src_segmentnr	src_original	tgt_segmentnr	tgt_original
K01prmosu_u:431	 bhavati na ca punar bhagavān evaṃ vaded anekaparyāyeṇa bhagavatā antarāyikā dharmāḥ	K01D0003-3_H0003-3:324b-6	དགེ་ཚུལ་ཞིག་ཀྱང་འདི་སྐད་ཅེས་ཇི་ལྟར་བཅོམ་ལྡན་འདས་ཀྱིས་འདོད་པ་དག་ནི་བར་དུ་གཅོད་པའོ་ཞེས་གསུངས་པ་གང་དག་ཡིན་པ་དེ་དག་བསྟེན་ཀྱང་བར་དུ་གཅོད་པར་མི་འགྱུར་ཏེ་།
K01prmosu_u:433	 tvam āyuṣmann idam evaṃrūpaṃ pāpakaṃ dṛṣṭigatam  eva(ṃ) ce(t sa) bhikṣur bhikṣubhir ucyamānas tad vastu pratiniḥsṛjed ity evaṃ kuśalaṃ na cet pratiniḥsṛjed dvir api trir api samanuśāsitavyas tasya vastunaḥ pratiniḥsargāya (dv)  ir api trir api samanuśiṣyamāṇas tad vastu pratiniḥsṛjed ity evaṃ kuśalaṃ no cet pratiniḥsṛjet pātayantikā 55  yaḥ punar bhikṣur jānaṃs tathāvādinaṃ pudgalam akṛtānudharmāṇam apratiniḥsṛṣṭena	K01D0003-3_H0003-3:324b-7	དེ་ལྟར་བཅོམ་ལྡན་འདས་ཀྱིས་ཆོས་བསྟན་པ་བདག་གིས་ཤེས་སོ་ཞེས་ཟེར་ན་དགེ་ཚུལ་དེ་ལ་དགེ་སློང་རྣམས་ཀྱིས་འདི་སྐད་ཅེས་དགེ་ཚུལ་ཁྱོད་ཇི་ལྟར་བཅོམ་ལྡན་འདས་ཀྱིས་འདོད་པ་དག་ནི་བར་དུ་གཅོད་པའོ་ཞེས་གསུངས་པ་གང་དག་ཡིན་པ
K01prmosu_u:438	 śramaṇoddeśaś ced evaṃ vadet tathāhaṃ bhagavato dharmaṃ deśitam ājānāmi yat kāmāṃ pratiṣevato nālam antarāyāyeti /  sa śramaṇoddeśo bhikṣubhir evaṃ syād vacanīyo mā tvam āyuṣmaṃ śramaṇoddeśa evaṃ vada tathāhaṃ bhagavato dharmaṃ deśitam ājānāmi yat kāmāṃ pratiṣevato nālam antarāyāyeti	K01D0003-3_H0003-3:324b-9	དེ་ལྟར་བཅོམ་ལྡན་འདས་ཀྱིས་ཆོས་བསྟན་པ་བདག་གིས་ཤེས་སོ་ཞེས་དེ་སྐད་ཅེས་མ་ཟེར་ཅིག་།
K01prmosu_u:440	 mā bhagavantaṃ vivada mā bhagavantam abhyākhyāhi na sādhu bhagavato 'bhyākhyānaṃ	K01D0003-3_H0003-3:324b-10	བཅོམ་ལྡན་འདས་ལ་སྐུར་པ་མ་འདེབས་ཤིག་། བཅོམ་ལྡན་འདས་ལ་སྐུར་བས་ལེགས་པར་མི་འགྱུར་རོ་༎ བཅོམ་ལྡན་འདས་ནི་དེ་སྐད་མི་གསུང་ངོ་༎
K01prmosu_u:441	 bhavati na ca punar bhagavān evaṃ vaded anekaparyāyeṇa bhagavatā antarāyikāḥ kāmāḥ  samānā antarāyikā ity uktās tāṃś ca pratiṣevato 'lam antarāyāyeti niḥsṛja tvaṃ śramaṇoddeśa	K01D0003-3_H0003-3:325a-0	ཚེ་དང་ལྡན་པ་དགེ་ཚུལ་འདོད་པ་བར་དུ་གཅོད་པ་༄༣༢༥ཨ་༌༎ རྣམས་ནི་བར་དུ་གཅོད་པ་ཉིད་དོ་ཞེས་བཅོམ་ལྡན་འདས་ཀྱིས་རྣམ་གྲངས་དུ་མར་གསུངས་ཏེ་དེ་དག་བསྟེན་ན་བར་དུ་གཅོད་པར་འགྱུར་གྱི་།
K01prmosu_u:443	 idam evaṃrūpaṃ pāpakaṃ dṛṣṭigatam	K01D0003-3_H0003-3:325a-2	དགེ་ཚུལ་ཁྱོད་སྡིག་པ་ཅན་གྱི་ལྟ་བའི་རྣམ་པ་འདི་ལྟ་བུ་འདི་ཐོང་ཞིག་ཅེས་བསྒོ་བར་བྱའོ་༎
