src_segmentnr	src_original	tgt_segmentnr	tgt_original
K01vinv01_u:742	 bhikṣavaḥ purāṇo mārgaḥ purāṇaṃ vartma purāṇaṃ paṭumaṃ pūrvakair ṛṣibhir yātānuyātaṃ /	K01D0001_H0001:156b-1	དགེ་སློང་དག་འདི་ནི་སྔོན་གྱི་ལམ་དང་། སྔོན་གྱི་བགྲོད་པ་དང་། སྔོན་གྱི་ལམ་སྲོལ་། སྔོན་གྱི་དྲང་སྲོང་རྣམས་གཤེགས་ཤིང་རྗེས་སུ་འདོང་བ་ཡིན་ནོ་༎
K01vinv01_u:75	 vedādhyayanaṃ kariṣye /	K01D0001_H0001:10a-9	བྲམ་ཟེའི་ཁྱེའུ་དེས་བྲམ་ཟེ་དེའི་དྲུང་དུ་རིག་བྱེད་བཀླག་པ་བྱ་བར་བརྩམས་སོ་༎
K01vinv01_u:743	 so 'haṃ tam anugatavān* so 'haṃ tam anugacchaṃ jarāmaraṇam adrākṣaṃ jarāmaraṇasamudayaṃ jarāmaraṇanirodhaṃ jarāmaraṇanirodhagāminīṃ ca pratipadam adrākṣaṃ /  (Pravr-v III 261)	K01D0001_H0001:156b-3	ངས་དེར་སོན་ཅིང་དེར་སོན་པ་ན་། རྒ་ཤི་མཐོང་ཞིང་རྒ་ཤི་ཀུན་འབྱུང་བ་དང་། རྒ་ཤི་འགོག་པ་དང་། རྒ་ཤི་འགོག་པར་འགྲོ་བའི་ལམ་མཐོང་ངོ་༎
K01vinv01_u:745	 jātiṃ bhavam upādānaṃ tṛṣṇāṃ vedanāṃ sparśaṃ ṣaḍāyatanaṃ nāmarūpaṃ vijñānaṃ saṃskārān adrākṣaṃ saṃskārasamudayaṃ saṃskāranirodhaṃ saṃskāranirodhagāminīṃ pratipadam adrākṣaṃ /	K01D0001_H0001:156b-5	སྐྱེ་བ་དང་། སྲིད་པ་དང་། ལེན་པ་དང་། སྲེད་པ་དང་། ཚོར་བ་དང་། རེག་པ་དང་། སྐྱེ་མཆེད་དྲུག་དང་། མིང་དང་གཟུགས་དང་། རྣམ་པར་ཤེས་པ་དང་། འདུ་བྱེད་རྣམས་མཐོང་ཞིང་། འདུ་བྱེད་རྣམས་ཀུན་འབྱུང་བ་དང་། འདུ་བྱེད་རྣམས་འགོག་པ་དང་། འདུ་བྱེད་རྣམས་འགོག་པར་འགྲོ་བའི་ལམ་མཐོང་སྟེ་།
K01vinv01_u:746	 so 'ham imān dharmāṃ svayam abhijñayābhisaṃbuddhya bhikṣūṇām ārocayāmi bhikṣuṇīnām upāsakānām upāsikānām anyeṣāṃ ca śramaṇabrāhmaṇacarakaparivrājakānām*	K01D0001_H0001:156b-7	ངས་རང་གི་མངོན་པར་ཤེས་པས་མངོན་པར་རྫོགས་པར་བྱང་ཆུབ་ནས་། དགེ་སློང་རྣམས་དང་། དགེ་སློང་མ་རྣམས་དང་། དགེ་བསྙེན་རྣམས་དང་། དགེ་བསྙེན་མ་རྣམས་དང་། གཞན་ཡང་མུ་སྟེགས་ཅན་དང་། དགེ་སྦྱོང་དང་། བྲམ་ཟེ་དང་། སྤྱོད་པ་ཅན་དང་། ཀུན་ཏུ་རྒྱུ་སྣ་ཚོགས་དག་ལ་བརྗོད་དོ་༎
K01vinv01_u:747	 tatra bhikṣur api samyakpratipadyamāna ārādhako bhavaty ārādhayati nyāyyaṃ dharmaṃ kuśalaṃ /	K01D0001_H0001:156b-9	དེ་ལ་དགེ་སློང་གིས་ཀྱང་ཡང་དག་པར་སྒྲུབ་པ་ན་སྒྲུབ་པར་བྱེད་པ་ཡིན་ཞིང་རིགས་པ་དང་ལྡན་པ་། ཆོས་དང་ལྡན་པ་།
K01vinv01_u:748	 bhikṣuṇyupāsakopāsikās samyakpratipadyamānā ārādhikā bhavaṃty ārādhayanti nyāyyaṃ dharmaṃ kuśalaṃ /	K01D0001_H0001:156b-11	དགེ་བ་སྒྲུབ་པར་བྱེད་དོ་༎ དགེ་སློང་མ་དང་། དགེ་བསྙེན་དང་། དགེ་བསྙེན་མས་ཀྱང་ཡང་དག་པར་སྒྲུབ་པ་ན༏་སྒྲུབ་པར་བྱེད་པ་ཡིན་ཞིང་། རིགས་པ་དང་ལྡན་པ་། ཆོས་དང་ལྡན་པ་། དགེ་བ་སྒྲུབ་པར་བྱེད་དེ་།
K01vinv01_u:749	 evam idaṃ brahmacaryaṃ vaistārikaṃ bāhujanyaṃ pṛthubhūtaṃ yāvad devamanuṣyebhyas samyaksuprakāśitaṃ /	K01D0001_H0001:156b-16	དེ་ལྟ་ན་ཚངས་པར་སྤྱོད་པ་འདི་ནི་རྒྱ་ཆེ་བ་། སྐྱེ་བོ་མང་པོ་ལ་ཕན་པ་། ཡང་དག་པར་༄༡༥༧ཨ་༌༎ གྱུར་པ་། ལྷ་དང་མིའི་བར་དག་ལ་ཡང་དག་པར་རབ་ཏུ་བསྟན་པ་ཡིན་ནོ་ཞེས་སྟོན་ཅིང་།
K01vinv01_u:750	 tato 'vasāne pariṇāmitaṃ /	K01D0001_H0001:157a-2	དེ་ནས་མཇུག་ཏུ་།
K01vinv01_u:751	 yānīha bhūtāni samāgatāni sthitāni bhūmāv athavāntarikṣe /	K01D0001_H0001:157a-3	འབྱུང་པོ་གང་དག་འདིར་ནི་ལྷགས་གྱུར་ཅིང་། ས་འམ་འོན་ཏེ་བར་སྣང་འཁོད་པ་དག་།
K01vinv01_u:752	 kurvantu maitrīṃ satataṃ prajāsu divā ca rātrau ca carantu dharmam iti //	K01D0001_H0001:157a-5	སྐྱེ་དགུ་རྣམས་ལ་རྟག་ཏུ་བྱམས་བྱེད་ཅིང་༎ ཉིན་དང་མཚན་དུ་ཆོས་ཀྱང་སྤྱོད་གྱུར་ཅིག་།
K01vinv01_u:753	 sarvais taiḥ sahasatyābhisamayād anāgāmiphalaṃ prāptaṃ /	K01D0001_H0001:157a-7	ཅེས་ཡོངས་སུ་བསྔོས་པ་དང་། དེ་དག་ཐམས་ཅད་ཀྱིས་བདེན་པ་མངོན་པར་རྟོགས་མ་ཐག་ཏུ་ཕྱིར་མི་འོང་བའི་འབྲས་བུ་ཐོབ་སྟེ་།
K01vinv01_u:754	 riddhiś cābhinirhṛtā /	K01D0001_H0001:157a-8	རྫུ་འཕྲུལ་ཡང་མངོན་པར་བསྒྲུབས་སོ་༎
K01vinv01_u:755	 subhāṣitaṃ subhāṣitam iti sarvair nādo muktaḥ tatas tayā devatayā riddhyabhisaṃskārāḥ pratiprasrabdhāḥ parasparaṃ draṣṭum ārabdhāḥ te 'nyonyaṃ kathayanti /	K01D0001_H0001:157a-9	དེ་ནས་དེ་དག་ཐམས་ཅད་ཀྱིས་བཙུན་པ་དགེ་འདུན་འཚོ་ལེགས་པར་གསུངས་སོ་༎ ལེགས་པར་གསུངས་སོ་༎ དེ་ནས་ལྷ་མོ་དེས་རྫུ་འཕྲུལ་མངོན་པར་འདུ་བྱ་བ་དེ་བརྟུལ་བ་དང་། གཅིག་གིས་གཅིག་མཐོང་བར་གྱུར་ཏོ༏་༏དེ་དག་གིས་གཅིག་གིས་གཅིག་མཐོང་ནས་སྨྲས་པ་།
K01vinv01_u:756	 bhos tvam ihāgatas tvam apy āgataḥ (46v = GBM 6.693)  āgato 'haṃ śobhanaṃ iti /	K01D0001_H0001:157a-13	ཀྱེ་ཁྱོད་ཀྱང་འོངས་སམ་། ཁོ་བོས་འོངས་སོ་༎
K01vinv01_u:758	 te labdhodayā labdhasaṃbhārāḥ kathayanti labhemahi vayaṃ bhadanta svākhyāte dharmavinaye pravrajyām upasaṃpadaṃ bhikṣubhāvaṃ carema vayaṃ bhagavato 'ntike brahmacaryam iti /	K01D0001_H0001:157a-16	ལེགས་སོ་༎ དེ་དག་གིས་འབྱོར་པ་རྙེད་ཅིང་རྙེད་པ་རྙེད་ནས་སྨྲས་པ༏་བཙུན་པ་དགེ་འདུན་འཚོ་བདག་ཅག་ལེགས་པར་གསུངས་པའི་ཆོས་འདུལ་བ་ལ་རབ་ཏུ་འབྱུང་བ་དང་། བསྙེན་པར་རྫོགས་པ་དགེ་སློང་གི་དངོས་པོ་གནང་ན་། བདག་ཅག་བཅོམ་ལྡན་འདས་ཀྱི་སྤྱན་སྔར་ཚངས་པར་སྤྱོད་པ་སྤྱད་པར་བགྱིའོ་༎
K01vinv01_u:759	 sa smitapūrvaṃgamaḥ kathayati sādhu sādhv āyuṣmanta udāro va unmadgu kalyāṇaṃ pratibhānam	K01D0001_H0001:157a-18	དེས་འཛུམ་པ་སྔོན་དུ་བཏང་སྟེ་སྨྲས་པ་། ཚེ་དང་ལྡན་པ་དག་ཁྱོད་སྤོབས་པ་རྒྱ་ཆེན་པོ་ཞུམ་པ་མེད་པ་དགེ་བ་དང་ལྡན་པ་ལེགས་སོ་༄༡༥༧བ་ལེགས་སོ་༎
K01vinv01_u:760	 uktaṃ ca bhagavatā paṃcānuśaṃsāṃ saṃpaśyatā paṇḍitena alam eva pravrajyādhimuktena bhavituṃ /	K01D0001_H0001:157b-1	བཅོམ་ལྡན་འདས་ཀྱིས་ཀྱང་ཕན་ཡོན་ལྔ་ཡང་དག་པར་རྗེས་སུ་མཐོང་བའི་མཁས་པས་རབ་ཏུ་འབྱུང་བ་ལ་མོས་པར་བྱ་བ་ཁོ་ནར་རིགས་ཏེ་།
K01vinv01_u:761	 katamān paṃca /	K01D0001_H0001:157b-2	ལྔ་གང་ཞེ་ན་།
K01vinv01_u:762	 āveṇiko me svārtho 'nuprāpto bhaviṣyatīti saṃpaśyatā paṇḍitena alam eva pravrajyādhimuktena bhavituṃ /	K01D0001_H0001:157b-3	བདག་གིས་རང་གི་དོན་མ་འདྲེས་པ་རྗེས་སུ་ཐོབ་པར་འགྱུར་རོ་ཞེས་བྱ་བར་ཡང་དག་པར་རྗེས་སུ་མཐོང་བའི་མཁས་པས་རབ་ཏུ་འབྱུང་བ་ལ་མོས་པར་བྱ་བ་ཁོ་ནར་རིགས་པ་དང་། བདག་གང་དག་གི་བྲན་དང་། མངག་གཞུག་པ་དང་།
K01vinv01_u:78	 3r9 (Pravr-v II): /// kadācin nagarāvalokakāḥ kadācit samidhāhārakāḥ yāvad apareṇa	K01D0001_H0001:10a-12	ལན་འགའ་ནི་ཆུ་ངོགས་སུ་ཉེ་རེག་བྱེད་དུ་འདོང་ངོ་༎ ལན་འགའ་ནི་གྲོང་ཁྱེར་ལྟར་འདོང་ངོ་༎ ལན་འགའ་ནི་ཡམ་སྲེག་ཤིང་ཐུར་འདོང་ངོ་༎ ཇི་ཙམ་དུས་གཞན་ཞིག་ན་དེ་དག་མི་ཀློག་པར་གྱུར་ནས་།
K01vinv01_u:763	 yeṣām ahaṃ dāsaḥ preṣyo nirdeśyo bhujiṣyo nayenakāmaṃgamas teṣāṃ pūjyaś ca bhaviṣyāmi praśaṃsyaś ceti saṃpaśyatā paṇḍitena alam eva pravrajyādhimuktena bhavituṃ /	K01D0001_H0001:157b-4	བསྒོ་བ་དང་། རང་དབང་མེད་པ་དང་། དགའ་མགུར་འགྲོར་མེད་པ་ཡིན་པ་དེ་དག་གིས་མཆོད་པར་བྱ་བ་དང་། བསྟོད་པར་བྱ་བར་འགྱུར་རོ་ཞེས་བྱ་བར་ཡང་དག་པར་རྗེས་སུ་མཐོང་བའི་མཁས་པས་རབ་ཏུ་འབྱུང་བ་ལ་མོས་པར་བྱ་བ་ཁོ་ནར་རིགས་པ་དང་།
K01vinv01_u:764	 anuttaraṃ vā yogakṣemaṃ nirvāṇam anuprāpsyāmīti saṃpaśyatā paṇḍitena alam eva pravrajyādhimuktena bhavituṃ /  anuttaraṃ vā yogakṣemaṃ nirvāṇam anuprāpnuvanta āpannakasya me sato deveṣūpapattir bhaviṣyatīti saṃpaśyatā paṇḍitena alam eva pravrajyādhimuktena bhavituṃ /	K01D0001_H0001:157b-5	གྲུབ་པ་དང་། བདེ་བའི་བླ་ན་མེད་པའི་མྱ་ངན་ལས་འདས་པ་ཐོབ་པར་འགྱུར་རོ་ཞེས་བྱ་བར་ཡང་དག་པར་རྗེས་སུ་མཐོང་བའི་མཁས་པས་རབ་ཏུ་འབྱུང་བ་ལ་མོས་པར་བྱ་བ་ཁོ་ནར་རིགས་པ་དང་། གྲུབ་པ་དང་། བདེ་བ་བླ་ན་མེད་པའི་མྱ་ངན་ལས་འདས་པ་ཐོབ་པ་ལས་ཉམས་ན་ཡང་ལྷ་རྣམས་ཀྱི་ནང་དུ་སྐྱེ་བར་འགྱུར་རོ་ཞེས་བྱ་བར་ཡང་དག་པར་རྗེས་སུ་མཐོང་བའི་མཁས་པས་རབ་ཏུ་འབྱུང་བ་ལ་མོས་པར་བྱ་བ་ཁོ་ནར་རིགས་པ
K01vinv01_u:766	 anekaparyāyeṇa pravrajyā varṇitā buddhaiś ca buddhaśrāvakaiś ca sadbhiḥ (Pravr-v III 262)	K01D0001_H0001:157b-7	དང་། རབ་ཏུ་བྱུང་བ་ནི་སངས་རྒྱས་རྣམས་དང་། སངས་རྒྱས་ཀྱི་ཉན་ཐོས་དམ་པ་ཡང་དག་པར་སོང་བ༏་ཡང་དག་པར་ཞུགས་པ་། སྐྱེས་བུ་དམ་པ་རྣམས་ཀྱི་རྣམ་གྲངས་དུ་མས་བསྔགས་སོ་༎
K01vinv01_u:767	 samyaggatais satpuruṣair iti saṃpaśyatā paṇḍitena alam eva pravrajyādhimuktena bhavituṃ /	K01D0001_H0001:158a-0	ཞེས་བྱ་བར་ཡང་དག་པར་རྗེས་སུ་མཐོང་བའི་མཁས་པས་རབ་ཏུ་བྱུང་བ་ལ་མོས་པར་བྱ་བ་ཁོ་ནར་རིགས་༄༡༥༨ཨ་༌༎ སོ་ཞེས་གསུངས་ཀྱིས་རབ་ཏུ་བྱུང་ཞིག་།
K01vinv01_u:768	 tat kiṃ bhagavato 'ntike pravrajatha āhosvin mameti /	K01D0001_H0001:158a-2	དེའི་ཕྱིར་ཅི་བཅོམ་ལྡན་འདས་ཀྱི་སྤྱན་སྔར་རབ་ཏུ་འབྱུང་ངམ་། འོན་ཏེ་ཁོ་བོ་ལས་།
K01vinv01_u:769	 te kathayanti /	K01D0001_H0001:158a-4	དེ་དག་གིས་སྨྲས་པ་།
K01vinv01_u:770	 bhagavataḥ āyuṣmān saṃgharakṣitaḥ kathayati /	K01D0001_H0001:158a-5	བཅོམ་ལྡན་འདས་ཀྱིས་སྤྱན་སྔར་རོ་༎ ཚེ་དང་ལྡན་པ་དགེ་འདུན་འཚོས་སྨྲས་པ་།
K01vinv01_u:771	 yady evam āgacchata bhagavatsakāśaṃ gacchāmaḥ te kathayanti bhadanta saṃgharakṣita kim asmadīyayā riddhyā gacchāmaḥ āhosvit tvadīyayeti /	K01D0001_H0001:158a-7	གལ་ཏེ་དེ་ལྟ་ན་ཚུར་ཤོག་། བཅོམ་ལྡན་འདས་ཀྱི་སྤྱན་སྔར་འདོང་ངོ་༎ དེ་དག་གིས་སྨྲས་པ་། བཙུན་པ་དགེ་འདུན་འཚོ་ཅི་བདག་ཅག་གི་རྫུ་འཕྲུལ་གྱིས་བཞུད་དམ་། འོན་ཏེ་ཁྱོད་ཀྱི་རྫུ་འཕྲུལ་གྱིས་།
K01vinv01_u:81	 tatraike kathayanti vayaṃ pūrvadeśād ity apare vayaṃ dakṣiṇāpathād ity apare kathayanti vayaṃ pāścātyā ity apare kathayanti + + +	K01D0001_H0001:10a-21	ལྔ་པའི་བུ་དག་། ཉེ་ལྔ་པའི་བུ་དག་། ཇེ་ཁྱེད་ཅག་ལས་གང་ནི་ཡུལ་གང་ལས་འོངས་པ་དྲི་བར་བྱའོ་༎ དེ་ན་བྲམ་ཟེའི་ཁྱེའུ་གཅིག་གིས་སྨྲས་པ་། ཁོ་བོ་ནི་ཡུལ་ཤར་ནས་སོ་༎ གཞན་ཞིག་གིས་སྨྲས་པ་།
K01vinv01_u:80	 3r10 (Pravr-v II): /// bhāradvājāḥ paṃcakāḥ upapaṃcakāḥ ko vaḥ kasmād deśād iti /	K01D0001_H0001:10a-16	དེའི་ཚེ་དེ་དག་ཡམ་སྲེག་ཤིང་ཐུར་དོང་པ་དང་། དེ་དག་ལ་ལམ་གྱི་བར་དུ་བར་སྐབས་ཀྱི་གཏམ་བརྗོད་པ་འདི་ལྟ་བུ་འདི་བྱུང་སྟེ་། ཀྱེ་ཀུད་སའི་བུ་དག་། བད་སའི་བུ་དག་། ཤ་ནད་ལའི་བུ་དག་། བ་ར་དབ༹་ཙའི་བུ་དག་།
K01vinv01_u:772	 śrutvā āyuṣmān saṃgharakṣito vyathitaḥ sa saṃlakṣayaty ebhir madīyenānubhāvenaivaṃvidhā	K01D0001_H0001:158a-12	ཚེ་དང་ལྡན་པ་དགེ་འདུན་འཚོས་ཐོས་ནས་ཉམ་ང་བར་གྱུར་ཏེ་། དེས་བསམས་པ་།
K01vinv01_u:773	 guṇagaṇā adhigatāḥ ahaṃ nāma kolopamaḥ saṃvṛttaḥ sa hīnadīnavadanaḥ kathayati tiṣṭhantu	K01D0001_H0001:158a-14	བདག་གི་མཐུས་འདི་དག་གིས་ཡོན་ཏན་གྱི་ཚོགས་འདི་ལྟ་བུ་ཐོབ་ན་། བདག་ནི་གཟིངས་ལྟ་བུར་གྱུར་བ་ལྟ་སྙམ་ནས་།
K01vinv01_u:774	 tāvad āyuṣmanto muhūrtaṃ me kiṃcit karaṇīyam astīti so 'nyatarad vṛkṣamūlam upaniśṛtya	K01D0001_H0001:158a-16	དེ་བཞིན་ཉམས་ཤིང་གྱུར་ཏེ་སྨྲས་པ་། ཚེ་དང་ལྡན་པ་དག་ཁོ་བོ་ལ་བྱ་བ་ཅུང་ཞིག་ཡོད་ཀྱིས་རེ་ཞིག་ཡུད་ཙམ་ཞིག་སྡོད་ཅིག་ཅེས་དེ་ཤིང་ལྗོན་པ་ཞིག་གི་དྲུང་དུ་བརྟེན་ནས་སྐྱིལ་མོ་ཀྲུང་བཅས་ཏེ་།
K01vinv01_u:775	 niṣaṇṇaḥ paryaṅkam ābhujya ṛjuṃ kāyaṃ praṇidhāya pratimukhāṃ smṛtim upasthāpya /  uktaṃ hi bhagavatā /  paṃcānuśaṃsā bāhuśrutye katame paṃca /	K01D0001_H0001:158a-18	ལུས་དྲང་པོར་བསྲངས་ནས་། དྲན་པ་ཕྱོགས་པར་བཞག་སྟེ་འདུག་གོ་༏བཅོམ་ལྡན་འདས་ཀྱིས་མང་དུ་ཐོས་པ་ལ་ཕན་ཡོན་ལྔ་ཡོད་དེ་། ལྔ་གང་ཞེ་ན་།
K01vinv01_u:778	 dhātukuśalo bhavaty āyatanakuśalaḥ pratītyasamutpādakuśalaḥ sthānāsthānakuśalaḥ aparapratibaddhā cāsyāvavādānuśāsanī bhavatīti /	K01D0001_H0001:158a-21	ཕུང་པོ་ལ་མཁས་པ་དང་། ཁམས་ལ་མཁས་པ་དང་། སྐྱེ་མཆེད་ལ་མཁས་པ་དང་། རྟེན་ཅིང་འབྲེལ་པར་འབྱུང་བ་ལ་མཁས་པ་དང་། དེའི་གདམས་ངག་དང་རྗེས་སུ་བསྟན་པ་། གཞན་ལ་རག་མ་ལས་པ་ཡིན་ནོ་ཞེས་གསུངས་པས་།
K01vinv01_u:779	 tenodyacchamānena ghaṭamānena vyāyacchamānena sarvakleśaprahāṇād arhatvaṃ sākṣātkṛtam  arhaṃ saṃvṛttaḥ traidhātukavītarāgaḥ samaloṣṭakāñcanaḥ ākāśapāṇitalasamacitto vāsīcandanakalpo	K01D0001_H0001:158a-23	དེས་བརྩོན་འགྲུས་བརྩམས་པས་། འཁོར་༄༡༥༨བ་བའི་འཁོར་ལོ་ཆ་ལྔ་བ་ག-ཡོ་བ་དང་མི་ག-ཡོ་བ་འདི་ཉིད་རིག་སྟེ་། འདུ་བྱེད་ཀྱི་རྣམ་པ་ཐམས་ཅད་ཉམས་པ་དང་། ལྟུང་བ་དང་། རྣམ་པར་འཐོར་བ་དང་། རྣམ་པར་འཇིག་པའི་ཆོས་ཉིད་ཀྱིས་ཟིལ་གྱིས་མནན་ནས་ཉོན་མོངས་པ་ཐམས་ཅད་སྤངས་པས་།
K01vinv01_u:783	 tena te 'bhihitā gṛhṇantu bhavanto madīyaṃ cīvarakarṇakaṃ māmikayā riddhyā gacchāma iti /	K01D0001_H0001:158b-14	རིག་པ་དང་མངོན་པར་ཤེས་པ་དང་། སོ་སོ་ཡང་དག་པར་རིག་པ་ཐོབ་པ་། སྲིད་པ་དང་། འདོད་པའི་རྙེད་པ་དང་། བཀུར་སྟི་ལ་རྒྱབ་ཀྱིས་ཕྱོགས་པ་། དབང་པོ་དང་ཉེ་དབང་དང་བཅས་པའི་ལྷ་རྣམས་ཀྱིས་མཆོད་པར་བྱ་བ་དང་། རྗེད་པར་བྱ་བ་དང་། མངོན་དུ་སྨྲ་པར་བྱ་བར་གྱུར་ཏོ་༎ ཤེས་ལྡན་དག་ཁོ་བོའི་ཆོས་གོས་ཀྱི་གརབ༹་ནས་ཟུང་ཞིག་དང་། ཁོ་བོའི་རྫུ་འཕྲུལ་གྱིས་འདོང་བར་བྱའོ་༎ དེ་དག་དེའི་ཆོས་གོས་ཀྱི་གརབ༹་ནས་འཇུས་༄༡༥༩ཨ་༌༎
K01vinv01_u:784	 te tasya cīvarakarṇake lagnāḥ tata āyuṣmān saṃgharakṣito vitatapakṣa iva haṃsarāja riddhyā upari vihāyasā prakrāntaḥ	K01D0001_H0001:159a-1	པ་དང་། དེ་ནས་ཚེ་དང་ལྡན་པ་དགེ་འདུན་འཚོས་ངང་པའི་རྒྱལ་པོ་འདབ་མ་བརྐྱང་བ་ལྟར་རྫུ་འཕྲུལ་གྱིས་སྟེང་གི་ནམ་མཁའ་ལ་སོང་ངོ་༎
K01vinv01_u:785	 yāvat tāni paṃca vaṇikchatāni bhāṇḍaṃ pratiśāmayanti sa tair dṛṣṭas te kathayanti ārya saṃgharakṣita svāgatam* /	K01D0001_H0001:159a-2	ཇི་ཙམ་ན་ཚོང་པ་ལྔ་བརྒྱ་པོ་དེ་དག་རྫས་འཁོས་སུ་འབེབས་པར་བྱེད་པ་ན་། དེ་དག་གིས་དེ་མཐོང་ནས་། དེ་དག་གིས་སྨྲས་པ་། འཕགས་པ་དགེ་འདུན་འཚོ་ཁྱོད་བྱོན་ཏམ་། བྱོན་པ་ལེགས་སོ་༎
K01vinv01_u:786	 āgatas tvam āgato 'ham* (47r = GBM 6.694)	K01D0001_H0001:159a-7	ཁོ་བོ་འོངས་སོ་། གང་དུ་བཞུད་། དེས་སྨྲས་པ་།
K01vinv01_u:787	 kutra gacchasi sa kathayati bhagavatsakāśam imāni paṃca kulaputraśatāny ākāṃkṣanti svākhyāte dharmavinaye pravrajyām upasaṃpadaṃ bhikṣubhāvam iti /	K01D0001_H0001:159a-10	རིགས་ཀྱི་བུ་ལྔ་བརྒྱ་པོ་དེ་དག་བཅོམ་ལྡན་འདས་ཀྱི་སྤྱན་སྔར་ལེགས་པར་གསུངས་པའི་ཆོས་འདུལ་བ་ལ་རབ་ཏུ་འབྱུང་བ་དང་། བསྙེན་པར་རྫོགས་པ་དགེ་སློང་གི་དངོས་པོ་འདོད་པས་། བཅོམ་ལྡན་འདས་ཀྱི་སྤྱན་སྔར་འགྲོའོ་༎ དེ་དག་གིས་སྨྲས་པ་། འཕགས་པ་དགེ་འདུན་འཚོ་བདག་ཅག་ཀྱང་རབ་ཏུ་འབྱུང་གིས་།
K01vinv01_u:788	 te kathayanty ārya saṃgharakṣita vayam api pravrajiṣyāmaḥ avatarasva tāvad yāvad bhāṇḍaṃ pratiśāmayāma iti /	K01D0001_H0001:159a-14	བོབས་ལ་བདག་ཅག་རྫས་འཁོས་སུ་འབེབས་ཀྱི་བར་དུ་རེ་ཞིག་གཞེས་སུ་གསོལ་། ཚེ་དང་ལྡན་པ་དགེ་འདུན་འཚོས་བབས་པ་དང་། དེ་དག་གིས་རྫས་འཁོས་སུ་ཕབ་བོ་༎
K01vinv01_u:8	 2r5 (Pravr-v II): /// biṃbisāraḥ kumāro hastiskandhābhirūḍho janapadān nirgacchati	K01D0001_H0001:7a-0	དེ་དག་འོངས་༄༧ཨ་༌༎ ནས་ཕྱིར་ལྡོག་པ་གཞོན་ནུ་གཟུགས་ཅན་སྙིང་པོས་མཐོང་ནས་སྨྲས་པ་།
K01vinv01_u:77	 sa tasyāntike vedādhyayanaṃ kartum ārabdhaḥ ācaritaṃ teṣāṃ + + +	K01D0001_H0001:14a-18	བྲམ་ཟེའི་ཁྱེའུ་དེས་། བྲམ་ཟེ་སྐར་རྒྱལ་གྱི་དྲུང་དུ་འཇིག་རྟེན་རྒྱང་པན་གཟུང་བར་བརྩམས་སོ་༎ བྲམ་ཟེའི་ཁྱེའུ་རྣམས་ཀྱིས་ཀུན་ཏུ་སྤྱོད་པ་ནི་འདི་ཡིན་ཏེ་། གང་གི་ཚེ་མི་ཀློག་པར་གྱུར་པ་དེའི་ཚེ་ན་།
