src_segmentnr	src_original	tgt_segmentnr	tgt_original
K01vinv171u:5874	 Conversion of the Tīrthyas  te dṛṣṭasatyāḥ kathayanti:	K01D0006-2_H0006-2:197b-16	དེ་བདེན་པ་མཐོང་ནས་སྟན་ལས་ལངས་ཏེ་། བཅོམ་ལྡན་འདས་ལ་འདི་སྐད་ཅེས་གསོལ་ཏོ་༎
K01vinv171u:5876	 labhemahi vayaṃ śāriputra svākhyāte dharmavinaye pravrajyām upasaṃpadaṃ bhikṣubhāvam;	K01D0006-2_H0006-2:197b-19	བཙུན་པ་ལེགས་པར་བཤད་པའི་ཆོས་འདུལ་བ་ལ་རབ་ཏུ་བྱུང་ཞིང་། བསྙེན་༄༡༩༨ཨ་༌༎ པར་རྫོགས་ཏེ་། དགེ་སློང་མའི་དངོས་པོར་འགྱུར་ཞིང་།
K01vinv171u:5877	 carema vayaṃ bhadantaśāriputrasyāntike brahmacaryam iti;	K01D0006-2_H0006-2:198a-2	བཅོམ་ལྡན་འདས་ཀྱི་དྲུང་དུ་བདག་ཚངས་པར་སྤྱད་པ་སྤྱོད་དུ་གནང་ངམ་།
K01vinv171u:5878	 te āyuṣmatā śāriputreṇa pravrājitā upasaṃpāditāḥ;  avavādo dattaḥ;  tair yujyamānair,  ghaṭamānair,	K01D0006-2_H0006-2:198a-3	བཅོམ་ལྡན་འདས་ཀྱིས་སྐྱེ་དགུའི་བདག་མོ་ཆེན་མོ་ལ་གཏད་ནས་དེས་རབ་ཏུ་ཕྱུང་སྟེ་། བསྙེན་པར་རྫོགས་པར་བྱས་ནས་། འདུལ་བ་ལ་བསླབས་ཏེ་ལུང་བསྒོ་བ་བྱིན་ནས་། དེ་བརྩོན་པར་བྱས་། ནན་ཏན་ཏུ་བྱས་།
K01vinv171u:5882	 vyāyacchamānair idam eva pañcagaṇḍakaṃ saṃsāracakraṃ calācalaṃ viditvā sarvasaṃskāragatīḥ	K01D0006-2_H0006-2:198a-8	བསྒྲུབ་པར་བྱས་པས་ན་འཁོར་བའི་འཁོར་ལོ་འདི་ག-ཡོ་བ་དང་། མི་ག-ཡོ་བར་ཤེས་ཏེ་། འདུས་བྱས་ཀྱི་རྒྱུད་ཐམས་ཅད་ཞིག་པ་དང་། ལྟུང་པ་དང་། རྣམ་པར་གྱེས་པ་།
K01vinv171u:5884	 sākṣātkṛtam ity arhantaḥ saṃvṛttāḥ;	K01D0006-2_H0006-2:198a-12	དགྲ་བཅོམ་པར་གྱུར་ཏོ་༎
K01vinv171u:5885	 traidhātukavītarāgāḥ samaloṣṭakāñcanā ākāśapāṇitalasamacittā vāsīcandanakalpā vidyāvidāritāṇḍakośā	K01D0006-2_H0006-2:198a-13	ཁམས་གསུམ་གྱི་འདོད་ཆགས་དང་བྲལ་བ་། བོང་བ་དང་གསེར་དུ་འདྲ་བ་། ནམ་མཁའ་དང་ལག་མཐིལ་ལྟར་ཆགས་པ་མེད་པ་བཞིན་དུ་སེམས་མཉམ་པ་སྟེ་།
K01vinv171u:5886	 vidyābhijñāpratisaṃvitprāptā bhavalābhalobhasatkāraparāṅmukhāḥ sendropendrāṇāṃ devānāṃ  pūjyā mānyā abhivādyāś ca saṃvṛttāḥ	K01D0006-2_H0006-2:198a-16	སྟེའུ་དང་ཙན་དན་དུ་འདྲ་བར་རིག་པས་སྒོ་ངའི་སྦུབས་བཅོམ་པ་།
