src_segmentnr	src_original	tgt_segmentnr	tgt_original
K01vinv171u:4355	 mama bhikṣava eṣu caturṣv āryasatyeṣv evaṃ triparivartaṃ dvādaśākāraṃ na cakṣur udapādi,  na jñānaṃ ( na)  vidyā na buddhir udapādi,  na tāvad aham asmād bhikṣavaḥ sadevakāl lokāt,  samārakāt,	T02n0110_001:0504a28_5	「汝等苾芻！ 若我於此四聖諦法未了三轉十二相者，眼智明覺皆不得生，我則不於諸天魔梵、沙門婆羅門一切世間，捨離煩惱心得解脫，不能證得無上菩提。
K01vinv171u:4363	 yataś ca mama bhikṣava eṣu caturṣv āryasatyeṣv evaṃ triparivartaṃ dvādaśākāraṃ cakṣur udapādi,  jñānaṃ vidyā buddhir udapādi,  tato 'ham asmāt sadevakāl lokāt samārakāt sabrahmakāt,  saśramaṇabrāhmaṇikāyāḥ prajāyāḥ sadevamānuṣāyā mukto nisṛto visaṃyukto vipramukto viparyāsāpagatena cetasā bahulaṃ vyāhārṣam;  bhikṣavaḥ anuttarāṃ samyaksaṃbodhim abhisaṃbuddho 'smīty adhyajñāsiṣaṃ	T02n0110_001:0504b06_8	由我於此四聖諦法解了三轉十二相故，眼智明覺皆悉得生，乃於諸天魔梵、沙門婆羅門一切世間，捨離煩惱心得解脫，便能證得無上菩提。
K01vinv171u:4368	 The name of Ājñātakauṇḍinya  asmin khalu dharmaparyāye bhāṣyamāṇe āyuṣmata ājñātākauṇḍinyasya virajo vigatamalaṃ dharmeṣu dharmacakṣur utpannam,  aśīteś ca devatāsahasrāṇām;	T02n0110_001:0504b08_10	」爾時世尊說是法時，具壽憍陳如及八萬諸天，遠塵離垢得法眼淨。
K01vinv171u:4371	 tatra bhagavān āyuṣmantaṃ kauṇḍinyam āmantrayate sma:	T02n0110_001:0504b08_16	佛告憍陳如：
K01vinv171u:4372	 ājñātas te kauṇḍinya dharmaḥ?	T02n0110_001:0504b09_2	「汝解此法不？ 」答言：
K01vinv171u:4373	 ājñātaḥ bhagavann ājñātaḥ;	T02n0110_001:0504b09_10	「已解。 世尊！
K01vinv171u:4374	 ājñātas te kauṇḍinya dharmaḥ?	T02n0110_001:0504b09_21	」「汝解此法不？
K01vinv171u:4394	 yāvad brahmalokaṃ śabdo 'gamat;  brahmakāyikā devāḥ śabdam udīrayanti;  ghoṣam anuśrāvayanti:	T02n0110_001:0504b13_1	是時地居藥叉聞佛說已，出大音聲，告人天曰：
K01vinv171u:4397	 etan mārṣā bhagavatā vārāṇasyaṃ ṛṣivadane mṛgadāve triparivartaṃ dvādaśākāraṃ dharmyaṃ  dharmacakraṃ pravartitam apravartyaṃ śramaṇena brāhmaṇena vā devena vā māreṇa vā  brahmaṇā vā kenacid vā punar loke sahadharmataḥ bahujanahitāya bahujanasukhāya lokānukampāyai  arthāya hitāya sukhāya devamanuṣyāṇām iti divyāḥ kāyā abhivardhiṣyante;  āsurāḥ kāyāḥ parihāsyanta iti;  pravartitaṃ bhagavatā vārāṇasyām ṛṣivadane mṛgadāve triparivartaṃ dvādaśākāraṃ dharmyaṃ dharmacakram iti;	T02n0110_001:0504b17_4	「仁等當知，佛在婆羅痆斯仙人墮處施鹿林中，廣說三轉十二行相法輪，由此能於天人魔梵、沙門婆羅門一切世間，為大饒益，令同梵行者速至安隱涅槃之處，人天增盛阿蘇羅減少。
