src_segmentnr	src_original	tgt_segmentnr	tgt_original
K01vinv15_u:322	 tena sadṛśāt kulāt kalatram ānītam;	K01D0005_H0005:45a-7	རིགས་མཉམ་པ་ལས་ཆུང་མ་བླངས་ནས་།
K01vinv15_u:323	 sa tayā sārdhaṃ krīḍati ramate paricārayati;  tasya krīḍato ramamāṇasya (MSV III 134)  paricārayataḥ kālāntareṇa patnī āpannasatvā saṃvṛttā;	K01D0005_H0005:45a-8	དེ་དེ་དང་ལྷན་ཅིག་རྩེ་བར་བྱེད་། དགའ་བར་བྱེད་། དགའ་མགུར་སྤྱོད་པར་བྱེད་དོ་༎ དུས་གཞན་ཞིག་ན་དེའི་ཆུང་མ་དེ་ལ་སེམས་ཅན་ཞིག་ཞུགས་པར་གྱུར་ཏོ་༎
K01vinv15_u:326	 sā cāṣṭānāṃ vā navānāṃ vā māsānām atyayāt prasūtā;	K01D0005_H0005:45a-12	ཇི་ཙམ་ན་ཟླ་བ་བརྒྱད་དམ་དགུ་འདས་ཏེ་བཙས་པ་ལས་།
K01vinv15_u:327	 dārako jātaḥ;  tasya trīṇi saptakāny ekaviṃśatidivasān vistareṇa jātasya jātimahaṃ kṛtvā nāmadheyaṃ vyavasthāpyate;  kiṃ bhavatu dārakasya nāmeti;  jñātaya ūcuḥ:	K01D0005_H0005:45a-13	བུ་མོ་གཟུགས་བཟང་བ་། བལྟ་ན་སྡུག་པ་། མཛེས་པ་ཞིག་སྐྱེས་ནས་། དེའི་ཉེ་དུ་རྣམས་འཚོགས་ཤིང་འདུས་ཏེ་ཉི་མ་བདུན་གསུམ་ཉི་ཤུ་གཅིག་ཏུ་སྦྱིན་པ་དག་ནི་སྦྱིན་། བསོད་ནམས་དག་ནི་བྱས་ནས་། མིང་འདོགས་པར་བྱེད་དོ་༎
K01vinv15_u:331	 ayaṃ dārako dattasya gṛhapateḥ putras tasmād bhavatu dārakasya sudatta iti nāmeti;	K01D0005_H0005:45a-19	ཡུལ་དབུས་ན་ཡང་ལུགས་ཀྱིས་གང་གཟུགས་བཟང་བ་དེ་ལ་བཟང་མོ་ཞེས་ཟེར་བས་། འདི་སྐད་དུ་བུ་མོ་འདི་གཟུགས་བཟང་བ་དང་། བལྟ་ན་སྡུག་པ་། མཛེས་པ་ཡིན་ལ་། འདིའི་ཕ་ཡང་སེར་སྐྱ་ཞེས་བྱ་བ་ཡིན་པ་།
K01vinv15_u:332	 tasya sudatta iti nāmadheyaṃ vyavasthāpitam;	K01D0005_H0005:45a-23	བུ་མོ་འདི་ཡང་སེར་སྐྱའི་བུ་མོ་བཟང་མོ་ཞེས་བྱ་བར་གདགས་སོ་ཞེས་མིང་བཏགས་སོ་༎
K01vinv15_u:333	 sudatto dārako 'ṣṭābhyo dhātrībhyo dattaḥ;	K01D0005_H0005:45a-24	དེ་ནས་སེར་སྐྱའི་བུ་མོ་བཟང་མོ་མ་མ་བརྒྱད་ལ་རྗེས་སུ་བཏད་དེ་།
K01vinv15_u:334	 dvābhyām aṃsadhātrībhyām;  dvābhyāṃ kṣīradhātrībhyām;	K01D0005_H0005:45b-0	པང་ན་འཚོ་བའི་མ་མ་གཉིས་དང་། ནུ་མ་བསྣུན་པའི་མ་མ་གཉིས་དང་། དྲི་མ་འཕྱི་བའི་མ་མ་གཉིས་དང་། རྩེད་གྲོགས་༄༤༥བ་ཀྱི་མ་མ་གཉིས་དང་། ལྕགས་ཀྱི་མདའ་ཐོགས་ཤིང་།
