src_segmentnr	src_original	tgt_segmentnr	tgt_original
K01vinv171u:1335	 yaiḥ samanvāgatasya mahāpuruṣasya (A 365a?)  dve gatī bhavato,	K10D0124_H0126:373a-8	འགྲོ་བ་གཉིས་སུ་འགྱུར་ཏེ་། གསུམ་དུ་འགྱུར་བ་མེད་དོ་༎
K01vinv171u:1337	 nānyā; saced gṛhī agāram adhyāvasati,  rājā bhavati cakravartī,  cāturantāṃ vijetā,  dhārmiko,	K10D0124_H0126:373a-10	གལ་ཏེ་ཁྱིམ་ན་གནས་ན་ནི་། འཁོར་ལོས་བསྒྱུར་བ་གླིང་བཞི་ལས་ཆེས་རྣམ་པར་རྒྱལ་ཞིང་ཆོས་ཅན་ཆོས་ཀྱི་རྒྱལ་པོ་སྟེ་།
K01vinv171u:1342	 tasyemāny evaṃrūpāṇi sapta ratnāni bhavanti; tadyathā (1)	K10D0124_H0126:373a-12	རིན་པོ་ཆེ་བདུན་དང་ལྡན་ནོ་༎ དེ་ལ་རིན་པོ་ཆེ་འདི་བདུན་འབྱུང་བ་འདི་ལྟ་སྟེ་།
K01vinv171u:1343	 cakraratnam, (2)  hastiratnam, (3)  aśvaratnam, (4)  maṇiratnam, (5)  strīratnam, (6)  gṛhapatiratnam, (7)  pariṇāyakaratnam eva saptamam;	K10D0124_H0126:373a-14	འཁོར་ལོ་རིན་པོ་ཆེ་དང་། གླང་པོ་རིན་པོ་ཆེ་དང་། རྟ་རིན་པོ་ཆེ་དང་། བུད་མེད་རིན་པོ་ཆེ་དང་། ནོར་བུ་རིན་པོ་ཆེ་དང་། ཁྱིམ་བདག་རིན་པོ་ཆེ་དང་། བློན་པོ་རིན་པོ་ཆེ་དང་རིན་པོ་ཆེ་དེ་བདུན་ནོ་༎
K01vinv171u:1350	 pūrṇaṃ cāsya bhavati sahasraṃ putrāṇāṃ śūrāṇāṃ vīrāṇāṃ varāṅgarūpiṇāṃ parasainyapramardakānām;	K10D0124_H0126:373a-15	དེ་ལ་བུ་སྟོང་ཚང་བ་ཡོད་དེ་། དབང་བ་། རྟུལ་ཕོད་པ་། ཡན་ལག་མཆོག་གི་གཟུགས་དང་ལྡན་པ་། ཕ་རོལ་གྱི་སྡེ་རབ་ཏུ་འཇོམས་པ་རྣམས་སོ་༎
K01vinv171u:1351	 sa imām eva samudraparyantāṃ mahāpṛthivīm akhilām akaṇṭakām anutpīḍām adaṇḍenāśastreṇa dharmeṇa samenābhinirjityādhyāvatsyati;	K10D0124_H0126:373a-19	དེས་གླིང་བཞི་པའི་འཇིག་རྟེན་ཆད་པ་དང་། མཚོན་གྱིས་མ་ཡིན་པར་ཆོས་ཀྱིས་ཕབ་སྟེ་རབ་ཏུ་གནས་སོ་༎
