src_segmentnr	src_original	tgt_segmentnr	tgt_original
K01vinv171u:5199	 asmin khalu dharmaparyāye bhāṣyamāṇe rājño māgadhasya śreṇyasya bimbisārasya virajo vigatamalaṃ dharmeṣu dharmacakṣur utpannam;  aśiteś ca devatāsahasrāṇām,  anekeṣāṃ ca brāhmaṇagṛhapatiśatasahasrāṇām;	K10D0289_H0292:475b-14	ཆོས་ཀྱི་རྣམ་གྲངས་འདི་བཤད་པ་ན་ཡུལ་མ་ག་དྷའི་རྒྱལ་པོ་བཟོ་སྦྱངས་གཟུགས་ཅན་སྙིང་པོ་དང་། ལྷ་བརྒྱད་ཁྲི་དང་། ཡུལ་མ་ག་དྷའི་བྲམ་ཟེ་དང་། ཁྱིམ་བདག་འབུམ་ཕྲག་དུ་མ་དག་ཆོས་རྣམས་ལ་ཆོས་ཀྱི་མིག་རྡུལ་མེད་ཅིང་དྲི་མ་དང་བྲལ་བ་སྐྱེས་སོ་༎
K01vinv171u:5202	 atha rājā māgadhaḥ śreṇyo bimbisāro dṛṣṭadharmā prāptadharmā viditadharmā paryavagāḍhadharmā	K10D0289_H0292:475b-15	དེ་ནས་ཡུལ་མ་ག་དྷའི་རྒྱལ་པོ་བཟོ་སྦྱངས་གཟུགས་ཅན་སྙིང་པོས་ཆོས་མཐོང་ཞིང་ཆོས་ཐོབ་ལ་།
K01vinv171u:5203	 tīrṇakāṅkṣas tīrṇavicikitso 'parapratyayo 'nanyaneyaḥ śāstuś śāsane dharmeṣu vaiśāradyaprāpta	K10D0289_H0292:476a-0	ཆོས་རྟོགས་ཤིང་ཆོས་ཀྱི་གཏིང་སླེབས་ཏེ་ནེམ་ནུར་ལས་རྒལ་ཏེ་ཐེ་ཚོམ་ལས་རྒལ་ཅིང་གཞན་གྱི་དྲིང་མི་འཇོག་པ་དང་། གཞན་གྱིས་བཀྲིར་མི་ཟུག་པ་དང་། སྟོན་པའི་བསྟན་པའི་ཆོས་རྣམས་ལ་མི་འཇིགས་པ་ཐོབ་ནས་སྟན་ལས་ལངས་ཏེ་བླ་གོས་ཕྲག་པ་གཅིག་ཏུ་བྱས་ནས་པུས་མོ་ག-ཡས་པའི་ལྷ་ང་ས་ལ་བཙུགས་ཏེ་༄༤༧༦ཨ་༌༎
K01vinv171u:5204	 utthāyāsanād ekāṃsam uttarāsaṅgaṃ kṛtvā yena bhagavāṃs tenāñjaliṃ praṇamayya bhagavantam idam avocat:	K10D0289_H0292:476a-1	བཅོམ་ལྡན་འདས་ག་ལ་བ་དེ་ལོགས་སུ་ཐལ་མོ་སྦྱར་བ་བཏུད་ནས་བཅོམ་ལྡན་འདས་ལ་འདི་སྐད་ཅེས་གསོལ་ཏོ་༎ བཙུན་པ་། བདག་ནི་། མངོན་པར་ཞུགས་པ་ལགས་སོ་༎ བདག་ནི་། མངོན་པར་ཞུགས་པ་ལགས་སོ་༎
K01vinv171u:5206	 eṣo 'haṃ bhagavantaṃ śaraṇaṃ gacchāmi,  dharmaṃ ca,  bhikṣusaṅghaṃ ca;	K10D0289_H0292:476a-5	བདག་བཅོམ་ལྡན་འདས་དང་། ཆོས་དང་། དགེ་སློང་གི་དགེ་འདུན་ལ་སྐྱབས་སུ་མཆི་ལགས་ཀྱི་།
K01vinv171u:5209	 upāsakaṃ ca māṃ dhārayādyāgreṇa yāvajjīvaṃ prāṇopetaṃ śaraṇāgatam,  abhiprasannam;	K10D0289_H0292:476a-6	བདག་དེང་སླན་ཆད་ཇི་སྲིད་འཚོའི་བར་དུ་སྲོག་གཅོད་པ་ལ་སོགས་པ་སྤངས་པ་། སྐྱབས་སུ་མཆིས་པ་།
K01vinv171u:5211	 āgacchatu bhagavān rājagṛham; ahaṃ (A 408b)  bhagavantam upasthāsyami yāvajjīvaṃ cīvarapiṇḍapātaśayanāsanaglānapratyayabhaiṣajyapariṣkāraiḥ sārdhaṃ bhikṣusaṅgheneti;	K10D0289_H0292:476a-8	མངོན་པར་དད་པར་གྱུར་པའི་དགེ་བསྙེན་ལགས་པར་གཟུང་དུ་གསོལ་། བདག་གིས་ཇི་སྲིད་འཚོའི་བར་དུ་བཅོམ་ལྡན་འདས་དགེ་སློང་གི་དགེ་འདུན་དང་བཅས་པ་ལ་ན་བཟའ་དང་། བསོད་སྙོམས་དང་། གཟིམས་ཆ་དང་། གདན་དང་། སྙུན་གྱི་གསོས་སྨན་ཡོ་བྱད་དག་གིས་བསྙེན་བཀུར་བགྱི་བར་འཚལ་ན་།
K01vinv171u:7992	 atha bhagavān mahatā bhikṣusaṃghena sārdhaṃ bhikṣusahasreṇa sarvaiḥ (SBV I 234)	K10D0289_H0292:467b-6	བཅོམ་ལྡན་འདས་དགེ་སློང་སྟོང་གི་དགེ་སློང་གི་དགེ་འདུན་ཆེན་པོ་ཐམས་ཅད་ཀྱང་སྔོན་རལ་པ་ཅན་ཐམས་ཅད་ཀྱང་དགྲ་བཅོམ་པ་།
K01vinv171u:7993	 purāṇajaṭilaiḥ sarvaiś cārhadbhiḥ kṣīṇāsravaiḥ kṛtakṛtyaiḥ kṛtakaraṇīyair avahṛtabhārair	K10D0289_H0292:467b-7	ཟག་པ་ཟད་པ་། བྱ་བ་བྱས་པ་། བྱེད་པ་བྱས་པ་། ཁུར་བོར་བ་།
K01vinv171u:7994	 anuprāptasvakārthaiḥ parikṣīṇabhavasaṃyojanaiḥ samyagājñayā suvimuktacittair māgadheṣu	K10D0289_H0292:467b-11	བདག་གི་དོན་རྗེས་སུ་ཐོབ་པ་། སྲིད་པར་ཀུན་ཏུ་སྦྱོར་བ་ཡོངས་སུ་ཟད་པ་།
K01vinv171u:7995	 janapadeṣu caryāṃ caran yena yaṣṭivanaṃ supratiṣṭhito māgadhakānāṃ caityas tena caryāṃ prakrāntaḥ;  atha bhagavān supratiṣṭhitaṃ caityaṃ anuprāpto yaṣṭivane supratiṣṭhite viharati māgadhakānāṃ caitye;	K10D0289_H0292:468a-0	ཡང་དག་པའི་ཤེས་པས་སེམས་ཤིན་ཏུ་རྣམ་པར་གྲོལ་བ་ཤ་སྟག་དང་ཐབས་ཅིག་ཏུ་ཡུལ་མ་ག་དྷ་ར་ཡུལ་རྒྱུ་ཞིང་གཤེགས་པ་ན་མ་ག་དྷ་པ་རྣམས་ཀྱི་མཆོད་རྟེན་རབ་བརྟན་གྱི་སྨྱིག་མའི་ནགས་ཁྲོད་༄༤༦༨ཨ་༌༎ དེ་ན་བཅོམ་ལྡན་འདས་རབ་བརྟན་དུ་བྱོན་ནས་མ་ག་དྷ་པ་རྣམས་ཀྱི་མཆོད་རྟེན་རབ་བརྟན་གྱི་སྨྱིག་མའི་ནགས་ཁྲོད་ན་བཞུགས་སོ༏་༏ཡུལ་མ་ག་དྷའི་རྒྱལ་པོ་བཟོ་སྦྱངས་གཟུགས་ཅན་སྙིང་པོས་བཅོམ་ལྡན་འདས་དགེ་སློང་སྟོང་གི་དགེ་སློང་གི་དགེ་འདུན་ཆེན་པོ་ཐམས་ཅད་ཀྱང་སྔོན་རལ་པ་ཅན་། ཐམས་ཅད་ཀྱང་དགྲ་བཅོམ་པ་།
K01vinv171u:7998	 bhagavān mahatā bhikṣusaṃghena sārdhaṃ bhikṣusahasreṇa sarvaiḥ pūrvavad yāvat samyagājñayā  suvimuktacittair māgadheṣu janapadeṣu caryāṃ caran yena yaṣṭivanaṃ supratiṣṭhito  māgadhakānāṃ caityas tenānuprāpto yaṣṭivane viharati māgadhakānāṃ caitye	K10D0289_H0292:468a-11	ཡང་དག་པའི་ཤེས་པས་སེམས་ཤིན་ཏུ་རྣམ་པར་གྲོལ་བ་ཤ་སྟག་དང་ཐབས་ཅིག་ཏུ་ཡུལ་མ་ག་དྷར་ཡུལ་རྒྱུ་ཞིང་གཤེགས་པ་ན་མ་ག་དྷ་པ་རྣམས་ཀྱི་མཆོད་རྟེན་རབ་བརྟན་གྱི་སྨྱིག་མའི་ནགས་ཁྲོད་ག་ལ་བ་དེར་གཤེགས་ཏེ་། དེ་ན་བཅོམ་ལྡན་འདས་རབ་བརྟན་དུ་བྱོན་ནས་མ་ག་དྷ་པ་རྣམས་ཀྱི་མཆོད་རྟེན་རབ་བརྟན་གྱི་སྨྱིག་མའི་ནགས་ཁྲོད་ན་བཞུགས་སོ་༎
