src_segmentnr	src_original	tgt_segmentnr	tgt_original
K01vinv01_u:516	 te kathayanti bhadanta saṃgharakṣita vayaṃ kāśyapasya samyaksaṃbuddhasya śrāvakā	K01D0001_H0001:147b-10	དེ་དག་གིས་སྨྲས་པ་། བཙུན་པ་དགེ་འདུན་འཚོ་བདག་ཅག་ནི་ཡང་དག་པར་རྫོགས་པའི་སངས་རྒྱས་འོད་སྲུང་གི་ཉན་ཐོས་སུ་གྱུར་ཏེ་།
K01vinv01_u:517	 āsaṃs tair asmābhir bhaktāgre raṇam utpāditaṃ tasya karmaṇo vipākena vayaṃ pratyekanarake	K01D0001_H0001:147b-12	ཇི་ཙམ་ན་བདག་ཅག་གིས་ཟན་གྱི་གྲལ་དུ་འཐབ་མོ་བགྱིས་པས་ལས་དེའི་རྣམ་པར་སྨིན་པས་བདག་ཅག་ཉི་ཚེ་བའི་སེམས་ཅན་དམྱལ་བ་རྣམས་ཀྱི་ནང་དུ་སྐྱེས་ཏེ་།
K01vinv01_u:518	 upapannāḥ sthānam etad vidyate yaṃ idam asmākam itaś cyutānāṃ narakopapattir bhaviṣyati /	K01D0001_H0001:147b-13	བདག་ཅག་འདི་ནས་ཤི་འཕོས་པ་དག་སེམས་ཅན་དམྱལ་བ་རྣམས་ཀྱི་ནང་དུ་སྐྱེ་བར་འགྱུར་བ་གང་ལགས་པ་དེ་ལྟ་བུའི་གནས་ཀྱང་མཆིས་པར་འགྱུར་རོ་༎
K01vinv01_u:519	 tat sādhu bhadanta saṃgharakṣita jambudvīpaṃ gatvā sabrahmacāriṇāṃ vistareṇaitam artham ārocaya mā āyuṣmantas saṃghamadhye raṇam utpādayiṣyatha	K01D0001_H0001:147b-14	བཙུན་པ་དགེ་འདུན་འཚོ་དེའི་སླད་དུ་འཛམ་བུའི་གླིང་དུ་གཤེགས་ནས་། འོད་སྲུང་གི་དགེ་སློང་དག་ལྟར་ཟན་གྱི་གྲལ་དུ་འཐབ་མོ་མ་བྱེད་ཅིག་།
K01vinv01_u:520	 mā tādṛśasya duḥkhasamūhasya bhāgino bhaviṣyatha :	K01D0001_H0001:147b-17	སྡུག་བསྔལ་གྱི་ཚོགས་དེ་ལྟ་བུའི་སྐལ་བ་ཅན་དུ་འགྱུར་བར་མ་བྱེད་ཅིག་།
K01vinv01_u:521	 tadyathā śramaṇāḥ kāśyapīyā iti /  sa tatheti pratijñāya saṃprasthito	K01D0001_H0001:148a-0	༄༡༤༨ཨ་༌༎ ཅེས་དོན་འདི་རྒྱ་ཆེར་བརྗོད་ན་ལེགས་སོ་༎ དེས་དེ་ལྟར་བྱའོ་ཞེས་ཁས་བླངས་ཏེ་སོང་ངོ་༎ ཇི་ཙམ་ན་དེ་ཁོ་ན་བཞིན་དུ་སའ་ལའི་དགོན་པ་ཞིག་ན་གཙུག་ལག་ཁང་གཉིས་པ་རྟ་བབས་མཐོན་པོ་དང་ལྡན་པ་། མཐོངས་ཁུང་དང་། སྐར་ཁུང་དྲ་བ་ཅན་དང་། ལན་ཀན་གྱིས་བརྒྱན་པ་སྙིང་དང་མིག་འཕྲོག་པར་བྱེད་པ་། ཁྲི་དང་ཁྲིའུ་དང་ཡོ་བྱད་ཕུན་སུམ་ཚོགས་པ་དང་ལྡན་པ་།
K01vinv01_u:524	 nānāvṛkṣaparivāritaṃ puṣkariṇītaḍāgopaśobhitaṃ haṃsakrauñcamayūraśukaśārikākokilābhinikūjitaṃ	K01D0001_H0001:148a-6	ཤིང་ལྗོན་པ་སྣ་ཚོགས་ཀྱིས་བསྐོར་པ་། རྫིང་བུ་དང་། མཚེའུས་ཉེ་བར་མཛེས་པར་བྱས་པ་། ངང་པ་དང་། ཁྲུང་ཁྲུང་དང་། རྨ་བྱ་དང་། ནེ་ཙོ་དང་། རི་སྐེགས་དང་། ཁུ་བྱུག་དག་མངོན་པར་སྒྲ་འབྱིན་པ་།
K01vinv01_u:525	 devabhavanam iva śriyā jvalantaṃ /  bhikṣūṃś ca suprāvṛtanivastāṃ śānteneryāpathenāvasthitāṃ /	K01D0001_H0001:148a-9	ལྷའི་གནས་ལྟར་དཔལ་གྱིས་འབར་བ་ཞིག་དང་། དེ་ན་དགེ་སློང་ལེགས་པར་བགོས་ཤིང་ལེགས་པར་སྦྱངས་པ་།
K01vinv01_u:527	 sa sagauravas teṣāṃ sakāśam upasaṃkrāntaḥ  tatas tais sasambhramair asau saṃbhāṣitaḥ /	K01D0001_H0001:148a-10	སྤྱོད་ལམ་ཞི་བས་གནས་པ་དག་མཐོང་ནས་གུས་པ་དང་བཅས་པས་དེ་དག་གི་གན་དུ་སོང་ངོ་༎ དེ་ནས་དེ་དག་གུས་པ་དང་སྒྲིམ་པ་དང་བཅས་པས་།
K01vinv01_u:53	 te tasya muktasaṃnāhasya śivire nipatitās tair aṅgo rājā praghātitaḥ aṅgasya rājñaś caturaṅgo balakāyaś caturdiśaṃ vidrutaḥ /	K01D0001_H0001:8b-21	དེ་དག་གིས་ཨཨང་གའི་རྒྱལ་པོ་བཞབས་ཏེ་གསད་དོ་༎ ཨཨང་གའི་རྒྱལ་པོའི་དཔུང་གི་ཚོགས་ཡན་ལག་བཞི་པ་ཕྱོགས་བཞིར་ཕྱེར་བ་དང་། གཞོན་ནུ་གཟུགས་ཅན་སྙིང་པོས་ཕྱོགས་བཞིར་ཕོ་ཉ་རྟ་བ་དག་བཀྱེ་སྟེ་།
K01vinv01_u:529	 svāgataṃ svāgataṃ bhadantasaṃgharakṣitāya /	K01D0001_H0001:148a-12	དེས་སྨྲས་པ་། བཙུན་པ་དགེ་འདུན་འཚོ་བྱོན་པ་ལེགས་སོ་༎ བྱོན་པ་ལེགས་སོ་༎
K01vinv01_u:530	 kutas tvam etarhy āgacchasīti /	K01D0001_H0001:148a-15	ཁྱོད་ད་གཟོད་ག་ལས་བྱོན་།
K01vinv01_u:531	 tena yathāvṛttaṃ sarvam ārocitaṃ /	K01D0001_H0001:148a-16	དེས་ཇི་ལྟར་གྱུར་པ་ཐམས་ཅད་བརྗོད་པ་དང་། དེ་ནས་དེ་དག་གིས་ངལ་སོར་བཅུག་སྟེ་།
K01vinv01_u:532	 tatas tair viśrāmitaḥ mārgaśrame prativinodite vihāraṃ praveśito  yāvat paśyati śobhanām āsanaprajñaptiḥ kṛtā /  praṇītaṃ cāhāram upānvāhṛtaṃ /	K01D0001_H0001:148a-17	ལམ་གྱིས་དུབ་པ་བསལ་ནས་། གཙུག་ལག་ཁང་དུ་ཁྲིད་དོ༏་༏ཇི་ཙམ་ན་སྟན་བཟང་པོ་བཤམས་པ་དང་། ཁ་ཟས་བསོད་པའི་སྤྱི་བུངས་བཤམས་པ་དག་མཐོང་ནས་དེ་དག་གིས་དེ་ལ་སྨྲས་པ་།
K01vinv01_u:535	 (Pravr-v III 255) sa tair ukto bhadanta saṃgharakṣita mā tṛṣito mā bubhukṣito vā /	K01D0001_H0001:148a-19	བཙུན་པ་དགེ་འདུན་འཚོ་མི་སྐྱེམས་སམ་། མི་སྦྲེབས་༄༡༤༨བ་སམ་།
K01vinv01_u:536	 sa kathayati āyuṣmantas tṛṣito 'smi bubhukṣitaś ceti /	K01D0001_H0001:148b-1	དེས་སྨྲས་པ་། ཚེ་དང་ལྡན་པ་དག་སྐོམ་མོ་༎
K01vinv01_u:537	 te kathayanti bhadanta saṃgharakṣita bhuṃkṣveti /	K01D0001_H0001:148b-3	བཀྲེས་སོ་༎ དེ་དག་གིས་སྨྲས་པ་། བཙུན་པ་དགེ་འདུན་འཚོ་གསོལ་ཅིག་།
K01vinv01_u:538	 sa kathayati saṃghamadhye eva bhokṣyāmīti /	K01D0001_H0001:148b-5	དེས་སྨྲས་པ་། དགེ་འདུན་གྱི་ནང་དུ་བཟའོ་༎
K01vinv01_u:539	 te kathayanti bhadanta saṃgharakṣita (43v = GBM 6.687)  mārgaparikhinnas tvaṃ idānīm eva bhuṃkṣva ādīnavo 'tra bhaviṣyatīti /	K01D0001_H0001:148b-7	དེ་དག་གིས་སྨྲས་པ་། བཙུན་པ་དགེ་འདུན་འཚོ་ཁྱོད་ཤུལ་གྱིས་བསྙེལ་བ་ལགས་ཀྱིས་གསོལ་ཅིག་། སླད་ཀྱིས་འདིར་ཉེས་དམིགས་འབྱུང་བར་འགྱུར་རོ་༎
K01vinv01_u:541	 sa bhuktvā ekānte prakramyāvasthitaḥ	K01D0001_H0001:148b-10	དེས་ཉེས་དམིགས་མཐོང་བས་ཟོས་ནས་མཐའ་གཅིག་ཏུ་སོང་སྟེ་འདུག་གོ་།
K01vinv01_u:542	 yāvat teṣāṃ bhojanakālo jāto gaṇḍir ākoṭitā te svakasvakāni pātrāṇy ādāya yathāgantryā	K01D0001_H0001:148b-11	ཇི་ཙམ་ན་དེ་དག་དྲོ་ལ་བབ་སྟེ་། གནདའི་བརྡུངས་པ་ན་རང་རང་གི་ལྷུང་བཟེད་ཐོགས་ཏེ་གྲལ་རིམས་བཞིན་དུ་འཁོད་དོ་༎
K01vinv01_u:543	 niṣaṇṇāḥ vihāraś cāntarhitaḥ tad annapānam ayorasaṃ prādurbhūtaṃ tatas tair ārttasvaraṃ	K01D0001_H0001:148b-13	དེ་དག་འཁོད་པ་དང་གཙུག་ལག་ཁང་དེ་ཡང་མི་སྣང་བར་གྱུར་ཅིང་། བཟའ་བ་དང་བཏུང་བ་དེ་དག་ཀྱང་ལྕགས་ཁུ་དག་ཏུ་གྱུར་ཏོ་༎
K01vinv01_u:544	 krandadbhir ayorasena parasparaṃ tāvad ātmā pariṣikto yāvad bhojanakālo 'tikrānta	K01D0001_H0001:148b-15	དེ་ནས་དེ་དག་ཇི་སྲིད་དྲོ་མ་ཡོལ་གྱི་བར་དུ་ལྕགས་ཁུ་དེ་དག་གིས་ཕན་ཚུན་གཏོར་ནས་། དེ་དག་ལུས་ཚིག་ཅིང་སྡུག་བསྔལ་བའི་ཚོར་བས་ཉེན་ནས་ཉམ་ཐག་པའི་སྐད་འབྱིན་ཏོ་༎
K01vinv01_u:545	 ity atikrānte ca bhojanakāle sa vihāraḥ punar api tādṛśa eva prādurbhūtas te ca bhikṣavas  tathaiva śānteneryāpathenāvasthitāḥ	K01D0001_H0001:148b-17	ཇི་ཙམ་ན་དྲོ་ཡོལ་བ་དང་། གཙུག་ལག་ཁང་དེ་ཡང་དེ་ཁོ་ན་བཞིན་དུ་ཕྱིར་བྱུང་ཞིང་། དགེ་སློང་དེ་དག་ཀྱང་དེ་ཁོ་ན་བཞིན་དུ་སྤྱོད་ལམ་ཞི་བས་གནས་སོ་༎
K01vinv01_u:547	 tata āyuṣmāṃ saṃgharakṣitas teṣāṃ sakāśam upasaṃkramya pṛcchati /	K01D0001_H0001:148b-19	དེ་ནས་ཚེ་ལྡན་པ་དགེ་འདུན་འཚོ་དེ་དག་གི་གན་དུ་སོང་སྟེ་དྲིས་པ་།
K01vinv01_u:548	 ke yūyam āyuṣmantaḥ kena vā karmaṇā ihopapannā iti /	K01D0001_H0001:148b-20	ཚེ་དང་ལྡན་པ་དག་ཁྱེད་སུ་ཡིན་། ལས་གང་གིས་འདིར་སྐྱེས་།
K01vinv01_u:549	 te kathayanti bhadanta saṃgharakṣita duṣkuhakā jāmbūdvīpakā manuṣyā na śraddhāsyanti	K01D0001_H0001:148b-22	དེ་དག་གིས་སྨྲས་པ་། བཙུན་པ་དགེ་འདུན་འཚོ་འཛམ་བུ་གླིང་པའི་མི་རྣམས་ཡིད་ཆེས་པར་དཀའ་བས་། ཁྱོད་ཡིད་ཆེས་པར་མི་འགྱུར་རོ་༎
K01vinv01_u:54	 3r1 (Pravr-v II; GBM 6.676): /// vayam api rājānaḥ kṣatriyā mūrdhābhiṣiktāḥ nivartantu bhavanto 'haṃ bhavatāṃ vṛddhyupādānaṃ prajñāpayiṣyāmīti	K01D0001_H0001:8b-23	ཤེས་ལྡན་དག་དེ་ཡང་རྒྱལ་པོ་རྒྱལ་རིགས་སྤྱི་བོར་དབང་བསྐུར་བ་ཡིན་ལ་། ངེད་ཀྱང་རྒྱལ་པོ་༄༩ཨ་༌༎ རྒྱལ་རིགས་སྤྱི་བོར་དབང་བསྐུར་བ་ཡིན་གྱིས་། ཕྱིར་ལོག་ཅིག་དང་། ཤེས་ལྡན་དག་ངས་ཤེས་ལྡན་དག་ལ་འཚོ་བའི་རྒྱུ་སྦྱིན་པར་བྱའོ་ཞེས་སྤྲིང་པ་དང་། དེ་དག་ཕྱིར་ལོག་གོ་།
K01vinv01_u:550	 sa kathayaty ahaṃ pratyakṣadarśy eva kathaṃ na śraddhāsyāmi /	K01D0001_H0001:148b-25	དེས་སྨྲས་པ་། ཁོ་བོས་མངོན་སུམ་ཁོ་ནར་མཐོང་ན་ཅིའི་ཕྱིར་ཡིད་ཆེས་པར་མི་འགྱུར་།
K01vinv01_u:551	 te kathayanti bhadanta saṃgharakṣita vayaṃ kāśyapasya samyaksaṃbuddhasya śrāvakā āsaṃ /	K01D0001_H0001:148b-27	དེ་དག་གིས་སྨྲས་པ་། བཙུན་པ་དགེ་༄༡༤༩ཨ་༌༎ འདུན་འཚོ་བདག་ཅག་ནི་ཡང་དག་པར་རྫོགས་པའི་སངས་རྒྱས་འོད་སྲུང་གི་ཉན་ཐོས་སུ་གྱུར་ཏེ་།
K01vinv01_u:553	 mātsaryaparigṛhītair evaṃ cittam utpādya vāṅ niścāritā na tāvad bhojayiṣyāmo yāvad  āgantukā bhikṣavo na viprakrāmantīti /  tathaiva ca kṛtaṃ /	K01D0001_H0001:149a-3	བདག་ཅག་སེར་སྣ་ཡོངས་སུ་བཟུང་བ་དག་གིས་ཇི་སྲིད་དུ་དགེ་སློང་གློ་བུར་དུ་འོངས་པ་དག་མདོང་བ་དེ་སྲིད་དུ་བཟའ་བར་མི་བྱའོ་ཞེས་དེ་ལྟར་སེམས་བསྐྱེད་ཅིང་ཚིག་ཏུ་ཡང་བརྗོད་ལ་།
K01vinv01_u:552	 yāvat saṃghasya snehalābhas saṃpannaḥ āgantukāś ca bhikṣavo 'bhyāgatās tair asmābhir	K01D0001_H0001:149a-2	ཇི་ཙམ་ན་དགེ་འདུན་ལ་སྣུམ་བག་གི་རྙེད་པ་བྱུང་ཞིང་དགེ་སློང་གློ་བུར་དུ་འོངས་པ་དག་ཀྱང་ལྷགས་པ་ན་།
K01vinv01_u:556	 yāvat saptāham akāladurdinaṃ prādurbhūtaṃ yena tad annapānaṃ kleditam ayogyaṃ saṃvṛttaṃ /	K01D0001_H0001:149a-4	ཞག་བདུན་གྱི་བར་དུ་དུས་མ་ཡིན་པར་ཡུལ་ངན་བྱུང་ནས་། དེས་བཟའ་བ་དང་བཏུང་བ་དེ་དག་རུལ་ཅིང་མ་རུང་བར་གྱུར་པ་དེ་ལྟར་བགྱིས་ཏེ་།
K01vinv01_u:558	 yad asmākam itaś cyutānāṃ narakopapattir bhaviṣyati /	K01D0001_H0001:149a-6	བདག་ཅག་གིས་དད་པས་སྦྱིན་པར་བྱ་བ་ཆུད་གཟན་པས་། ལས་དེའི་རྣམ་པར་སྨིན་པས་བདག་ཅག་ཉི་ཚེ་བའི་སེམས་ཅན་དམྱལ་བ་རྣམས་ཀྱི་ནང་དུ་སྐྱེས་ཏེ་། བདག་ཅག་འདི་ནས་ཤི་འཕོས་པ་དག་སེམས་ཅན་དམྱལ་བ་ཆེན་པོ་རྣམས་ཀྱི་ནང་དུ་སྐྱེ་བར་འགྱུར་བ་གང་ལགས་པ་དེ་ལྟ་བུའི་གནས་ཀྱང་མཆིས་པར་འགྱུར་རོ་༎
K01vinv01_u:559	 tat sādhu bhadanta saṃgharakṣita jambudvīpaṃ gatvā sabrahmacāriṇām etam arthaṃ vistareṇārocaya /	K01D0001_H0001:149a-9	བཙུན་པ་དགེ་འདུན་འཚོ་། དེའི་སླད་དུ་འཛམ་བུའི་གླིང་དུ་གཤེགས་ནས་། ཚངས་པ་མཚུངས་པར་སྤྱོད་པ་རྣམས་ལ་།
K01vinv01_u:560	 mā yūyam āyuṣmantaḥ śraddhādeyaṃ vinipātayiṣyatha :	K01D0001_H0001:149a-13	དཔེར་ན་འོད་སྲུང་གི་དགེ་སྦྱོང་དག་ལྟར་དད་པས་སྦྱིན་པར་བྱ་བ་ཆུད་མ་གཟོན་ཅིག་།
K01vinv01_u:561	 mā tādṛśasya duḥkhasamūhasya bhāgino bhaviṣyatha :  tadyathā śramaṇāḥ kāśyapīyā iti /	K01D0001_H0001:149a-14	སྡུག་བསྔལ་གྱི་ཚོགས་དེ་ལྟ་བུའི་སྐལ་བ་ཅན་དུ་འགྱུར་བར་མ་བྱེད་ཅིག་ཅེས་དོན་འདི་རྒྱ་ཆེར་བརྗོད་ན་ལེགས་སོ་༎ དེ་དེ་ལྟར་བྱའོ་༎
K01vinv01_u:563	 sa tatheti pratiśrutya pratijñāya saṃprasthito	K01D0001_H0001:149a-16	ཞེས་ཁས་བླང་ནས་སོང་ངོ་༎
K01vinv01_u:565	 nānāvṛkṣaparivāritaṃ puṣkariṇītaḍāgopaśobhitaṃ haṃsakrauñcamayūraśukaśārikākokilābhinikūjitaṃ	K01D0001_H0001:149b-5	ཤིང་ལྗོན་པ་སྣ་ཚོགས་ཀྱིས་བསྐོར་བ་། རྫིང་བུ་དང་། མཚེའུས་ཉེ་བར་མཛེས་པར་བྱས་པ་། ངང་པ་དང་། ཁྲུང་ཁྲུང་དང་། རྨ་བྱ་དང་། ནེ་ཙོ་དང་། རི་སྐེགས་དང་། ཁུ་བྱུག་དག་མངོན་པར་སྒྲ་འབྱིན་པ་།
K01vinv01_u:564	 yāvat tṛtīyaṃ vihāraṃ paśyati udgatamaṃcapīṭhavedikājālavātāyanagavākṣapariṣaṇḍamaṇḍitaṃ	K01D0001_H0001:149b-0	ཇི་ཙམ་ན་ཡང་དེ་ཁོ་ན་བཞིན་དུ་སའ་ལའི་དགོན་པ་ཞིག་ན་གཙུག་ལག་ཁང་གསུམ་པ་རྟ་བབས་མཐོན་པོ་༄༡༤༩བ་དང་ལྡན་པ་། མཐོངས་ཁུང་དང་། སྐར་ཁུང་དྲ་བ་ཅན་དང་། ལན་ཀན་གྱིས་བརྒྱན་པ་། སྙིང་དང་མིག་འཕྲོག་པར་བྱེད་པ་། མཐོ་རིས་ཀྱི་ཐེམ་སྐས་སུ་གྱུར་པ་། ཁྲི་དང་ཁྲིའུ་དང་། ཡོ་བྱད་ཕུན་སུམ་ཚོགས་པ་དང་ལྡན་པ་།
K01vinv01_u:567	 sa sagauravas teṣāṃ sakāśam upasaṃkrāntaḥ	K01D0001_H0001:149b-10	གུས་པ་དང་བཅས་པས་དེ་དག་གི་གན་དུ་སོང་ངོ་༎
K01vinv01_u:566	 devabhavanam iva śriyā jvalantaṃ bhikṣūṃś ca suprāvṛtasunivastāṃ śānteneryāpathenāvasthitāṃ /	K01D0001_H0001:149b-8	ལྷའི་གནས་ལྟར་དཔལ་གྱིས་འབར་བ་ཞིག་དང་། དེ་ན་དགེ་སློང་ལེགས་པར་བགོས་ཤིང་ལེགས་པར་སྦྱངས་པ་། སྤྱོད་ལམ་ཞི་བས་གནས་པ་དག་མཐོང་ནས་།
K01vinv01_u:526	 bhikṣūṃś ca suprāvṛtanivastāṃ śānteneryāpathenāvasthitāṃ /	K01D0001_H0001:146b-19	དེ་ན་དགེ་སློང་ལེགས་པར་བགོས་ཤིང་ལེགས་པར་སྦྱངས་པ་། སྤྱོད་ལམ་ཞི་བས་གནས་པ་དག་མཐོང་ནས་གུས་༄༡༤༧ཨ་༌༎
K01vinv01_u:524	 nānāvṛkṣaparivāritaṃ puṣkariṇītaḍāgopaśobhitaṃ haṃsakrauñcamayūraśukaśārikākokilābhinikūjitaṃ  devabhavanam iva śriyā jvalantaṃ /	K01D0001_H0001:146b-17	ཤིང་ལྗོན་པ་སྣ་ཚོགས་ཀྱིས་བསྐོར་བ་། རྫིང་བུ་དང་མཚེའུས་ཉེ་བར་མཛེས་པར་བྱས་པ་དང་། ངང་པ་དང་། ཁྲུང་ཁྲུང་དང་། རྨ་བྱ་དང་། ནེ་ཙོ་དང་། རི་སྐེགས་དང་། ཁུ་བྱུག་མངོན་པར་སྒྲ་འབྱིན་པ་ལྷའི་གནས་ལྟར་དཔལ་གྱིས་འབར་བ་ཞིག་དང་།
K01vinv01_u:55	 te nivartitāḥ tato yaś caṃpāyām ārakṣakaḥ sthāpitaḥ tena śrutaṃ yathā	K01D0001_H0001:9a-3	དེ་ནས་ཨཨང་གའི་རྒྱལ་པོས་གྲོང་ཁྱེར་ཙམ་པ་བསྲུང་བ་བཞག་པ་དེས་ཨཨང་གའི་རྒྱལ་པོ་ཇི་ལྟར་བསད་པ་ཐོས་ནས་། དེས་སྒོ་བཅད་དེར་བདག་གི་ཁར་སྦྲེངས་ནས་འདུག་གོ་།
K01vinv01_u:528	 tatas tais sasambhramair asau saṃbhāṣitaḥ /	K01D0001_H0001:147a-2	དེ་ནས་དེ་དག་གུས་པར་སྒྲིམ་པ་དང་བཅས་པས་དེ་ལ་སྨྲས་པ་།
K01vinv01_u:527	 sa sagauravas teṣāṃ sakāśam upasaṃkrāntaḥ	K01D0001_H0001:147a-1	པ་དང་བཅས་པས་དེ་དག་གི་གན་དུ་སོང་ངོ་༎
K01vinv01_u:529	 svāgataṃ svāgataṃ bhadantasaṃgharakṣitāya /	K01D0001_H0001:147a-3	བཙུན་པ་དགེ་འདུན་འཚོ་བྱོན་པ་ལེགས་སོ་༎ བྱོན་པ་ལེགས་སོ་༎
K01vinv01_u:530	 kutas tvam etarhy āgacchasīti /	K01D0001_H0001:147a-5	ཁྱོད་ད་གཟོད་ག་ལས་བྱོན་།
K01vinv01_u:531	 tena yathāvṛttaṃ sarvam ārocitaṃ /	K01D0001_H0001:147a-6	དེས་ཇི་ལྟར་གྱུར་པ་ཐམས་ཅད་བརྗོད་པ་དང་། དེ་ནས་དེ་དག་གིས་ངལ་སོར་བཅུག་སྟེ་།
K01vinv01_u:532	 tatas tair viśrāmitaḥ mārgaśrame prativinodite vihāraṃ praveśito	K01D0001_H0001:147a-7	ལམ་གྱིས་དུབ་པ་བསལ་ནས་གཙུག་ལག་ཁང་དུ་ཁྲིད་དོ་༎
K01vinv01_u:533	 yāvat paśyati śobhanām āsanaprajñaptiḥ kṛtā /  praṇītaṃ cāhāram upānvāhṛtaṃ /	K01D0001_H0001:147a-8	ཇི་ཙམ་ན་སྟན་བཟང་པོ་བཤམས་པ་དང་ཁ་ཟས་བསོད་པའི་སྤྱི་བུངས་བཤམས་པ་མཐོང་ནས་།
K01vinv01_u:535	 (Pravr-v III 255) sa tair ukto bhadanta saṃgharakṣita mā tṛṣito mā bubhukṣito vā /	K01D0001_H0001:147a-9	དེ་དག་གིས་དེ་ལ་སྨྲས་པ་། བཙུན་པ་དགེ་འདུན་འཚོ་མི་སྐྱེམས་སམ་། མི་བཀྲེས་སམ་།
K01vinv01_u:536	 sa kathayati āyuṣmantas tṛṣito 'smi bubhukṣitaś ceti /	K01D0001_H0001:147a-12	དེས་སྨྲས་པ་། ཚེ་དང་ལྡན་པ་དག་སྐོམ་མོ་༎
K01vinv01_u:537	 te kathayanti bhadanta saṃgharakṣita bhuṃkṣveti /	K01D0001_H0001:147a-14	བཀྲེས་སོ་༎ དེ་དག་གིས་སྨྲས་པ་། བཙུན་པ་དགེ་འདུན་འཚོ་གསོལ་ཅིག་།
K01vinv01_u:538	 sa kathayati saṃghamadhye eva bhokṣyāmīti /	K01D0001_H0001:147a-16	དེས་སྨྲས་པ་། དགེ་འདུན་གྱི་ནང་དུ་བཟའོ་༎
K01vinv01_u:539	 te kathayanti bhadanta saṃgharakṣita (43v = GBM 6.687)  mārgaparikhinnas tvaṃ idānīm eva bhuṃkṣva ādīnavo 'tra bhaviṣyatīti /	K01D0001_H0001:147a-18	དེ་དག་གིས་སྨྲས་པ་། བཙུན་པ་དགེ་འདུན་འཚོ་ཁྱོད་ཤུལ་གྱིས་དུབ་པ་ལགས་ཀྱིས་། ད་གསོལ་ཅིག་། སླད་ཀྱིས་འདིར་ཉེས་དམིགས་འབྱུང་བར་འགྱུར་རོ་༎ དེས་ཉེས་དམིགས་མཐོང་བས་།
K01vinv01_u:56	 3r2 (Pravr-v II): /// bimbisāraḥ kumāro 'nupūrveṇa caṇpāṃ gataḥ tena dīrghayā latayā	K01D0001_H0001:9a-5	གཞོན་ནུ་གཟུགས་ཅན་སྙིང་པོ་ཡང་མཐར་གྱིས་གྲོང་ཁྱེར་ཙམ་པར་ཕྱིན་ནས་།
K01vinv01_u:542	 yāvat teṣāṃ bhojanakālo jāto gaṇḍir ākoṭitā te svakasvakāni pātrāṇy ādāya yathāgantryā	K01D0001_H0001:147a-24	ཇི་ཙམ་ན་དེ་དག་དྲོ་ལ་བབ་སྟེ་། རང་རང་གི་ལྷུང་བཟེད་ཐོགས་ཏེ་གྲལ་རིམས་བཞིན་འཁོད་དོ་༎
K01vinv01_u:541	 sa bhuktvā ekānte prakramyāvasthitaḥ	K01D0001_H0001:147a-23	ཟོས་ནས་མཐའ་གཅིག་ཏུ་སོང་སྟེ་འདུག་གོ་༎
