src_segmentnr	src_original	tgt_segmentnr	tgt_original
K01vinv01_u:1203	 rathyāsaṃbādhe niṣpalāyito jetavanaṃ bhikṣos sakāśam upasaṃkramya kathayaty ārya	K01D0001_H0001:179b-14	ཆོམ་རྐུན་པ་ཞིག་ལམ་ལྡོག་པར་བྲོས་ཏེ་རྒྱལ་བྱེད་ཀྱི་ཚལ་དུ་དགེ་སློང་གི་གན་དུ་སོང་སྟེ་སྨྲས་པ་།
K01vinv01_u:1204	 pravrajitum icchāmi /	K01D0001_H0001:179b-15	འཕགས་པ་བདག་རབ་ཏུ་འབྱུང་བར་འཚལ་ལོ་༎
K01vinv01_u:1205	 sa tena pravrājita upasaṃpāditaḥ te 'pi corāḥ praghātitāḥ	K01D0001_H0001:179b-16	དེས་རབ་ཏུ་ཕྱུང་ཞིང་བསྙེན་པར་རྫོགས་པར་བྱས་སོ་༎ ཆོམ་རྐུན་པ་དེ་དག་ཀྱང་བསད་དོ་༎
K01vinv01_u:1206	 uktaṃ bhagavatā ātmavipattiṃ paravipattiṃ ātmasaṃpattiṃ parasaṃpattiṃ bhikṣavo 'bhīkṣṇaṃ	K01D0001_H0001:179b-18	བཅོམ་ལྡན་འདས་ཀྱིས་དགེ་སློང་དག་རང་གི་རྒུད་པ་དང་། གཞན་གྱི་རྒུད་པ་དང་། རང་གི་འབྱོར་པ་དང་། གཞན་གྱི་འབྱོར་པ་ལ་ཡང་དང་ཡང་དུ་སོ་སོར་རྟོགས་ཤིག་།
K01vinv01_u:1207	 pratyavekṣadhvaṃ tat kasya hetor ātmavipattiḥ bhikṣavaḥ saṃvejanīyaṃ sthānaṃ paravipattiḥ	K01D0001_H0001:179b-19	དེ་ཅིའི་ཕྱིར་ཞེ་ན་། དགེ་སློང་དག་རང་གི་རྒུད་པ་དང་། གཞན་གྱི་རྒུད་པ་ནི་ཀུན་ཏུ་སྐྱོ་བར་འགྱུར་བའི་གནས་ཡིན་ལ་།
K01vinv01_u:1208	 ātmasaṃpattiḥ parasaṃpattiḥ saṃvejanīyaṃ sthānam iti /	K01D0001_H0001:180a-0	རང་གི་འབྱོར་པ་༄༡༨༠ཨ་༌༎ དང་། གཞན་གྱི་འབྱོར་པ་ཡང་ཀུན་ཏུ་སྐྱོ་བར་འགྱུར་བའི་གནས་ཡིན་པའི་ཕྱིར་རོ་༎
K01vinv01_u:1209	 yāvad apareṇa samayena bhikṣavaḥ śmaśānacārikāṃ caranti /	K01D0001_H0001:180a-3	ཇི་ཙམ་དུས་གཞན་ཞིག་ན་དགེ་སློང་རྣམས་དུར་ཁྲོད་རྒྱུར་འདོད་པ་ན་།
K01vinv01_u:1210	 so 'pi tais sārdhaṃ śmaśānacārikāṃ carati /	K01D0001_H0001:180a-4	དགེ་སློང་དེ་ཡང་དེ་རྣམས་དང་ལྷན་ཅིག་ཏུ་དུར་ཁྲོད་རྒྱུར་སོང་བ་ལས་།
K01vinv01_u:1211	 tena te caurā dṛṣṭāḥ praghātitāḥ sāsrukaṇṭho vyavasthitaḥ bhikṣavaḥ kathayanty āyuṣmantaḥ īdṛśo 'py ayaṃ bhadrāśayo navapravrajita iti /  sa muktakenaiva kaṇṭhena roditum ārabdhaḥ bhikṣubhir ucyate āyuṣmaṃ kasyārthe (Pravr-v IV 36)	K01D0001_H0001:180a-5	དེས་ཆོམ་རྐུན་པ་དེ་དག་བསད་པ་མཐོང་ནས་། མཆི་མས་བརྣངས་ཏེ་འདུག་པར་གྱུར་པ་དང་། དགེ་སློང་རྣམས་ཀྱིས་སྨྲས་པ་། ཚེ་དང་ལྡན་པ་དག་གསར་བུ་རབ་ཏུ་བྱུང་བ་ཡིན་ཡང་བསམས་པ་འདི་འདྲ་བར་བཟང་ངོ་༎ དེས་སྐད་ཕྱུང་སྟེ་ངུ་བར་བརྩམས་པ་དང་། དགེ་སློང་རྣམས་ཀྱིས་སྨྲས་པ་། ཚེ་དང་ལྡན་པ་ཁྱོད་ཅིའི་ཕྱིར་ཆོ་ངེས་འདེབས་།
K01vinv01_u:1214	 sa kathayaty ayaṃ me pitā ayaṃ me bhrātā ayaṃ me pitṛvyo 'yaṃ me mātula iti /	K01D0001_H0001:180a-10	དེས་སྨྲས་པ་། འདི་ནི་བདག་གི་ཕའོ་༎ འདི་ནི་བདག་ཅག་གི་ཕུ་ནུའོ་༎ འདི་ནི་བདག་ཅག་གི་ཁོ་བོའོ་༎ འདི་ནི་ཞང་པོའོ་༎
K01vinv01_u:1215	 te kathayanty ebhir arhanto jīvitād vyavaropitā mā tvayāpi vyavaropitāḥ sa kathayati vyavaropitāḥ /	K01D0001_H0001:180a-15	དེ་རྣམས་ཀྱིས་སྨྲས་པ་། འདི་རྣམས་ཀྱིས་དགྲ་བཅོམ་པ་སྲོག་དང་ཕྲལ་ན་། ཁྱོད་ཀྱིས་ཀྱང་དགྲ་བཅོམ་པ་སྲོག་དང་ཕྲལ་ལམ་། ངེས་སྨྲས་པ་།
K01vinv01_u:1216	 etat prakaraṇaṃ bhikṣavo bhagavata (52v = GBM 6.705)  bhagavān āha //	K01D0001_H0001:180a-20	བཅོམ་ལྡན་འདས་ལ་དགེ་སློང་རྣམས་ཀྱིས་གསོལ་པ་དང་། བཅོམ་ལྡན་འདས་ཀྱིས་བཀའ་སྩལ་པ་།
K01vinv01_u:1219	 arhadghātako 'yaṃ bhikṣavaḥ pudgalo nāśayata yūyam arhadghātakaṃ pudgalam asmād dharmavinayād aprarohaṇadharmā arhadghātakaḥ pudgalo 'smin dharmavinaye	K01D0001_H0001:180a-21	དགེ་སློང་དག་གང་ཟག་འདི་ནི་དགྲ་བཅོམ་པ་བསད་པ་ཡིན་ཏེ་། དགེ་སློང་དག་ཁྱེད་ཀྱིས་གང་ཟག་དགྲ་བཅོམ་པ་བསད་པ་། ཆོས་འདུལ་བ་འདི་ལས་བསྙིལ་བར་བྱའོ་༎ འགའ་ཞིག་གི་གན་དུ་རབ་ཏུ་༄༡༨༠བ་འབྱུང་བར་འདོད་པ་འོངས་ན་།
K01vinv01_u:1220	 tasmāt tarhi bhikṣavo yasya kasyacit pravrajyāpekṣa upasaṃkrāmati sa tena praṣṭavyo māsy arhadghātaka iti apṛṣṭvā pravrājayaty upasaṃpādayati sātisāro bhavati // //  āyuṣmān upālī buddhaṃ bhagavantaṃ pṛcchati /	K01D0001_H0001:180b-1	དེས་དེ་ལ་དགྲ་བཅོམ་པ་བསད་པ་མ་ཡིན་ནམ་ཞེས་དྲི་བར་བྱའོ་༎ མ་དྲིས་པར་རབ་ཏུ་འབྱིན་པར་བྱེད་། བསྙེན་པར་རྫོགས་པར་བྱེད་ན་འགལ་ཚབས་ཅན་དུ་འགྱུར་རོ༏་༏སངས་རྒྱས་བཅོམ་ལྡན་འདས་ལ་ཚེ་དང་ལྡན་པ་ཉེ་བར་འཁོར་གྱིས་ཞུས་པ་།
K01vinv01_u:1222	 yena bhadanta pūrvikāyāṃ pravrajyāyāṃ tathāgatasya śrāvakasaṃgho bhinnaḥ sacet sa ākāṃkṣet svākhyāte dharmavinaye pravrajyām upasaṃpadaṃ bhikṣubhāvaṃ	K01D0001_H0001:180b-4	བཙུན་པ་གང་གི་སྔོན་རབ་ཏུ་ཕྱུང་བ་ན་། དེ་བཞིན་གཤེགས་པའི་ཉན་ཐོས་ཀྱི་དགེ་འདུན་ཕྱེ་བ་དེ་གལ་ཏེ་ལེགས་པར་གསུངས་པའི་ཆོས་འདུལ་བ་ལ་རབ་ཏུ་འབྱུང་བ་དང་། བསྙེན་པ་རྫོགས་པ་དགེ་སློང་གི་དངོས་པོ་འཚལ་ན་།
K01vinv01_u:1223	 pravrājayitavyo na pravrājayitavyaḥ /  na pravrājayitavya upāliṃ /	K01D0001_H0001:180b-6	རབ་ཏུ་དབྱུང་བར་བགྱིའམ་། རབ་ཏུ་དབྱུང་བར་མི་བགྱི་། ཉེ་བར་འཁོར་རབ་ཏུ་དབྱུང་བར་མི་བྱའོ་༎
K01vinv01_u:1225	 tasmāt tarhi yasya kasyacit pravrajyāpekṣa upasaṃkrāmati sa tena praṣṭavyo māsi saṃghabhedaka ity apṛṣṭvā pravrājayati sātisāro bhavati //	K01D0001_H0001:180b-9	དེ་ལྟ་བས་ན་འགའ་ཞིག་གི་གན་དུ་རབ་ཏུ་འབྱུང་བར་འདོད་པ་འོངས་ན་། དེས་ན་དེ་ལ་དགེ་འདུན་གྱི་དབྱེན་བྱས་པ་མ་ཡིན་ནམ་ཞེས་དྲི་བར་བྱའོ་༎ མ་དྲིས་པར་རབ་ཏུ་འབྱིན་པར་བྱེད་ན་འགལ་ཚབས་ཅན་དུ་འགྱུར་རོ་༎
K01vinv01_u:1226	 āyuṣmān upālī buddhaṃ bhagavantaṃ pṛcchati /	K01D0001_H0001:180b-12	སངས་རྒྱས་བཅོམ་ལྡན་འདས་ལ་ཚེ་དང་ལྡན་པ་ཉེ་བར་འཁོར་གྱིས་ཞུས་པ་།
K01vinv01_u:1227	 yena bhadanta tathāgatasyāntike duṣṭacittarudhiram utpāditaṃ sa ākāṃkṣaṃ svākhyāte dharmavinaye pravrajyām upasaṃpadaṃ bhikṣubhāvaṃ /	K01D0001_H0001:180b-13	བཙུན་པ་གང་གིས་དེ་བཞིན་གཤེགས་པ་ལ་ངན་སེམས་ཀྱིས་ཁྲག་ཕྱུང་བ་གལ་ཏེ་ལེགས་པར་གསུངས་པའི་ཆོས་འདུལ་བ་ལ་རབ་ཏུ་འབྱུང་བ་དང་། བསྙེན་པར་རྫོགས་པ་དགེ་སློང་གི་དངོས་པོ་འཚལ་ན་། རབ་ཏུ་དབྱུང་བར་བགྱིའམ་། རབ་ཏུ་དབྱུང་བར་མི་བགྱི་།
K01vinv01_u:1228	 pravrājayitavyo na pravrājayitavyaḥ na pravrājayitavya upāliṃ /	K01D0001_H0001:180b-16	ཉེ་བར་འཁོར་རབ་ཏུ་དབྱུང་བར་མི་བྱའོ་༎ དེ་ལྟ་བས་ན་འགའ་ཞིག་གི་གན་དུ་རབ་ཏུ་འབྱུང་བར་འདོད་པ་འོངས་ན་།
K01vinv01_u:1229	 tasmāt tarhi yasya kasyacit pravrajyāpekṣa upasaṃkrāmati sa tena praṣṭavyo māsi tathāgatasyāntike duṣṭacittarudhirotpādaka ity apṛṣṭvā pravrājayati sātisāro bhavati / //	K01D0001_H0001:180b-18	དེས་དེ་ལ་དེ་བཞིན་གཤེགས་པ་ལ་ངན་སེམས་ཀྱིས་ཁྲག་ཕྱུང་བ་མ་ཡིན་ནམ་ཞེས་དྲི་བར་བྱའོ་༎ མ་དྲིས་པར་རབ་ཏུ་འབྱིན་པར་བྱེད་ན་འགལ་ཚབས་༄༡༨༡ཨ་༌༎ ཅན་དུ་འགྱུར་རོ་༎
K01vinv01_u:1230	 āyuṣmān upālī buddhaṃ bhagavantaṃ pṛcchati /	K01D0001_H0001:181a-2	སངས་རྒྱས་བཅོམ་ལྡན་འདས་ལ་ཚེ་དང་ལྡན་པ་ཉེ་བར་འཁོར་གྱིས་ཞུས་པ་།
K01vinv01_u:1231	 yo bhadanta pūrvikāyāṃ pravrajyāyāṃ caturṇāṃ pārājikānām anyatamānyatamām āpattim āpannaḥ sacet sa ākāṃkṣet svākhyāte dharmavinaye pravrajyām upasaṃpadaṃ bhikṣubhāvaṃ /	K01D0001_H0001:181a-3	བཙུན་པ་སྔོན་གང་རབ་ཏུ་འབྱུང་བ་ན་ཕམ་པར་གྱུར་པ་བཞི་ལས་ལྟུང་བ་གང་ཡང་རུང་བ་བྱུང་བ་དེ་། གལ་ཏེ་ལེགས་པར་གསུངས་པའི་ཆོས་འདུལ་བ་ལ་རབ་ཏུ་འབྱུང་བ་དང་། བསྙེན་པར་རྫོགས་པ་དགེ་སློང་གི་དངོས་པོ་འཚལ་ན་།
K01vinv01_u:1232	 pravrājayitavyo na pravrājayitavyaḥ na pravrājayitavya upāliṃ //	K01D0001_H0001:181a-5	རབ་ཏུ་དབྱུང་བར་བགྱིའམ་། ཉེ་བར་འཁོར་རབ་ཏུ་དབྱུང་བར་མི་བྱའོ་༎
K01vinv01_u:1233	 tasmāt tarhi yasya kasyacit pravrajyāpekṣa upasaṃkrāmati sa tena praṣṭavyo māsi caturṇāṃ  pārājikānām anyatamānyatamām āpattim āpanna ity apṛṣṭvā pravrājayati upasaṃpādayati  vā sātisāro bhavati // //	K01D0001_H0001:181a-9	དེས་དེ་ལ་ཕམ་པར་འགྱུར་བ་བཞི་ལས་ལྟུང་བ་གང་ཡང་རུང་བ་བྱུང་བ་མ་ཡིན་ནམ་ཞེས་དྲི་བར་བྱའོ་༎ མ་དྲིས་པར་རབ་ཏུ་འབྱིན་པར་བྱེད་ན་འགལ་ཚབས་ཅན་དུ་འགྱུར་རོ་༎
K01vinv01_u:1236	 buddho bhagavāṃ śrāvastyāṃ viharati jetavane 'nāthapiṇḍadasyārāme /	K01D0001_H0001:181a-11	སངས་རྒྱས་བཅོམ་ལྡན་འདས་མཉན་ཡོད་ན་། རྒྱལ་བྱེད་ཀྱི་ཚལ་མགོན་མེད་ཟས་སྦྱིན་གྱི་ཀུན་དགའ་ར་བ་ན་བཞུགས་སོ་༎
K01vinv01_u:1125	 uddhṛto narakatiryakpretebhyaḥ pādaḥ pratiṣṭhāpito devamanuṣyeṣv	K01D0001_H0001:172a-6	སེམས་ཅན་དམྱལ་བ་དང་། དུད་འགྲོ་དང་། ཡི་དབ༹གས་དག་ནས་ནི་རྐང་པ་ཕྱུང་། ལྷ་དང་མི་རྣམས་ཀྱི་ནང་དུ་བཞག་གོ་ཞེས་ལན་གསུམ་ཆེད་དུ་བརྗོད་པ་ཆེད་དུ་བརྗོད་དོ༏་༏ཡང་སྨྲས་པ་།
K01vinv01_u:1129	 tvadāśrayāc cāptaṃ apetadoṣaṃ mayādya śuddhaṃ suviśuddha cakṣuḥ	K01D0001_H0001:172a-12	ཤིན་ཏུ་རྣམ་དག་ཁྱོད་བརྟེན་བདག་གིས་ནི་༎ དེ་རིང་སྐྱོན་བྲལ་དག་པའི་མིག་ཐོབ་ཅིང་༎
K01vinv01_u:1130	 prāptaṃ ca śāntaṃ padam āryakāntaṃ tīrṇaś ca duḥkhārṇavapāram asmi /	K01D0001_H0001:172a-14	གོ་འཕང་ཞི་བ་འཕགས་པ་དགྱེས་ཐོབ་སྟེ་༎ སྡུག་བསྔལ་རྒྱ་མཚོ་ཕ་རོལ་རྒལ་བར་གྱུར་༎
K01vinv01_u:1131	 jagati daityanarāmarapūjitaṃ vigatajanmajarāmaraṇāmayaṃ /	K01D0001_H0001:172a-16	འགྲོ་བ་ལྷ་མིན་མི་དང་ལྷས་མཆོད་པ་༎ སྐྱེ་དང་རྒ་དང་ན་འཆི་བྲལ་བ་པོ་༎
K01vinv01_u:1132	 bhavasahasrasudurlabhadarśanaṃ saphalam adya mune tava darśanam* //	K01D0001_H0001:172a-18	སྲིད་པ་སྟོང་དུ་མཐོང་བར་རབ་དཀོན་པ་༎ ཐུབ་པ་དེ་རིང་ཁྱོད་མཐོང་འབྲས་བུ་མཆིས་༎
K01vinv01_u:1133	 avanamya tataḥ pralambahāraś caraṇau dvāv abhivandya jātaharṣaḥ	K01D0001_H0001:172a-20	དེ་ནས་འདུད་བྱས་དོ་ཤལ་རབ་འཕྱང་བས་༎ ཞབས་ལ་ཕྱག་འཚལ་རངས་པ་སྐྱེས་གྱུར་ནས་༎ དགྲ་ཐུལ་ག-ཡས་ནས་ཡོངས་སུ་བསྐོར་བྱས་ཏེ་༎
K01vinv01_u:1134	 praṇipatya ca dakṣiṇaṃ jitāriṃ suralokābhimukho divaṃ jagāma /	K01D0001_H0001:172a-23	ལྷ་ཡི་འཇིག་རྟེན་མངོན་ཕྱོགས་མཁའ་ལ་སོང་༎
K01vinv01_u:1135	 atha narakapūrvī devaputro vaṇig iva labdhalābhaḥ sasyasampanna iva kārṣakaḥ śūra  iva vijitasaṃgrāmaḥ sarvarogaparimukta ivāturo yayā vibhūtyā bhagavatsakāśam āgataḥ  tayaiva vibhūtyā svabhavanaṃ gataḥ	K01D0001_H0001:172a-24	དེ་ནས་སྔོན་སེམས་ཅན་དམྱལ་བ་ལྷའི་བུ་ཚོང་པ་ཁེ་སྤོགས་རྙེད་པ་ལྟ་བུ་དང་། ཞིང་པ་ལོ་ཏོག་འབྱོར་པ་ལྟ་བུ་དང་། དཔའ་བོ་ག-ཡུལ་ལས་རྣམ་པར་རྒྱལ་བ་ལྟ་བུ་དང་། ནད་པ་ནད་ཐམས་ཅད་ལས་ཡོངས་སུ་ཐར་བ་ལྟ་བུར་གྱུར་ཏེ་། ཆ་ལུགས་༄༡༧༢བ་གང་གིས་བཅོམ་ལྡན་འདས་ཀྱི་སྤྱན་སྔར་འོངས་པའི་ཆ་ལུགས་དེ་ཉིད་ཀྱིས་རང་གི་གནས་སུ་སོང་ངོ་༎
K01vinv01_u:1141	 sa saṃlakṣayati vayan nāma īdṛśaṃ pānīyaṃ pibāma upādhyāyo 'py avīcau mahānarake kvathitaṃ tāmrarasaṃ pāsyatīti /	K01D0001_H0001:172b-5	དེས་བསམས་པ་། བདག་ཅག་ནི་ཆུ་ཤིན་ཏུ་གྲང་མོ་འདི་ལྟ་བུ་འཐུང་ན་། མཁན་པོ་ནི་སེམས་ཅན་དམྱལ་བ་ཆེན་པོ་མནར་མེད་པ་ན་། ཟངས་ཁུ་བསྐོལ་བ་འཐུང་ངོ་སྙམ་ནས་།
K01vinv01_u:1142	 so 'vīciṃ mahānarakaṃ vyavalokayitum ārabdho na paśyati	K01D0001_H0001:172b-9	དེས་སེམས་ཅན་དམྱལ་བ་ཆེན་པོ་མནར་མེད་པར་རྣམ་པར་བལྟ་བ་བརྩམས་ན་། མི་སྣང་ངོ་།
K01vinv01_u:1143	 tiraścaḥ pretāṃś ca manuṣyāṃ anyāṃś ca narakāṃs teṣv api na paśyati yāvad devāṃ vyavalokayitum	K01D0001_H0001:172b-11	༏དུད་འགྲོ་དང་། ཡི་དབ༹གས་དང་། མི་དང་སེམས་ཅན་དམྱལ་བ་གཞན་རྣམས་སུ་ཡང་རྣམ་པར་བལྟས་ན་། དེ་རྣམས་ན་ཡང་མི་སྣང་ནས་ལྷ་རྣམས་ཀྱི་བར་གྱི་ནང་དུ་རྣམ་པར་བལྟ་བར་བརྩམས་ན་།
K01vinv01_u:1144	 ārabdhaḥ paśyati cāturmahārājikeṣu deveṣūpapannaḥ devabhūtena ca bhagavato 'ntike  satyadarśanaṃ kṛtaṃ deveṣūccāvatiṣṭhantaṃ /	K01D0001_H0001:172b-13	རྒྱལ་ཆེན་བཞིའི་ལྷ་རྣམས་ཀྱི་ནང་དུ་སྐྱེས་ཏེ་། ལྷར་གྱུར་པས་། བཅོམ་ལྡན་འདས་ཀྱི་སྤྱན་སྔར་བདེན་པ་མཐོང་བར་བྱས་ཏེ་། ལྷ་རྣམས་ཀྱི་ནང་ན་འདུག་པ་མཐོང་ནས་།
K01vinv01_u:1146	 sa smitapūrvaṃgamo bhagavati labdhaprasāda udānam udānayam* /	K01D0001_H0001:172b-17	འཛུམ་པ་སྔོན་དུ་བཏང་སྟེ་། བཅོམ་ལྡན་འདས་ལ་དད་པ་ཐོབ་ནས་།
K01vinv01_u:1147	 aho buddha /	K01D0001_H0001:172b-19	ཀྱེ་མ་སངས་རྒྱས་།
K01vinv01_u:1148	 aho dharma aho saṃgha :	K01D0001_H0001:172b-20	ཀྱེ་མ་ཆོས་། ཀྱེ་མ་དགེ་འདུན་།
K01vinv01_u:127	 tasya pūrvapakṣo dattaḥ tena paṃcaśatiko daṇḍas samuccārito māṭhareṇa pratyuccārya doṣo dattaḥ /	K01D0001_H0001:12b-10	བྲམ་ཟེ་དེ་ཕྱོགས་སྔ་མ་བྱེད་དུ་བཅུག་ནས་། དེས་རྒྱུད་ཆགས་ལྔ་བརྒྱ་བཟླས་སོ་༎ གནས་ལེན་གྱིས་བུས་ཕྱིར་བཟླས་ཏེ་། ཁྱོད་ཀྱི་འདི་ནི་རིགས་པ་མེད་པ་ཡིན་ནོ་༎
K01vinv01_u:128	 idaṃ te ayuktam idam asadṛśam idaṃ nopapadyata iti /  sa tūṣṇīm avasthitaḥ	K01D0001_H0001:12b-14	འདི་ནི་མི་མཐུན་པ་ཡིན་ནོ་༎ འདི་ནི་མི་འཐད་པ་ཡིན་ནོ་༎ ཞེས་སྐྱོན་བཏགས་པ་དང་། བྲམ་ཟེ་དེ་ཅང་མི་སྨྲ་བར་འདུག་གོ་། ཚར་གཅད་པའི་གནས་ཀྱི་ནང་ན་འདི་ལྟ་སྟེ་། ལན་ལ་སྤོབས་པ་མེད་པ་འདི་ནི་ཐ་ཆད་ཡིན་ནོ་༎
K01vinv01_u:13	 te śabditāḥ sa kathayati /	K01D0001_H0001:7a-9	བདག་ཅག་ཨཨང་གའི་རྒྱལ་པོའི་གན་དུ་དོང་སྟེ་སྦྲན་པར་བྱའོ་སྙམ་ནས་།
K01vinv01_u:130	 4r6 (Pravr-v II): /// rājā amātyān āmantrayate /	K01D0001_H0001:12b-19	རྒྱལ་པོས་བློན་པོ་རྣམས་ལ་སྨྲས་པ་།
K01vinv01_u:131	 kataro 'tra bhavantaś śobhata iti /	K01D0001_H0001:12b-20	ཤེས་ལྡན་དག་སུ་རྒྱལ་།
K01vinv01_u:132	 te kathayanti devopādhyāyo māṭhara iti /	K01D0001_H0001:12b-21	ལྷ་། མཁན་པོ་གནས་ལེན་གྱི་བུའོ་༎
K01vinv01_u:133	 tato rājā āttamanās saṃvṛttaḥ tasya me lābhās sulabdhā yasya me vijite evaṃvidhā	K01D0001_H0001:12b-22	དེ་ནས་རྒྱལ་པོ་ཡིད་དགའ་ཞིང་ཡིད་དགའ་ནས་། རོ་སྟོད་བསྲང་སྟེ་ལག་པ་ག-ཡས་པ་བརྐྱང་ནས་།
K01vinv01_u:134	 4r7 (Pravr-v II): /// nivasati /  deva nāladagrāmake /	K01D0001_H0001:12b-24	བདག་གི་ཡུལ་ན་སྨྲ་བའི་ཁྱུ་མཆོག་འདི་ལྟ་བུ་དག་ཡོད་པ་ནི་བདག་གིས་རྙེད་པ་ལེགས་པར་རྙེད་དོ་ཞེས་ཆེད་དུ་བརྗོད་པ་ཆེད་དུ་བརྗོད་ནས་སྨྲས་པ་། མཁན་པོ་ཁྱོད་གནས་གང་ན་གནས་། གནས་ལེན་གྱིས་བུས་སྨྲས་པ་། ལྷ་གྲོང་ན་ལ་ད་ནའོ་༎ ཁྱོད་སོང་ལ་གྲོང་དེ་ཁྱོད་ཀྱི་རྒོལ་བའི་ལོངས་སྤྱོད་གྱིས་ཤིག་། གནས་ལེན་གྱི་བུ་རངས་པ་དང་༄༡༣ཨ་༌༎ དགའ་བ་དང་། མཆོག་ཏུ་དགའ་བར་གྱུར་ནས་།
K01vinv01_u:137	 sa tasya vādibhogo dattaḥ saṃpattikāmo loko vipattipratikūlaḥ so 'nekair brāhmaṇaiḥ kanyānimittaṃ prārthyate / tatas tena  4r8 (Pravr-v II): /// paricārayati /	K01D0001_H0001:13a-3	འཇིག་རྟེན་ནི་འབྱོར་པ་འདོད་ཅིང་། རྒུད་པ་ལ་མ་དད་པ་ཡིན་པས་། དེ་ལ་བྲམ་ཟེ་དུ་མ་ཞིག་གིས་བུ་མོ་ཆུང་མར་ལེན་དུ་བཅུག་པ་དང་། དེ་ནས་གནས་ལེན་གྱི་བུ་དེས་རིགས་མཉམ་པ་ལས་ཆུང་མ་བླངས་ཏེ་།
K01vinv01_u:139	 tasya krīḍato ramamāṇasya paricārayataḥ putro jāto dīrghadīrghābhyāṃ koṣṭhābhyāṃ	K01D0001_H0001:13a-6	དེ་དེ་དང་ལྷན་ཅིག་རྩེ་བར་བྱེད་དགའ་བར་བྱེད་། དགའ་མགུར་སྤྱོད་པར་བྱེད་དོ༏་༏རྩེ་བར་བྱེད་། དགའ་མགུར་སྤྱོད་པར་བྱེད་པ་དེའི་ཆུང་མ་ལ་བུ་རོ་སྟོད་རིང་བ་རིང་བ་ཞིག་བཙས་ནས་།
K01vinv01_u:14	 bhavantaḥ so 'pi rājā kṣatriyo mūrdhābhiṣikto vayam api rājānaḥ kṣatriyā + +  2r7 (Pravr-v II): /// udgrāhayiṣyatheti /	K01D0001_H0001:7a-11	ལྷ་བདག་ཅག་ལྷའི་ཞོ་ཤས་འཚོ་བ་ལགས་ཏེ་། བདག་ཅག་ལྷའི་ལོ་ཐང་དང་དཔྱ་སྡུད་པ་ན་།
K01vinv01_u:140	 tasya vistareṇa jātasya jātimahaṃ kṛtvā koṣṭhila iti nāmadheyaṃ vyavasthāpitaṃ koṣṭhilo	K01D0001_H0001:13a-10	དེའི་ཉེ་དུ་དག་འདུས་ཤིང་ལྷགས་ནས་། ཉི་མ་བདུན་གསུམ་ཉི་ཤུ་རྩ་གཅིག་ཏུ་བཙས་པའི་བཙས་སྟོན་རྒྱ་ཆེར་བྱས་ཏེ་།
