src_segmentnr	src_original	tgt_segmentnr	tgt_original
K02sspp2_4u:4131	 ye 'pi te 'bhūvann atīte 'dhvani tathāgatā arhantaḥ samyaksaṃbuddhās te 'pīmām eva prajñāpāramitāṃ āgamyānuttarāṃ samyaksaṃbodhim abhisaṃbuddhāḥ,  ye 'pi te bhaviṣyanty anāgate 'dhvani tathāgatārhantaḥ samyaksaṃbuddhās te 'pīmām eva prajñāpāramitām āgamyānuttarāṃ samyaksaṃbodhim abhisaṃbhotsyante,	K03D0009-2_H0010-2:138b-12	འདས་པའི་དུས་ཀྱི་དེ་བཞིན་གཤེགས་པ་དགྲ་བཅོམ་པ་ཡང་དག་པར་རྫོགས་པའི་སངས་རྒྱས་གང་ཇི་སྙེད་ཅིག་བྱུང་བ་དེ་དག་ཀྱང་། ཤེས་རབ་ཀྱི་ཕ་རོལ་ཏུ་ཕྱིན་པ་འདི་ཉིད་ལ་བརྟེན་ཏེ་། བླ་ན་མེད་པ་ཡང་དག་པར་རྫོགས་པའི་བྱང་ཆུབ་ཏུ་མངོན་པར་རྫོགས་པར་སངས་རྒྱས་སོ་༎ མ་འོངས་པའི་དུས་ཀྱི་དེ་བཞིན་གཤེགས་པ་དགྲ་བཅོམ་པ་ཡང་དག་པར་རྫོགས་པའི་སངས་རྒྱས་གང་ཇི་སྙེད་ཅིག་འབྱུང་བ་དེ་དག་ཀྱང་། ཤེས་རབ་ཀྱི་ཕ་རོལ་ཏུ་ཕྱིན་པ་འདི་ཉིད་ལ་བརྟེན་ཅིང་། བླ་ན་མེད་པ་ཡང་དག་པར་རྫོགས་པའི་བྱང་ཆུབ་ཏུ་མངོན་པར་རྫོགས་པར་འཚང་རྒྱའོ་༎
K02sspp2_4u:4133	 ye 'pi te etarhi daśadig lokadhātuṣv aprameyeṣv asaṃkhyeyeṣu tathāgatā arhantaḥ samyaksaṃbuddhās tiṣṭhanti dhhriyante yāpayanti dharmaṃ deśayanti,	K03D0009-2_H0010-2:138b-18	ད་ལྟར་བྱུང་བའི་ཕྱོགས་བཅུའི་འཇིག་རྟེན་གྱི་ཁམས་ཚད་མེད་གྲངས་མེད་པ་དག་ན་། དེ་བཞིན་གཤེགས་པ་དགྲ་༄༡༣༩ཨ་༌༎
K02sspp2_4u:4134	 te 'pīmām eva prajñāpāramitāyām āgamyānuttarāṃ samyaksaṃbodhim abhisaṃbudhyante,	K03D0009-2_H0010-2:139a-1	བཅོམ་པ་ཡང་དག་པར་རྫོགས་པའི་སངས་རྒྱས་གང་ཇི་སྙེད་ཅིག་བཞུགས་ཤིང་འཚོ་སྐྱོང་བ་དང་། ཆོས་སྟོན་པ་དེ་དག་ཀྱང་ཤེས་རབ་ཀྱི་ཕ་རོལ་ཏུ་ཕྱིན་པ་འདི་ཉིད་ལ་བརྟེན་ཏེ་། བླ་ན་མེད་པ་ཡང་དག་པར་རྫོགས་པའི་བྱང་ཆུབ་ཏུ་མངོན་པར་རྫོགས་པར་སངས་རྒྱས་སོ་༎
K02sspp2_4u:4135	 ye 'pi te 'bhūvann atītānāṃ tathāgatānām arhatāṃ samyaksaṃbuddhānāṃ śrāvakāḥ,  ye 'pi te bhaviṣyanty anāgatānāṃ tathāgatānām arhatāṃ samyaksaṃbuddhānāṃ śrāvakāḥ,  ye 'py etarhi pratyutpannānāṃ tathāgatānām arhatāṃ samyaksaṃbuddhānāṃ śrāvakāḥ,	K03D0009-2_H0010-2:139a-3	འདས་པའི་དུས་ཀྱི་དེ་བཞིན་གཤེགས་པ་དགྲ་བཅོམ་པ་ཡང་དག་པར་རྫོགས་པའི་སངས་རྒྱས་རྣམས་ཀྱི་ཉན་ཐོས་གང་ཇི་སྙེད་ཅིག་བྱུང་བ་དང་། མ་བྱོན་པའི་དེ་བཞིན་གཤེགས་པ་དགྲ་བཅོམ་པ་ཡང་དག་པར་རྫོགས་པའི་སངས་རྒྱས་རྣམས་ཀྱི་ཉན་ཐོས་གང་ཇི་སྙེད་ཅིག་འབྱུང་བ་དང་།
K02sspp2_4u:418	 ātmanā ca kāmamithyācārāt prativirato bhaviṣyati. parāṃś ca kāmamithyācāravairamaṇyāṃ samādāpayiṣyati kāmamithyācāraviramaṇyāś ca varṇaṃ bhāṣiṣyate,  ye cānye kāmamithyācārāt prativiratā bhaviṣyanti,  ātmanā ca mṛṣāvādāt prativirato bhaviṣyati. parāṃś ca mṛṣāvādavairamaṇyāṃ samādāpayiṣyati mṛṣāvādavairamaṇyāś ca varṇaṃ bhāṣiṣyate,  ye cānye mṛṣāvādāt prativiratā bhaviṣyanti,  teṣām api varṇavādī bhaviṣyati samanujñaḥ,	K03D0009-2_H0010-2:70b-13	གཞན་ཡང་སྲོག་གཅོད་པ་སྤོང་བ་ལ་ཡང་དག་པར་སྐུལ་བར་འགྱུར་རོ་༎
K02sspp2_4u:4140	 anāgāmiphalaṃ prāptāḥ prāpsyanti prāpnuvanti ca,  arhattvaṃ prāptāḥ prāpsyanti prāpnuvanti ca,  ye 'pi te 'bhūvann atite 'dhvani pratyekabuddhāḥ,  ye 'pi te bhaviṣyanty anāgate 'dhvani pratyekabuddhā,  ye 'pi te etarhi aprameyāsaṃkhyeyeṣu lokadhātuṣu pratyekabuddhās tiṣṭhanti dhriyante	K03D0009-2_H0010-2:139a-6	རྒྱུན་དུ་ཞུགས་པའི་འབྲས་བུ་དང་། ལན་གཅིག་ཕྱིར་འོང་བའི་འབྲས་བུ་དང་། ཕྱིར་མི་འོང་བའི་འབྲས་བུ་དང་། དགྲ་བཅོམ་པ་ཉིད་ཐོབ་བོ་༎ འཐོབ་བོ་༎ འཐོབ་པར་འགྱུར་རོ་༎
K02sspp2_4u:4145	 yāpayanti tair apīmām eva prajñāpāramitām āgamya pratyekabodhiḥ prāptāḥ prāpsyate	K03D0009-2_H0010-2:139b-0	ཤེས་རབ་ཀྱི་ཕ་༄༡༣༩བ་རོལ་ཏུ་ཕྱིན་པ་འདི་ཉིད་ལ་བརྟེན་ཏེ་རང་བྱང་ཆུབ་ཐོབ་བོ་༎ འཐོབ་བོ་༎ འཐོབ་པར་འགྱུར་རོ་༎
K02sspp2_4u:4146	 prāpyate ca. tat kasya hetoḥ?	K03D0009-2_H0010-2:139b-2	དེ་ཅིའི་ཕྱིར་ཞེ་ན་།
K02sspp2_4u:4147	 tathā hy atra prajñāpāramitāyā sarvāṇi trīṇi yānāni vistareṇopadiṣṭāni,	K03D0009-2_H0010-2:139b-3	འདི་ལྟར་ཤེས་རབ་ཀྱི་ཕ་རོལ་ཏུ་ཕྱིན་པ་འདི་ལས་ཐེག་པ་གསུམ་པོ་ཐམས་ཅད་རྒྱ་ཆེར་བསྟན་ཏེ་།
K02sspp2_4u:4148	 tāni punar animittayogenānupalambhayogenānutpādayogenānirodhayogenāsasaṃkleśayogenāvyavadānayogenānabhisaṃskārayogenānāyūhayogenāniryuhayogenānukṣepayogenāprakṣepayogenānugrahayogenānutsargayogena	K03D0009-2_H0010-2:139b-4	དེ་དག་ཀྱང་མཚན་མ་མེད་པའི་ཚུལ་དང་། དམིགས་པ་མེད་པའི་ཚུལ་དང་། སྐྱེ་བ་མེད་པའི་ཚུལ་དང་། འགག་པ་མེད་པའི་ཚུལ་དང་། ཀུན་ནས་ཉོན་མོངས་པ་མེད་པ་དང་། རྣམ་པར་བྱང་བ་མེད་པའི་ཚུལ་དང་། མངོན་པར་འདུ་བྱ་བ་མེད་པའི་ཚུལ་དང་། ཞེན་པ་མེད་པ་དང་། འདོར་བ་མེད་པའི་ཚུལ་དང་། དབྲི་བ་མེད་པ་དང་། བསྣན་པ་མེད་པའི་ཚུལ་དང་། བླང་བ་མེད་པ་དང་། སྤང་བ་མེད་པའི་ཚུལ་གྱིས་བསྟན་ཏེ་།
K02sspp2_4u:4149	 tat punar lokavyavahāreṇa na paramārthena. tat kasya hetoḥ?	K03D0009-2_H0010-2:139b-6	དེའང་འཇིག་རྟེན་གྱི་ཐ་སྙད་ཀྱི་ཚུལ་གྱིས་བསྟན་གྱི་། དོན་དམ་པར་ནི་མ་ཡིན་ནོ་༎ དེ་ཅིའི་ཕྱིར་ཞེ་ན་།
K02sspp2_4u:4150	 na hi prajñāpāramitā āramitā na pāramitā na hi prajñāpāramitā apāro na pāraḥ,  na sthalaṃ na nimnaṃ na samaṃ na viṣamaṃ na nimittaṃ nānimittaṃ na laukikī na lokottarā na saṃskṛtā nāsaṃskṛtā na kuśalā nākuśalā nātītā nānāgatā na pratyutpannā,	K03D0009-2_H0010-2:139b-9	ཤེས་རབ་ཀྱི་ཕ་རོལ་ཏུ་ཕྱིན་པ་འདི་ནི་རིང་དུ་སོང་བ་མ་ཡིན་། ཕ་རོལ་ཏུ་ཕྱིན་པ་མ་ཡིན་ཏེ་། ཤེས་རབ་ཀྱི་ཕ་རོལ་ཏུ་ཕྱིན་པ་ནི་ཚུ་རོལ་མ་ཡིན་། ཕ་རོལ་མ་ཡིན་། ཐང་དུ་འདུག་པ་མ་ཡིན་། གཤོང་དུ་འདུག་པ་མ་ཡིན་།
K02sspp2_4u:4156	 na hi kauśika prajñāpāramitā arhaddharmāṇāṃ dātrī na hi kauśika prajñāpāramitā pratyekabuddhadharmāṇāṃ dātrī,  na hi kauśika prajñāpāramitā pṛthagjanadharmāṇāṃ dātrī.  [K. 200b10, N. 395a1, T. 317a9, P. 276a7, Ch. 706a10]	K03D0009-2_H0010-2:139b-29	ཀོཨོ་ཤི་ཀ་། ཤེས་རབ་ཀྱི་ཕ་རོལ་ཏུ་ཕྱིན་༄༡༤༠ཨ་༌༎ པ་ནི་སངས་རྒྱས་ཀྱི་ཆོས་རྣམས་ཉེ་བར་བསྒྲུབ་པ་མ་ཡིན་ཏེ་། དགྲ་བཅོམ་པའི་བར་གྱི་ཆོས་རྣམས་དང་། རང་སངས་རྒྱས་ཀྱི་ཆོས་རྣམས་ཉེ་བར་བསྒྲུབ་པ་མ་ཡིན༏་སོ་སོའི་སྐྱེ་བོའི་ཆོས་རྣམས་འདོར་བ་མ་ཡིན་ནོ་༎
K02sspp2_4u:424	 ātmanā ca paiśunyāt prativirato bhaviṣyati,  parāṃś ca paiśunyavairamaṇyāṃ samādāpayiṣyati,  paiśunyavairamaṇyāś ca varṇaṃ bhāṣiṣyati, ye cānye (ŚsP_II-4_11)  paiśūnyāt prativiratā bhaviṣyanti,  teṣām api varṇavādī bhaviṣyati samanujñaḥ,  ātmanā ca pāruṣyāt prativirato bhaviṣyati,	K03D0009-2_H0010-2:70b-14	སྲོག་གཅོད་པ་སྤོང་བའི་ལེགས་པ་རྗོད་པར་།
K02sspp2_4u:4159	 śakra āha: mahāpāramiteyaṃ bhagavan yad uta prajñāpāramitā,	K03D0009-2_H0010-2:140a-3	བརྒྱ་བྱིན་གྱིས་གསོལ་བ་། བཅོམ་ལྡན་འདས་། ཤེས་རབ་ཀྱི་ཕ་རོལ་ཏུ་ཕྱིན་པ་འདི་ནི་ཕ་རོལ་ཏུ་ཕྱིན་པ་ཆེན་པོ་སྟེ་། བཅོམ་ལྡན་འདས་།
K02sspp2_4u:4160	 atra bhagavan bodhisattvā mahāsattvāḥ prajñāpāramitāyāṃ carantaḥ sarvasattvānāṃ cittacaritāni	K03D0009-2_H0010-2:140a-7	བྱང་ཆུབ་སེམས་དཔའ་སེམས་དཔའ་ཆེན་པོ་ཤེས་རབ་ཀྱི་ཕ་རོལ་ཏུ་ཕྱིན་པ་འདི་ལ་སྤྱོད་པ་རྣམས་ནི་། སེམས་ཅན་ཐམས་ཅད་ཀྱི་སེམས་དང་སྤྱོད་པ་ཡང་འཚལ་ཏེ་།
K02sspp2_4u:4161	 prajānanti na sattvam upalabhate na sattvaprajñaptim upalabhate nātmanam upalabhate  na sattvam upalabhate na jīvam upalabhate na jantum upalabhate na poṣam upalabhate  na puruṣam upalabhate na pudgalam upalabhate na manujam upalabhate na mānavam upalabhate	K03D0009-2_H0010-2:140a-9	སེམས་ཅན་དུ་དམིགས་པ་མ་མཆིས་སོ་༎
K02sspp2_4u:4164	 na kārakam upalabhate na vedakam upalabhate na jānakam upalabhate na paśyakam upalabhate.  na rūpam upalabhate,  na vedanām upalabhate,  na saṃjñām upalabhate,  na saṃskārām upalabhate,  na vijñānam upalabhate.	K03D0009-2_H0010-2:140a-10	སེམས་ཅན་དུ་གདགས་པར་དམིགས་པ་མ་མཆིས་སོ་༎
K02sspp2_4u:4170	 na cakṣur upalabhate,  na śrotram upalabhate,  na ghrāṇam upalabhate,  na jihvām upalabhate,  na kāyam upalabhate,  na manasam upalabhate.	K03D0009-2_H0010-2:140a-11	བདག་དང་། སེམས་ཅན་དང་། སྲོག་དང་། འགྲོ་བ་དང་། གསོ་བ་དང་། སྐྱེས་བུ་དང་། གང་ཟག་དང་། ཤེད་ཅན་དང་། ཤེད་བདག་དང་། བྱེད་པ་པོ་དང་། ཚོར་བ་པོ་དང་། ཤེས་པ་པོ་དང་།
K02sspp2_4u:4176	 na rūpam upalabhate,	K03D0009-2_H0010-2:140a-13	གཟུགས་སུ་དམིགས་པ་མ་མཆིས་།
K02sspp2_4u:4200	 na pṛthivīdhātum upalabhate,	K03D0009-2_H0010-2:140b-5	སའི་ཁམས་སུ་དམིགས་པ་མ་མཆིས་།
K02sspp2_4u:4201	 nābdhātum upalabhate,  na tejodhātum upalabhate,  na vāyudhātum upalabhate,  nākāśadhātum upalabhate,  na vijñānadhātum upalabhate.	K03D0009-2_H0010-2:140b-6	ཆུའི་ཁམས་དང་། མེའི་ཁམས་དང་། རླུང་གི་ཁམས་དང་། ནམ་མཁའི་ཁམས་དང་། རྣམ་པར་ཤེས་པའི་ཁམས་སུ་དམིགས་པ་མ་མཆིས་སོ་༎
K02sspp2_4u:4206	 nāvidyām upalabhate,  na saṃskārām upalabhate,  na vijñānam upalabhate,  na nāmarūpam upalabhate,  na ṣaḍāyatanam upalabhate,	K03D0009-2_H0010-2:140b-7	མ་རིག་པར་དམིགས་པ་མ་མཆིས་།
K02sspp2_4u:4211	 na sparśam upalabhate,  na vedanām upalabhate,  na tṛṣṇām upalabhate,  nopādānam upalabhate,  na bhavam upalabhate,  na jātim upalabhate,  na jarāmaraṇam upalabhate.	K03D0009-2_H0010-2:140b-8	འདུ་བྱེད་དང་། རྣམ་པར་ཤེས་པ་དང་། མིང་དང་གཟུགས་དང༏་སྐྱེ་མཆེད་དྲུག་དང་། རེག་པ་དང་། ཚོར་བ་དང་། སྲེད་པ་དང་། ལེན་པ་དང་། སྲིད་པ་དང་། སྐྱེ་བ་དང་། རྒ་ཤིར་དམིགས་པ་མ་མཆིས་སོ་༎
K02sspp2_4u:4218	 na dānapāramitām upalabhate,	K03D0009-2_H0010-2:140b-9	སྦྱིན་པའི་ཕ་རོལ་ཏུ་ཕྱིན་པར་དམིགས་པ་མ་མཆིས་།
K02sspp2_4u:4219	 na śīlapāramitām upalabhate,  na kṣāntipāramitām upalabhate,  na vīryapāramitām upalabhate,  na dhyānapāramitām upalabhate,  na prajñāpāramitām upalabhate.  nādhyātmaśūnyatām upalabhate,  na bahirdhāśūnyatām upalabhate,	K03D0009-2_H0010-2:140b-10	ཚུལ་ཁྲིམས་ཀྱི་ཕ་རོལ་ཏུ་ཕྱིན་པ་དང་། བཟོད་པའི་ཕ་རོལ་ཏུ་ཕྱིན་པ་དང་། བརྩོན་འགྲུས་ཀྱི་ཕ་རོལ་ཏུ་ཕྱིན་པ་དང་། བསམ་གཏན་གྱི་ཕ་རོལ་ཏུ་ཕྱིན་པ་དང་། ཤེས་རབ་ཀྱི་ཕ་རོལ་ཏུ་ཕྱིན་པར་དམིགས་པ་མ་མཆིས་སོ་༎
K02sspp2_4u:4226	 nādhyātmabahirdhāśūnyatām upalabhate,  na śūnyatāśūnyatām upalabhate,  na mahāśūnyatām upalabhate,  na paramārthaśūnyatām upalabhate,  na saṃskṛtaśūnyatām upalabhate,  nāsaṃskṛtaśūnyatām upalabhate,  nātyantaśūnyatām upalabhate,  nānavarāgraśūnyatām upalabhate,  nānavakāraśūnyatām upalabhate,  na prakṛtiśūnyatām upalabhate,	K03D0009-2_H0010-2:140b-11	ནང་སྟོང་པ་ཉིད་དུ་དམིགས་པ་མ་མཆིས་།
K02sspp2_4u:4236	 na sarvadharmaśūnyatām upalabhate,  na svalakṣaṇaśūnyatām upalabhate,  nānupalambhaśūnyatām upalabhate,  nābhāvaśūnyatām upalabhate,  na svabhāvaśūnyatām upalabhate,  nābhāvasvabhāvaśūnyatām upalabhate.	K03D0009-2_H0010-2:140b-12	དངོས་པོ་མེད་པའི་ངོ་བོ་ཉིད་སྟོང་པ་ཉིད་ཀྱི་བར་དུ་དམིགས་པ་མ་མཆིས་སོ་༎
K02sspp2_4u:4242	 na smṛtyupasthānāny upalabhante,	K03D0009-2_H0010-2:140b-13	དྲན་པ་ཉེ་བར་བཞག་པ་རྣམས་སུ་དམིགས་པ་མ་མཆིས་།
K02sspp2_4u:4243	 na samyakprahāṇāny upalabhante,  na rddhipādān upalabhante,  nendriyāny upalabhante,  na balāny upalabhante,  na bodhyaṅgāny upalabhante,  nāryāṣṭāṅgo mārgam upalabhante,	K03D0009-2_H0010-2:141a-0	ཡང་དག་པར་སྤོང་བ་དང་། རྫུ་འཕྲུལ་གྱི་རྐང་པ་དང་། དབང་པོ་དང་། སྟོབས་དང་། བྱང་ཆུབ་ཀྱི་ཡན་ལག་དང་། འཕགས་པའི་ལམ་ཡན་ལག་བརྒྱད་པར་དམིགས་པ་མ་༄༡༤༡ཨ་༌༎
K02sspp2_4u:4249	 nāryasatyāny upalabhante,	K03D0009-2_H0010-2:141a-1	མཆིས་སོ་༎ འཕགས་པའི་བདེན་པ་རྣམས་སུ་དམིགས་པ་མ་མཆིས་སོ་༎
K02sspp2_4u:430	 parāṃś ca pāruṣyavairamaṇyāṃ samādāyati,  pārūṣyavairamaṇyāś ca varṇaṃ bhāṣiṣyate,  ye cānye pāruṣyāt prativiratā bhaviṣyanti,  teṣām api varṇavādī bhaviṣyati samanujñaḥ,	K03D0009-2_H0010-2:71a-1	གཞན་གྱིས་སྲོག་གཅོད་པ་སྤངས་ན་ཡང་དེ་དག་གི་ལེགས་པ་བརྗོད་ཅིང་རྗེས་སུ་དགའ་བར་འགྱུར་རོ་༎
K02sspp2_4u:434	 ātmanā ca saṃbhinnapralāpāt prativirato bhaviṣyati,  parāṃś ca saṃbhinnapralāpavairamaṇyāṃ samādāpayiṣyati,  saṃbhinnapralāpavairamaṇyāś ca varṇaṃ bhāṣiṣyate,  ye cānye saṃvinnapralāpāt prativiratā bhaviṣyanti,  teṣām api varṇavādī bhaviṣyati samanujñaḥ,	K03D0009-2_H0010-2:71a-2	བདག་ཀྱང་མ་བྱིན་པར་ལེན་པ་དང་། འདོད་པས་ལོག་པར་ག-ཡེམ་པ་དང་། བརྫུན་དུ་སྨྲ་བ་དང་། ཕྲ་མ་དང་། ཞེ་གཅོད་པ་དང་། ཚིག་ཀྱལ་པ་དང་། ཆགས་སེམས་དང་། གནོད་སེམས་དང་། ལོག་པར་ལྟ་བ་སྤོང་བར་འགྱུར་།
K02sspp2_4u:439	 ātmanā cābhidhyāyāḥ prativirato bhaviṣyati,  parāṃś cābhidhyāvairamaṇyāṃ samādāpayiṣyati,  abhidhyāvairamaṇyāś ca varṇaṃ bhāṣiṣyate,  ye cānye 'bhidhyāyāḥ prativiratā bhaviṣyanti,  teṣām api varṇavādī bhaviṣyati samanujñaḥ,  ātmanā ca vyāpādāt prativirato bhaviṣyati,	K03D0009-2_H0010-2:71a-3	གཞན་ཡང་ལོག་པར་ལྟ་བ་སྤོང་བ་ལ་ཡང་དག་པར་སྐུལ་བར་འགྱུར་།
K02sspp2_4u:4250	 na dhyānāny upalabhante,  nāpramāṇāny upalabhante,  nārūpyasamāpattīr upalabhante,	K03D0009-2_H0010-2:141a-2	བསམ་གཏན་དང་། ཚད་མེད་པ་དང་། གཟུགས་མེད་པའི་སྙོམས་པར་འཇུག་པ་རྣམས་སུ་དམིགས་པ་མ་མཆིས་སོ་༎
K02sspp2_4u:4253	 nāṣṭau vimokṣām upalabhante,	K03D0009-2_H0010-2:141a-3	རྣམ་པར་ཐར་པ་བརྒྱད་དུ་དམིགས་པ་མ་མཆིས་།
K02sspp2_4u:4254	 na navānupūrvavihārasamāpattīr upalabhante,  na śūnyatānimittāpraṇihitavimokṣamukhāny upalabhante,  nābhijñā upalabhante,	K03D0009-2_H0010-2:141a-4	མཐར་གྱིས་གནས་པའི་སྙོམས་པར་འཇུག་པ་དགུ་དང་། རྣམ་པར་ཐར་པའི་སྒོ་གསུམ་དང་། མངོན་པར་ཤེས་པ་རྣམས་སུ་དམིགས་པ་མ་མཆིས་སོ་༎
K02sspp2_4u:4257	 na samādhīn upalabhante,  na dhāraṇīmukhāny upalabhante,	K03D0009-2_H0010-2:141a-5	ཏིང་ངེ་འཛིན་རྣམས་སུ་དམིགས་པ་མ་མཆིས་སོ་༎ གཟུངས་ཀྱི་སྒོ་རྣམས་སུ་དམིགས་པ་མ་མཆིས་སོ་༎
K02sspp2_4u:4259	 na daśatathāgatabalāny upalabhante,	K03D0009-2_H0010-2:141a-7	དེ་བཞིན་གཤེགས་པའི་སྟོབས་རྣམས་སུ་དམིགས་པ་མ་མཆིས་།
K02sspp2_4u:4260	 na vaiśāradyāny upalabhante,  na pratisaṃvida upalabhante,	K03D0009-2_H0010-2:141a-8	མི་འཇིགས་པ་རྣམས་དང་། སོ་སོ་ཡང་དག་པར་རིག་པ་རྣམས་དང་། སྙིང་རྗེ་ཆེན་པོ་དང་། སངས་རྒྱས་ཀྱི་ཆོས་མ་འདྲེས་པ་རྣམས་སུ་དམིགས་པ་མ་མཆིས་སོ་༎ རྒྱུན་དུ་ཞུགས་པའི་འབྲས་བུར་དམིགས་པ་མ་མཆིས་། ལན་གཅིག་ཕྱིར་འོང་བའི་འབྲས་བུ་དང་། ཕྱིར་མི་འོང་བའི་འབྲས་བུ་དང་། དགྲ་བཅོམ་པ་ཉིད་དུ་དམིགས་པ་མ་མཆིས་སོ་༎
K02sspp2_4u:4262	 na mahāmaitrīm upalabhante,  na mahākaruṇām upalabhante,  nāveṇikabuddhadharmān upalabhante,	K03D0009-2_H0010-2:141a-11	རང་བྱང་ཆུབ་ཏུ་དམིགས་པ་མ་མཆིས་སོ་༎ ལམ་གྱི་རྣམ་པ་ཤེས་པ་ཉིད་དང་། བྱང་ཆུབ་དང་། སངས་རྒྱས་དང་། སངས་རྒྱས་ཀྱི་ཆོས་སུ་དམིགས་པ་མ་མཆིས་ཏེ་།
K02sspp2_4u:4282	 śakra āha: punar bhagavan bodhisattvo mahāsattvaḥ prajñāpāramitāyāṃ carati na tadanyāsu pāramitāsu.	K03D0009-2_H0010-2:141b-12	བྱང་ཆུབ་སེམས་དཔའ་སེམས་དཔའ་ཆེན་པོ་ཤེས་རབ་ཀྱི་ཕ་རོལ་ཏུ་ཕྱིན་པ་ལ་སྤྱོད་ཀྱི་། དེ་མ་ལགས་པའི་ཕ་རོལ་ཏུ་ཕྱིན་པ་གཞན་ལ་མི་སྤྱོད་དམ་།
K02sspp2_4u:4283	 bhagavān āha:	K03D0009-2_H0010-2:141b-14	བཅོམ་ལྡན་འདས་ཀྱིས་བཀའ་སྩལ་པ་།
K02sspp2_4u:4284	 sarvāsu kauśika ṣaḍpāramitāsu bodhisattvo mahāsattvaś carati tac cānupalambhayogena. sa dānam api nopalabhate dāyakam api nopalabhate pratigrāhakam api nopalabhate,	K03D0009-2_H0010-2:141b-15	ཀོཨོ་ཤི་ཀ་། བྱང་ཆུབ་སེམས་དཔའ་སེམས་དཔའ་ཆེན་པོ་ནི་ཕ་རོལ་ཏུ་ཕྱིན་པ་དྲུག་པོ་ཀུན་ལའང་། དེས་སྦྱིན་པའང་མི་དམིགས་། གཏོང་བའང་མི་དམིགས་། ལེན་པའང་མི་དམིགས་སོ་༎
K02sspp2_4u:4285	 śīlam api nopalabhate śīlavantam api nopalabhate dauḥśīlam api nopalabhate,	K03D0009-2_H0010-2:141b-21	ཚུལ་ཁྲིམས་ཀྱང་མི་དམིགས་། ཚུལ་ཁྲིམས་དང་ལྡན་པ་ཡང་མི་དམིགས་། ཚུལ་ཁྲིམས་ངན་པའང་མི་དམིགས་སོ་༎
K02sspp2_4u:4286	 kṣāntim api nopalabhate kṣamīnam api nopalabhate vyāpādam api nopalabhate,  vīryam api nopalabhate vīryavantam api nopalabhate kauśīdyam api nopalabhate,	K03D0009-2_H0010-2:141b-24	བཟོད་པའང་མི་དམིགས་། བཟོད་པ་དང་ལྡན་པའང་མི་དམིགས་། གནོད་སེམས་ཀྱང་མི་དམིགས་སོ་༎ བརྩོན་འགྲུས་ཀྱང་མི་དམིགས་། བརྩོན་འགྲུས་དང་ལྡན་པའང་མི་དམིགས་། ལེ་ལོའང་མི་དམིགས་སོ་༎
K02sspp2_4u:4288	 dhyānam api nopalabhate dhyāyinam api nopalabhate vikṣepam api nopalabhate,	K03D0009-2_H0010-2:141b-30	བསམ་གཏན་ཡང་མི་དམིགས་། བསམ་གཏན་དང་ལྡན་པ་ཡང་མི་དམིགས་། འཁྲུག་པའང་མི་དམིགས་སོ་༎
K02sspp2_4u:4289	 prajñām api nopalabhate prajñāvantam api nopalabhate dauṣprajñam api nopalabhate.	K03D0009-2_H0010-2:141b-33	ཤེས་རབ་ཀྱང་མི་དམིགས་། ༄༡༤༢ཨ་༌༎ ཤེས་རབ་དང་ལྡན་པའང་མི་དམིགས་།
