src_segmentnr	src_original	tgt_segmentnr	tgt_original
K02sspp2_4u:5709	 yatra kulaputrāḥ kuladuhitaraś ca śikṣitvā samyaktvanyāmam avakrāntā avakramanty avakramiṣyanti ca,	K03D0009-2_H0010-2:153a-1	དེ་དག་བསླབས་ཤིང་། རིགས་ཀྱི་བུའམ་རིགས་ཀྱི་བུ་མོ་དག་། ཡང་དག་པའི་སྐྱོན་མེད་པར་ཞུགས་པར་གྱུར་ཏོ་༎
K02sspp2_4u:5710	 srotaāpattiphalaṃ prāptāḥ prāpnuvanti prāpsyanti ca,  sakṛdāgāmiphalaṃ prāptāḥ prāpnuvanti prāpsyanti ca,  anāgāmiphalaṃ prāptāḥ prāpnuvanti prāpsyanti ca,	K03D0009-2_H0010-2:153a-4	འཇུག་གོ་། འཇུག་པར་འགྱུར་རོ་༎
K02sspp2_4u:5713	 arhattvaṃ prāptāḥ prāpnuvanti prāpsyanti ca,	K03D0009-2_H0010-2:153a-5	དགྲ་བཅོམ་པ་ཉིད་ཀྱི་བར་དུ་ཐོབ་པར་གྱུར་ཏོ་༎ འཐོབ་བོ་༎ འཐོབ་པར་འགྱུར་རོ་༎
K02sspp2_4u:579	 parāṃś ca caturthe dhyāne samādāpayiṣyati,	K03D0009-2_H0010-2:72a-7	གཞན་ཡང་བསམ་གཏན་བཞི་པ་ལ་ཡང་དག་པར་སྐུལ་བར་འགྱུར་།
K02sspp2_4u:580	 caturthadhyānasya ca varṇaṃ bhāṣiṣyate,  ye cānye caturthaṃ dhyānaṃ samāpatsyate teṣām api varṇavādī bhaviṣyati samanujñaḥ.	K03D0009-2_H0010-2:72a-8	བསམ་གཏན་བཞི་པའི་ལེགས་པ་རྗོད་པར་འགྱུར་། གཞན་བསམ་གཏན་བཞི་པ་ལ་སྙོམས་པར་འཇུག་ན་ཡང་དེ་དག་གི་ལེགས་པ་བརྗོད་ཅིང་རྗེས་སུ་དགའ་བར་འགྱུར་རོ་༎
K02sspp2_4u:582	 ātmanā ca maitrī samāpatsyate,	K03D0009-2_H0010-2:72a-10	བདག་ཀྱང་བྱམས་པ་ལ་སྙོམས་པར་འཇུག་པར་འགྱུར་།
K02sspp2_4u:583	 parāṃś ca maitrīsamāpattau samādāpayiṣyati,	K03D0009-2_H0010-2:72a-11	གཞན་ཡང་བྱམས་པ་ལ་སྙོམས་པར་འཇུག་པ་ལ་ཡང་དག་པར་སྐུལ་བར་འགྱུར་།
K02sspp2_4u:585	 ye cānye mahāmaitrī samāpatsyante teṣām api varṇavādī bhaviṣyati samanujñaḥ,  ātmanā ca karuṇā samāpatsyate,  parāṃś ca karuṇāyāṃ samādāpayiṣyati,  ye cānye karuṇā samāpatsyante teṣām api varṇavādī bhaviṣyati samanujñaḥ,  ātmanā ca muditāṃ samāpatsyate,	K03D0009-2_H0010-2:72a-12	བྱམས་པ་ལ་སྙོམས་པར་འཇུག་པའི་ལེགས་པ་རྗོད་པར་འགྱུར་།
K02sspp2_4u:5715	 bodhisattvāś ca mahāsattvā bodhisattvanyāmam avakrāntā avakrāmanty avakraṃiṣyanti,	K03D0009-2_H0010-2:153a-10	བྱང་ཆུབ་སེམས་དཔའི་སྐྱོན་མེད་པར་ཞུགས་པར་གྱུར་ཏོ༏་༏འཇུག་གོ་། འཇུག་པར་འགྱུར་རོ་༎
K02sspp2_4u:5714	 pratyekabuddhayānikāḥ pratyekabodhiṃ prāptāḥ prāpnuvanti prāpsyanti ca,	K03D0009-2_H0010-2:153a-7	རང་བྱང་ཆུབ་ཐོབ་པར་གྱུར་ཏོ་༎ འཐོབ་བོ་༎ འཐོབ་པར་འགྱུར་རོ་༎
K02sspp2_4u:5716	 anuttarāṃ samyaksaṃbodhim abhisaṃbuddhā abhisaṃbudhyate abhisaṃbhotsyate ca.	K03D0009-2_H0010-2:153a-12	བླ་ན་མེད་པ་ཡང་དག་པར་རྫོགས་པའི་བྱང་ཆུབ་ཏུ་མངོན་པར་རྫོགས་པར་སངས་རྒྱས་སོ་༎ མངོན་པར་རྫོགས་པར་འཚང་རྒྱའོ་༎ མངོན་པར་རྫོགས་པར་འཚང་རྒྱ་བར་འགྱུར་རོ་༎
K02sspp2_4u:5736	 abhāvasvabhāvaśūnyatā.  catvāri smṛtyupasthānāni,  catvāri samyakprahāṇāni,  catvāra ṛddhipādāḥ,  pañcendriyāṇi,	K03D0009-2_H0010-2:153a-18	ཕ་རོལ་ཏུ་ཕྱིན་པ་རྣམས་དང་། ནང་སྟོང་པ་ཉིད་དང་། དངོས་པོ་མེད་པའི་ངོ་བོ་ཉིད་སྟོང་པ་ཉིད་ཀྱི་བར་དང་། བྱང་ཆུབ་ཀྱི་ཕྱོགས་ཀྱི་ཆོས་སུམ་ཅུ་རྩ་བདུན་དང་། འཕགས་པའི་བདེན་པ་དང་། བསམ་གཏན་དང་།
K02sspp2_4u:5741	 pañca balāni,  sapta bodhyaṅgāny āryāṣṭāṅgo mārgaś catvāry āryasatyāny aṣṭau vimokṣā navānupūrvavihārasamāpattayaḥ  śūnyatānimittāpraṇihitavimokṣamukhāni ṣaḍ abhijñāḥ sarvasamādhayaḥ sarvaddhāraṇīmukhāni	K03D0009-2_H0010-2:153b-0	ཚད་མེད་པ་དང་། གཟུགས་མེད་པའི་སྙོམས་པར་འཇུག་པ་དང་། རྣམ་པར་ཐར་པ་བརྒྱད་དང་། མཐར་གྱིས་གནས་པའི་སྙོམས་པར་འཇུག་པ་དགུ་དང་། རྣམ་པར་ཐར་པའི་སྒོ་གསུམ་དང་། མངོན་པར་ཤེས་པ་༄༡༥༣བ་དྲུག་དང་། ཏིང་ངེ་འཛིན་ཐམས་ཅད་དང་།
K02sspp2_4u:5744	 daśatathāgatabalāni catvāri vaiśāradyāni catasraḥ pratisaṃvido 'ṣṭādaśāveṇikā buddbadharmāḥ,	K03D0009-2_H0010-2:153b-1	གཟུངས་ཀྱི་སྒོ་ཐམས་ཅད་དང་། དེ་བཞིན་གཤེགས་པའི་སྟོབས་བཅུ་དང་། མི་འཇིགས་པ་བཞི་དང་། སོ་སོ་ཡང་དག་པར་རིག་པ་བཞི་དང་། སངས་རྒྱས་ཀྱི་ཆོས་མ་འདྲེས་པ་བཅོ་བརྒྱད་ཀྱི་བར་དང་། སངས་རྒྱས་ཀྱི་ཆོས་ཚང་མེད་པའི་བར་གཞན་དག་ཀྱང་རྒྱ་ཆེར་བསྟན་ཏོ་༎
K02sspp2_4u:5747	 ayam eva tato bahutaraṃ puṇyaṃ prasavet. tat kasya hetoḥ?	K03D0009-2_H0010-2:153b-5	དེ་བས་འདིའི་བསོད་ནམས་ཆེས་མང་དུ་འཕེལ་བར་ཤེས་པར་བྱའོ་༎ དེ་ཅིའི་ཕྱིར་ཞེ་ན་།
K02sspp2_4u:5745	 mahāmaitrī mahākaruṇā mahāmuditā mahopekṣā anye cāparimāṇā buddhadharmā vistareṇopadiṣṭāḥ. tad anenāpi te kauśika paryāyeṇaivaṃ veditavyaṃ,  yaḥ kulaputro vā kuladuhitā vā prajñāpāramitāṃ pustakalikhitāṃ kṛtvā parebhyo dadyāt paṭhanāyāpi lekhanāyapi vācanāyāpi,	K03D0009-2_H0010-2:153b-2	ཀོཨོ་ཤི་ཀ་། རྣམ་གྲངས་དེས་ཀྱང་རིགས་ཀྱི་བུའམ་རིགས་ཀྱི་བུ་མོ་གང་གིས་ཤེས་རབ་ཀྱི་ཕ་རོལ་ཏུ་ཕྱིན་པ་འདི་གླེགས་བམ་དུ་བྲིས་ཤིང་། བཀླག་པ་དང་བྲི་བ་དང་ཁ་ཏོན་དུ་བྱ་བའི་ཕྱིར་གཞན་ལ་བྱིན་ན་།
K02sspp2_4u:5748	 tathā hy atra kauśika prajñāpāramitāyāṃ vistareṇa sarvadharmā upadiṣṭā yaiḥ kṣatriyamahāśālakulāni prajñāyante,	K03D0009-2_H0010-2:153b-7	ཀོཨོ་ཤི་ཀ་། དེ་ནི་འདི་ལྟར་ཤེས་རབ་ཀྱི་ཕ་རོལ་ཏུ་ཕྱིན་པ་འདི་ལས་ཆོས་ཐམས་ཅད་རྒྱ་ཆེར་བསྟན་ཏེ་།
K02sspp2_4u:5709	 yatra kulaputrāḥ kuladuhitaraś ca śikṣitvā samyaktvanyāmam avakrāntā avakramanty avakramiṣyanti ca,	K03D0009-2_H0010-2:150a-2	དེ་དག་ལ་བསླབས་ཤིང་། རིགས་ཀྱི་བུ་དང་། རིགས་ཀྱི་བུ་མོ་དག་ཡང་དག་པའི་སྐྱོན་མེད་པར་ཞུགས་པར་གྱུར་ཏོ་༎ འཇུག་གོ་། འཇུག་པར་འགྱུར་རོ་༎
K02sspp2_4u:5710	 srotaāpattiphalaṃ prāptāḥ prāpnuvanti prāpsyanti ca,  sakṛdāgāmiphalaṃ prāptāḥ prāpnuvanti prāpsyanti ca,  anāgāmiphalaṃ prāptāḥ prāpnuvanti prāpsyanti ca,  arhattvaṃ prāptāḥ prāpnuvanti prāpsyanti ca,	K03D0009-2_H0010-2:150a-5	དགྲ་བཅོམ་པ་ཉིད་ཀྱི་བར་དུ་ཐོབ་བོ་༎
K02sspp2_4u:5714	 pratyekabuddhayānikāḥ pratyekabodhiṃ prāptāḥ prāpnuvanti prāpsyanti ca,	K03D0009-2_H0010-2:150a-6	འཐོབ་བོ་༎ འཐོབ་པར་འགྱུར་རོ་༎ རང་བྱང་ཆུབ་ཐོབ་པར་གྱུར་ཏོ་༎
K02sspp2_4u:5715	 bodhisattvāś ca mahāsattvā bodhisattvanyāmam avakrāntā avakrāmanty avakraṃiṣyanti,	K03D0009-2_H0010-2:150a-10	བྱང་ཆུབ་སེམས་དཔའ་སེམས་དཔའ་ཆེན་པོ་རྣམས་ཀྱང་། ཡང་དག་པའི་སྐྱོན་མེད་པར་ཞུགས་པར་གྱུར་ཏོ་།
K02sspp2_4u:5716	 anuttarāṃ samyaksaṃbodhim abhisaṃbuddhā abhisaṃbudhyate abhisaṃbhotsyate ca.	K03D0009-2_H0010-2:150a-12	འཇུག་གོ་། འཇུག་པར་འགྱུར་རོ་༎ བླ་ན་མེད་པ་ཡང་དག་པར་རྫོགས་པའི་བྱང་ཆུབ་ཏུ་མངོན་པར་རྫོགས་པར་སངས་རྒྱས་སོ་༎
K02sspp2_4u:5854	 tathā hy atra kauśika prajñāpāramitāyām anāsravā dharmā vistareṇopadiṣṭāḥ,	K03D0009-2_H0010-2:152b-28	ཀོཨོ་ཤི་ཀ་། ༄༡༥༣ཨ་༌༎ དེ་ནི་འདི་ལྟར་ཤེས་རབ་ཀྱི་ཕ་རོལ་ཏུ་ཕྱིན་པ་འདི་ལས་ཟག་པ་མེད་པའི་ཆོས་རྣམས་རྒྱ་ཆེར་བསྟན་ཏེ་།
K02sspp2_4u:5855	 yatra kulaputrāḥ kuladuhitaraś ca śikṣitvā samyaktvanyāmam avakrāntā,	K03D0009-2_H0010-2:153a-1	དེ་དག་བསླབས་ཤིང་། རིགས་ཀྱི་བུའམ་རིགས་ཀྱི་བུ་མོ་དག་། ཡང་དག་པའི་སྐྱོན་མེད་པར་ཞུགས་པར་གྱུར་ཏོ་༎
K02sspp2_4u:5856	 avakrāmanty avakramiṣyanti ca,	K03D0009-2_H0010-2:153a-4	འཇུག་གོ་། འཇུག་པར་འགྱུར་རོ་༎
K02sspp2_4u:5857	 srotaāpattiphalaṃ prāptāḥ prāpnuvanti prāpsyanti ca,  sakṛdāgāmiphalaṃ prāptāḥ prāpnuvanti prāpsyanti ca,  anāgāmiphalaṃ prāptāḥ prāpnuvanti prāpsyanti ca,	K03D0009-2_H0010-2:153a-5	དགྲ་བཅོམ་པ་ཉིད་ཀྱི་བར་དུ་ཐོབ་པར་གྱུར་ཏོ་༎
K02sspp2_4u:5860	 arhattvaṃ prāptāḥ prāpnuvanti prāpsyanti ca,	K03D0009-2_H0010-2:153a-6	འཐོབ་བོ་༎ འཐོབ་པར་འགྱུར་རོ་༎
K02sspp2_4u:5861	 pratyekabuddhayānikāḥ pratyekabodhiṃ prāptāḥ prāpnuvanti prāpsyanti ca,	K03D0009-2_H0010-2:153a-7	རང་བྱང་ཆུབ་ཐོབ་པར་གྱུར་ཏོ་༎ འཐོབ་བོ་༎ འཐོབ་པར་འགྱུར་རོ་༎
K02sspp2_4u:5862	 bodhisattvāś ca mahāsattvā bodhisattvanyāmam avakrāntā avakrāmanty avakramiṣyanti,	K03D0009-2_H0010-2:153a-10	བྱང་ཆུབ་སེམས་དཔའི་སྐྱོན་མེད་པར་ཞུགས་པར་གྱུར་ཏོ༏་༏འཇུག་གོ་། འཇུག་པར་འགྱུར་རོ་༎
K02sspp2_4u:5863	 anuttarāṃ samyaksaṃbodhim abhisaṃbuddhā abhisaṃbudhyante abhisaṃbhotsyante ca.	K03D0009-2_H0010-2:153a-12	བླ་ན་མེད་པ་ཡང་དག་པར་རྫོགས་པའི་བྱང་ཆུབ་ཏུ་མངོན་པར་རྫོགས་པར་སངས་རྒྱས་སོ་༎ མངོན་པར་རྫོགས་པར་འཚང་རྒྱའོ་༎ མངོན་པར་རྫོགས་པར་འཚང་རྒྱ་བར་འགྱུར་རོ་༎
K02sspp2_4u:5864	 katame te kauśikānāsravā dharmās tad yathā dānapāramitā,	K03D0009-2_H0010-2:153a-15	ཀོཨོ་ཤི་ཀ་། ཟག་པ་མེད་པའི་ཆོས་དེ་དག་ཀྱང་གང་ཞེ་ན་། འདི་ལྟ་སྟེ་།
K02sspp2_4u:59	 samādhīnaṃ varṇaṃ bhāṣante,  dhāraṇīmukhānāṃ varṇaṃ bhāṣante,  daśānāṃ tathāgatabalānāṃ varṇaṃ bhāṣante,  caturṇāṃ vaiśāradyānāṃ varṇaṃ bhāṣante,  catasṛṇāṃ pratisaṃvidāṃ varṇaṃ bhāsante,  mahāmaitryā varṇaṃ bhāṣante,  mahākaruṇāyā varṇaṃ bhāṣante,	K03D0009-2_H0010-2:64b-4	མངོན་པར་ཤེས་པ་དང་། ཏིང་ངེ་འཛིན་དང་། གཟུངས་ཀྱི་སྒོ་དང་། དེ་བཞིན་གཤེགས་པའི་སྟོབས་དང་། མི་འཇིགས་པ་དང་། སོ་སོ་ཡང་དག་པར་རིག་པ་དང་། སངས་རྒྱས་ཀྱི་ཆོས་མ་འདྲེས་པའི་ཡོན་ཏན་བརྗོད་པ་དང་།
K02sspp2_4u:591	 parāṃś ca muditāsamāpattau samādāpayiṣyati,  muditāsamāpatteś ca varṇaṃ bhāṣiṣyate,  ye cānye muditāṃ samāpatsyante teṣām api varṇavādī bhaviṣyati samanujñaḥ,  ātmanā copekṣāṃ samāpatsyate,  parāṃś copekṣāsamāpattau samādāpayiṣyati,  upekṣāsamāpatteś ca varṇaṃ bhāṣiṣyate,  ye cānye upekṣāṃ samāpatsyate teṣām api varṇavādī bhaviṣyati samanujñaḥ.	K03D0009-2_H0010-2:72a-13	གཞན་བྱམས་པ་ལ་སྙོམས་པར་འཇུག་ན་ཡང་དེ་དག་གི་ལེགས་པ་བརྗོད་ཅིང་རྗེས་སུ་དགའ་བར་འགྱུར་རོ་༎
K02sspp2_4u:599	 parāṃś cākāśānantyāyatanasamāpattau samādāpayiṣyati,	K03D0009-2_H0010-2:72b-0	གཞན་ཡང་བཏང་སྙོམས་ལ་སྙོམས་པར་འཇུག་པར་ཡང་དག་པར་སྐུལ་༄༧༢བ་བར་འགྱུར་།
K02sspp2_4u:5865	 śīlapāramitā kṣāntipāramitā vīryapāramitā dhyanapāramitā prajñāpāramitā.  adhyatmaśūnyatā,  bahirdhāśūnyatā,  adhyātmabahirdhāśūnyatā,  śūnyatāśūnyatā,	K03D0009-2_H0010-2:153a-18	ཕ་རོལ་ཏུ་ཕྱིན་པ་རྣམས་དང་། ནང་སྟོང་པ་ཉིད་དང་། དངོས་པོ་མེད་པའི་ངོ་བོ་ཉིད་སྟོང་པ་ཉིད་ཀྱི་བར་དང་། བྱང་ཆུབ་ཀྱི་ཕྱོགས་ཀྱི་ཆོས་སུམ་ཅུ་རྩ་བདུན་དང་། འཕགས་པའི་བདེན་པ་དང་། བསམ་གཏན་དང་།
K02sspp2_4u:5892	 yaḥ kulaputro vā kuladuhitā vā prajñāpāramitāṃ pustakalikhitāṃ kṛtvā parebhyo dadyāt paṭhanāyāpi lekhanāyāpi vācanāyāpi,	K03D0009-2_H0010-2:153b-4	བཀླག་པ་དང་བྲི་བ་དང་ཁ་ཏོན་དུ་བྱ་བའི་ཕྱིར་གཞན་ལ་བྱིན་ན་།
K02sspp2_4u:5893	 ayam eva tato bahutaraṃ puṇyaṃ prasavet,	K03D0009-2_H0010-2:153b-5	དེ་བས་འདིའི་བསོད་ནམས་ཆེས་མང་དུ་འཕེལ་བར་ཤེས་པར་བྱའོ་༎
K02sspp2_4u:5894	 tat kasya hetoḥ?	K03D0009-2_H0010-2:153b-6	དེ་ཅིའི་ཕྱིར་ཞེ་ན་།
K02sspp2_4u:5895	 tathā hy atra kauśika prajñāpāramitāyāṃ vistareṇa sarvadharmā upadiṣṭā yaiḥ kṣatriyamahāśālakulāni prajñāyante,	K03D0009-2_H0010-2:153b-7	ཀོཨོ་ཤི་ཀ་། དེ་ནི་འདི་ལྟར་ཤེས་རབ་ཀྱི་ཕ་རོལ་ཏུ་ཕྱིན་པ་འདི་ལས་ཆོས་ཐམས་ཅད་རྒྱ་ཆེར་བསྟན་ཏེ་།
K02sspp2_4u:5896	 brāhmaṇamahāśālakulāni prajñāyante,  gṛhapatimahāśālakulāni prajñāyante.  cāturmahārājakāyikā devāḥ prajñāyante,	K03D0009-2_H0010-2:153b-9	དེ་དག་ཡོད་པས་རྒྱལ་རིགས་ཆེ་ཞིང་མཐོ་བ་དང་། བྲམ་ཟེའི་རིགས་ཆེ་ཞིང་མཐོ་བ་དང་། ཁྱིམ་བདག་གི་རིགས་ཆེ་ཞིང་མཐོ་བ་དང་། རྒྱལ་ཆེན་བཞིའི་རིས་ཀྱི་ལྷ་རྣམས་ཡོད་དོ་༎
K02sspp2_4u:5899	 trāyastriṃśā devāḥ prajñāyante,	K03D0009-2_H0010-2:153b-10	སུམ་ཅུ་རྩ་གསུམ་དང་། མཚེ་མ་དང་། དགའ་ལྡན་དང་། འཕྲུལ་དགའ་དང་། གཞན་འཕྲུལ་དབང་བྱེད་ཀྱི་ལྷ་རྣམས་དང་། ཚངས་རིས་དང་། ཚངས་ལྷ་ཉེ་ཕན་དང་། ཚངས་པ་ཀུན་འཁོར་དང་། ཚངས་ཆེན་དང་། འོག་མིན་གྱི་བར་གྱི་ལྷ་རྣམས་དང་། ནམ་མཁའ་མཐའ་ཡས་སྐྱེ་མཆེད་དང་། འདུ་ཤེས་མེད་འདུ་ཤེས་མེད་མིན་སྐྱེ་མཆེད་ཀྱི་བར་གྱི་ལྷ་རྣམས་ཡོད་དོ་༎ ཕ་རོལ་ཏུ་ཕྱིན་པ་རྣམས་ཡོད་དོ་༎
K02sspp2_4u:6	 buddhakṣetraṃ pariśodhayanti buddhakṣetrād buddhakṣetraṃ saṃkrāmanti,	K03D0009-2_H0010-2:64a-0	སེམས་ཅན་རྣམས་ཡོངས་སུ་སྨིན་པར་བགྱིད་པ་དང་། སངས་རྒྱས་ཀྱི་ཞིང་ཡོངས་སུ་དག་༄༦༤ཨ་༌༎
K02sspp2_4u:600	 ākāśānantyāyatanasamāpatteś ca varṇaṃ bhāṣiṣyate,  ye cānye ākāśānantyāyatanaṃ samāpatsyante teṣām api varṇavādī bhaviṣyati samanujñaḥ,	K03D0009-2_H0010-2:72b-1	བཏང་སྙོམས་ལ་སྙོམས་པར་འཇུག་པའི་ལེགས་པ་རྗོད་པར་འགྱུར་། གཞན་བཏང་སྙོམས་ལ་སྙོམས་པར་འཇུག་ན་ཡང་དེ་དག་གི་ལེགས་པ་བརྗོད་ཅིང་རྗེས་སུ་དགའ་བར་འགྱུར་རོ་༎
K02sspp2_4u:5854	 tathā hy atra kauśika prajñāpāramitāyām anāsravā dharmā vistareṇopadiṣṭāḥ,	K03D0009-2_H0010-2:150a-0	ཤེས་རབ་ཀྱི་ཕ་རོལ་ཏུ་ཕྱིན་པ་འདི་ལས་ཟག་པ་༄༡༥༠ཨ་༌༎ མེད་པའི་ཆོས་རྣམས་རྒྱ་ཆེར་བསྟན་ཏེ་།
K02sspp2_4u:5855	 yatra kulaputrāḥ kuladuhitaraś ca śikṣitvā samyaktvanyāmam avakrāntā,	K03D0009-2_H0010-2:150a-2	དེ་དག་ལ་བསླབས་ཤིང་། རིགས་ཀྱི་བུ་དང་། རིགས་ཀྱི་བུ་མོ་དག་ཡང་དག་པའི་སྐྱོན་མེད་པར་ཞུགས་པར་གྱུར་ཏོ་༎
K02sspp2_4u:5856	 avakrāmanty avakramiṣyanti ca,	K03D0009-2_H0010-2:150a-4	འཇུག་གོ་། འཇུག་པར་འགྱུར་རོ་༎
K02sspp2_4u:5857	 srotaāpattiphalaṃ prāptāḥ prāpnuvanti prāpsyanti ca,  sakṛdāgāmiphalaṃ prāptāḥ prāpnuvanti prāpsyanti ca,  anāgāmiphalaṃ prāptāḥ prāpnuvanti prāpsyanti ca,  arhattvaṃ prāptāḥ prāpnuvanti prāpsyanti ca,	K03D0009-2_H0010-2:150a-5	དགྲ་བཅོམ་པ་ཉིད་ཀྱི་བར་དུ་ཐོབ་བོ་༎
K02sspp2_4u:5861	 pratyekabuddhayānikāḥ pratyekabodhiṃ prāptāḥ prāpnuvanti prāpsyanti ca,	K03D0009-2_H0010-2:150a-6	འཐོབ་བོ་༎ འཐོབ་པར་འགྱུར་རོ་༎ རང་བྱང་ཆུབ་ཐོབ་པར་གྱུར་ཏོ་༎
K02sspp2_4u:5862	 bodhisattvāś ca mahāsattvā bodhisattvanyāmam avakrāntā avakrāmanty avakramiṣyanti,	K03D0009-2_H0010-2:150a-10	བྱང་ཆུབ་སེམས་དཔའ་སེམས་དཔའ་ཆེན་པོ་རྣམས་ཀྱང་། ཡང་དག་པའི་སྐྱོན་མེད་པར་ཞུགས་པར་གྱུར་ཏོ་། འཇུག་གོ་། འཇུག་པར་འགྱུར་རོ་༎
K02sspp2_4u:5863	 anuttarāṃ samyaksaṃbodhim abhisaṃbuddhā abhisaṃbudhyante abhisaṃbhotsyante ca.	K03D0009-2_H0010-2:150a-13	བླ་ན་མེད་པ་ཡང་དག་པར་རྫོགས་པའི་བྱང་ཆུབ་ཏུ་མངོན་པར་རྫོགས་པར་སངས་རྒྱས་སོ་༎ མངོན་པར་རྫོགས་པར་འཚང་རྒྱའོ་༎ མངོན་པར་རྫོགས་པར་འཚང་རྒྱ་བར་འགྱུར་རོ་༎
K02sspp2_4u:5993	 caturṣv apramāṇeṣu pratiṣṭhāpayec catasṛṣv ārūpyasamāpttiṣu pratiṣṭhāpayet pañcasv	K03D0009-2_H0010-2:154b-14	བསམ་གཏན་བཞི་ལ་བཀོད་། ཚད་མེད་པ་བཞི་ལ་བཀོད་། གཟུགས་མེད་པའི་སྙོམས་པར་འཇུག་པ་བཞི་ལ་བཀོད་།
K02sspp2_4u:5994	 abhijñāsu pratiṣṭhāpayet. tat kiṃ manyase?	K03D0009-2_H0010-2:154b-17	མངོན་པར་ཤེས་པ་ལྔ་ལ་བཀོད་ན་། ཀོཨོ་ཤི་ཀ་། དེ་ཇི་སྙམ་དུ་སེམས་།
K02sspp2_4u:5995	 kauśikāpi nu sa kulaputro vā kuladuhitā vā tatonidānaṃ bahupuṇyaṃ prasavet.	K03D0009-2_H0010-2:154b-20	རིགས་ཀྱི་བུའམ་རིགས་ཀྱི་བུ་མོ་དེའི་བསོད་ནམས་དེའི་རྒྱུས་མང་དུ་འཕེལ་ལམ་།
K02sspp2_4u:5996	 āha: bahu bhagavan bahu sugata.	K03D0009-2_H0010-2:154b-21	གསོལ་པ་། བཅོམ་ལྡན་འདས་། མང་ངོ་༎ བདེ་བར་གཤེགས་པ་།
K02sspp2_4u:5997	 bhagavān āha:	K03D0009-2_H0010-2:154b-23	མང་ངོ་༎ བཅོམ་ལྡན་འདས་ཀྱིས་བཀའ་སྩལ་པ་།
K02sspp2_4u:6000	 paṭhanāya vā lekhanāya vā vācanāya vā. tat kasya hetoḥ?	K03D0009-2_H0010-2:155a-2	བསོད་ནམས་ཆེས་མང་དུ་འཕེལ་ལོ་༎ དེ་ཅིའི་ཕྱིར་ཞེ་ན་།
K02sspp2_4u:5998	 ataḥ sa kauśika kulaputro vā kuladuhitā vā bahutaraṃ puṇyaṃ prasavet,  yo 'syāḥ prajñāpāramitāyāḥ pustakaṃ parasmai dadyāt,	K03D0009-2_H0010-2:154b-24	ཀོཨོ་ཤི་ཀ་། དེ་བས་རིགས་ཀྱི་བུའམ་རིགས་ཀྱི་བུ་མོ་གང་གིས་། ཤེས་རབ་ཀྱི་ཕ་རོལ་ཏུ་ཕྱིན་པ་འདིའི་གླེགས་བམ་བཀླག་པ་དང་བྲི་བ་དང་ཁ་ཏོན་དུ་བྱ་བའི་ཕྱིར་༄༡༥༥ཨ་༌༎ གཞན་ལ་བྱིན་ན་།
K02sspp2_4u:5999	 yo 'syāḥ prajñāpāramitāyāḥ pustakaṃ parasmai dadyāt,  paṭhanāya vā lekhanāya vā vācanāya vā. tat kasya hetoḥ?  tathā hy atra kauśika prajñāpāramitāyām anāsravā dharmā vistareṇopadiṣṭāḥ,	K03D0009-2_H0010-2:148a-8	ཀོཨོ་ཤི་ཀ་། དེ་བས་ཀྱང་ལ་ལ་ཞིག་གིས་ཤེས་རབ་ཀྱི་ཕ་རོལ་ཏུ་ཕྱིན་པ་འདིའི་གླེགས་བམ་བཀླག་པའམ་བྲི་བའམ་ཁ་ཏོན་བྱ་བའི་ཕྱིར་གཞན་ལ་བྱིན་ན་བསོད་ནམས་ཆེས་མང་དུ་འཕེལ་ལོ་༎ དེ་ཅིའི་ཕྱིར་ཞེ་ན་།
