src_segmentnr	src_original	tgt_segmentnr	tgt_original
K02sspp2_2u:6737	 mārgākārajñatā śūnyety aśūnyeti na sthātavyam upalambhayogena,  mārgākārajñatā nimittety animitteti na sthātavyam upalambhayogena,  mārgākārajñatā praṇihitety apraṇihiteti na sthātavyam upalambhayogena.  sarvākārajñatā nityety anityeti na sthātavyam upalambhayogena,  sarvākārajñatā sukheti duḥkheti na sthātavyam upalambhayogena,  sarvākārajñatātmety anātmeti na sthātavyam upalambhayogena,  sarvākārajñatā śubhety aśubheti na sthātavyam upalambhayogena,	K05D0010_H0012:372b-8	བདག་མེད་ཅེས་བྱ་བ་དང་། ཞི་ཞེས་བྱ་བ་དང་། མ་ཞི་ཞེས་བྱ་བ་དང་། དབེན་ཞེས་བྱ་བ་དང་། མི་དབེན་ཞེས་བྱ་བ་དང་། སྟོང་ཞེས་བྱ་བ་དང་། མི་སྟོང་ཞེས་བྱ་བ་དང་། མཚན་མ་ཡོད་ཅེས་བྱ་བ་དང་། མཚན་མ་མེད་ཅེས་བྱ་བ་དང་། སྨོན་པ་ཡོད་ཅེས་བྱ་བ་དང་། སྨོན་པ་མེད་ཅེས་བྱ་བར་དམིགས་པའི་ཚུལ་གྱིས་གནས་པར་མི་བྱའོ་༎ ༄༣༧༣ཨ་༌༎ དེ་བཞིན་དུ་ཁམས་རྣམས་དང་། སྐྱེ་མཆེད་རྣམས་དང་། རྟེན་ཅིང་འབྲེལ་བར་འབྱུང་བ་དང་། ཕ་རོལ་ཏུ་ཕྱིན་པ་རྣམས་དང་། སྟོང་པ་ཉིད་ཐམས་ཅད་དང་། བྱང་ཆུབ་ཀྱི་ཕྱོགས་ཀྱི་ཆོས་རྣམས་དང་། སྟོབས་བཅུ་དང་། མི་འཇིགས་པ་རྣམས་དང་། སོ་སོ་ཡང་དག་པར་རིག་པ་རྣམས་དང་། སངས་རྒྱས་ཀྱི་ཆོས་མ་འདྲེས་པ་རྣམས་རྟག་ཅེས་བྱ་བ་དང་། མི་རྟག་ཅེས་བྱ་བ་དང་། སྨོན་པ་ཡོད་ཅེས་བྱ་བ་དང་། སྨོན་པ་མེད་ཅེས་བྱ་བའི་བར་དུ་དམིགས་པའི་ཚུལ་གྱིས་གནས་པར་མི་བྱའོ་༎
K02sspp2_2u:6750	 sakṛdāgāmiphalam asaṃskṛtaprabhāvitam iti na sthātavyam upalambhayogena,  anāgāmiphalam asaṃskṛtaprabhāvitam iti na sthātavyam upalambhayogena,  arhattvam asaṃskṛtaprabhāvitam iti na sthātavyam upalambhayogena,  pratyekabodhir asaṃskṛtaprabhāvitam iti na sthātavyam upalambhayogena,  anuttarāyāḥ samyaksaṃbodhir asaṃskṛtaprabhāvitam (ŚsP II-2 178)  iti na sthātavyam upalambhayogena,  srotaāpannā dakṣiṇīyam asaṃskṛtaprabhāvitam iti na sthātavyam upalambhayogena,  sakṛdāgāmī dakṣiṇīyam asaṃskṛtaprabhāvitam iti na sthātavyam upalambhayogena,  anāgāmī dakṣiṇīyam asaṃskṛtaprabhāvitam iti na sthātavyam upalambhayogena,  arhan dakṣiṇīyam asaṃskṛtaprabhāvitam iti na sthātavyam upalambhayogena,	K05D0010_H0012:373a-4	དེ་བཞིན་དུ་ལན་གཅིག་ཕྱིར་འོང་བའི་འབྲས་བུ་དང་། ཕྱིར་མི་འོང་བའི་འབྲས་བུ་དང་། དགྲ་བཅོམ་པ་ཉིད་དང་། རང་སངས་རྒྱས་ནི་འདུས་མ་བྱས་ཀྱིས་རབ་ཏུ་ཕྱེ་བའོ་ཞེས་བྱ་བར་དམིགས་པའི་ཚུལ་གྱིས་གནས་པར་མི་བྱའོ་༎
K02sspp2_2u:6760	 pratyekabuddho dakṣiṇīya iti na sthātavyam upalambhayogena,  tathāgato 'rhan samyaksaṃbuddho dakṣiṇīya iti na sthātavyam upalambhayogena.	K05D0010_H0012:373b-0	དེ་བཞིན་དུ་ལན་གཅིག་ཕྱིར་འོང་བ་དང་། ཕྱིར་མི་འོང་བ་དང་། དགྲ་བཅོམ་པ་ཉིད་དང་། རང་སངས་རྒྱས་དང་། དེ་བཞིན་གཤེགས་པ་དགྲ་བཅོམ་པ་ཡང་དག་པར་རྫོགས་པའི་སངས་རྒྱས་ནི་སྦྱིན་གནས་༄༣༧༣བ་སོ་ཞེས་བྱ་བར་དམིགས་པའི་ཚུལ་གྱིས་གནས་པར་མི་བྱའོ་༎
K02sspp2_2u:6762	 punar aparaṃ kauśika bodhisattvena mahāsattvena prathamāyāṃ bhūmau na sthātavyam upalambhayogena,	K05D0010_H0012:373b-1	ཀོཨོ་ཤི་ཀ་། གཞན་ཡང་བྱང་ཆུབ་སེམས་དཔའ་སེམས་དཔའ་ཆེན་པོས་ས་དང་པོ་ལ་དམིགས་པའི་ཚུལ་གྱིས་གནས་པར་མི་བྱའོ་༎
K02sspp2_2u:6763	 dvitīyāyāṃ bhūmau na sthātavyam upalambhayogena,	K05D0010_H0012:373b-3	དེ་བཞིན་དུ་ས་བཅུ་པའི་བར་ལ་དམིགས་པའི་ཚུལ་གྱིས་གནས་པར་མི་བྱའོ་༎
K02sspp2_2u:6772	 punar aparaṃ kauśika bodhisattvena mahāsattvena prathamacittotpāde sthitvā dānapāramitāṃ paripūrayiṣyāmīti na sthātavyam upalambhayogena,	K05D0010_H0012:373b-6	ཀོཨོ་ཤི་ཀ་། གཞན་ཡང་བྱང་ཆུབ་སེམས་དཔའ་སེམས་དཔའ་ཆེན་པོས་སེམས་དང་པོ་བསྐྱེད་པ་ལ་གནས་ཏེ་། སྦྱིན་པའི་ཕ་རོལ་ཏུ་ཕྱིན་པ་ཡོངས་སུ་རྫོགས་པར་བྱའོ་སྙམ་དུ་དམིགས་པའི་ཚུལ་གྱིས་གནས་པར་མི་བྱའོ་༎
K02sspp2_2u:6773	 śīlapāramitāṃ paripūrayiṣyāmīti na sthātavyam upalambhayogena,  kṣāntipāramitāṃ paripūrayiṣyāmīti na sthātavyam upalambhayogena,  vīryapāramitāṃ paripūrayiṣyāmīti na sthātavyam upalambhayogena,	K05D0010_H0012:373b-9	དེ་བཞིན་དུ་ཚུལ་ཁྲིམས་ཀྱི་ཕ་རོལ་ཏུ་ཕྱིན་པ་དང་། བཟོད་པའི་ཕ་རོལ་ཏུ་ཕྱིན་པ་དང་། བརྩོན་འགྲུས་ཀྱི་ཕ་རོལ་ཏུ་ཕྱིན་པ་དང་། བསམ་གཏན་གྱི་ཕ་རོལ་ཏུ་ཕྱིན་པ་དང་། ཤེས་རབ་ཀྱི་ཕ་རོལ་ཏུ་ཕྱིན་པ་ཡོངས་སུ་རྫོགས་པར་བྱའོ་སྙམ་དུ་དམིགས་པའི་ཚུལ་གྱིས་གནས་པར་མི་བྱའོ་༎
K02sspp2_2u:6776	 dhyānapāramitāṃ paripūrayiṣyāmīti na sthātavyam upalambhayogena,	K05D0010_H0012:373b-10	དྲན་པ་ཉེ་བར་བཞག་པ་རྣམས་ཡོངས་སུ་རྫོགས་པར་བྱའོ་སྙམ་དུ་དམིགས་པའི་ཚུལ་གྱིས་གནས་པར་མི་བྱའོ་༎
K02sspp2_2u:6777	 prajñāpāramitāṃ paripūrayiṣyāmīti na sthātavyam upalambhayogena.  smṛtyupasthānāni paripūrayiṣyāmīti na sthātavyam upalambhayogena,  samyakprahāṇāni paripūrayiṣyāmīti na sthātavyam upalambhayogena,  ṛddhipādāṃ paripūrayiṣyāmīti na sthātavyam upalambhayogena,  indriyāṇi paripūrayiṣyāmīti na sthātavyam upalambhayogena,  balāni paripūrayiṣyāmīti na sthātavyam upalambhayogena,  bodhyaṅgāni paripūrayiṣyāmīti na sthātavyam upalambhayogena,  āryāṣṭāṅgamārgaṃ paripūrayiṣyāmīti na sthātavyam upalambhayogena,	K05D0010_H0012:373b-11	ཡང་དག་པར་སྤོང་བ་རྣམས་དང་། རྫུ་འཕྲུལ་གྱི་རྐང་པ་རྣམས་དང་། དབང་པོ་དང་། སྟོབས་དང་། བྱང་ཆུབ་ཀྱི་ཡན་ལག་དང་། ལམ་རྣམས་ཡོངས་སུ་རྫོགས་པར་བྱའོ་སྙམ་དུ་དམིགས་པའི་ཚུལ་གྱིས་གནས་པར་མི་བྱའོ་༎
K02sspp2_2u:6785	 bodhisattvaniyāmam avakramiṣyāmīti na sthātavyam upalambhayogena,  bodhisattvaniyāmam avakramya buddhabhūmau sthāsyāmīti bodhisattvena mahāsattvena na sthātavyam upalambhayogena.	K05D0010_H0012:373b-12	བྱང་ཆུབ་སེམས་དཔའ་སེམས་དཔའ་ཆེན་པོས་བྱང་ཆུབ་སེམས་དཔའི་སྐྱོན་མེད་པ་ལ་འཇུག་པར་བྱའོ་སྙམ་དུ་དམིགས་པའི་ཚུལ་གྱིས་གནས་པར་མི་བྱའོ་༎ ༄༣༧༤ཨ་༌༎ བྱང་ཆུབ་སེམས་དཔའ་སེམས་དཔའ་ཆེན་པོས་བྱང་ཆུབ་སེམས་དཔའི་སྐྱོན་མེད་པ་ལ་ཞུགས་ནས་ཕྱིར་མི་ལྡོག་པའི་ས་ལ་གནས་པར་བྱའོ་སྙམ་དུ་དམིགས་པའི་ཚུལ་གྱིས་གནས་པར་མི་བྱའོ་༎
K02sspp2_2u:6787	 (ŚsP II-2 179)  pañcabodhisattvābhijñāḥ paripūrayiṣyāmīti na sthātavyam upalambhayogena,	K05D0010_H0012:374a-1	བྱང་ཆུབ་སེམས་དཔའ་སེམས་དཔའ་ཆེན་པོས་མངོན་པར་ཤེས་པ་ལྔ་ཡོངས་སུ་རྫོགས་པར་བྱའོ་སྙམ་དུ་དམིགས་པའི་ཚུལ་གྱིས་གནས་པར་མི་བྱའོ་༎
K02sspp2_2u:6789	 pañcasu bodhisattvābhijñāsu sthitvā aprameyāny asaṃkhyeyāni buddhakṣetrāṇy upasaṃkramiṣyāmi  buddhānāṃ bhagavatāṃ darśanāya vandanāya paryupāsanāya dharmaśravaṇāya śrutvā ca	K05D0010_H0012:374a-2	བྱང་ཆུབ་སེམས་དཔའ་སེམས་དཔའ་ཆེན་པོས་བྱང་ཆུབ་སེམས་དཔའི་མངོན་པར་ཤེས་པ་ལྔ་ལ་གནས་ཏེ་། སངས་རྒྱས་བཅོམ་ལྡན་འདས་རྣམས་ལ་ཕྱག་བྱ་བ་དང་། བསྙེན་བཀུར་བྱ་བ་དང་། ཆོས་མཉན་པའི་ཕྱིར་སངས་རྒྱས་ཀྱི་ཞིང་དཔག་ཏུ་མེད་། གྲངས་མེད་པ་རྣམས་སུ་འགྲོ་བར་བྱ་ཞིང་།
K02sspp2_2u:6791	 tathatvāya parebhyo deśayiṣyāmīti bodhisattvena mahāsattvena sthātavyam upalambhayogena.	K05D0010_H0012:374a-5	ཆོས་ཐོས་ནས་ཀྱང་དེ་བཞིན་ཉིད་དུ་བསྒྲུབ་ཅིང་། གཞན་དག་ལའང་བསྟན་པར་བྱའོ་སྙམ་དུ་དམིགས་པའི་ཚུལ་གྱིས་གནས་པར་མི་བྱའོ་༎
K02sspp2_2u:6792	 yādṛśāni ca teṣāṃ buddhānāṃ bhagavatāṃ buddhakṣetrāni tadṛśāni eva pariniṣpādayiṣyāmīti bodhisattvena mahāsattvena na sthātavyam upalambhayogena,	K05D0010_H0012:374a-7	བྱང་ཆུབ་སེམས་དཔའ་སེམས་དཔའ་ཆེན་པོས་སངས་རྒྱས་བཅོམ་ལྡན་འདས་དེ་དག་གི་སངས་རྒྱས་ཀྱི་ཞིང་ཅི་འདྲ་བ་དེ་ལྟ་བུ་དག་བསྒྲུབ་པར་བྱའོ་སྙམ་དུ་དམིགས་པའི་ཚུལ་གྱིས་གནས་པར་མི་བྱའོ་༎ བྱང་ཆུབ་སེམས་དཔའ་སེམས་དཔའ་ཆེན་པོས་ཤེས་རབ་ཀྱི་ཕ་རོལ་ཏུ་ཕྱིན་པ་ལ་སྤྱད་དེ་།
K02sspp2_2u:6793	 sattvān bodhau paripācayiṣyāmīti bodhisattvena mahāsattvena sthātavyam upalambhayogena.	K05D0010_H0012:374a-9	སེམས་ཅན་རྣམས་བླ་ན་མེད་པ་ཡང་དག་པར་རྫོགས་པའི་བྱང་ཆུབ་ཏུ་ཡོངས་སུ་སྨིན་པར་བྱའོ་སྙམ་དུ་དམིགས་པའི་ཚུལ་གྱིས་གནས་པར་མི་བྱའོ་༎
K02sspp2_2u:6794	 aprameyāsaṃkhyeyāṃś ca lokadhātuṃ gatvā tān tathāgatān arhataḥ samyaksaṃbuddhān satkariṣyāmīti gurukariṣyāmīti mānayiṣyāmīti pūjayiṣyāmīti,  puṣpamālyagandhavilepanacūrṇacīvaracchatradhvajapatākābhiḥ koṭīniyutaśatasahasraiś ca tāṃs tathāgatāṃ pūjayiṣyāmīty evam api na sthātavyam upalambhayogena,	K05D0010_H0012:374b-0	བྱང་ཆུབ་སེམས་༄༣༧༤བ་དཔའ་སེམས་དཔའ་ཆེན་པོས་འཇིག་རྟེན་གྱི་ཁམས་དཔག་ཏུ་མེད་། གྲངས་མེད་པ་དག་ཏུ་སོང་ཞིང་། དེ་བཞིན་གཤེགས་པ་དགྲ་བཅོམ་པ་ཡང་དག་པར་རྫོགས་པའི་སངས་རྒྱས་རྣམས་ལ་མེ་ཏོག་དང་། སྤོས་དང་། བདུག་པ་དང་། མེ་ཏོག་ཕྲེང་དང་། བྱུག་པ་དང་། ན་བཟའ་དང་། གདུགས་དང་། རྒྱལ་མཚན་དང་། བ་དན་དག་གིས་བཀུར་སྟིར་བྱ་། བླ་མར་བྱ་། བརྗེད་པར་བྱ་། མཆོད་པར་བྱ་ཞིང་། རས་བཅོས་བུ་བྱེ་བ་ཁྲག་ཁྲིག་ཕྲག་འབུམ་ཕྲག་དུ་མ་དག་གིས་། དེ་བཞིན་གཤེགས་པ་དགྲ་བཅོམ་པ་ཡང་དག་པར་རྫོགས་པའི་སངས་རྒྱས་དེ་དག་གི་སྐུ་ལ་གསོལ་བར་བྱའོ་སྙམ་དུའང་དམིགས་པའི་ཚུལ་གྱིས་གནས་པར་མི་བྱའོ་༎
K02sspp2_2u:6796	 aprameyāsaṃkhyeyāṃ sattvān anuttarāyāṃ samyaksaṃbodhau pratiṣṭhāpayiṣyāmīti bodhisattvena mahāsattvena sthātavyam upalambhayogena.	K05D0010_H0012:374b-9	གྲངས་མེད་། ཚད་མེད་པ་དག་བླ་ན་མེད་པ་ཡང་དག་པར་རྫོགས་པའི་བྱང་ཆུབ་ལ་དགོད་པར་བྱའོ་སྙམ་དུ་དམིགས་པའི་ཚུལ་གྱིས་གནས་པར་མི་བྱའོ་༎
K02sspp2_2u:6797	 pañcacakṣuṣy utpādayiṣyāmīti na sthātavyam upalambhayogena. katamāni pañca?  māṃsacakṣur divyacakṣuḥ prajñācakṣur dharmacakṣur buddhacakṣur utpādayiṣyāmīti na sthātavyam upalambhayogena,  sarvasamādhīṃ paripūrayiṣyāmīti na sthātavyam upalambhayogena,  yena yena punaḥ samādhīn ākāṅkṣayiṣyāmi vikrīḍituṃ tena tena samādhinā vikrīḍiṣyāmīti na sthātavyam upalambhayogema,	K05D0010_H0012:374b-10	བྱང་ཆུབ་སེམས་དཔའ་སེམས་དཔའ་ཆེན་པོས་མིག་ལྔ་བསྒྲུབ་པར་བྱ་སྟེ་། ཤའི་མིག་དང་། ལྷའི་མིག་དང་། ཤེས་རབ་ཀྱི་མིག་དང་། ཆོས་ཀྱི་མིག་དང་། སངས་རྒྱས་ཀྱི་མིག་བསྒྲུབ་པར་བྱའོ་སྙམ་དུ་དམིགས་པའི་ཚུལ་གྱིས་གནས་པར་མི་བྱའོ་༎ ཏིང་ངེ་འཛིན་ཐམས་ཅད་བསྒྲུབ་པར་བྱའོ་སྙམ་དུ་དམིགས་པའི་ཚུལ་གྱིས་གནས་པར་མི་བྱའོ་༎ ཏིང་ངེ་འཛིན་གང་དང་གང་གིས་རྣམ་པར་རྩེ་བར་འདོད་པའི་ཏིང་ངེ་འཛིན་དེ་དང་ངེས་རྣམ་པར་རྩེ་༄༣༧༥ཨ་༌༎ བར་བྱའོ་སྙམ་དུ་དམིགས་པའི་ཚུལ་གྱིས་གནས་པར་མི་བྱའོ་༎
K02sspp2_2u:6801	 sarvadhāraṇīmukhāni pariniṣpādayiṣyāmīti na sthātavyam upalambhayogena.	K05D0010_H0012:375a-2	གཟུངས་ཀྱི་སྒོ་ཐམས་ཅད་བསྒྲུབ་པར་བྱའོ་སྙམ་དུ་དམིགས་པའི་ཚུལ་གྱིས་གནས་པར་མི་བྱའོ་༎
K02sspp2_2u:6802	 daśatathāgatabalāni pariniṣpādayiṣyāmīti na sthātavyam upalambhayogena,	K05D0010_H0012:375a-3	བྱང་ཆུབ་སེམས་དཔའ་སེམས་དཔའ་ཆེན་པོས་དེ་བཞིན་གཤེགས་པའི་སྟོབས་བཅུ་བསྒྲུབ་པར་བྱའོ་སྙམ་དུ་དམིགས་པའི་ཚུལ་གྱིས་གནས་པར་མི་བྱའོ་༎
K02sspp2_2u:6803	 catvāri vaiśāradyāni pariniṣpādayiṣyāmīti na sthātavyam upalambhayogena,  catasraḥ pratisaṃvidaḥ pariniṣpādayiṣyāmīti na sthātavyam upalambhayogena,	K05D0010_H0012:375a-4	མི་འཇིགས་པ་བཞི་དང་། སོ་སོ་ཡང་དག་པར་རིག་པ་བཞི་དང་། སངས་རྒྱས་ཀྱི་ཆོས་མ་འདྲེས་པ་བཅོ་བརྒྱད་ཡོངས་སུ་རྫོགས་པར་བྱའོ་སྙམ་དུ་དམིགས་པའི་ཚུལ་གྱིས་གནས་པར་མི་བྱའོ་༎
K02sspp2_2u:6805	 mahāmaitrīṃ pariniṣpādayiṣyāmīti na sthātavyam upalambhayogena,  mahākaruṇāṃ pariniṣpādayiṣyāmīti na sthātavyam upalambhayogena,  aṣṭādaśāveṇikān buddhadharmān pariniṣpādayiṣyāmīti evam api bodhisattvena mahāsattvena na sthātavyam upalambhayogena,	K05D0010_H0012:375a-5	བྱམས་པ་ཆེན་པོ་དང༏་སྙིང་རྗེ་ཆེན་པོ་བསྒྲུབ་པར་བྱའོ་སྙམ་དུ་དམིགས་པའི་ཚུལ་གྱིས་གནས་པར་མི་བྱའོ་༎
K02sspp2_2u:6808	 dvātriṃśatāni mahāpuruṣalakṣaṇāni kāye pariniṣpādayiṣyāmīti na sthātavyam (ŚsP II-2 180)	K05D0010_H0012:375a-6	སྐྱེས་བུ་ཆེན་པོའི་མཚན་སུམ་ཅུ་རྩ་གཉིས་ལུས་ལ་བསྒྲུབ་པར་བྱའོ་སྙམ་དུ་དམིགས་པའི་ཚུལ་གྱིས་གནས་པར་མི་བྱའོ་༎
K02sspp2_2u:6810	 aśīty anuvyañjanāni kāye pariniṣpādayiṣyāmīti bodhisattvena mahāsattvena na sthātavyam upalambhayogena.	K05D0010_H0012:375a-7	དཔེ་བྱད་བཟང་པོ་བརྒྱད་ཅུ་ལུས་ལ་བསྒྲུབ་པར་བྱའོ་སྙམ་དུ་དམིགས་པའི་ཚུལ་གྱིས་གནས་པར་མི་བྱའོ་༎
K02sspp2_2u:6811	 śuddhānusārīni na sthātavyam upalambhayogena,  dharmānusārīni na sthātavyam upalambhayogena,	K05D0010_H0012:375a-8	དད་པས་རྗེས་སུ་འབྲང་བ་དང་། ཆོས་ཀྱི་རྗེས་སུ་འབྲང་བ་ནི་བརྒྱད་པའོ་ཞེས་བྱ་བ་དང་། རེ་ལྟར་ཐོགས་ན་སྲིད་པ་ལན་བདུན་པ་ནི་རྒྱུན་དུ་ཞུགས་པའོ་ཞེས་བྱ་བར་དམིགས་པའི་ཚུལ་གྱིས་གནས་པར་མི་བྱའོ་༎
K02sspp2_2u:6813	 aṣṭamaka iti na sthātavyam upalambhayogena,  srotaāpanna iti na sthātavyam upalambhayogena,  saptakṛtvabhavaparamam iti na sthātavyam upalambhayogena,  kulaṃkula ity ekavīcika iti na sthātavyam upalambhayogena,  samaśīrṣapudgala iti na sthātavyam upalambhayogena,	K05D0010_H0012:375a-9	རིགས་ནས་རིགས་སུ་སྐྱེ་བ་དང་། བར་ཆད་གཅིག་པ་ཞེས་བྱ་བར་དམིགས་པའི་ཚུལ་གྱིས་གནས་པར་མི་བྱའོ་༎
K02sspp2_2u:6818	 āyuḥkṣaye kleśakṣaye ceti na sthātavyam upalambhayogena,	K05D0010_H0012:375b-0	ཚེ་ཟད་པ་དང་། ཉོན་མོངས་པ་ཟད་པ་ནི་གང་ཟག་མགོ་མཉམ་པ་ཞེས་བྱ་བར་དམིགས་༄༣༧༥བ་པའི་ཚུལ་གྱིས་གནས་པར་མི་བྱའོ་༎
K02sspp2_2u:6819	 avinipātadharmā iti na sthātavyam upalambhayogena,  sakṛdāgāmi sakṛd imaṃ lokam āgamya duḥkhasyāṃ taṃ kariṣyāmīti na sthātavyam upalambhayogena,	K05D0010_H0012:375b-1	རྒྱུན་དུ་ཞུགས་པ་ནི་བར་མ་དོར་ཡོངས་སུ་མྱ་ངན་ལས་འདའ་བར་འགྱུར་རོ་ཞེས་བྱ་བར་དམིགས་པའི་ཚུལ་གྱིས་གནས་པར་མི་བྱའོ་༎ ལན་གཅིག་ཕྱིར་འོང་པ་ནི་འཇིག་རྟེན་འདིར་ལན་གཅིག་འོངས་ནས་སྡུག་བསྔལ་མཐར་ཕྱིན་པར་འགྱུར་བའོ་ཞེས་བྱ་བར་དམིགས་པའི་ཚུལ་གྱིས་གནས་པར་མི་བྱའོ་༎
K02sspp2_2u:6821	 anāgagāmiphalasākṣātkriyāyai pratikannaka iti na sthātavyam upalambhayogena,	K05D0010_H0012:375b-3	ཕྱིར་མི་འོང་བའི་འབྲས་བུ་མངོན་སུམ་དུ་བྱ་བའི་ཕྱིར་ཞུགས་པའོ་ཞེས་བྱ་བར་དམིགས་པའི་ཚུལ་གྱིས་གནས་པར་མི་བྱའོ་༎
K02sspp2_2u:6822	 anāgāmi tatraiva nirvāsyatīti na sthātavyam upalambhayogena,	K05D0010_H0012:375b-4	ཕྱིར་མི་འོང་བ་ནི་དེར་ཡོངས་སུ་མྱ་ངན་ལས་འདའ་བའོ་ཞེས་བྱ་བར་དམིགས་པའི་ཚུལ་གྱིས་གནས་པར་མི་བྱའོ་༎
K02sspp2_2u:6823	 arhatphalasākṣātkriyāyaiḥ pratipannaka iti na sthātavyam upalambhayogena,	K05D0010_H0012:375b-5	དགྲ་བཅོམ་པའི་འབྲས་བུ་མངོན་སུམ་དུ་བྱ་བའི་ཕྱིར་ཞུགས་པའོ་ཞེས་བྱ་བར་དམིགས་པའི་ཚུལ་གྱིས་གནས་པར་མི་བྱའོ་༎
K02sspp2_2u:6824	 arhann ihaivānupadhiśeṣanirvāṇadhātau parinirvāpayiṣyatīti na sthātavyam upalambhayogena,	K05D0010_H0012:375b-6	དགྲ་བཅོམ་པ་ནི་འདི་ཉིད་ལ་ཕུང་པོའི་ལྷག་མ་མེད་པའི་མྱ་ངན་ལས་འདས་པའི་དབྱིངས་སུ་ཡོངས་སུ་མྱ་ངན་ལས་འདའ་བའོ་ཞེས་བྱ་བར་དམིགས་པའི་ཚུལ་གྱིས་གནས་པར་མི་བྱའོ་༎
K02sspp2_2u:6825	 pratyekabuddha iti na sthātavyam upalambhayogena,	K05D0010_H0012:375b-7	རང་སངས་རྒྱས་ཞེས་བྱ་བར་དམིགས་པའི་ཚུལ་གྱིས་གནས་པར་མི་བྱའོ་༎
