src_segmentnr	src_original	tgt_segmentnr	tgt_original
K02sspp2_2u:5520	 iti hi śrāvakaśūnyatā ca pratyekabuddhaśūnyatā ca buddhaśūnyatā ca bodhisattvaśūnyatā  cādvayam etad advaidhīkāram. evaṃ khalu kauśika bodhisattvena mahāsattvena prajñāpāramitāyāṃ sthātavyam.	K05D0010_H0012:370b-13	དེ་ལྟར་ན་དྲན་པ་ཉེ་བར་བཞག་པ་རྣམས་ཀྱི་སྟོང་པ་ཉིད་གང་ཡིན་པ་དང་། སངས་རྒྱས་ཀྱི་ཆོས་མ་འདྲེས་པ་རྣམས་ཀྱི་བར་གྱི་སྟོང་པ་ཉིད་གང་ཡིན་པ་དང་། བྱང་ཆུབ་སེམས་དཔའི་སྟོང་པ་ཉིད་གང་ཡིན་པ་དེ་ནི་གཉིས་སུ་མེད་ཅིང་གཉིས་སུ་དབྱེར་མེད་དོ་༎
K02sspp2_2u:5522	 punar aparaṃ kauśika srotaāpattiphalaṃ srotaāpattiphalena śūnyaṃ,  sakṛdāgāmiphalaṃ sakṛdāgāmiphalena śūnyaṃ,	K05D0010_H0012:370b-14	ཀོཨོ་ཤི་ཀ་། གཞན་༄༣༧༡ཨ་༌༎ ཡང་ཏིང་ངེ་འཛིན་རྣམས་ནི་ཏིང་ངེ་འཛིན་རྣམས་ཀྱིས་སྟོང་། གཟུངས་ཀྱི་སྒོ་རྣམས་ནི་གཟུངས་ཀྱི་སྒོ་རྣམས་ཀྱིས་སྟོང་།
K02sspp2_2u:5525	 arhattvam arhattvena śūnyṃ,	K05D0010_H0012:371a-5	གཞན་ཡང་ཉན་ཐོས་ཀྱི་ཐེག་པ་ནི་ཉན་ཐོས་ཀྱི་ཐེག་པས་སྟོང་།
K02sspp2_2u:5526	 pratyekabodhiḥ pratyekabodhyā śūnyā,	K05D0010_H0012:371a-6	རང་སངས་རྒྱས་ཀྱི་ཐེག་པ་ནི་རང་སངས་རྒྱས་ཀྱི་ཐེག་པས་སྟོང་། ཐེག་པ་ཆེན་པོ་ནི་ཐེག་པ་ཆེན་པོས་སྟོང་།
K02sspp2_2u:5528	 sarvākārajñatā sarvākārajñatayā śūnyā,	K05D0010_H0012:371a-14	ཀོཨོ་ཤི་ཀ་། གཞན་ཡང་རྣམ་པ་ཐམས་ཅད་མཁྱེན་པ་ཉིད་ཀྱི་བར་ནི་རྣམ་པ་ཐམས་ཅད་མཁྱེན་པ་ཉིད་ཀྱི་བར་གྱིས་སྟོང་།
K02sspp2_2u:5529	 bodhisattvo bodhisattvena śūnyaḥ,	K05D0010_H0012:371b-0	བྱང་ཆུབ་སེམས་དཔའ་ནི་བྱང་ཆུབ་སེམས་༄༣༧༡བ་དཔས་སྟོང་སྟེ་།
K02sspp2_2u:5530	 iti hi śrotraāpattiphalaśūnyatā ca sakṛdāgāmiphalaśūnyatā cānāgāmiphalaśūnyatā cārhatphalaśūnyatā ca pratyekabodhiśūnyatā ca mārgākārajñatāśūnyatā (ŚsP II-2 143)  ca sarvākārajñatāśūnyatā ca bodhisattvaśūnyatā cādvayam etad advaidhīkāram. evaṃ khalu kauśika bodhisattvena mahāsattvena prajñāpāramitāyāṃ	K05D0010_H0012:371b-1	དེ་ལྟར་ན་རྣམ་པ་ཐམས་ཅད་མཁྱེན་པ་ཉིད་ཀྱི་བར་གྱི་སྟོང་པ་ཉིད་གང་ཡིན་པ་དང་། བྱང་ཆུབ་སེམས་དཔའི་སྟོང་པ་ཉིད་གང་ཡིན་པ་དེ་ནི་གཉིས་སུ་མེད་ཅིང་གཉིས་སུ་དབྱེར་མེད་དེ༏་ཀོཨོ་ཤི་ཀ་། བྱང་ཆུབ་སེམས་དཔའ་སེམས་དཔའ་ཆེན་པོས་དེ་ལྟར་ཤེས་རབ་ཀྱི་ཕ་རོལ་ཏུ་ཕྱིན་པ་ལ་གནས་པར་བྱའོ་༎
K02sspp2_2u:5532	 atha khalu śakro devānām indraḥ subhūtiṃ sthaviram etad avocat:	K05D0010_H0012:371b-3	དེ་ནས་ལྷའི་དབང་པོ་བརྒྱ་བྱིན་གྱིས་། ཚེ་དང་ལྡན་པ་རབ་འབྱོར་ལ་འདི་སྐད་ཅེས་སྨྲས་སོ་༎
K02sspp2_2u:5533	 kathaṃ bhadanta subhūte bodhisattvena mahāsattvena prajñāpāramitāyāṃ na sthātavyam?	K05D0010_H0012:371b-5	བཙུན་པ་རབ་འབྱོར་། བྱང་ཆུབ་སེམས་དཔའ་སེམས་དཔའ་ཆེན་པོས་ཇི་ལྟར་ཤེས་རབ་ཀྱི་ཕ་རོལ་ཏུ་ཕྱིན་པ་ལ་གནས་པར་མི་བྱ་བ་ཡིན་།
K02sspp2_2u:5534	 subhūtir āha:	K05D0010_H0012:371b-7	རབ་འབྱོར་གྱིས་སྨྲས་པ་།
K02sspp2_2u:5535	 iti hi kauśika bodhisattvena mahāsattvena prajñāpāramitāyāṃ caratā rūpe na sthātavyam upalambhayogena,	K05D0010_H0012:371b-8	ཀོཨོ་ཤི་ཀ་། འདི་ལ་བྱང་ཆུབ་སེམས་དཔའ་སེམས་དཔའ་ཆེན་པོས་གཟུགས་ལ་དམིགས་པའི་ཚུལ་གྱིས་གནས་པར་མི་བྱའོ་༎
K02sspp2_2u:5536	 vedanāyāṃ na sthātavyam upalambhayogena,  saṃjñāyāṃ na sthātavyam upalambhayogena,  saṃskāreṣu na sthātavyam upalambhayogena,  vijñāne na sthātavyam upalambhayogena.	K05D0010_H0012:371b-10	ཚོར་བ་དང་། འདུ་ཤེས་དང་། འདུ་བྱེད་རྣམས་དང་། རྣམ་པར་ཤེས་པ་ལ་དམིགས་པའི་ཚུལ་གྱིས་གནས་པར་མི་བྱའོ་༎
K02sspp2_2u:5540	 cakṣuṣi na sthātavyam upalambhayogena,  śrotre na sthātavyam upalambhayogena,  ghrāṇe na sthātavyam upalambhayogena,  jihvāyāṃ na sthātavyam upalambhayogena,  kāye na sthātavyam upalambhayogena,  manasi na sthātavyam upalambhayogena.	K05D0010_H0012:371b-11	མིག་ལ་དམིགས་པའི་ཚུལ་གྱིས་གནས་པར་མི་བྱའོ་༎
K02sspp2_2u:5546	 rūpe na sthātavyam upalambhayogena,  śabde na sthātavyam upalambhayogena,  gandhe na sthātavyam upalambhayogena,  rase na sthātavyam upalambhayogena,  sparśe na sthātavyam upalambhayogena,  dharmeṣu na sthātavyam upalambhayogena.	K05D0010_H0012:371b-12	གཟུགས་ལ་དམིགས་པའི་ཚུལ་གྱིས་གནས་པར་མི་བྱའོ་༎
K02sspp2_2u:5552	 cakṣurvijñāne na sthātavyam upalambhayogena,  śrotravijñāne na sthātavyam upalambhayogena,  ghrāṇavijñāne na sthātavyam upalambhayogena,  jihvāvijñāne na sthātavyam upalambhayogena,  kāyavijñāne na sthātavyam upalambhayogena,  manovijñāne na sthātavyam upalambhayogena.  cakṣuḥsaṃsparśe na sthātavyam upalambhayogena,	K05D0010_H0012:371b-13	མིག་གི་རྣམ་པར་ཤེས་པ་ལ་དམིགས་པའི་ཚུལ་གྱིས་གནས་པར་མི་བྱའོ་༎
K02sspp2_2u:5559	 śrotrasaṃsparśe na sthātavyam upalambhayogena,  ghrāṇasaṃsparśe na sthātavyam upalambhayogena,  jihvāsaṃsparśe na sthātavyam upalambhayogena,  kāyasaṃsparśe na sthātavyam upalambhayogena,  manaḥsaṃsparśe na sthātavyam upalambhayogena.  cakṣuḥsaṃsparśajāyāṃ vedanāyāṃ na sthātavyam upalambhayogena,  śrotrasaṃsparśajāyāṃ vedanāyāṃ na sthātavyam upalambhayogena,  ghrāṇasaṃsparśajāyāṃ vedanāyāṃ na sthātavyam upalambhayogena,  jihvāsaṃsparśajāyāṃ vedanāyāṃ na sthātavyam upalambhayogena,  kāyasaṃsparśajāyāṃ vedanāyāṃ na sthātavyam upalambhayogena,	K05D0010_H0012:371b-14	མིག་གི་འདུས་ཏེ་རེག་པ་ལ་དམིགས་པའི་ཚུལ་གྱིས་གནས་པར་མི་བྱའོ་༎
K02sspp2_2u:5569	 manaḥsaṃsparśajāyāṃ (ŚsP II-2 144)  vedanāyāṃ na sthātavyam upalambhayogena.	K05D0010_H0012:371b-15	མིག་གི་འདུས་ཏེ་རེག་པ་ལས་བྱུང་བའི་ཚོར་བ་ལ་དམིགས་པའི་ཚུལ་གྱིས་གནས་པར་མི་བྱའོ་༎
K02sspp2_2u:5571	 pṛthivīdhātau na sthātavyam upalambhayogena,  abdhātau na sthātavyam upalambhayogena,  tejodhātau na sthātavyam upalambhayogena,  vāyudhātau na sthātavyam upalambhayogena,  ākāśadhātau na sthātavyam upalambhayogena,  vijñānadhātau na sthātavyam upalambhayogena.  avidyāyāṃ na sthātavyam upalambhayogena,	K05D0010_H0012:371b-16	དེ་བཞིན་དུ་རྣ་བ་དང་། སྣ་དང་། ལྕེ་དང་། ལུས་དང་། ཡིད་ལ་དམིགས་པའི་ཚུལ་གྱིས་གནས་པར་མི་བྱའོ་༎
K02sspp2_2u:5578	 saṃskāreṣu na sthātavyam upalambhayogena,	K05D0010_H0012:372a-0	ཆོས་རྣམས་དང་། ཡིད་ཀྱི་རྣམ་པར་༄༣༧༢ཨ་༌༎
K02sspp2_2u:5579	 vijñāne na sthātavyam upalambhayogena,  nāmarūpe na sthātavyam upalambhayogena,  ṣaḍāyatane na sthātavyam upalambhayogena,  sparśe na sthātavyam upalambhayogena,  vedanāyāṃ na sthātavyam upalambhayogena,	K05D0010_H0012:372a-1	ཤེས་པ་དང་། ཡིད་ཀྱི་འདུས་ཏེ་རེག་པ་དང་། ཡིད་ཀྱི་འདུས་ཏེ་རེག་པ་ལས་བྱུང་བའི་ཚོར་བ་ལ་དམིགས་པའི་ཚུལ་གྱིས་གནས་པར་མི་བྱའོ་༎
K02sspp2_2u:5584	 tṛṣṇāyāṃ na sthātavyam upalambhayogena,  upadāne na sthātavyam upalambhayogena,  bhave na sthātavyam upalambhayogena,	K05D0010_H0012:372a-2	སའི་ཁམས་ལ་དམིགས་པའི་ཚུལ་གྱིས་གནས་པར་མི་བྱའོ་༎
K02sspp2_2u:5619	 bodhyaṅgeṣu na sthātavyam upalambhayogena,  āryāṣṭāṅge marge na sthātavyam upalambhayogena,  āryasatyeṣu na sthātavyam upalambhayogena,	K05D0010_H0012:371b-10	ཚོར་བ་དང་། འདུ་ཤེས་དང་། འདུ་བྱེད་རྣམས་དང་། རྣམ་པར་ཤེས་པ་ལ་དམིགས་པའི་ཚུལ་གྱིས་གནས་པར་མི་བྱའོ་༎
K02sspp2_2u:5622	 dhyāneṣu na sthātavyam upalambhayogena,	K05D0010_H0012:371b-11	མིག་ལ་དམིགས་པའི་ཚུལ་གྱིས་གནས་པར་མི་བྱའོ་༎
K02sspp2_2u:5623	 apramāṇeṣu na sthātavyam upalambhayogena,  ārūpyasamāpattiṣu na sthātavyam upalambhayogena,	K05D0010_H0012:371b-12	གཟུགས་ལ་དམིགས་པའི་ཚུལ་གྱིས་གནས་པར་མི་བྱའོ་༎ མིག་གི་རྣམ་པར་ཤེས་པ་ལ་དམིགས་པའི་ཚུལ་གྱིས་གནས་པར་མི་བྱའོ་༎ མིག་གི་འདུས་ཏེ་རེག་པ་ལ་དམིགས་པའི་ཚུལ་གྱིས་གནས་པར་མི་བྱའོ་༎
K02sspp2_2u:5625	 vimokṣeṣu na sthātavyam upalambhayogena,	K05D0010_H0012:371b-15	མིག་གི་འདུས་ཏེ་རེག་པ་ལས་བྱུང་བའི་ཚོར་བ་ལ་དམིགས་པའི་ཚུལ་གྱིས་གནས་པར་མི་བྱའོ་༎
K02sspp2_2u:5626	 navānupūrvavihārasamāpattiṣu na sthātavyam upalambhayogena,  śūnyatānimittāpraṇihitavimokṣamukheṣu na sthātavyam upalambhayogena,	K05D0010_H0012:371b-16	དེ་བཞིན་དུ་རྣ་བ་དང་། སྣ་དང་། ལྕེ་དང་། ལུས་དང་། ཡིད་ལ་དམིགས་པའི་ཚུལ་གྱིས་གནས་པར་མི་བྱའོ་༎
K02sspp2_2u:5628	 abhijñāsu na sthātavyam upalambhayogena,	K05D0010_H0012:372a-0	ཆོས་རྣམས་དང་། ཡིད་ཀྱི་རྣམ་པར་༄༣༧༢ཨ་༌༎
K02sspp2_2u:5629	 samādhiṣu na sthātavyam upalambhayogena,  dhāraṇīmukheṣu na sthātavyam upalambhayogena,  tathāgatabaleṣu na sthātavyam upalambhayogena,  vaiśāradyeṣu na sthātavyam upalambhayogena,  pratisaṃvitsu na sthātavyam upalambhayogena,  mahāmaitryāṃ na sthātavyam upalambhayogena,  mahākaruṇāyāṃ na sthātavyam upalambhayogena,  āveṇikabuddhadharmeṣu na sthātavyam upalambhayogena,	K05D0010_H0012:372a-1	ཤེས་པ་དང་། ཡིད་ཀྱི་འདུས་ཏེ་རེག་པ་དང་། ཡིད་ཀྱི་འདུས་ཏེ་རེག་པ་ལས་བྱུང་བའི་ཚོར་བ་ལ་དམིགས་པའི་ཚུལ་གྱིས་གནས་པར་མི་བྱའོ་༎
K02sspp2_2u:5637	 śrāvakayāne na sthātavyam upalambhayogena,	K05D0010_H0012:372a-2	སའི་ཁམས་ལ་དམིགས་པའི་ཚུལ་གྱིས་གནས་པར་མི་བྱའོ་༎
K02sspp2_2u:5638	 pratyekabuddhayāne na sthātavyam upalambhayogena,  buddhayāne na sthātavyam upalambhayogena,  srotaāpattiphale na sthātavyam upalambhayogena,  sakṛdāgāmiphale na sthātavyam upalambhayogena,	K05D0010_H0012:372a-3	ཆུའི་ཁམས་དང་། མེའི་ཁམས་དང་། རླུང་གི་ཁམས་དང་། ནམ་མཁའི་ཁམས་དང་། རྣམ་པར་ཤེས་པའི་ཁམས་ལ་དམིགས་པའི་ཚུལ་གྱིས་གནས་པར་མི་བྱའོ་༎
K02sspp2_2u:5642	 anāgāmiphale na sthātavyam upalambhayogena,  arhatphale na sthātavyam upalambhayogena,	K05D0010_H0012:372a-4	དྲན་པ་ཉེ་བར་བཞག་པ་རྣམས་ལ་དམིགས་པའི་ཚུལ་གྱིས་གནས་པར་མི་བྱའོ་༎
K02sspp2_2u:5644	 pratyekabuddhatve na sthātavyam upalambhayogena,  sarvajñatāyāṃ na sthātavyam upalambhayogena,  mārgākārajñatāyāṃ na sthātavyam upalambhayogena,  sarvākārajñatāyāṃ na sthātavyam upalambhayogena.	K05D0010_H0012:372a-5	ཡང་དག་པར་སྤོང་བ་རྣམས་དང་། རྫུ་འཕྲུལ་གྱི་རྐང་པ་རྣམས་དང་། དབང་པོ་རྣམས་དང་། སྟོབས་རྣམས་དང་། བྱང་ཆུབ་ཀྱི་ཡན་ལག་རྣམས་དང་། ལམ་དང་། སྟོབས་བཅུ་དང་། མི་འཇིགས་པ་རྣམས་དང་། སོ་སོ་ཡང་དག་པར་རིག་པ་རྣམས་དང་། སངས་རྒྱས་ཀྱི་ཆོས་མ་འདྲེས་པ་རྣམས་དང་། རྣམ་པ་ཐམས་ཅད་མཁྱེན་པ་ཉིད་ལ་དམིགས་པའི་ཚུལ་གྱིས་གནས་པར་མི་བྱའོ་༎
K02sspp2_2u:5648	 rūpam iti na sthātavyam upalambhayogena,  vedaneti na sthātavyam upalambhayogena,  saṃjñeti na sthātavyam upalambhayogena,	K05D0010_H0012:372a-7	རྒྱུན་དུ་ཞུགས་པའི་འབྲས་བུ་ལ་དམིགས་པའི་ཚུལ་གྱིས་གནས་པར་མི་བྱའོ་༎ ལན་གཅིག་ཕྱིར་འོང་བའི་འབྲས་བུ་དང་། ཕྱིར་མི་འོང་བའི་འབྲས་བུ་དང་། དགྲ་བཅོམ་པ་ཉིད་དང་། རང་སངས་རྒྱས་ཉིད་ལ་དམིགས་པའི་ཚུལ་གྱིས་གནས་པར་མི་བྱའོ་༎
K02sspp2_2u:5634	 mahāmaitryāṃ na sthātavyam upalambhayogena,  mahākaruṇāyāṃ na sthātavyam upalambhayogena,	K05D0010_H0012:375a-5	བྱམས་པ་ཆེན་པོ་དང༏་སྙིང་རྗེ་ཆེན་པོ་བསྒྲུབ་པར་བྱའོ་སྙམ་དུ་དམིགས་པའི་ཚུལ་གྱིས་གནས་པར་མི་བྱའོ་༎
K02sspp2_2u:5636	 āveṇikabuddhadharmeṣu na sthātavyam upalambhayogena,	K05D0010_H0012:375a-6	སྐྱེས་བུ་ཆེན་པོའི་མཚན་སུམ་ཅུ་རྩ་གཉིས་ལུས་ལ་བསྒྲུབ་པར་བྱའོ་སྙམ་དུ་དམིགས་པའི་ཚུལ་གྱིས་གནས་པར་མི་བྱའོ་༎ དཔེ་བྱད་བཟང་པོ་བརྒྱད་ཅུ་ལུས་ལ་བསྒྲུབ་པར་བྱའོ་སྙམ་དུ་དམིགས་པའི་ཚུལ་གྱིས་གནས་པར་མི་བྱའོ་༎ དད་པས་རྗེས་སུ་འབྲང་བ་དང་། ཆོས་ཀྱི་རྗེས་སུ་འབྲང་བ་ནི་བརྒྱད་པའོ་ཞེས་བྱ་བ་དང་། རེ་ལྟར་ཐོགས་ན་སྲིད་པ་ལན་བདུན་པ་ནི་རྒྱུན་དུ་ཞུགས་པའོ་ཞེས་བྱ་བར་དམིགས་པའི་ཚུལ་གྱིས་གནས་པར་མི་བྱའོ་༎ རིགས་ནས་རིགས་སུ་སྐྱེ་བ་དང་། བར་ཆད་གཅིག་པ་ཞེས་བྱ་བར་དམིགས་པའི་ཚུལ་གྱིས་གནས་པར་མི་བྱའོ་༎ ཚེ་ཟད་པ་དང་། ཉོན་མོངས་པ་ཟད་པ་ནི་གང་ཟག་མགོ་མཉམ་པ་ཞེས་བྱ་བར་དམིགས་༄༣༧༥བ་པའི་ཚུལ་གྱིས་གནས་པར་མི་བྱའོ་༎
K02sspp2_2u:5637	 śrāvakayāne na sthātavyam upalambhayogena,	K05D0010_H0012:375b-1	རྒྱུན་དུ་ཞུགས་པ་ནི་བར་མ་དོར་ཡོངས་སུ་མྱ་ངན་ལས་འདའ་བར་འགྱུར་རོ་ཞེས་བྱ་བར་དམིགས་པའི་ཚུལ་གྱིས་གནས་པར་མི་བྱའོ་༎
K02sspp2_2u:5638	 pratyekabuddhayāne na sthātavyam upalambhayogena,  buddhayāne na sthātavyam upalambhayogena,	K05D0010_H0012:375b-2	ལན་གཅིག་ཕྱིར་འོང་པ་ནི་འཇིག་རྟེན་འདིར་ལན་གཅིག་འོངས་ནས་སྡུག་བསྔལ་མཐར་ཕྱིན་པར་འགྱུར་བའོ་ཞེས་བྱ་བར་དམིགས་པའི་ཚུལ་གྱིས་གནས་པར་མི་བྱའོ་༎
K02sspp2_2u:5640	 srotaāpattiphale na sthātavyam upalambhayogena,  sakṛdāgāmiphale na sthātavyam upalambhayogena,	K05D0010_H0012:375b-3	ཕྱིར་མི་འོང་བའི་འབྲས་བུ་མངོན་སུམ་དུ་བྱ་བའི་ཕྱིར་ཞུགས་པའོ་ཞེས་བྱ་བར་དམིགས་པའི་ཚུལ་གྱིས་གནས་པར་མི་བྱའོ་༎ ཕྱིར་མི་འོང་བ་ནི་དེར་ཡོངས་སུ་མྱ་ངན་ལས་འདའ་བའོ་ཞེས་བྱ་བར་དམིགས་པའི་ཚུལ་གྱིས་གནས་པར་མི་བྱའོ་༎
K02sspp2_2u:5642	 anāgāmiphale na sthātavyam upalambhayogena,  arhatphale na sthātavyam upalambhayogena,	K05D0010_H0012:375b-5	དགྲ་བཅོམ་པའི་འབྲས་བུ་མངོན་སུམ་དུ་བྱ་བའི་ཕྱིར་ཞུགས་པའོ་ཞེས་བྱ་བར་དམིགས་པའི་ཚུལ་གྱིས་གནས་པར་མི་བྱའོ་༎ དགྲ་བཅོམ་པ་ནི་འདི་ཉིད་ལ་ཕུང་པོའི་ལྷག་མ་མེད་པའི་མྱ་ངན་ལས་འདས་པའི་དབྱིངས་སུ་ཡོངས་སུ་མྱ་ངན་ལས་འདའ་བའོ་ཞེས་བྱ་བར་དམིགས་པའི་ཚུལ་གྱིས་གནས་པར་མི་བྱའོ་༎
K02sspp2_2u:5644	 pratyekabuddhatve na sthātavyam upalambhayogena,	K05D0010_H0012:375b-7	རང་སངས་རྒྱས་ཞེས་བྱ་བར་དམིགས་པའི་ཚུལ་གྱིས་གནས་པར་མི་བྱའོ་༎
K02sspp2_2u:5646	 mārgākārajñatāyāṃ na sthātavyam upalambhayogena,	K05D0010_H0012:375b-9	ལམ་གྱི་རྣམ་པ་ཤེས་པའི་ཡེ་ཤེས་ལ་དམིགས་པའི་ཚུལ་གྱིས་གནས་པར་མི་བྱའོ་༎
K02sspp2_2u:6727	 sarvajñatā viviktety avivikteti na sthātavyam upalambhayogena,	K05D0010_H0012:372a-6	སངས་རྒྱས་ཀྱི་ཆོས་མ་འདྲེས་པ་རྣམས་དང་། རྣམ་པ་ཐམས་ཅད་མཁྱེན་པ་ཉིད་ལ་དམིགས་པའི་ཚུལ་གྱིས་གནས་པར་མི་བྱའོ་༎ རྒྱུན་དུ་ཞུགས་པའི་འབྲས་བུ་ལ་དམིགས་པའི་ཚུལ་གྱིས་གནས་པར་མི་བྱའོ་༎ ལན་གཅིག་ཕྱིར་འོང་བའི་འབྲས་བུ་དང་། ཕྱིར་མི་འོང་བའི་འབྲས་བུ་དང་། དགྲ་བཅོམ་པ་ཉིད་དང་། རང་སངས་རྒྱས་ཉིད་ལ་དམིགས་པའི་ཚུལ་གྱིས་གནས་པར་མི་བྱའོ་༎ སངས་རྒྱས་ཉིད་ལ་དམིགས་པའི་ཚུལ་གྱིས་གནས་པར་མི་བྱའོ་༎
K02sspp2_2u:6729	 sarvajñatā nimittety animitteti na sthātavyam upalambhayogena,  sarvajñatā praṇihitety apraṇihiteti na sthātavyam upalambhayogena.	K05D0010_H0012:372a-11	དེ་ལྟར་ན་གཟུགས་ཞེས་བྱ་བར་དམིགས་པའི་ཚུལ་གྱིས་གནས་པར་མི་བྱའོ་༎ རྣམ་༄༣༧༢བ་པ་ཐམས་ཅད་མཁྱེན་པ་ཉིད་ཅེས་བྱ་བའི་བར་དུ་དམིགས་པའི་ཚུལ་གྱིས་གནས་པར་མི་བྱའོ་༎ དེ་ལྟར་ན་རྒྱུན་དུ་ཞུགས་པའི་འབྲས་བུ་ཞེས་བྱ་བར་དམིགས་པའི་ཚུལ་གྱིས་གནས་པར་མི་བྱའོ་༎ སངས་རྒྱས་ཉིད་ཅེས་བྱ་བའི་བར་དུ་དམིགས་པའི་ཚུལ་གྱིས་གནས་པར་མི་བྱའོ་༎
K02sspp2_2u:6731	 mārgākārajñatā nityety anityeti na sthātavyam upalambhayogena,	K05D0010_H0012:372b-3	གཟུགས་རྟག་ཅེས་བྱ་བར་དམིགས་པའི་ཚུལ་གྱིས་གནས་པར་མི་བྱའོ་༎
K02sspp2_2u:6732	 mārgākārajñatā sukheti duḥkheti na sthātavyam upalambhayogena,	K05D0010_H0012:372b-4	དེ་བཞིན་དུ་མི་རྟག་ཅེས་བྱ་བ་དང་། བདེ་ཞེས་བྱ་བ་དང་། སྡུག་བསྔལ་ཞེས་བྱ་བ་དང་། བདག་ཅེས་བྱ་བ་དང་། བདག་མེད་ཅེས་བྱ་བ་དང་། ཞི་ཞེས་བྱ་བ་དང་། མ་ཞི་ཞེས་བྱ་བ་དང་།
K02sspp2_2u:6736	 mārgākārajñatā viviktety avivikteti na sthātavyam upalambhayogena,	K05D0010_H0012:372b-6	སྨོན་པ་མེད་ཅེས་བྱ་བར་དམིགས་པའི་ཚུལ་གྱིས་གནས་པར་མི་བྱའོ་༎ དེ་བཞིན་དུ་ཚོར་བ་དང་། འདུ་ཤེས་དང་། འདུ་བྱེད་རྣམས་དང་། རྣམ་པར་ཤེས་པ་རྟག་ཅེས་བྱ་བ་དང་། མི་རྟག་ཅེས་བྱ་བ་དང་། བདེ་ཞེས་བྱ་བ་དང་། སྡུག་བསྔལ་ཞེས་བྱ་བ་དང་། བདག་ཅེས་བྱ་བ་དང་།
