src_segmentnr	src_original	tgt_segmentnr	tgt_original
K02sspp2_2u:3331	 sacet punar āyuṣmañ chāradvatīputra bodhisattvasya mahāsattvasya prajñāpāramitāyāṃ  bhāṣyamāṇāyāṃ na bhavati kāṅkṣāyitatvaṃ vā dhanvāyitatvaṃ vā veditavyam āyuṣmañ chāradvatīputra	T16D4357:375b-0	ཚེ་དང་ལྡན་པ་ཤ་ར་དབ༹་ཏིའི་བུ་ཤེས་རབ་ཀྱི་ཕ་རོལ་དུ་ཕྱིན་པ་འདི་༄༣༧༥བ་བཤད་པ་ན་། གལ་ཏེ་བྱང་ཆུབ་སེམས་དཔའ་སེམས་དཔའ་ཆེན་པོ་ནེམ་ནུར་མེད་ཅིང་། རྨོངས་པ་མེད་པར་གྱུར་ན་།
K02sspp2_2u:3333	 viharaty ayaṃ bodhisattvo mahāsattvo 'nena vihāreṇa yad uta sarvasattvānāṃ trāṇāya  sarvasattvānām aparityāgatāyai tac cānupalambhayogena viharaty ayaṃ bodhisattvo mahāsattvo	T16D4357:375b-3	བྱང་ཆུབ་སེམས་དཔའ་སེམས་དཔའ་ཆེན་པོ་དེ་ནི་འདི་ལྟ་བུ་སྟེ་། སེམས་ཅན་ཐམས་ཅད་བསྐྱབ་པ་དང་། སེམས་ཅན་ཐམས་ཅད་ཡོངས་སུ་མི་གཏོང་བའི་ཕྱིར་། དེ་ཡང་མི་གནས་བའི་ཚུལ་གྱིས་གནས་ཤིང་།
K02sspp2_2u:3335	 'nena manasikāreṇa yad uta mahākaruṇā manasikārena.	T16D4357:375b-7	བྱང་ཆུབ་སེམས་དཔའ་སེམས་དཔའ་ཆེན་པོ་དེ་ནི་འདི་ལྟ་སྟེ་། སྙིང་རྗེ་ཆེན་པོ་ཡིད་ལ་བྱེད་པ་དེ་དང་མ་བྲལ་བར་རིག་པར་བྱའོ་༎
K02sspp2_2u:3336	 āha: viharatum āyuṣman subhūte bodhisattvo mahāsattvo 'yam anena vihāreṇecchasi,  avirahitaṃ cānena manasikāreṇa yad uta mahākaruṇā manasikāreṇa,	T16D4357:375b-9	ཤའ་རིའི་བུས་སྨྲས་པ་། སྙིང་རྗེ་ཆེན་པོ་ཡིད་ལ་བྱེད་པ་དེ་ཡིད་ལ་བྱེད་པ་དེ་དང་མ་བྲལ་བར་གནས་པ་སྟེ་། བྱང་ཆུབ་སེམས་དཔའ་སེམས་དཔའ་ཆེན་པོ་ཡིན་པར་འདོད་ན་།
K02sspp2_2u:3338	 evaṃ saty āyuṣman subhūte sarvasattvā bodhisattvā bhaviṣyanti. tat kasya hetoḥ?	T16D4357:375b-13	ཚེ་དང་ལྡན་པ་རབ་འབྱོར་དེ་ལྟར་ན་སེམས་ཅན་ཐམས་ཅད་ཀྱང་བྱང་ཆུབ་སེམས་དཔའ་ཡིན་པར་འགྱུར་རོ་༎
