src_segmentnr	src_original	tgt_segmentnr	tgt_original
K02sspp2_2u:6827	 mārgākārajñatājñāne sarvākārajñatāyāṃ ca na sthātavyam upalambhayogena,  sarvākāraiḥ sarvadharmān abhisaṃbuddhā sarvāvāsanā na saṃvikte śakṣayāyāṃ na sthātavyam upalambhayogena,  anuttarāṃ samyaksaṃbodhim abhisaṃbudhya dharmacakrapravartayiṣyāmīti na sthātavyam upalambhayogena,  buddhakārye kṛtvā aprameyān asaṃkhyeyān lokadhātūn parinirvāpayiṣyāmīti,  evam api na sthātavyam upalambhayogena.	K05D0010_H0012:375b-8	བྱང་ཆུབ་སེམས་དཔའ་ནི་ཉན་ཐོས་ཀྱི་ས་དང་། རང་སངས་རྒྱས་ཀྱི་ས་ལས་ཤིན་ཏུ་འདས་ནས་བྱང་ཆུབ་སེམས་དཔའི་ས་ལ་གནས་པར་འགྱུར་རོ་ཞེས་བྱ་བར་དམིགས་པའི་ཚུལ་གྱིས་གནས་པར་མི་བྱའོ་༎ ལམ་གྱི་རྣམ་པ་ཤེས་པའི་ཡེ་ཤེས་ལ་དམིགས་པའི་ཚུལ་གྱིས་གནས་པར་མི་བྱའོ་༎ ཆོས་ཐམས་ཅད་རྣམ་པ་ཐམས་ཅད་དུ་མངོན་པར་རྫོགས་པར་སངས་རྒྱས་ནས་བག་༄༣༧༦ཨ་༌༎ ཆགས་དང་། མཚམས་སྦྱོར་བ་དང་། ཉོན་མོངས་པ་ཐམས་ཅད་ཟད་དོ་ཞེས་བྱ་བར་དམིགས་པའི་ཚུལ་གྱིས་གནས་པར་མི་བྱའོ་༎ བླ་ན་མེད་པ་ཡང་དག་པར་རྫོགས་པའི་བྱང་ཆུབ་མངོན་པར་རྫོགས་པར་སངས་རྒྱས་ནས་།
K02sspp2_2u:6833	 aparimitaś ca me āyur bhaved iti na sthātavyam upalambhayogena.	K05D0010_H0012:376a-4	ཆོས་ཀྱི་འཁོར་ལོ་བསྐོར་བར་བྱའོ་སྙམ་དུ་དམིགས་པའི་ཚུལ་གྱིས་གནས་པར་མི་བྱའོ་༎ སངས་རྒྱས་ཀྱི་མཛད་པ་བྱས་ནས་སེམས་ཅན་དཔག་ཏུ་མེད་། གྲངས་མེད་པ་དག་ཡོངས་སུ་མྱ་ངན་ལས་བཟླ་བར་བྱའོ་སྙམ་དུ་དེ་ལྟ་བུར་ཡང་དམིགས་པའི་ཚུལ་གྱིས་གནས་པར་མི་བྱའོ་༎ ཏིང་ངེ་འཛིན་གང་ལ་སྙོམས་པར་ཞུགས་པས་། བསྐལ་པ་གངགའའི་ཀླུང་གི་བྱེ་མ་སྙེད་དུ་གནས་པར་འགྱུར་བ་དེ་ལྟ་བུའི་ཏིང་ངེ་འཛིན་ལ་སྙོམས་པར་འཇུག་པར་བྱའོ་སྙམ་དུའང་དམིགས་པའི་ཚུལ་གྱིས་གནས་པར་མི་བྱའོ་༎ བདག་གི་ཚེའི་ཚད་ནི་དཔག་ཏུ་མེད་པར་འགྱུར་རོ་ཞེས་བྱ་བར་ཡང་དམིགས་པའི་ཚུལ་གྱིས་གནས་པར་མི་བྱའོ་༎
K02sspp2_2u:6834	 dvātriṃśatāṃ me mahāpuruṣalakṣaṇānām ekaikalakṣaṇaṃ śatapuṇyapariniṣpannaṃ bhaved iti na sthātavyam upalambhayogena,	K05D0010_H0012:376a-11	བདག་གི་མཚན་སུམ་ཅུ་རྩ་གཉིས་ཀྱི་མཚན་རེ་རེའང་བསོད་ནམས་བརྒྱས་ཡོངས་སུ་གྲུབ་པར་འབྱུང་བར་འགྱུར་རོ་སྙམ་དུའང་དམིགས་པའི་ཚུལ་གྱིས་གནས་པར་མི་བྱའོ་༎
K02sspp2_2u:6835	 yāvanto gaṅgānadīvālukopamā lokadhātavaḥ pūrveṇa,  yāvanto gaṅgānadīvālukopamā lokadhātavo dakṣiṇena,  yāvanto gaṅgānadīvālukopamā lokadhātavaḥ paścimena,  yāvanto gaṅgānadīvālukopamā lokadhātava uttareṇa,  yāvanto gaṅgānadīvālukopamā lokadhātavaḥ uttarapūrveṇa,  yāvanto gaṅgānadīvālukopamā (ŚsP II-2 181)  lokadhātavaḥ pūrvadakṣiṇena,  yāvanto gaṅgānadīvālukopamā lokadhātavo dakṣiṇapaścimena,  yāvanto gaṅgānadīvālukopamā lokadhātavaḥ paścimottareṇa,	K05D0010_H0012:376b-0	བདག་གི་སངས་རྒྱས་ཀྱི་ཞིང་གཅིག་གི་ཁྱོན་ཡང་ཤར་ཕྱོགས་ཀྱི་འཇིག་རྟེན་གྱི་ཁམས་གངགའའི་ཀླུང་གི་བྱེ་མ་སྙེད་དག་དང་། དེ་༄༣༧༦བ་བཞིན་དུ་ལྷོ་དང་། ནུབ་དང་། བྱང་ཕྱོགས་ཀྱི་འཇིག་རྟེན་གྱི་ཁམས་གངགའའི་ཀླུང་གི་བྱེ་མ་སྙེད་དག་གི་ཁྱོན་ཅི་ཙམ་པ་དེ་ཙམ་དུ་འགྱུར་རོ་ཞེས་བྱ་བར་ཡང་དམིགས་པའི་ཚུལ་གྱིས་གནས་པར་མི་བྱའོ་༎
K02sspp2_2u:6844	 tāvanta ekaṃ me buddhakṣetraṃ bhaved iti na sthātavyam upalambhayogena,  vajropamo me trisāhasramahāsāhasro lokadhātur bhaved iti na sthātavyam upalambhayogena.	K05D0010_H0012:376b-1	བདག་གི་སྟོང་གསུམ་གྱི་སྟོང་ཆེན་པོའི་འཇིག་རྟེན་གྱི་ཁམས་རྡོ་རྗེ་ལས་གྲུབ་པར་འགྱུར་རོ་ཞེས་བྱ་བར་ཡང་དམིགས་པའི་ཚུལ་གྱིས་གནས་པར་མི་བྱའོ་༎
K02sspp2_2u:6846	 bodhivṛkṣāś ca me tādṛśo gandho niścaret,  ye sattvās taṃ gandham ājighreyus teṣām na rāgadveṣamohāś ca vyābādheyur iti na sthātavyam upalambhayogena,  na śrāvakacittaṃ na pratyekabuddhacittam utpadyeyur iti na sthātavyam upalambhayogena,	K05D0010_H0012:376b-2	བདག་གི་བྱང་ཆུབ་ཀྱི་ཤིང་ལས་སེམས་ཅན་གང་དག་གིས་དྲི་མ་ནམས་པ་དེ་དག་འདོད་ཆགས་ཀྱི་གནོད་པ་མེད་པ་དང་། ཞེ་སྡང་དང་། གཏི་མུག་གི་གནོད་པ་མེད་ཅིང་།
K02sspp2_2u:6849	 sarve ca te niyatā bhaveyur anuttarāyā samyaksaṃbuddhāv iti na sthātavyam upalambhayogena,  ye ca sattvās taṃ bodhivṛkṣagandham ājighreyus teṣāṃ na kaścid vyādhir bhaved kāye vā citte veti na sthātavyam upalambhayogena.	K05D0010_H0012:376b-3	ཉན་ཐོས་དང་། རང་སངས་རྒྱས་ཀྱི་སེམས་འགའ་ཡང་བསྐྱེད་པར་མི་འགྱུར་བར་སེམས་ཅན་དེ་དག་ཐམས་ཅད་བླ་ན་མེད་པ་ཡང་དག་པར་རྫོགས་པའི་བྱང་ཆུབ་ཏུ་ངེས་པར་འགྱུར་བ་དང་། སེམས་ཅན་གང་དག་དྲི་དེ་ལ་སྣོམ་པར་འགྱུར་བ་དེ་དག་ལ་ལུས་དང་།
K02sspp2_2u:6851	 tatra ca me buddhakṣetre na rūpaśabdo bhaved iti na sthātavyam upalambhayogena,  na vedanāśabdo bhaven na saṃjñāśabdo bhaven na saṃskāraśabdo bhaven na vijñānaśabdo bhaved iti na sthātavyam upalambhayogena,  na dhātuśabdo nāyatanaśabdo na pratītyasamutpādaśabdo bhaved iti sthātavyam upalambhayogena,	K05D0010_H0012:376b-5	བདག་གི་སངས་རྒྱས་ཀྱི་ཞིང་དེར་གཟུགས་ཀྱི་སྒྲ་འབྱུང་བར་མི་འགྱུར་བ་དང་། ཚོར་བ་དང་། འདུ་ཤེས་དང་། འདུ་བྱེད་རྣམས་དང་། རྣམ་པར་ཤེས་པའི་སྒྲ་འབྱུང་བར་མི་འགྱུར་རོ་ཞེས་བྱ་པར་ཡང་དམིགས་པའི་ཚུལ་གྱིས་གནས་པར་མི་བྱའོ་༎
K02sspp2_2u:6854	 na dānapāramitāśabdo bhaven na śīlapāramitāśabdo bhaven na kṣāntipāramitāśabdo bhaven  na vīryapāramitāśabdo bhaven na dhyānapāramitāśabdo bhaven na prajñāpāramitāśabdo	K05D0010_H0012:377a-0	སྦྱིན་པའི་ཕ་རོལ་ཏུ་ཕྱིན་པའི་སྒྲ་འབྱུང་བར་མི་འགྱུར་བ་དང་། ཚུལ་ཁྲིམས་ཀྱི་ཕ་རོལ་ཏུ་ཕྱིན་པ་དང་། བཟོད་པའི་ཕ་རོལ་༄༣༧༧ཨ་༌༎
K02sspp2_2u:6863	 na smṛtyupasthānaśabdo bhaven na samyakprahāṇaśabdo bhaven na ṛddhipādaśabdo bhaved iti na sthātavyam upalambhayogena,	K05D0010_H0012:377a-2	དྲན་པ་ཉེ་བར་བཞག་པ་རྣམས་ཀྱི་སྒྲ་འབྱུང་བར་མི་འགྱུར་པ་དང་། ཡང་དག་པར་སྤོང་བ་རྣམས་དང་། རྫུ་འཕྲུལ་གྱི་རྐང་པ་རྣམས་དང་། དབང་པོ་རྣམས་དང་། སྟོབས་རྣམས་དང་། བྱང་ཆུབ་ཀྱི་ཡན་ལག་རྣམས་དང་།
K02sspp2_2u:6856	 bhaved iti na sthātavyam upalambhayogena,  nādhyātmaśūnyatāśabdo bhaven na bahirdhāśūnyatāśabdo bhaven nādhyātmabahirdhāśūnyatāśabdo bhaved iti na sthātavyam upalambhayogena,  na śūnyatāśūnyatāśabdo bhaven na mahāśūnyatāśabdo bhaven na paramārthaśūnyatāśabdo  nātyantaśūnyatāśabdo bhaven nānavarāgraśūnyatāśabdo bhaven nānavakāraśūnyatāśabdo bhaven na prakṛtiśūnyatāśabdo bhaved iti na sthātavyam upalambhayogena,  na sarvadharmaśūnyatāśabdo bhaven na svalakṣaṇaśūnyatāśabdo bhaven nānupalambhaśūnyatāśabdo bhaved iti na sthātavyam upalambhayogena,  nābhāvaśūnyatāśabdo bhaven na svabhāvaśūnyatāśabdo bhaven nābhāvasvabhāvaśūnyatāśabdo bhaved iti na sthātavyam upalambhayogena, (ŚsP II-2 182)	K05D0010_H0012:377a-1	ཏུ་ཕྱིན་པ་དང་། བརྩོན་འགྲུས་ཀྱི་ཕ་རོལ་ཏུ་ཕྱིན་པ་དང་། བསམ་གཏན་གྱི་ཕ་རོལ་ཏུ་ཕྱིན་པ་དང་། ཤེས་རབ་ཀྱི་ཕ་རོལ་ཏུ་ཕྱིན་པའི་སྒྲ་འབྱུང་བར་མི་འགྱུར་རོ་ཞེས་བྱ་བར་ཡང་དམིགས་པའི་ཚུལ་གྱིས་གནས་པར་མི་བྱའོ་༎
K02sspp2_2u:6864	 nendriyaśabdo bhaven na balaśabdo bhaven na bodhyaṅgaśabdo bhaven nāryāṣṭāṅgamārgaśabdo bhaven nāryasatyaśabdo bhaved iti na sthātavaym upalambhayogena,  na dhyānaśabdo bhaven nāpramāṇaśabdo bhaven nārūpyasamāpattiśabdo bhaven na vimokṣaśabdo bhaved iti na sthātavyam upalambhayogena,	K05D0010_H0012:377a-3	འཕགས་པའི་ལམ་ཡན་ལག་བརྒྱད་པ་དང་། སྟོབས་བཅུ་དང་། མི་འཇིགས་པ་རྣམས་དང་། སོ་སོ་ཡང་དག་པར་རིག་པ་རྣམས་དང་། སངས་རྒྱས་ཀྱི་ཆོས་མ་འདྲེས་པ་རྣམས་ཀྱི་སྒྲ་འབྱུང་བར་མི་འགྱུར་ཞེས་བྱ་བ་དང་། རྒྱུན་དུ་ཞུགས་པ་དང་། ལན་གཅིག་ཕྱིར་འོང་བ་དང་། ཕྱིར་མི་འོང་བ་དང་། དགྲ་བཅོམ་པ་དང་། རང་སངས་རྒྱས་དང་། བྱང་ཆུབ་སེམས་དཔའ་དང་། སངས་རྒྱས་ཀྱི་སྒྲ་འབྱུང་བར་མི་འགྱུར་རོ་ཞེས་བྱ་བར་ཡང་དམིགས་པའི་ཚུལ་གྱིས་གནས་པར་མི་བྱའོ་༎
K02sspp2_2u:6873	 tathā hi tathāgatenārhatā samyaksaṃbuddhenānuttarāṃ samyaksaṃbodhim abhisaṃbuddhya sarvadharmā nopalabdhāḥ.	K05D0010_H0012:377a-6	འདི་ལྟར་དེ་བཞིན་གཤེགས་པ་དགྲ་བཅོམ་པ་ཡང་དག་པར་རྫོགས་པའི་སངས་རྒྱས་ཀྱིས་། བླ་ན་མེད་པ་ཡང་དག་པར་རྫོགས་པའི་བྱང་ཆུབ་མངོན་པར་རྫོགས་པར་སངས་རྒྱས་ནས་ཆོས་ཐམས་ཅད་མ་དམིགས་པའི་ཕྱིར་རོ་༎
K02sspp2_2u:6874	 evaṃ khalu kauśika bodhisattvena mahāsattvena prajñāpāramitāyāṃ na sthātavyam upalambhayogena.	K05D0010_H0012:377a-8	ཀོཨོ་ཤི་ཀ་། བྱང་ཆུབ་སེམས་དཔའ་སེམས་དཔའ་ཆེན་པོས་དེ་ལྟར་༄༣༧༧བ་ཤེས་རབ་ཀྱི་ཕ་རོལ་ཏུ་ཕྱིན་པ་ལ་དམིགས་པའི་ཚུལ་གྱིས་གནས་པར་མི་བྱའོ་༎
K02sspp2_2u:6875	 athāyuṣmataḥ śāradvatīputasyaitad abhūt:	K05D0010_H0012:377b-1	དེ་ནས་ཚེ་དང་ལྡན་པ་ཤའ་རིའི་བུ་འདི་སྙམ་དུ་སེམས་ཏེ་།
K02sspp2_2u:6876	 kathaṃ punar bodhisattvena mahāsattvena prajñāpāramitāyāṃ sthātavyam?	K05D0010_H0012:377b-2	འོ་ན་ཇི་ལྟར་བྱང་ཆུབ་སེམས་དཔའ་སེམས་དཔའ་ཆེན་པོས་ཤེས་རབ་ཀྱི་ཕ་རོལ་ཏུ་ཕྱིན་པ་ལ་གནས་པར་བྱ་སྙམ་མོ་༎
K02sspp2_2u:6877	 athāyuṣmataḥ subhūtir āyuṣmataḥ śāradvatīputrasya cetasyaiva cetaḥparivitarkam ājñāyāyuṣmataṃ śāradvatīputram āmantrayati sma. tat kiṃ manyase?	K05D0010_H0012:377b-3	དེ་ནས་ཚེ་དང་ལྡན་པ་རབ་འབྱོར་གྱིས་ཚེ་དང་ལྡན་པ་ཤའ་རིའི་བུའི་སེམས་ཀྱི་ཡོངས་སུ་རྟོག་པ་སེམས་ཀྱིས་ཤེས་ནས་།
K02sspp2_2u:6969	 sarvajñatāyāṃ naiva sthito nāsthitaḥ,  mārgākārajñatāyāṃ naiva sthito nāsthitaḥ,	K05D0010_H0012:378a-5	རྣམ་པ་ཐམས་ཅད་མཁྱེན་པ་ཉིད་ཀྱི་བར་ལའང་གནས་པའང་མ་ཡིན་། མི་གནས་པའང་མ་ཡིན་པ་དེ་ལྟར་བྱང་ཆུབ་སེམས་དཔའ་སེམས་དཔའ་ཆེན་པོས་ཤེས་རབ་ཀྱི་ཕ་རོལ་ཏུ་ཕྱིན་པ་ལ་གནས་པར་བྱ་སྟེ་།
K02sspp2_2u:6887	 na cakṣuḥsaṃsparśapratyayavedanāyāṃ sthito na śrotrasaṃsparśapratyayavedanāyāṃ sthito	K05D0010_H0012:116b-17	དེས་མིག་གི་འདུས་ཏེ་རེག་པ་ལ་གནས་པར་མི་བགྱིའོ་༎ མིག་གི་འདུས་ཏེ་རེག་པའི་རྐྱེན་གྱིས་ཚོར་བ་ལ་གནས་པར་མི་བགྱིའོ་༎
K02sspp2_2u:6971	 sarvākārajñatāyāṃ naiva sthito nāsthitaḥ.  evaṃ khalv āyuṣmañ chāradvatīputra bodhisattvena mahāsattvena prajñāpāramitāyāṃ śikṣitavyaṃ sthātavyam ity asthānayogena.  (ŚsP II-2 186)	K05D0010_H0012:378a-7	ཚེ་དང་ལྡན་པ་ཤའ་རིའི་བུ་། བྱང་ཆུབ་སེམས་དཔའ་སེམས་དཔའ་ཆེན་པོས་དེ་ལྟར་ཤེས་རབ་ཀྱི་ཕ་རོལ་ཏུ་ཕྱིན་པ་ལ་མི་གནས་པའི་ཚུལ་གྱིས་གནས་པར་བྱའོ་༎༎ ཤེས་རབ་ཀྱི་ཕ་རོལ་ཏུ་ཕྱིན་པ་ཁྲི་བརྒྱད་སྟོང་པ་། བམ་པོ་བཅུ་དགུ་པ་།
K02sspp2_2u:6974	 atha khalu tatra parṣadi keṣāñcid devaputrāṇām etad abhavat:	K05D0010_H0012:378a-11	དེ་ནས་འཁོར་དེ་ལས་ལྷའི་བུ་ཁ་ཅིག་འདི་སྙམ་དུ་སེམས་ཏེ་།
K02sspp2_2u:6975	 yāni tāni yakṣāṇāṃ yakṣapadāni yakṣamantritāni yakṣarutāni yakṣapravyāhṛtāni vijñāyante,  tāni mantrayamāṇāni,	K05D0010_H0012:378a-12	གནོད་སྦྱིན་རྣམས་ཀྱི་གནོད་སྦྱིན་གྱི་སྐད་དང་། གནོད་སྦྱིན་གྱིས་སྨྲས་པ་དང་། གནོད་སྦྱིན་གྱིས་བརྗོད་པ་དང་། གནོད་སྦྱིན་གྱི་ཚིག་གང་དག་ཡོད་པ་དེ་དག་ནི་བརྗོད་ན་ཤེས་པར་ཡང་རུང་གི་།
K02sspp2_2u:6977	 idaṃ punar api na vijñāyate yad āryasubhūtiḥ prajñāpāramitāṃ bhāṣate pravyāharati deśayati vibhajaty uttānīkaroti upadiśati.	K05D0010_H0012:378a-14	གནས་བརྟན་རབ་འབྱོར་ཤེས་རབ་ཀྱི་ཕ་རོལ་ཏུ་ཕྱིན་པ་སྨྲ་བ་དང་། བརྗོད་པ་དང་། འཆད་པ་དང་། སྟོན་པ་འདི་ནི་ཤེས་པར་མི་རུང་ངོ་སྙམ་མོ་༎
K02sspp2_2u:6978	 athāyuṣmān subhūtis teṣāṃ devaputrāṇāṃ cetasaiva cetaḥparivitarkam ājñāya tān devaputrān āmantrayate sma,	K05D0010_H0012:378a-15	དེ་ནས་ཚེ་དང་ལྡན་པ་རབ་འབྱོར་གྱིས་། ལྷའི་བུ་དེ་དག་གི་སེམས་ཀྱི་ཡོངས་སུ་རྟོག་པ་སེམས་ཀྱིས་ཤེས་ནས་ལྷའི་བུ་དེ་དག་ལ་སྨྲས་པ་།
K02sspp2_2u:6979	 na vijñāyate devaputrāṇām āmantrayate.	K05D0010_H0012:378a-17	ལྷའི་བུ་དག་། གང་སྨྲས་པ་༄༣༧༨བ་ཤེས་པར་མི་རུང་ངམ་།
K02sspp2_2u:6980	 devaputrā āhuḥ:	K05D0010_H0012:378b-1	ལྷའི་བུ་རྣམས་ཀྱིས་སྨྲས་པ་།
K02sspp2_2u:6981	 na vijñāyate āryasubhūte.	K05D0010_H0012:378b-2	འཕགས་པ་རབ་འབྱོར་། ཤེས་པར་མི་རུང་ངོ་༎
K02sspp2_2u:6982	 subhūtir āha:	K05D0010_H0012:378b-4	རབ་འབྱོར་གྱིས་སྨྲས་པ་།
K02sspp2_2u:6983	 tathā hi devaputrā ekākṣaram api na pravyāhrite tan na śruyate yan na śruyate tan na vijñāyate. tat kasya hetoḥ?	K05D0010_H0012:378b-5	ལྷའི་བུ་དག་། འདི་ལྟར་ཡི་གེ་གཅིག་ཀྱང་མ་བརྗོད་དེ་། གང་མ་བརྗོད་པ་དེ་ནི་ཐོས་པར་མི་རུང་ངོ་༎ དེ་ཅིའི་ཕྱིར་ཞེ་ན་།
K02sspp2_2u:6984	 na hy akṣarāṇi prajñāpāramitā na cātra kaścid deśayitā na śrotā na vijñātā. tat kasya hetoḥ?	K05D0010_H0012:378b-9	ཤེས་རབ་ཀྱི་ཕ་རོལ་ཏུ་ཕྱིན་པ་ནི་ཡི་གེ་མེད་པ་སྟེ་། དེ་ལ་ནི་ཉན་པའམ་སྟོན་པའང་མེད་ལ་།
K02sspp2_2u:6985	 anakṣarā hi devaputrās tathāgatānām arhatāṃ samyaksaṃbuddhānāṃ bodhiḥ tad yathāpi	K05D0010_H0012:378b-11	དེ་བཞིན་གཤེགས་པ་དགྲ་བཅོམ་པ་ཡང་དག་པར་རྫོགས་པའི་སངས་རྒྱས་རྣམས་ཀྱི་ཡང་དག་པར་རྫོགས་པའི་སངས་རྒྱས་ཀྱི་བྱང་ཆུབ་ལའང་ཡི་གེ་མེད་པའི་ཕྱིར་རོ་༎ ལྷའི་བུ་དག་། འདི་ལྟ་སྟེ་།
K02sspp2_2u:6986	 nāma devaputrās tathāgato 'rhan samyaksaṃbuddho buddhanirmitaṃ nirmimīte. sa ca punar	K05D0010_H0012:378b-14	དཔེར་ན་། དེ་བཞིན་གཤེགས་པ་དགྲ་བཅོམ་པ་ཡང་དག་པར་རྫོགས་པའི་སངས་རྒྱས་ཀྱིས་སངས་རྒྱས་སྤྲུལ་པ་སྤྲུལ་པ་མཛད་དེ་།
K02sspp2_2u:6987	 nirmitaś catasraparṣado nirmimītaḥ bhikṣubhikṣuṇyupāsakopāsikāḥ.	K05D0010_H0012:378b-15	འཁོར་བཞི་པོ་དགེ་སློང་དང་། དགེ་སློང་མ་དང་། དགེ་བསྙེན་དང་། དགེ་བསྙེན་མ་དག་ཀྱང་མངོན་པར་སྤྲུལ་ལ་།
K02sspp2_2u:6988	 atha sa nirmitaḥ tābhyo nirmitābhyaś catasṛbhyaḥ parṣadbhyo dharmaṃ deśayet. tat kiṃ manyadhve?	K05D0010_H0012:378b-16	སྤྲུལ་པ་དེས་སྤྲུལ་པའི་འཁོར་བཞི་པོ་དག་ལ་ཆོས་བསྟན་པར་གྱུར་ན་ལྷའི་བུ་དག་འདི་ཇི་སྙམ་དུ་སེམས་།
K02sspp2_2u:6989	 devaputrāḥ. api tu tatra parṣadi kenacid deśitaṃ bhavet?  kenacic chrutam ājñātaṃ ca bhavet?	K05D0010_H0012:378b-17	དེ་ལ་སུས་ཀྱང་ཅིའང་བསྟན་པའམ་། མཉན་པ་ཡོད་སྙམ་མམ་།
K02sspp2_2u:6996	 āhuḥ: no hīdaṃ bhadanta subhūte.	K05D0010_H0012:378b-21	དེ་ནི་མེད་དོ་༎
K02sspp2_2u:6997	 subhūtir āha:	K05D0010_H0012:378b-22	རབ་འབྱོར་གྱིས་སྨྲས་པ་།
K02sspp2_2u:6998	 evam eva devaputrāḥ svapnopamāḥ sarvadharmās tatra na kenacid deśitaṃ na kenacid	K05D0010_H0012:378b-23	ལྷའི་བུ་དག་། དེ་བཞིན་དུ་ཆོས་ཐམས་ཅད་ཀྱང་སྤྲུལ་པ་ལྟ་བུ་སྟེ་། དེ་ལ་སུས་ཀྱང་བཤད་པ་མེད་ཅིང་སུས་ཀྱང་མཉན་པ་མེད་ལ་། སུས་ཀྱང་ཤེས་པ་མེད་དོ་༎
K02sspp2_2u:6999	 śrutaṃ na kenacid ājñātaṃ tad yathāpi nāma devaputrāḥ dvau puruṣau parvatakandare	K05D0010_H0012:378b-27	ལྷའི་བུ་དག་། འདི་ལྟ་སྟེ་། དཔེར་ན་། མི་གཉིད་ཀྱིས་ལོག་པའི་རྨི་ལམ་ན་།
K02sspp2_2u:7002	 devaputrāḥ. api nu tenaikena pratiśrutkāśabdena dvitīyapratiśrutkāśabdo vijñāpito bhavet.	K05D0010_H0012:379a-2	དེ་ལ་སུས་ཀྱང་བཤད་པའམ་། མཉན་པའམ་། ཤེས་པ་ཡོད་སྙམ་མམ་། ལྷའི་བུ་རྣམས་ཀྱིས་སྨྲས་པ་།
K02sspp2_2u:7003	 āhuh: no hīdaṃ bhadanta subhūte.	K05D0010_H0012:379a-5	བཙུན་པ་རབ་འབྱོར་། དེ་ནི་མེད་དོ་༎
K02sspp2_2u:7004	 subhūtir āha:	K05D0010_H0012:379a-7	རབ་འབྱོར་གྱིས་སྨྲས་པ་།
K02sspp2_2u:7005	 evam eva devaputrāḥ sarvadharmāḥ pratiśrutkopamāḥ,	K05D0010_H0012:379a-8	ལྷའི་བུ་དག་། དེ་བཞིན་དུ་ཆོས་ཐམས་ཅད་ཀྱང་རྨི་ལམ་ལྟ་བུ་སྟེ་།
K02sspp2_2u:7006	 tatra na kenacid deśitaṃ na kenacic chrutaṃ na kenacid ājñātaṃ,	K05D0010_H0012:379a-10	དེ་ལ་སུས་ཀྱང་བཤད་པ་མེད་ཅིང་། སུས་ཀྱང་མཉན་པ་མེད་ལ་། སུས་ཀྱང་ཤེས་པ་མེད་དོ་༎
K02sspp2_2u:7009	 sa ca nirmitas tābhyo nirmitābhyaḥ parṣadbhyo dharmaṃ deśayet. tat kiṃ manyadhve?  devaputrāḥ,	K05D0010_H0012:379a-17	ཆོས་ཀྱི་བསྔགས་པ་བརྗོད་། དགེ་འདུན་གྱི་བསྔགས་པ་བརྗོད་ནས་དེ་གཉིས་ཀྱི་སྐད་ཀྱི་བྲག་ཅ་བྱུང་བར་གྱུར་ན་། ལྷའི་བུ་དག་འདི་ཇི་སྙམ་དུ་སེམས་།
K02sspp2_2u:7011	 api nu tatra kenacid deśitaṃ vā śrutaṃ vā ājñātaṃ vā bhavet.	K05D0010_H0012:379a-20	དེ་ལ་གཅིག་གི་བྲག་ཅས་། གཅིག་ཤོས་ཀྱི་བྲག་ཅའི་སྒྲ་ཤེས་པར་གྱུར་སྙམ་མམ་།
