src_segmentnr	src_original	tgt_segmentnr	tgt_original
K02sspp2_4u:2292	 ca sattvānāṃ viheṭhanābhiprāyaḥ,	K03D0009-2_H0010-2:106a-4	སེམས་ཅན་ཡང་དག་པར་བརྩོན་པ་རྣམས་ལ་ཡང་གཙེ་བའི་བསམ་པ་ཅན་ཡིན་གྱི་།
K02sspp2_4u:2293	 ya nv aham imāṃ (ŚsP_II-4_63)  prajñāpāramitāṃ samanvāhareyaṃ smṛtyā ca svādhyāyaṃ kuryāt.	K03D0009-2_H0010-2:106a-5	བདག་གིས་ཤེས་རབ་ཀྱི་ཕ་རོལ་ཏུ་ཕྱིན་པ་འདི་ཡང་དག་པར་བསམ་པར་བྱའོ་༎ དྲན་པས་བརྗོད་པར་བྱའོ་སྙམ་ནས་།
K02sspp2_4u:2295	 atha śakro devānām indra imāṃ prajñāpāramitāṃ samanvāharati sma,	K03D0009-2_H0010-2:106a-7	ལྷའི་དབང་པོ་བརྒྱ་བྱིན་གྱིས་། ཤེས་རབ་ཀྱི་ཕ་རོལ་ཏུ་ཕྱིན་པ་འདི་ཡང་དག་པར་བསམས་ཏེ་།
K02sspp2_4u:2296	 smṛtyā ca svādhyāyaṃ karoti sma,  yathā yathā śakro devānām indra imāṃ prajñāpāramitāṃ svādhyāyaṃ karoti sma,	K03D0009-2_H0010-2:106a-9	དྲན་པས་གསལ་བར་བརྗོད་པ་དང་། ལྷའི་དབང་པོ་བརྒྱ་བྱིན་གྱིས་། ཇི་ལྟ་ཇི་ལྟར་ཤེས་རབ་ཀྱི་ཕ་རོལ་ཏུ་ཕྱིན་པ་འདི་གསལ་བར་བརྗོད་པ་དེ་ལྟ་དེ་ལྟར་།
K02sspp2_4u:2298	 tathā tathā mārapāpīyāṃs tenaiva mārgeṇa tenaiva dvāreṇa punar eva pratyudāvartate sma.	K03D0009-2_H0010-2:106a-11	བདུད་སྡིག་ཏོ་ཅན་དེ་དག་ལམ་དེ་ཉིད་དང་། སྒོ་དེ་ཉིད་ནས་ཕྱིར་ལོག་གོ་།
K02sspp2_4u:2299	 atha tatra parṣadi cāturmahārājakāyikā devaputrā yāvad akaniṣṭhā devās te divyāni puṣpāṇi vāsāṃsi cābhinirmāya vaihāyasy antarikṣe sthitvaiva yena bhagavāṃs tenākṣipanti sma,	K03D0009-2_H0010-2:106a-12	དེ་ནས་འཁོར་དེ་ན་རྒྱལ་ཆེན་བཞིའི་རིས་ཀྱི་ལྷའི་བུ་དང་། འོག་མིན་གྱི་བར་གྱི་ལྷ་ཇི་སྙེད་ཅིག་འཁོད་པ་དེ་དག་གིས་། ལྷ་རྫས་ཀྱི་མེ་ཏོག་དང་། ན་བཟའ་མང་པོ་མངོན་པར་སྤྲུལ་ནས་། བར་སྣང་གི་ནམ་མཁའ་ལ་འཁོད་བཞིན་དུ་། བཅོམ་ལྡན་འདས་གང་ན་བ་དེར་གཏོར་ཏེ་།
K02sspp2_4u:2300	 yena bhagavāṃs tenābhiprakiranti sma. evaṃ ca vācam abhāṣanta,	K03D0009-2_H0010-2:106a-16	མངོན་པར་གཏོར་ནས་ཚིག་འདི་སྐད་དུ་བརྗོད་དོ་༎
K02sspp2_4u:2301	 ciraṃ bateyaṃ jāmbūdvīpakānāṃ manuṣyāṇāṃ prajñāpāramitā bhagavatāṃ yāvat kileyaṃ	K03D0009-2_H0010-2:106b-0	འཛམ་བུའི་གླིང་གི་མ་འདི་རྣམས་ཤེས་རབ་ཀྱི་ཕ་རོལ་ཏུ་ཕྱིན་པ་འདི་ལ་ཡུན་རིང་པོར་སྤྱོད་པར་༄༡༠༦བ་གྱུར་ཅིག་། འཛམ་བུའི་གླིང་གི་མི་འདི་དག་ཇི་སྲིད་དུ་ཤེས་རབ་ཀྱི་ཕ་རོལ་ཏུ་ཕྱིན་པ་འདི་ལ་སྤྱོད་པ་དེ་སྲིད་དུ་། དེ་བཞིན་གཤེགས་པ་དགྲ་བཅོམ་པ་ཡང་དག་པར་རྫོགས་པའི་སངས་རྒྱས་ཀྱང་ནུབ་པར་མི་འགྱུར་ལ་། དམ་པའི་ཆོས་ཡུན་རིང་དུ་གནས་ཤིང་། དགེ་འདུན་དཀོན་མཆོག་ཀྱང་འཇིག་རྟེན་དུ་འབྱུང་བར་འགྱུར་ཞེའོ་༎
K02sspp2_4u:2302	 jāmbūdvīpakān manuṣyān prajñāpāramitānuvartiṣyante tāvan na tathāgatasyārhataḥ samyaksaṃbuddhasyāntardhānaṃ	K03D0009-2_H0010-2:106b-5	སྟོང་གསུམ་གྱི་སྟོང་ཆེན་པོའི་འཇིག་རྟེན་གྱི་ཁམས་དང་། ཕྱོགས་བཅུའི་འཇིག་རྟེན་གྱི་ཁམས་ཀྱི་བར་གྱི་དེ་བཞིན་གཤེགས་པ་དགྲ་བཅོམ་པ་ཡང་དག་པར་རྫོགས་པའི་སངས་རྒྱས་ཀྱང་ནུབ་པར་མི་འགྱུར་ལ་།
K02sspp2_4u:2303	 bhaviṣyati saddharmasya ca cirasthitikatāṃ bhaviṣyati,	K03D0009-2_H0010-2:106b-6	དམ་པའི་ཆོས་ཀྱང་ཡུན་རིང་པོར་གནས་ཤིང་།
K02sspp2_4u:2304	 saṃgharatnasya ca loke prādurbhāvo bhaviṣyati,	K03D0009-2_H0010-2:106b-7	དགེ་འདུན་དཀོན་མཆོག་ཀྱང་འཇིག་རྟེན་དུ་འབྱུང་བར་འགྱུར་ཞེའོ་༎
K02sspp2_4u:2305	 bodhisattvānāṃ ca mahāsattvānāṃ caryāviśeṣaḥ prajñāsyate,	K03D0009-2_H0010-2:106b-8	བྱང་ཆུབ་སེམས་དཔའ་སེམས་དཔའ་ཆེན་པོ་རྣམས་ཀྱི་སྤྱོད་པ་ཁྱད་པར་དུ་འཕགས་པ་ཡང་ཡོད་པར་འགྱུར་ཞེའོ་༎
K02sspp2_4u:2306	 yatra ca digbhāge imāṃ prajñāpāramitāṃ te kulaputrā kuladuhitaro vā likhiṣyanti dhārayiṣyanti  pustakagatām api kṛtvā ālokajātā ca sā dik pratikāṅkṣitavyā sanāthāvigatās tamondhakārā  ca me sā dik pratikāṅkṣitavya.  [K. 186b9, N. 265a1, T. 293a2, P. 223a2, Ch. 584c1]	K03D0009-2_H0010-2:106b-9	ཕྱོགས་གང་ན་རིགས་ཀྱི་བུའམ་། རིགས་ཀྱི་བུ་མོ་དེ་དག་གིས་ཤེས་རབ་ཀྱི་ཕ་རོལ་ཏུ་ཕྱིན་པ་འདི་བྲིས་ཤིང་གླེགས་བམ་དུ་བྱས་ཏེ་འཆང་བའི་ཕྱོགས་དེ་ནི་སྣང་བ་དང་ལྡན་པར་རིག་པར་བྱའོ་༎ ཕྱོགས་དེ་ནི་མགོན་དང་བཅས་ཤིང་མུན་པ་དང་བྲལ་བར་རིག་པར་བྱའོ་༎
K02sspp2_4u:2310	 atha bhagavāñ chakraṃ devānām indrakāṃś cākaniṣṭhaparyato devaputrān etad avocat:	K03D0009-2_H0010-2:106b-12	དེ་ནས་བཅོམ་ལྡན་འདས་ཀྱིས་ལྷའི་དབང་པོ་བརྒྱ་བྱིན་དང་། འོག་མིན་གྱི་བར་གྱི་ལྷའི་བུ་དེ་དག་ལ་འདི་སྐད་ཅེས་བཀའ་སྩལ་ཏོ་༎
K02sspp2_4u:2311	 evam etat kauśikaivam etat,	K03D0009-2_H0010-2:106b-13	ཀོཨོ་ཤི་ཀ་། དེ་དེ་བཞིན་ནོ་༎
K02sspp2_4u:2312	 evam etad devaputrā evam etat,	K03D0009-2_H0010-2:106b-16	ལྷའི་བུ་དག་། དེ་དེ་བཞིན་ནོ་༎ དེ་དེ་བཞིན་ཏེ་།
K02sspp2_4u:2313	 yāvad imāṃ prajñāpāramitāṃ jāmbūdvīpakā manuṣyā anuvartiṣyante,	K03D0009-2_H0010-2:106b-19	ཇི་སྲིད་དུ་འཛམ་བུའི་གླིང་གི་མི་རྣམས་ཤེས་རབ་ཀྱི་ཕ་རོལ་ཏུ་ཕྱིན་པ་འདི་ལ་སྤྱོད་པ་དེ་སྲིད་དུ་།
K02sspp2_4u:2314	 tāvat tathāgatasyārhataḥ samyaksaṃbuddhasyāntardhānaṃ bhaviṣyati saddharmasya ca	K03D0009-2_H0010-2:107a-0	དེ་བཞིན་གཤེགས་༄༡༠༧ཨ་༌༎ པ་དགྲ་བཅོམ་པ་ཡང་དག་པར་རྫོགས་པའི་སངས་རྒྱས་ཀྱང་ནུབ་པར་མི་འགྱུར་ལ་། དམ་པའི་ཆོས་ཀྱང་ཡུན་རིང་དུ་གནས་ཤིང་།
K02sspp2_4u:2315	 cirasthitikatā bhaviṣyati saṃgharatnasya ca loke prajñāyate yāvat trisāhasramahāsāhasre	K03D0009-2_H0010-2:107a-3	དགེ་འདུན་དཀོན་མཆོག་ཀྱང་འཇིག་རྟེན་དུ་འབྱུང་བར་འགྱུར་རོ་༎
K02sspp2_4u:2316	 lokadhātau yāvat samanto daśasu dikṣu lokadhātuṣu tathāgatasyārhantaḥ samyaksaṃbuddhasyāntardhānaṃ bhaviṣyati,	K03D0009-2_H0010-2:107a-4	སྟོང་གསུམ་གྱི་སྟོང་ཆེན་པོའི་འཇིག་རྟེན་གྱི་ཁམས་དང་། ཕྱོགས་བཅུ་ཀུན་གྱི་འཇིག་རྟེན་གྱི་ཁམས་ཀྱི་བར་གྱི་དེ་བཞིན་གཤེགས་པ་དགྲ་བཅོམ་པ་ཡང་དག་པར་རྫོགས་པའི་སངས་རྒྱས་རྣམས་ཀྱང་ནུབ་པར་མི་འགྱུར་ལ་།
K02sspp2_4u:2317	 sarvadharmasya ca cirasthitikatā bhaviṣyati,	K03D0009-2_H0010-2:107a-5	དམ་པའི་ཆོས་ཀྱང་ཡུན་རིང་དུ་གནས་ཤིང་།
K02sspp2_4u:2318	 saṃgharatnasya ca loke prādurbhāvo bhaviṣyati,	K03D0009-2_H0010-2:107a-6	དགེ་འདུན་དཀོན་མཆོག་ཀྱང་འཇིག་རྟེན་དུ་འབྱུང་བར་འགྱུར་རོ་༎
K02sspp2_4u:230	 tathā hi tasyā auṣadhyā bhaiṣajyaguṇo yaṃ tasyāśīviṣasya tad viṣam abhibhavaty eva balavatī hi kauśika sā maghī auṣadhiḥ.	K03D0009-2_H0010-2:68a-5	དཔེར་ན༏་རྩི་མ་གྷི་ཞེས་བྱ་བ་དུག་ཐམས་ཅད་ཞི་བར་བྱེད་པ་ཡོད་དེ་།
K02sspp2_4u:2319	 bodhisattvānāṃ ca mahāsattvānāṃ caryāviśeṣaḥ prajñāsyate,	K03D0009-2_H0010-2:107a-7	བྱང་ཆུབ་སེམས་དཔའ་སེམས་དཔའ་ཆེན་པོ་རྣམས་ཀྱི་སྤྱོད་པ་ཁྱད་པར་དུ་འཕགས་པའང་ཡོད་པར་འགྱུར་རོ་༎
K02sspp2_4u:2320	 yatra ca digbhāge imāṃ prajñāpāramitāṃ te kulaputrā kuladuhitaro vā likhiṣyanti dhārayiṣyanti	K03D0009-2_H0010-2:107a-8	ཕྱོགས་གང་ན་རིགས་ཀྱི་བུའམ་། རིགས་ཀྱི་བུ་མོ་དེ་དག་གིས་ཤེས་རབ་ཀྱི་ཕ་རོལ་ཏུ་ཕྱིན་པ་འདི་བྲིས་ཤིང་གླེགས་བམ་དུ་བྱས་ཏེ་འཆང་བའི་ཕྱོགས་དེ་ནི་སྣང་བ་དང་ལྡན་པར་ངས་ཤེས་སོ་༎
K02sspp2_4u:2321	 pustakagatām api kṛtvā ālokajātā ca sā dik pratikāṅkṣitavyā sanāthāvigatās tamondhakārā  ca me sā dik pratibhāti.	K03D0009-2_H0010-2:107a-10	ཕྱོགས་དེ་ནི་མགོན་དང་བཅས་ཤིང་མུན་པ་དང་བྲལ་བར་ངས་ཤེས་སོ་༎
K02sspp2_4u:2323	 atha te devaputrā punar api divyāni kusumāni abhinirmāya yena bhagavāṃs tenābhiprakiranti sma,	K03D0009-2_H0010-2:107a-11	དེ་ནས་ལྷའི་བུ་དེ་དག་གིས་ལྷ་རྫས་ཀྱི་མེ་ཏོག་མང་པོ་མངོན་པར་སྤྲུལ་ནས་། བཅོམ་ལྡན་འདས་། གང་ན་བ་དེར་མངོན་པར་གཏོར་ཏེ་།
K02sspp2_4u:2324	 evañ ca vācam abhāṣanta,	K03D0009-2_H0010-2:107a-14	འདི་སྐད་ཀྱི་ཚིག་བརྗོད་དོ་༎
K02sspp2_4u:2325	 yo hi kaścid bhagavan kulaputro vā kuladuhitā vā imāṃ prajñāpāramitām udgrahīṣyati (ŚsP_II-4_64)	K03D0009-2_H0010-2:107a-15	བཅོམ་ལྡན་འདས་། རིགས་ཀྱི་བུའམ་། རིགས་ཀྱི་བུ་མོ་གང་ལ་ལ་།
K02sspp2_4u:2326	 dhārayiṣyati vācayiṣyati paryavāpsyati yoniśas manasikariśyati. na tasya māro vā mārakāyikā vā devatā avatāraprakṣiṇo 'vatāraṃ lapsyante,	K03D0009-2_H0010-2:107a-18	ཤེས་རབ་ཀྱི་ཕ་རོལ་ཏུ་ཕྱིན་པ་འདི་འཛིན་པ་དང་། འཆང་བ་དང་། ཀློག་པ་དང་། ཀུན་ཆུབ་པར་བགྱིད་ཅིང་། ཚུལ་བཞིན་དུ་ཡིད་ལ་བགྱིད་པ་དེ་ལ་བདུད་དམ་། ༄༡༠༧བ་བདུད་ཀྱི་རིགས་སུ་གཏོགས་པའི་ལྷ་གླགས་ཚོལ་པ་རྣམས་ཀྱིས་གླགས་མི་རྙེད་དོ་༎
K02sspp2_4u:2327	 vayam api bhagavaṃs tasya kulaputrasya vā kuladuhitur vā satatasamitaṃ rakṣāvaraṇaguptiṃ saṃvidhāsyāmaḥ. tat kasya hetoḥ?	K03D0009-2_H0010-2:107b-1	བཅོམ་ལྡན་འདས་། བདག་ཅག་གིས་ཀྱང་རིགས་ཀྱི་བུའམ་། རིགས་ཀྱི་བུ་མོ་དེ་ལ་རྟག་ཏུ་རྒྱུན་མི་ཆད་པར་བསྲུང་བ་དང༏་བསྐྱབ་པ་དང་། བསྐྱད་བར་བགྱིའོ་༎ དེ་ཅིའི་སླད་དུ་ཞེ་ན་།
K02sspp2_4u:2328	 śāstāram eva bhagavaṃs tam asya mahāśāstāram anyataraṃ vā yaḥ kulaputro vā kuladuhitā vemāṃ prajñāpāramitām udgrahīṣyati dhārayiṣyati vācayiṣyati  yoniśaś ca manasikariṣyati.	K03D0009-2_H0010-2:107b-5	རིགས་ཀྱི་བུའམ་། རིགས་ཀྱི་བུ་མོ་གང་ཤེས་རབ་ཀྱི་ཕ་རོལ་ཏུ་ཕྱིན་པ་འདི་འཛིན་ཅིང་འཆང་བ་དང་། ཀློག་ཅིང་ཀུན་ཆུབ་པར་བགྱིད་པ་དང་། ཚུལ་བཞིན་དུ་ཡིད་ལ་བགྱིད་པ་དེ་ནི་སྟོན་པའམ་། སྟོན་པ་དང་མཚུངས་པ་ཙམ་དུ་བདག་ཅག་སེམས་སོ་༎
K02sspp2_4u:2330	 atha śakro devānām indro bhagavantam etad avocat:	K03D0009-2_H0010-2:107b-8	དེ་ནས་ལྷའི་དབང་པོ་བརྒྱ་བྱིན་གྱིས་། བཅོམ་ལྡན་འདས་ལ་འདི་སྐད་ཅེས་གསོལ་ཏོ་༎
K02sspp2_4u:2331	 na te bhagavan kulaputro vā kuladuhitaro vā avarakena kuśalamūlena samanvāgatā bhaviṣyanti,  ya imāṃ prajñāpāramitām udgrahīṣyati dhārayiṣyati vācayiṣyati paryavāpsyati,  yoniśaś ca manasikariṣyati,	K03D0009-2_H0010-2:107b-10	བཅོམ་ལྡན་འདས་། རིགས་ཀྱི་བུ་མོ་གང་ཤེས་རབ་ཀྱི་ཕ་རོལ་ཏུ་ཕྱིན་པ་འདི་འཛིན་ཅིང་འཆང་པ་དང་། ཀློག་ཅིང་ཀུན་ཆུབ་པར་བགྱིད་པ་དང་། ཚུལ་བཞིན་དུ་ཡིད་ལ་བགྱིད་པ་དེ་དག་ནི་དགེ་བའི་རྩ་བ་དམའ་བ་དང་ལྡན་པ་མ་ལགས་ཏེ་།
K02sspp2_4u:2334	 sarvajinamanasikārās te bhagavan kulaputrāḥ kuladuhitaraś ca bhaviṣyanti,	K03D0009-2_H0010-2:107b-13	བཅོམ་ལྡན་འདས་། རིགས་ཀྱི་བུ་མོ་གང་ཤེས་རབ་ཀྱི་ཕ་རོལ་ཏུ་ཕྱིན་པ་འདི་འཛིན་ཅིང་འཆང་བ་དང་། ཀློག་ཅིང་ཀུན་ཆུབ་པར་བགྱིད་པ་དང༏་ཚུལ་བཞིན་དུ་ཡིད་ལ་བྱེད་པ་དེ་དག་ནི་སྔོན་གྱི་རྒྱལ་བ་ལ་བགྱི་བ་བགྱིད་པ་ལགས་སོ་༎ བཅོམ་ལྡན་འདས་།
K02sspp2_4u:2335	 ya imāṃ prajñāpāramitām udgrahīṣyanti dhārayiṣyanti vācayiṣyanti paryavāpsyanti yoniśaś ca manasikariṣyanti,	K03D0009-2_H0010-2:107b-18	རིགས་ཀྱི་བུ་མོ་གང་ཤེས་རབ་ཀྱི་ཕ་རོལ་ཏུ་ཕྱིན་པ་འདི་འཛིན་ཅིང་འཆང་བ་དང་། ཀློག་ཅིང་ཀུན་ཆུབ་པར་བགྱིད་པ་དང་། ཚུལ་བཞིན་དུ་ཡིད་ལ་བགྱིད་པ་དེ་དག་ནི་།
K02sspp2_4u:2336	 bahubuddhaparyupāsitāś ca te bhagavan kulaputrāḥ kuladuhitaraś ca bhaviṣyanti,	K03D0009-2_H0010-2:107b-19	སངས་རྒྱས་མང་པོ་ལ་བསྙེན་བཀུར་བགྱིས་པར་འགྱུར་།
K02sspp2_4u:2337	 kalyāṇamitraparigṛhītāś ca te bhagavan kulaputrā vā kuladuhitaraś ca bhaviṣyanti,	K03D0009-2_H0010-2:108a-0	དགེ་བའི་བཤེས་༄༡༠༨ཨ་༌༎ གཉེན་གྱིས་ཡོངས་སུ་བཟུང་བར་འགྱུར་རོ་༎ བཅོམ་ལྡན་འདས་།
K02sspp2_4u:2338	 ya imāṃ prajñāpāramitām udgrahīṣyanti dhārayiṣyanti vācayiṣyanti paryavāpsyanti yoniśaś ca manasikariṣyanti. tat kasya hetoḥ?	K03D0009-2_H0010-2:108a-3	དེ་ཅིའི་སླད་དུ་ཞེ་ན་། འདི་ལྟ་སྟེ་།
K02sspp2_4u:2339	 ato hi bhagavan sarvākārajñatā gaveṣitavyā yad uta prajñāpāramitāyāḥ,	K03D0009-2_H0010-2:108a-5	ཤེས་རབ་ཀྱི་ཕ་རོལ་ཏུ་ཕྱིན་པ་འདི་ལས་། རྣམ་པ་ཐམས་ཅད་མཁྱེན་པ་ཉིད་བཙལ་བར་བགྱིའོ་༎ བཅོམ་ལྡན་འདས་།
K02sspp2_4u:2341	 yad uta sarvākārajñatāyāḥ. tat kasya hetoḥ?	K03D0009-2_H0010-2:108a-8	འདི་ལྟ་སྟེ་། རྣམ་པ་ཐམས་ཅད་མཁྱེན་པ་ཉིད་ལས་ཤེས་རབ་ཀྱི་ཕ་རོལ་ཏུ་ཕྱིན་པ་བཙལ་བར་བགྱིའོ་༎ དེ་ཅིའི་སླད་དུ་ཞེ་ན༏་བཅོམ་ལྡན་འདས་།
K02sspp2_4u:2342	 tathā hi bhagavan nānyā prajñāpāramitānyā sarvākārajñatānyā prajñāpāramitā iti hi prajñāpāramitā ca sarvākārajñatā nānyādvayam etad advaidhīkāram.	K03D0009-2_H0010-2:108a-11	དེ་ནི་འདི་ལྟར་ཤེས་རབ་ཀྱི་ཕ་རོལ་ཏུ་ཕྱིན་པའང་གཞན་ལ་། རྣམ་པ་ཐམས་ཅད་མཁྱེན་པ་ཉིད་ཀྱང་གཞན་མ་ལགས་། རྣམ་པ་ཐམས་ཅད་མཁྱེན་པ་ཉིད་ཀྱང་གཞན་ལ་། ཤེས་རབ་ཀྱི་ཕ་རོལ་ཏུ་ཕྱིན་པའང་གཞན་མ་ལགས་ཏེ་། ཤེས་རབ་ཀྱི་ཕ་རོལ་ཏུ་ཕྱིན་པ་དང་། རྣམ་པ་ཐམས་ཅད་མཁྱེན་པ་ཉིད་དེ་ལ་གཉིས་སུ་མ་མཆིས་ཏེ་གཉིས་སུ་བགྱིར་མ་མཆིས་སོ་༎
K02sspp2_4u:2343	 bhagavān āha:	K03D0009-2_H0010-2:108a-16	བཅོམ་ལྡན་འདས་ཀྱིས་བཀའ་སྩལ་པ་།
K02sspp2_4u:2344	 evam etat kauśikaivam etat prajñāpāramitāniryātā hi kauśika tathāgatānām arhatāṃ samyaksaṃbuddhānāṃ sarvākārajñatā,	K03D0009-2_H0010-2:108a-17	ཀོཨོ་ཤི་ཀ་། དེ་དེ་བཞིན་ནོ་༎ དེ་དེ་བཞིན་ཏེ་། ཀོཨོ་ཤི་ཀ་། ཤེས་རབ་ཀྱི་ཕ་རོལ་ཏུ་ཕྱིན་པ་ལས་བྱུང་བ་ནི་དེ་བཞིན་གཤེགས་པ་དགྲ་བཅོམ་པ་ཡང་དག་པར་རྫོགས་པའི་སངས་རྒྱས་རྣམས་ཀྱི་རྣམ་པ་ཐམས་ཅད་མཁྱེན་པ་ཉིད་དོ་༎
K02sspp2_4u:2345	 sarvākārajñātāniryātā ca prajñāpāramitā. tat kasya hetoḥ?	K03D0009-2_H0010-2:108a-22	རྣམ་པ་ཐམས་ཅད་མཁྱེན་པ་ཉིད་ལས་བྱུང་བ་ནི་ཤེས་རབ་ཀྱི་ཕ་རོལ་ཏུ་ཕྱིན་པའོ་༎ དེ་ཅིའི་ཕྱིར་ཞེ་ན་།
K02sspp2_4u:2346	 tathā hi kauśika nānyā prajñāpāramitānyā sarvākārajñatā nānyā sarvākārajñatānyā prajñāpāramitā iti hi prajñāpāramitā ca sarvākārajñatā cādvayam etad advaidhīkāram.	K03D0009-2_H0010-2:108a-24	ཀོཨོ་ཤི་ཀ་། དེ་ནི་འདི་ལྟར་ཤེས་རབ་ཀྱི་ཕ་རོལ་ཏུ་ཕྱིན་པའང་གཞན་ལ་། རྣམ་པ་ཐམས་ཅད་མཁྱེན་པ་ཉིད་ཀྱང་གཞན་མ་ཡིན་། རྣམ་པ་ཐམས་ཅད་མཁྱེན་པ་ཉིད་ཀྱང་གཞན་༄༡༠༨བ་ལ༏་ཤེས་རབ་ཀྱི་ཕ་རོལ་ཏུ་ཕྱིན་པའང་གཞན་མ་ཡིན་ཏེ་། དེ་ལྟར་ཤེས་རབ་ཀྱི་ཕ་རོལ་ཏུ་ཕྱིན་པ་དང་། རྣམ་པ་ཐམས་ཅད་མཁྱེན་པ་ཉིད་དེ་ལ་གཉིས་སུ་མེད་དེ་གཉིས་སུ་བྱར་མེད་དོ་༎
K02sspp2_4u:2347	 śatasāhasryāṃ prajñāpāramitāyāṃ viṃśatitamaḥ parivartaḥ  [K. 187a3, N. 365b8, T. 293b6, P. 224b2, Ch, 585a15]	K03D0009-2_H0010-2:108b-2	ཤེས་རབ་ཀྱི་ཕ་རོལ་ཏུ་ཕྱིན་པ་སྟོང་ཕྲག་ཉི་ཤུ་ལྔ་པ་ལས་ལེའུ་ཉི་ཤུ་པའོ་༎༎
K02sspp2_4u:2349	 atha khalv āyuṣmān ānando bhagavantam etad avocat:	K03D0009-2_H0010-2:108b-3	དེ་ནས་ཚེ་དང་ལྡན་པ་དགའ་པོས་། བཅོམ་ལྡན་འདས་ལ་འདི་སྐད་ཅེས་གསོལ་ཏོ་༎
K02sspp2_4u:2350	 na tathā bhagavān dānapāramitāyā nāmadheyaṃ parikīrtayati,  na tathā śīlapāramitāyā nāmadheyaṃ parikīrtayati,  na tathā kṣāntipāramitāyā nāmadheyaṃ parikīrtayati,  na tathā vīryapāramitāyā nāmadheyaṃ parikīrtayati,	K03D0009-2_H0010-2:108b-5	བཅོམ་ལྡན་འདས་ཀྱིས་ཇི་ལྟར་ཤེས་རབ་ཀྱི་ཕ་རོལ་ཏུ་ཕྱིན་པའི་མིང་ཡོངས་སུ་བརྗོད་པར་མཛད་པ་དེ་ལྟར་།
K02sspp2_4u:2354	 na tathā dhyānapāramitāyā nāmadheyaṃ parikīrtayati,  na tathā prajñāpāramitāyā nāmadheyaṃ parikīrtayati.  na tathā bhagavān adhyātmaśūnyatāyā nāmadheyaṃ parikīrtayati,  na tathā bahirdhāśūnyatāyā nāmadheyaṃ parikīrtayati,  na tathādhyātmabahirdhāśūnyatāyā nāmadheyaṃ parikīrtayati,  na tathā śūnyatāśūnyatāyā nāmadheyaṃ parikīrtayati,	K03D0009-2_H0010-2:108b-6	སྦྱིན་པའི་ཕ་རོལ་ཏུ་ཕྱིན་པའི་མིང་ཡང་ཡོངས་སུ་བརྗོད་པ་མ་མཛད་།
K02sspp2_4u:2360	 na tathā mahāśūnyatāyā nāmadheyaṃ parikīrtayati,  na tathā paramārthaśūnyatāyā nāmadheyaṃ parikīrtayati,  na tathā saṃskṛtaśūnyatāyā nāmadheyaṃ parikīrtayati,  na tathā saṃskṛtaśūnyatāyā nāmadheyaṃ parikīrtayati,  na tathātyantaśūnyatāyā nāmadheyaṃ parikīrtayati,  na tathānavarāgraśūnyatāyā nāmadheyaṃ parikīrtayati,  na tathānavakāraśūnyatāyā nāmadheyaṃ parikīrtayati,  na tathā prakṛtiśūnyatāyā nāmadheyaṃ parikīrtayati,	K03D0009-2_H0010-2:108b-7	དེ་ལྟར་ཚུལ་ཁྲིམས་ཀྱི་ཕ་རོལ་ཏུ་ཕྱིན་པ་དང་། བཟོད་པའི་ཕ་རོལ་ཏུ་ཕྱིན་པ་དང་། བརྩོན་འགྲུས་ཀྱི་ཕ་རོལ་ཏུ་ཕྱིན་པ་དང་། དེ་ལྟར་བསམ་གཏན་གྱི་ཕ་རོལ་ཏུ་ཕྱིན་པའི་མིང་ཡང་ཡོངས་སུ་བརྗོད་པ་མ་མཛད་དོ་༎
