src_segmentnr	src_original	tgt_segmentnr	tgt_original
K03psp_4u:5685	 nāyaṃ kālaḥ sākṣātkriyāyā iti pratyavekṣate parijayasyāyaṃ kālo nāyaṃ kālaḥ sākṣātkriyāyā iti pratyavekṣate. asamāhita eva bodhisattvo mahāsattva āraṃbaṇe cittam upanibadhnāti,	K03D0009-3_H0010-3:11a-10	མངོན་དུ་བྱ་བ་ཡིན་ནོ་ཞེས་བྱ་བར་མི་རྟོག་སྟེ་། ཡོངས་སུ་འདྲིས་པར་བྱ་བར་རྟོག་ཅིང་འདི་ནི་ཡོངས་སུ་འདྲིས་པར་བྱ་བའི་དུས་ཡིན་གྱི་། འདི་ནི་མངོན་དུ་བྱ་བའི་དུས་མ་ཡིན་ནོ་༎ ཞེས་བྱ་བར་རྟོག་གོ་། བྱང་ཆུབ་སེམས་དཔའ་སེམས་དཔའ་ཆེན་པོ་ནི་མཉམ་པར་མ་བཞག་པ་ཉིད་དུ་སེམས་དམིགས་པ་ལ་འདོགས་ཏེ་།
K03psp_4u:5687	 na cāsravakṣayaṃ sākṣātkaroti. tat kasya hetoḥ?	K03D0009-3_H0010-3:11a-16	ཟག་པ་ཟད་པའང་མངོན་དུ་མི་བྱེད་དོ་༎
K03psp_4u:5688	 evam udārajñānasamanvāgato bodhisattvo mahāsattvo bhaviṣyati. tat kasya hetoḥ?	K03D0009-3_H0010-3:11a-17	དེ་ཅིའི་ཕྱིར་ཞེ་ན་། བྱང་ཆུབ་སེམས་དཔའ་སེམས་དཔའ་ཆེན་པོ་ནི་དེ་ལྟ་བུའི་ཡེ་ཤེས་༄༡༡བ་རླབས་པོ་ཆེ་དང་ལྡན་པ་སྟེ་།
K03psp_4u:5689	 yo bodhipakṣyeṣu dharmeṣu sthita evaṃ jānāti parijayasyāyaṃ kālo nāyaṃ kālaḥ sākṣātkriyāyā iti.	K03D0009-3_H0010-3:11b-1	དེ་ནི་བྱང་ཆུབ་ཀྱི་ཕྱོགས་ཀྱི་ཆོས་རྣམས་ལ་གནས་ཤིང་། འདི་ལྟར་འདི་ནི་ཡོངས་སུ་འདྲིས་པར་བྱ་བའི་དུས་ཏེ་། འདི་ནི་མངོན་དུ་བྱ་བའི་དུས་མ་ཡིན་ནོ་ཞེས་བྱ་བར་རང་ཏུ་ཤེས་སོ་༎
K03psp_4u:5690	 tena khalu punaḥ subhūte bodhisattvena mahāsattvena prajñāpāramitāyāṃ carataivaṃ pratyavekṣitavyaṃ,  dānapāramitāyā ayaṃ kālaḥ,	K03D0009-3_H0010-3:11b-4	རབ་འབྱོར་། བྱང་ཆུབ་སེམས་དཔའ་སེམས་དཔའ་ཆེན་པོ་ཤེས་རབ་ཀྱི་ཕ་རོལ་ཏུ་ཕྱིན་པ་ལ་སྤྱོད་པ་དེས་འདི་ལྟར་འདི་ནི་སྦྱིན་པའི་ཕ་རོལ་ཏུ་ཕྱིན་པའི་དུས་སོ་༎
K03psp_4u:5692	 śīlapāramitāyā ayaṃ kālaḥ,  kṣāntipāramitāyā ayaṃ kālaḥ,  vīryapāramitāyā ayaṃ kālaḥ,  dhyānapāramitāyā ayaṃ kālaḥ,  prajñāpāramitāyā ayaṃ kālaḥ,  smṛtyupasthānasya bhāvanāyā ayaṃ kālaḥ,	K03D0009-3_H0010-3:11b-5	འདི་ནི་ཚུལ་ཁྲིམས་ཀྱི་ཕ་རོལ་ཏུ་ཕྱིན་པ་དང་། བཟོད་པའི་ཕ་རོལ་ཏུ་ཕྱིན་པ་དང་། བརྩོན་འགྲུས་ཀྱི་ཕ་རོལ་ཏུ་ཕྱིན་པ་དང་། བསམ་གཏན་གྱི་ཕ་རོལ་ཏུ་ཕྱིན་པ་དང་། ཤེས་རབ་ཀྱི་ཕ་རོལ་ཏུ་ཕྱིན་པའི་དུས་སོ༏་༏འདི་ནི་དྲན་པ་ཉེ་བར་བཞག་པ་བསྒོམ་པའི་དུས་སོ་༎
K03psp_4u:5698	 evaṃ samyakprahāṇarddhipādendriyabalabodhyaṅgānām āryāṣṭāṅgikasya mārgasya bhāvanāyā ayaṃ kālaḥ,	K03D0009-3_H0010-3:11b-6	འདི་ནི་ཡང་དག་པར་སྤོང་བ་དང་། རྫུ་འཕྲུལ་གྱི་རྐང་པ་དང་། དབང་པོ་དང་། སྟོབས་དང་། བྱང་ཆུབ་ཀྱི་ཡན་ལག་དང་། འཕགས་པའི་ལམ་ཡན་ལག་བརྒྱད་པ་བསྒོམ་པའི་དུས་སོ་༎
K03psp_4u:5699	 śūnyatānimittāpraṇihitabhāvanāyā ayaṃ kālaḥ,	K03D0009-3_H0010-3:11b-7	འདི་ནི་སྟོང་པ་ཉིད་དང་། མཚན་མ་མེད་པ་དང་། སྨོན་པ་མེད་པ་བསྒོམ་པའི་དུས་སོ་༎
K03psp_4u:5700	 adhyātmaśūnyatāyā ayaṃ kālo bahirdhāśūnyatāyā ayaṃ kālo 'dhyātmabahirdhāśūnyatāyā ayaṃ kālo yāvad abhāvasvabhāvaśūnyatāyā ayaṃ kālaḥ,  apramāṇadhyānārūpyasamāpattibhāvanāyā ayaṃ kāla,	K03D0009-3_H0010-3:11b-8	འདི་ནི་མངོན་པར་ཤེས་པ་རྣམས་དང་། ཏིང་ངེ་འཛིན་རྣམས་དང་། གཟུངས་ཀྱི་སྒོ་རྣམས་ཐོབ་པར་བྱ་བའི་དུས་སོ་༎
K03psp_4u:5705	 daśānāṃ tathāgatabalānāṃ pratilābhāyāyaṃ kālaś,  caturṇāṃ vaiśāradyānāṃ pratilābhāyāyaṃ kālaḥ pratisaṃvitpratilābhāyāyaṃ kālo, (PSP_4:194)  aṣṭādaśānām āveṇikānāṃ buddhadharmāṇāṃ paripūraṇāyāyaṃ kālo,	K03D0009-3_H0010-3:11b-9	འདི་ནི་དེ་བཞིན་གཤེགས་པའི་སྟོབས་བཅུ་དང་། མི་འཇིགས་པ་བཞི་དང་། སོ་སོ་ཡང་དག་པར་རིག་པ་བཞི་དང་། སངས་རྒྱས་ཀྱི་ཆོས་མ་འདྲེས་པ་བཅོ་བརྒྱད་ཐོབ་པར་བྱ་བའི་དུས་སོ་༎
K03psp_4u:5708	 mahāmaitryā mahākaruṇāyāḥ pratilābhāyāyaṃ kālo,	K03D0009-3_H0010-3:11b-10	འདི་ནི་བྱམས་པ་ཆེན་པོ་དང་། སྙིང་རྗེ་ཆེན་པོ་ཐོབ་པར་བྱ་བའི་དུས་ཡིན་ཏེ་།
K03psp_4u:5709	 nāyaṃ kālaḥ srotaḥāpattiphalasākṣātkriyāyai,	K03D0009-3_H0010-3:12a-0	འདི་ནི་རྒྱུན་དུ་ཞུགས་པའི་འབྲས་བུ་མངོན་དུ་བྱ་བའི་དུས་༄༡༢ཨ་༌༎
K03psp_4u:5710	 nāyaṃ kālaḥ sakṛdāgāmiphalasākṣātkriyāyai,  nāyaṃ kālo nāgāmiphalasākṣātkriyāyai,	K03D0009-3_H0010-3:12a-1	མ་ཡིན་། ལན་གཅིག་ཕྱིར་འོང་བའི་འབྲས་བུ་དང་། ཕྱིར་མི་འོང་བའི་འབྲས་བུ་དང་། དགྲ་བཅོམ་པ་ཉིད་མངོན་དུ་བྱ་བའི་དུས་མ་ཡིན་།
K03psp_4u:5712	 nāyaṃ kālo 'rhattvaphalasākṣātkriyāyai nāyaṃ kālaḥ pratyekabuddhajñānasākṣātkriyāyai,  sarvākārajñatāyāḥ pratilābhāyāyaṃ kālaḥ.	K03D0009-3_H0010-3:12a-2	རང་སངས་རྒྱས་ཀྱི་ཡེ་ཤེས་མངོན་དུ་བྱ་བའི་དུས་མ་ཡིན་ཏེ་། འདི་ནི་རྣམ་པ་ཐམས་ཅད་མཁྱེན་པ་ཉིད་ཐོབ་པར་བྱ་བ་ཡོངས་སུ་མི་གཏང་བའི་དུས་སོ་ཞེས་བྱ་བར་བརྟག་པར་བྱ་སྟེ་།
K03psp_4u:5714	 evaṃ khalu subhūte bodhisattvo mahāsattvaḥ prajñāpāramitāyāṃ caran śūnyatāyāṃ ca parijayaṃ karoti,	K03D0009-3_H0010-3:12a-4	རབ་འབྱོར་། དེ་ལྟར་ན་བྱང་ཆུབ་སེམས་དཔའ་སེམས་དཔའ་ཆེན་པོ་ཤེས་རབ་ཀྱི་ཕ་རོལ་ཏུ་ཕྱིན་པ་ལ་སྤྱོད་པའི་ཚེ་།
K03psp_4u:5715	 śūnyatayā ca viharaty,	K03D0009-3_H0010-3:12a-5	སྟོང་པ་ཉིད་ལ་ཡོངས་སུ་འདྲིས་པར་བྱེད་ཅིང་སྟོང་པ་ཉིད་ཀྱིས་རྣམ་པར་སྤྱོད་པ་ཡིན་།
K03psp_4u:5716	 ānimitte ca parijayaṃ karoti,  ānimittena ca viharaty,	K03D0009-3_H0010-3:12a-6	མཚན་མ་མེད་པ་ལ་ཡོངས་སུ་འདྲིས་པར་བྱེད་ཅིང་མཚན་མ་མེད་པས་རྣམ་པར་སྤྱོད་པ་ཡིན་།
K03psp_4u:5718	 apraṇihite ca parijayaṃ karoti,	K03D0009-3_H0010-3:12a-7	སྨོན་པ་མེད་པ་ལ་ཡོངས་སུ་འདྲིས་པར་བྱེད་ཅིང་སྨོན་པ་མེད་པར་རྣམ་པར་སྤྱོད་པ་ཡིན་།
K03psp_4u:5719	 apraṇihitena ca viharati. smṛtyupasthānāni ca bhāvayati smṛtyupasthānaiś ca viharati na ca sākṣātkaroti. evaṃ samyakprahāṇarddhipādendriyabalabodhyaṅgāni,	K03D0009-3_H0010-3:12a-8	དྲན་པ་ཉེ་བར་བཞག་པ་རྣམས་ལ་བསྒོམ་ཞིང་། དྲན་པ་ཉེ་བར་བཞག་པ་རྣམས་ཀྱིས་རྣམ་པར་སྤྱོད་པ་ཡིན་། ཡང་དག་པར་སྤོང་བ་དང་། རྫུ་འཕྲུལ་གྱི་རྐང་པ་དང་། དབང་པོ་དང་། སྟོབས་དང་། བྱང་ཆུབ་ཀྱི་ཡན་ལག་རྣམས་ལ་བསྒོམ་ཞིང་། བྱང་ཆུབ་ཀྱི་ཡན་ལག་རྣམས་ཀྱིས་རྣམ་པར་སྤྱོད་པ་ཡིན་།
K03psp_4u:5720	 āryāṣṭāṅgikaṃ ca mārgañ ca bhāvayaty āryāṣṭāṅgikena ca mārgeṇa viharati na ca sākṣātkaroti.	K03D0009-3_H0010-3:12a-12	འཕགས་པའི་ལམ་ཡན་ལག་བརྒྱད་པ་ལ་བསྒོམ་ཡང་མངོན་དུ་མི་བྱེད་པ་ཡིན་།
K03psp_4u:5721	 evaṃ khalu subhūte bodhisattvo mahāsattvo bodhipakṣyeṣu dharmeṣu parijayaṃ karoti,	K03D0009-3_H0010-3:12a-13	རབ་འབྱོར་། དེ་ལྟར་ན་བྱང་ཆུབ་སེམས་དཔའ་སེམས་དཔའ་ཆེན་པོ་བྱང་ཆུབ་ཀྱི་ཕྱོགས་ཀྱི་ཆོས་རྣམས་ལ་ཡོངས་སུ་འདྲིས་པར་བྱེད་པ་ཡིན་།
K03psp_4u:5722	 bodhipakṣyāṃś ca dharmān bhāvayati bodhipakṣyaiś ca dharmair viharati,	K03D0009-3_H0010-3:12a-14	བྱང་ཆུབ་ཀྱི་ཕྱོགས་ཀྱི་ཆོས་རྣམས་བསྒོམ་པ་ཡིན་། བྱང་ཆུབ་༄༡༢བ་ཀྱི་ཕྱོགས་ཀྱི་ཆོས་རྣམས་ཀྱིས་རྣམ་པར་སྤྱོད་པ་ཡིན་ཏེ་།
K03psp_4u:5723	 na ca srotaāpattiphalaṃ sākṣātkaroti na ca sakṛdāgāmiphalan na cānāgāmiphalan nārhattvaphalaṃ sākṣātkaroti. ity upāyakauśalaprayogaḥ	K03D0009-3_H0010-3:12b-1	རྒྱུན་དུ་ཞུགས་པའི་འབྲས་བུ་མངོན་དུ་མི་བྱེད་དོ་༎ ལན་གཅིག་ཕྱིར་འོང་བའི་འབྲས་བུ་དང་། ཕྱིར་མི་འོང་བའི་འབྲས་བུ་དང་། དགྲ་བཅོམ་པ་ཉིད་དང་། རང་བྱང་ཆུབ་མངོན་དུ་མི་བྱེད་དོ་༎
K03psp_4u:5724	 tadyathāpi nāma subhūte kaścid eva puruṣaḥ śūraś ca bhaved,  vīraś ca bhaved,  dṛḍhapratiṣṭhānaś ca bhaved,	K03D0009-3_H0010-3:12b-3	རབ་འབྱོར་། འདི་ལྟ་སྟེ་། དཔེར་ན་། སྐྱེས་བུ་ཞིག་དཔའ་ཞིང་རྩལ་ཆེ་ལ་ཤིན་ཏུ་བརྟན་ཞིང་།
K03psp_4u:5727	 abhirūpaś ca bhavet,	K03D0009-3_H0010-3:12b-5	གཟུགས་མཛེས་ལ་།
K03psp_4u:5730	 paramaśubhavarṇapuṣkaratayā samanvāgataś ca bhaved,	K03D0009-3_H0010-3:12b-6	བྱད་བཞིན་བཟང་ཞིང་བལྟ་ན་སྡུག་པ་ཁ་དོག་བཟང་པོ་མཆོག་ཏུ་རྒྱས་པ་དང་ལྡན་པ་།
K03psp_4u:5731	 iṣvastre ca paramāṃ gatiṃgato bhaved,	K03D0009-3_H0010-3:12b-7	འཕོང་རྩལ་མཆོག་ཏུ་བྱུང་བ་།
K03psp_4u:5732	 dṛḍhāni cānena praharaṇāni gṛhītāni bhaveyuḥ,	K03D0009-3_H0010-3:12b-8	མཚོན་ཆ་སྲ་བ་ཐོགས་པ་།
K03psp_4u:5733	 sarvāsu ca catuḥṣaṣṭhiṣu kalāsu pariniṣpanno bhavet,	K03D0009-3_H0010-3:12b-9	སྒྱུ་རྩལ་དྲུག་ཅུ་རྩ་བཞི་ཐམས་ཅད་ཡོངས་སུ་རྫོགས་པ་།
K03psp_4u:5734	 sarvatra ca śilpasthāneṣu ca karmasthāneṣu ca gatiṃgato bhavet,	K03D0009-3_H0010-3:12b-10	བཟོའི་གནས་དང་ལས་ཀྱི་གནས་ཐམས་ཅད་རྟོག་པར་རིག་པ་།
K03psp_4u:5735	 bahujanasya ca priyo manaāpo bhavet,  sa yāṃ yām eva ca kāṃścit kriyām ārabheta sarvatra tatra tatra ca lābhasatkārasamanvāgato bhavet,	K03D0009-3_H0010-3:12b-11	འགྲོ་བ་མང་པོའི་ཡིད་དུ་འོང་ཞིང་སྡུག་པ་ནི་བྱ་བ་གང་དང་གང་རྩོམ་ཡང་ཐམས་ཅད་དུ་རྙེད་པ་ཆེན་པོ་དང་ལྡན་ཏེ་།
K03psp_4u:5737	 tena ca bahujanaṃ satkuryād gurukuryāt mānayet pūjayet,	K03D0009-3_H0010-3:12b-12	རྙེད་པ་དེས་སྐྱེ་བོ་མང་པོ་ལ་རིམ་གྲོར་བྱེད༏་བཀུར་སྟིར་བྱེད་།
K03psp_4u:5738	 sa bhūyasyā mātrayā āttamanasko bhavet pramuditaḥ prītisaumanasyajātaḥ sa mātāpitṛputradārān  gṛhītvā kenacid eva karaṇīyena mahābhayabhairavam aṭavīkāntāraṃ praviṣṭas syād bālānāṃ	K03D0009-3_H0010-3:12b-15	དེ་ཤིན་ཏུ་དགའ་ཞིང་སྤྲོ་བ་དང་། ཉམས་དགའ་ཞིང་ཡིད་བདེ་ནས་དགོས་པ་ཞིག་གི་ཕྱིར་ཕ་མ་དང་། བུ་དང་ཆུང་མ་དག་ཁྲིད་དེ་འབྲོག་དགོན་པ་བྱིས་པ་རྣམས་འཇིགས་ཤིང་སྐྱི་ག-ཡའ་བར་སོང་སྟེ་།
K03psp_4u:5741	 tatra ca sa puruṣaḥ praviśya tān mātāpitṛputradārān (PSP_4:195)  abhayenābhinimantrayen,	K03D0009-3_H0010-3:12b-16	སྐྱེས་བུ་དེས་དེར་ཕྱིན་ནས་ཕ་མ་དང་། བུ་དང་། ཆུང་མ་ལ་མི་འཇིགས་པ་བྱིན་ཏེ་། འཇིགས་པར་མ་བྱེད་།
K03psp_4u:5743	 mā bhaiṣṭa mā bhaiṣṭāhaṃ yuṣmān ito mahābhayabhairavād aṭavīkāntārād bālānāṃ bhīṣaṇāt  sa romaharṣaṇāc chīghram evāpakrāmayiṣyāmi śīghram eva parimocayiṣyāmi. tasya ca	K03D0009-3_H0010-3:12b-18	མ་འཇིགས་ཤིག་། བདག་གིས་ཁྱེད་འབྲོག་དགོན་པ་འཇིགས་ཤིང་ཉམས་མི་བདེ་བ་འདི་ལས་མྱུར་དུ་གདོན་ཅིང་མྱུར་དུ་ཐར་བར་བྱའོ་ཞེས་མི་འཇིགས་པ་བྱིན་ཏེ་།
K03psp_4u:5745	 puruṣasya tatrāṭavīkāntāre bahavo 'mitrā vadhakāḥ pratyarthikāḥ pratyamitrāḥ pratyupasthitā bhaveyuḥ,	K03D0009-3_H0010-3:13a-0	འབྲོག་དགོན་པ་དེར་སྐྱེས་༄༡༣ཨ་༌༎ བུ་དེ་ལ་གསོད་པའི་དགྲ་ཕྱིར་རྒོལ་པ་མང་པོ་ཉེ་བར་གནས་པར་གྱུར་ནས་།
K03psp_4u:5747	 sa tān parimocayitvā mātāpitṛputradārāṃs tasmād aṭavīkāntārān niṣkāśayitvā punar  eva grāmaṃ vā nagaraṃ vā nigamaṃ vā janapadaṃ vā janapradeśaṃ vā gatvā prītisaumanasya	K03D0009-3_H0010-3:13a-3	དེས་ཕ་མ་དང་། བུ་དང་། ཆུང་མ་དག་འབྲོག་དགོན་པ་དེ་ནས་བཏོན་ཏེ་། བདེ་ཞིང་ཉོན་མ་མོངས་པར་ཐར་པར་བྱས་ནས་ཕྱིར་གྲོང་ངམ་། གྲོང་ཁྱེར་རམ་། གྲོང་རྡལ་ལམ་།
K03psp_4u:5749	 jāto vihared akṣato 'nupahato,  na ca teṣāṃ sattvānām antike pratyarthikānāṃ pratyamitrāṇāṃ vā manaḥ praduṣayet. tat kasya hetoḥ?	K03D0009-3_H0010-3:13a-7	ལྗོངས་ཀྱི་འདབ་ཏུ་མ་སྣད་མ་ཉམས་པར་ཕྱིན་ནས་དགའ་ཞིང་ཡིད་བདེ་བ་སྐྱེས་ཏེ་དགྲ་ཕྱིར་རྒོལ་བའི་སེམས་ཅན་དེ་དག་ལའང་སེམས་ཀྱིས་སྡང་བར་མི་བྱེད་དེ་། དེ་ཅིའི་ཕྱིར་ཞེ་ན་།
K03psp_4u:5751	 tathā hi sa kṛtayogyaḥ sarvāsu ca kalāsu bhavet,  tena tatrāṭavīkāntāre bahutarāś ca śūratarāś ca dṛḍhapraharaṇatarāś ca teṣāṃ pratyarthikānāṃ pratyamitrāṇām anye udāratarāḥ pratyarthikāḥ pratyamitrā abhinirmitā bhaveyuḥ,	K03D0009-3_H0010-3:13a-9	སྐྱེས་བུ་དེས་སྒྱུ་རྩལ་ཐམས་ཅད་ལ་བྱང་བར་བྱས་པས༏་དེས་འབྲོག་དགོན་པ་དེར་ཕྱིར་རྒོལ་བ་དེ་དག་པས་། ཕྱིར་རྒོལ་པ་གཞན་ཆེས་ཕལ་ཆེ་བ་། ཆེས་མང་བ་། ཆེས་དཔའ་བ་།
K03psp_4u:5753	 te tena bhayena sarve 'pagatā bhaveyuḥ. atha sa puruṣas tān mātāpitṛputradārān svastinā parimocayitvā sukhaṃ viharet.	K03D0009-3_H0010-3:13a-14	ཕྱིར་རྒོལ་བ་དེ་དག་ཐམས་ཅད་འཇིགས་པ་དེས་མེད་པར་གྱུར་ནས་སྐྱེས་བུ་དེས་ཕ་མ་དང་། བུ་དང་། ཆུང་མ་དེ་དག་ཉོན་མ་མོངས་པར་ཐར་བར་བྱས་ནས་། བདེ་བར་རྣམ་པར་སྤྱོད་པ་ཞིག་ཡོད་ན་།
K03psp_4u:5754	 evam eva subhūte yasmin samaye bodhisattvo mahāsattvaḥ sarvasattvānām antike maitryārambaṇena	K03D0009-3_H0010-3:13a-16	རབ་འབྱོར༏་དེ་བཞིན་དུ་གང་གི་ཚེ་། བྱང་ཆུབ་སེམས་དཔའ་སེམས་དཔའ་ཆེན་པོ་སེམས་ཅན་ཐམས་ཅད་ལ་བྱམས་པར་དམིགས་པའི་སེམས་དང་། སྙིང་རྗེ་དང་། དགའ་བ་དང་། བཏང་སྙོམས་སུ་དམིགས་པའི་སེམས་ཀྱིས་ཁྱབ་པར་བྱས་ནས་གནས་ཏེ་།
K03psp_4u:5756	 mahāsattvo na cānimittena vyāhriyate na cānimittasamādhiṃ sākṣātkriyayā śrāvakabhūmau  vā pratyekabuddhabhūmau vā pratiṣṭhet.  ity antarāyikadharmasamatikramaṇopāyaḥ	K03D0009-3_H0010-3:13b-3	དེའི་སྐབས་སུ་བྱང་ཆུབ་སེམས་དཔའ་སེམས་དཔའ་ཆེན་པོ་མཚན་མས་ཀྱང་རྣམ་པར་མི་སྤྱོད་། མཚན་མ་མེད་པའི་ཏིང་ངེ་འཛིན་གང་མངོན་དུ་བྱས་པས་ཉན་ཐོས་ཀྱི་སའམ་། རང་སངས་རྒྱས་ཀྱི་ས་ལ་གནས་པར་འགྱུར་བ་དེ་ལྟ་བུའང་མངོན་དུ་མི་བྱེད་དོ་༎
K03psp_4u:5759	 tadyathāpi nāma subhūte pakṣī śakunir antarīkṣe carati na ca bhūmau patati,	K03D0009-3_H0010-3:13b-6	རབ་འབྱོར་། འདི་ལྟ་སྟེ་། དཔེར་ན་། འདབ་ཆགས་བྱ་ནི་བར་སྣང་ལ་རྒྱུ་ཞིང་ས་ལ་མི་ལྟུང་སྟེ་།
K03psp_4u:5760	 ākāśe vāntarīkṣe viharati na ca tatra tiṣṭhati na pratiṣṭhate. evam eva subhūte bodhisattvo mahāsattvaḥ śūnyatāyāṃ ca parijayaṃ karoti śūnyatayā ca viharati,	K03D0009-3_H0010-3:13b-8	ནམ་མཁའ་བར་སྣང་ལ་གནས་ཀྱང་དེ་ལ་གནས་པ་མེད་དོ་༎ རབ་འབྱོར་། དེ་བཞིན་དུ་བྱང་ཆུབ་སེམས་དཔའ་སེམས་དཔའ་ཆེན་པོའང་སྟོང་པ་ཉིད་ལ་ཡོངས་སུ་འདྲིས་པར་བྱེད་ཅིང་། སྟོང་པ་ཉིད་ལའང་རྣམ་པར་སྤྱོད་།
K03psp_4u:5761	 ānimitte ca parijayaṃ karoty ānimittena ca viharaty,  apraṇihite ca parijayaṃ karoty apraṇihitena ca viharati,	K03D0009-3_H0010-3:13b-11	མཚན་མ་མེད་པ་དང་། སྨོན་པ་མེད་པ་ལ་ཡོངས་སུ་འདྲིས་པར་བྱེད་ཅིང་མཚན་མ་མེད་པ་དང་། སྨོན་པ་མེད་པ་ལའང་རྣམ་པར་སྤྱོད་དེ་།
K03psp_4u:5763	 na ca śūnyatāṃ vānimittaṃ vāpraṇihitaṃ vā sākṣātkaroti,  yayā sākṣātkriyayā śrāvakabhūmau vā pratyekabuddhabhūmau vā pated,  aparipūrṇair daśabhis tathāgatabalaiś caturbhir vaiśāradyaiś catasṛbhiḥ pratisaṃvidbhir	K03D0009-3_H0010-3:13b-12	སྟོང་པ་ཉིད་དང་། མཚན་མ་མེད་པ་དང་། སྨོན་པ་མེད་པ་གང་མངོན་དུ་བྱས་པས་དེ་བཞིན་གཤེགས་པའི་སྟོབས་བཅུ་དང་། མི་འཇིགས་པ་བཞི་དང་། སོ་སོ་ཡང་དག་པར་རིག་པ་བཞི་དང་། བྱམས་པ་ཆེན་པོ་དང་། སྙིང་རྗེ་ཆེན་པོ་དང་། སངས་རྒྱས་ཀྱི་ཆོས་མ་འདྲེས་པ་བཅོ་བརྒྱད་ཡོངས་སུ་མ་རྫོགས་པར་ཉན་ཐོས་༄༡༤ཨ་༌༎ ཀྱི་སའམ་། རང་སངས་རྒྱས་ཀྱི་སར་ལྟུང་བར་འགྱུར་བའང་མངོན་དུ་མི་བྱེད་དེ་།
K03psp_4u:5766	 aṣṭādaśabhir āveṇikair buddhadharmair mahāmaitryā mahākaruṇayā cāparimāṇeṣu ca buddhadharmeṣu	K03D0009-3_H0010-3:14a-2	སངས་རྒྱས་ཀྱི་ཆོས་ཚད་མེད་པ་ལ་སྤྱད་ནས་།
K03psp_4u:5767	 caritvā sarvākārajñatām anuprāpnoti. ity apratiṣṭhitavihāropāyaḥ	K03D0009-3_H0010-3:14a-3	རྣམ་པ་ཐམས་ཅད་མཁྱེན་པ་ཉིད་ཐོབ་པར་བྱེད་དོ་༎
K03psp_4u:5768	 tadyathāpi nāma subhūte balavān iṣvastrācāryo bhaved iṣvastraśikṣāyāṃ suśikṣitaḥ	K03D0009-3_H0010-3:14a-4	རབ་འབྱོར་། འདི་ལྟ་སྟེ་། དཔེར་ན་། སྐྱེས་བུ་མཐུ་དང་ལྡན་པ་འཕོང་རྩལ་གྱི་སློབ་དཔོན་དུ་གྱུར་པ་།
