src_segmentnr	src_original	tgt_segmentnr	tgt_original
K03psp_1u:6236	 sarvasattvānām antike mayā samacittatā utpādayitavyā,	T02D2512-2:303b-19	བདག་གིས་སེམས་ཅན་ཐམས་ཅད་ལ་མཉམ་པའི་སེམས་བསྐྱེད་པར་བགྱིའོ་༎
K03psp_1u:6237	 sarvasattvā mayā tribhir yānaiḥ parinirvāpayitavyāḥ,	T02D2512-2:303b-20	བདག་གིས་སེམས་ཅན་ཐམས་ཅད་དང་། ཐབས་ཀྱི་བྱེ་བྲག་ཐམས་ཅད་ཀྱིས་བཏུལ་ནས་མི་གནས་པའི་མྱ་ངན་ལས་འདས་པའི་དབྱིངས་ལ་རབ་ཏུ་གཞག་པར་བྱའོ་༎
K03psp_1u:6238	 sarvasattvān api mayā parinirvāpya na kaścit sattvaḥ parinirvāpito bhavati. tat kasya hetoḥ?	T02D2512-2:303b-21	བདག་གིས་སེམས་ཅན་ཐམས་ཅད་ཡོངས་སུ་མྱ་ངན་ལས་འདས་པར་གྱུར་ཀྱང་སེམས་ཅན་འགའ་ཡང་ཡོངས་སུ་མྱ་ངན་ལས་འདས་པ་མེད་དོ་ཞེས་སེམས་བསྐྱེད་པར་བགྱིའོ་༎
K03psp_1u:6240	 avyavakīrṇena mayā sarvākārajñatācittena ṣaṭsu pāramitāsu caritavyaṃ,  sarvatrānugatāyāṃ sarvadharmaprativedhapariniṣpattyāṃ mayā śikṣitavyam,	T02D2512-2:303b-22	བདག་གིས་ཆོས་ཐམས་ཅད་སྐྱེ་བ་མེད་པ་ཉིད་དུ་རྗེས་སུ་རྟོག་པར་བགྱིའོ་༎ བདག་གིས་མ་ཡེངས་བའི་སེམས་དང་༏་ཐམས་ཅད་མཁྱེན་པའི་ཡེ་ཤེས་ཀྱི་སེམས་ཀྱིས་ཕ་རོལ་ཏུ་ཕྱིན་པ་དྲུག་ལ་བསླབ་པར་བྱའོ་༎
K03psp_1u:6242	 ekatayābhinirhāro mayā sarvadharmāṇāṃ pratiboddhavyaḥ,	T02D2512-2:303b-24	བདག་གིས་ཐོས་པ་གཅིག་གི་ཚུལ་དུ་གནས་པར་ཡང་རྟོག་པར་བགྱིའོ་༎
K03psp_1u:6243	 yāvat pāramitābhinirhāraprativedhāya mayā sarvadharmāṇāṃ śikṣitavyaṃ,  saptatriṃśad bodhipakṣadharmābhinirhāraprativedhāya mayā dharmāṇāṃ śikṣitavyaṃ,  apramāṇadhyānārūpyābhijñājñānābhinirhāraprativedhāya mayā dharmāṇāṃ śikṣitavyaṃ,  daśabalavaiśāradyāveṇikabuddhadharmābhinirhāraprativedhāya mayā dharmāṇāṃ śikṣitavyaṃ,	T02D2512-2:304a-0	བདག་གིས་བྱང་ཆུབ་ཀྱི་ཕྱོགས་ཀྱི་ཆོས་སུམ་ཅུ་རྩ་བདུན་ལ་གནས་པར་སོ་སོར་རྟོགས་༄༣༠༤ཨ་༌་༎ པར་བྱ་བའི་ཕྱིར་བསླབ་པར་བྱའོ་༎
