src_segmentnr	src_original	tgt_segmentnr	tgt_original
K03psp_4u:5769	 sa kāṇḍam ūrdhvamukhaṃ kṣiptvā tadanyaiḥ kāṇḍais tasya pūrvakasya kāṇḍasya paraṃparayā  pṛthivyāṃ patanaṃ na dadyāt tāvat kāṇḍaṃ pṛthivyāṃ na patati yāvat sa puruṣa ākāṅkṣet.  atha khalv etat kāṇḍaṃ pṛthivyāṃ nipatet,  sa paścimaṃ kāṇḍam ūrdhvamukhaṃ nākṣiped,	K03D0009-3_H0010-3:14a-6	འཕོང་རྩལ་བསླབ་པ་ལ་ཤིན་ཏུ་བྱང་བ་ཞིག་ཡོད་ལ་། དེས་མདའ་ཞིག་གནམ་དུ་འཕངས་ཏེ་། མདའ་དེ་གནམ་དུ་འཕངས་ནས་། མདའ་གཞན་གཅིག་ནས་གཅིག་ཏུ་བརྒྱུད་དེ་འཕངས་པས་མདའ་སྔ་མ་དེ་ས་ལ་ལྟུང་དུ་མ་བཅུག་སྟེ་། དེ་ཇི་སྲིད་དུ་སྐྱེས་བུ་དེས་ད་ནི་མདའ་འདི་ས་ལ་ལྟུང་བར་བྱའོ་སྙམ་དུ་འདོད་པར་མ་བྱས་པས་དེ་སྲིད་དུ་མདའ་དེ་ས་ལ་མི་ལྟུང་སྟེ་། ནམ་མདའ་ཕྱི་མ་མ་འཕངས་པ་དེའི་ཚེ་།
K03psp_4u:5773	 evaṃ sā kāṇḍaparaṃparā pṛthivyāṃ nipatet.	K03D0009-3_H0010-3:14a-12	མདའ་གཅིག་ནས་གཅིག་ཏུ་བརྒྱུད་པ་དེ་དག་ས་ལ་ལྡོག་གོ་།
K03psp_4u:5774	 evam eva subhūte bodhisattvo mahāsattvaḥ prajñāpāramitāyāṃ carann upāyakauśalyena	K03D0009-3_H0010-3:14a-13	རབ་འབྱོར་། དེ་བཞིན་དུ་བྱང་ཆུབ་སེམས་དཔའ་སེམས་དཔའ་ཆེན་པོ་ཤེས་རབ་ཀྱི་ཕ་རོལ་ཏུ་ཕྱིན་པ་ལ་སྤྱོད་པ་།
K03psp_4u:5775	 parigṛhītas tāvat tāṃ paramāṃ bhūtakoṭiṃ na sākṣātkaroti yāvan na tāni kuśalamūlāni  paripakvāni bhavanty anuttarāyāṃ samyaksaṃbodhau,	K03D0009-3_H0010-3:14a-14	ཐབས་མཁས་པས་ཡོངས་སུ་བཟུང་བའང་ཇི་སྲིད་དུ་དགེ་བའི་རྩ་བ་དེ་དག་བླ་ན་མེད་པ་ཡང་དག་པར་རྫོགས་པའི་བྱང་ཆུབ་ཏུ་ཡོངས་སུ་སྨིན་པར་མ་གྱུར་པ་དེ་སྲིད་དུ་ཡང་དག་པའི་མཐའ་དམ་པ་མངོན་དུ་མི་བྱེད་དོ་༎
K03psp_4u:5777	 yadā tāni kuśalamūlāni paripakvāni bhavanty anuttarāyāṃ samyaksaṃbodhau tadā tāṃ  paramāṃ bhūtakoṭiṃ sākṣātkaroti. tasmāt tarhi subhūte bodhisattvena mahāsattvena	K03D0009-3_H0010-3:14a-15	ནམ་དགེ་བའི་རྩ་བ་དེ་དག་བླ་ན་མེད་པ་ཡང་དག་པར་རྫོགས་པའི་བྱང་ཆུབ་ཏུ་ཡོངས་སུ་སྨིན་པར་གྱུར་པ་དེ་ནི་ཡང་དག་པའི་མཐའ་དམ་པ་མངོན་དུ་བྱེད་དོ་༎ རབ་འབྱོར་། དེ་བས་ན་བྱང་ཆུབ་སེམས་དཔའ་སེམས་༄༡༤བ་དཔའ་ཆེན་པོ་ཤེས་རབ་ཀྱི་ཕ་རོལ་ཏུ་ཕྱིན་པ་ལ་སྤྱོད་པས་།
K03psp_4u:5779	 prajñāpāramitāyāṃ carataivam eteṣāṃ dharmāṇāṃ dharmatopanidhyātavyā upaparīkṣitavyāḥ.	K03D0009-3_H0010-3:14b-1	ཆོས་དེ་དག་གི་ཆོས་ཉིད་དེ་ལྟར་ཡོངས་སུ་བརྟག་པར་བྱའོ་༎
K03psp_4u:5781	 evam ukte āyuṣmān subhūtir bhagavantam etad avocat:	K03D0009-3_H0010-3:14b-2	གསོལ་པ་། བཅོམ་ལྡན་འདས་།
K03psp_4u:5782	 duṣkarakārako bhagavan bodhisattvo mahāsattvo ya iha dharmatāyāṃ śikṣate bhūtakoṭyāṃ	K03D0009-3_H0010-3:14b-3	བྱང་ཆུབ་སེམས་དཔའ་སེམས་དཔའ་ཆེན་པོ་གང་ཆོས་ཉིད་འདི་ལ་སློབ་པ་།
K03psp_4u:5783	 śikṣate dharmadhātau śikṣate atyantaśūnyatāyāṃ śikṣate yāvat svalakṣaṇaśūnyatāyāṃ	K03D0009-3_H0010-3:14b-4	ཡང་དག་པའི་མཐའ་ལ་སློབ་པ་། དེ་བཞིན་ཉིད་ལ་སློབ་པ་། ཆོས་ཀྱི་དབྱིངས་ལ་སློབ་པ་།
K03psp_4u:5784	 śikṣate yāvat triṣu vimokṣamukheṣu śikṣate,	K03D0009-3_H0010-3:14b-7	རང་གི་མཚན་ཉིད་སྟོང་པ་ཉིད་ཀྱི་བར་ལ་སློབ་པ་།
K03psp_4u:5792	 ānimittaṃ samādhivimokṣamukham abhinirharaty,  apraṇihitaṃ samādhivimokṣamukham abhinirharaty,  upāyakauśalyasamanvāgataḥ sa bodhisattvo mahāsattvas tasmin samaye veditavyo,	K03D0009-3_H0010-3:15a-0	ནམ་བྱང་ཆུབ་སེམས་དཔའ་སེམས་དཔའ་ཆེན་པོ་ཐབས་མཁས་པ་དང་ལྡན་པར་རྣམ་༄༡༥ཨ་༌༎ པར་ཐར་པའི་སྒོ་སྟོང་པ་ཉིད་ཀྱི་ཏིང་ངེ་འཛིན་མངོན་པར་བསྒྲུབ་པ་དང་། རྣམ་པར་ཐར་པའི་སྒོ་མཚན་མ་མེད་པའི་ཏིང་ངེ་འཛིན་མངོན་པར་བསྒྲུབ་པ་དང་། རྣམ་པར་ཐར་པའི་སྒོ་སྨོན་པ་མེད་པའི་ཏིང་ངེ་འཛིན་མངོན་པར་བསྒྲུབ་པ་དེའི་ཚེ་།
K03psp_4u:5795	 na cāntarā bhūtakoṭiṃ sākṣātkaroti yāvan na sarvākārajñatām anuprāpnoti. ity asādhāraṇopāyaḥ	K03D0009-3_H0010-3:15a-2	ཇི་སྲིད་དུ་རྣམ་པ་ཐམས་ཅད་མཁྱེན་པ་ཉིད་མ་ཐོབ་ཀྱི་བར་དུ་བར་མ་དོར་ཡང་དག་པའི་མཐའ་མངོན་དུ་མི་བྱེད་པར་རིག་པར་བྱའོ་༎
K03psp_4u:5796	 punar aparaṃ subhūte bodhisattvo mahāsattvo yānīmāni gambhīrāṇi sthānāni pratyavekṣitukāmo bhavati,	K03D0009-3_H0010-3:15a-3	རབ་འབྱོར་། གཞན་ཡང་བྱང་ཆུབ་སེམས་དཔའ་སེམས་དཔའ་ཆེན་པོ་གང་གི་ཚེ་འདི་ལྟ་སྟེ་།
K03psp_4u:5797	 tadyathedam adhyātmaśūnyatāṃ bahirdhāśūnyatām adhyātmabahirdhāśūnyatāṃ yāvad abhāvasvabhāvaśūnyatāṃ (PSP_4:197)	K03D0009-3_H0010-3:15a-4	ནང་སྟོང་པ་ཉིད་དང་། ཕྱི་སྟོང་པ་ཉིད་དང་། ཕྱི་ནང་སྟོང་པ་ཉིད་དང་། དངོས་པོ་མེད་པའི་ངོ་བོ་ཉིད་སྟོང་པ་ཉིད་ཀྱི་བར་དང་། དྲན་པ་ཉེ་བར་བཞག་པ་དང་། ཡང་དག་པར་སྤོང་བ་དང་། རྫུ་འཕྲུལ་གྱི་རྐང་པ་དང་།
K03psp_4u:5799	 tenaivaṃ cittotpādo 'bhinirhartavyo,  dīrgharātram ime sattvā ātmasaṃjñāyāṃ sattvasaṃjñāyāṃ jīvasaṃjñāyāṃ jantusaṃjñāyāṃ	K03D0009-3_H0010-3:15a-6	དེས་འདི་ལྟར་འདི་སྙམ་དུ་སེམས་ཅན་འདི་དག་ནི་ཡུན་རིང་པོ་ནས་བདག་ཏུ་འདུ་ཤེས་པ་དང་། སེམས་ཅན་དུ་འདུ་ཤེས་པ་དང་། སྲོག་ཏུ་འདུ་ཤེས་པ་དང་། འགྲོ་བར་འདུ་ཤེས་པ་དང་། གསོ་བར་འདུ་ཤེས་པ་དང༏་སྐྱེས་བུར་འདུ་ཤེས་པ་དང་།
K03psp_4u:5801	 poṣasaṃjñāyāṃ puruṣasaṃjñāyāṃ pudgalasaṃjñāyāṃ manujasaṃjñāyāṃ mānavasaṃjñāyāṃ kārakasaṃjñāyāṃ  vedakasaṃjñāyāṃ jānakasaṃjñāyāṃ paśyakasaṃjñayām upalambhe caranti,	K03D0009-3_H0010-3:15b-0	གང་ཟག་ཏུ་འདུ་ཤེས་པ་དང་། ཤེད་ཅན་དུ་འདུ་ཤེས་པ་དང་། ཤེད་བདག་ཏུ་འདུ་ཤེས་པ་དང་། བྱེད་པ་པོར་འདུ་ཤེས་པ་དང་། ཚོར་བ་༄༡༥བ་པོར་འདུ་ཤེས་པ་དང་། འཇུག་པ་པོར་འདུ་ཤེས་པས་དམིགས་པ་ལ་སྤྱོད་ཀྱི་།
K03psp_4u:5803	 teṣām upalambhadṛṣṭiprahāṇāyānuttarāṃ samyaksaṃbodhim abhisaṃbudhya dharmaṃ deśayiṣyāmi. yasmin samaye bodhisattvo mahāsattvaḥ śūnyatāsamādhivimokṣamukhaṃ	K03D0009-3_H0010-3:15b-1	དེ་དག་གི་དམིགས་པ་སྤང་བའི་ཕྱིར་བླ་ན་མེད་པ་ཡང་དག་པར་རྫོགས་པའི་བྱང་ཆུབ་ཏུ་མངོན་པར་རྫོགས་པར་སངས་རྒྱས་ཏེ་། ཆོས་བསྟན་པར་བྱའོ་༎
K03psp_4u:5804	 ānimittaṃ samādhivimokṣamukhaṃ bhāvayaty apraṇihitaṃ samādhivimokṣamukhaṃ bhāvayati samāpadyate ca na ca bhūtakoṭīṃ sākṣātkaroti,  yayā sākṣātkriyayā srotaāpattiphalaṃ prāpnuyāt,	K03D0009-3_H0010-3:15b-3	སྙམ་དུ་སེམས་མངོན་པར་བསྒྲུབ་པར་བྱའོ་༎ དེའི་ཚེ་བྱང་ཆུབ་སེམས་དཔའ་སེམས་དཔའ་ཆེན་པོ་རྣམ་པར་ཐར་པའི་སྒོ་སྟོང་པ་ཉིད་དང་། མཚན་མ་མེད་པ་དང་། སྨོན་པ་མེད་པའི་ཏིང་ངེ་འཛིན་ལ་སྙོམས་པར་འཇུག་ཀྱང་ཡང་དག་པའི་མཐའ་གང་མངོན་དུ་བྱས་པས་རྒྱུན་དུ་ཞུགས་པའི་འབྲས་བུ་ཐོབ་པ་དང་།
K03psp_4u:5806	 sakṛdāgāmiphalam anāgāmiphalam arhattvaṃ prāpnuyāt,  pratyekāṃ bodhiṃ prāpnuyāt,  tasmin samaye bodhisattvo mahāsattvo na srotaāpattiphalam anuprāpnuyād na sakṛdāgāmiphalan nānāgāmiphalaṃ nārhattvam anuprāpnuyāt,  na pratyekāṃ bodhim anuprāpnuyād,	K03D0009-3_H0010-3:15b-5	ལན་གཅིག་ཕྱིར་འོང་བའི་འབྲས་བུ་དང་། ཕྱིར་མི་འོང་བའི་འབྲས་བུ་དང་། དགྲ་བཅོམ་པ་ཉིད་འཐོབ་པ་དང་། རང་བྱང་ཆུབ་འཐོབ་པར་འགྱུར་བ་མངོན་དུ་མི་བྱེད་དོ་༎
K03psp_4u:5810	 evaṃ caran bodhisattvo mahāsattvo 'nena cittotpādena etaiś ca kuśalamūlaiḥ samanvāgato  nāntarā bhūtakoṭiṃ sākṣātkaroti na ca parihīyate caturbhir apramāṇaiś caturbhir dhyānaiś	K03D0009-3_H0010-3:15b-6	རབ་འབྱོར་། དེ་ལྟར་བྱང་ཆུབ་སེམས་དཔའ་སེམས་དཔའ་ཆེན་པོ་སེམས་བསྐྱེད་པ་དེ་དང་། དགེ་བའི་རྩ་བ་དེ་དག་དང་། ཐབས་མཁས་པ་དང་ལྡན་པ་ནི་བར་མ་དོར་ཡང་དག་པའི་མཐའ་ཡང་མངོན་དུ་མི་བྱེད་དེ་། སྦྱིན་པའི་ཕ་རོལ་ཏུ་ཕྱིན་པའང་ཡོངས་སུ་འགྲིབ་པར་མི་འགྱུར་རོ་༎
K03psp_4u:5814	 mārgeṇa śūnyatānimittāpraṇihitasamādhibhir adhyātmaśūnyatayā yāvad abhāvasvabhāvaśūnyatayā na parihīyate,	K03D0009-3_H0010-3:16a-0	ནང་སྟོང་པ་ཉིད་དང་། དངོས་པོ་མེད་པའི་ངོ་བོ་ཉིད་སྟོང་པ་ཉིད་ཀྱི་བར་ཡང་ཡོངས་སུ་འགྲིབ་༄༡༦ཨ་༌༎ པར་མི་འགྱུར་རོ་༎
K03psp_4u:5819	 dhyānapāramitayā na parihīyate,  prajñāpāramitayā na parihīyate,  āryasatyair na parihīyate,	K03D0009-3_H0010-3:16a-3	འཕགས་པའི་བདེན་པ་དང་། བསམ་གཏན་དང་། ཚད་མེད་པ་དང་། གཟུགས་མེད་པའི་སྙོམས་པར་འཇུག་པའང་ཡོངས་སུ་འགྲིབ་པར་མི་འགྱུར་རོ་༎ རྣམ་པར་ཐར་པ་བརྒྱད་དང་། མཐར་གྱིས་གནས་པའི་སྙོམས་པར་འཇུག་པ་དགུ་དང་། སྟོང་པ་ཉིད་དང་། མཚན་མ་མེད་པ་དང་། སྨོན་པ་མེད་པ་ཡོངས་སུ་འགྲིབ་པར་མི་འགྱུར་རོ་༎
K03psp_4u:5822	 sarvavimokṣasamādhisamāpattidhāraṇīmukhair na parihīyate pañcabhir abhijñābhir daśabhis tathāgatabalaiś caturbhir vaiśāradyaiś catasṛbhiḥ pratisaṃvidbhir na parihīyate,	K03D0009-3_H0010-3:16a-5	མངོན་པར་ཤེས་པ་ལྔ་དང་། ཏིང་ངེ་འཛིན་དང་། གཟུངས་ཀྱི་སྒོ་དང་། དེ་བཞིན་གཤེགས་པའི་སྟོབས་བཅུ་དང་། མི་འཇིགས་པ་བཞི་དང་། སོ་སོ་ཡང་དག་པར་རིག་པ་བཞི་དང་། བྱམས་པ་ཆེན་པོ་དང་། སྙིང་རྗེ་ཆེན་པོ་དང་།
K03psp_4u:5823	 aṣṭādaśabhir āveṇikair buddhadharmair na parihīyate,	K03D0009-3_H0010-3:16a-6	སངས་རྒྱས་ཀྱི་ཆོས་མ་འདྲེས་པ་བཅོ་བརྒྱད་དང་། བླ་ན་མེད་པ་ཡང་དག་པར་རྫོགས་པའི་བྱང་ཆུབ་ཀྱང་ཡོངས་སུ་འགྲིབ་པར་མི་འགྱུར་རོ་༎
K03psp_4u:5825	 sarvabodhipakṣyair dharmaiḥ samanvāgato na ca parihīyate tato yāvad anuttarāṃ samyaksaṃbodhim  abhisaṃbudhyate. upāyakauśalyaparigṛhīto bodhisattvo mahāsattvo (PSP_4:198)	K03D0009-3_H0010-3:16a-8	བྱང་ཆུབ་ཀྱི་ཕྱོགས་ཀྱི་ཆོས་རྣམས་དང་ལྡན་པ་ཡིན་ཏེ་། བླ་ན་མེད་པ་ཡང་དག་པར་རྫོགས་པའི་བྱང་ཆུབ་ཏུ་མངོན་པར་རྫོགས་པར་སངས་རྒྱས་ཀྱི་བར་དུ་ཡོངས་སུ་འགྲིབ་པར་མི་འགྱུར་ཏེ་།
K03psp_4u:5827	 vivardhate śuklair dharmaiḥ,  tīkṣṇatamāni cāsyendriyāṇi bhavanti yathā na śrāvakapratyekabuddhānām. ity aśaktyupāyaḥ	K03D0009-3_H0010-3:16b-0	ཐབས་མཁས་པས་ཡོངས་སུ་བཟུང་བའི་༄༡༦བ་བྱང་ཆུབ་སེམས་དཔའ་སེམས་དཔའ་ཆེན་པོ་དེ་ནི་དགེ་བའི་ཆོས་རྣམས་ཀྱིས་རྣམ་པར་འཕེལ་ཞིང་དེའི་དབང་པོ་རྣམས་ཀྱང་ཆེས་རྣོ་བར་འགྱུར་ཏེ་། ཉན་ཐོས་དང་། རང་སངས་རྒྱས་ཀྱི་ལྟ་བུ་མ་ཡིན་པར་འགྱུར་རོ་༎
K03psp_4u:5829	 punar aparaṃ subhūte bodhisattvasya mahāsattvasya evaṃ bhavati,	K03D0009-3_H0010-3:16b-2	རབ་འབྱོར་། གཞན་ཡང་བྱང་ཆུབ་སེམས་དཔའ་སེམས་དཔའ་ཆེན་པོ་ནི་འདི་སྙམ་སྟེ་།
K03psp_4u:5830	 dīrgharātram ime sattvāś caturbhir viparyāsair viparyastacittā nityasaṃjñāyāṃ sukhasaṃjñāyāṃ śubhasaṃjñāyām ātmasaṃjñāyāñ ca teṣām arthāya bodhaye	K03D0009-3_H0010-3:16b-3	སེམས་ཅན་འདི་དག་ནི་ཡུན་རིང་པོ་ནས་ཕྱིན་ཅི་ལོག་བཞི་ལ་སྤྱོད་སྤྱོད་པ་། རྟག་པར་འདུ་ཤེས་པ་དང་། བདེ་བར་འདུ་ཤེས་པ་དང་། བདག་ཏུ་འདུ་ཤེས་པ་དང་། སྡུག་པར་འདུ་ཤེས་པ་ལ་སྤྱོད་སྤྱོད་པ་ཡིན་གྱི་།
K03psp_4u:5831	 tathā cānuttarāṃ samyaksaṃbodhim abhisaṃbudhya dharmaṃ deśayiṣyāmi,  yathānityam iti duḥkham ity aśubham iti anātmīyam iti vā samudācāro 'pi na bhaviṣyati. so 'nena cittotpādena samanvāgata upāyakauśalyena ca prajñāpāramitāyāṃ carati,	K03D0009-3_H0010-3:16b-5	དེ་དག་གི་ཕྱིར་བྱང་ཆུབ་ཏུ་སྤྱད་པར་བྱའོ་༎ བླ་ན་མེད་པ་ཡང་དག་པར་རྫོགས་པའི་བྱང་ཆུབ་ཏུ་མངོན་པར་རྫོགས་པར་སངས་རྒྱས་ན་། ཅི་ནས་ཀྱང་རྟག་ཅེས་བྱ་བའམ་། བདེ་ཞེས་བྱ་བའམ་། བདག་ཅེས་བྱ་བའམ་། སྡུག་ཅེས་བྱ་བའི་ཡོངས་སུ་རྒྱུ་བ་མེད་པར་ཆོས་བསྟན་པར་བྱའོ་སྙམ་སྟེ་། སེམས་བསྐྱེད་པ་དེ་ལྟ་བུ་དག་དང་ལྡན་ལ་ཐབས་མཁས་པས་ཤེས་རབ་ཀྱི་ཕ་རོལ་ཏུ་ཕྱིན་པ་ལ་སྤྱོད་པས་།
K03psp_4u:5833	 buddhadharmasamādhiṃ samāpadyate 'paripūrṇair daśabhis tathāgatabalaiś caturbhir	K03D0009-3_H0010-3:16b-12	དེ་བཞིན་གཤེགས་པའི་སྟོབས་བཅུ་ཡོངས་སུ་མ་རྫོགས་།
K03psp_4u:5834	 vaiśāradyaiś catasṛbhiḥ pratisaṃvidbhir aṣṭādaśabhir āveṇikair buddhadharmair mahāmaitryā  mahākaruṇayā ca śūnyatānimittāpraṇihitasamādhivimokṣamukhaṃ tasmin samaye bodhisattvo	K03D0009-3_H0010-3:16b-13	མི་འཇིགས་པ་བཞི་དང་། སོ་སོ་ཡང་དག་པར་རིག་པ་བཞི་དང་། སངས་རྒྱས་ཀྱི་ཆོས་མ་འདྲེས་པ་བཅོ་བརྒྱད་དང་། བྱམས་པ་ཆེན་པོ་དང་། སྙིང་རྗེ་ཆེན་པོ་ཡོངས་སུ་མ་རྫོགས་པར་ཡང་དག་པའི་མཐའ་མངོན་དུ་མི་བྱེད་དོ་༎
K03psp_4u:5836	 mahāsattvo bhāvayati samāpadyate ca,  na ca bhūtakoṭiṃ sākṣātkaroti yāvad anuttarāṃ samyaksaṃbodhim abhisaṃbudhyate.	K03D0009-3_H0010-3:17a-0	དེའི་ཚེ་བྱང་ཆུབ་སེམས་དཔའ་སེམས་དཔའ་ཆེན་པོ་རྣམ་པར་ཐར་པའི་སྒོ་སྟོང་པ་ཉིད་དང་། མཚན་མ་མེད་པ་དང་། སྨོན་པ་མེད་པའི་ཏིང་ངེ་འཛིན་ལ་སྙོམས་པར་འཇུག་༄༡༧ཨ་༌༎ ཀྱང༏་བླ་ན་མེད་པ་ཡང་དག་པར་རྫོགས་པའི་བྱང་ཆུབ་ཏུ་མངོན་པར་རྫོགས་པར་སངས་མ་རྒྱས་ཀྱི་བར་དུ་ཡང་དག་པའི་མཐའ་མངོན་དུ་མི་བྱེད་དོ་༎
K03psp_4u:5838	 punar aparaṃ subhūte bodhisattvasya mahāsattvasya evaṃ bhavati,  dīrgharātram ime sattvā upalambhacaratā ātmeti,	K03D0009-3_H0010-3:17a-2	རབ་འབྱོར་། གཞན་ཡང་བྱང་ཆུབ་སེམས་དཔའ་སེམས་དཔའ་ཆེན་པོ་ནི་འདི་སྙམ་དུ་སེམས་ཅན་འདི་དག་ནི་ཡུན་རིང་པོ་ནས་དམིགས་པ་ལ་སྤྱོད་སྤྱོད་པ་སྟེ་། བདག་ཅེས་བྱ་བའམ་།
K03psp_4u:5840	 sattvajīvajantupoṣapuruṣapudgalamanujamānavakārakavedakajānakapaśyakā iti,	K03D0009-3_H0010-3:17a-4	སེམས་ཅན་དང་། སྲོག་དང་། འགྲོ་བ་དང་། གསོ་བ་དང་། སྐྱེས་བུ་དང་། གང་ཟག་དང་། ཤེད་ཅན་དང་། ཤེད་བདག་དང་། བྱེད་པ་པོ་དང་། ཚོར་བ་པོ་དང་། ཤེས་པ་པོ་དང་། མཐོང་པ་པོ་ཞེས་བྱ་བའམ་།
K03psp_4u:5841	 rūpam iti vā vedaneti vā saṃjñeti vā saṃskārā iti vā vijñānam iti vā skandhā iti	K03D0009-3_H0010-3:17a-5	གཟུགས་ཞེས་བྱ་བའམ་། ཚོར་བ་དང་། འདུ་ཤེས་དང་། འདུ་བྱེད་དང་། རྣམ་པར་ཤེས་པ་ཞེས་བྱ་བའམ་།
K03psp_4u:5844	 kariṣyāmi yathā me 'nuttarāṃ samyaksaṃbodhim abhisaṃbuddhasya sattvānām ete upalambhadoṣā na bhaviṣyanti,	K03D0009-3_H0010-3:17b-1	དེ་ལ་བདག་གིས་ཅི་ནས་ཀྱང་བདག་བླ་ན་མེད་པ་ཡང་དག་པར་རྫོགས་པའི་བྱང་ཆུབ་ཏུ་མངོན་པར་རྫོགས་པར་སངས་རྒྱས་ནས་། སེམས་ཅན་རྣམས་ཀྱི་དམིགས་པའི་ཉེས་པ་དེ་དག་མེད་པར་བྱའོ་སྙམ་སྟེ་།
K03psp_4u:5845	 sa imaiś cittotpādaiḥ samanvāgato 'nena copāyakauśalyena prajñāpāramitāyāṃ caran  na bhūtakoṭīṃ sākṣātkaroty apūrṇair daśabhis tathāgatabalaiś caturbhir vaiśāradyaiś  catasṛbhiḥ pratisaṃvidbhir aṣṭādaśabhir āveṇikair buddhadharmair mahāmaitryā mahākaruṇayā	K03D0009-3_H0010-3:17b-3	དེ་སེམས་བསྐྱེད་པ་དེ་ལྟ་བུ་དག་དང་ལྡན་ལ་ཐབས་མཁས་པས་ཤེས་རབ་ཀྱི་ཕ་རོལ་ཏུ་ཕྱིན་པ་ལ་སྤྱོད་པས་དེ་བཞིན་གཤེགས་པའི་སྟོབས་བཅུ་དང་། མི་འཇིགས་པ་བཞི་དང་། སོ་སོ་ཡང་དག་པར་རིག་པ་བཞི་དང་། སངས་རྒྱས་ཀྱི་ཆོས་མ་འདྲེས་པ་བཅོ་བརྒྱད་དང་། བྱམས་པ་ཆེན་པོ་དང་། སྙིང་རྗེ་ཆེན་པོ་ཡོངས་སུ་མ་རྫོགས་པར་ཡང་དག་པའི་མཐའ་མངོན་དུ་མི་བྱེད་དེ་།
K03psp_4u:5848	 ca śūnyatāsamādhivimokṣamukhaṃ tasmin samaye bodhisattvasya mahāsattvasya bhāvanā  paripūriṃ gacchati. ity anupalambhopāyaḥ	K03D0009-3_H0010-3:17b-5	དེའི་ཚེ་བྱང་ཆུབ་སེམས་དཔའ་སེམས་དཔའ་ཆེན་པོ་རྣམ་པར་ཐར་པའི་སྒོ་སྟོང་པ་ཉིད་དང་། མཚན་མ་མེད་པ་དང་། སྨོན་པ་མེད་པའི་ཏིང་ངེ་འཛིན་བསྒོམ་པ་ཡོངས་སུ་རྫོགས་པར་འགྱུར་རོ་༎
K03psp_4u:5850	 punar aparaṃ subhūte bodhisattvasya mahāsattvasya prajñāpāramitāyāṃ carata evaṃ bhavati,	K03D0009-3_H0010-3:17b-6	རབ་འབྱོར་། གཞན་ཡང་བྱང་ཆུབ་སེམས་དཔའ་སེམས་དཔའ་ཆེན་པོ་ཤེས་རབ་ཀྱི་ཕ་རོལ་ཏུ་ཕྱིན་པ་ལ་སྤྱོད་པའི་ཚེ་།
K03psp_4u:5851	 dīrgharātram ime sattvā nimittena caritāḥ strīnimitteṣu vā puruṣanimitteṣu vā rūpanimitteṣu vā ārūpyanimitteṣu (PSP_4:199)	K03D0009-3_H0010-3:17b-7	འདི་སྙམ་དུ་སེམས་ཅན་འདི་དག་ནི་ཡུན་རིང་པོ་ནས་མཚན་མ་ལ་སྤྱོད་སྤྱོད་པ་སྟེ་། བུད་མེད་ཀྱི་མཚན་མའམ་། སྐྱེས་པའི་མཚན་མའམ་། གཟུགས་ཀྱི་མཚན་མའམ་།
