src_segmentnr	src_original	tgt_segmentnr	tgt_original
K05adsp70-u:1112	 śubhatvam apy adhimukto bhavaty ayaṃ tritīyo vimokṣaḥ. (iv)	K02D0008-10_H0009-10:499a-2	བཟང་བར་མོས་པ་འདི་ནི་རྣམ་པར་ཐར་པ་གསུམ་པའོ་༎
K05adsp70-u:1113	 sa sarvaśo rūpasaṃjñānāṃsamatikramāt pratighasaṃjñānām astaṅgamāt nānātvasaṃjñānām	K02D0008-10_H0009-10:499a-3	དེ་རྣམ་པ་ཐམས་ཅད་དུ་གཟུགས་ཀྱི་འདུ་ཤེས་ལས་ཡང་དག་པར་འདས་ཏེ༏་ཐོགས་པའི་འདུ་ཤེས་རྣམས་ནུབ་པར་གྱུར་ཅིང་། སྣ་ཚོགས་ཀྱི་འདུ་ཤེས་རྣམས་ཡིད་ལ་མི་བྱེད་པས་།
K05adsp70-u:1114	 amanasikārād anantam ākāśam ity ākāśānantyāyatanam upasaṃpadya viharaty ayaṃ caturtho vimokṣaḥ. (v)	K02D0008-10_H0009-10:499a-5	ནམ་མཁའ་མཐའ་ཡས་སོ་ཞེས་ཏེ་། ནམ་མཁའ་མཐའ་ཡས་སྐྱེ་མཆེད་ལ་ཉེ་བར་བསྒྲུབས་ཏེ་གནས་པ་འདི་ནི་རྣམ་པར་ཐར་པ་བཞི་པའོ་༎
K05adsp70-u:1115	 sa sarvaśa ākāśānantyāyatanasamatikramād anantaṃ vijñānam iti vijñānānantyāyatanam upasaṃpadya viharaty. ayaṃ pañcamo [f. 280a] vimokṣaḥ. (vi)	K02D0008-10_H0009-10:499a-7	དེ་རྣམ་པ་ཐམས་ཅད་དུ་ནམ་མཁའ་མཐའ་ཡས་སྐྱེ་མཆེད་ལས་ཡང་དག་པར་འདས་ཏེ་། རྣམ་པར་ཤེས་པ་མཐའ་ཡས་སོ་ཞེས་ཏེ་། རྣམ་ཤེས་མཐའ་ཡས་སྐྱེ་མཆེད་ལ་ཉེ་བར་བསྒྲུབས་ཏེ་གནས་པ་འདི་ནི་རྣམ་པར་ཐར་པ་ལྔ་པའོ་༎
K05adsp70-u:1116	 sa sarvaśo vijñānānantyāyatanasamatikramān nāsti kiṃcid ity ākiṃcanyāyatanam upasanipadya viharaty ayaṃ ṣaṣṭo vimokṣaḥ. (vii)	K02D0008-10_H0009-10:499a-10	དེ་རྣམ་པ་ཐམས་ཅད་དུ་རྣམ་ཤེས་མཐའ་ཡས་སྐྱེ་མཆེད་ལས་ཡང་དག་པར་འདས་ཏེ་། ཅུང་ཟད་མ་ཡོད་དོ་ཞེས་ཅུང་ཟད་མེད་པའི་སྐྱེ་མཆེད་ལ་ཉེ་བར་བསྒྲུབས་ཏེ་གནས་པ་འདི་ནི་རྣམ་པར་ཐར་པ་དྲུག་པའོ་༎
K05adsp70-u:1117	 sa sarvaśa ākiṃcanyāyatanasamatikramān naivasaṃjñānāsaṃjñāyatanam upasaṃpadya viharaty ayaṃ saptamo vimokṣaḥ. (viii)	K02D0008-10_H0009-10:499a-12	དེ་རྣམ་པ་ཐམས་ཅད་དུ་ཅུང་ཟད་མེད་པའི་སྐྱེ་མཆེད་ལས་ཡང་དག་པར་འདས་ཏེ་། འདུ་ཤེས་མེད་འདུ་ཤེས་མེད་མིན་སྐྱེ་མཆེད་ལ་ཉེ་བར་བསྒྲུབས་ཏེ་གནས་པ་འདི་ནི་རྣམ་པར་ཐར་པ་བདུན་པའོ་༎
K05adsp70-u:1118	 sa sarvaśo naivasaṃjñānāsaṇijñāyatanasamatikramāt saṃjñāvedayitanirodham (AdSPG II 48)	K02D0008-10_H0009-10:499a-14	དེ་རྣམ་པ་ཐམས་ཅད་དུ་འདུ་ཤེས་མེད་འདུ་ཤེས་མེད་མིན་སྐྱེ་མཆེད་ལས་ཡང་དག་པར་འདས་ཏེ་། འདུ་ཤེས་དང་། ཚོར་བ་འགོག་པ་ལ་ཉེ་བར་བསྒྲུབས་ཏེ་༄༤༩༩བ་གནས་པ་འདི་ནི་རྣམ་པར་ཐར་པ་བརྒྱད་པ་སྟེ་།
K05adsp70-u:1119	 upasaṃpadya viharaty ayam aṣṭamo vimokṣaḥ. ima ucyante 'ṣṭau vimokṣāḥ.	K02D0008-10_H0009-10:499b-1	དེ་ལྟར་ན་རྣམ་པར་ཐར་པ་བརྒྱད་པོ་འདི་དག་ལ་ལུགས་དང་མཐུན་པ་དང་། ལུགས་དང་མི་མཐུན་པར་སྙོམས་པར་འཇུག་ཅིང་རྣམ་པར་ལྡང་ངོ་༎
K05adsp70-u:1120	 (4) katamāni ca navānupūrvasamāpattayaḥ?	K02D0008-10_H0009-10:499b-2	མཐར་གྱིས་གནས་པའི་སྙོམས་པར་འཇུག་པ་དགུ་ལ་ལུགས་དང་མཐུན་པ་དང་། ལུགས་དང་མི་མཐུན་པར་སྙོམས་པར་འཇུག་ཅིང་རྣམ་པར་ལྡང་སྟེ་། དགུ་གང་ཞེ་ན་།
