src_segmentnr	src_original	tgt_segmentnr	tgt_original
K05adsp55-u:1233	 saṃmukhaṃ mayā teṣāṃ tathāgatānām arhatāṃ samyaksaṃbuddhānām antikād iyaṃ (AdSPG I 74)  gaṃbhirā prajñāpāramitā śrutā bhaviṣyaty udgṛhītā ca dhāritā ca vā citā ca paryavāptā ca bhaviṣyati,	T07n0220c_516:0675a13_17	當知彼人是大菩薩，曾於過去親從如來聞說如是甚深般若波羅蜜多，聞已受持、讀誦、通利、精勤修學、如理思惟，亦曾為他宣說、開示、教誡教授甚深般若波羅蜜多故，於今生能辦是事。
K05adsp55-u:1235	 tatra ca tathāgateṣv arhatsu samyaksaṃbuddheṣu kuśalamūlāny avaropitāni bhaviṣyanti. veditavyam ānanda tena kulaputreṇa vā kuladuhitrā vā,  na mayā śrāvakāṇām antike kusalamūlāny avaropitāni,	T07n0220c_516:0675a14_3	慶喜當知！ 是善男子、善女人等，曾於過去無量佛所種諸善根故，於今生能作是事。
K05adsp55-u:1237	 na śrāvakāṇām antikād iyaṃ gaṃbhīrā prajñāpāramitā śrutā. yo hi kaścid ānanda kulaputro vā kuladuhitā vā imāṃ gaṃbhīrāṃ prajñāpāramitāṃ udgrahīṣyati dhārayiṣyati vācayiṣyati,	T07n0220c_516:0675a16_10	此善男子、善女人等應作是念： 『我先不從聲聞、獨覺聞說如是甚深般若波羅蜜多，定從諸佛聞說如是甚深般若波羅蜜多。
K05adsp55-u:1239	 arthataś ca dharmataś ca vyañjanataś ca anugamiṣyati,  niṣṭhā ānanda tena kulaputreṇa vā kuladuhitrā vā gantavyā,  saṃmukhībhūto me tathāgato 'rhan samyaksaṃbuddhaḥ. yo hi kaścid ānanda kulaputro  vā kuladuhitā vā imāṃ gaṃbhīrāṃ prajñāpāramitāṃ bhāṣyamāṇāṃ śrutvā na pratikrokṣyanti	T07n0220c_516:0675a27_7	若善男子、善女人等，愛樂聽聞甚深般若波羅蜜多，聞已受持、讀誦、通利、精勤修學、如理思惟，若法、若義、若文、若意皆善通達隨順修行，是善男子、善女人等則為現見我等如來、應、正等覺。 「慶喜當知！
K05adsp55-u:1343	 mahāsattvaḥ ṣaṭsu pāramitāsu caraṃś caturṣu smṛtyupasthāneṣu,	T07n0220c_516:0676c17_14	是菩薩摩訶薩自修六種波羅蜜多，亦教他修六種波羅蜜多，廣說乃至自修一切智智，亦教他修一切智智。
K05adsp55-u:1341	 ātmanā ca anuttarāṃ samyaksaṃbodhim abhisaṃboddhukāmaḥ paraṃ ca anuttarasyāṃ samyaksaṃbodhau	T07n0220c_516:0676c15_1	是菩薩摩訶薩自求無上正等菩提，亦以大乘相應之法示現教導讚勵慶喜他諸有情令於無上正等菩提得不退轉。
K05adsp55-u:1344	 yāvan mārgākārajñatāyāṃ caraṃ kuśalamulair vivardhamānaḥ asthānam ānanda anavakāśo yad anuttarasyāḥ samyaksaṃbodheḥ parihīyeta nedaṃ sthānaṃ	T07n0220c_516:0676c19_3	由是因緣，善根增長，若於無上正等菩提有退轉者，無有是處。
K05adsp55-u:1345	 asyāṃ khalu punaḥ prajñāpāramitāyāṃ bhāṣyamāṇāyāṃ bhagavāṃś catasṛṇāṃ parṣadāṃ devanāgayakṣagandharvāsuragaruḍakinnaramahoragāṇāṃ  tathā sthitānām eva puratas tathārūpam ṛddhyabhisaṃskāram abhisaṃskṛtavān yathārūpeṇarddhyabhisaṃskāreṇa  abhisaṃskṛtena sarve te akṣobhyaṃ tathāgatam arhantaṃ samyaksaṃbuddhaṃ paśyanti bhikṣusaṃghaparivṛtaṃ  bhikṣusaṃghapuraskṛtaṃ dharman deśayantaṃ sāgaropamayā parṣadā akṣobhyayā,  sarvair arhadbhiḥ kṣīṇāsravair niṣkleśair vaśībhūtaiḥ suvimuktacittaiḥ suvimuktaprajñair	T07n0220c_516:0676c28_12	」爾時，世尊四眾圍繞，讚說般若波羅蜜多付阿難陀令受持已，復於一切天、龍、藥叉、健達縛等大眾會前現神通力，令眾皆見不動如來、應、正等覺，聲聞、菩薩、大眾圍繞，為海喻會宣說妙法，及見彼土嚴淨之相，其聲聞僧皆阿羅漢，諸漏已盡無復煩惱得真自在，心善解脫、慧善解脫，如調慧馬亦如大龍，已作所作已辦所辦，棄諸重擔逮得己利，盡諸有結正知解脫，至心自在第一究竟。
K05adsp55-u:1352	 bodhisattvaiś ca mahāsattvaiḥ sāgaropamabuddhibhiḥ. atha bhagavān punar eva tam ṛddhyabhisaṃskāraṃ  pratisaṃhṛtavān pratisaṃhṛte ca tasmin ṛddhyabhisaṃskāre tāś catasraḥ parṣado na  bhūyaḥ paśyanti tam akṣobhyaṃ tathāgatam arhantaṃ samyaksaṃbuddhaṃ,	T07n0220c_516:0677a03_16	佛攝神力，令此眾會天、龍、藥叉、健達縛等，不復見彼不動如來、應、正等覺、聲聞、菩薩及餘大眾并彼佛土嚴淨之相。
K05adsp55-u:1355	 śrāvakān vā bodhisattvayānikān vā pudgalaṃs, tac ca (AdSPG I 81)  buddhakṣetram akṣobhyasya tathāgatasya arhataḥ samyaksaṃbuddhasya na bhūyaḥ paśyanti,  na bhūyo buddhapramukho bhikṣusaṃghaś cakṣuṣa ābhāsam āgacchati. tat kasya hetoḥ?	T07n0220c_516:0677a04_14	彼佛眾會及嚴淨土皆非此土眼根所對。 所以者何？
K05adsp55-u:1358	 pratisaṃhṛto hi tathāgatena arhatā samyaksaṃbuddhena sa ṛddhyabhisaṃskāras. tena tena bhūyaḥ paśyanti. atha bhagavān āyuṣmantam ānandam āmantrayata:	T07n0220c_516:0677a05_15	佛攝神力，於彼遠境無見緣故。 爾時，佛告阿難陀言：
K05adsp55-u:1359	 paśyasi tvam ānanda tad akṣobhyasya tathāgatasya buddhakṣetraṃ taṃ ca akṣobhyam tathāgataṃ taṃ ca bhikṣusaṃghaṃ bodhisattvasaṃghaṃ ca?  āha: cakṣuṣo 'pi bhagavaṃs tad buddhakṣetraṃ nābhāsam āgacchati. nāpi sa tathāgato nāpi sa bhikṣusaṃgho nāpi sa bodhisattvasaṃghaḥ. bhagavān	T07n0220c_516:0677a07_3	「不動如來、應、正等覺國土眾會，汝更見不？
K05adsp55-u:1861	 saṃjñāvedayitanirodham upasaṃpadya viharati. iha nava anupūrvasamāpattīr anulomapratilomaṃ  samāpadyate ca vyutthiṣṭhate ca. sa eṣām aṣṭānāṃ vimokṣāṇām āsāṃ ca navānām anupūrvasamāpattīnāṃ  vibhaṅgaṃ kṛtvā imaṃ siṃhavijṛṃbhitaṃ samādhiṃ samāpadyate. katamaś ca subhūte bodhisattvasya	T07n0220c_516:0683b01_15	是菩薩摩訶薩復於九次第定若逆若順自在入出，謂四靜慮、四無量、四無色定、滅想受定。 是菩薩摩訶薩於八解脫、九次第定順逆入出善成熟已，能入菩薩摩訶薩師子頻申三摩地。
K05adsp55-u:1864	 mahāsattvasya (AdSPG I 109)  siṃhavijṛṃbhitaḥ samādhiḥ?	T07n0220c_516:0683b04_13	云何名為菩薩摩訶薩師子頻申三摩地？
K05adsp55-u:1866	 iha subhūte bodhisattvo mahāsattvo viviktam eva kāmair viviktaṃ pāpakair akuśalair  dharmaiḥ savitarkaṃ savicāraṃ vivekajaṃ prītisukhaṃ prathamaṃ dhyānam upasaṃpadya  viharati. yāvan naivasaṃjñānāsaṃjñāyatanād vyutthāya nirodhaṃ samāpadyate. nirodhasamāpatter  vyutthāya naivasaṃjñānāsaṃjñāyatanaṃ samāpadyate. naivasaṃjñānāsaṃjñāyatanād vyutthāya	T07n0220c_516:0683b09_8	謂菩薩摩訶薩離欲惡不善法，有尋有伺，離生喜樂，入初靜慮，次第乃至超一切非想非非想處入滅想受定，復從滅想受定起還入非想非非想處定，次第乃至入初靜慮，是為菩薩摩訶薩師子頻申三摩地。
K05adsp55-u:1872	 iha subhūte bodhisattvo mahāsattvo viviktam eva kāmair viviktaṃ pāpakair akuśalair  dharmai savitarkaṃ savicāraṃ vivekajaṃ prītisukhaṃ prathamadhyānam upasaṃpadya viharati.  prathamadhyānād vyutthāya yāvan naivasaṃjñānāsaṃjñāyatanam upasaṃpadya viharati.  naivasaṃjñānāsaṃjñāyatanād vyutthāya nirodhasamāpattiṃ samāpadyate. nirodhasamāpatter  vyutthāya dvitīyaṃ dhyānam upasaṃpadya viharati. dvitīyād dhyānād vyutthāya nirodhasamāpattiṃ	T07n0220c_516:0683c09_6	謂菩薩摩訶薩離欲惡不善法，有尋有伺，離生喜樂，入初靜慮，從初靜慮起次第乃至入滅想受定，從滅想受定起入初靜慮，從初靜慮起入滅想受定，從滅想受定起入第二靜慮，從第二靜慮起入滅想受定，從滅想受定起入第三靜慮，從第三靜慮起入滅想受定，從滅想受定起入第四靜慮，從第四靜慮起入滅想受定，從滅想受定起入空無邊處定，從空無邊處定起入滅想受定，從滅想受定起入識無邊處定，從識無邊處定起入滅想受定，從滅想受定起入無所有處定，從無所有處定起入滅想受定，從滅想受定起入非想非非想處定，從非想非非想處定起入滅想受定，從滅想受定起復入非想非非想處定，從非想非非想處定起住不定心，從不定心還入滅想受定，從滅想受定起住不定心，從不定心入非想非非想處定，從非想非非想處定起住不定心，從不定心入無所有處定，從無所有處定起住不定心，從不定心入識無邊處定，從識無邊處定起住不定心，從不定心入空無邊處定，從空無邊處定起住不定心，從不定心入第四靜慮，從第四靜慮起住不定心，從不定心入第三靜慮，從第三靜慮起住不定心，從不定心入第二靜慮，從第二靜慮起住不定心，從不定心入初靜慮，從初靜慮起住不定心，是為菩薩摩訶薩集散三摩地。
K05adsp55-u:1870	 prathamadhyānaṃ samāpadyate. sa imaṃ siṃhavijṛṃbhitaṃ samādhiṃ vipākīkṛtya viṣkandakasamādhiṃ  samāpadyate. katamaś ca subhūte bodhisattvasya mahāsattvasya viṣkandakasamādhi?	T07n0220c_516:0683b11_4	「是菩薩摩訶薩於師子頻申三摩地善成熟已，復入菩薩摩訶薩集散三摩地。 云何名為菩薩摩訶薩集散三摩地？
K05adsp55-u:1899	 anuprāpnoti. evaṃ khalu subhūte bodhisattvo mahāsattvaḥ prajñāpāramitāyāṃ sthito  dhyānapāramitāṃ parigṛhṇāti. ((6))	T07n0220c_516:0683c15_13	是為菩薩摩訶薩安住般若波羅蜜多引攝靜慮波羅蜜多。
K05adsp55-u:1904	 kiyac ciraṃ saṃprasthito vatāyaṃ bhagavan bodhisattvo mahāsattvaḥ yo 'nenopāyakauśalena samanvāgataḥ?	T07n0220c_516:0683c26_2	諸菩薩摩訶薩成就如是方便善巧，發趣無上正等覺心已經幾時？
K05adsp55-u:1905	 bhagavān āha:	T07n0220c_516:0683c26_8	」佛告善現：
K05adsp55-u:1906	 asaṃkhyeyakalpakoṭīniyutasaṃprasthito 'yaṃ subhūte bodhisattvo mahāsattvaḥ yo 'nenopāyakauśalena samanvāgataḥ. āha:	T07n0220c_516:0683c27_16	「是菩薩摩訶薩發趣無上正等覺心，已經無數百千俱胝那庾多劫。 」具壽善現復白佛言：
K05adsp55-u:1907	 kiyanto buddhān bhagavantaḥ paryupāsito 'yaṃ bhagavaṃ bodhisattvo mahāsattvo yo 'nenopāyakauśalena samanvāgataḥ?	T07n0220c_516:0683c29_12	「諸菩薩摩訶薩成就如是方便善巧，已曾親近供養幾佛？
K05adsp55-u:1908	 bhagavān āha:	T07n0220c_516:0683c29_18	」佛告善現：
K05adsp55-u:1909	 gaṅgānadīvālukopamān buddhān bhagavantaḥ paryupāsito sa bodhisattvo mahāsattvo veditavyaḥ yo 'nenopāyakauśalena samanvāgataḥ. āha:	T07n0220c_516:0684a01_16	「是菩薩摩訶薩已曾親近供養殑伽沙數諸佛。 」具壽善現復白佛言：
K05adsp55-u:1910	 kin tena bhagavan bodhisattvena mahāsattvena kuśalamūlam avaropitama yo 'nenopāyakauśalena samanvāgataḥ?	T07n0220c_516:0684a03_13	「諸菩薩摩訶薩成就如是方便善巧，已種何等微妙善根？
K05adsp55-u:1911	 bhagavān āha:	T07n0220c_516:0684a03_19	」佛告善現：
K05adsp55-u:1912	 prathamacittotpādam upādāya subhūte na sā kācid dānapāramitā yā tena bodhisattvena  mahāsattvena na paripūritā yo 'nenopāyakauśalena samanvāgataḥ. na sā kācic chīlapāramitā  kṣāntipāramitā vīryapāramitā dhyānapāramitā prajñāpāramitā yā tena bodhisattvena	T07n0220c_516:0684a06_17	「是菩薩摩訶薩發心已來，無有布施波羅蜜多乃至般若波羅蜜多所引善根而不精勤修學圓滿，由此因緣，成就如是方便善巧。
K05adsp55-u:1942	 balakāyasya cakraratnam agrato gacchati,  tiṣṭhati ca. yatra rājā cakravarty annahetos tiṣṭhati,  tatra rājñaś cakravartino balakāyān saṃtarpayati,  na ca tac cakraratnaṃ sthānataś calati,	T07n0220c_516:0684b19_11	如轉輪王欲有所趣，四軍導從輪寶居先，王及四軍念欲飲食輪即為住，既飲食已，王念欲行，輪即前去，其輪去住隨王意欲，至所趣方不復前去。
K05adsp55-u:1916	 āścaryam etad bhagavan bodhisattvānāṃ mahāsattvānāṃ ye 'nenopāyakauśalena samanvāgatāḥ. bhagavān āha:	T07n0220c_516:0684a07_6	」具壽善現復白佛言： 「諸菩薩摩訶薩成就如是方便善巧，甚為希有！ 」佛告善現：
K05adsp55-u:1946	 evam eva subhūte āsāṃ pañcānāṃ pāramitānāṃ prajñāpāramitā pariṇāyikā,  yena sarvākārajñatā tena anugacchanti,	T07n0220c_516:0684b22_12	布施等五波羅蜜多亦復如是，與諸善法欲趣無上正等菩提，要因般若波羅蜜多以為前導，進止俱隨不相捨離，若至佛果更不前進。
K05adsp55-u:1949	 tatra sthitvā tataḥ sthānato nātikrāmanti,  tadyathāpi nāma subhūte rājñaś cakravartinaś tac cakraratnaṃ tac ca pariṇāyakaratnaṃ  tac ca gṛhapatiratnaṃ tac ca strīratnaṃ tac ca maṇiratnaṃ tac ca hastiratnaṃ tac  ca aśvaratnaṃ caturaṅgasya balakāyasya agrato gacchaty,	T07n0220c_516:0684b25_1	如轉輪王七寶具足，欲有所至，四軍七寶前後導從，爾時輪寶雖最居先，而不分別前後之相。
K05adsp55-u:1953	 evam eva subhūte āsāṃ pañcānāṃ pāramitānāṃ prajñāpāramitā agrato gacchaty,	T07n0220c_516:0684b27_11	如是前五波羅蜜多與諸善法欲趣無上正等菩提，定以般若波羅蜜多為其前導，然此般若波羅蜜多不作是念：
K05adsp55-u:1955	 na ca prajñāpāramitāyā evaṃ bhavati:	T07n0220c_516:0684b29_6	』布施等五波羅蜜多，不作是念：
K05adsp55-u:1956	 dānapāramitā mama [f. 243b] anugacchet. evaṃ śīlapāramitā kṣāntipāramitā vīryapāramitā dhyānapāramitā anugacchet. na dānapāramitāyā evaṃ bhavaty:  ahaṃ prajñāpāramitām anugaccheyaṃ. evaṃ na śīlapāramitāyā na kṣāntipāramitāyā na vīryaparamitāyā na dhyānapāramitāyā (AdSPG I 114)  ahaṃ prajñāpāramitām anugaccheyaṃ. tat kasya hetoḥ?	T07n0220c_516:0684c01_4	『甚深般若波羅蜜多居我等前，我隨從彼。 』所以者何？ 如是六種波羅蜜多及一切法，自性皆鈍無所能為，無有主宰虛假不實，空無所有不自在相。
K05adsp55-u:1960	 svabhāvo hy āsām eṣaḥ akiṃcitsamarthaḥ svabhāvaśūnyā tucchā marīcisamā. athāyuṣmān subhūtir bhagavantam etad avocat:	T07n0220c_516:0684c04_18	譬如陽焰、光影、水月、幻事、夢等，其中都無分別作用真實體相。 」具壽善現復白佛言：
K05adsp55-u:1961	 yadi bhagavaṃ sarvadharmā svabhāvaśūnyās,  tat kathaṃ bhagavaṃ bodhisattvo mahāsattvo dānapāramitāyāṃ carañc chīlapāramitāyaṃ  kṣāntipāramitāyāṃ vīryapāramitāyāṃ dhyānapāramitāyāṃ prajñāpāramitāyāṃ carann anuttarāṃ  samyaksaṃbodhim abhisaṃbudhyate?	T07n0220c_516:0684c07_16	「若一切法自性皆空，都無真實體相作用，諸菩薩摩訶薩云何修學布施等六波羅蜜多，能證無上正等菩提？
K05adsp55-u:1459	 vyavalokitavyā abhinirhartavyā. evaṃ khalu subhūte bodhisattvo mahāsattvaḥ pratītyasamutpādaṃ  vyavalokayan na kaṃcid dharmaṃ paśyaty ahetukam utpadyamānam na kaṃcid dharmaṃ nityaṃ  samanupaśyati na nirudhyamānaṃ. na kaṃcid dharmam ātmataḥ samanupaśyati. na sattvato  na jīvato na jaṃtuto na manujato na mānavato na poṣato na pudgalato na kārakato na  kārāpakato na utthāpakato na samutthāpakato na vedakato na vedayitrīkato na jānakato na paśyakataḥ,	T07n0220c_444:0316a15_12	諸菩薩摩訶薩如是觀察緣起法時，不見有法無因而生，不見有法無因而滅，不見有法性相常住、不生不滅，不見有法有我、有情廣說乃至知者、見者，不見有法若常若無常、若樂若苦、若我若無我、若淨若不淨、若寂靜若不寂靜、若遠離若不遠離。
K05adsp55-u:1965	 bhagavān āha:	T07n0220c_516:0684c08_2	」佛告善現：
K05adsp55-u:1966	 iha subhūte bodisattvasya mahāsattvasya ṣaṭpāramitāsu carataḥ evaṃ bhavati:	T07n0220c_516:0684c09_8	「諸菩薩摩訶薩於此六種波羅蜜多勤修學時，常作是念：
K05adsp55-u:1967	 viparyastacitto vatāyaṃ lokasanniveśaḥ. sa na śakyam anupāyakauśalena saṃsārāt parimocayituṃ.  ahaṃ teṣāṃ sattvānām arthāya dānapāramitāyāṃ cariṣyāmi. śīlapāramitāyāṃ cariṣyāmi	T07n0220c_516:0684c11_5	『世間有情心恒顛倒，沒生死苦，不能自脫，我若不修巧便勝行，不能拔濟彼生死苦；
K05adsp55-u:1970	 prajñāpāramitāyāṃ cariṣyāmi. sa teṣāṃ sattvānām arthāya ādhyatmikabahyāni vastūni parityajati,  tasyaivaṃ parityajata evaṃ bhavati:	T07n0220c_516:0684c15_3	』「是菩薩摩訶薩作此念已，為諸有情捨內外物，捨已復作如是思惟：
K05adsp55-u:1972	 na me kiṃcit parityaktaṃ.	T07n0220c_516:0684c15_13	『我於此物都無所捨。
K05adsp55-u:1973	 tat kasya hetos?	T07n0220c_516:0684c15_18	所以者何？
K05adsp55-u:1974	 tathā hy etad vastu svabhāvaśūnyaṃ. evaṃ khalu subhūte bodhisattvo mahāsattva upaparīkṣamāṇo	T07n0220c_516:0684c16_16	此內外物自性皆空不可捨施，非唯屬我。 』是菩薩摩訶薩由此觀察，修行布施波羅蜜多速得圓滿，疾證無上正等菩提。
K05adsp55-u:1975	 dānapāramitāṃ paripūrayati. teṣām eva sattvānām arthāya dauḥśīlasya avakāśaṃ na dadāti. tat kasya hetoḥ?	T07n0220c_516:0684c19_8	「是菩薩摩訶薩為諸有情終不犯戒。 所以者何？
K05adsp55-u:1977	 naitad me pratirūpaṃ syād yad aham anuttarasyāṃ samyaksaṃbodhaye saṃprasthitaḥ prāṇātipātaṃ  kuryāṃ yāvan mithyādṛṣṭiko bhaveyaṃ viṣayān vā prārthayeyaṃ. devatvaṃ vā brahmatvaṃ  vā śrāvakabhūmiṃ vā pratyekabuddhabhūmiṃ vā prārthayeyaṃ. evaṃ khalu subhūte bodhisattvo (AdSPG I 115)	T07n0220c_516:0684c23_1	『我為有情求趣無上正等菩提，決定不應斷眾生命乃至邪見，亦定不應求妙欲境及諸天樂，亦定不應求二乘地唯自解脫。
K05adsp55-u:1980	 mahāsattvaḥ upaparīkṣamāṇaḥ śīlapāramitāyāṃ carati. teṣām eva sattvānām arthāya satatam	T07n0220c_516:0684c24_15	』是菩薩摩訶薩由此觀察，修行淨戒波羅蜜多速得圓滿，疾證無上正等菩提。
K05adsp55-u:1981	 ākruśyamānaḥ paribhāṣyamāṇaḥ kaṭukaiḥ karkaśair vacanair na kṣobhacittam utpādayati.  nāpi loṣṭadaṇḍaśastrapāṣāṇaprahārais tāḍyamāno nāpi śārirā vayaveṣu bhidyamāneṣu  nāpy aṅgapratyaṅgāvayaveṣu cchidyamāneṣu duṣṭacittam utpādayati. tat kasya hetoḥ?	T07n0220c_516:0684c27_1	「是菩薩摩訶薩為諸有情不起忿恚，假使恒遭毀謗、凌辱、分解肢節、受諸苦惱，亦不發起一念惡心。
K05adsp55-u:1984	 tathā hi sa sarvaśaṃ tāṃ pratiśrutkropamān upaparīkṣate. rūpaṃ phenapiṇḍopamaṃ yāvat  vijñānaṃ māyopamam upaparīkṣate. [f. 244a] evaṃ khalu subhūte bodhisattvo mahāsattva	T07n0220c_516:0684c27_6	所以者何？ 是菩薩摩訶薩觀察一切聲如谷響、色如聚沫，不應於中妄生瞋恨。
K05adsp55-u:1986	 upaparīkṣamāṇaḥ kṣāntipāramitāyāṃ carati,	T07n0220c_516:0685a01_11	是菩薩摩訶薩由此觀察，修行安忍波羅蜜多速得圓滿，疾證無上正等菩提。
K05adsp55-u:1987	 teṣām eva sattvānām arthāya na kausīdyacittam utpādayati. sarvakuśalaparyeṣṭyāṃ yāvan na anuttarāṃ samyaksaṃbodhim abhisaṃbuddho bhavati. tat kasya hetoḥ?	T07n0220c_516:0685a03_6	「是菩薩摩訶薩為諸有情，勤求善法乃至無上正等菩提，於其中間常不懈怠。 所以者何？
K05adsp55-u:1989	 na kusīdena śakyaṃ sattvānām arthaḥ kartum anuttarāṃ vā samyaksaṃbodhim abhisaṃboddhuṃ.	T07n0220c_516:0685a05_15	『我若懈怠，不能濟拔一切有情令其遠離生死大苦，亦不能得一切智智。
K05adsp55-u:1990	 evaṃ khalu subhūte bodhisattvo mahāsattva upaparīkṣamāṇaḥ vīryapāramitāyāṃ carati.	T07n0220c_516:0685a07_11	』是菩薩摩訶薩由此觀察，修行精進波羅蜜多速得圓滿，疾證無上正等菩提。
K05adsp55-u:1991	 teṣām eva sattvānām arthāya na vikṣiptacitto bhavati yāvan na anuttarāṃ samyaksaṃbodhim	T07n0220c_516:0685a09_11	「是菩薩摩訶薩為諸有情，勤修勝定乃至無上正等菩提，終不發起貪、瞋、癡等散動之心。 所以者何？ 是菩薩摩訶薩常作此念： 『我若發起貪、瞋、癡等散動之心，則不能成饒益他事，亦不能證所求佛果。
K05adsp55-u:1992	 abhisaṃbuddho bhavati. evaṃ khalu subhūte bodhisattvo mahāsattvaḥ upaparīkṣamāṇo	T07n0220c_516:0685a13_14	』是菩薩摩訶薩由此觀察，修行靜慮波羅蜜多速得圓滿，疾證無上正等菩提。
K05adsp55-u:1993	 dhyānapāramitāyāṃ carati. teṣām eva sattvānām arthāya na jātu prajñāvirahito bhavati. tat kasya hetoḥ?	T07n0220c_516:0685a15_13	「是菩薩摩訶薩為諸有情，不離般若波羅蜜多，乃至無上正等菩提，常勤修學微妙勝慧。 所以者何？ 是菩薩摩訶薩常作此念：
K05adsp55-u:1994	 nāpy anyathā śakyaṃ sattvān paripācayitum anyatra prajñāpāramitāpraveśāt,	T07n0220c_516:0685a17_17	『若離般若波羅蜜多，於諸有情不能成熟，亦不能證無上菩提。
K05adsp55-u:1997	 yadi bhagavan pāramitānāṃ nāsti nānātvaṃ,  kutaḥ iyaṃ prajñāpāramitā pañcānāṃ pāramitānām agryā ākhyāyate jyeṣṭhā śreṣṭhā varā pravarā praṇītā anuttarā niruttarā asamasamā ākhyāyate. bhagavān āha:	T07n0220c_516:0685a26_3	「若此六種波羅蜜多無差別性，皆是般若波羅蜜多所攝受故，云何可說般若波羅蜜多於五波羅蜜多，為最為勝、為尊為高、為妙為微妙、為上為無上？ 」佛告善現：
K05adsp55-u:1995	 tasmāt mayaikam api dauṣprajñasahagataṃ (AdSPG I 116)  cittaṃ notpādayitavyam iti. evaṃ khalu subhūte bodhisattvo mahāsattvaḥ sattvānām evārthāya prajñāpāramitāyāṃ carati. āha:	T07n0220c_516:0685a19_13	』是菩薩摩訶薩由此觀察，修行般若波羅蜜多速得圓滿，疾證無上正等菩提。 由此因緣，雖一切法自性皆空，都無真實體相作用，而諸菩薩摩訶薩眾，勤修六種波羅蜜多，證得無上正等菩提。 」具壽善現復白佛言：
K05adsp55-u:1999	 evam etat subhūte evam etat,	T07n0220c_516:0685a26_13	「如是！ 如是！ 如汝所說。
K05adsp55-u:2000	 na subhūte pāramitānāṃ kiṃcin nānātvāṃ. yadi punaḥ prajñāpāramitā na bhaven nemāḥ paṃcapāramitāḥ pāramitānāmadheyaṃ labheran,	T07n0220c_516:0685a28_5	布施等六波羅蜜多無差別性，皆是般若波羅蜜多所攝受故。 若無般若波羅蜜多，布施等五不得名為波羅蜜多； 要依般若波羅蜜多，布施等五乃得名為波羅蜜多。 「善現當知！
K05adsp55-u:2001	 prajñāpāramitāṃ punar āgamya imāḥ paṃcapāramitāḥ pāramitānāmadheyaṃ labhante. tadyathāpi nāma subhūte nānāprakārā ātmabhāvāḥ sumeruṃ parvatarājam upasaṃkrāntā ekavarṇā bhavanti,  evam eva subhūte prajñāpāramitām āgamyemāḥ paṃcapāramitāḥ pāramitānāmadheyaṃ labhante tāḥ sarvākārajñatām anupraviṣṭā ekavarṇā bhavanti. yaduta  na viśeṣaḥ kaścit prajñāyate iyan dānapāramitā iyaṃ śīlapāramitā iyaṃ kṣāntipāramitā iyaṃ vīryapāramitā iyaṃ dhyānapāramitā iyaṃ prajñāpāramitā. tat kasya hetos?	T07n0220c_516:0685b03_5	如有情類，雖有種種身色差別，若往親近妙高山王咸同一色。 如是前五波羅蜜多，雖有種種品類差別，而為般若波羅蜜多所攝受故，皆由般若波羅蜜多修成滿故，皆入般若波羅蜜多，不可施設差別名姓。 又前五種波羅蜜多，依止般若波羅蜜多，方能證得一切智智，乃得名為到彼岸者，是故六種波羅蜜多，皆同一味，性無差別，不可施設此是布施乃至般若波羅蜜多。
K05adsp55-u:2005	 anena kāraṇena viśeso na prajñāyate. āha:  yadi bhagavaṃ nārthaprāptau kasyacid dharmasya viśeṣo vā nānākaraṇaṃ vā prajñāyate,	T07n0220c_516:0685b12_19	如是六種波羅蜜多，皆能證得一切智智，能到彼岸，性無差別，由是因緣，布施等六不可施設名姓有異。 」具壽善現復白佛言：
K05adsp55-u:2007	 kuta iyaṃ prajñāpāramitā āsāṃ paṃcānāṃ pāramitānām agryākhyāyate. jyeṣṭhākhyāyate  śreṣṭhākhyāyate varā pravarā praṇītā ākhyāyate. anuttarā niruttarā asamasamā ākhyāyate. bhagavān āha:	T07n0220c_516:0685b16_13	「波羅蜜多及一切法，若隨實義皆無此彼勝劣差別，何緣故說般若波羅蜜多於五波羅蜜多，為最為勝、為尊為高、為妙為微妙、為上為無上？
K05adsp55-u:2009	 evam etat subhūte evam etat. nārthaprāptau kasyacid dharmasya viśeṣo vā nānākaraṇaṃ vā prajñāyate,  api tu khalu lokavyavahārasaṃketam upādāya dānapāramitā prajñāyate śīlapāramitā (AdSPG I 117)	T07n0220c_516:0685b16_19	」佛告善現： 「如是！ 如汝所說。 若隨實義，波羅蜜多及一切法，皆無此彼勝劣差別，但依世俗言說作用，說有此彼勝劣差別。
