src_segmentnr	src_original	tgt_segmentnr	tgt_original
K05adsp55-u:3060	 na hi subhūte bodhisattvasya mahāsattvasya dvayacāriṇī buddhiḥ. na hi subhūte bodhisattvo mahāsattvo dvayena dānapāramitāyāṃ carati. na dvayena śīlapāramitāyāṃ carati,  na dvayena vīryapāramitāyāṃ carati. na dvayena samādhipāramitāyāṃ carati. na dvayena  prajñāpāramitāyāṃ carati. evaṃ subhūte bodhisattvo mahāsattvaḥ dānapāramitāṃ parigṛhṇāti	T07n0220c_516:0700b16_14	「諸菩薩摩訶薩行深般若波羅蜜多，不以二故攝受布施乃至般若波羅蜜多，廣說乃至不以二故漸次證得一切智智。
K05adsp55-u:3065	 yadi bhagavaṃ na dvayena [f. 258a] dānapāramitāyāṃ carati,  na dvayena śīlapāramitāyāṃ kṣāntipāramitāyāṃ vīryapāramitāyāṃ dhyānapāramitāyāṃ prajñāpāramitāyāṃ carati,	T07n0220c_516:0700b19_18	「若菩薩摩訶薩行深般若波羅蜜多，不以二故攝受布施乃至般若波羅蜜多，廣說乃至不以二故漸次證得一切智智。
K05adsp55-u:3067	 tat katham idānīṃ bodhisattvo mahāsattvaḥ kuśalamūlair vivardhamānai prathamacittotpādam upādāya. yāvat paścimakaś cittotpādaḥ kuśalamūlair	T07n0220c_516:0700b21_6	云何菩薩摩訶薩從初發心乃至後心，恒時增長殊勝善法？
K05adsp55-u:3068	 bhagavān āha:	T07n0220c_516:0700b21_12	」佛告善現：
K05adsp55-u:3069	 ye subhūte dvayena caranti,  na te vivardhante kuśalamūlaiḥ. tat kasya hetoḥ?	T07n0220c_516:0700b22_12	「若菩薩摩訶薩以二故行，則諸善法不得增長。 所以者何？
K05adsp55-u:3071	 dvayaniśritā hi subhūte sarvabālapṛthagjanās,	T07n0220c_516:0700b23_15	愚夫異生皆依二故，所起善法不得增長。
K05adsp55-u:3072	 te na vivardhaṃte kuśalamūlaiḥ. bodhisattvo mahāsattvaḥ punar advayena carati,  sa prathamacittotpādam upādāya kuśalamūlair vivardhate. yāvat paścimakaś cittotpāda kuśalamūlair vivardhate. tena (AdSPG I 171)	T07n0220c_516:0700b25_6	諸菩薩摩訶薩不行二故，從初發心乃至後心，恒時增長殊勝善法。
K05adsp55-u:3074	 na śakyate 'bhibhavituṃ. sadevamānuṣāsureṇa lokena,  yair akuśalamūlair avamarditaḥ śrāvakabhūmau vā pratyekabuddhabhūmau vā patet,	T07n0220c_516:0700b25_12	是故，善現！ 諸菩薩摩訶薩善根堅固不可屈伏，世間天、人、阿素洛等不能破壞令墮聲聞、獨覺等地。
K05adsp55-u:3076	 tad anyair vā akuśalair dharmaiḥ saṃhṛyeta,  yaiḥ saṃhṛyamāno dānapāramitāyāṃ caran kuśalair mūlair na vivardheta,  yāvat sarvākārajñatāyāṃ caran kuśalamūlair na vivardheta. evaṃ khalu subhūte bodhisattvena mahāsattvena prajñāpāramitāyāṃ caritavyaṃ. āha:	T07n0220c_516:0700b29_12	世間種種惡不善法，不能引奪令行六種波羅蜜多，廣說乃至一切智智所有善法不得增長。 如是，善現！ 諸菩薩摩訶薩應行無二甚深般若波羅蜜多。
K05adsp55-u:3079	 kiṃ punar bhagavaṃ bodhisattvena mahāsattvena kusalamūlānāṃ kṛte prajñāpāramitāyāṃ caritavyaṃ?	T07n0220c_516:0700c02_8	」具壽善現復白佛言： 「諸菩薩摩訶薩為善根故行深般若波羅蜜多耶？
K05adsp55-u:3080	 bhagagavān āha:	T07n0220c_516:0700c03_14	」佛言：
K05adsp55-u:3081	 no hīdaṃ subhūte,	T07n0220c_516:0700c03_18	「不爾！ 善現當知！
K05adsp55-u:3082	 na bodhisattvo mahāsattvo kuśalamūlānāṃ kṛte prajñāpāramitāyāṃ carati,  nāpy akuśalamūlānāṃ kṛte prajñāpāramitāyāṃ carati,	T07n0220c_516:0700c06_2	諸菩薩摩訶薩不為善根故行深般若波羅蜜多，亦不為不善根故行深般若波羅蜜多。
K05adsp55-u:3084	 na ca aparyupāsya buddhān bhagavato,  na aparipūrya kuśalamūlāni. na kalyāṇamitrair aparigṛhīto bodhisattvo mahāsattvaḥ śaktaḥ sarvākārajñatām anuprāptuṃ. āha:	T07n0220c_516:0700c06_7	所以者何？ 諸菩薩摩訶薩法應如是，若未親近供養恭敬諸佛世尊，若諸善根未極圓滿，若真善友未多攝受，終不能得一切智智。 」具壽善現復白佛言：
K05adsp55-u:3086	 kathaṃ bhagavaṃ paryupāsya buddhāṃ bhagavataḥ kuśalamūlaiḥ parigṛhītaḥ kalyāṇamitrair parigṛhīto bodhisattvo mahāsattvaḥ sarvākārajñatām anuprāpnoti?	T07n0220c_516:0700c11_15	「云何菩薩摩訶薩親近供養諸佛世尊，令諸善根最極圓滿，得真善友多所攝受，疾能證得一切智智？
K05adsp55-u:3087	 bhagavān āha:	T07n0220c_516:0700c12_1	」佛告善現：
K05adsp55-u:2289	 ato niryātaṃ hi tad dānaśīlasamādhiprajñāvimuktivimuktijñānadarśanasrotaāpattiphalaṃ  yāvad arhattvaṃ pratyekabodhiḥ. ye 'pi te buddhā bhagavanto daśasu dikṣu lokadhātuṣu  tiṣṭhanti dhṛyante yāpayanti dharmaṃ ca deśayanti te 'py ato niryātāḥ prajñāpāramitāyāḥ.  ye 'pi te 'tītānāgatapratyutpannā buddhā bhagavantas te 'py ata eva prabhāvitā. prajñāpāramitāyāḥ.  punar aparaṃ subhūte yo muhūrtaṃ vā divasaṃ vā divasaśataṃ vā saṃvatsaraṃ va saṃvatsaraśataṃ	T07n0220c_444:0330c04_8	假使有人教化三千大千世界一切有情，皆令安住布施、淨戒、安忍、精進、靜慮、般若，或令安住解脫及解脫智見，或令安住預流果乃至獨覺菩提，是人雖得無量福聚，而猶不及如實修行甚深般若波羅蜜多經彈指頃所獲福聚。
K05adsp55-u:2386	 kathaṃ tathatā?	T07n0220c_444:0332b17_16	云何真如？
K05adsp55-u:1471	 śāntaṃ vā aśāntaṃ vā. yasmiṃ subhūte samaye bodhisattvo mahāsattva prajñāpāramitāyāṃ carati,  tasmim [f. 237b] samaye prajñāpāramitāyāṃ caraṃ prajñāpāramitāṃ na samanupaśyati.  tam api dharmaṃ na samanupaśyati. yena prajñāpāramitāṃ samanupaśyet. evaṃ dhyānapāramitāṃ  na samanupaśyati. vīryapāramitāṃ na samanupaśyati. kṣāntipāramitāṃ na samanupaśyati.  śīlapāramitāṃ na samanupaśyati. dānapāramitāṃ na samanupaśyati. yāvad bodhiṃ na samanupaśyati.  tam api dharmaṃ na samanupaśyati. yena dharmeṇa bodhiṃ samanupaśyet. yena ca dharmeṇa	T07n0220c_444:0316a29_16	若時菩薩摩訶薩如是修行甚深般若波羅蜜多，是時菩薩摩訶薩雖行般若波羅蜜多，而不見有所行般若波羅蜜多，亦復不見有法能見所行般若波羅蜜多，亦不見有如是不見。 雖行靜慮、精進、安忍、淨戒、布施波羅蜜多，而不見有所行靜慮乃至布施波羅蜜多，亦復不見有法能見所行靜慮乃至布施波羅蜜多，亦不見有如是不見。
K05adsp55-u:2388	 yathā bhūtakoṭi. āha:	T07n0220c_444:0332b17_21	」「善現！ 如實際。
K05adsp55-u:2389	 kathaṃ bhūtakoṭiḥ?	T07n0220c_444:0332b18_8	云何實際？
K05adsp55-u:3088	 iha subhūte bodhisattvo mahāsattvaḥ prathamacittotpādam upādāya buddhān bhagavataḥ paryupāste,	T07n0220c_516:0700c23_10	「諸菩薩摩訶薩從初發心，親近供養諸佛世尊，從諸佛所聞說契經乃至論義，聞已受持、轉讀、溫習、令善通利，既善通利如理思惟，既思惟已深見意趣，見意趣已能善通達，既善通達得陀羅尼，起無礙解乃至證得無上菩提，隨所生處於所聞持正法教義常不忘失，於諸佛所廣殖善根，由善根力所任持故，不墮惡趣無暇處生，復由善根所攝受故，意樂清淨，淨意樂力所攝持故，常能無倒成熟有情、嚴淨佛土，復由善根所攝受故，恒不遠離真淨善友，謂諸如來及諸菩薩、獨覺、聲聞并餘能讚佛、法、僧者。
K05adsp55-u:2390	 bhagavān āha:  yathā dharmadhātuḥ. āha:	T07n0220c_444:0332b18_17	如法界。
K05adsp55-u:3124	 iha subhūte bodhisattvo mahāsattva prathamacittotpādam upādāya dānapāramitāyāṃ caraṃ sarvākārajñatāpratisaṃyuktair manasikārair dānaṃ dadāti,  buddhebhyo bhagavadbhyas pratyekabuddhebhyaḥ śrāvakebhyo manuṣyabhūtebhyaḥ amanuṣyabhūtebhyaḥ.  sa taiḥ sarvākārajñatāpratisaṃyuktair manasikārair samanvāgato na ca asya dāne dānasaṃjñā bhavati,  na pratigrāhake pratigrāhakasaṃjñā bhavati,	T07n0220c_516:0701a24_3	「若菩薩摩訶薩從初發心，修行布施波羅蜜多時，以一切智智相應作意，或施諸佛，或施菩薩，或施獨覺，或施聲聞，或施諸餘人、非人等。 是菩薩摩訶薩成就如是一切智智相應作意，雖行布施而無施想、無受者想，亦無一切我、我所想。
K05adsp55-u:3128	 na dāyake dāyakasaṃjñā bhavati. tat kasya hetoḥ?	T07n0220c_516:0701a26_13	所以者何？
K05adsp55-u:3129	 tathā hi subhūte svalakṣaṇaśūnyān sarvadharmān jānāty asato 'saṃbhūtān apariniṣpannān  anabhinirvṛttān sarvadharmān paśyati. dharmāṇāṃ ca dharmalakṣaṇam avataraty akiñcitsamarthāḥ  sarvadharmā ity asaṃskāralakṣaṇena avatarati. so 'nenopāyakauśalena samanvāgata kuśalamūlair vivardhate,	T07n0220c_516:0701a28_2	是菩薩摩訶薩觀一切法性相皆空，無起、無成、無轉、無滅，入諸法相； 知一切法無作、無能，入諸行相。
K05adsp55-u:3132	 sa kuśalamūlair vivardhamāno dānapāramitāyāṃ carati,  dānapāramitāyāṃ caran sattvāṃś ca paripācayati buddhakṣetraṃ ca pariśodhayati. na	T07n0220c_516:0701b02_11	是菩薩摩訶薩成就如是方便善巧，恒時增長勝妙善根，由此善根常增長故，能行布施波羅蜜多，成熟有情、嚴淨佛土。
K05adsp55-u:3134	 ca dānaphalam āśaṃsate yad dānaphalaṃ saṃsāre paribhuṃjīta anyatra sattvaparitrāṇatāyai  sattvaparimocanatāyai dānapāramitāyāṃ carati. upāyakauśalyanirdeśaparivartaḥ. ((66))  (AdSPG I 175)	T07n0220c_516:0701b05_2	雖行布施而不希求施所得果，謂不貪著生死勝報，但為救護無救護者，及欲解脫未解脫者，勤修布施波羅蜜多。
K05adsp55-u:2392	 kathaṃ dharmadhātuḥ?	T07n0220c_444:0332b19_1	云何法界？
K05adsp55-u:3137	 pativarta 67.  punar aparaṃ subhūte bodhisattvo mahāsattvaḥ śīlapāramitāyāṃ caraṃ prathamacittotpādam	T07n0220c_516:0701b05_9	「復次，善現！
K05adsp55-u:3261	 sarvākārajñatā. evaṃ khalu subhūte bodhisattvena mahāsattvena niṣprapañcyāyāṃ prajñāpāramitāyāṃ	T07n0220c_516:0703a28_17	如是，善現！ 諸菩薩摩訶薩應行無戲論甚深般若波羅蜜多。
K05adsp55-u:3262	 caritavyaṃ. api tu khalu subhūte nāsti rūpasya svabhāvo nāsti vedanāyāḥ saṃjñāyā  saṃskārāṇāṃ nāsti vijñānasya svabhāvaḥ. yāvan nāsti sarvākārajñatāyā svabhāvaḥ. yasya	T07n0220c_516:0703b01_9	」爾時，善現復白佛言： 「諸菩薩摩訶薩行深般若波羅蜜多時，云何觀色蘊乃至識蘊廣說乃至一切智智皆不可戲論故不應戲論？
K05adsp55-u:3264	 svabhāvo nāsti tad niṣprapañcyaṃ. [f. 260b] anena subhūte kāraṇena niṣprapañcyaṃ	T07n0220c_516:0703b04_3	」佛告善現： 「諸菩薩摩訶薩行深般若波羅蜜多時，應觀色蘊乃至識蘊皆無自性，廣說乃至一切智智亦無自性，若法無自性則不可戲論。 是故，善現！
K05adsp55-u:3265	 rūpaṃ niṣprapañcyā vedanāsaṃjñāsaṃskārā niṣprapañcyaṃ vijñānaṃ. yāvan niṣprapañcyā  sarvākārajñatā. evaṃ khalu suhhūte bodhisattvo mahāsattvaḥ prajñāpāramitāyāṃ caran	T07n0220c_516:0703b09_18	色蘊乃至識蘊皆不可戲論故，諸菩薩摩訶薩不應戲論，廣說乃至一切智智亦不可戲論故，諸菩薩摩訶薩不應戲論。
K05adsp55-u:3268	 yadi bhagavan na kasyacid dharmasya svabhāva upalabhyate. katamena mārgeṇa bodhisattvo mahāsattvo bodhisattvanyāmam avakrāmati,	T07n0220c_516:0703b15_6	「若一切法皆無自性，亦無戲論而可得者。 諸菩薩摩訶薩用何等道，得入菩薩正性離生？
K05adsp55-u:3269	 śrāvakamārgeṇa vā pratyekabuddhamārgeṇa vā buddharmārgeṇa vā?	T07n0220c_516:0703b17_2	為聲聞道、為獨覺道、為諸佛道？
K05adsp55-u:3381	 jñānena darśanena śikṣitvā kecid dharmāḥ prativeddhavyāḥ (AdSPG I 188)  kecid dharmā na prativeddhavyāḥ. katame dharmā bodhisattvena mahāsattvena jñānena darśanena śikṣitvā prativeddhavyāḥ,	T07n0220c_516:0704c16_4	「諸菩薩摩訶薩於何等法學智見已如實觀察不應攝受？ 於何等法學智見已如實觀察應可攝受？
K05adsp55-u:3384	 śrāvakapratyekabuddhadharmāḥ śikṣitvājñānena darśanena ca na prativeddhavyāḥ,	T07n0220c_516:0704c18_17	「諸菩薩摩訶薩於諸聲聞、獨覺等法學智見已，如實觀察不應攝受；
K05adsp55-u:2393	 bhagavān āha:  yathā ātmadhātuḥ sattvadhātur jīvadhātuḥ pudgaladhātuḥ. āha:  kathaṃ bhagavann ātmadhātuḥ sattvadhātur jīvadhātuḥ pudgaladhātu?	T07n0220c_444:0332b20_11	如我界、有情界、命者界、生者界、養者界、士夫界、補特伽羅界。
K05adsp55-u:3385	 sarvākārajñatājñānena sarvākāraiḥ sarvadharmā prativeddhavyāḥ. evaṃ khalu subhūte bodhisattvena mahāsattvena āryadharmavinaye prajñāpāramitāyāṃ śikṣitavyaṃ. āha:	T07n0220c_516:0704c20_7	於一切智智相應諸法學智見已，如實觀察一切種相應可攝受。 善現當知！ 諸菩薩摩訶薩於此聖法毘奈耶中，應如是學甚深般若波羅蜜多。
K05adsp55-u:3386	 āryo dharmavinayo āryo dharmavinaya iti bhagavann ucyate. kiyatā bhagavann āryo dharmavinaya ity ucyate?	T07n0220c_516:0704c22_13	」具壽善現復白佛言： 「佛說聖法毘奈耶者，何等名聖法毘奈耶？ 何故名聖法毘奈耶？
K05adsp55-u:3387	 bhagavān āha:	T07n0220c_516:0704c24_7	」佛告善現：
K05adsp55-u:3388	 iha subhūte śrāvakāḥ pratyekabuddhā bodhisattvā mahāsattvāś ca tathāgatā arhantaḥ  samyaksaṃbuddhā rāgeṇa na saṃyuktā na visaṃyuktāḥ doṣeṇa na saṃyuktā na visaṃyuktāḥ  mohena na saṃyuktā na visaṃyuktāḥ satkāyadṛṣṭyā na saṃyuktā na visaṃyuktāḥ vicikitsayā  na saṃyuktā na visaṃyuktāḥ śīlavrataparāmarśena na saṃyuktā na visaṃyuktāḥ kāmarāgavyāpādena  na saṃyuktā na visaṃyuktāḥ rūparāgārūparāgeṇa na saṃyuktā na visaṃyuktāḥ avidyayā  na saṃyuktā na visaṃyuktāḥ manauddhatyena na saṃyuktā na visaṃyuktāḥ prathamena dhyānena	T07n0220c_516:0705a21_18	「若諸聲聞，若諸獨覺，若諸菩薩，若諸如來、應、正等覺，如是一切與貪、瞋、癡皆非相應非不相應，與薩迦耶見、戒禁取、疑皆非相應非不相應，與欲貪、瞋恚皆非相應非不相應，與色愛、無色愛、掉舉、慢、無明皆非相應非不相應，與四靜慮、四無量、四無色定皆非相應非不相應，與四念住乃至八聖道支皆非相應非不相應，與苦、集、滅、道聖諦皆非相應非不相應，與空、無相、無願解脫門皆非相應非不相應，與八解脫乃至十遍處皆非相應非不相應，與六波羅蜜多皆非相應非不相應，與內空乃至無性自性空皆非相應非不相應，與真如乃至不思議界皆非相應非不相應，與淨觀地乃至如來地皆非相應非不相應，與極喜地乃至法雲地皆非相應非不相應，與陀羅尼門、三摩地門皆非相應非不相應，與五眼、六神通皆非相應非不相應，與如來十力乃至十八佛不共法皆非相應非不相應，與大慈、大悲、大喜、大捨皆非相應非不相應，與三十二大士相、八十隨好皆非相應非不相應，與無忘失法、恒住捨性皆非相應非不相應，與一切智、道相智、一切相智皆非相應非不相應，與預流果乃至獨覺菩提皆非相應非不相應，與諸菩薩摩訶薩行及佛無上正等菩提皆非相應非不相應，與斷煩惱習氣相續、一切智智皆非相應非不相應，與有為界及無為界皆非相應非不相應。
K05adsp55-u:3546	 bhagavān āha:	T07n0220c_516:0707c27_4	」佛告善現：
K05adsp55-u:3547	 evam etat subhūte evam etat. na abhāvasaṃjñina ānulomikī kṣāntir asti yāvan nāsti sarvavāsanānusandhikleśaprahānaṃ. āha:	T07n0220c_516:0707c27_8	「如是！ 如汝所說。 住無想者，亦無順忍，乃至亦無永斷煩惱習氣相續，亦不能得一切智智。 然依無相，非實有法修得順忍，乃至永斷一切煩惱習氣相續，亦能證得一切智智。 」具壽善現復白佛言：
K05adsp55-u:3548	 kiṃ punar bhagavaṃ bodhisattvasya mahāsattvasya prajñāpāramitāyāṃ carato bhāvasaṃjñā bhavaty abhāvasaṃjñā vā,	T07n0220c_516:0708a04_2	「諸菩薩摩訶薩行深般若波羅蜜多時，為有有想，有無想不？
K05adsp55-u:3549	 rūpasaṃjñā vā yāvat vijñānasaṃjñā vā,	T07n0220c_516:0708a04_14	為有色蘊想乃至識蘊想不？ 廣說乃至為有永斷一切煩惱習氣相續想不？
K05adsp55-u:2397	 tat kiṃ manyase subhūte api nv ātmā vā sattvo vā jīvo vā pudgalo vā upalabhyate?	T07n0220c_444:0332b21_5	云何我界乃至補特伽羅界？ 」「善現！ 於意云何？
K05adsp55-u:3550	 yāvat sarvākārajñatāsaṃjñā vā,	T07n0220c_516:0708a06_7	為有證得一切智智想不？
K05adsp55-u:3554	 vā, avidyāsaṃjñā vā avidyāprahāṇasaṃjña vā,	T07n0220c_516:0708a08_5	為有受想行識想，有受想行識斷想不？ 為有眼處乃至意處想，有眼處乃至意處斷想不？ 為有色處乃至法處想，有色處乃至法處斷想不？ 為有眼界乃至意界想，有眼界乃至意界斷想不？
K05adsp55-u:3555	 saṃskārasaṃjñā vā saṃskāraprahāṇasaṃjñā vā,	T07n0220c_516:0708a12_14	為有色界乃至法界想，有色界乃至法界斷想不？
K05adsp55-u:3556	 vijñānasaṃjñā vā vijñānaprahānasaṃjñā vā,	T07n0220c_516:0708a14_1	為有眼識界乃至意識界想，有眼識界乃至意識界斷想不？
K05adsp55-u:3565	 jarāmaraṇasaṃjñā vā jarāmaraṇaprahāṇasaṃjñā vā,	T07n0220c_516:0708a21_16	為有無明乃至老死想，有無明乃至老死斷想不？
K05adsp55-u:2674	 ucyate. ekena ākāreṇa sarvākārajñatety ucyate. yaduta śāntākāreṇa. api tu khalu punaḥ subhūte yair ākārair yair liṅgair yair nimittair [f. 253a] dharmā sūcyante,	T07n0220c_444:0337c20_3	」佛告善現： 「知一切法皆同一相，謂寂滅相，是故名為一切相智。 復次，善現！
K05adsp55-u:3588	 teṣān dhyānānāṃ dhyānāṅgānāñ ca nimittam anudgṛhṇaṃs,  tair dhyānair na manye,  dhyānāni na āsvādayāmi,  dhyānāni nopalabhe. so 'haṃ tāni dhyānāny ākāraviśuddhāni samāpadye,  so 'haṃ tāni dhyānāni vipākīkṛtvā vividhajñānasākṣātkriyāyai cittam abhinirṇāmayāmi,	T07n0220c_516:0708b13_2	我於爾時，於諸靜慮及靜慮支雖善取相，而無所執，於諸靜慮及靜慮支不生味著，於諸靜慮及靜慮支都無所得。
K05adsp55-u:3593	 yāvad divyaśrotrajñānasākṣātkriyāyai cittaparyāyajñānasākṣātkriyāyai pūrvanivāsānusmṛtijñānasākṣātkriyāyai  divyacakṣurjñānasākṣātkriyāyai cittam abhinirṇāmayāmi. tāsāṃ sākṣātkriyāyāṃ nimittam  anudgṛhṇaṃs tābhir abhijñabhir na manye na āsvādayāmi nopalabhe. so 'haṃ tāḥ pañcābhijñāḥ  samyaksaṃbodhim abhisaṃbudhya idaṃ duḥkhaṃ,	T07n0220c_516:0708b14_1	我於爾時，於四靜慮行相清淨無所分別。 我於爾時，於諸靜慮及靜慮支雖善純熟，而不受彼所得果報，但依靜慮，令心引發神境、天耳、他心、宿住、天眼智通，於此五通雖善取相，而無所執，亦不愛味，於諸通境都無所得，亦不分別，如空而住。
K05adsp55-u:3604	 āha: kathaṃ bhagavaṃs [f. 265a] tathāgatena arhatā samyaksaṃbuddhena abhāvasvabhāvāni catvāri dhyānāni utpāditāni,  katham abhāsvabhāvā ṣaḍabhijñā utpāditā,  kathaṃ sattvāsattvā triṣu rāśiṣu vyākṛtāḥ?	T07n0220c_516:0708b26_4	」具壽善現復白佛言： 「云何如來應正等覺於一切法無性性中，起四靜慮，發五神通，證大菩提，具諸功德，安立利樂三聚有情？
K05adsp55-u:3599	 ayaṃ duḥkhanirodhaḥ,  iyaṃ duḥkhanirodhagaminīpratipad iti yathābhūtam ājñātavān,  so 'haṃ daśabhiḥ tathāgatabalaiḥ samanvāgataś caturbhir vaiśāradyaiś catasṛbhiḥ pratisaṃvidbhiḥ  mahāmaitryā mahākaruṇayā 'ṣṭādaśabhir āveṇikair buddhadharmaiḥ samanvāgataḥ sattvāṃs  triṣu rāśiṣu vyākaromi. (AdSPG I 200)	T07n0220c_516:0708b25_15	由此成就如來十力、四無所畏、四無礙解及十八佛不共法等無邊功德，以佛妙智安立有情三聚差別，隨其所應，方便化導，令獲殊勝利益安樂。
K05adsp55-u:3607	 bhagavān āha:	T07n0220c_516:0708b28_17	」佛告善現：
K05adsp55-u:3608	 sacet subhūte kāmānāṃ vā pāpakānāṃ vā akuśalānāṃ dharmāṇāṃ svabhāvo 'bhaviṣyad bhāvo vābhaviṣyat para bhāvo vābhaviṣyan,  na ahaṃ subhūte pūrvaṃ bodhisattvacārikāṃ carann abhāvasvabhāvān kāmān viditvā abhāvasvabhāvān  tasmād ahaṃ pūrvaṃ bodhisattvacārikāṃ caran viviktaṃ kāmair viviktaṃ pāpakair akuśalair	T07n0220c_516:0708c04_10	「若諸欲惡不善法等，有少自性，或復他性為自性者，我本修學菩薩道時，不應通達一切欲惡不善法等，皆以無性而為自性，離欲惡等，入諸靜慮，具足而住，以諸欲惡不善法等，無自他性，但以無性為自性故。
K05adsp55-u:2675	 sarvāṇi tāny ākārās tāni liṅgāni tāni nimittāni tathāgatena anubuddhāni,	T07n0220c_444:0337c22_19	諸行、狀、相能表諸法，如來如實能遍覺知，由是故名一切相智。
K05adsp55-u:2677	 yat punar bhagavaṃ sarvākārajñatā ca mārgākārajñatā ca sarvajñatā ca,  kaccid bhagavann āsām tisṛṇāṃ sarvajñatānāṃ kleśaprahāṇasya nānātvam asti,  asya sāvaśeṣaprahāṇam asya anavaśeṣaprahāṇam iti?	T07n0220c_444:0337c24_18	「若一切智、若道相智、若一切相智，如是三智，諸煩惱斷有差別不？ 有有餘斷、無餘斷不？
K05adsp55-u:2680	 bhagavān āha:	T07n0220c_444:0337c25_14	」佛告善現：
K05adsp55-u:2681	 na subhūte kleśaprahāṇasya nānātvam asti. asti punas tathāgatasya sarvavāsanānusandhiprahāṇaṃ na punaḥ srāvakasya pratyekabuddhasya ca sarvāsanānusandhikleśaprahānaṃ.	T07n0220c_444:0337c27_15	「非諸煩惱斷有差別，然諸如來一切煩惱習氣相續皆已永斷，聲聞、獨覺習氣相續猶未永斷。
K05adsp55-u:2682	 āha: kiṃ punar bhagavann ebhir anuprāptam asaṃskṛtaṃ. kiṃ vā punar bhagavann asaṃskṛtasya nānātvam upalabhyate?	T07n0220c_444:0337c27_21	」善現復問： 「諸煩惱斷得無為不？ 」佛言： 「如是！ 」善現復問：
K05adsp55-u:2683	 bhagavān āha:	T07n0220c_444:0337c29_17	」佛言：
K05adsp55-u:2684	 neti. āha:	T07n0220c_444:0337c29_21	「不爾！ 」善現復問：
K05adsp55-u:2685	 yady asaṃskṛtasya nānātvaṃ nopalabhyate,	T07n0220c_444:0338a01_12	「無為法中有差別不？
K05adsp55-u:2687	 asya sarvavāsanānusandhiprahāṇam asya na sarvavāsanānusandhiprahāṇaṃ?	T07n0220c_444:0338a04_12	「若無為法無差別者，佛何故說一切如來、應、正等覺習氣相續皆已永斷，聲聞、獨覺習氣相續猶未永斷？
K05adsp55-u:1477	 sarvavāsanānusandhiprahāṇaṃ kuryāt tam api na samanupaśyati. evaṃ khalu subhūte bodhisattvena  mahāsattvena prajñāpāramitāyāṃ caritavyaṃ. sarvadharma anupalaṃbhayogena. yasmiṃ	T07n0220c_444:0316b07_15	如是乃至雖修一切智智，而不見有所修一切智智，亦復不見有法能見所修一切智智，亦不見有如是不見，亦復不見有法能斷一切煩惱習氣相續。
K05adsp55-u:2688	 bhāgavān āha:	T07n0220c_444:0338a04_16	」佛言：
K05adsp55-u:2689	 na subhūte vāsanānusandhikleśo 'sti. api tv asti teṣāṃ śrāvākapratyekabuddhānāṃ rāgadoṣamohaprahāṇaṃ  kaścit tu kāyavikārās pravartante te bālapṛthagjanānām anarthāya sanivartante. na	T07n0220c_444:0338a04_20	「善現！ 習氣相續實非煩惱，然諸聲聞及諸獨覺煩惱已斷，猶有少分似貪瞋癡動發身、語，即說此為習氣相續。
K05adsp55-u:2691	 tu śrāvakānāṃ te tathāgatasya nāsti. athāyuṣmāṃ subhūtir bhagavantam etad avocat:  yady abhāvo (AdSPG I 150)	T07n0220c_444:0338a09_11	此在愚夫異生相續能引無義，非在聲聞、獨覺相續能引無義，如是一切習氣相續，諸佛世尊究竟無有。 」具壽善現白言：
K05adsp55-u:1479	 subhūte samaye bodhisattvo mahāsattvaḥ sarvadharma anupalabhamānaḥ prajñāpāramitāyāñ carati	T07n0220c_444:0316b07_18	善現！ 諸菩薩摩訶薩於一切法以無所得而為方便，應行般若波羅蜜多。 善現！
K05adsp55-u:1844	 iha subhūte hodhisattvo mahāsattvāḥ prajñāpāramitāyāṃ sthitas tathāgatasamādhiṃ sthāpayitvā  yāvantaḥ kecit samādhayaḥ śrāvakasamādhayo vā pratyekabuddhasamādhayo vā bodhisattvasamādhayo	T07n0220c_444:0321c05_13	若菩薩摩訶薩安住般若波羅蜜多，除佛等持，於餘一切聲聞、獨覺、菩薩等持，皆能自在隨意入出。
K05adsp55-u:2693	 bhagavaṃ mārgaḥ abhāvo nirvāṇaṃ,	T07n0220c_444:0338a10_1	「世尊！ 道與涅槃俱無自性，佛何故說此是預流、此是一來、此是不還、此是阿羅漢、此是獨覺、此是菩薩、此是如來？ 」佛告善現：
