src_segmentnr	src_original	tgt_segmentnr	tgt_original
K05bsu049_u:7989	 sa ca dīpaṃkarastathāgato 'rhan samyaksaṃbuddhaḥ suvarṇapuṣpairevāvakīrṇo 'nuttarāṃ samyaksaṃbodhiṃ prārthayamānayā /  yadā mayā pañcabhirutpalairdīpaṃkarastathāgato 'rhan samyaksaṃbuddho 'vakīrṇaḥ,  anutpattikeṣu ca mayā dharmeṣu kṣāntiḥ pratilabdhā,	T07n0220c_516:0645b05_13	我於過去然燈佛所以五莖花奉散彼佛迴向發願。
K05bsu049_u:7992	 tato 'haṃ dīpaṃkareṇa tathāgatenārhatā samyaksaṃbuddhena vyākṛto 'nuttarāyāṃ samyaksaṃbodhau	T07n0220c_516:0645b06_13	然燈如來、應、正等覺知我根熟與我受記：
K05bsu049_u:7993	 - bhaviṣyasi tvaṃ māṇavaka anāgate 'dhvani śākyamunirnāma tathāgato 'rhan samyaksaṃbuddho	T07n0220c_516:0645b07_18	『汝於來世當得作佛，號曰能寂，界名堪忍，劫號為賢。
K05bsu049_u:7995	 manuṣyāṇāṃ ca buddho bhagavāniti /  tadā etasyā bhaginyā mama vyākaraṇaṃ śrutvā evaṃ cittamudapādi - aho bata ahamapyevaṃ vyākriyeya anuttarāyāṃ samyaksaṃbodhau yathāyaṃ māṇavako vyākṛto 'nuttarāyāṃ samyaksaṃbodhau /	T07n0220c_516:0645b11_11	『使我來世於此菩薩當作佛時，亦如今佛現前授我大菩提記。
K05bsu049_u:8105	 tatkasya hetoḥ?	T07n0220c_516:0646c01_7	所以者何？
K05bsu049_u:8106	 tathā hyasya balavattamā dṛḍhatamāś ca parigrāhakāḥ,  yaduta prajñāpāramitā upāyakauśalyaṃ ca /	T07n0220c_516:0646c02_1	自恃威猛具諸伎術無所畏故。 「善現當知！
K05bsu049_u:8108	 tena asyāparityaktāḥ sarvasattvāḥ,  tenaiṣa pratibalaḥ svastinā kṣemeṇa anuttarāṃ samyaksaṃbodhimabhisaṃboddhum /  yasmin samaye subhūte bodhisattvo mahāsattvaḥ sarvasattvānāmantike maitrīcittamārambaṇīkṛtya tān paramayā maitryā paribadhnāti,	T07n0220c_516:0646c05_15	諸菩薩摩訶薩亦復如是，愍生死苦諸有情類，發趣無上正等菩提，普緣有情起四無量，住四無量俱行之心，勤修布施乃至般若波羅蜜多令速圓滿。
K05bsu049_u:8111	 atrāntare bodhisattvo mahāsattvaḥ kleśapakṣaṃ mārapakṣaṃ cātikramya śrāvakabhūmiṃ pratyekabuddhabhūmiṃ cātikramya tatra samādhāvavatiṣṭhate  aprāptaś ca sa subhūte āsravakṣayaṃ paramapāramitāyāṃ śūnyatāyāṃ parijayaṃ karoti /  yasmin samaye subhūte bodhisattvo mahāsattvaḥ śūnyatāsamādhivimokṣamukhena viharati,	T07n0220c_516:0646c09_13	是菩薩摩訶薩於此六種波羅蜜多未圓滿位，為欲修學一切智智不證漏盡，雖住空、無相、無願解脫門，然不隨其勢力而轉，亦不為彼障所牽奪，於解脫門亦不作證。
K05bsu049_u:8121	 evameva subhūte bodhisattvo mahāsattvaḥ śūnyatāvihāreṇa viharati,  śūnyatāyāṃ parijayaṃ karoti,  ānimittavihāreṇa ca viharati,	T07n0220c_516:0646c13_7	「善現當知！ 諸菩薩摩訶薩亦復如是，雖於空、無相、無願解脫門數習、住、修，而於其中能不作證，由不證故，不墮聲聞及獨覺地。
K05bsu049_u:8116	 tadyathāpi nāma subhūte pakṣī śakunirākāśe 'ntarīkṣe carati,  na ca bhūmau patati,  na ca kaṃcinniśrayaṃ niśritya tiṣṭhati,  ākāśa evāntarīkṣe viharati,  na ca tatrāpi niśrito na pratiṣṭhitaḥ /	T07n0220c_516:0646c13_1	如堅翅鳥飛騰虛空，自在𦒡翔久不墮落，雖依空戲而不據空，亦不為空之所拘礙。
K05bsu049_u:8124	 ānimitte ca parijayaṃ karoti,  apraṇihitavihāreṇa ca viharati,  apraṇihite ca parijayaṃ karoti /  na ca śūnyatāyāṃ vā ānimitte vā apraṇihite vā patatyaparipūrṇairbuddhadharmaiḥ /	T07n0220c_516:0646c18_13	修佛十力、四無所畏、四無礙解、大慈、大悲、大喜、大捨及十八佛不共法等無量佛法，若未圓滿，終不依空、無相、無願而證漏盡。
K05bsu049_u:8128	 tadyathāpi nāma subhūte balavāniṣvastrācārya iṣvastraśikṣāyāṃ suśikṣitaḥ supariniṣṭhitaḥ /  sa ūrdhvaṃ kāṇḍaṃ kṣipet /  ūrdhvaṃ kāṇḍaṃ kṣiptvā tadanyaiḥ kāṇḍaistatkāṇḍaṃ bhūmau patat pratinivārayet,  vārayet,	T07n0220c_516:0646c18_18	善現當知！ 譬如壯夫善閑射術，欲顯己伎，仰射虛空，為令空中箭不墮地，復以後箭射前箭筈，如是展轉經於多時，箭箭相承不令其墮。
K05bsu049_u:8135	 evameva subhūte bodhisattvo mahāsattvaḥ prajñāpāramitāyāṃ caran upāyakauśalyaparigṛhītaḥ tāvattāṃ paramāṃ bhūtakoṭiṃ na sākṣātkaroti,  yāvanna tāni kuśalamūlānyanuttarāyāṃ samyaksaṃbodhau paripakvāni suparipakvāni /	T07n0220c_516:0646c25_15	諸菩薩摩訶薩亦復如是，行深般若波羅蜜多，方便善巧所攝受故，乃至無上正等菩提，因行善根未皆成熟，終不中道證於實際。
K05bsu049_u:8132	 tasya paurvakasya kāṇḍasya kāṇḍaparaṃparayā bhūmau patanaṃ na dadyāt,  tāvattatkāṇḍaṃ bhūmau na patat,  yāvannākāṅkṣet - aho batedaṃ kāṇḍaṃ bhūmau patediti /	T07n0220c_516:0646c22_12	若欲令墮便止後箭，爾時諸箭方頓墮落。 「善現當知！
K05bsu049_u:8137	 yadā tāni kuśalamūlānyanuttarāyāṃ samyaksaṃbodhau paripakvāni bhavanti suparipakvāni,	T07n0220c_516:0646c27_13	若得無上正等菩提，因行善根一切成熟，爾時菩薩方證實際，便得無上正等菩提。
K05bsu049_u:8238	 evaṃ hi subhūte bodhisattvo mahāsattvaḥ paripraṣṭavyo bodhisattvena mahāsattvena anuttarāṃ samyaksaṃbodhimabhisaṃboddhukāmena - katameṣāṃ dharmāṇāṃ parijayaḥ kartavyaḥ?  kiyadrūpāṇi ca cittānyabhinirhartavyāni?	T07n0220c_516:0648b20_19	』善現當知！
K05bsu049_u:8241	 na ānimittaṃ sākṣātkaroti,  na apraṇihitaṃ sākṣātkaroti,  na anabhisaṃskāraṃ sākṣātkaroti,  na anutpādaṃ sākṣātkaroti,  na ajātiṃ sākṣātkaroti,  na abhāvaṃ sākṣātkaroti,	T07n0220c_516:0648b24_9	『諸菩薩摩訶薩欲證無上正等菩提，但應思惟空、無相、無願、無生、無滅、無作、無為、無性、實際及餘一切菩提分法，不應修學。
K05bsu049_u:8248	 sacetsubhūte bodhisattvo mahāsattvo bodhisattvena mahāsattvenaivaṃ pṛṣṭa evaṃ vyākaroti - śūnyataiva bodhisattvena mahāsattvena manasi kartavyā	T07n0220c_516:0648b28_2	善現當知！ 是菩薩摩訶薩得此問時，若作是答：
K05bsu049_u:8249	 ānimittameva apraṇihitameva anabhisaṃskāra eva anutpāda eva ajātireva abhāva eva bodhisattvena mahāsattvena manasi kartavya iti /  sacettaṃ sarvasattvāparityāgacittotpādaṃ nopadarśayet,  upāyakauśalyaṃ vā na vyākuryāt,	T07n0220c_516:0648c03_6	『諸菩薩摩訶薩欲證無上正等菩提，應正思惟空、無相、無願、無生、無滅、無作、無為、無性、實際及餘一切菩提分法，亦應方便如先所說善巧修學而不作證。
K05bsu049_u:8252	 veditavyametatsubhūte nāyaṃ vyākṛto bodhisattvo mahāsattvo 'nuttarāyāṃ samyaksaṃbodhāvavinivartanīyatve taiḥ paurvakaistathāgatairarhadbhiḥ samyaksaṃbuddhaiḥ /	T07n0220c_516:0648c04_15	』是菩薩摩訶薩已蒙如來、應、正等覺授與無上正等菩提不退轉記。
K05bsu049_u:8253	 tatkasya hetoḥ?	T07n0220c_516:0648c05_2	所以者何？
K05bsu049_u:8254	 yo hyasāvavinivartanīyasya bodhisattvasya mahāsattvasyāveṇiko dharmaḥ,  taṃ dharmaṃ na sūcayati,  nopadarśayati,	T07n0220c_516:0648c06_13	是菩薩摩訶薩已能開示、記別、顯了住不退轉地菩薩摩訶薩修學法相。
K05bsu049_u:8260	 na visarjayati,  na tāṃ bhūmimavakrāmayati,  yo 'vinivartanīyasya bodhisattvasya mahāsattvasya bhūmiriti //	T07n0220c_516:0648c18_6	「世尊！ 頗有未得不退轉菩薩摩訶薩能作如是如實答不？
K05bsu049_u:8263	 subhūtirāha - syātpunarbhagavan paryāyo yena paryāyeṇa bodhisattvo mahāsattvo 'vinivartanīyo (Vaidya 188)  bhavet? bhagavānāha - syātsubhūte sa paryāyo yena paryāyeṇa sa bodhisattvo mahāsattvo 'vinivartanīyo bhavet /	T07n0220c_516:0648c19_13	」佛告善現： 「有菩薩摩訶薩雖未得不退轉，而能於此作如實答。 善現當知！
K05bsu049_u:8265	 sacedbodhisattvo mahāsattva imāṃ prajñāpāramitāṃ śrutvā vā aśrutvā va evaṃ pratipadyeta,	T07n0220c_516:0648c24_14	是菩薩摩訶薩雖未得不退轉，而能修學布施、淨戒、安忍、精進、靜慮、般若波羅蜜多及餘一切菩提分法，已得成熟覺慧猛利，若聞、不聞能如實答如不退地菩薩摩訶薩。 」具壽善現復白佛言：
K05bsu049_u:8266	 evaṃ visarjayet - avinivartanīyo bodhisattvo mahāsattvo veditavyaḥ /	T07n0220c_516:0648c27_17	「多有菩薩摩訶薩求學無上正等菩提，少有能如實答如不退轉地菩薩摩訶薩已善修治地，未善修治地而安住故。
K05bsu049_u:8267	 subhūtirāha - tena hi bhagavan bahavo bodhāya caranti /	T07n0220c_516:0648c28_3	」佛告善現： 「如是！ 如是！ 所以者何？
K05bsu049_u:8268	 alpakāḥ punarya evaṃ visarjayanti /  bhagavānāha - tathā hi subhūte alpakāste bodhisattvā mahāsattvā ye vyākṛtā avinivartanīyāyāṃ jñānabhūmau /  ye punaste vyākṛtā bhaviṣyanti,  te evaṃ visarjayiṣyanti /	T07n0220c_516:0649a01_13	少有菩薩摩訶薩得受如是不退轉地殊勝慧記，若有得受如是記者，皆能於此作如實答。 善現！
K05bsu049_u:8272	 te te bodhisattvā mahāsattvā uttaptāvaropitakuśalamūlā veditavyāḥ /  te te bodhisattvā mahāsattvā asaṃhāryāḥ sadevamānuṣāsureṇa lokena /	T07n0220c_516:0649a05_2	若能於此如實答者，當知是菩薩摩訶薩已種善根最極明利，所修智慧其量深廣，世間天、人、阿素洛等不能引奪令其破壞，必得無上正等菩提。
K05bsu049_u:8274	 sacetpunaḥ subhūte bodhisattvo mahāsattvaḥ svapnāntaragato 'pi svapnopamāḥ sarvadharmā iti vyavalokayati,  na ca sākṣātkaroti,  idam api subhūte avinivartanīyasya bodhisattvasya mahāsattvasya avinivartanīyalakṣaṇaṃ veditavyam //  punaraparaṃ subhūte bodhisattvo mahāsattvaḥ svapnāntaragato 'pi śrāvakabhūmau vā pratyekabuddhabhūmau vā traidhātukāya ca spṛhāmanuśaṃsācittaṃ	T07n0220c_516:0649a05_9	「復次，善現！ 若菩薩摩訶薩乃至夢中，亦不愛樂稱讚聲聞、獨覺地法，於三界法亦不起心愛樂稱讚，常觀諸法如夢、如響廣說乃至如尋香城，雖如是觀察而不證實際，當知是菩薩有不退轉相。
K05bsu049_u:8279	 punaraparaṃ subhūte bodhisattvo mahāsattvaḥ svapnāntaragato 'pyanekaśatāyāḥ parṣado  'nekasahasrāyā yāvadanekakoṭīniyutaśatasahasrāyāḥ parṣado madhyagataṃ maṇḍalamāle  niṣaṇṇaṃ bhikṣusaṃghaparivṛtaṃ bodhisattvasaṃghapuraskṛtaṃ dharmaṃ deśayantaṃ tathāgatamarhantaṃ  samyaksaṃbuddhamātmānaṃ paśyati /  idam api subhūte avinivartanīyasya bodhisattvasya mahāsattvasyāvinivartanīyalakṣaṇaṃ veditavyam //	T07n0220c_516:0649a13_17	若菩薩摩訶薩夢見如來、應、正等覺，有無數量百千俱胝那庾多眾，恭敬圍遶而為說法，既聞法已善解義趣，解義趣已精進修行，法隨法行入三摩地起隨法行，當知是菩薩有不退轉相。
K05bsu049_u:8287	 ye 'nyāsu dikṣu gatvā anyeṣu lokadhātuṣu buddhakṛtyaṃ kurvanti,  dharmaṃ ca deśayanti /  evam api subhūte svapnāntaragatoa'vinivartanīyo bodhisattvo mahāsattvaḥ saṃjānīte /  idam api subhūte avinivartanīyasya bodhisattvasya mahāsattvasya avinivartanīyalakṣaṇaṃ veditavyam //	T07n0220c_516:0649a18_17	若菩薩摩訶薩夢見如來、應、正等覺，具三十二大士夫相、八十隨好圓滿莊嚴，常光一尋周匝照曜，與無量眾踊在虛空，現大神通說正法要，化作化士令往他方無邊佛土施作佛事，當知是菩薩有不退轉相。
K05bsu049_u:8291	 punaraparaṃ subhūte svapnāntaragato bodhisattvo mahāsattvo notrasyati,	T07n0220c_516:0649a19_4	「復次，善現！
K05bsu049_u:8292	 na saṃtrasyati,  na saṃtrāsamāpadyate /  grāmaghāte vā nagaraghāte vā nigamaghāte vā janapadaghāte vā rāṣṭraghāte vā agnidāhe  vā vartamāne vyālamṛgān vā tato 'nyān api vā kṣudramṛgajātīn dṛṣṭvā śiraśchede vā  pratyupasthite tato 'nyāny api vā mahābhayabhairavāṇi duḥkhadaurmanasyāni vā prāpya	T07n0220c_516:0649a23_14	若菩薩摩訶薩夢見狂賊破壞村城，或見火起焚燒聚落，或見師子、虎、狼、猛獸、毒蛇、惡蝎欲來害身，或見怨家欲斬其首，或見父母、兄弟、姊妹、妻子、親友臨當命終，或見自身寒熱飢渴及餘苦事之所逼惱。
K05bsu049_u:8297	 tato 'nyeṣām api vā sattvānāṃ mahābhayabhairavāṇi duḥkhāni dṛṣṭvā nāsya bhayabhairavamutpadyate,  notrasyati na saṃtrasyati na saṃtrāsamāpadyate /	T07n0220c_516:0649a25_4	見如是等可怖畏事，不驚、不懼亦不憂惱，從夢覺已即能思惟：
K05bsu049_u:8299	 tataś ca svapnāntarātprativibuddhasya samanantaravyutthitasyaivaṃ bhavati - svapnopamamidaṃ sarvaṃ traidhātukam /  evaṃ ca mayā anuttarāṃ samyaksaṃbodhimabhisaṃbudhya samyagdeśayatā dharmo deśayitavya iti /	T07n0220c_516:0649a27_2	『三界非真皆如夢見，我得無上正等覺時，當為有情說三界法，一切虛妄皆如夢境。
K05bsu049_u:8301	 idam api subhūte avinivartanīyasya bodhisattvasya mahāsattvasya avinivartanīyalakṣaṇaṃ veditavyam //	T07n0220c_516:0649a27_14	』當知是菩薩有不退轉相。
K05bsu049_u:8302	 (Vaidya 189) punaraparaṃ subhūte avinivartanīyasya bodhisattvasya mahāsattvasya svapnāntaragatasya  nairayikān sattvān dṛṣṭvā evaṃ bhavati - tathā kariṣyāmi yathā me 'nuttarāṃ samyaksaṃbodhimabhisaṃbuddhasya	T07n0220c_516:0649a27_21	「復次，善現！ 若菩薩摩訶薩乃至夢中見有地獄、傍生、鬼界諸有情類，便作是念：
K05bsu049_u:8304	 buddhakṣetre sarveṇa sarvaṃ sarvathā sarvaṃ sarve 'pyapāyā na bhaviṣyantīti /  idam api subhūte avinivartanīyasya bodhisattvasya mahāsattvasya apāyapariśuddhilakṣaṇaṃ veditavyam //	T07n0220c_516:0649b02_12	『我當精勤修諸菩薩摩訶薩行，速趣無上正等菩提，我佛土中得無地獄、傍生、鬼界惡趣及名。 』從夢覺已亦作是念。
K05bsu049_u:8306	 tatra subhūte kathaṃ vijñāyeta asyāvinivartanīyasya bodhisattvasya mahāsattvasya  anuttarāṃ samyaksaṃbodhimabhisaṃbuddhasya buddhakṣetre sarveṇa sarvaṃ sarvathā sarvaṃ  sarve 'pyapāyā na bhaviṣyantīti?	T07n0220c_516:0649b03_6	善現當知！ 是菩薩摩訶薩當作佛時，所居佛土定無惡趣。 所以者何？ 若夢、若覺諸法無二、無二分故，當知是菩薩有不退轉相。 「復次，善現！
K05bsu049_u:8309	 sacetsubhūte bodhisattvo mahāsattvaḥ svapnāntaragato 'pi nirayagatāṃstiryakpretagatān vā sattvān dṛṣṭvā smṛtiṃ pratilabhate /	T07n0220c_516:0649b07_19	若菩薩摩訶薩夢中見火燒地獄等諸有情類，或復見燒城邑、聚落，便發誓願：
K05bsu049_u:8314	 punaraparaṃ subhūte svapnāntaragato bodhisattvo mahāsattvo nagaradāhe vā grāmadāhe  vā vartamāne prativibuddhaḥ saṃstataḥ svapnādevaṃ samanvāharati yathā - mayā svapnāntaragatena	T07n0220c_516:0649b14_3	若菩薩摩訶薩覺時現見大火卒起，燒諸城邑或燒聚落，便作是念：
K05bsu049_u:8317	 yairākārairyairliṅgairyairnimittairavivartanīyo bodhisattvo mahāsattvo dhārayitavyaḥ,  te ākārāstāni liṅgāni tāni nimittāni mama saṃvidyante /  etena satyena satyavacanena ayaṃ nagaradāho vā grāmadāho vā vartamāna upaśāmyatu,	T07n0220c_516:0649b18_7	』若此菩薩作是誓願發誠諦言，爾時大火即為頓滅，當知已得不退轉記。 若此菩薩作是誓願發誠諦言，火不頓滅，當知未得不退轉記。
K05bsu049_u:8322	 sacetsubhūte grāmadāho vā nagaradāho vā upaśāmyati,	T07n0220c_516:0649b21_7	若菩薩摩訶薩覺時見火燒諸城邑或燒聚落，便作是念：
K05bsu049_u:8323	 śītībhavati,  astaṃ gacchati,  veditavyametatsubhūte vyākṛto 'yaṃ bodhisattvo mahāsattvastaiḥ paurvakaistathāgatairarhadbhiḥ samyaksaṃbuddhairavinivartanīyo 'nuttarāyāḥ samyaksaṃbodheriti	T07n0220c_516:0649b22_12	『我在夢中或在覺位，曾見自有不退轉地諸行、狀、相。 若我所見定是實有，必證無上正等菩提，願此大火即時頓滅變為清涼。
K05bsu049_u:8328	 nāstaḥ gacchati,  veditavyametatsubhūte nāyaṃ vyākṛto bodhisattvo mahāsattvo 'nuttarāyāṃ samyaksaṃbodhāviti /	T07n0220c_516:0649b28_9	是菩薩摩訶薩應自了知決定已得不退轉記。
K05bsu049_u:8330	 sacetpunaḥ subhūte so 'gnidāho 'tikramya gṛhādgṛhaṃ rathyāyā rathyāmanyatarānyatarāṃ rathyāṃ vā gṛhaṃ vā gacchati,  dahati,  nāstaṃ gacchati,  veditavyametatsubhūte dharmapratyākhyānaṃ duṣprajñasaṃvartanīyaṃ tena bodhisattvena mahāsattvena karmopacitam /  tato 'syaitaddṛṣṭadharmasaṃvartanīyameva karma vipacyate /  tata eva dharmapratyākhyānātsāvaśeṣaṃ karmaivaṃ vipacyate /	T07n0220c_516:0649c03_6	然被燒者，由彼有情造作增長壞正法業，彼由此業先墮惡趣，無量劫中受正苦果，今生人趣受彼餘殃，或由此業當墮惡趣，經無量劫受正苦果，今在人趣先現少殃。
K05bsu049_u:8338	 ityayaṃ subhūte heturayaṃ pratyayo 'sya bodhisattvasya mahāsattvasya avinivartanīyalakṣaṇatāyā iti /  ayam api subhūte bodhisattvo mahāsattvo 'vinivartanīyo 'nuttarāyāḥ samyaksaṃbodherdhārayitavyaḥ //	T07n0220c_516:0649c03_13	「復次，善現！ 依前所說種種因緣，知是不退轉菩薩摩訶薩。
K05bsu049_u:8340	 punaraparaṃ subhūte yairākārairyairliṅgairyairnimittairavinivartanīyo bodhisattvo mahāsattvo dhārayitavyaḥ,  tānākārāṃstāni liṅgāni tāni nimittāni deśayiṣyāmi /  tatsādhu ca suṣṭhu ca śṛṇu,  manasi kuru,  bhāṣiṣye 'haṃ te /	T07n0220c_516:0649c06_8	復有成就餘行、狀、相，知是不退轉菩薩摩訶薩，吾當為汝分別解說，汝應諦聽！ 極善思惟！
K05bsu049_u:8345	 sādhu bhagavannityāyuṣmān subhūtirbhagavataḥ pratyaśrauṣīt /	T07n0220c_516:0649c06_19	」善現答言： 「唯然！ 願說！
K05bsu049_u:8346	 bhagavānetadavocat - sacetsubhūte kaścideva puruṣo vā strī vā dārako vā dārikā vā (Vaidya 190)  amanuṣyeṇa gṛhīto bhavedāviṣṭaḥ /  tatra bodhisattvena mahāsattvena upasaṃkramya evamadhiṣṭhānaṃ samanvāhartavyam /	T07n0220c_516:0649c07_10	」佛告善現： 「若菩薩摩訶薩見有男子或有女人現為非人之所魅著，受諸苦惱不能遠離，便作是念：
K05bsu049_u:8349	 sacedahaṃ haiḥ paurvakaistathāgatairarhadbhiḥ samyaksaṃbuddhairvyākṛto 'nuttarāyāṃ samyaksaṃbodhau,  pariśuddho me 'dhyāśayaḥ anuttarāṃ samyaksaṃbodhimabhisaṃboddhum /	T07n0220c_516:0649c11_2	『若諸如來、應、正等覺知我已得清淨意樂，授我無上正等菩提不退轉記；
K05bsu049_u:8351	 yathāhamanuttarāṃ samyaksaṃbodhimabhisaṃboddhukāmaḥ,  pariśuddho me manasikāro 'nuttarāyāṃ samyaksaṃbodhau /  apagataṃ me śrāvakacittaṃ pratyekabuddhacittaṃ ca,	T07n0220c_516:0649c13_8	若我久發清淨作意，求證無上正等菩提，遠離聲聞、獨覺作意，不以聲聞、獨覺作意求證無上正等菩提。
K05bsu049_u:8354	 tena mayā anuttarā samyaksaṃbodhirabhisaṃboddhavyā /  nāhaṃ nānuttarāṃ samyaksaṃbodhimabhisaṃbhotsye /	T07n0220c_516:0649c14_16	若我當來必得無上正等菩提，窮未來際利益安樂諸有情類。
K05bsu049_u:8356	 abhisaṃbhotsya evāhamanuttarāṃ samyaksaṃbodhim /  ye 'pi te aprameyeṣvasaṃkhyeyeṣu lokadhātuṣu buddhā bhagavantastiṣṭhanti dhriyante yāpayanti,  na teṣāṃ tathāgatānāmarhatāṃ samyaksaṃbuddhānāṃ kiṃcidajñātaṃ vā adṛṣṭaṃ vā aviditaṃ vā asākṣātkṛtaṃ vā anabhisaṃbuddhaṃ vā /	T07n0220c_516:0649c19_2	若十方界現在實有無量如來、應、正等覺說微妙法利樂有情，彼諸如來、應、正等覺無所不見、無所不知、無所不解、無所不證，現知、見、覺一切有情意樂差別，願垂照察我心所念及誠諦言。
K05bsu049_u:8360	 anena satyena satyavacanena iyaṃ strī vā puruṣo vā dārako vā dārikā vā yena amanuṣyagraheṇa gṛhīto vā āviṣṭo vā,  so 'pakrāmatu /	T07n0220c_516:0649c21_17	若我實能修菩薩行，必獲無上正等菩提，救拔有情生死苦者，願是男子或此女人，不為非人之所擾惱，彼隨我語即當捨去。
K05bsu049_u:8362	 sacetso 'manuṣyaḥ evaṃ bhāṣamāṇena bodhisattvena mahāsattvena nāpakrāmati,  veditavyametatsubhūte nāyaṃ vyākṛto bodhisattvo mahāsattvastaiḥ paurvakaistathāgatairarhadbhiḥ samyaksaṃbuddhairanuttarāyāṃ samyaksaṃbodhāviti  sacetpunaḥ subhūte evaṃ bhāṣamāṇasya bodhisattvasya mahāsattvasya so 'manuṣyo 'pakrāmati,	T07n0220c_516:0649c23_8	』是菩薩摩訶薩作此語時，若彼非人不為去者，當知未得不退轉記。 是菩薩摩訶薩作此語時，若彼非人即為去者，當知已得不退轉記。 「復次，善現！
K05bsu049_u:8370	 ahaṃ vyākṛtaḥ taiḥ paurvakaistathāgatairarhadbhiḥ samyaksaṃbuddhairanuttarāyāṃ samyaksaṃbodhau,  tena satyena satyavacena ayamamanuṣyo 'pakrāmatviti /	T07n0220c_516:0650a12_2	『我若已從過去諸佛，受得無上正等菩提不退轉記，令是男子或此女人，不為非人之所擾惱，彼隨我語速當捨去。
K05bsu049_u:8372	 tatra subhūte māraḥ pāpīyānautsukyamāpatsyate tasya amanuṣyasyāpakramaṇāya /	T07n0220c_516:0650a13_12	』是菩薩摩訶薩作此語已，爾時惡魔為誑惑故，即便驅逼非人令去。
K05bsu049_u:8373	 tatkasya hetoḥ?	T07n0220c_516:0650a13_17	所以者何？
K05bsu049_u:8374	 māro hyatra pāpīyāṃstasya bodhisattvasya mahāsattvasya cirayānasaṃprasthitasyāntike balavattaraṃ tejovattaraṃ codyogamāpatsyate - kathamayamamanuṣyo 'pakrāmediti /  evaṃ so 'manuṣyo mārādhiṣṭhānenāpakramiṣyati /	T07n0220c_516:0650a15_2	惡魔威力勝彼非人，是故非人受魔教勅即便捨去。
K05bsu049_u:8376	 evaṃ ca tasya bodhisattvasya mahāsattvasya bhaviṣyati - mamaiṣo 'nubhāvena amanuṣyo 'pakrānta iti /	T07n0220c_516:0650a16_3	「是菩薩摩訶薩見此事已，歡喜踊躍作是念言： 『非人今去是吾威力。
K05bsu049_u:8377	 na punaḥ sa evaṃ jñāsyati - mārasyaiṣo 'nubhāvena amanuṣyo 'pakrānta iti /	T07n0220c_516:0650a16_18	所以者何？ 非人隨我所發誓願，即便放此男子、女人，無別緣故。 』是菩薩摩訶薩不能覺知惡魔所作，謂是己力妄生歡喜，恃此輕弄諸餘菩薩言：
K05bsu049_u:8722	 subhūtirāha - yadi bhagavan sarvadharmā viviktāḥ,	T07n0220c_516:0653c09_19	」爾時，善現復白佛言：
K05bsu049_u:8723	 sarvadharmāḥ śūnyāḥ,  kathaṃ bhagavan sattvānāṃ saṃkleśaḥ prajñāyate,  kathaṃ bhagavan sattvānāṃ vyavadānaṃ prajñāyate?  na ca bhagavan viviktaṃ saṃkliśyate,  na bhagavan viviktaṃ vyavadāyati /	T07n0220c_516:0653c12_3	「若一切法皆自性空、自性離者，即一切法一切法空，亦一切法一切法離，云何有情可得施設有染有淨？
K05bsu049_u:8728	 na ca bhagavan śūnyaṃ saṃkliśyate,  na ca bhagavan śūnyaṃ vyavadāyati /	T07n0220c_516:0653c13_2	非性空法有染有淨，亦非離法有染有淨；
K05bsu049_u:8730	 na ca bhagavan viviktaṃ vā śūnyaṃ vā anuttarāṃ samyaksaṃbodhimabhisaṃbudhyate /	T07n0220c_516:0653c14_9	非性空法能證無上正等菩提，亦非離法能證無上正等菩提；
K05bsu049_u:8731	 anyatrāpi bhagavan śūnyatāyāḥ sarvadharmo nopalabhyate,  yo 'nuttarāṃ samyaksaṃbodhimabhisaṃbuddho vā,  abhisaṃbhotsyate vā,	T07n0220c_516:0653c15_7	非性空中有法可得，亦非離中有法可得；
K05bsu049_u:8734	 abhisaṃbudhyate vā /  kathaṃ vā vayaṃ bhagavan asya bhāṣitasyārthamājānīmaḥ?  deśayatu bhagavan,  deśayatu sugata /	T07n0220c_516:0653c18_4	非性空中有菩薩摩訶薩證得無上正等菩提，亦非離中有菩薩摩訶薩證得無上正等菩提，云何令我解佛所說甚深義趣？
K05bsu049_u:8738	 evamukte bhagavānāyuṣmantaṃ subhūtimetadavocat - tatkiṃ manyase dīrgharātraṃ sattvā ahaṃkāre mamakāre caranti?  subhūtirāha - evametadbhagavan,  evametatsugata /	T07n0220c_516:0653c18_10	」佛告善現： 「於意云何？
K05bsu049_u:8741	 dīrgharātraṃ sattvā ahaṃkāre mamakāre caranti /	T07n0220c_516:0653c19_13	有情長夜有我、我所，心執我、我所不？
K05bsu049_u:8825	 na ca vivartante 'nuttarāyāḥ samyaksaṃbodheḥ /  yeṣāṃ ca dāyakānāṃ dānapatīnāṃ ca paribhuñjate cīvarapiṇḍapātaśayanāsanaglānapratyayabhaiṣajyapariṣkārān,	T07n0220c_516:0655a25_9	是菩薩摩訶薩雖未證得一切智智，而於無上正等菩提得不退轉故，到有情福田彼岸，堪受一切衣服、飲食、床座、醫藥、諸資生具。 善現當知！
K05bsu049_u:8827	 asyāṃ prajñāpāramitāyāṃ sūpasthitacittāḥ,  teṣāṃ dāyakānāṃ dānapatīnāṃ ca dānadakṣiṇāṃ viśodhayanti /  sarvajñatā caiṣāmāsannībhavati /	T07n0220c_516:0655a27_12	是菩薩摩訶薩常住般若波羅蜜多相應作意，故能究竟報施主恩，亦能親近一切智智。
K05bsu049_u:8830	 tasmāttarhi subhūte bodhisattvena mahāsattvena amoghaṃ rāṣṭraṃ piṇḍaṃ paribhoktukāmena	T07n0220c_516:0655a27_18	是故，善現！
