src_segmentnr	src_original	tgt_segmentnr	tgt_original
K06D0019=D0554_H0023=H0512:253b-15	ཆོས་ཐམས་ཅད་མཉམ་པ་ཉིད་ཀྱི་ཕྱིར་ཤེས་རབ་ཀྱི་ཕ་རོལ་ཏུ་ཕྱིན་པ་ཉིད་མཉམ་མོ་༎	T06n0220b_400:1071b06_6	一切法平等故，當知般若波羅蜜多亦平等。
K06D0019=D0554_H0023=H0512:253b-16	ཆོས་ཐམས་ཅད་ཟབ་པའི་ཕྱིར་ཤེས་རབ་ཀྱི་ཕ་རོལ་ཏུ་ཕྱིན་པ་ཟབ་བོ་༎ ཆོས་ཐམས་ཅད་དབེན་པའི་ཕྱིར་ཤེས་རབ་ཀྱི་ཕ་རོལ་ཏུ་ཕྱིན་པ་དབེན་ནོ་༎	T06n0220b_400:1071b07_6	一切法遠離故，當知般若波羅蜜多亦遠離。
K06D0019=D0554_H0023=H0512:253b-18	ཆོས་ཐམས་ཅད་ག-ཡོ་བ་མེད་པའི་ཕྱིར་ཤེས་རབ་ཀྱི་ཕ་རོལ་ཏུ་ཕྱིན་པ་ག-ཡོ་བ་མེད་དོ་༎ ཆོས་ཐམས་ཅད་རློམ་སེམས་མེད་པའི་ཕྱིར་ཤེས་རབ་ཀྱི་ཕ་རོལ་ཏུ་ཕྱིན་པ་རློ་མ་སེམས་མེད་དོ་༎	T06n0220b_400:1071b08_6	一切法不動故，當知般若波羅蜜多亦不動。 一切法無念故，當知般若波羅蜜多亦無念。
K06D0019=D0554_H0023=H0512:253b-20	ཆོས་ཐམས་ཅད་འཇིགས་པ་མེད་པའི་ཕྱིར་ཤེས་རབ་ཀྱི་ཕ་རོལ་ཏུ་ཕྱིན་པ་འཇིགས་པ་མེད་དོ་༎ ཆོས་ཐམས་ཅད་བག་ཚ་བ་མེད་པའི་ཕྱིར་ཤེས་རབ་ཀྱི་ཕ་རོལ་ཏུ་ཕྱིན་པ་བག་ཚ་བ་མེད་དོ་༎	T06n0220b_400:1071b10_6	一切法無畏故，當知般若波羅蜜多亦無畏。 一切法無懼故，當知般若波羅蜜多亦無懼。
K06D0019=D0554_H0023=H0512:253b-22	ཆོས་ཐམས་ཅད་རོ་གཅིག་པའི་ཕྱིར་ཤེས་རབ་ཀྱི་ཕ་རོལ་ཏུ་ཕྱིན་ཕ་རོལ་གཅིག་གོ་།	T06n0220b_400:1071b12_6	一切法一味故，當知般若波羅蜜多亦一味。
K06D0019=D0554_H0023=H0512:253b-23	ཆོས་ཐམས་ཅད་སྐྱེ་བ་མེད་པའི་ཕྱིར་ཤེས་རབ་ཀྱི་ཕ་རོལ་ཏུ་ཕྱིན་པ་སྐྱེ་བ་མེད་དོ་༎	T06n0220b_400:1071b13_6	一切法無際故，當知般若波羅蜜多亦無際。 一切法無生故，當知般若波羅蜜多亦無生。 一切法無滅故，當知般若波羅蜜多亦無滅。 太虛空無邊故，當知般若波羅蜜多亦無邊。 大海水無邊故，當知般若波羅蜜多亦無邊。 妙高山無邊故，當知般若波羅蜜多亦無邊。 妙高山嚴好故，當知般若波羅蜜多亦嚴好。 如太虛空無分別故，當知般若波羅蜜多亦無分別。
K06D0019=D0554_H0023=H0512:254a-2	གཟུགས་མུ་མེད་པའི་ཕྱིར་ཤེས་རབ་ཀྱི་ཕ་རོལ་ཏུ་ཕྱིན་པ་མུ་མེད་དོ་༎	T06n0220b_400:1071c02_10	聲、香、味、觸、法界無邊故，當知般若波羅蜜多亦無邊。 眼識界無邊故，當知般若波羅蜜多亦無邊； 耳、鼻、舌、身、意識界無邊故，當知般若波羅蜜多亦無邊。 眼觸無邊故，當知般若波羅蜜多亦無邊； 耳、鼻、舌、身、意觸無邊故，當知般若波羅蜜多亦無邊。
K06D0019=D0554_H0023=H0512:254a-3	དེ་བཞིན་དུ་ཚོར་བ་དང་། འདུ་ཤེས་དང་། འདུ་བྱེད་རྣམས་དང་། རྣམ་པར་ཤེས་པ་མུ་མེད་པའི་ཕྱིར་ཤེས་རབ་ཀྱི་ཕ་རོལ་ཏུ་ཕྱིན་པ་མུ་མེད་དོ་༎	T06n0220b_400:1071c08_3	眼觸為緣所生諸受無邊故，當知般若波羅蜜多亦無邊； 耳、鼻、舌、身、意觸為緣所生諸受無邊故，當知般若波羅蜜多亦無邊。
K06D0019=D0554_H0023=H0512:254a-4	སའི་ཁམས་མུ་མེད་པའི་ཕྱིར་ཤེས་རབ་ཀྱི་ཕ་རོལ་ཏུ་ཕྱིན་པ་མུ་མེད་དོ་༎	T06n0220b_400:1071c10_11	地界無邊故，當知般若波羅蜜多亦無邊；
