src_segmentnr	src_original	tgt_segmentnr	tgt_original
K06vchedppu:286	 evam etat subhūte evam etat subhūte paramāścaryasamanvāgatās te satvā bhaviṣyaṃti /  ya iha sūtre bhāṣyamāṇe śrutvā nottrasiṣyaṃti /  na saṃtrasiṣyaṃti /  na saṃtrāsam āpatsyaṃte /	K06D0016_H0018:224a-18	རབ་འབྱོར༏་དེ་དེ་བཞིན་ནོ་༎ དེ་དེ་བཞིན་ཏེ་། མདོ་འདི་བཤད་པ་འདི་ལ་གང་དག་མི་སྐྲག་མི་དང་བཞིང་དངང་བར་མི་འགྱུར་བའི་སེམས་ཅན་དེ་དག་ནི་། ངོ་མཚར་རབ་དང་ལྡན་པར་༄༢༢༤བ་འགྱུར་རོ་༎
K06vchedppu:290	 tat kasya hetoḥ /	K06D0016_H0018:224b-1	དེ་ཅིའི་ཕྱིར་ཞེ་ན་།
K06vchedppu:291	 paramapāramiteyaṃ subhūte tathāgatena bhāṣitā /	K06D0016_H0018:224b-2	རབ་འབྱོར་། ཕ་རོལ་ཏུ་ཕྱིན་པ་དམ་པ་འདི་ནི་། དེ་བཞིན་གཤེགས་པས་གསུངས་ཏེ་།
K06vchedppu:292	 yāṃ ca tathāgataḥ paramapāramitāṃ bhāṣate tām aparimāṇā buddhā bhagavaṃto bhāṣaṃte /	K06D0016_H0018:224b-4	ཕ་རོལ་ཏུ་ཕྱིན་པ་དམ་པ་གང་དག་དེ་བཞིན་གཤེགས་པས་གསུངས་པ་དེ༏་སངས་རྒྱས་བཅོམ་ལྡན་འདས་དཔག་ཏུ་མེད་པ་རྣམས་ཀྱིས་ཀྱང་གསུངས་པའི་ཕྱིར་ཏེ་།
K06vchedppu:293	 tenocyate paramapāramiteti /	K06D0016_H0018:224b-5	དེས་ན་། ཕ་རོལ་ཏུ་ཕྱིན་པ་དམ་པ་ཞེས་བྱའོ་༎
K06vchedppu:295	 api tu khalu punaḥ subhūte yā tathāgatasya kṣāṃtipāramitā saivāpāramitā /	K06D0016_H0018:224b-6	ཡང་རབ་འབྱོར་། དེ་བཞིན་གཤེགས་པའི་བཟོད་པའི་ཕ་རོལ་ཏུ་ཕྱིན་པ་གང་ཡིན་པ་དེ་ཉིད་ཕ་རོལ་ཏུ་ཕྱིན་པ་མེད་དོ་༎
K06vchedppu:296	 tat kasya hetoḥ /	K06D0016_H0018:224b-8	དེ་ཅིའི་ཕྱིར་ཞེ་ན་།
K06vchedppu:297	 yadā me subhūte kaliṃgarājā aṃgapratyaṃgāny acchetsīn nāsīn me tasmin samaye ātmasaṃjñā vā satvasaṃjñā vā jīvasaṃjñā vā pudgalasaṃjñā vā na me kācit saṃjñā nāsaṃjñā babhūva /	K06D0016_H0018:224b-9	རབ་འབྱོར་། གང་གི་ཚེ་ཀ་ལིངཀའི་རྒྱལ་པོས་ངའི་ཡན་ལག་དང་། ཉིང་ལག་རྣམ་པར་བཅད་པར་གྱུར་པ་དེའི་ཚེ་ང་ལ་བདག་ཏུ་འདུ་ཤེས་སམ་། སེམས་ཅན་དུ་འདུ་ཤེས་སམ་། སྲོག་ཏུ་འདུ་ཤེས་སམ་། གང་ཟག་ཏུ་འདུ་ཤེས་ཀྱང་མ་བྱུང་ཞིང་། ང་ལ་འདུ་ཤེས་ཅི་ཡང་མེད་ལ་། འདུ་ཤེས་མེད་པར་གྱུར་པ་ཡང་མ་ཡིན་པའི་ཕྱིར་རོ་༎
K06vchedppu:298	 tat kasya hetoḥ /	K06D0016_H0018:224b-15	དེ་ཅིའི་ཕྱིར་ཞེ་ན་།
K06vchedppu:299	 sacet subhūte mama tasmin samaye ātmasamjñābhaviṣyat /	K06D0016_H0018:224b-16	རབ་འབྱོར་། གལ་ཏེ་དེའི་ཚེ་བདག་ཏུ་འདུ་ཤེས་བྱུང་ན་།
K06vchedppu:3	 śrāvastyāṃ viharati sma /  jetavane /  anāthapiṇḍadasyārāme mahatā bhikṣusaṃghena sārdham ardhatrayodaśabhir bhikṣuśataiḥ /	K06D0016_H0018:215a-6	བཅོམ་ལྡན་འདས་མཉན་དུ་ཡོད་པ་ན་རྒྱལ་བུ་རྒྱལ་བྱེད་ཀྱི་ཚལ་མགོན་མེད་ཟས་སྦྱིན་གྱི་ཀུན་དགའ་ར་བ་ན་དགེ་སློང་སྟོང་ཉིས་བརྒྱ་ལྔ་བཅུའི་དགེ་སློང་གི་དགེ་འདུན་ཆེན་པོ་དང་། བྱང་ཆུབ་སེམས་དཔའ་སེམས་དཔའ་ཆེན་པོ་རབ་ཏུ་མང་པོ་དང་ཐབས་གཅིག་ཏུ་བཞུགས་ཏེ་།
K06vchedppu:300	 vyāpādasaṃjñāpi me 'bhaviṣyat tasmin samaye /	K06D0016_H0018:224b-17	དེའི་ཚེ་གནོད་སེམས་ཀྱི་འདུ་ཤེས་ཀྱང་འབྱུང་ལ་། སེམས་ཅན་དུ་འདུ་ཤེས་པ་དང་། སྲོག་ཏུ་འདུ་ཤེས་པ་དང་། གང་ཟག་ཏུ་འདུ་ཤེས་པ་བྱུང་ན་། དེའི་ཚེ་གནོད་སེམས་ཀྱི་འདུ་ཤེས་ཀྱང་འབྱུང་བའི་ཕྱིར་རོ་༎
K06vchedppu:301	 abhijānāmy ahaṃ subhūte atīte 'dhvani paṃca jātiśatāni yad ahaṃ kṣāṃtivādī riṣir abhū tadāpi me nātmasaṃjñā babhūva /	K06D0016_H0018:224b-20	རབ་འབྱོར་། ངས་མངོན་པར་ཤེས་ཏེ༏་འདས་པའི་དུས་ན་ང་ཚེ་རབས་ལྔ་བརྒྱར་བཟོད་པར་སྨྲ་བ་ཞེས་བྱ་བའི་དྲང་སྲོང་དུ་གྱུར་པ་དེ་ན་ཡང་ང་ལ་བདག་ཏུ་འདུ་ཤེས་མ་བྱུང་།
K06vchedppu:302	 na satvasaṃjñā na jīvasaṃjñā na pudgalasaṃjñā /	K06D0016_H0018:225a-0	སེམས་ཅན་དུ་འདུ་ཤེས་པ་དང་། སྲོག་ཏུ་འདུ་ཤེས་༄༢༢༥ཨ་༌༎ པ་དང་། གང་ཟག་ཏུ་འདུ་ཤེས་པ་མ་བྱུང་ངོ་༎
K06vchedppu:303	 tasmāt tarhi subhūte bodhisatvena mahāsatvena sarvasaṃjñā vivarjayitvānuttarāyāṃ samyaksaṃbodhau cittam utpādayitavyam /	K06D0016_H0018:225a-2	རབ་འབྱོར་། དེ་ལྟ་བས་ན་། བྱང་ཆུབ་སེམས་དཔའ་སེམས་དཔའ་ཆེན་པོས་འདུ་ཤེས་ཐམས་ཅད་རྣམ་པར་སྤངས་ཏེ་བླ་ན་མེད་པ་ཡང་དག་པར་རྫོགས་པའི་བྱང་ཆུབ་ཏུ་སེམས་བསྐྱེད་པར་བྱའོ་༎
K06vchedppu:304	 na rūpapratiṣṭhitaṃ cittam utpādayitavyam /	K06D0016_H0018:225a-4	གཟུགས་ལ་མི་གནས་པར་སེམས་བསྐྱེད་པར་བྱའོ་༎
K06vchedppu:305	 na śabdagandharasaspraṣṭavyapratiṣṭhitaṃ cittam utpādayitavyam /	K06D0016_H0018:225a-5	སྒྲ་དང་། དྲི་དང་། རོ་དང་། རེག་བྱ་དང་། ཆོས་ལའང་མི་གནས་པར་སེམས་བསྐྱེད་པར་བྱའོ་༎
K06vchedppu:306	 na dharmapratiṣṭhitaṃ cittam utpādayitavyam /  nādharmapratiṣṭhitaṃ cittam utpādayitavyam /	K06D0016_H0018:225a-6	ཆོས་མེད་པ་ལའང་མི་གནས་པར་སེམས་བསྐྱེད་པར་བྱའོ་༎
K06vchedppu:308	 na kvacitpratiṣṭhitaṃ cittam utpādayitavyam /	K06D0016_H0018:225a-7	ཅི་ལའང་མི་གནས་པར་སེམས་བསྐྱེད་པར་བྱའོ་༎
K06vchedppu:309	 tat kasmād dhetoḥ /	K06D0016_H0018:225a-8	དེ་ཅིའི་ཕྱིར་ཞེ་ན་།
K06vchedppu:310	 yat pratiṣṭhitaṃ tad evāpratiṣṭhitaṃ /	K06D0016_H0018:225a-9	གནས་པ་གང་ཡིན་པ་དེ་ཉིད་མི་གནས་པའི་ཕྱིར་ཏེ་།
K06vchedppu:311	 tasmād eva tathāgato bhāṣate rūpāpratiṣṭhitena dānaṃ dātavyam /	K06D0016_H0018:225a-10	དེ་བས་ན་། དེ་བཞིན་གཤེགས་པས་འདི་སྐད་དུ་། བྱང་ཆུབ་སེམས་དཔས་མི་གནས་པར་སྦྱིན་པ་སྦྱིན་པར་བྱའོ་༎
K06vchedppu:313	 api tu khalu punaḥ subhūte bodhisatvenaivaṃ dānaparityāgaḥ parityajyaḥ sarvasatvānām arthāya /	K06D0016_H0018:225a-14	ཡང་རབ་འབྱོར་། བྱང་ཆུབ་སེམས་དཔས་འདི་ལྟར་སེམས་ཅན་ཐམས་ཅད་ཀྱི་དོན་གྱི་ཕྱིར་སྦྱིན་པ་ཡོངས་སུ་གཏང་བར་བྱའོ་༎
K06vchedppu:314	 yaiva ca satvasaṃjñā sa evāsaṃjñā /  ya eva te sarvasatvāḥ tathāgatena bhāṣitāḥ ta evāsatvāḥ /	K06D0016_H0018:225a-16	སེམས་ཅན་དུ་འདུ་ཤེས་པ་གང་ཡིན་པ་དེ་ཉིད་ཀྱང་འདུ་ཤེས་མེད་པ་སྟེ་། དེ་བཞིན་གཤེགས་པས་སེམས་ཅན་ཐམས་ཅད་ཅེས་གང་གསུངས་པ་དེ་བདག་ཉིད་ཀྱང་མེད་པའོ་༎ དེ་ཅིའི་ཕྱིར་ཞེ་ན་།
K06vchedppu:316	 bhūtavādī subhūte tathāgataḥ satyavādī tathāvādī tathāgato na vitathāvādī tathāgato /	K06D0016_H0018:225a-19	རབ་འབྱོར་། དེ་བཞིན་གཤེགས་པ་ནི་། ཡང་དག་པར་གསུང་པ་། བདེན་པར་གསུང་བ་། དེ་བཞིན་ཉིད་དུ་གསུང་བ་སྟེ་། དེ་བཞིན་གཤེགས་པ་ནི་། མ་ནོར་བ་དེ་བཞིན་ཉིད་གསུང་བའི་ཕྱིར་རོ་༎
K06vchedppu:318	 api tu khalu punaḥ subhūte yaḥ tathāgatena dharmo 'bhisaṃbuddho deśito vā na tatra satyaṃ na mṛṣā /	K06D0016_H0018:225b-1	དེ་བཞིན་གཤེགས་པས་ཆོས་གང་མངོན་པར་རྫོགས་པར་སངས་རྒྱས་པའམ་། བསྟན་པ་དེ་ལ་ནི་། བདེན་པ་ཡང་མེད་། རྫུན་པ་ཡང་མེད་དོ་༎
K06vchedppu:319	 tad yathāpi nāma subhūte puruṣo 'ndhakārapraviṣṭaḥ /	K06D0016_H0018:225b-5	རབ་འབྱོར་། འདི་ལྟ་སྟེ༏་དཔེར་ན་།
K06vchedppu:320	 evaṃ vastupatito bodhisatvo draṣṭavyo yo vastupatitaṃ dānaṃ parityajati /	K06D0016_H0018:225b-6	མིག་དང་ལྡན་པའི་མི་ཞིག་མུན་པར་ཞུགས་ན་ཅི་ཡང་མི་མཐོང་བ་དེ་བཞིན་དུ་གང་དངོས་པོར་ལྷུང་བས་སྦྱིན་པ་ཡོངས་སུ་གཏོང་བའི་བྱང་ཆུབ་སེམས་དཔར་བལྟའོ༏་༏རབ་འབྱོར་།
K06vchedppu:321	 tad yathāpi nāma subhūte cakṣuṣmān puruṣo vibhātāyāṃ rātryāṃ sūrye 'bhyudgate nānāvidhāni rūpāṇi paśyet /  evaṃ bodhisatvo draṣṭavyo yo vastvapatitaṃ dānaṃ parityajati /  Vaj 14h; folio 43r6-v3 (Cz 42.20-43.7; P 185.14-18)	K06D0016_H0018:225b-7	འདི་ལྟ་སྟེ་། དཔེར་ན་། ནམ་ལངས་ཏེ་ཉི་མ་ཤར་ནས་མིག་དང་ལྡན་པའི་མིས་གཟུགས་རྣམ་པ་སྣ་ཚོགས་དག་མཐོང་བ་དེ་བཞིན་དུ་གང་དངོས་པོར་མ་ལྷུང་བས་སྦྱིན་པ་ཡོངས་སུ་གཏོང་བའི་བྱང་ཆུབ་སེམས་དཔར་བལྟའོ་༎ ཡང་རབ་འབྱོར་།
K06vchedppu:324	 api tu khalu punaḥ subhūte ye kulaputrā vā kuladuhitaro vā imaṃ dharmaparyāyam udgrahīṣyaṃti /  dhārayiṣyaṃti /  vācayiṣyaṃti /  paryavāpsyaṃti /	K06D0016_H0018:225b-10	རིགས་ཀྱི་བུའམ་། རིགས་ཀྱི་བུ་མོ་གང་དག་ཆོས་ཀྱི་རྣམ་གྲངས་འདི་ལེན་པ་དང་། འཛིན་པ་དང་། ཀློག་པ་དང་། ཀུན་ཆུབ་པར་བྱེད་པ་དང་། གཞན་དག་ལ་ཡང་རྒྱ་ཆེར་ཡང་དག་པར་རབ་ཏུ་སྟོན་པ་དེ་དག་ནི་།
K06vchedppu:328	 jñātās te subhūte tathāgatena dṛṣṭās te subhūte tathāgatena buddhās te tathāgatena /	K06D0016_H0018:225b-12	དེ་བཞིན་གཤེགས་པས་མཁྱེན་། དེ་དག་ནི་། དེ་བཞིན་གཤེགས་པས་གཟིགས་ཏེ་།
K06vchedppu:329	 sarve te satvāḥ aprameyaṃ puṇyaskandhaṃ prasaviṣyaṃti /	K06D0016_H0018:225b-15	སེམས་ཅན་དེ་དག་ཐམས་ཅད་ནི་། བསོད་ནམས་ཀྱི་ཕུང་པོ་དཔག་ཏུ་མེད་པ་བསྐྱེད་པར་འགྱུར་རོ་༎
K06vchedppu:330	 Vaj 15a; folio 43v3-44r5 (Cz 43.8-19; P 185.18-186.4)  yaś ca khalu punaḥ subhūte strī vā puruṣo vā pūrvāhṇakālasamaye gaṃgānadīvālukopamān ātmabhāvān parityajet /  madhyāhṇakālasamaye sāyāhṇakālasamaye gaṃgānadīvālukopamān ātmabhāvān parityajet /	K06D0016_H0018:225b-17	ཡང་རབ་འབྱོར་། སྐྱེས་པའམ་། བུད་མེད་གང་ཞིག་སྔ་དྲོའི་དུས་ཀྱི་ཚེ་ལུས་གངགའའི་ཀླུང་གི་བྱེ་མ་སྙེད་ཡོངས་སུ་གཏོང་ལ་། ཕྱེད་ཀྱི་དུས་དང་། ཕྱི་དྲོའི་དུས་ཀྱི་ཚེ་ཡང་ལུས་གངགའའི་ཀླུང་གི་བྱེ་མ་སྙེད་ཡོངས་སུ་གཏོང་སྟེ་།
K06vchedppu:334	 yaś cemaṃ dharmaparyāyaṃ śrutvā /  na pratikṣiped ayam eva tatonidānaṃ bahutaraṃ puṇyaskandhaṃ prasunuyāt /  aprameyam asaṃkhyeyam /	K06D0016_H0018:226a-2	གང་གིས་ཆོས་ཀྱི་རྣམ་གྲངས་འདི་ཐོས་ནས་མི་སྤོང་ན་། དེ་ཉིད་གཞི་དེ་ལས་བསོད་ནམས་ཆེས་མང་དུ་གྲངས་མེད་དཔག་ཏུ་མེད་པ་བསྐྱེད་ན་།
K06vchedppu:337	 kaḥ punar vādaḥ yo Iikhitvodgṛhṇīyāt /  dhārayet /  vācayet /  paryavāpnuyāt /  parebhyaś ca vistareṇa saṃprakāśayet /  Vaj 15b; folio 44r5-45r4 (Cz 43.19-44.13; G 7al-2; P 186.5-17)	K06D0016_H0018:226a-4	གང་གིས་ཡི་གེར་བྲིས་ནས་ལེན་པ་དང་། འཛིན་པ་དང་། ཀློག་པ་དང་། ཀུན་ཆུབ་པར་བྱེད་པ་དང་། གཞན་དག་ལ་ཡང་རྒྱ་ཆེར་ཡང་དག་པར་རབ་ཏུ་སྟོན་པ་ལྟ་ཅི་སྨོས་།
K06vchedppu:343	 api tu subhūte aciṃtyo 'tulyo 'yaṃ dharmaparyāyaḥ /	K06D0016_H0018:226a-5	ཡང་རབ་འབྱོར་། ཆོས་ཀྱི་རྣམ་གྲངས་འདི་ནི་། བསམ་གྱིས་མི་ཁྱབ་ཅིང་མཚུངས་པ་མེད་དེ་།
K06vchedppu:344	 ayaṃ ca dharmaparyāyaḥ tathāgatena bhāṣitaḥ agrayānasaṃprasthitānāṃ satvānām arthāya /  śreṣṭhayānasaṃprasthitānāṃ satvānām arthāya /	K06D0016_H0018:226a-8	ཆོས་ཀྱི་རྣམ་གྲངས་འདི་ནི༏་ཐེག་པ་མཆོག་ལ་ཡང་དག་པར་ཞུགས་པའི་སེམས་ཅན་རྣམས་ཀྱི་དོན་དང་། ཐེག་པ་ཕུལ་དུ་ཕྱིན་པ་ལ་ཡང་དག་པར་ཞུགས་པའི་སེམས་ཅན་རྣམས་ཀྱི་དོན་གྱི་ཕྱིར་དེ་བཞིན་གཤེགས་པས་གསུངས་སོ་༎
K06vchedppu:346	 ye imaṃ dharmaparyāyam udgrahīṣyaṃti /  dhārayiṣyaṃti /  vācayiṣyaṃti /  paryavāpsyaṃti /	K06D0016_H0018:226a-9	གང་དག་ཆོས་ཀྱི་རྣམ་གྲངས་འདི་ལེན་པ་དང་། འཛིན་པ་དང་། ཀློག་པ་དང་། ཀུན་ཆུབ་པར་བྱེད་པ་དང་། གཞན་དག་ལ་ཡང་རྒྱ་ཆེར་ཡང་དག་པར་རབ་ཏུ་སྟོན་པ་དེ་དག་ནི་།
K06vchedppu:350	 jñātās te subhūte tathāgatena dṛṣṭās te subhūte tathāgatena /	K06D0016_H0018:226a-10	དེ་བཞིན་གཤེགས་པས་མཁྱེན་། དེ་བཞིན་གཤེགས་པས་གཟིགས་ཏེ་།
K06vchedppu:351	 sarve te satvāḥ aprameyeṇa puṇyaskandhena samanvāgatā bhaviṣyaṃti /	K06D0016_H0018:226a-13	སེམས་ཅན་དེ་དག་ཐམས་ཅད་ནི་། བསོད་ནམས་ཀྱི་ཕུང་པོ་དཔག་ཏུ་མེད་པ་དང་ལྡན་པར་འགྱུར་རོ་༎
K06vchedppu:352	 aciṃtyenātulyenāmāpyenāparimāṇena puṇyaskandhena samanvāgatā bhaviṣyaṃti /	K06D0016_H0018:226b-0	བསོད་ནམས་ཀྱི་ཕུང་པོ་བསམ་གྱིས་མི་ཁྱབ་པ་དང་། མཚུངས་པ་མེད་པ་དང་། གཞལ་དུ་མེད་པ་དང་། ཚད་མེད་པ་དང་ལྡན་༄༢༢༦བ་པར་འགྱུར་ཏེ་།
K06vchedppu:353	 tat kasya hetoḥ /	K06D0016_H0018:226b-2	དེ་ཅིའི་ཕྱིར་ཞེ་ན་།
K06vchedppu:354	 na hi śakyaṃ subhūte ayaṃ dharmo hīnādhimuktikaiḥ śrotum /	K06D0016_H0018:226b-3	རབ་འབྱོར་། དམན་པ་ལ་མོས་པ་རྣམས་ཀྱིས་ཆོས་ཀྱི་རྣམ་གྲངས་འདི་མཉན་པར་མི་ནུས་ཏེ་།
K06vchedppu:355	 nātmadṛṣṭikaiḥ na satvadṛṣṭikaiḥ na jīvadṛṣṭikaiḥ na pudgaladṛṣṭikaiḥ śakyaṃ śrotum udgrahītuṃ vā dhārayituṃ vā vācayituṃ vā paryavāptuṃ vā nedaṃ sthānaṃ vidyate /  Vaj 15c; folio 45r4-v2 (Cz 44.13-18; G 7a2-3; P 186.17-20)	K06D0016_H0018:226b-4	བདག་ཏུ་ལྟ་བ་རྣམས་ཀྱིས་མ་ཡིན་། སེམས་ཅན་དུ་ལྟ་བ་རྣམས་ཀྱིས་མ་ཡིན་། སྲོག་ཏུ་ལྟ་བ་རྣམས་ཀྱིས་མ་ཡིན་ཞིང་། གང་ཟག་ཏུ་ལྟ་བ་རྣམས་ཀྱིས་མཉན་པ་དང་། བླང་བ་དང་། གཟུང་བ་དང་། ཀློག་པ་དང་། ཀུན་ཆུབ་པར་བྱེད་མི་ནུས་ཏེ་། དེ་ནི་། གནས་མེད་པའི་ཕྱིར་རོ་༎
K06vchedppu:358	 pūjanīyaḥ sa pṛthivīpradeśo bhaviṣyati /  sadevamānuṣāsurasya lokasya vandanīyaḥ pradakṣiṇīkaraṇīyaś ca sa pṛthivīpradeśo bhaviṣyati /	K06D0016_H0018:226b-10	ས་ཕྱོགས་གང་ན་མདོ་སྡེ་འདི་སྟོན་པའི་ས་ཕྱོགས་དེ་། ལྷ་དང་། མི་དང་། ལྷ་མ་ཡིན་དུ་བཅས་པའི་འཇིག་རྟེན་གྱིས་མཆོད་པར་འོས་པར་འགྱུར་རོ་༎ ས་ཕྱོགས་དེ་ཕྱག་བྱ་བར་འོས་པ་དང་། བསྐོར་བ་བྱ་བར་འོས་པར་ཡང་འགྱུར་རོ་༎
K06vchedppu:36	 sacet subhūte bodhisatvasya satvasaṃjñā pravartate na sa bodhisatva iti vaktavyaḥ /	K06D0016_H0018:216b-15	རབ་འབྱོར་། གལ་ཏེ་བྱང་ཆུབ་སེམས་དཔའ་སེམས་ཅན་དུ་འདུ་ཤེས་འཇུག་ན་། དེ་བྱང་ཆུབ་སེམས་དཔའ་ཞེས་མི་བྱ་བའི་ཕྱིར་རོ་༎
K06vchedppu:360	 caitya sa pṛthivīpradeśo bhaviṣyati /	K06D0016_H0018:226b-13	ས་ཕྱོགས་དེ་ནི་། མཆོད་རྟེན་ལྟ་བུར་འགྱུར་རོ་༎
K06vchedppu:361	 Vaj 16a; folio 45v2-46rl (Cz 44.18-45.6; G 7a3-5; P 186.20-187.3)  ye te subhūte kulaputrā vā kuladuhitaro vā imān evaṃrūpāṃ sūtrāṃtān udgrahīsyaṃti dhārayiṣyaṃti paryavāpsyaṃti /	K06D0016_H0018:226b-15	རབ་འབྱོར་། རིགས་ཀྱི་བུའམ་རིགས་ཀྱི་བུ་མོ་གང་དག་འདི་ལྟ་བུའི་མདོ་སྡེའི་ཚིག་འདི་དག་ལེན་པ་དང་། འཛིན་པ་དང་། ཀློག་པ་དང་། ཀུན་ཆུབ་པར་བྱེད་པ་དེ་དག་ནི་།
K06vchedppu:363	 te paribhūtā bhaviṣyaṃti suparibhūtāś ca bhaviṣyaṃti / //	K06D0016_H0018:226b-16	མནར་བར་འགྱུར་། ཤིན་ཏུ་མནར་བར་འགྱུར་རོ་༎
K06vchedppu:364	 yāni teṣāṃ satvānāṃ paurvajanmikāni karmāṇi kṛtāny apāyasaṃvartanīyāni dṛṣṭa eva dharme paribhūtatayā pūrvajanmikāny aśubhāni karmāṇi kṣapayiṣyaṃti	K06D0016_H0018:226b-18	དེ་ཅིའི་ཕྱིར་ཞེ་ན་། རབ་འབྱོར་། སེམས་ཅན་དེ་དག་གིས་ཚེ་རབས་སྔ་མའི་མི་དགེ་བའི་ལས་ངན་སོང་དུ་སྐྱེ་བར་འགྱུར་བ་གང་དག་བྱས་པ་དག་ཚེ་འདི་ཉིད་ལ་མནར་བས་། ཚེ་རབས་སྔ་མའི་མི་དགེ་བའི་ལས་དེ་དག་འབྱང་བར་འགྱུར་ཏེ་།
K06vchedppu:365	 buddhabodhiṃ ca prāpsyaṃti /	K06D0016_H0018:227a-0	སངས་རྒྱས་ཀྱི་བྱང་༄༢༢༧ཨ་༌༎ ཆུབ་ཀྱང་འཐོབ་པར་འགྱུར་བའི་ཕྱིར་རོ་༎
K06vchedppu:366	 Vaj 16b; folio 46rl-v4 (Cz 45.6-46.6; G 7a5-7b3; P 187.3-187.13)  abhijānāmy ahaṃ subhūte atīte 'dhvani asaṃkhyeye kalpe asaṃkhyeyatare dīpaṃkarasya	K06D0016_H0018:227a-2	རབ་འབྱོར་། ངས་མངོན་པར་ཤེས་ཏེ་། འདས་པའི་དུས་བསྐལ་པ་གྲངས་མེད་པའི་ཡང་ཆེས་གྲངས་མེད་པ་ན་།
K06vchedppu:368	 tathāgatasyārhataḥ samyaksaṃbuddhasya pareṇa parataraṃ caturaśītibuddhakoṭīnayutaśatasahasrāṇy	K06D0016_H0018:227a-5	སངས་རྒྱས་བྱེ་བ་ཁྲག་ཁྲིག་འབུམ་ཕྲག་བརྒྱད་ཅུ་རྩ་བཞི་དག་བྱུང་བ་ངས་མཉེས་པར་བྱས་ཏེ་།
K06vchedppu:369	 abhūvan ye mayā ārādhitā ārādhayetvā na virādhitā /	K06D0016_H0018:227a-6	མཉེས་པར་བྱས་ནས་ཐུགས་མ་ཕྱུང་བར་བྱས་ཏེ་།
K06vchedppu:37	 tat kasya hetoḥ /	K06D0016_H0018:216b-17	དེ་ཅིའི་ཕྱིར་ཞེ་ན་།
K06vchedppu:370	 yac ca mayā subhūte buddhā bhagavaṃtaḥ ārāgitā ārāgayetvā na virāgitā yac ca carime  kāle paścimikāyaṃ paṃcāśatyāṃ vartamānāyām imaṃ sūtrāṃtam udgrahīṣyaṃti dhārayiṣyaṃti	K06D0016_H0018:227a-7	རབ་འབྱོར་། སངས་རྒྱས་བཅོམ་ལྡན་འདས་དེ་དག་ངས་མཉེས་པར་བྱས་ནས་ཐུགས་བྱུང་བར་མ་བྱས་པ་གང་ཡིན་པ་དང་། ཕྱི་མའི་དུས་ལྔ་བརྒྱ་ཐ་མར་གྱུར་པ་ན་།
K06vchedppu:372	 vācayiṣyaṃti paryavāpsyaṃti /	K06D0016_H0018:227a-8	མདོ་སྡེ་འདི་ལེན་པ་དང་། འཛིན་པ་དང་། ཀློག་པ་དང་། ཀུན་ཆུབ་པར་བྱེད་པ་གང་ཡིན་པ་ལས་།
K06vchedppu:373	 asya subhūte puṇyaskandhasyāṃtikād eṣa pūrvakaḥ puṇyaskandhaḥ śatatamīm api kalāṃ nopaiti sāhasṛtamām api /	K06D0016_H0018:227a-9	རབ་འབྱོར་། བསོད་ནམས་ཀྱི་ཕུང་པོ་འདི་ལ་བསོད་ནམས་ཀྱི་ཕུང་པོ་སྔ་མས་བརྒྱའི་ཆར་ཡང་མི་ཕོད་།
