src_segmentnr	src_original	tgt_segmentnr	tgt_original
K10ayuhparu:313	 Āps 45. brahmakāyikānāṃ bhikṣavo devānām ardhakalpa āyuṣaḥ pramāṇam, (GBM 1701.5)  asty antareṇa kālakriyā.  Āps 46. brahmapurohitānāṃ bhikṣavo devānāṃ kalpa āyuṣaḥ pramāṇam,  asty antareṇa kālakriyā.  Āps 47. mahābrahmāṇāṃ bhikṣavo devānām adhyardhakalpa //  addhyardhakalpa//	T01n0023_004:0296c07_1	忉利天人，壽天上千歲，亦復有中夭者；
K10ayuhparu:320	 asty antareṇa kālakriyā.  Āps 48. parīttābhānāṃ bhikṣavo devānāṃ dvau kalpāv āyuṣaḥ pramāṇam. asty antareṇa kālakriyā.  Āps 49. apramāṇābhānāṃ bhikṣavo devānāṃ (GBM 1701.7)  catvāraḥ kalpā āyuṣaḥ pramāṇam,  asty antareṇa kālakriyā.  Āps 50. ābhāsvarāṇāṃ bhikṣavo devānām aṣṭau kalpā āyuṣaḥ pramāṇam,	T01n0023_004:0296c08_2	焰天上諸天人，壽天上二千歲，亦有中夭者；
K10ayuhparu:327	 Āps 51. parīttāśubhānāṃ (GBM 1700.1)  bhikṣavo devānāṃ ṣoḍaśa kalpā āyuṣaḥ pramāṇam,  asty antareṇa kālakriyā.  Āps 52. apraṃāṇaśubhānāṃ bhikṣavo devānāṃ dvātriṃśat kalpā āyuṣaḥ pramāṇam,  asty antareṇa kālakriyā.  Āps 53. (GBM 1700.2) śubhakṛtsnānāṃ bhikṣavo devānāṃ catuḥṣaṣṭiḥ kalpā āyuṣaḥ pramāṇam,	T01n0023_004:0296c09_3	兜率天上諸天人，壽天上四千歲，亦有中夭者；
K10ayuhparu:333	 asty antareṇa kālakriyā.  Āps 54. anabhrakāṇāṃ bhikṣavo devānāṃ paṃcaviṃśaty adhikaṃ kalpaśatam āyuṣaḥ pramāṇam, asty (GBM 1700.3)  antareṇa kālakriyā.  Āps 55. puṇyaprasavānāṃ bhikṣavo devānām ardhatritīyāni kalpaśatāny āyuṣaḥ pramāṇam,  asty antareṇa kālakriyā.	T01n0023_004:0296c10_4	樂無貢高諸天人，壽天上八千歲，亦有中夭者；
K10ayuhparu:338	 Āps 56. bṛhatphalānāṃ bhikṣavo devānāṃ (GBM 1700.4)  paṃca kalpaśatāny āyuṣaḥ pramāṇam,  asty antareṇa kālakriyā.  Āps 57. tathaivāsaṃjñāsatvānāṃ paṃca kalpaśatāny āyuṣaḥ pramāṇam,  asty antareṇa kālakriyā.  Āps 58. abṛhānāṃ (GBM 1700.5)  bhikṣavo devānāṃ kalpasahasram āyuṣaḥ pramāṇam,	T01n0023_004:0296c11_9	他化自轉天上諸天人，壽天上萬六千歲，亦有中夭者；
K10ayuhparu:346	 Āps 59. atapānāṃ bhikṣavo devānāṃ dve kalpasahasre āyuṣaḥ pramāṇam,  asty antareṇa (GBM 1700.6) kālakriyā.  Āps 60. sudṛśānāṃ bhikṣavo devānāṃ catvāri kalpasahasrāṇy āyuṣaḥ pramāṇam,  asty antareṇa kālakriyā.  Āps 61. sudarśanānāṃ bhikṣavo devānām aṣṭau kalpasahasrāṇy āyuṣaḥ (GBM 1700.7)	T01n0023_004:0296c12_7	梵迦夷天上諸天人，壽一劫，亦有中夭；
K10ayuhparu:351	 pramāṇam, asty antareṇa kālakriyā.  Āps 62. akaniṣṭhānāṃ bhikṣavo devānāṃ ṣoḍaśa kalpasahasrāṇy āyuṣaḥ pramāṇam,  asty antareṇa kālakriyā.  Āps 63. ākāśānantyāyatanopagānāṃ bhikṣavo devānāṃ viṃśatiḥ kalpasahasrāṇy āyuṣaḥ pramāṇam,  asty antareṇa kālakriyā.	T01n0023_004:0296c13_7	阿波波天上諸天人，壽二劫，亦有中夭者；
K10ayuhparu:356	 Āps 64. vijñānānantyāyatanānāṃ bhikṣavo devānāṃ catvāriṃśat kalpasahasrāṇy āyuṣaḥ pramāṇam,  asty antareṇa kālakriyā.  Āps 65. ākiṃcanyāyatanānāṃ bhikṣavo devānāṃ ṣaṣṭiḥ kalpasahasrāṇy āyuṣaḥ pramāṇam,  asty antareṇa kālakriyā.  Āps 66. naivasaṃjñānāsaṃjñāyatanānāṃ bhikṣavo devānām aśītiḥ kalpasahasrāṇy āyuṣaḥ pramāṇam,	T01n0023_004:0296c14_5	首陀行天上諸天人，壽四劫，亦有中夭者；
