src_segmentnr	src_original	tgt_segmentnr	tgt_original
K10dvavims_tu:1119	 apāyadvārāṇi pihitāni svargadvārāṇi pratiṣṭhāpitāni //	K01D0006_H0006:74b-12	བསྒྲལ་། ངན་སོང་གི་སྒོ་དག་ནི་། བཀུམ་། མཐོ་རིས་དང་། ཐར་པའི་སྒོ་དག་ནི་། ཕྱེ་། སེམས་ཅན་དམྱལ་བ་དང་། དུད་འགྲོ་དང་། ཡི་དབ༹གས་དག་ནས་ནི་། རྐང་པ་ཕྱུང་། ལྷ་དང་། མི་རྣམས་ཀྱི་ནང་དུ་ནི་། བཞག་གོ་། ཞེས་ལན་གསུམ་ཆེད་དུ་བརྗོད་པ་ཆེད་དུ་བརྗོད་དོ་༎
K10dvavims_tu:1120	 tavānubhāvāt pihitaḥ sughoro hy apāyamārgo bahudoṣayuktaḥ /	K01D0006_H0006:74b-18	ཡང་སྨྲས་པ་། ཁྱོད་མཐུས་རབ་དྲག་ཉེས་པ་མང་ལྡན་པའི་༎
K10dvavims_tu:1121	 apāvṛtā svargagatiḥ supuṇyā nirvāṇamārgaś ca mayopalabdhaḥ // Dak_8.60 //	K01D0006_H0006:74b-21	མཐོ་རིས་འགྲོ་བ་ཕྱེ་ཞིང་བདག་གིས་ནི་༎ མྱ་ངན་འདས་པའི་ཤུལ་ཡང་ཐོབ་པར་གྱུར་༎
K10dvavims_tu:1122	 tvadāśrayāc cāptam apetadoṣaṃ nāv adya labdhaṃ suviśuddhacakṣuḥ /	K01D0006_H0006:74b-23	ཤིན་ཏུ་རྣམ་དག་ཁྱོད་བརྟེན་བདག་གིས་ནི་༎
K10dvavims_tu:1123	 prāptaṃ ca śāntaṃ padam āryakāntaṃ tīrṇaṃ ca duḥkhārṇavapāram asmin //	K01D0006_H0006:74b-24	དེ་རིང་སྐྱོན་བྲལ་དག་པའི་མིག་ཐོབ་ཅིང་༎ གོ་འཕང་ཞི་བ་འཕགས་པ་དགྱེས་ཐོབ་སྟེ་། སྡུག་བསྔལ་རྒྱ་མཚོའི་ཕ་རོལ་བརྒལ་བར་གྱུར་༎
K10dvavims_tu:1124	 naravarendra narāmarapūjita vigatajanmajarāmaraṇāmaya /	K01D0006_H0006:74b-27	འགྲོ་བ་ལྷ་མིན་མི་དང་ལྷས་མཆོད་པ་༎ སྐྱེ་དང་རྒ་དང་ན་འཆི་བྲལ་བ་པོ་༎
K10dvavims_tu:1125	 bhavaśahasrasudurlabhadarśana saphalam adya mune tava darśanam // Dak_8.62 //	K01D0006_H0006:74b-29	སྲིད་པ་སྟོང་དུ་མཐོང་བ་རབ་དཀོན་པ་༎
K10dvavims_tu:3331	 tato vastradāyikā devakanyā calavimalakuṇḍaladharā hārārdhahāravibhūṣitagātrā maṇiratnacitracūḍā	K01D0006_H0006:74a-4	སྙམ་མོ་༎ དེ་ནས་སྔོན་དགེ་སློང་ལྷའི་བུ་རྣ་ཆ་གདུབ་ཀོར་ག-ཡོ་ཞིང་དྲི་མ་མེད་པ་ཐོགས་ཏེ་དོ་ཤལ་དང་། སེ་མོ་དོས་བརྒྱན་པའི་ལུས་ཀྱིས་ལྷའི་མེ་ཏོག་ཨཽཏཔ་ལ་དང་། པདམ་དང་། ཀུ་མུ་དང་། པདམ་དཀར་པོ་དང་།
K10dvavims_tu:3332	 kuṅkumatamālapattraspṛkkādisaṃmṛṣṭagātrā tām eva rātriṃ divyānām utpalapadmakumudapunḍarīkamandārakāṇāṃ  puṣpāṇām utsaṅgaṃ pūrayitvā sarvaṃ jetavanam udāreṇāvabhāsenāvabhāsya bhagavantaṃ  puṣpair avakīrya bhagavataḥ purastān niṣaṇṇā dharmaśravaṇāya //	K01D0006_H0006:74a-5	མན་དའ་ར་བ་དག་གིས་ཐུ་བ་བཀང་སྟེ་ཁ་དོག་ཤིན་ཏུ་འདས་པས༏་མཚན་མོ་ལ་བབ་པ་དང་། བཅོམ་ལྡན་འདས་ག་ལ་བ་དེར་སོང་སྟེ་ཕྱིན་ནས་བཅོམ་ལྡན་འདས་ལ་མེ་ཏོག་དག་གིས་མངོན་པར་གཏོར་ཏེ་བཅོམ་ལྡན་འདས་ཀྱི་ཞབས་གཉིས་ལ་མགོ་བོས་ཕྱག་འཚལ་ནས་མཐའ་གཅིག་ཏུ་འདུག་པ་དང་། འདི་ལྟར་སྔོན་དགེ་སློང་ལྷའི་བུའི་ཁ་དོག་གི་མཐུས་རྒྱལ་བྱེད་ཀྱི་ཚལ་ཐམས་ཅད་སྣང་བ་རྒྱ་ཆེན་པོས་ཁྱབ་པར་གྱུར་ཏོ་༎
K10dvavims_tu:3335	 atha bhagavān paṭapradāyikāyā devakanyāyā āśayānuśayaṃ dhātuṃ prakṛtiṃ ca jñatva	K01D0006_H0006:74a-7	དེ་ནས་བཅོམ་ལྡན་འདས་ཀྱིས་སྔོན་དགེ་སློང་ལྷའི་བུའི་བསམ་པ་དང་། བག་ལ་ཉལ་བ་དང་། ཁམས་དང་རང་བཞིན་ཐུགས་སུ་ཆུད་ནས་གང་ཐོས་ནས་སྔོན་དགེ་སློང་ལྷའི་བུས་སྟན་དེ་ཉིད་ལ་འདུག་བཞིན་དུ་འཇིག་ཚོགས་ལ་ལྟ་བའི་རིའི་རྩེ་མོ་ཉི་ཤུ་མཐོ་བ་།
K10dvavims_tu:3336	 tādṛśīṃ caturāryasaṃpratibodhikīṃ dharmadeśanāṃ kṛtavān yāṃ śrutvā paṭapradāyikāyā  devakanyāyā viṃśatiśikharasamudgataṃ satkāyadṛṣṭiśailaṃ jñānavajreṇa bhittvā śrotāpattiphalaṃ sākṣātkṛtam //	K01D0006_H0006:74b-0	ཡེ་ཤེས་ཀྱི་རྡོ་རྗེས་བཅོམ་སྟེ་རྒྱུན་དུ་ཞུགས་པའི་འབྲས་བུ་མངོན་སུམ་དུ་བྱས་པ་དེ་ལྟ་བུར་འཕགས་པའི་བདེན་པ་༄༧༤བ་བཞི་ཡང་དག་པར་སོ་སོར་རྟོགས་པར་བྱེད་པའི་ཆོས་བསྟན་པ་མཛད་དོ་༎
K10dvavims_tu:3338	 sā dṛṣṭasatyā trir udānam udānayati /	K01D0006_H0006:74b-1	དེས་བདེན་པ་མཐོང་ནས་བཙུན་པ་། བཅོམ་ལྡན་འདས་ཀྱིས་བདག་ལ་གང་མཛད་པ་འདི་ལྟ་བུ་ནི་། བདག་ལ་ཕས་ཀྱང་མ་བགྱིས་། མས་ཀྱང་མ་བགྱིས་། རྒྱལ་པོས་ཀྱང་མ་བགྱིས་།
K10dvavims_tu:3339	 idam asmākaṃ bhadanta na mātrā kṛtaṃ na pitrā na rājñā na devatābhiḥ neṣṭena svajanabhandhuvargeṇa na pūryapretair śramaṇabrāhmaṇair yad bhagavatāsmākaṃ kṛtam /	K01D0006_H0006:74b-6	ལྷ་རྣམས་ཀྱིས་ཀྱང་མ་བགྱིས་། སྔོན་གྱི་ཕ་མེས་དག་གིས་ཀྱང་མ་བགྱིས་། དགེ་སྦྱོང་དང་། བྲམ་ཟེ་དག་གིས་ཀྱང་མ་བགྱིས་། བྱམས་པ་དང་། མཛའ་བཤེས་དང་། རྩ་ལག་གི་ཚོགས་ཀྱིས་ཀྱང་མ་བགྱིས་ཏེ་། ཁྲག་དང་། མཆི་མའི་རྒྱ་མཚོ་ནི་།
K10dvavims_tu:3340	 ucchoṣitā rudhirāśrusamudrā laṅghitā asthiparvatāḥ pihitāny apāyadvārāṇi vivṛtāni svargamokṣadvārāṇi pratiṣṭhāpitāḥ smo devamanuṣyeṣu / āha ca //  (Dak: 226)	K01D0006_H0006:74b-11	བསྐམས་། རུས་པའི་རི་དག་ལས་ནི་། བསྒྲལ་། ངན་སོང་གི་སྒོ་དག་ནི་། བཀུམ་། མཐོ་རིས་དང་། ཐར་པའི་སྒོ་དག་ནི་། ཕྱེ་། སེམས་ཅན་དམྱལ་བ་དང་། དུད་འགྲོ་དང་། ཡི་དབ༹གས་དག་ནས་ནི་། རྐང་པ་ཕྱུང་། ལྷ་དང་། མི་རྣམས་ཀྱི་ནང་དུ་ནི་།
K10dvavims_tu:3342	 tavānubhāvāt pihitaḥ sughoro hy apāyamārgo bahudoṣayuktaḥ /	K01D0006_H0006:74b-17	བཞག་གོ་། ཞེས་ལན་གསུམ་ཆེད་དུ་བརྗོད་པ་ཆེད་དུ་བརྗོད་དོ་༎ ཡང་སྨྲས་པ་། ཁྱོད་མཐུས་རབ་དྲག་ཉེས་པ་མང་ལྡན་པའི་༎
K10dvavims_tu:3343	 apāvṛtā svargagatiḥ supuṇyā nirvāṇamārgaś ca mayopalabdhaḥ // Dak_23.12 //	K01D0006_H0006:74b-21	མཐོ་རིས་འགྲོ་བ་ཕྱེ་ཞིང་བདག་གིས་ནི་༎ མྱ་ངན་འདས་པའི་ཤུལ་ཡང་ཐོབ་པར་གྱུར་༎
K10dvavims_tu:3344	 tvadāśrayāc cāptam apetadoṣaṃ mayādya śuddhaṃ suviśuddhacakṣuḥ /	K01D0006_H0006:74b-23	ཤིན་ཏུ་རྣམ་དག་ཁྱོད་བརྟེན་བདག་གིས་ནི་༎
K10dvavims_tu:3345	 prāptaṃ ca śāntaṃ padam āryakāntaṃ tīrṇā ca duḥkhārṇavapāram asmi //	K01D0006_H0006:74b-24	དེ་རིང་སྐྱོན་བྲལ་དག་པའི་མིག་ཐོབ་ཅིང་༎ གོ་འཕང་ཞི་བ་འཕགས་པ་དགྱེས་ཐོབ་སྟེ་། སྡུག་བསྔལ་རྒྱ་མཚོའི་ཕ་རོལ་བརྒལ་བར་གྱུར་༎
K10dvavims_tu:3346	 naravarendra narāmarapūjita vigatajanmajarāmaraṇāmaya /	K01D0006_H0006:74b-27	འགྲོ་བ་ལྷ་མིན་མི་དང་ལྷས་མཆོད་པ་༎ སྐྱེ་དང་རྒ་དང་ན་འཆི་བྲལ་བ་པོ་༎
K10dvavims_tu:3347	 bhavasahasrasudurlabhadarśana saphalam adya mune tava darśanam // Dak_23.14 //	K01D0006_H0006:74b-29	སྲིད་པ་སྟོང་དུ་མཐོང་བ་རབ་དཀོན་པ་༎ ཐུབ་པ་ད་རིང་ཁྱོད་མཐོང་འབྲས་བུ་མཆིས་༎
K10dvavims_tu:3125	 atha bhikṣavaḥ saṃśayajātāḥ sarvasaṃśayacchettāraṃ buddhaṃ bhagavantaṃ papracchuḥ /	K01D0006_H0006:242b-9	ཡང་དགེ་སློང་རྣམས་ཐེ་ཚོམ་སྐྱེས་ནས་ཐེ་ཚོམ་ཐམས་ཅད་གཅོད་པར་མཛད་པ་། སངས་རྒྱས་བཅོམ་ལྡན་འདས་ལ་ཞུས་པ་།
K10dvavims_tu:3126	 kāni bhadanta vapuṣmatā karmāṇi kṛtāni yenāsyaivaṃvidha āśrayo 'rhattvaṃ ca prāptam iti //	K01D0006_H0006:242b-11	བཙུན་པ་། ཚེ་དང་ལྡན་པ་དགའ་བོས་ལས་ཅི་ཞིག་བགྱིས་ན་། ལས་དེའི་རྣམ་པར་སྨིན་པས་གལ་ཏེ་རབ་ཏུ་བྱུང་བར་མ་གྱུར་ན་། འདིས་སྟོབས་ཀྱིས་འཁོར་ལོས་བསྒྱུར་བའི་རྒྱལ་སྲིད་བགྱིས་པར་འགྱུར་ལགས་།
K10dvavims_tu:3127	 bhagavān āha /	K01D0006_H0006:242b-14	བཅོམ་ལྡན་འདས་ཀྱིས་བཀའ་སྩལ་པ་།
K10dvavims_tu:3128	 vapuṣmatā bhikṣavaḥ pūrvam anyāsu jātiṣu karmāṇi kṛtāny upacitāni labdhasaṃbhārāṇi pariṇatapratyayāny oghavatpratyupasthitāny	K01D0006_H0006:242b-15	དགེ་སློང་དག་། རིགས་ཀྱི་བུ་དགའ་བོ་འདི་ཉིད་ཀྱིས་ལས་བྱས་ཤིང་བསགས་པ་། ཚོགས་པ་རྙེད་པ་།
K10dvavims_tu:3129	 avaśyabhāvīni /	K01D0006_H0006:242b-20	ངེས་པར་གྱུར་པ་ཡིན་ཏེ་།
K10dvavims_tu:3130	 vapuṣmatā karmāṇi kṛtāny upacitāni ko 'nyaḥ pratyanubhaviṣyati /	K01D0006_H0006:242b-21	ལས་བྱས་ཤིང་བསགས་པ་རྣམས་གཞན་སུ་ཞིག་གིས་མྱོང་བར་འགྱུར་།
K10dvavims_tu:3132	 na bhikṣavaḥ karmāṇi kṛtāny upacitāni bāhye pṛthivīdhātau vipacyante  nābdhātau na tejodhātau na vāyudhātāv api tūpatteṣv eva skandhadhātvāyataneṣu karmāṇi kṛtāni vipacyante śubhāny aśubhāni ca /	K01D0006_H0006:242b-24	ཕྱི་རོལ་གྱི་སའི་ཁམས་ལ་རྣམ་པར་སྨིན་པར་མི་འགྱུར་། ཆུའི་ཁམས་ལ་མ་ཡིན་། ༄༢༤༣ཨ་༌༎ མེའི་ཁམས་ལ་མ་ཡིན་། རླུང་གི་ཁམས་ལ་མ་ཡིན་གྱི་། འོན་ཀྱང་དགེ་བ་དང་། མི་དགེ་བའི་ལས་བྱས་པ་རྣམས་ནི་། ཟིན་པའི་ཕུང་པོ་དང་། ཁམས་དང་། སྐྱེ་མཆེད་དག་ཁོ་ན་ལ་རྣམ་པར་སྨིན་པར་འགྱུར་ཏེ་།
K10dvavims_tu:3134	 na praṇaśyanti karmāṇi kalpakoṭiśatair api /	K01D0006_H0006:243a-4	བསྐལ་པ་བརྒྱ་ཕྲག་རྣམས་སུ་ཡང་༎ ལས་རྣམས་ཆུད་ཟར་མི་འགྱུར་ཏེ་༎
K10dvavims_tu:3135	 sāmagrīṃ prāpya kālaṃ ca phalanti khalu dehinām // Dak_21.3 //	K01D0006_H0006:243a-6	ཚོགས་ཤིང་དུས་ལ་བབ་པ་ན་༎ ལུས་ཅན་རྣམས་ལ་འབྲས་བུར་སྨིན་།
K10dvavims_tu:3136	 bhūtapūrvaṃ bhikṣavo 'tīte 'dhvani ekanavate kalpe vipaśyī nāma samyaksaṃbuddho loka	K01D0006_H0006:243a-8	དགེ་སློང་དག་། སྔོན་བྱུང་བ་བསྐལ་པ་བཟང་པོ་འདི་ཉིད་ལ་སྐྱེ་རྒུའི་ཚེ་ལོ་ཉི་ཁྲི་ཐུབ་པ་ན་།
K10dvavims_tu:3137	 udapādi vidyācaraṇasaṃpannaḥ sugato lokavid anuttaraḥ puruṣadamyasārathiḥ śāstā devānāṃ  ca manuṣyāṇāṃ ca buddho bhagavān /	K01D0006_H0006:243a-10	སྟོན་པ་དེ་བཞིན་གཤེགས་པ་དགྲ་བཅོམ་པ་ཡང་དག་པར་རྫོགས་པའི་སངས་རྒྱས་རིག་པ་དང་ཞབས་སུ་ལྡན་པ་། བདེ་བར་གཤེགས་པ་། འཇིག་རྟེན་མཁྱེན་པ་། སྐྱེས་བུ་འདུལ་བའི་ཁ་ལོ་སྒྱུར་བ་བླ་ན་མེད་པ་། ལྷ་དང་། མི་རྣམས་ཀྱི་སྟོན་པ་།
K10dvavims_tu:3140	 yāvad vipaśyī samyaksaṃbuddhaḥ sakalabuddhakāryaṃ kṛtvā indhanakṣayād ivāgnir nirupadhiśeṣe nirvāṇadhātau parinirvṛtaḥ /	K01D0006_H0006:243a-20	སྐྱེ་བོ་དང་། མི་མང་པོས་གང་བ་ཞེས་བྱ་བ་ནས་ཆོས་བཞིན་བྱེད་དུ་འཇུག་གོ་། ཞེས་བྱ་བའི་བར་སྔ་མ་བཞིན་ནོ་༎ རྒྱལ་པོ་དེ་ལ་བུ་གསུམ་སྟེ་། རབ་དང་འབྲིང་པོ་དང་། ཐ་ཆུང་ངོ་༎ གང་གི་ཚེ་ཡང་དག་པར་རྫོགས་པའི་སངས་རྒྱས་འོད་སྲུང་སངས་རྒྱས་ཀྱི་མཛད་པ་མཐའ་དག་མཛད་ནས་༄༢༤༣བ་བུད་ཤིང་ཟད་པའི་མེ་བཞིན་དུ་ཕུང་པོའི་ལྷག་མ་མེད་པའི་མྱ་ངན་ལས་འདས་པའི་དབྱིངས་སུ་མྱ་ངན་ལས་འདས་པ་དེའི་ཚེ་རྒྱལ་པོ
K10dvavims_tu:3327	 dharmatā khalu devaputrasya devakanyāya vāciropasaṃpannasya trīṇi cittāny utpadyante /	K01D0006_H0006:150a-0	ཆོས་ཉིད་ཀྱིས་ལྷའི་༄༡༥༠ཨ་༌༎ བུའམ་། ལྷའི་བུ་མོ་སྐྱེས་ནས་རིང་པོ་མ་ལོན་པ་ལ་སེམས་གསུམ་སྐྱེ་སྟེ་།
K10dvavims_tu:3328	 kutaś cyutāḥ kutropapannāḥ kena karmaṇeti /	K01D0006_H0006:150a-2	གང་ནས་ཤི་འཕོས་པ་དང་། གང་དུ་སྐྱེས་པ་དང་། ལས་གང་གིས་ཡིན་པའོ་༎
K10dvavims_tu:3329	 sā paśyati manuṣyebhyaś cyutā (Dak: 225)  praṇīteṣu deveṣu trayastriṃśeṣūpapannā bhagavataḥ paṭakapradānād iti //	K01D0006_H0006:150a-3	དེ་རྣམས་ཀྱིས་མི་རྣམས་ཀྱི་ནང་ནས་ཤི་འཕོས་པ་དང་། རྒྱལ་ཆེན་བཞི་པའི་ལྷ་རྣམས་ཀྱི་ནང་དུ་སྐྱེས་པ་དང་། ལས་གང་གིས་ཤེ་ན་། བཅོམ་ལྡན་འདས་ལ་སེམས་རབ་ཏུ་དང་བར་བྱས་པས་ཡིན་པར་མཐོང་ངོ་༎
K10dvavims_tu:3333	 puṣpāṇām utsaṅgaṃ pūrayitvā sarvaṃ jetavanam udāreṇāvabhāsenāvabhāsya bhagavantaṃ  puṣpair avakīrya bhagavataḥ purastān niṣaṇṇā dharmaśravaṇāya //	K01D0006_H0006:150a-10	ལུས་དོ་ཤལ་དང་སེ་མོ་དོས་བརྒྱན་ནས་དེ་ཉིད་ཀྱི་མཚན་མོ་ལྷ་རྫས་ཀྱི་མེ་ཏོག་ཨཽཏཔ་ལ་དང་། པདམ་དང་། ཀུ་མུ་ད་དང་། པདམ་དཀར་པོ་དང་། མན་དའ་ར་བ་རྣམས་ཀྱིས་ཐུ་བ་བཀང་ནས་རྒྱལ་བུ་རྒྱལ་བྱེད་ཀྱི་ཚལ་ཐམས་ཅད་སྣང་བ་རྒྱ་ཆེན་པོས་སྣང་བར་བྱས་ཏེ་བཅོམ་ལྡན་འདས་ལ་མེ་ཏོག་རྣམས་ཀྱིས་གཏོར་ནས་བཅོམ་ལྡན་འདས་ཀྱི་སྤྱན་སྔར་ཆོས་མཉན་པའི་ཕྱིར་འདུག་གོ་།
K10dvavims_tu:3335	 atha bhagavān paṭapradāyikāyā devakanyāyā āśayānuśayaṃ dhātuṃ prakṛtiṃ ca jñatva  tādṛśīṃ caturāryasaṃpratibodhikīṃ dharmadeśanāṃ kṛtavān yāṃ śrutvā paṭapradāyikāyā  devakanyāyā viṃśatiśikharasamudgataṃ satkāyadṛṣṭiśailaṃ jñānavajreṇa bhittvā śrotāpattiphalaṃ sākṣātkṛtam //	K01D0006_H0006:150b-0	བཅོམ་ལྡན་འདས་ཀྱིས་དེ་རྣམས་ཀྱི་བསམ་པ་དང་། བག་ལ་ཉལ་བ་དང་། ཁམས་དང་། རང་བཞིན་མཁྱེན་ནས་འཕགས་པའི་བདེན་པ་བཞི་རྟོགས་༄༡༥༠བ་པར་འགྱུར་བ་དེ་ལྟ་བུའི་ཆོས་བསྟན་པ་མཛད་པ་དང་། དེ་རྣམས་ཀྱིས་དེ་ཐོས་ནས་འཇིག་ཚོགས་ལ་ལྟ་བའི་རིའི་རྩེ་མོ་ཉི་ཤུ་མཐོ་བ་། ཡེ་ཤེས་ཀྱིས་རྡོ་རྗེས་བཅོམ་ནས་རྒྱུན་དུ་ཞུགས་པའི་འབྲས་བུ་མངོན་སུམ་དུ་བྱས་སོ་༎
K10dvavims_tu:3338	 sā dṛṣṭasatyā trir udānam udānayati /	K01D0006_H0006:150b-2	དེ་རྣམས་ཀྱིས་བདེན་པ་མཐོང་ནས་ཆེད་དུ་བརྗོད་པ་ལན་གསུམ་བརྗོད་པ་།
K10dvavims_tu:3339	 idam asmākaṃ bhadanta na mātrā kṛtaṃ na pitrā na rājñā na devatābhiḥ neṣṭena svajanabhandhuvargeṇa na pūryapretair śramaṇabrāhmaṇair yad bhagavatāsmākaṃ kṛtam /	K01D0006_H0006:150b-3	བཅོམ་ལྡན་འདས་ཀྱིས་གང་བདག་ཅག་ལ་སྨན་བཏགས་པ་འདི་ལྟ་བུ་ནི་། བདག་ཅག་ལ་མས་མ་བགྱིས་། ཕས་མ་ལགས་། རྒྱལ་པོས་མ་ལགས་། ལྷ་རྣམས་ཀྱིས་མ་ལགས་། རང་གི་སྐྱེ་བོ་དང་གཉེན་སྡུག་པའི་ཚོགས་ཀྱིས་མ་ལགས་།
K10dvavims_tu:3340	 ucchoṣitā rudhirāśrusamudrā laṅghitā asthiparvatāḥ pihitāny apāyadvārāṇi vivṛtāni svargamokṣadvārāṇi pratiṣṭhāpitāḥ smo devamanuṣyeṣu / āha ca //  (Dak: 226)	K01D0006_H0006:150b-9	སྔོན་གྱི་མེས་པོ་རྣམས་ཀྱིས་མ་ལགས་། དགེ་སྦྱོང་དང་། བྲམ་ཟེ་རྣམས་ཀྱིས་མ་ལགས་ཏེ་། ཁྲག་དང་མཆི་མའི་རྒྱ་མཚོ་ནི་།
K10dvavims_tu:1665	 yad utāsmin satīdaṃ bhavaty asyotpādād idam utpadyate /	K01D0006_H0006:426b-10	འདི་ཡོད་པས་འདི་འབྱུང་། འདི་སྐྱེས་པས་འདི་སྐྱེ་སྟེ་།
K10dvavims_tu:1666	 yad utāvidyāpratyayāt saṃskāraḥ,	K01D0006_H0006:426b-12	འདི་ལྟ་སྟེ་། མ་རིག་པའི་རྐྱེན་གྱིས་འདུ་བྱེད་།
K10dvavims_tu:1667	 saṃskārapratyayād vijñānaṃ vijñānapratyayān nāmarūpaṃ nāmarūpapratyayāt ṣaḍāyatanaṃ	K01D0006_H0006:426b-14	འདུ་བྱེད་ཀྱི་རྐྱེན་གྱིས་རྣམ་པར་ཤེས་པ་། རྣམ་པར་ཤེས་པའི་རྐྱེན་གྱིས་མིང་དང་གཟུགས་། མིང་དང་གཟུགས་ཀྱི་རྐྱེན་གྱིས་སྐྱེ་མཆེད་དྲུག་། སྐྱེ་མཆེད་དྲུག་གི་རྐྱེན་གྱིས་རེག་པ་།
K10dvavims_tu:1668	 saḍāyatanapratyayāt sparśaḥ sparśapratyayāt tṛṣṇā tṛṣṇāpratyayād upādānam upādānapratyayād	K01D0006_H0006:426b-18	རེག་པའི་རྐྱེན་གྱིས་ཚོར་བ་། ཚོར་བའི་རྐྱེན་གྱིས་སྲེད་པ་། སྲེད་པའི་རྐྱེན་གྱིས་ལེན་པ་། ལེན་པའི་རྐྱེན་གྱིས་སྲིད་པ་།
K10dvavims_tu:1669	 bhavo bhavapratyayāj jātir jātipratyayāj jarāmaraṇaśokaparidevaduḥkhadaurmanasyopāyāsāḥ saṃbhavanti /	K01D0006_H0006:426b-22	སྲིད་པའི་རྐྱེན་གྱིས་སྐྱེ་བ་། སྐྱེ་བའི་རྐྱེན་གྱིས་རྒ་ཤི་དང་། མྱ་ངན་དང་། སྨྲེ་སྔགས་འདོན་པ་དང་། སྡུག་བསྔལ་བ་དང་། ཡིད་མི་བདེ་བ་དང་། འཁྲུག་པ་རྣམས་འབྱུང་སྟེ་།
K10dvavims_tu:1670	 evam asya kevalasya mahato duḥkhaskandhasya samudayo bhavati /	K01D0006_H0006:426b-24	དེ་ལྟར་ན་། སྡུག་བསྔལ་གྱི་ཕུང་པོ་ཆེན་པོ་འདི་འབའ་ཞིག་ཀུན་འབྱུང་བར་འགྱུར་རོ་༎
K10dvavims_tu:1671	 yad utāsmin na satīdaṃ na (Dak: 113)  satīdaṃ na bhavati /	K01D0006_H0006:426b-26	འདི་ལྟར་། འདི་མེད་པས་འདི་མི་འབྱུང་།
K10dvavims_tu:2641	 atrāntare nāsti kiṃ cid buddhānāṃ bhagavatām aviditam avijñātam /	K01D0006_H0006:427b-16	སྐབས་འདི་ལྟ་བུ་ལ་སངས་རྒྱས་བཅོམ་ལྡན་འདས་རྣམས་མི་མཁྱེན་པའམ་། མི་གཟིགས་པའམ་།
K10dvavims_tu:2642	 dharmatā khalu buddhānāṃ bhagavatāṃ mahākāruṇikānāṃ lokānugrahapravṛttikānām,	K01D0006_H0006:427b-18	མི་རིག་པ་དང་། རྣམ་པར་མི་མཁྱེན་པ་ཅུང་ཟད་ཀྱང་མི་མངའ་སྟེ༏་སངས་རྒྱས་བཅོམ་ལྡན་འདས་ཐུགས་རྗེ་ཆེན་པོ་མངའ་བ་། འཇིག་རྟེན་ལ་ཕན་འདོགས་པར་ཞུགས་པ་།
K10dvavims_tu:2643	 ekākārarakṣāṇāṃ,	K01D0006_H0006:427b-20	སྲུང་བ་གཅིག་པ་། གཅིག་ཏུ་དཔའ་བ་། ཟླ་མེད་པ་། གཉིས་སུ་མི་གསུང་བ་།
K10dvavims_tu:2644	 śamathavipaśyanāvihāriṇāṃ,	K01D0006_H0006:428a-0	ཞི་༄༤༢༨ཨ་༌༎ གནས་དང་ལྷག་མཐོང་ལ་གནས་པ་།
K10dvavims_tu:2645	 tridamathavastukuśalānāṃ,	K01D0006_H0006:428a-1	གདུལ་བའི་དངོས་པོ་གསུམ་ལ་མཁས་པ་།
