src_segmentnr	src_original	tgt_segmentnr	tgt_original
K10klpdrapu:474	 jñānena yadi vā vipraḥ śūdro 'pi brāhmaṇo bhavet* // KDA_228 //  anye 'pi bahavaḥ santi sakaivartādinīcajāḥ /  jñānavantaś ca ye dhīrās te 'pi syur brāhmaṇāḥ khalu // KDA_229 //  tamāc ca jñānamātreṇa brāhmaṇo na bhavet khalu /	T02D1784a:88a-29	རིག་བྱེད་ཀློག་པའི་ཤེས་པའི་མཚན་ཉིད་ཅན་བྲམ་ཟེ་ཉིད་ནི་མ་ཡིན་ཏེ་། དམངས་རིགས་ལ་སོགས་པ་ཡང་དེ་ཤེས་པ་རྣམས་བྲམ་ཟེར་ཐལ་བར་འགྱུར་རོ་༎
K10klpdrapu:478	 karmācārapramāṇena na jñānasya pramāṇatā // KDA_230 //  karmaṇāpi dvijo naiva śuddhācārapramāṇataḥ /  karmaṇā vai dvijāś caivaṃ sarve syur brāhmaṇāḥ khalu // KDA_231 //  santi hi bahavo loke mahāyajñādikarmiṇaḥ /  kṣatriyavaiśyaśūdrāś ca kathaṃ na brāhmaṇā nu te // KDA_232 //	T02D1784a:88b-0	ཁྲུས་དང་སྦྱིན་སྲེག་ལ་སོགས་༄༨༨བ་པའི་སྤྱོད་པའི་བྲམ་ཟེ་ཉིད་དུ་ཁས་བླངས་ནས་།
K10klpdrapu:484	 tasmān na karmamātreṇa brāhmaṇāḥ syur narāḥ khalu /  ye ye svācāravantaś ca te te syur brāhmaṇāḥ kila // KDA_234 //  santi ca bahavaḥ śūdrāḥ śuddhācārasamanvitāḥ /	T02D1784a:88b-1	དེ་ནི་དེ་དང་ལྡན་པའི་དམངས་རིགས་ཀྱི་སྐྱེས་པ་ཡང་བྲམ་ཟེ་ཉིད་དུ་ཐལ་བར་འགྱུར་རོ་༎
K10klpdrapu:489	 vratopavāsadharmiṣṭā nīcajā api santi ca // KDA_235 //  te 'pi syur brāhmaṇāś caivaṃ yady ācārapramāṇatā /	T02D1784a:88b-2	དུས་བྱས་པ་ནི་སྒྲ་མཚམས་ཕྱེ་བ་ལ་སོགས་པའི་མཚན་ཉིད་ཅན་བྲམ་ཟེ་ཡིན་ན་།
K10klpdrapu:491	 tasmād ācāramātreṇa brāhmaṇā naiva mānuṣāḥ // KDA_236 //  vedenāpi tathā naiva brāhmaṇāḥ syur narottamāḥ /  yadi vedair bhaved vipro rākṣaso 'pi dvijaḥ khalu // KDA_237 //  tathābhūd rāvaṇo nāma rākṣaso vedapāragaḥ /  sarve 'pi rākṣasāś caivaṃ vedakarmānucārakāḥ // KDA_238 //	T02D1784a:88b-3	རིགས་ངན་མོ་རྣམས་ཀྱང་དེ་བྱེད་པས་ན་བྲམ་ཟེ་ཉིད་དུ་མ་ཡིན་པའི་ཕྱིར་རོ་༎
K10klpdrapu:496	 kathaṃ te brāhmaṇā naiva yadi vedād dvijo bhavet* /  tasmāc ca vedamātreṇa naiva syur brāhmaṇāḥ khalu // KDA_230 //	T02D1784a:88b-4	དེ་བས་ན་བྲམ་ཟེ་ལ་སོགས་པའི་རིགས་འདི་རྣམས་ནི་རྟོག་པས་བྱས་པའི་ཐ་སྙད་ཙམ་ཡིན་ནོ་༎
