src_segmentnr	src_original	tgt_segmentnr	tgt_original
K10nidansyu:230	 kasmin nu sati jarāmaraṇaṃ bhavati /  kiṃpratyayañ ca punar jarāmaraṇam /	T03n0190_030:0794c13_12	何因緣有此老病死？
K10nidansyu:232	 tasya mama yoniśo manasikurvata evaṃ yathābhūtasyābhisamaya udapādi /  jātyāṃ satyāṃ jarāmaraṇaṃ bhavati /  jātipratyayañ ca punar jāramaraṇam /	T03n0190_030:0794c15_6	』菩薩如是思惟念時，知老病死因生故有，此老病死，以有生故，老病死隨。
K10nidansyu:235	 NidSa 5.5 tasya mamaitad abhavat /	T03n0190_030:0794c16_7	「菩薩復更思惟：
K10nidansyu:236	 kasmin nu sati jātir bhavati /	T03n0190_030:0794c16_15	『此生從何而有？
K10nidansyu:237	 kiṃpratyayā ca punar jātiḥ /	T03n0190_030:0794c16_20	何因緣故？
K10nidansyu:238	 tasya mama yoniśo manasi kurvata evaṃ yathābhūtasyābhisamaya udapādi /  bhave sati jātir bhavati /  bhavapratyayā ca punar jātiḥ /	T03n0190_030:0794c17_3	得有是生？ 』菩薩如是思惟念已，知因有故故有是生。
