src_segmentnr	src_original	tgt_segmentnr	tgt_original
K10ratnakeu:1599	 kumalāṃs trīn prahāyeha śāstuḥ śṛṇuta bhāṣitaṃ /	K10D0138_H0140:359b-22	དྲི་མ་ངན་པ་གསུམ་སྤོངས་ལ་༎ སྟོན་པས་གསུངས་པ་འདིར་ཉོན་ཅིག་།
K10ratnakeu:16	 śruṇata yūyaṃ māṇavakāḥ smarata saṃsāradoṣān /	K10D0138_H0140:294a-3	བྲམ་ཟེའི་ཁྱེའུ་ཁྱོད་ཉོན་ཅིག་འཁོར་བའི་སྐྱོན་༎
K10ratnakeu:160	 nānayoḥ kulaputrayor anubhāvaḥ /	K10D0138_H0140:298b-7	རིགས་ཀྱི་བུ་འདི་གཉིས་ཀྱི་མཐུ་མ་ཡིན་ཏེ་།
K10ratnakeu:1601	 trivimokṣe ca saṃsthāya trisaṃvarasthito bhava /	K10D0138_H0140:359b-26	རྣམ་ཐར་གསུམ་ལ་རབ་གནས་ཤིང་༎ སྡོམ་པ་གསུམ་ལ་ཡང་དག་གནས་༎
K10ratnakeu:1602	 traidhātukāś ca ye kleśās tān aśeṣān vidhunvata // RKP_5.17	K10D0138_H0140:360a-0	༄༣༦༠ཨ་༌༎ ཁམས་གསུམ་ཀུན་གྱི་ཉོན་མོངས་གང་༎ དེ་དག་མ་ལུས་རྣམ་པར་ཆོམ་༎
K10ratnakeu:1603	 triratnavaṃśapūjārthaṃ yūyaṃ + + + + + + /	K10D0138_H0140:360a-2	དཀོན་མཆོག་གསུམ་གྱི་རིགས་མཆོག་དང་༎ ཆོས་ཀྱི་དོན་དུ་ཁྱེད་ཅག་རྣམས་༎ སངས་རྒྱས་ལྷ་དང་བདུད་གསུམ་གྱི་༎
K10ratnakeu:1605	 traidhātukavinirmuktāṃ kṣāntiṃ lapsyati śāmikīm // RKP_5.19	K10D0138_H0140:360a-7	ཁམས་གསུམ་པ་ལས་གྲོལ་བ་ཡི་༎ ཞི་བྱེད་བཟོད་པ་ཐོབ་པར་བྱོས་༎
K10ratnakeu:1607	 cakṣurūpaprasaṃgena kāyavākcetanāvrtaiḥ /	K10D0138_H0140:360a-12	མིག་ནི་གཟུགས་ལ་ཆགས་པ་ཡིས་༎ ལུས་དང་ངག་དང་སེམས་བསྒྲིབས་ནས་༎
K10ratnakeu:161	 mārasya tu pāpīmataḥ paṃcamātraiḥ paricārikāśatais tato mārabhavanād idam evaṃrūpaṃ mahāpuṣpavarṣaṃ yāvad alaṃkāravarṣam utsṛṣṭaṃ mama pūjākarmaṇe	K10D0138_H0140:298b-8	བདུད་སྡིག་ཅན་གྱི་ག-ཡོག་མོ་ལྔ་བརྒྱ་ཙམ་གྱིས་བདུད་ཀྱི་ཁང་པ་དེ་ནས་ང་ལ་མཆོད་པ་བྱ་བའི་ཕྱིར་འདི་ལྟ་བུའི་མེ་ཏོག་གི་ཆར་ཆེན་པོ་ནས་རྒྱན་གྱི་བར་གྱི་ཆར་ཕབ་བོ་༎
K10ratnakeu:1610	 mocayaṃte ca te sattvāṃś caturoghebhya īśvarāḥ /	K10D0138_H0140:360a-20	དབང་ཕྱུག་དེ་དག་སེམས་ཅན་རྣམས་༎ ཆུ་བོ་བཞི་ལས་ཐར་པར་བྱེད་༎ འཆི་འཕོ་སྐྱེ་བ་རབ་ཤེས་པ་༎ དེས་པ་རྣམས་ནི་ཕ་རོལ་འགྲོ་༎
K10ratnakeu:1611	 + + + + + + + + bodhisattvaviśāradāḥ /	K10D0138_H0140:360a-24	བྱང་ཆུབ་སེམས་དཔའ་འཇིགས་མེད་པ་༎
K10ratnakeu:1612	 samyagjñānena cchindaṃti sattvānāṃ bhavabandhanam // RKP_5.24  (Kurumiya 111)	K10D0138_H0140:360a-25	རྐང་པ་བཞི་དང་ལྡན་པ་དག་། སེམས་ཅན་སྲེད་པས་བཅིངས་པ་རྣམས་༎ ཡང་དག་ཤེས་པས་གཅོད་པར་བྱེད་༎
K10ratnakeu:1614	 paṃcaskandhāḥ parijñāna + + + + + + + + + /	K10D0138_H0140:360b-0	ཕུང་པོ་ལྔ་རྣམས་༄༣༦༠བ་ཡོངས་ཤེས་པས་༎
K10ratnakeu:1616	 prahāya pāpaṃ niḥśeṣaṃ pāraṃ yāsyakutobhayam // RKP_5.26 + + + + + + + + + + + + + + + + /	K10D0138_H0140:360b-5	སྡིག་པ་དག་ནི་མྱུར་དུ་ཤོགས་༎ སྡིག་པ་མ་ལུས་རབ་སྤོངས་ལ་༎ འཇིགས་པ་མེད་པར་ཕ་རོལ་སོང་༎
K10ratnakeu:1618	 pāpamitraprahīṇās tu pāpadṛṣṭivivarjitāḥ /	K10D0138_H0140:360b-12	སྡིག་པའི་གྲོགས་པོ་རབ་སྤངས་ཏེ་༎ སྡིག་པའི་ལྟ་བ་རྣམས་བོར་ནས་༎
K10ratnakeu:1619	 smṛtvā saṃsāraduḥkhaṃ + + + + + + + + + // RKP_5.28 + + + + + + + + + + + + + + + + /	K10D0138_H0140:360b-14	འཁོར་བའི་སྡུག་བསྔལ་དྲན་བྱས་ཏེ་༎ དམ་པའི་ཆོས་ལ་རབ་སྦྱོར་ཅིག་། བཏུང་བའི་དམ་པ་འཐུང་བར་བྱོས་༎ སྟོང་པ་ཉིད་ཀྱང་རབ་སྒོམས་ཤིག་།
K10ratnakeu:162	 acirāt tā atrāgatā mamāntikād vyākaraṇaṃ pratilapsyante 'nuttarāyāṃ samyaksaṃbodhau //	K10D0138_H0140:298b-9	དེ་དག་རིང་པོར་མི་ཐོགས་པར་འདིར་འོངས་ཏེ་། ང་ལས་བླ་ན་མེད་པ་ཡང་དག་པར་རྫོགས་པའི་བྱང་ཆུབ་ཏུ་ལུང་བསྟན་པ་འཐོབ་བོ་༎
K10ratnakeu:1620	 paramārthe na bhāvo 'sti na dravyaṃ nāpi lakṣaṇaṃ // RKP_5.29	K10D0138_H0140:360b-18	དམ་པའི་དོན་ལ་དངོས་པོ་མེད་༎ རྫས་ཀྱང་མེད་ཅིང་མཚན་ཉིད་མེད་༎
K10ratnakeu:1621	 ṣaḍindriyaṃ yathā śūnyaṃ kārako 'tra na vidyate /	K10D0138_H0140:360b-20	འདི་ལྟར་དབང་པོ་དྲུག་སྟོང་སྟེ་༎ བྱེད་པ་པོ་ནི་འདི་ལ་མེད་༎
K10ratnakeu:1622	 ṣaṭ sparśāyatanāny evaṃ śūnyāny api vijānatha // RKP_5.31	K10D0138_H0140:360b-23	དངོས་པོ་ཙམ་སྟེ་ག-ཡོ་བ་མེད་༎ ཚོར་བ་དྲུག་དང་སྲེད་པ་དྲུག་། རེག་པ་དྲུག་ལས་བྱུང་བ་ཡིན་༎ དེ་བཞིན་རེག་པའི་སྐྱེ་མཆེད་དྲུག་། སྟོང་པ་ཡིན་པར་ཤེས་པར་བྱོས་༎
K10ratnakeu:1623	 bhāvam ekaṃ nirīkṣadhvaṃ ya + + + + + + + /	K10D0138_H0140:360b-28	རང་བཞིན་གྱིས་ནི་དངོས་མེད་པར་༎ དངོས་པོ་ཉིད་ལ་བརྟག་པར་བྱོས་༎
K10ratnakeu:1625	 yair jñātā nirjvarās te vai eṣa mārgo hy anuttaraḥ // RKP_5.33	K10D0138_H0140:361a-0	༄༣༦༡ཨ་༌༎ ཤེས་པ་དེ་དག་ནད་མེད་དེ་༎ དེ་ནི་བླ་ན་མེད་པའི་ལམ་༎
K10ratnakeu:1628	 ........................ khyeyākṣobhyagaṃgānadīvālukopamāsu śūnyāśūnyāsu paṃcakaṣāyeṣu  ........................ aprameyāsaṃkhyeyāni sattvakoṭīnayutaśatasahasrāṇi atīva	K10D0138_H0140:361a-7	མི་སྟོང་པའི་སྙིགས་མ་ལྔ་ཅན་གངགའའི་ཀླུང་དཔག་ཏུ་མེད་པ་མི་འཁྲུགས་པའི་བྱེ་མ་སྙེད་རྣམས་སུ་དབྱིངས་ཀྱི་དཀྱིལ་འཁོར་གྱི་ཚིག་བརྗོད་པ་འདི་དག་གྲགས་པར་གྱུར་ནས་དེའི་མོད་ལ་སངས་རྒྱས་ཀྱི་ཞིང་རེ་རེ་ནས་ཀྱང་སེམས་ཅན་བྱེ་བ་ཁྲག་ཁྲིག་བརྒྱ་སྟོང་གྲངས་མེད་དཔག་ཏུ་མེད་པ་དག་ནི་། ཤིན་ཏུ་ཟང་ཟིང་མེད་པའི་དགའ་བ་དང་། དད་པ་རྙེད་དེ་བླ་ན་མེད་པ་ཡང་དག་པར་རྫོགས་པའི་བྱང་ཆུབ་ལས་ཕྱིར་མི་ལྡོག་པར་གྱུར་ཏོ་༎
K10ratnakeu:163	 (Kurumiya 12)  atha tāni paṃcamātrāṇi mārakanyāśatāni svayam eva bhagavato vākśrutaghoṣavyāhāram  abhiśrutya bhūyasya mātrayā ca bhagavato 'ntike prasādajātās tās tena prasādapramodyena	K10D0138_H0140:298b-11	དེ་ནས་བདུད་ཀྱི་བུ་མོ་ལྔ་བརྒྱ་ཙམ་པོ་དེ་དག་སོ་སོ་ནས་བཅོམ་ལྡན་འདས་ཀྱི་གསུང་དང་། བརྗོད་པའི་དབྱངས་ཐོས་ནས་བཅོམ་ལྡན་འདས་ལ་དེ་བས་ཀྱང་རབ་ཏུ་དགའ་བ་སྐྱེས་ཏེ་།
K10ratnakeu:1630	 nir ........................ vicitrāḥ samādhikṣāntidhāraṇīḥ pratilebhire /	K10D0138_H0140:361a-10	ལ་ལ་དག་གིས་ནི་། ཏིང་ངེ་འཛིན་དང་། བཟོད་པ་དང་། གཟུངས་སྣ་ཚོགས་ཐོབ་བོ་༎
K10ratnakeu:1631	 iha buddhakṣetrasannipatitā .............................. pratilābho 'bhūt /	K10D0138_H0140:361a-12	སངས་རྒྱས་ཀྱི་ཞིང་འདིར་འདུས་པའི་སེམས་ཅན་གྲངས་མེད་དཔག་ཏུ་མེད་པ་རྣམས་ཀྱིས་ནི་། དོན་དང་། ཚིག་དང་། ཡི་གེ་འདི་དག་༄༣༦༡བ་ཐོས་ནས་ཕྱིར་མི་ལྡོག་པའི་ས་ཐོབ་པར་གྱུར་ཏོ་༎
K10ratnakeu:1632	 tribhir yānair aprameyāsaṃkhyeyāḥ sattvā niryāṇam avā .........	K10D0138_H0140:361b-1	སེམས་ཅན་གྲངས་མེད་དཔག་ཏུ་མེད་པ་དག་ནི་། ཐེག་པ་གསུམ་པོ་དག་གིས་ངེས་པར་འབྱུང་བ་ཐོབ་པར་གྱུར་ཏོ་༎
K10ratnakeu:1658	 ye 'nāgate 'dhvani daśasu dikṣu anyonyāsu lokadhātuṣu tathāgatā arhantaḥ samyaksaṃbuddhā  bhaviṣyanti te 'pīmāṃ vajradharmasamatāpratītyadharmahṛdayasamucchrayavidhvaṃsanīṃ (Kurumiya 115)  nāma dhāraṇīmudrāpadaprabhedapraveśavyākaraṇīṃ bhāṣiṣyaṃte adhiṣṭhāsyanty anyonyaṃ cānumodiṣyaṃti //	K10D0138_H0140:366a-4	མ་འོངས་པའི་དུས་ན་ཕྱོགས་བཅུའི་འཇིག་རྟེན་གྱི་ཁམས་གཞན་དང་གཞན་དག་ཏུ་དེ་བཞིན་གཤེགས་པ་དགྲ་བཅོམ་པ་ཡང་དག་པར་རྫོགས་པའི་སངས་རྒྱས་གང་དག་འབྱུང་བ་དེ་དག་ཀྱང་ཆོས་མཉམ་པ་ཉིད་རྡོ་རྗེ་ལྟ་བུ་བརྟེན་པའི་ཆོས་ཀྱི་སྙིང་པོས་ལུས་ཡོངས་སུ་འཇོམས་པ་ཞེས་བྱ་བའི་གཟུངས་ཕྱག་རྒྱ་དང་། ཚིག་རབ་ཏུ་དབྱེ་བ་ལ་འཇུག་པ་ལུང་བསྟན་པ་གསུང་བར་འགྱུར་རོ་༎ བྱིན་གྱིས་རློབ་པར་འགྱུར་རོ་༎ གཅིག་ལ་གཅིག་དགྱེས་པར་མཛད་པར་འགྱུར་རོ་༎
K10ratnakeu:166	 bodhicittāsaṃpramoṣaṃ nāma samādhiṃ pratilebhire //	K10D0138_H0140:298b-12	དེ་དག་དགའ་བ་དང་། རངས་པ་དེས་བྱང་ཆུབ་ཀྱི་སེམས་བརྗེད་པ་མེད་པ་ཞེས་བྱ་བའི་ཏིང་ངེ་འཛིན་ཐོབ་བོ་༎
K10ratnakeu:1661	 atha khalu teṣu buddhakṣetreṣu ye bodhisattvā mahāsattvās te tān pratipratibuddhān bhagavataḥ pariprākṣuḥ /	K10D0138_H0140:366a-8	དེ་ནས་སངས་རྒྱས་ཀྱི་ཞིང་དེ་དག་ན་བྱང་ཆུབ་སེམས་དཔའ་སེམས་དཔའ་ཆེན་པོ་གང་དག་ཡོད་པ་དེ་དག་སོ་སོའི་སངས་རྒྱས་བཅོམ་ལྡན་འདས་དག་ལ་ཡོངས་སུ་ཞུས་པ་།
K10ratnakeu:1662	 katamāsau bhagavann asmābhir aśrutapūrvā vajradharmasamatāpratītyadharmahṛdayasamucchrayavidhvaṃsanī dhāraṇīmudrāpadaprabhedapraveśavyākaraṇī yam evaṃ bahuguṇākārī /	K10D0138_H0140:366a-9	བཅོམ་ལྡན་འདས་། བདག་ཅག་གིས་སྔོན་མ་ཐོས་པའི་ཆོས་མཉམ་པ་ཉིད་རྡོ་རྗེ་ལྟ་བུ་བརྟེན་པའི་ཆོས་ཀྱི་སྙིང་པོས་ལུས་འཇོམས་པ་ཞེས་བྱ་བའི་གཟུངས་ཕྱག་རྒྱ་དང་། ཚིག་རབ་ཏུ་དབྱེ་བ་ལ་འཇུག་པ་ལུང་བསྟན་པ་གང་འདི་ལྟར་ཡོན་ཏན་མང་པོ་བགྱིད་པ་།
K10ratnakeu:1663	 evam acintyadharmaguṇasamanvāgatā sarvadharmānāvaraṇālokakarī yāvad upaśamakarī /	K10D0138_H0140:366b-0	འདི་ལྟར་ཡོན་ཏན་བསམ་༄༣༦༦བ་གྱིས་མི་ཁྱབ་པ་དང་ལྡན་པ་། ཆོས་ཐམས་ཅད་ལ་སྒྲིབ་པ་མ་མཆིས་པའི་སྣང་བ་བགྱིད་པ་ནས་ཞི་བའི་བར་དུ་བགྱིད་པ་དེ་གང་ལགས་།
K10ratnakeu:1664	 deśayatu bhagavāṃs tāṃ vajradharmasamatāpratītyadharmahṛdayasamucchrayavidhvaṃsanīṃ  dhāraṇīmudrāpadaprabhedapraveśavyākaraṇīṃ sarvamārabalaviṣayapramardanakarīṃ yāvad	K10D0138_H0140:366b-2	ཆོས་མཉམ་པ་ཉིད་རྡོ་རྗེ་ལྟ་བུ་བརྟེན་པའི་ཆོས་ཀྱི་སྙིང་པོས་ལུས་འཇོམས་པ་ཞེས་བགྱི་བའི་གཟུངས་ཕྱག་རྒྱ་དང་། ཚིག་རབ་ཏུ་དབྱེ་བ་ལ་འཇུག་པ་ལུང་བསྟན་པ་།
K10ratnakeu:1666	 anupadhiśeṣe nirvāṇadhātau parinirvāpaṇīṃ bahujanahitāya bahujanasukhāya lokānukaṃpāyai	K10D0138_H0140:366b-3	བདུད་ཀྱི་སྟོབས་ཀྱི་ཡུལ་ཐམས་ཅད་རབ་ཏུ་འཇོམས་པར་བགྱིད་པ་ནས་ཕུང་པོའི་ལྷག་མ་མཆིས་པའི་ཡོངས་སུ་མྱ་ངན་ལས་འདས་པའི་དབྱིངས་སུ་མྱ་ངན་ལས་འདས་པའི་བར་དུ་བགྱིད་པ་དེ་སྐྱེ་བོ་མང་པོ་ལ་སྨན་པ་དང་། སྐྱེ་བོ་མང་པོ་ལ་བདེ་བ་དང་།
K10ratnakeu:1667	 mahato janakāyasyārthāya hitāya sukhāya devānāṃ ca manuṣyāṇāṃ ca //	K10D0138_H0140:366b-4	འཇིག་རྟེན་ལ་ཐུགས་བརྩེ་བ་དང་། སྐྱེ་བོ་ཕལ་པོ་ཆེ་དང་། ལྷ་དང་། མི་རྣམས་ཀྱི་དོན་དང་། སྨན་པ་དང་བདེ་བའི་སླད་དུ་བཅོམ་ལྡན་འདས་ཀྱིས་བཤད་དུ་གསོལ་།
K10ratnakeu:1668	 atha khalu te buddhā bhagavantas tān bodhisattvān evam āhuḥ /	K10D0138_H0140:366b-5	དེ་ནས་སངས་རྒྱས་བཅོམ་ལྡན་འདས་དེ་དག་གིས་བྱང་ཆུབ་སེམས་དཔའ་དེ་དག་ལ་འདི་སྐད་ཅེས་བཀའ་སྩལ་ཏོ་༎
K10ratnakeu:1669	 vayam api kulaputrās tāṃ sahāṃ lokadhātuṃ gamiṣyāmo yatra sa śākyamunis tathāgato viharaty arhān samyaksaṃbuddhaḥ /	K10D0138_H0140:366b-6	རིགས་ཀྱི་བུ་དག་། ངེད་ཀྱང་འཇིག་རྟེན་གྱི་ཁམས་མི་མཇེད་དུ་དེ་བཞིན་གཤེགས་པ་དགྲ་བཅོམ་པ་ཡང་དག་པར་རྫོགས་པའི་སངས་རྒྱས་ཤའཀྱ་ཐུབ་པ་ག་ལ་བཞུགས་པ་དེར་འདོང་ངོ་༎
K10ratnakeu:167	 atha khalu tā mārakanyās tatra mārabhavane ekāṃsaṃ cīvaraṃ prāvṛtya dakṣiṇaṃ jānumaṇḍalaṃ  pṛthivyāṃ pratiṣṭhāpyāṃjaliṃ kṛtvā yasyāṃ diśi bhagavān viharati tāṃ diśaṃ nirīkṣamāṇā evam ūcuḥ //	K10D0138_H0140:298b-13	དེ་ནས་ཡང་བདུད་ཀྱི་བུ་མོ་དེ་དག་བདུད་ཀྱི་ཁང་པ་དེར་གོས་ཕྲག་པ་གཅིག་ཏུ་བགོས་ཏེ་བུས་མོ་ག-ཡས་པའི་ལྷ་ང་ས་ལ་བཙུགས་ནས་ཐལ་མོ་སྦྱར་ཏེ་བཅོམ་ལྡན་འདས་ཕྱོགས་གང་ན་བཞུགས་པའི་ཕྱོགས་དེར་བལྟས་ནས་འདི་སྐད་ཅེས་གསོལ
K10ratnakeu:1670	 ye 'pi daśasu dikṣu buddhā bhagavanta etarhi tiṣṭhanti dhriyanti yāpayaṃty anyonyāsu  lokadhātuṣu te sarve bodhisattvagaṇaparivṛtāḥ śrāvakasaṃghapuraskṛtāḥ tāṃ sahāṃ lokadhātuṃ	K10D0138_H0140:366b-8	ད་ལྟར་ཕྱོགས་བཅུའི་འཇིག་རྟེན་གྱི་ཁམས་གཞན་དག་ན་སངས་རྒྱས་བཅོམ་ལྡན་འདས་གང་དག་བཞུགས་ཤིང་འཚོ་ལ་གཞེས་པ་དེ་དག་ཐམས་ཅད་ཀྱང་བྱང་ཆུབ་སེམས་དཔའི་ཚོགས་ཀྱིས་བསྐོར་ཅིང་། ཉན་ཐོས་ཀྱི་དགེ་འདུན་དང་བཅས་པས་མདུན་དུ་བདར་ནས་འཇིག་རྟེན་གྱི་ཁམས་མི་མཇེད་དུ་དེ་བཞིན་༄༣༦༧ཨ་༌༎
K10ratnakeu:1672	 gamiṣyanti yatra śākyamunis tathāgato viharaty arhān samyaksaṃbuddhas tena (Kurumiya 116)	K10D0138_H0140:367a-1	གཤེགས་པ་དགྲ་བཅོམ་པ་ཡང་དག་པར་རྫོགས་པའི་སངས་རྒྱས་ཤའཀྱ་ཐུབ་པ་ག་ལ་བཞུགས་པ་དེར་གཤེགས་ཏེ་།
K10ratnakeu:1674	 dhāraṇīmudrāpadaprabhedapraveśavyākaraṇīṃ bhāṣiṣyaṃte 'dhiṣṭhāsyaṃty anyonyaṃ cānumodiṣyaṃti  sarvasattvānāṃ hitāya duścaritakarmanivāraṇāya bhadracaryāprapūraṇāyānuttarajñānaparipūraṇāya /	K10D0138_H0140:367a-2	དེ་བཞིན་གཤེགས་པ་ཤའཀྱ་ཐུབ་པ་དེ་དང་ལྷན་ཅིག་སེམས་ཅན་ཐམས་ཅད་ལ་ཕན་པ་དང་། ངན་པ་སྤྱོད་པ་ལས་བཟློག་པ་དང་། བཟང་པོའི་སྤྱོད་པ་ཡོངས་སུ་རྫོགས་པར་བྱ་བ་དང་། བླ་ན་མེད་པའི་ཡེ་ཤེས་ཡོངས་སུ་རྫོགས་པར་བྱ་བའི་ཕྱིར་ཆོས་མཉམ་པ་ཉིད་རྡོ་རྗེ་ལྟ་བུ་བརྟེན་པའི་ཆོས་ཀྱི་སྙིང་པོས་ལུས་འཇོམས་པ་ཞེས་བྱ་བའི་གཟུངས་ཕྱག་རྒྱ་དང་། ཚིག་རབ་ཏུ་དབྱེ་བ་ལ་འཇུག་པ་ལུང་བསྟན་པ་འདི་འཆད་པར་འགྱུར་། བྱིན་གྱིས་རློབ་པར་འགྱུར་། གཅིག་ལ་གཅིག་རྗེས་སུ་དགྱེས་པར་མཛད་པར་འགྱུར་རོ་༎
K10ratnakeu:1676	 te sarve buddhā bhagavanto 'dya tāṃ sahāṃ lokadhātuṃ sannipatya bodhisattvagaṇaparivṛtāḥ  śrāvakasaṃghapuraskṛtā imāṃ vajradharmasamatāṃ pratītyadharmahṛadayasamucchrayavidhvaṃsanīṃ	K10D0138_H0140:367a-6	སངས་རྒྱས་བཅོམ་ལྡན་འདས་དེ་དག་ཐམས་ཅད་འཇིག་རྟེན་གྱི་ཁམས་མི་མཇེད་དུ་འདུས་ནས་བྱང་ཆུབ་སེམས་དཔའི་ཚོགས་ཀྱིས་བསྐོར་ཅིང་ཉན་ཐོས་ཀྱི་དགེ་འདུན་གྱིས་བལྟས་ཏེ་ཆོས་མཉམ་པ་ཉིད་རྡོ་རྗེ་ལྟ་བུ་བརྟེན་པའི་ཆོས་ཀྱི་སྙིང་པོས་ལུས་འཇོམས་པ
K10ratnakeu:1678	 dhāraṇīmudrāpadaprabhedapraveśavyākaraṇīṃ bhāṣiṣyanti /  tad yo yuṣmākam icchati tāṃ vajradharmasamatāpratītyadharmahṛdayasamucchrayavidhvaṃsanīṃ  dhāraṇīmudrāpadaprabhedapraveśavyākaraṇīṃ śrotuṃ tāṃś cāprameyāsaṃkhyeyāṃ gaṃgānadīvālukopamān	K10D0138_H0140:367b-0	ཁྱེད་ཅག་ལས་གང་ཆོས་མཉམ་པ་ཉིད་རྡོ་རྗེ་ལྟ་བུ་བརྟེན་པའི་ཆོས་ཀྱི་སྙིང་པོས་ལུས་འཇོམས་པ་ཞེས་བྱ་བའི་གཟུངས་ཕྱག་རྒྱ་དང་། ཚིག་རབ་ཏུ་དབྱེ་བ་ལ་འཇུག་པ་ལུང་བསྟན་པ་མཉན་པ་དང་། སངས་རྒྱས་བཅོམ་ལྡན་འདས་ཚད་མེད་གྲངས་མེད་པ་༄༣༦༧བ་གངགའའི་ཀླུང་གི་བྱེ་མ་སྙེད་དུས་གཅིག་ཏུ་སངས་རྒྱས་ཀྱི་ཞིང་གཅིག་ན་བཞུགས་པ་དེ་དག་ལ་མཆོད་པ་བྱ་བ་དང་།
K10ratnakeu:1681	 ekakalpaikabuddhakṣetre buddhān bhagavataḥ tiṣṭhatah pūjayituṃ tāṃś ca dharmāṃ śrotuṃ  tāṃś ca sarvabuddhabodhisattvadevaviṣayasarvamāraviṣayabuddhakṣetrālaṃkāravyūhān	K10D0138_H0140:367b-1	ཆོས་དེ་ཡང་ཉན་པ་དང་། སངས་རྒྱས་དང་། བྱང་ཆུབ་སེམས་དཔའ་ཐམས་ཅད་དང་། ལྷའི་ཡུལ་དང་། བདུད་ཀྱི་ཡུལ་ཐམས་ཅད་དང་། སངས་རྒྱས་ཀྱི་ཞིང་གི་བརྒྱན་བཀོད་པ་དེ་དག་ལ་བལྟ་བ་དང་། སངས་རྒྱས་མང་པོ་འདུས་པ་སྔོན་མ་མཐོང་མ་ཐོས་པ་བལྟ་བར་འདོད་པ་དེ་དག་དང་། ད་ངེད་ལྷན་ཅིག་ཏུ་འཇིག་རྟེན་གྱི་ཁམས་མི་མཇེད་དུ་དེ་བཞིན་གཤེགས་པ་དགྲ་བཅོམ་པ་ཡང་དག་པར་རྫོགས་པའི་སངས་རྒྱས་ཤའཀྱ་ཐུབ་པ་ག་ལ་བ་དེར་འདོང་ངོ་༎
K10ratnakeu:1685	 atha te bodhisattvā mahāsattvās tāṃ buddhān bhagavanta evam āhuḥ /	K10D0138_H0140:367b-3	དེ་ནས་སངས་རྒྱས་བཅོམ་ལྡན་འདས་དེ་དག་ལ་བྱང་ཆུབ་སེམས་དཔའ་སེམས་དཔའ་ཆེན་པོ་དེ་དག་གིས་འདི་སྐད་ཅེས་གསོལ་ཏོ་༎
