src_segmentnr	src_original	tgt_segmentnr	tgt_original
K10ratnakeu:2225	 samyaṅnakṣatrarātridivasamāsārdhamāsartusaṃvatsarāṇi pravahiṣyaṃti /  sattvāś ca prāyo daśakuśalakarmapathacāriṇo bhaviṣyaṃti /  itaś cyutāḥ sugatisvargagāmino bhaviṣyaṃti /  te 'pi yuṣmatparivāro bhaviṣyati /	K10D0138_H0140:408a-0	འཐབ་པ་དང་། རྩོད་པ་དང་། མུ་གེ་དང་། ནད་དང་། ཕ་རོལ་གྱི་དམག་ཚོགས་དང་། དུག་དང་། ཤ་སྦྲང་དང་། སྦྲང་བུ་དང་། ༄༤༠༨ཨ་༌༎ ཕྱེ་མ་ལེབ་དང་། སྦྲུལ་གདུག་པ་དང་། གནོད་སྦྱིན་དང་། སྲིན་པོ་མ་རུངས་པ་དང་། རི་དབ༹གས་དང་། བྱ་དང་། སྤྱང་ཀི་དང་། དུས་མ་ཡིན་པའི་རླུང་དང་། ཆར་རྣམས་རབ་ཏུ་ཞི་བར་འགྱུར་། སྐར་མ་དང་། ཉིན་མོ་དང་། མཚན་མོ་དང་། ཟླ་བ་དང་། ཟླ་བ་ཕྱེད་པ་དང་། ལོ་དང་། དུས་རྣམས་ཀྱང་ལེགས་པར་འབྱུང་བར་འགྱུར་།
K10ratnakeu:2229	 evaṃ bahuguṇamahānuśaṃso 'yaṃ dhāraṇīdharmaparyāyaḥ /	K10D0138_H0140:408a-6	དེ་ལྟར་གཟུངས་ཀྱི་ཕྱག་རྒྱའི་ཆོས་ཀྱི་རྣམ་གྲངས་འདིའི་ཡོན་ཏན་མང་ཞིང་ཕན་ཡོན་ཆེ་སྟེ་།
K10ratnakeu:223	 tatv eṣa priyavigrahaḥ śaṭhamatiḥ śatrur mamātyuddhataḥ // RKP_1.32	K10D0138_H0140:300b-4	ལུས་མཛེས་ག-ཡོ་ཅན་བློ་གྲོས་ལྡན་འདི་ང་ཡི་དགྲར་ནི་རབ་ཏུ་གནད་༎
K10ratnakeu:2232	 saṃkṣepād (Kurumiya 151)  dṛṣṭadharmavedanīyo 'pi so mātṛgrāmātmabhāvaḥ ākṣiptaḥ sa sarvaḥ parikṣayaṃ yāsyati sthāpyānantaryakāriṇaṃ saddharmapratikṣepakaṃ vāryāpavādakaṃ vā /  yad anyat kāyavāṅmanaḥphalavipākadauṣṭhulyaṃ tat sarvaṃ parikṣayaṃ yāsyati /	K10D0138_H0140:408a-9	བུད་མེད་ཀྱི་དངོས་པོ་སྐྱེས་ནས་མྱོང་བར་འགྱུར་བ་དང་། ལན་གྲངས་གཞན་ལ་མྱོང་བར་འགྱུར་བ་མ་ལུས་པར་ཡོངས་སུ་ཟད་པར་འགྱུར་རོ་༎ མདོར་ན་ཚེ་འདི་ལ་བུད་མེད་ཀྱི་དངོས་པོ་མྱོང་བར་འགྱུར་བར་འཕངས་པ་ཐམས་ཅད་བྱང་བར་འགྱུར་ཏེ་། མཚམས་མེད་པ་བྱེད་པ་དང་། དམ་པའི་ཆོས་སྤོང་བ་དང་། འཕགས་པ་ལ་སྐུར་པ་འདེབས་པ་མ་གཏོགས་པར་གང་གཞན་ལུས་དང་། ངག་དང་། ཡིད་ཀྱི་༄༤༠༨བ་འབྲས་བུ་རྣམ་པར་སྨིན་པའི་གནས་ངན་ལེན་དེ་ཐམས་ཅད་ཡོངས་སུ་བྱང་བར་འགྱུར་རོ་༎
K10ratnakeu:2235	 ya imaṃ dharmaparyāyam antaśaḥ pustakalikhitam api kṛtvā dhārayiṣyati tasya sumerumātrāṇi karmakleśāvaraṇāni parikṣayaṃ yāsyaṃti /	K10D0138_H0140:408b-1	གང་ཆོས་ཀྱི་རྣམ་གྲངས་འདི་ཐ་ན་གླེགས་བམ་ལ་བྲིས་ཏེ་འཆང་ནའང་འདུས་པ་ཆེན་པོ་སངས་རྒྱས་ཐམས་ཅད་ཀྱིས་བྱིན་གྱིས་བརླབས་པའི་གཟུངས་ཀྱི་ཆོས་ཀྱི་རྣམ་གྲངས་འདིའི་མཐུས་དེའི་ལས་དང་། ཉོན་མོངས་པའི་སྒྲིབ་པ་རི་རབ་ཙམ་ཡང་བྱང་བར་འགྱུར་།
K10ratnakeu:2236	 sarvakuśalamūlāraṃbaṇāni ca vivṛddhiṃ pāripūriṃ yāsyaṃti /	K10D0138_H0140:408b-2	དགེ་བའི་རྩ་བ་ཐམས་ཅད་ལ་དམིགས་པ་འཕེལ་ཞིང་ཡོངས་སུ་རྫོགས་པར་འགྱུར་།
K10ratnakeu:2237	 sarvāṃgapāripūriḥ sarvābhiprāyasaṃpattiḥ sarvāṇi kāyavāṅmanaḥsucaritāni vivardhiṣyaṃti /	K10D0138_H0140:408b-3	ཡན་ལག་ཐམས་ཅད་ཡོངས་སུ་རྫོགས་པ་དང་། བསམ་པ་ཐམས་ཅད་ཕུན་སུམ་ཚོགས་པ་དང་། ལུས་དང་། ངག་དང་། ཡིད་ཀྱི་ལེགས་པར་སྤྱོད་པ་ཐམས་ཅད་འཕེལ་བར་འགྱུར་།
K10ratnakeu:2238	 sarvakudṛṣṭiprahāṇaṃ sarvaśatrusahadharmanigrahaḥ sarvasūkṣmaśāntamārgāvatāro bhaviṣyati /	K10D0138_H0140:408b-4	ལྟ་བ་ངན་པ་ཐམས་ཅད་སྤོང་བ་དང་། དགྲ་ཐམས་ཅད་ཆོས་དང་མཐུན་པར་ཚར་གཅོད་པ་དང་། ཞི་ཞིང་ཕྲ་བའི་ལས་ཐམས་ཅད་ལ་འཇུག་པར་འགྱུར་རོ་༎
K10ratnakeu:2239	 asya sarvabuddhādhiṣṭhitasya mahāsannipātadhāraṇīdharmaparyāyasya prabhāvena //  yatra ca viṣaye punar ayaṃ dhāraṇīdharmaparyāyaḥ	K10D0138_H0140:408b-5	ཡུལ་གང་དུ་གཟུངས་ཀྱི་ཆོས་ཀྱི་རྣམ་གྲངས་འདི་སྤྱོད་པར་འགྱུར་བ་དེར་སངས་རྒྱས་ཐམས་ཅད་ཀྱིས་བྱིན་གྱིས་བརླབས་པ་འདུས་པ་ཆེན་པོའི་གཟུངས་ཀྱི་ཆོས་ཀྱི་རྣམ་གྲངས་འདིའི་མཐུས་ས་ཕྱོགས་དེ་ཤིན་ཏུ་སྣུམ་པར་འགྱུར་།
K10ratnakeu:2241	 pracariṣyati tatra sā pṛthivī snigdhatarā bhaviṣyati /  ojovatī mṛṣṭaphalarasā bhaviṣyati /	K10D0138_H0140:408b-6	འབྲས་བུ་མདངས་དང་ལྡན་པ་དང་། ཤིན་ཏུ་ཞིམ་པ་དང་། རོ་དང་ལྡན་པར་འགྱུར་།
K10ratnakeu:2243	 tiktakaṭukaparuṣavirasaparivarjitā bhaviṣyati /	K10D0138_H0140:408b-7	ཁ་བ་དང་། ཚ་བ་དང་། རྩུབ་པ་དང་། རོ་མེད་པ་སྤོང་བར་འགྱུར་།
K10ratnakeu:2244	 puṣpaphalasamṛddhatarā dhanadhānyakośakoṣṭhāgārakuṃbhakalaśavṛddhir bhaviṣyati /	K10D0138_H0140:408b-8	མེ་ཏོག་དང་། འབྲས་བུ་ཤིན་ཏུ་འབྱོར་པ་དང་། ནོར་དང་། འབྲུ་དང་། བང་བ་དང་། མཛོད་དང་། རྫ་ཕྲུ་དང་། བྱ་སྐྱོགས་རྣམས་རྣམ་པར་འཕེལ་བར་འགྱུར་།
K10ratnakeu:2245	 vastrānnapānauṣadhopakaraṇabhūyiṣṭhatarāḥ ye ca tatrānnapānopajīvinaḥ sattvās te	K10D0138_H0140:409a-0	གོས་༄༤༠༩ཨ་༌༎ དང་། ཟས་དང་། སྐོམ་དང་། སྨན་དང་། ཡོ་བྱད་རྣམས་ཤིན་ཏུ་མཆོག་ཏུ་འགྱུར་ཏེ་། དེ་ན་སེམས་ཅན་གང་དག་ཟས་དང་། སྐོམ་གྱིས་འཚོ་བ་དེ་དག་ནི་།
K10ratnakeu:2246	 'rogatarā bhaviṣyaṃti varṇavanto balavantaḥ smṛtivantaḥ prajñāvanto dharmakāmāḥ kuśalaparyeṣṭyabhiratāḥ pāpaparivarjitāḥ /	K10D0138_H0140:409a-2	ཤིན་ཏུ་ནད་མེད་པ་དང་། ནོར་དང་ལྡན་པ་དང་། ཁ་དོག་དང་། ལྡན་པ་དང་། སྟོབས་དང་ལྡན་པ་དང་། དྲན་པ་དང་ལྡན་པ་དང་། ཆོས་འདོད་པ་དང་། དགེ་བ་ཚོལ་བ་ལ་མངོན་པར་བརྩོན་པ་དང་། སྡིག་པའི་ལྟ་བ་ཡོངས་སུ་སྤོང་བར་འགྱུར་ཏེ་།
K10ratnakeu:2247	 te tataś cyavitvā yuṣmākaṃ sahabhāvyatayopapatsyaṃte /	K10D0138_H0140:409a-4	དེ་དག་འདི་ནས་ཤི་འཕོས་ནས་ཁྱེད་དང་སྐལ་བ་མཉམ་པར་སྐྱེ་བར་འགྱུར་ཏེ་།
K10ratnakeu:2248	 (Kurumiya 152) tayā yūyaṃ parivāravṛddhyā balavanto 'pratihatacakrā dharmabalena cāturvarṇyaṃ janakāyaṃ paripālayiṣyata /	K10D0138_H0140:409a-5	དེ་དག་ཁྱེད་ག-ཡོག་འཕེལ་ནས་སྟོབས་དང་ལྡན་ཞིང་ཐོགས་པ་མེད་པའི་ཚོགས་སུ་འགྱུར་གྱི་། ཆོས་ཀྱི་སྟོབས་ཀྱིས་རིགས་བཞིའི་སྐྱེ་བོའི་ཚོགས་ཡོངས་སུ་བསྐྱང་བར་གྱིས་ཤིག་།
K10ratnakeu:2249	 sattvān dharmārtheṣu niyokṣyata /	K10D0138_H0140:409a-7	སེམས་ཅན་རྣམས་ཆོས་ཀྱི་དོན་ལ་ཚུད་ཅིག་།
K10ratnakeu:225	 etā vai paricārikāḥ priyatamāḥ protsṛjya māṃ niṣkṛpāḥ	K10D0138_H0140:300b-5	རབ་ཏུ་སྡུག་པའི་ག-ཡོག་མོ་དེ་དག་སྙིང་རྗེ་མེད་པས་ང་བོར་ཏེ་༎
K10ratnakeu:2250	 evaṃ yuṣmābhiḥ sarvatryadhvānugatānāṃ buddhānāṃ bhagavatāṃ pūjā kṛtā bhaviṣyati //	K10D0138_H0140:409a-8	དེ་ལྟར་ན་ཁྱོད་ཀྱིས་དུས་གསུམ་དུ་གཤེགས་པའི་སངས་རྒྱས་བཅོམ་ལྡན་འདས་ཐམས་ཅད་ལ་མཆོད་པ་བྱས་པར་འགྱུར་རོ་༎
K10ratnakeu:2251	 atha khalu māndāravagandharocas tathāgato viśuddhena buddhaviṣayajñānasvaraghoṣeṇārthapadavyāhārānurūpeṇa	K10D0138_H0140:409a-9	དེ་ནས་དེ་བཞིན་གཤེགས་པ་མེ་ཏོག་མནདའ་ར་བའི་དྲི་མོས་ཀྱིས་འདུས་པ་ཆེན་པོའི་མདོའི་ཆོས་ཀྱི་ཚུལ་འདི་གཟུང་བ་དང་། བཤད་པ་དང་། བསྲུང་བའི་ཕྱིར་སངས་རྒྱས་ཀྱི་ཡུལ་གྱི་ཡེ་ཤེས་ཀྱི་སྒྲ་དབྱངས་རྣམ་པར་དག་པས་དོན་དང་།
K10ratnakeu:2252	 kṛtsnam idaṃ buddhakṣetram āpūrya sarve ca bodhisattvā mahāsattvāḥ śakrendrā yāvad  brahmendrā mahoragendrā ye ceha buddhakṣetre nivāsino bhūyiṣṭhataram asyāṃ cāturdvīpikāyāṃ  nivāsinaḥ sarvabuddhānāṃ bhagavatāṃ vacanena cāsya mahāsannipātasūtrasya dharmanetryā  dhāraṇāya prakāśanāya rakṣaṇāyotsāhayām āsa //	K10D0138_H0140:409b-0	ཚིག་བརྗོད་པའི་ཚུལ་གྱིས་སངས་རྒྱས་ཀྱི་ཞིང་མ་ལུས་པ་འདི་ཀུན་བཀང་ནས་བྱང་ཆུབ་སེམས་དཔའ་སེམས་དཔའ་ཆེན་པོ་རྣམས་དང་། བརྒྱ་བྱིན་གྱི་དབང་པོ་༄༤༠༩བ་ནས་ཚངས་པའི་དབང་པོ་དང་། ལྟོ་འཕྱེ་ཆེན་པོ་ཐམས་ཅད་ཀྱི་བར་དུ་གང་དག་སངས་རྒྱས་ཀྱི་ཞིང་འདི་ན་གནས་པ་ཕལ་ཆེར་གླིང་བཞི་པ་འདི་ན་གནས་པ་རྣམས་ལ་སངས་རྒྱས་བཅོམ་ལྡན་འདས་ཀྱི་བཀས་སྤྲོ་བ་མཛད་དོ་༎
K10ratnakeu:2256	 tena khalu punaḥ samayena maitreyapūrvaṃgamāṇāṃ saptanavatikoṭīsahasrāṇi kṣāntipratilabdhānāṃ  bodhisattvānāṃ mahāsattvānām iha buddhakṣetre nivāsīni tāni sarvāṇy ekakaṇṭhenaivam āhuḥ /	K10D0138_H0140:409b-1	ཡང་དེའི་ཚེ་བྱང་ཆུབ་སེམས་དཔའ་སེམས་དཔའ་ཆེན་པོ་བྱམས་པ་ལ་སོགས་པ་གང་དག་བཟོད་པ་ཐོབ་པ་བྱེ་བ་སྟོང་ཕྲག་དགུ་བཅུ་རྩ་བདུན་སངས་རྒྱས་ཀྱི་ཞིང་འདི་ན་གནས་པ་འདི་དག་ཐམས་ཅད་ཀྱིས་མགྲིན་གཅིག་ཏུ་འདི་སྐད་ཅེས་གསོལ་ཏོ
K10ratnakeu:2258	 vayam api sarvabuddhānāṃ bhagavatāṃ vacanena sarvanetryadhvānugatānāṃ tathāgatānāṃ pūjārtham imaṃ dharmaparyāyaṃ nyāyataḥ śāstṛsaṃmataṃ gurugauraveṇa pratigṛhṇīmaḥ /	K10D0138_H0140:409b-2	༎ སངས་རྒྱས་བཅོམ་ལྡན་འདས་། བདག་ཅག་གིས་ཀྱང་དུས་གསུམ་དུ་གཤེགས་པ་ཐམས་ཅད་ལ་མཆོད་པའི་སླད་དུ་ཆོས་ཀྱི་རྣམ་གྲངས་འདི་རིགས་པས་སྟོན་པར་བཀུར་ཞིང་གུས་པ་ཆེན་པོས་གཟུང་བར་བགྱིའོ་༎
K10ratnakeu:2259	 kāruṇyena sattvaparipākārthaṃ yāvad anuttare mārge pratiṣṭhāpanārthaṃ vayam imaṃ dharmaparyāyaṃ grāmanagaranigamajanapadarājadhānyaraṇyāyataneṣu vistareṇoddyotayiṣyāmaḥ /	K10D0138_H0140:409b-4	སྙིང་རྗེས་སེམས་ཅན་ཡོངས་སུ་སྨིན་པར་བགྱི་བ་ནས་བླ་ན་མེད་པའི་ལམ་གྱི་བར་ལ་དགོད་པའི་སླད་དུ་བདག་ཅག་གིས་ཆོས་ཀྱི་རྣམ་གྲངས་འདི་གྲོང་དང་། གྲོང་ཁྱེར་དང་། གྲོང་རྡལ་དང་། ལྗོངས་དང་། ཡུལ་འཁོར་དང་། ཕོ་བྲང་འཁོར་དང་། དགོན་པའི་གནས་རྣམས་སུ་རྒྱས་པར་བསྟན་པར་བགྱིའོ་༎
K10ratnakeu:226	 bho bhos taṃ śramaṇaṃ gatā dya śaraṇaṃ kṛtvāpi māṃ sākṣiṇam /	K10D0138_H0140:300b-6	ང་ལ་དཔང་བཙུགས་ནས་ནི་དེ་རིང་དགེ་སྦྱོང་དེ་ཡི་སྐྱབས་སུ་དོང་༎
K10ratnakeu:2260	 sattvāṃś ca paripācayiṣyāmaḥ saddharmacirasthityarthaṃ /	K10D0138_H0140:409b-6	དམ་པའི་ཆོས་ཡུན་རིང་དུ་གནས་བར་བགྱི་བའི་སླད་དུ་སེམས་ཅན་རྣམས་ཀྱང་ཡོངས་སུ་སྨིན་པར་བགྱིའོ་༎
K10ratnakeu:2261	 tena khalu punaḥ samayena sarve buddhā bhagavantas tadbuddhakṣetrāntargatāḥ sādhukāraṃ pradaduḥ /	K10D0138_H0140:409b-7	ཡང་དེའི་ཚེ་སངས་རྒྱས་ཀྱི་ཞིང་འདིར་གཏོགས་པའི་སངས་རྒྱས་བཅོམ་ལྡན་འདས་དེ་དག་ཐམས་ཅད་ཀྱིས་ལེགས་སོ་༎
K10ratnakeu:2262	 sādhu sādhu satpuruṣā evaṃ yuṣmābhiḥ karaṇīyam //  (Kurumiya 153)	K10D0138_H0140:409b-9	སྐྱེས་བུ་དམ་པ་དག་། ལེགས་སོ་༎ ལེགས་སོ་༎ ཁྱོད་ཀྱིས་དེ་བཞིན་དུ་༄༤༡༠ཨ་༌༎
K10ratnakeu:2264	 atha khalu sarve śakrabrahmamahoragendrā ye caiha buddhakṣetre 'parāṇi catuḥṣaṣṭikoṭīnayutāni mahaujaskamahaujaskānāṃ sattvānāṃ te sarve ekakaṇṭhenaivam āhuḥ /	K10D0138_H0140:410a-1	གྱིས་ཤིག་། དེ་ནས་བརྒྱ་བྱིན་དང་། ཚངས་པ་ནས་ལྟོ་འཕྱེ་ཆེན་པོའི་དབང་པོའི་བར་ཐམས་ཅད་དང་། གང་དག་གཞན་ཡང་སངས་རྒྱས་ཀྱི་ཞིང་འདིར་འདུས་པ་། སེམས་ཅན་གཟི་བརྗིད་ཆེ་བ་། གཟི་བརྗིད་ཆེ་བ་བྱེ་བ་ཁྲག་ཁྲིག་ཕྲག་དྲུག་ཅུ་རྩ་བཞི་དེ་དག་ཐམས་ཅད་ཀྱིས་མགྲིན་གཅིག་ཏུ་འདི་སྐད་ཅེས་གསོལ་ཏོ་༎
K10ratnakeu:2265	 vayam apīmaṃ mahāsannipātaṃ dharmaparyāyam udgṛhīṣyāmo yāvad vistareṇa saṃprakāśayiṣyāmaḥ samuddyotayiṣyāmaḥ sattvāṃś ca paripācayiṣyāmaḥ saddharmacirasthityarthaṃ	K10D0138_H0140:410a-4	བདག་ཅག་གིས་ཀྱང་དམ་པའི་ཆོས་ཡུན་རིང་དུ་གནས་པར་བགྱི་བའི་སླད་དུ་འདུས་པ་ཆེན་པོའི་ཆོས་ཀྱི་རྣམ་གྲངས་འདི་གཟུང་བར་བགྱི་བ་ནས་རྒྱས་པར་རབ་ཏུ་བཤད་པའི་བར་དུ་བགྱིའོ་༎ ཡང་དག་པར་བསྟན་པར་བགྱིའོ་༎ སེམས་ཅན་རྣམས་ཡོངས་སུ་སྨིན་པར་བགྱིའོ་༎
K10ratnakeu:2266	 saddharmadhārakān dhārmaśravaṇikāṃś ca rakṣiṣyāmaḥ paripālayiṣyāmaḥ /	K10D0138_H0140:410a-7	ཆོས་འཚལ་བ་དང་། ཆོས་ཉན་པའི་གང་ཟག་རྣམས་ཀྱང་བསྲུང་བར་བགྱིའོ་༎ ཡོངས་སུ་བསྐྱང་བར་བགྱིའོ་༎
K10ratnakeu:2267	 yatra cāyaṃ dharmaparyāyaḥ pracariṣyati tatra vayaṃ sarvabuddhānāṃ bhagavatāṃ vacanena	K10D0138_H0140:410a-9	གང་དུ་ཆོས་ཀྱི་རྣམ་གྲངས་འདི་སྤྱོད་པར་འགྱུར་བ་དེར་སངས་རྒྱས་བཅོམ་ལྡན་འདས་ཐམས་ཅད་ཀྱི་བཀས་བདག་ཅག་གིས་ཀྱང་འཐབ་པ་དང་། རྩོད་པ་དང་། འཐབ་མོ་དང་། འགྱེད་པ་དང་། མུ་གེ་དང་། ཕ་རོལ་གྱི་དམག་ཚོགས་དང་།
K10ratnakeu:2268	 sarvakalikalahavigrahavivādadurbhikṣarogaparacakrākālavātavṛṣṭiśītoṣṇāni duṣṭarūkṣaparuṣavirasatiktakaṭukabhāvān praśamayiṣyāmaḥ /	K10D0138_H0140:410a-10	དུས་མ་ཡིན་པའི་རླུང་དང་། ཆར་པ་དང་། གྲང་བ་དང་། ཚ་བ་དང་། གདུག་པ་དང་། རྩུབ་པ་དང་། རོ་མ་མཆིས་པ་དང་། སྲ་བ་དང་། ཁ་བ་དང་། ཚ་བའི་དངོས་པོ་རྣམས་རབ་ཏུ་ཞི་བར་བགྱིའོ་༎
K10ratnakeu:2269	 kṣemaramaṇīyatāṃ subhikṣasāmagrīṃ saṃpādayiṣyāmaḥ /	K10D0138_H0140:410a-11	བདེ་བ་དང་། ཉམས་དགའ་བ་དང་། ལོ་ལེགས་པ་དང་། འདུམ་པ་བསྒྲུབ་པར་བགྱིའོ་༎
K10ratnakeu:227	 kuryāt kṛtsnam idaṃ bhavatrayam ataḥ śūnyaṃ śaṭho māyayā  bhasmīkurma ihādya yady atibalaṃ nāśu prayatnād vayaṃ // RKP_1.33	K10D0138_H0140:300b-7	གལ་ཏེ་བདག་ཅག་མྱུར་བསྒྲིམས་སྟོབས་ཆེན་འདི་དེང་ཐལ་བར་མ་བྱས་ན་༎ ག-ཡོ་དང་སྒྱུ་སྲིད་པ་གསུམ་པོ་དེ་དག་མ་ལུས་སྟོང་པར་བྱེད་༎
K10ratnakeu:2270	 saddharmanetrīcirasthityartham udyogam āpatsyāmaḥ /	K10D0138_H0140:410b-0	ཆོས་ཀྱི་ཚུལ་ཡུན་རིང་དུ་གནས་པར་བགྱི་བའི་སླད་དུ་༄༤༡༠བ་ནན་ཏན་ཆེར་བགྱིའོ་༎
K10ratnakeu:2271	 bhūyasyā mātrayā dhārmikān rājñaḥ paripālayiṣyāmaḥ /	K10D0138_H0140:410b-1	ཆོས་ཉན་པའི་རྒྱལ་པོ་དེ་དག་ཀྱང་ཤིན་ཏུ་ཡོངས་སུ་བསྐྱང་བར་བགྱིའོ་༎
K10ratnakeu:2272	 dhyānābhiratāṃś ca sattvān rakṣiṣyāmaḥ /	K10D0138_H0140:410b-2	བསམ་གཏན་ལ་མངོན་པར་དགའ་བའི་སེམས་ཅན་རྣམས་ཀྱང་བསྲུང་བར་བགྱིའོ་༎
K10ratnakeu:2273	 atha sarve te buddhā bhagavantaḥ sādhukāraṃ pradaduḥ /	K10D0138_H0140:410b-3	དེ་ནས་སངས་རྒྱས་བཅོམ་ལྡན་འདས་དེ་དག་ཐམས་ཅད་ཀྱིས་ལེགས་སོ་༎
K10ratnakeu:2274	 sādhu sādhu bhadramukhā evaṃ yuṣmābhiḥ karaṇīyaṃ /	K10D0138_H0140:410b-5	བཞིན་བཟང་དག་། ལེགས་སོ་༎ ལེགས་སོ་༎ ཁྱེད་ཀྱིས་དེ་བཞིན་དུ་གྱིས་ཤིག་།
K10ratnakeu:2275	 ātmobhayaparārtham udyogam āpattavyaṃ /	K10D0138_H0140:410b-8	བདག་དང་། གཞན་དང་། གཉི་གའི་ཕྱིར་ནན་ཏན་གྱིས་ཤིག་།
K10ratnakeu:2276	 evaṃ ca yuṣmābhis tryadhvānugatānāṃ buddhānāṃ bhagavatāṃ pūjā kṛtā bhaviṣyati /	K10D0138_H0140:410b-9	དེ་ལྟར་ན་ཁྱེད་ཀྱིས་དུས་གསུམ་དུ་གཤེགས་པའི་སངས་རྒྱས་བཅོམ་ལྡན་འདས་ཐམས་ཅད་ལ་མཆོད་པ་བྱས་པར་འགྱུར་རོ་༎
K10ratnakeu:2277	 yatra hi nāma yūyaṃ sattvaparipākārthaṃ saddharmanetryujjvālanārthaṃ saddharmacirasthityartham udyuktā na cireṇa yūyaṃ kṣipram anuttarāṃ samyaksaṃodhim abhisaṃbhotsyata //	K10D0138_H0140:410b-10	འདི་ལྟར་ཁྱེད་ཀྱིས་སེམས་ཅན་ཡོངས་སུ་སྨིན་པར་བྱ་བ་དང་། དམ་པའི་ཆོས་ཀྱི་ཚུལ་འབར་བར་བྱ་བ་དང་། དམ་པའི་ཆོས་ཡུན་རིང་དུ་གནས་པར་བྱ་བའི་ཕྱིར་བརྩོན་ན་། ཁྱེད་རིང་པོར་མི་ཐོགས་པར་མྱུར་དུ་བླ་ན་མེད་པ་ཡང་དག་པར་རྫོགས་པའི་བྱང་ཆུབ་ཏུ་མངོན་པར་རྫོགས་པར་འཚང་རྒྱ་བར་འགྱུར་རོ་༎
K10ratnakeu:2278	 atha khalu ye 'syāṃ madhyamāyāṃ cāturdvīpikāyāṃ nivāsinaḥ śakrabrahmadevendrā mahoragendrā ye ca mahaujaskamahaujaskāḥ sattvās te sarve (Kurumiya	K10D0138_H0140:410b-12	དེ་ནས་དབུས་ཀྱི་གླིང་བཞི་པ་འདི་ན་གནས་པའི་བརྒྱ་བྱིན་དང་། ཚངས་པ་དང་། འཇིག་རྟེན་སྐྱོང་བ་དང་། ལྷའི་དབང་པོ་ནས་ལྟོ་འཕྱེ་ཆེན་པོའི་དབང་པོའི་བར་དང་། གང་དག་ཡང་སེམས་ཅན་གཟི་བརྗིད་ཆེ་བ་།
K10ratnakeu:2279	 utthāyāsanāt prāṃjalayaḥ sthitvaivam āhuḥ /	K10D0138_H0140:410b-13	གཟི་བརྗིད་ཆེ་བ་དེ་དག་ཐམས་ཅད་སྟན་ལས་ལངས་ཏེ་ཐལ་མོ་སྦྱར་ནས་འདུས་ཏེ་འདི་སྐད་ཅེས་གསོལ་ཏོ་༎
K10ratnakeu:2280	 vayam api sarvabuddhānāṃ bhagavatāṃ vacanenemāṃ saddharmanetrīm uddyotayiṣyāmaḥ rakṣiṣyāmaḥ /	K10D0138_H0140:410b-14	སངས་རྒྱས་བཅོམ་ལྡན་འདས་ཐམས་ཅད་ཀྱི་བཀས་བདག་ཅག་གིས་ཀྱང་ཆོས་ཀྱི་ཚུལ་འདི་བསྟན་པར་བགྱི་། བསྲུང་བར་བགྱི་།
