src_segmentnr	src_original	tgt_segmentnr	tgt_original
K10ratnakeu:305	 lakṣmī gatā mama punar na paraiti tāvad yāvat kṛto 'sya na + śākyasutasya nāśaḥ	K10D0138_H0140:304b-1	ཤའཀྱའི་བུ་ནི་ཇི་སྲིད་བརླགས་པར་མ་བྱས་པ་༎ དེ་སྲིད་བར་དུ་ང་ཡི་དཔལ་སོང་སླར་མི་འོང་༎
K10ratnakeu:307	 tūṣṇīṃ sthitā vayam ananyamanaḥpratarkāḥ śākyātmajaṃ kathaṃ im';  adya tu ghātayema // RKP_1.44	K10D0138_H0140:304b-3	ཤའཀྱའི་བུ་འདི་ཇི་ལྟར་དེ་རིང་གསད་སྙམ་སྟེ་༎ བདག་ཅག་གཞན་ལ་ཡིད་མི་རྟོག་ཅིང་མི་སྨྲ་འདུག་།
K10ratnakeu:309	 atha māraḥ pāpīmān durmanaska eva śokāgāre niṣaṇṇaḥ //	K10D0138_H0140:304b-5	དེ་ནས་བདུད་སྡིག་ཅན་ཡིད་མི་བདེ་ཞིང་མྱ་ངན་གྱི་ཁང་པ་ན་འདུག་གོ་།
K10ratnakeu:31	 yat khalu māṇavakā yūyaṃ jānīdhvam āvāṃ jarāmaraṇasāgarapāraṃgamāya tathāgatam uddiśya pravrajyāṃ saṃprasthitau /	K10D0138_H0140:294b-4	ངེད་ནི་། རྒ་བ་དང་། ན་བ་དང་། འཆི་བའི་རྒྱ་མཚོའི་ཕ་རོལ་ཏུ་འགྲོ་བར་བྱ་བའི་ཕྱིར་དེ་བཞིན་གཤེགས་པ་ལ་རབ་ཏུ་འབྱུང་བར་ཡང་དག་པར་ཆས་ཀྱི་། ཁྱེད་ཀྱིས་ཤེས་པར་གྱིས་ཤིག་།
K10ratnakeu:310	 mahāyānasūtrād ratnaketumārajihmīkaraṇaparivarto nāma prathamaḥ // //	K10D0138_H0140:304b-7	བདུད་སྤ་བཀོང་བའི་ལེའུ་སྟེ་དང་པོའོ་༎༎
K10ratnakeu:312	 atha tā mārakanyā māraputrāś ca sagaṇapāriṣadyā bhagavantam evam āhuḥ /	K10D0138_H0140:304b-8	བམ་པོ་གཉིས་པ༏་དེ་ནས་བདུད་ཀྱི་བུ་མོ་དང་། བདུད་ཀྱི་བུ་ཚོགས་ཀྱི་འཁོར་དང་བཅས་པ་དེ་དག་གིས་བཅོམ་ལྡན་འདས་ལ་འདི་སྐད་ཅེས་གསོལ་ཏོ་༎
K10ratnakeu:313	 arthikā vayaṃ bhagavann anenaivaṃrūpeṇa yānena ca jñānena ca riddhyā kṛpayopāyena pratibhānena ca āścaryaṃ bhagavan yāvad upāyajñānasamanvāgatas tathāgataḥ /	K10D0138_H0140:304b-9	བཅོམ་ལྡན་འདས་། བདག་ཅག་ནི༏་འདི་ལྟ་བུའི་ཐེག་པ་དང་། ཡེ་ཤེས་དང་། རྫུ་འཕྲུལ་དང་། སྙིང་རྗེ་དང་། ཐབས་དང་། སྤོབས་པ་འཚལ་ལོ་༎ བཅོམ་ལྡན་འདས་། དེ་བཞིན་གཤེགས་པ་ཐབས་དང་། ཡེ་ཤེས་ཀྱི་བར་དུ་ལྡན་པ་ངོ་མཚར་ཏོ་༎ བཅོམ་ལྡན་འདས་།
K10ratnakeu:314	 katamair bhagavan dharmaiḥ samanvāgataḥ puruṣapudgalo na ca pāpamitrahastaṃ gacchati /  kṣipraṃ cānuttarāṃ samyaksaṃbodhim abhisaṃbudhyate //	K10D0138_H0140:304b-14	ཆོས་དུ་དང་ལྡན་ན་། སྐྱེས་བུ་གང་ཟག་སྡིག་པའི་གྲོགས་པོའི་ལག་ཏུ་མི་མཆི་ཞིང་མྱུར་དུ་བླ་ན་མེད་པ་ཡང་དག་པར་རྫོགས་པའི་བྱང་ཆུབ་མངོན་པར་རྫོགས་པར་འཚང་རྒྱ་།
K10ratnakeu:316	 bhagavān āha /	K10D0138_H0140:304b-16	བཅོམ་ལྡན་འདས་ཀྱིས་བཀའ་སྩལ་པ་།
K10ratnakeu:317	 caturbhir dharmaiḥ samanvāgataḥ kulaputrā ihaikatyapuruṣapudgalo na pāpamitrahastaṃ gacchati /  kṣipraṃ cānuttarāṃ samyaksaṃbodhim abhisaṃbudhyate /	K10D0138_H0140:304b-17	རིགས་ཀྱི་བུ་དག་། ཆོས་བཞི་དང་ལྡན་ན་། འདི་༄༣༠༥ཨ་༌༎ ལས་སྐྱེས་བུ་གང་ཟག་ལ་ལ་སྡིག་པའི་གྲོགས་པོའི་ལག་ཏུ་མི་འགྲོ་ཞིང་མྱུར་དུ་བླ་ན་མེད་པ་ཡང་དག་པར་རྫོགས་པའི་བྱང་ཆུབ་ཏུ་མངོན་པར་རྫོགས་པར་འཚང་རྒྱའོ་༎
K10ratnakeu:319	 katamaiś caturbhiḥ /	K10D0138_H0140:305a-1	བཞི་གང་ཞེ་ན་།
K10ratnakeu:32	 yaḥ punar yuṣmākaṃ necchati bhagavataḥ śāsane pravrajitum ihaiva nivartatāṃ /	K10D0138_H0140:294b-6	ཁྱེད་རྣམས་ལས་གང་བཅོམ་ལྡན་འདས་ཀྱི་བསྟན་པ་ལ་རབ་ཏུ་འབྱུང་མི་འདོད་པ་དེ་ནི་། འདི་ནས་ཕྱིར་ལོག་གཅིག་།
K10ratnakeu:320	 iha bhadramukhāḥ kulaputraḥ sarvadharmān na parāmārṣṭi /	K10D0138_H0140:305a-2	བཞིན་བཟང་དག་། འདི་ལ་རིགས་ཀྱི་བུ་ཆོས་ཐམས་ཅད་ལ་མཆོག་ཏུ་མི་འཛིན་ཅིང་།
K10ratnakeu:321	 na ca kvacid dharmam udgṛhṇāti nopādatte nādhitiṣṭhati na kalpayati na vikalpayati	K10D0138_H0140:305a-5	མི་གཏོང་། ཁས་མི་ལེན་། མི་གནས༏་ཉེ་བར་མི་ལེ་ན་། མི་རྟོག་། རྣམ་པར་མི་རྟོག་གོ་།
K10ratnakeu:322	 yad uta dānapāramitāyāṃ caran na dānaphalaṃ riñcati nodgṛhṇāti nopādatte nādhitiṣṭhati	K10D0138_H0140:305a-8	འདི་ལྟ་སྟེ་། སྦྱིན་པའི་ཕ་རོལ་ཏུ་ཕྱིན་པ་ལ་སྤྱོད་པ་ན་སྦྱིན་པའི་འབྲས་བུའང་མི་གཏོང་མི་འཛིན་། ཁས་མི་ལེན་། ཉེ་བར་མི་ལེན༏་མི་གནས་། མི་རྟོག་། རྣམ་པར་མི་རྟོག་སྟེ་།
K10ratnakeu:323	 na kalpayati na vikalpayati yāvat prajñāpāramitāyām api caran yāvan na kalpayati na vikalpayati //	K10D0138_H0140:305a-13	ཤེས་རབ་ཀྱི་ཕ་རོལ་ཏུ་ཕྱིན་པའི་བར་དུ་སྤྱོད་པ་ན་མི་རྟོག་། རྣམ་པར་མི་རྟོག་པའི་བར་དུའོ་༎
K10ratnakeu:324	 punar aparaṃ bhadramukhāḥ sa kulaputro na sattvavādī bhavati na jīvavādī na poṣavādī (Kurumiya 25)	K10D0138_H0140:305a-15	བཞིན་བཟང་དག་། གཞན་ཡང་རིགས་ཀྱི་བུ་དེ་སེམས་ཅན་དུ་སྨྲ་བ་མ་ཡིན་། སྲོག་ཏུ་སྨྲ་བ་མ་ཡིན་།
K10ratnakeu:325	 na pudgalavādī na sattvadhātuṃ manasā parāmārṣṭi yāvan na kalpayati na vikalpayati //	K10D0138_H0140:305a-18	གསོ་བར་སྨྲ་བ་མ་ཡིན་། གང་ཟག་ཏུ་སྨྲ་བ་མ་ཡིན་ཞིང་། སེམས་ཅན་དང་། སེམས་ཅན་གྱི་ཁམས་ལ་ཡིད་ཀྱིས་མཆོག་ཏུ་མི་འཛིན་པ་ནས་མི་རྟོག་།
K10ratnakeu:326	 punar aparaṃ bhadramukhāḥ sa kulaputro na rūpaśabdagandharasaspraṣṭavyāni parāmārṣṭi yāvan na kalpayati na vikalpayati //	K10D0138_H0140:305a-22	བཞིན་བཟང་དག་། རིགས་ཀྱི་བུ་མོ་དེ་གཟུགས་དང་། སྒྲ་དང་། དྲི་དང་། རོ་དང་། རེག་བྱ་ལ་མཆོག་ཏུ་མི་འཛིན་པ་ནས་མི་རྟོག་།
K10ratnakeu:327	 punar aparaṃ bhadramukhāḥ sa kulaputraḥ sarvatryadhvatraidhātukaskandhadhātvāyatanānāṃ  hetupratyālaṃbanaphalavipākasamutthānāśrayotpādān na parāmārṣṭi yāvan na kalpayati na vikalpayati //  tat kutaḥ / sarvajñajñānaṃ sarvacaryādhiṣṭhānaviṣayakalpavikalparahitam anupalambhayogena ca kartavyaṃ //	K10D0138_H0140:305a-26	བཞིན་བཟང་དག་། གཞན་ཡང་རིགས་ཀྱི་བུ་དེ་ཁམས་གསུམ་དང་། ༄༣༠༥བ་དུས་གསུམ་དང་། ཕུང་པོ་དང་། ཁམས་དང་། སྐྱེ་མཆེད་རྣམས་ཀྱི་རྒྱུ་དང་། རྐྱེ་ན་དང་། དམིགས་པ་དང་། འབྲས་བུ་རྣམ་པར་སྨིན་པ་འབྱུང་བ་དང་། གནས་པ་དང་། སྐྱེ་བ་ཐམས་ཅད་ལ་མཆོག་ཏུ་མི་འཛིན་པ་ནས་མི་རྟོག་།
K10ratnakeu:33	 sarvāṇi ca tāni paṃcamāṇavakānāṃ śatāny evam āhuḥ /	K10D0138_H0140:294b-8	དེ་ནས་བྲམ་ཟེའི་ཁྱེའུ་ལྔ་བརྒྱ་པོ་དེ་དག་ཐམས་ཅད་ཀྱིས་འདི་སྐད་ཅེས་སྨྲས་སོ་༎
K10ratnakeu:332	 acintyānāhārāmatsarāprapañcārajāvirajaniravayavā niṣkiṃcanākārakāvedakānāśrayāgrāhyāvijñaptikāpratibhāsākṣaṇikā	K10D0138_H0140:305b-38	ཅིའང་མེད་པ་། བྱེད་པ་པོ་མེད་པ་། ཚོར་བ་པོ་མེད་པ་། རྟེན་མེད་པ་། གཟུང་བ་མེད་པ་། རྣམ་པར་རིག་པ་མེད་པ་། སོ་སོར་སྣང་བ་མེད་པ་།
K10ratnakeu:337	 yaḥ kaścid bhadramukhāḥ sarvaviṣayasaṃgasamucchrayalakṣaṇādhiṣṭhānavyavacāreṇa sarvajñajñānaṃ paryeṣate sa dvayasakto bhavati /	K10D0138_H0140:306a-7	བཞིན་བཟང་དག་། གང་ལ་ལ་ཡུལ་ཐམས་ཅད་ལ་ཆགས་པའི་ཡུལ་གྱི་མཚན་ཉིད་ཀྱི་གནས་ལ་རྣམ་པར་སྤྱོད་པས་ཐམས་ཅད་མཁྱེན་པའི་ཡེ་ཤེས་ཚོལ་ན་། དེ་གཉིས་ལ་ཆགས་པ་ཡིན་ཏེ་།
K10ratnakeu:338	 dvayasaktamanaḥsaṃkalpo visaṃvādayati sarvajñatāḥ /	K10D0138_H0140:306a-10	དེ་གཉིས་ལ་ཆགས་པའི་ཡིད་ཀྱིས་བརྣག་པ་ནི་། ཐམས་ཅད་མཁྱེན་པ་ཉིད་སླུ་བར་བྱེད་དོ་༎
K10ratnakeu:339	 tatra katamad dvayam /	K10D0138_H0140:306a-12	དེ་ལ་གཉིས་གང་ཞེ་ན་།
K10ratnakeu:34	 yat kiṃcid vayaṃ jānīmas tat sarvaṃ yuvayor anubhāvena /	K10D0138_H0140:294b-9	བདག་ཅག་ཅུང་ཟད་ཤེས་པ་དེ་ཀུན་ཀྱང་ཁྱེད་ཀྱི་མཐུན་།
K10ratnakeu:340	 yat skandhadhātvāyatanāni lakṣaṇavyavacāreṇādhitiṣṭhati parāmārṣṭi dvayam etad visaṃvādayati sarvajñatāḥ /	K10D0138_H0140:306a-13	གང་ཕུང་པོ་དང་། ཁམས་དང་། སྐྱེ་མཆེད་རྣམས་ལ་མཚན་ཉིད་དུ་རྣམ་པར་སྤྱོད་པས་གནས་པ་དང་། མཆོག་ཏུ་འཛིན་པ་དེ་ནི་། གཉིས་ཏེ་། ཐམས་ཅད་མཁྱེན་པ་ཉིད་སླུ་བའོ་༎
K10ratnakeu:341	 caryādhiṣṭhānaphalakalpanā dvayam etat /	K10D0138_H0140:306a-15	སྤྱོད་པའི་གནས་དང་། འབྲས་བུ་ལ་རྟོག་པ་འདི་ནི་།
K10ratnakeu:342	 jātibhavopādānasattvādhiṣṭhānakalpanā dvayam etat /	K10D0138_H0140:306a-16	གཉིས་སོ་༎ སྐྱེ་བ་དང་། སྲེད་པ་དང་། ལེན་པ་དང་། སེམས་ཅན་གྱི་གནས་ལ་རྟོག་པ་འདི་ནི་།
K10ratnakeu:343	 deśanāprakāśanāprajñāpanavākpatharutavyāhārādhiṣṭhānakalpanā dvayam etat /	K10D0138_H0140:306b-0	གཉིས་སོ་༎ བཤད་པ་དང་། རབ་ཏུ་བསྟན་པ་དང་། གདམས་པ་དང་། ཚིག་གི་ལམ་དང་། སྒྲ་དང་། སྐད་༄༣༠༦བ་ཀྱི་གནས་ལ་རྟོག་པ་འདི་ནི་།
K10ratnakeu:344	 ucchedaśāśvatavyavalokanajñānajñeyādhiṣṭhānakalpanā dvayam etat /	K10D0138_H0140:306b-1	གཉིས་སོ་༎ རྟག་པ་དང་། ཆད་པ་ལ་རྣམ་པར་ལྟ་བའི་ཤེས་པ་དང་། ཤེས་བྱའི་གནས་ལ་རྟོག་པ་འདི་ནི་།
K10ratnakeu:345	 sattvajīvapoṣapuruṣapudgalakārakakārāpakasaṃjñādhiṣṭhānakalpanā dvayam etat /	K10D0138_H0140:306b-2	གཉིས་སོ་༎ སེམས་ཅན་དང་། སྲོག་དང་། གསོ་བ་དང་། སྐྱེས་བུ་དང་། གང་ཟག་དང་། བྱེད་པ་པོ་དང་། བྱེད་དུ་འཇུག་པའི་འདུ་ཤེས་ཀྱི་གནས་ལ་རྟོག་པ་འདི་ནི་།
K10ratnakeu:35	 nūnaṃ yuvām udārasthāne pravrajitau /	K10D0138_H0140:294b-10	ཁྱེད་རྒྱ་ཆེན་པོའི་གནས་སུ་རབ་ཏུ་འབྱུང་ན་།
K10ratnakeu:352	 atha khalu tasyām eva pariṣadi dhāraṇamatir nāma bodhisattvaḥ sannipatito 'bhūt sanniṣaṇṇaḥ /  sa yena bhagavāṃs tenāṃjaliṃ praṇāmyaivam āha /	K10D0138_H0140:307a-1	ཆེན་པོ་གཟུངས་ཀྱི་བློ་གྲོས་ཞེས་བྱ་བ་འཁོར་དེར་འདུས་པར་གྱུར་ནས་འདུག་པ་དེས་བཅོམ་ལྡན་འདས་ག་ལ་བ་དེ་ལོགས་སུ་ཐལ་མོ་སྦྱར་བ་བཏུད་དེ་འདི་སྐད་ཅེས་གསོལ་ཏོ་༎ བཅོམ་ལྡན་འདས་།
K10ratnakeu:354	 yad anabhilapyaṃ tac chakyam abhisaṃboddhum //	K10D0138_H0140:307a-3	གང་བརྗོད་དུ་མ་མཆིས་པ་དེ་མངོན་པར་རྫོགས་པར་འཚང་རྒྱ་བར་ནུས་ལགས་སམ་།
K10ratnakeu:355	 bhagavān āha /  eṣa evābhisaṃbodho yad anabhilapyaṃ jānīte /	K10D0138_H0140:307a-4	བཅོམ་ལྡན་འདས་ཀྱིས་བཀའ་སྩལ་པ༏་གང་བརྗོད་དུ་མེད་པར་ཤེས་པ་དེ་ཉིད་མངོན་པར་རྫོགས་པར་འཚང་རྒྱ་བའོ་༎
K10ratnakeu:357	 tena hi kulaputra tvām eva pravakṣyāmi /	K10D0138_H0140:307a-5	དེའི་ཕྱིར་རིགས་ཀྱི་བུ་ཁྱོད་ཉིད་ལ་དྲིའི་།
K10ratnakeu:358	 yathā te kṣamaṃ tathā vyākuru /	K10D0138_H0140:307a-6	ཁྱོད་ཀྱིས་ཇི་ལྟར་བཟད་པ་དེ་བཞིན་དུ་ལན་ཐོབ་ཅིག་།
K10ratnakeu:359	 asti dravyalakṣaṇabhāvo yaḥ sarvajñatānāma labhate /	K10D0138_H0140:307a-7	གང་ཐམས་ཅད་མཁྱེན་པའི་མིང་ཐོབ་པར་འགྱུར་བའི་རྫས་ཀྱི་མཚན་ཉིད་ཀྱི་དངོས་པོ་གང་ཡང་ཡོད་དམ་།
K10ratnakeu:36	 yam uddiśya pravrajitau yuvāṃ tam uddiśya vayam api pravrajiṣyāmaḥ //	K10D0138_H0140:294b-11	ཁྱེད་གང་ལས་རབ་ཏུ་འབྱུང་བ་དེ་ལས་བདག་ཅག་ཀྱང་རབ་ཏུ་འབྱུང་ངོ་༎
K10ratnakeu:360	 āha yady astīti vakṣyāmi śāśvato bhaviṣyati /  atha nāstīti vakṣyāmy ucchedo bhaviṣyati /	K10D0138_H0140:307a-8	གསོལ་པ་། གལ་ཏེ་མཆིས་ཞེས་བགྱིས་ན་ནི་། རྟག་པར་འགྱུར་། ཅི་སྟེ་མ་མཆིས་ཞེས་བ་གྱིས་ན་ནི་། ཆད་པར་འགྱུར་།
K10ratnakeu:362	 madhyamā ca pratipan nopalabhyate //	K10D0138_H0140:307a-12	དབུ་མའི་ལམ་ནི་། དམིགས་སུ་མ་མཆིས་ཏེ་།
K10ratnakeu:363	 nāsāv asti nāpi nāstīti /	K10D0138_H0140:307a-14	དེ་ནི་། མཆིས་པའང་མ་ལགས་། མ་མཆིས་པའང་མ་ལགས་སོ་༎
K10ratnakeu:37	 athopatiṣyakaulitau parivrājakau paṃcaśataparivārau bhagavaṃtam uddiśya pravrajyāṃ	K10D0138_H0140:294b-12	དེ་ནས་ཀུན་ཏུ་རྒྱུ་ཉེ་རྒྱལ་དང་། པང་ནས་སྐྱེས་ག-ཡོག་ལྔ་བརྒྱ་དང་བཅས་པ་བཅོམ་ལྡན་འདས་ལས་རབ་ཏུ་འབྱུང་བར་ཆས་པར་བདུད་སྡིག་ཅན་གྱིས་རིག་ནས་ཅི་ནས་དེ་གཉིས་དགེ་སྦྱོང་གོཨོ་ཏ་མའི་གན་དུ་འགྲོ་མི་ནུས་པར་བྱ་བའི་ཕྱིར་རྒྱལ་པོའི་ཁབ་ཀྱི་གྲོང་ཁྱེར་ཆེན་པོའི
K10ratnakeu:38	 saṃprasthitau viditvātha māraḥ pāpīmān bahirājagṛhasya mahānagarasya mahāprapātam	K10D0138_H0140:295a-0	ཕྱི་ལོགས་སུ་ག-ཡང་ས་ཆེན་པོ་ཟབས་སུ་དཔག་ཚད་༄༢༩༥ཨ་༌༎
K10ratnakeu:383	 yaḥ sarvadharmeṣu na sajyate nānunīyate (Kurumiya 29)  nopekṣate na pratihanyate na spṛhayate na muhyate na gṛhṇāti na mucyaty eṣa evābhisaṃbodhaḥ //	K10D0138_H0140:308a-19	མི་རྨོངས་། མི་འཛིན་། མི་གཏོང་བ་འདི་ནི་། མངོན་པར་རྫོགས་༄༣༠༨བ་པར་འཚང་རྒྱ་བའོ་༎
K10ratnakeu:385	 padmagarbho bodhisattva āha /	K10D0138_H0140:308b-1	བྱང་ཆུབ་སེམས་དཔའ་པདམའི་སྙིང་པོས་གསོལ་པ་།
K10ratnakeu:386	 yaḥ puṇyapāpayor na sajjate gaṃbhīrakṣāṃtinayāvatāreṇāhaṃkāramamakārān na kalpayaty eṣa evābhisaṃbodhaḥ //	K10D0138_H0140:308b-2	གང་བསོད་ནམས་དང་སྡིག་པ་ལ་མི་ཆགས་ཤིང་། ཟབ་མོ་ལ་བཟོད་པའི་ཚུལ་ལ་འཇུག་པས་ངར་འཛིན་པ་དང་། ང་ཡིར་འཛིན་པ་ལ་མི་རྟོག་པ་འདི་ནི་། མངོན་པར་རྫོགས་པར་འཚང་རྒྱ་བའོ་༎
K10ratnakeu:387	 candraprabhaḥ kumārabhūta āha /	K10D0138_H0140:308b-5	ཟླ་འོད་གཞོན་ནུར་གྱུར་པས་གསོལ་པ་།
K10ratnakeu:388	 yo dagacandrasamān sarvadharmān na prajānīte na ca dharmāṇāṃ svabhāvam ācayaṃ cāpacayaṃ vā paśyaty eṣa evābhisaṃbodhaḥ //	K10D0138_H0140:308b-6	གང་ཆོས་ཐམས་ཅད་ཆུ་ཟླ་དང་མཚུངས་པར་རབ་ཏུ་འཚལ་ཅིང་ཆོས་རྣམས་ཀྱི་ངོ་བོ་ཉིད་གསོག་པ་དང་། འབྲི་བར་ཡང་མི་མཐོང་བ་འདི་ནི་། མངོན་པར་རྫོགས་པར་འཚང་རྒྱ་བའོ་༎
K10ratnakeu:389	 khagamatiḥ kumārabhūta āha /	K10D0138_H0140:308b-8	བྱང་ཆུབ་སེམས་དཔའ་རྣམ་མཁའི་བློ་གྲོས་གཞོན་ནུར་གྱུར་པས་གསོལ་པ་།
K10ratnakeu:39	 abhinirmitavān yojanaśatam adhastād (Kurumiya 4)	K10D0138_H0140:295a-1	བརྒྱ་པ་ཞིག་སྤྲུལ་ཏོ་༎
K10ratnakeu:390	 yasya sarvatamālokotpādavyayotkarṣāpacayaś cittacaitasikeṣu na pravartaṃta eṣa evābhisaṃbodhaḥ //	K10D0138_H0140:308b-9	གང་གི་སེམས་དང་སེམས་ལས་བྱུང་བ་ལ་མུན་པ་དང་། སྣང་བ་དང་། སྐྱེ་བ་དང་། འཇིག་པ་དང་། འཕེལ་བ་དང་། འབྲི་བ་ཐམས་ཅད་མི་འབྱུང་བ་འདི་ནི་། མངོན་པར་རྫོགས་པར་འཚང་རྒྱ་བའོ་༎
K10ratnakeu:391	 maitreyo bodhisattva āha /	K10D0138_H0140:308b-11	བྱང་ཆུབ་སེམས་དཔའ་བྱམས་པས་གསོལ་པ༏་གང་གནས་པ་ལ་གནས་པ་ན་ཁམས་གསུམ་པ་ལ་གནས་པའི་ཚངས་པ་ལ་མི་དམིགས་། མཉམ་པར་མི་བགྱིད་པ་འདི་ནི་།
K10ratnakeu:392	 ..... eṣa evābhisaṃbodhaḥ //  akṣayamatir bodhisattva āha /  yas trimaṇḍalapariśuddhyā pāramitāsv abhyāsaṃ karoty anupalaṃbhayogena na rajyate na virajyata eṣa evābhisaṃbodhaḥ //	K10D0138_H0140:308b-13	མངོན་པར་རྫོགས་པར་འཚང་རྒྱ་བའོ༏་༏བྱང་ཆུབ་སེམས་དཔའ་བློ་གྲོས་མི་ཟད་པས་གསོལ་པ་། གང་འཁོར་གསུམ་ཡོངས་སུ་དག་པས་ཕ་རོལ་ཏུ་ཕྱིན་པ་རྣམས་ལ་མི་དམིགས་པའི་ཚུལ་གྱིས་ར་༄༣༠༩ཨ་༌༎ ཏུ་གོམས་པར་བགྱིད་ཅིང་། མི་ཆགས་མི་སྐྱོ་བ་འདི་ནི་། མངོན་པར་རྫོགས་པར་འཚང་རྒྱ་བའོ་༎
K10ratnakeu:395	 maṃjuśrīḥ kumārabhūta āha /	K10D0138_H0140:309a-4	འཇམ་དཔལ་གཞོན་ནུར་གྱུར་པས་གསོལ་པ་། བཅོམ་ལྡན་འདས་།
K10ratnakeu:396	 yo bhagavan sarvadharmeṣu na rajyate na virajyate gaṃbhīradharmanayaṃ ca prajānāti /	K10D0138_H0140:309a-6	གང་ཆོས་ཐམས་ཅད་ལ་མི་ཆགས་མི་སྐྱོ་ཞིང་ཆོས་ཟབ་མོའི་ཚུལ་ཡང་རབ་ཏུ་འཚལ་ཏེ་།
K10ratnakeu:397	 yac ca prajānāti tan nāyūhati na niryūhati nākarṣati na vikarṣati na ca kasyacid dharmasyopacayaṃ (Kurumiya 30)  vāpacayaṃ vā vidyāṃ vā vimuktiṃ votpādayati vyayaṃ vā hāniṃ vā vṛddhiṃ vā vastuṣu na saṃkliṣyate 'vikalpanataḥ eṣa evābhisaṃbodhaḥ //	K10D0138_H0140:309a-7	གང་རབ་ཏུ་འཚལ་བ་དེའང་མི་ལེན་མི་འདོར་། སྡུད་པར་མི་བགྱིད་། བྲལ་བར་མི་བགྱིད་ཅིང་། འཕེལ་བའང་མི་བསྐྱེད་ལ་། དངོས་པོ་དག་ལ་རྣམ་པར་མི་རྟོག་པས་ཀུན་ནས་ཉོན་མོངས་པར་མི་འགྱུར་བ་འདི་ནི་། མངོན་པར་རྫོགས་པར་འཚང་རྒྱ་བ་སྟེ་།
K10ratnakeu:399	 anenaikanayena sarvajñajñānābhisaṃbodhaḥ //	K10D0138_H0140:309a-17	ཚུལ་གཅིག་པོ་འདིས་ཐམས་ཅད་མཁྱེན་པའི་ཡེ་ཤེས་མངོན་པར་རྫོགས་པར་འཚང་རྒྱའོ་༎
K10ratnakeu:4	 yuvayor eva manaḥpracāraniyamaṃ vijñāyatuṃ kiṃ yuvāṃ /	K10D0138_H0140:293b-8	ཁྱེད་གཉིས་ཡིད་ཀྱི་སྤྱོད་པ་ཅི་ལ་ངེས་པ་བགམ་པར་བྱ་བའི་ཕྱིར་༎
