src_segmentnr	src_original	tgt_segmentnr	tgt_original
K10sf107_sc:320	Mit_9.3 … nava dharmāḥ / parijñeyā ḥ / nava satvāvāsāḥ / katame nava / Mit_9.3.1 rūpiṅaḥ santi satvā nānātvakāyā nānātvasaṁjñinas tadyathā manuṣyā ekatyāś ca devāḥ / ayaṁ prathamaḥ satvāvāsaḥ / Mit_9.3.2 rūpiṇaḥ santi satvā nānātvakāyā ekatvasaṁjñinas tadyathā devā brahmakāyikā ya etat prathamābhinirvṛttāḥ / ayaṁ dvitīyaḥ saivāvāsaḥ /	T26n1542_006:0713b09_16	有九有情居，謂有色有情，身異想異，如人及一分天，是初有情居。 有色有情，身異想一，如梵眾天劫初時，是第二有情居。
K10sf107_sc:323	Mit_9.3.3 rūpiṇaḥ santi satvā ekatvakāyā nānātvasaṁjñinas tadyathā devā ābhāsvarāḥ / ayaṁ tṛīyaḥ satvārāsaḥ / Mit_9.3.4 rūpiṇaḥ santi satvā ekatvakāyā ekatvasiṁjñinas tadyatha devāḥ śubhakṛtsnāḥ / ayaṁ cuturthaḥ satvāvāsaḥ /	T26n1542_006:0713b12_3	有色有情，身一想異，如極光淨天，是第三有情居。 有色有情，身一想一，如遍淨天，是第四有情居。
K10sf107_sc:325	Mit_9.3.5 rūpiṇaḥ santi satvā asaṁjñino ’pratisaṁjñinas tadyathā devā asaṁjisatvāḥ / ayam pañcamaḥ satvāvāsaḥ /	T26n1542_006:0713b14_9	有色有情，無想無異想，如無想有情天，是第五有情居。
K10sf107_sc:326	Mit_9.3.6 arūpiṇaḥ santi satvāḥ sarvaśo rūpasaṁjñānāṁ samatikramāt pratihasaṁjñānām astangamān tadyathā devā āsāśānaṁtyāyatanapagāḥ / ayaṁ ṣaṣṭjaXxX94 satvāvāsaḥ /	T26n1542_006:0713b16_19	無色有情，超一切色想、滅有對想，不思惟種種想，入無邊空，空無邊處具足住，如空無邊處天，是第六有情居。
K10sf107_sc:329	Mit_9.3.7 arūpiṇaḥ santi satvāḥ sarvaśa ālāśānaṁtyāyatanaṁ samatikramyānantaṁ vijñānaṁ vijñānāṁtyāyatanam upasaṁpadya viharanti tadyathā devā vijñānānaṁtyāyatanopagāḥ / ayaṁ sapatmaḥ satvāvāsaḥ /	T26n1542_006:0713b18_19	無色有情，超一切空無邊處入無邊識，識無邊處具足住，如識無邊處天，是第七有情居。
K10sf107_sc:332	Mit_9.3.9 arūpiṇaḥ santi satvāḥ sarvaśa ākiṁcanyāyatanaṁ samatikramya naivasaṁjñānāsaṁjñāyatanam	T26n1542_006:0713b20_19	無色有情，超一切識無邊處入無所有，無所有處具足住，如無所有處天，是第八有情居。 無色有情，超一切無所有處入非想非非想處具足住，如非想非非想處天，是第九有情居。
