src_segmentnr	src_original	tgt_segmentnr	tgt_original
K10vimkn_u:171	 tāni cemāni buddhakṣetrapariśuddhiṃ paripṛcchanti ḥ katamā bodhisatvānāṃ buddhakṣetrapariśuddhir iti /  tat sādhu bhagavan deśayatu tathāgato 'mīṣāṃ bodhisatvānāṃ buddhakṣetrapariśuddhim /	T38n1781_002:0927b05_10	唯願世尊說諸菩薩淨土之行，此問淨土因也。 夫土所以淨者，必由於行，故請說行也。
K10vimkn_u:175	 sādhu khalu punas tvaṃ kumāra yas tvaṃ buddhakṣetrapariśuddhim ārabhya tathāgataṃ paripṛcchasi /	T38n1781_002:0927b09_6	乃能為諸菩薩問於如來淨土之行。
K10vimkn_u:176	 tena hi kumāra śṛṇu sādhu ca suṣṭhu ca manasikuru /	T38n1781_002:0927b10_2	諦聽諦聽，善思念之，當為汝說」。
K10vimkn_u:178	 sādhu bhagavann iti ratnākaro licchavikumāras tāni ca pañcamātrāṇi licchavikumāraśatāni bhagavataḥ pratyaśrauṣuḥ /	T38n1781_002:0927b13_7	當為汝說，此許說也。 「於是寶積及五百長者子受教而聽」。
K10vimkn_u:2431	 api tu gandhān kulaputrāḥ pratisaṃhṛtya taṃ lokadhātuṃ praviśata,  mā te satvā madapramādam āpatsyante /  svarūpaṃ ca pratisaṃharata,  mā te sahe lokadhātau satvā madgubhūtā bhaveyuḥ /  mā ca tasmin /  okadhātau hīnasaṃjñām utpādya pratighasaṃjñām utpādayata /	T38n1781_006:0980a15_13	「又汝於彼莫懷輕淺而作閡想。
K10vimkn_u:2437	 tat kasmād dhetoḥ /	T38n1781_006:0980a15_18	所以者何？
K10vimkn_u:2438	 ākāśakṣetrāṇi hi buddhakṣetrāṇi,	T38n1781_006:0980a16_9	十方國土皆如虛空」。
K10vimkn_u:2439	 satvaparipākāya tu buddhā bhagavanto na sarvaṃ buddhaviṣayaṃ saṃdarśayanti /	T38n1781_006:0980a17_6	初舉法身土誡之。 淨穢俱空，即是實相平等之土，諸佛法身之所同栖，未嘗優劣，故不應起高下心。 又諸佛為欲化諸樂小法者，不盡現其清淨土耳。 第二舉應迹土誡之。 諸佛適時而現淨穢，上方為淨緣而隱穢，下界為穢緣而隱淨耳。
K10vimkn_u:2440	 Vkn 9.9 atha nirmito bodhisatvas tad bhojanam ādāya sārdhaṃ tair navatyā bodhisatvasahasrair  buddhānubhāvena vimalakīrtyadhiṣṭhānena ca tenaiva kṣaṇalavamuhūrtena sarvagandhasugandhe  lokadhātāv antarhito vimalakīrter licchaver gṛhe pratyaṣṭhāt /	T38n1781_006:0980a24_10	「時化菩薩既受鉢飯，與彼九百萬菩薩俱承佛威神及維摩詰力，於彼世界忽然不現，須臾之間至維摩詰舍」。 第四化菩薩還歸本土。
K10vimkn_u:2443	 Vkn 9.10 tatra vimalakirtir navatisiṃhāsanasahasrāṇy adhitiṣṭhati yādṛśāny eva tāni prathamakāni siṃhāsanāni /	T38n1781_006:0980a25_6	就文又八： 第一從彼還此、二淨名設座待賓、三菩薩就坐、四化人飯授居士、五時眾雲集、六淨名勸食、七聲聞疑念、八菩薩呵譏。 「時維摩詰即化作九百萬師子之坐，嚴好如前」。 第二文也。 上明借坐，今辨化成，互現奇特。
K10vimkn_u:2444	 tatra te bodhisatvā niṣaṇṇāḥ /	T38n1781_006:0980b01_7	「諸菩薩皆坐其上」。
K10vimkn_u:2445	 sa ca nirmitas tad bhojanaparipūrṇaṃ bhājanaṃ vimalakīrter licchaver upanāmayati sma /	T38n1781_006:0980b01_13	第三就坐也。 「化菩薩以滿鉢香飯與維摩詰，飯香普熏毘耶離城及三千大千世界」。 第四授食與淨名。
K10vimkn_u:2446	 tasya bhojanasya gandhena sarvā vaiśālī mahānagarī nirdhūpitābhūd yāvat sāhasro lokadhātuḥ sugandhagandhīkṛto 'bhūt /	T38n1781_006:0980b04_12	天香逆風四十里，今是諸佛果報故並熏三千也。
K10vimkn_u:2447	 tatra vaiśālakā brāhmaṇagṛhapatayaḥ somacchatraś ca nāma licchavīnām adhipatis taṃ  gandham āghrāyāścaryaprāpto 'dbhutaprāptaḥ prahlāditakāyacetāḥ sārdhaṃ paripūrṇaiś	T38n1781_006:0980b05_22	「時毘耶離婆羅門、居士等，聞是香飯氣，身意快然，歎未曾有。 於是，長者主月蓋，從八萬四千人，來入維摩詰舍，見其室內菩薩甚多，諸師子坐高廣嚴好，皆大歡喜，禮眾菩薩及大弟子，却住一面」。 第五、時眾雲集。
K10vimkn_u:2450	 tenaiva ca bhojanagandhena bhūmāvacarā devaputrāḥ kāmāvacarā rūpāvacarāś ca devāḥ saṃcoditā vimalakīrter licchaver gṛham upasaṃkrāntā abhūvan	T38n1781_006:0980b12_18	「諸地神、虛空神，及欲、色界諸天，聞此香氣，亦皆來入維摩詰舍」。 此幽眾集。 小乘云： 色界無鼻識，何由聞香？
K10vimkn_u:2457	 tān sa nirmito bodhisatvaḥ śrāvakān etad avocat:  mā yūyam āyuṣmantaḥ svaprajñāpuṇyais tathāgataprajñāpuṇyāni samīkārṣṭa /  syāc caturṇāṃ mahāsamudrāṇāṃ kṣayaḥ,  na tv evāsya bhojanasya kaścit parikṣayaḥ /  sacet sarvasatvā api sumerumātrair ālopaiḥ kalpaṃ paribhuñjīran,	T38n1781_006:0980b13_20	又云： 借識故得聞者。 若前不聞，亦無因而借。 又大乘明義無微不察，故得聞香而至。 「時維摩詰語舍利弗等諸大聲聞：
K10vimkn_u:2463	 tat kasmād dhetoḥ /	T38n1781_006:0980c04_19	所以者何？
K10vimkn_u:2464	 akṣayaśīlasamādhiprajñānirjātasyedaṃ tathāgatasya pātrāvaśeṣaṃ bhojanaṃ naitac chakyaṃ kṣapayitum /	T38n1781_006:0980c06_5	無盡戒、定、智慧、解脫智見功德具足者，所食之餘，終不可盡」。
K10vimkn_u:2465	 Vkn 9.13 atha tato bhojanāt sarvā sā parṣat tṛptā kṛtā /	T38n1781_006:0980c06_15	一切人食，時人多也；
K10vimkn_u:2466	 na ca tāvad bhojanaṃ kṣīyate /	T38n1781_006:0980c07_4	揣食若須彌，所食大也； 一劫，明時久也。 而猶不盡，況此會乎？ 次舉五身釋之。 五身五為正果，香飯為依報，以正果無盡故，依果無盡。 又五身為本，香飯為迹，本既無盡，故應迹非窮。
K10vimkn_u:2467	 yaiś ca bodhisatvaiḥ śrāvakaiḥ śakrabrahmalokapālais tadanyaiś ca satvais tad bhojanaṃ bhuktam,  teṣāṃ tādṛśaṃ sukhaṃ kāye 'vakrāntaṃ yādṛśaṃ sarvasukhapratimaṇḍite lokadhātau bodhisatvānāṃ sukham /	T38n1781_006:0980c11_9	「於是鉢飯悉飽眾會，猶故不賜。 其諸菩薩、聲聞、天、人食此飯者，身安快樂，譬如一切樂莊嚴國諸菩薩也。
K10vimkn_u:2469	 sarvaromakūpebhyaś ca teṣāṃ tādṛśo gandhaḥ pravāti /  tadyathāpi nāma tasminn eva sarvagandhasugandhe lokadhātau vṛkṣāṇāṃ gandhaḥ /	T38n1781_006:0980c13_20	又諸毛孔皆出妙香，亦如眾香國土諸樹之香」。 淨土果有三： 一念食、二施食、三受食。
K10vimkn_u:2471	 Vkn 9.14 atha vimalakīrtir licchavir jānann eva tān bhagavato gandhottamakūṭasya tathāgatasya buddhakṣetrād āgatān bodhisatvān etad avocat:	T38n1781_006:0980c15_7	二章竟前，此第三也。 「爾時維摩詰問眾香菩薩：
K10vimkn_u:2472	 kidṛśī kulaputrāḥ gandhottamakūṭasya tathāgatasya dharmadeśanā /	T38n1781_006:0980c16_7	香積如來以何說法？
K10vimkn_u:2473	 ta evam āhuḥ:	T38n1781_006:0980c16_12	彼菩薩曰：
K10vimkn_u:2474	 na sa tathāgato 'kṣaraniruktyā dharmaṃ deśayati /	T38n1781_006:0980c17_14	我土如來，無文字說，位以眾香令諸天人得入律行；
K10vimkn_u:2475	 tenaiva gandhena te bodhisatvā vinayaṃ gacchanti /	T38n1781_006:0980c18_18	菩薩各各坐香樹下，聞斯妙香，即獲一切德藏三昧。 得是三昧者，菩薩所有功德皆悉具足」。 自上已來明香飯為佛事，此下第二辨兩國化儀： 初明淨土之教；
K10vimkn_u:2479	 Vkn 9.15 atha te bodhisatvā vimalakīrtiṃ licchavim etad avocan:	T38n1781_006:0980c26_4	「彼諸菩薩問維摩詰：
K10vimkn_u:2480	 iha punar bhagavāñ śākyamuniḥ kīdṛśīṃ dharmadeśanāṃ prakāśayati /	T38n1781_006:0980c26_17	今世尊釋迦牟尼以何說法」。
K10vimkn_u:2585	 nirmitabhojanānayanaparivarto nāma navamaḥ //  Vkn 10.1 tena khalu punaḥ samayena bhagavata āmrapālīvane dharmaṃ deśayataḥ sa maṇḍalamāḍo vipulaś ca vistīrṇaś ca saṃsthito 'bhūt /  sā ca parṣat suvarṇavarṇā saṃdṛśyate sma /	T38n1781_006:0982b08_2	「是時，佛說法於菴羅樹園，其地忽然廣博嚴事，一切眾會皆作金色」。 此初現瑞者，凡有三義： 一為他方客來故莊嚴處所、二發起菴薗眾會敬仰之誠也、三表備開法門他人悟道。
K10vimkn_u:2588	 athāyuṣmān ānando bhagavantam etad avocat:	T38n1781_006:0982b10_16	「阿難白佛言： 世尊！
K10vimkn_u:2589	 kasyedaṃ bhagavan pūrvanimittaṃ yad idam āmrapālīvanam evaṃ vistīrṇaṃ saṃsthitaṃ sarvā ca parṣat suvarṇavarṇā saṃdṛśyate /	T38n1781_006:0982b12_6	以何因緣有此瑞應，是處忽然廣博嚴事，一切眾會皆作金色」。
K10vimkn_u:2591	 eṣa ānanda vimalakīrtir licchavir mañjuśrīś ca kumārabhūto mahatyā parṣadā parivṛtau tathāgatasyāntikam upasaṃkramiṣyataḥ /	T38n1781_006:0982b14_12	「佛告阿難： 是維摩詰、文殊師利與諸大眾恭敬圍遶發意欲來，故先指此瑞應」。 第三答瑞所由也。
K10vimkn_u:2592	 Vkn 10.2 atha vimalakīrtir licchavir mañjuśriyaṃ kumārabhūtam etad avocat:	T38n1781_006:0982b17_1	「於是維摩詰語文殊師利：
K10vimkn_u:2607	 āha: dṛṣṭaṃ bhagavan /	T38n1781_006:0982c08_19	「唯然，已見！ 於汝意云何？
K10vimkn_u:2608	 bhagavān āha:	T38n1781_006:0982c09_6	世尊！
K10vimkn_u:2609	 tataḥ kā te saṃjñotpannā /  āha: acintyā saṃjñā me bhagavan tatrodapadyata yathā cintayituṃ tulayituṃ gaṇayituṃ na śaknomi tādṛśīṃ teṣām acintyāṃ kriyāṃ paśyāmi /	T38n1781_006:0982c10_4	我覩其為不可思議，非意所圖、非度所測」。 不思議名正顯於此，良以二乘不能測度，名不思議。
K10vimkn_u:2611	 Vkn 10.4 athāyuṣmān ānando bhagavantam etad avocat:	T38n1781_006:0982c11_17	「爾時，阿難白佛言：
K10vimkn_u:2612	 anāghrātapūrvaṃ bhagavan gandham ājighrāmi /	T38n1781_006:0982c11_20	世尊！ 今所聞香，自昔未有，是為何香」。
K10vimkn_u:2614	 āha: eṣām eva ānanda bodhisatvānāṃ sarvaromakūpebhyo gandhaḥ kāyāt pravāti /	T38n1781_006:0982c15_12	「佛告阿難： 是彼菩薩毛孔之香」。 獨言彼菩薩香者，示根本故也。 又欲今身子自顯是食之香。
K10vimkn_u:2615	 śāriputro 'py āha:  asmākam apy āyuṣmann ānanda sarvaromakūpebhya īdṛśo gandhaḥ pravāti /	T38n1781_006:0982c17_17	「於是舍利弗語阿難言： 我等毛孔亦出是香。 阿難言： 此所從來？ 曰：
K10vimkn_u:2617	 āha: kuto 'sya gandhasya prādurbhāvaḥ /  āha: vimalakīrtinā licchavinā gandhottamakūṭasya tathāgatasya buddhakṣetrāt sarvagandhasugandhāl lokadhātor bhojanam ānītam /	T38n1781_006:0982c20_4	是長者維摩詰從眾香國取佛餘飯，於舍長者一切毛孔皆香若此。 阿難問維摩詰： 是香氣住當久如？ 維摩詰言：
K10vimkn_u:2619	 tad yāvadbhir bhuktaṃ sarveṣām īdṛśo gandhaḥ kāyāt pravāti /	T38n1781_006:0982c21_8	至此飯消。 曰： 此飯久如當消？
K10vimkn_u:2620	 Vkn 10.5 athāyuṣmān ānando vimalakīrtiṃ bodhisatvam evam āha:  kiyacciraṃ punar eṣa kulaputra gandho 'nuvartiṣyate /	T38n1781_006:0982c21_19	曰： 此飯勢力至于七日，然後乃消」。 什公云「有人食香飯，飯不時消，心必厭捨，故不令久也。 亦云應得道者，飯氣時熏，不過七日，必成聖道。 如七步蛇嚙，勢不過七日。
K10vimkn_u:2622	 āha: yāvad etad bhojanaṃ na pariṇataṃ bhaviṣyati /	T38n1781_006:0982c25_20	事不須久，故不令過七也。 」釋僧肇云「七日勢消，飯之常力也。
K10vimkn_u:2623	 ānanda āha: kiyaccireṇa punar etad bhojanaṃ pariṇaṃsyati /	T38n1781_006:0982c27_16	若應因飯而階道者，要得其所應得，然後消也。 」吉藏謂飯有三，凡夫感薄，但得七日，所謂下也。 二乘小深，故得初果正位、羅漢心然後乃消，所謂次也。 大乘發心，乃至補處然後乃消，所謂上也。 以應三品眾生，故初云七日。
K10vimkn_u:2651	 Vkn 10.11 idam ānanda sarvabuddhadharmapraveśaṃ nāma dharmamukhaṃ yatra yatra dharmamukhe	T38n1781_006:0983c12_5	「是名入一切諸佛法門。
K10vimkn_u:2652	 praviṣṭo bodhisatvaḥ sarvodāravyūhaguṇasamanvāgateṣu buddhakṣetreṣu nāvalīyate nāvanamati /  sarvodāravyūhaguṇasamanvāgateṣu ca buddhakṣetreṣu na kṛṣyati nonnamati /	T38n1781_006:0983c13_11	菩薩入此門者，若見一切淨好佛土，不以為喜，不貪不高； 若見一切不淨佛土，不以為憂，不礙不沒；
K10vimkn_u:2654	 tathāgatānāṃ ca sakāśe so 'dhimātraṃ gauravam utpādayati /	T38n1781_006:0983c15_7	但於諸佛土生清淨心，歡喜恭敬，未曾有也。
K10vimkn_u:2655	 āścaryam idaṃ buddhānāṃ bhagavatāṃ sarvadharmasamatādhimuktānāṃ satvaparipācanatayā buddhakṣetranānātvadarśanam /	T38n1781_006:0983c16_9	諸佛如來功德平等，為教化眾生故，而現佛土不同。
K10vimkn_u:2656	 Vkn 10.12 tadyathā ānanda bhavati buddhakṣetrāṇām aparāparaguṇanānātvam,	T38n1781_006:0983c16_12	阿難！
K10vimkn_u:2657	 na punaḥ khagapathasaṃchāditasya buddhakṣetrasyākāśanānātvam /	T38n1781_006:0983c17_11	汝見諸佛國土，地有若干，而虛空無若干也。
K10vimkn_u:2658	 evam eva ānanda bhavati tathāgatānaṃ rupakāyanānātvam,  na punas tathāgatānām asaṅgajñānanānātvam /	T38n1781_006:0983c18_13	如是見諸佛色身有若干耳，其無閡慧無若干也」。 此第二明深入此門使得利益。 就文為三： 初明德同、次辨號等、三小乘不測。
K10vimkn_u:2667	 te 'pi sarve satvā ānandasadṛśā eṣāṃ trayāṇāṃ padānām arthaviniścayaṃ śrutasmṛtidhāriṇīlabdhānām arthaviniścayanirdeśaṃ kalpenāpi na śaknuyuḥ  yad idaṃ samyaksaṃbuddha iti tathāgata iti buddha iti /	T38n1781_006:0984a13_3	若我廣說此三句義，汝以劫壽不能盡受，正使三千大千世界滿中眾生皆如阿難多聞第一、得念總持，此諸人等以劫之壽亦不能受。
K10vimkn_u:2669	 evam apramāṇā hy ānanda buddhabodhiḥ,  evam acintyaṃ tathāgatānāṃ prajñāpratibhānam /	T38n1781_006:0984a13_8	如是阿難！ 諸佛阿耨多羅三藐三菩提無有限量，智慧辨才不可思議。
K10vimkn_u:2671	 Vkn 10.14 athāyuṣmān ānando bhagavantam etad avocat:	T38n1781_006:0984a14_19	阿難白佛言：
K10vimkn_u:2672	 adyāgreṇāhaṃ bhagavan na bhūyo 'gro bahuśrutānām ity ātmānaṃ pratijñāsyāmi /	T38n1781_006:0984a15_13	我從今已往，不敢自謂以為多聞。
K10vimkn_u:2673	 bhagavān āha:	T38n1781_006:0984a15_18	佛告阿難：
K10vimkn_u:2674	 mā tvam ānanda avalīnacittam utpādaya /	T38n1781_006:0984a16_2	勿起退意！
K10vimkn_u:2675	 tat kasmād dhetoḥ /	T38n1781_006:0984a16_7	所以者何？
K10vimkn_u:2676	 śrāvakān saṃdhāya tvaṃ mayā ānanda agro bahuśrutānāṃ nirdiṣṭaḥ,  na bodhisatvān /	T38n1781_006:0984a17_3	我說汝於聲聞中為最多聞，非謂菩薩。
K10vimkn_u:2678	 tiṣṭhantv ānanda bodhisatvāḥ /	T38n1781_006:0984a17_9	且止，阿難！
K10vimkn_u:2679	 na te paṇḍitenāvagāhayitavyāḥ /	T38n1781_006:0984a18_1	其有智者，不應限度諸菩薩也。
K10vimkn_u:2680	 śakyo hy ānanda sarvasāgarāṇāṃ gādhaḥ pramātum,  na tv eva śakyo bodhisatvānāṃ prajñājñānasmṛtidhāraṇīpratibhānasya gādhaḥ pramātum /	T38n1781_006:0984a19_10	一切海淵尚可測量，菩薩神足、智慧、辨才、總持一切功德不可量也。
K10vimkn_u:2682	 upekṣakā yūyam ānanda bodhisatvacaryāyāṃ bhavatha /  tat kasmād dhetoḥ /  ya ima ānanda vimalakīrtinā licchavinaikapūrvabhakte vyūhāḥ saṃdarśitāḥ,	T38n1781_006:0984a19_13	阿難！
K10vimkn_u:2733	 kāyavākpariśuddhyā cittapariśuddhyā cāsaṃkhyeyakalpasaṃsaraṇatā,	T38n1781_006:0985a09_13	「生死無數劫，意而有勇；
K10vimkn_u:2734	 cittaśūratayāpramāṇabuddhaguṇaśravaṇenāsaṃsīdanatā,	T38n1781_006:0985a10_2	聞佛無量德，志而不倦；
K10vimkn_u:2735	 kleśaśatrunigrahāya prajñāśastragrahaṇatā,	T38n1781_006:0985a10_12	以智慧劍，破煩惱賊；
K10vimkn_u:2736	 sarvasatvabhārodvahanatāyai skandhadhātvāyatanaparijñā,	T38n1781_006:0985a11_4	出陰、界、入，荷負眾生，永使解脫。
K10vimkn_u:2737	 uttaptavīryatā mārasainyadharṣaṇārtham,  nirmānatā dharmaparyeṣṭyai,	T38n1781_006:0985a12_3	以大精進，摧伏魔軍，常求無念實相智慧」。
K10vimkn_u:2739	 jñānaparyeṣṭidharmagrāhyatāyā alpecchasaṃtuṣṭitā,	T38n1781_006:0985a12_18	不起有無四句邪念，是真智慧也。 「行少欲知足，而不捨世法； 不壞威儀，而能隨俗；
K10vimkn_u:2740	 sarvalokapriyatāyai sarvalokadharmāsaṃsṛṣṭatā,  lokānuvartanatāyai sarveryāpathāvikopanatā,	T38n1781_006:0985a14_9	不壞道儀，而能隨俗」。 俯仰天下皆謂我同，我獨異人也。
K10vimkn_u:2742	 sarvakriyāsaṃdarśanatāyā abhijñotpādanatā,	T38n1781_006:0985a15_14	「起神通慧，引導眾生；
K10vimkn_u:2743	 sarvaśrutadhāraṇatāyai dhāraṇīsmṛtijñānatā,	T38n1781_006:0985a16_2	得念總持，所聞不忘；
K10vimkn_u:2744	 sarvasatvasaṃśayacchedanatāyā indriyaparāparajñānatā,	T38n1781_006:0985a16_12	善別諸根，斷眾生疑；
K10vimkn_u:2745	 asaṅgādhiṣṭhānatā dharmadeśanatāyai,  asaṅgapratibhānatā pratibhānaprāptapratilambhatayā,	T38n1781_006:0985a16_22	以樂說辨，演法無閡；
K10vimkn_u:2747	 devamanuṣyasaṃpattyanubhavatā daśakuśalakarmapariśuddhitayā,	T38n1781_006:0985a17_9	淨十善道，受天人福；
K10vimkn_u:2748	 brahmapathapratiṣṭhānatā caturapramāṇotpādanatāyai,	T38n1781_006:0985a17_19	修四無量，開梵天道；
K10vimkn_u:2749	 buddhasvarapratilambhatā dharmadeśanādhyeṣaṇānumodanāsādhukārapradānena,	T38n1781_006:0985a18_12	勸請說法，隨喜讚善，得佛音聲。
K10vimkn_u:2903	 niṣkalaḥ,  nirvikalpaḥ,  akṛtaḥ,  anutpannaḥ,  asaṃbhūtaḥ,  na bhaviṣyati,	T38n1781_006:0987c07_19	「無作無起，無生無滅」下，法身無為，絕於施造，孰能作之令起、生之使滅乎？
K10vimkn_u:2911	 nirbhayaḥ,  niṣkleśaḥ,  niḥśokaḥ,  niṣprītikaḥ,	T38n1781_006:0987c08_12	「無畏無憂，無喜無厭，無著」。
K10vimkn_u:2916	 sarvavyavahāranirdeśair avacanīyaḥ /	T38n1781_006:0987c11_8	「無已有、無當有、無今有，不可以一切言說分別顯示。
K10vimkn_u:2917	 īdṛśo bhagavan tathāgatasya kāyaḥ /  sa tathaiva draṣṭavyaḥ /	T38n1781_006:0987c11_11	世尊！ 如來身為若此，作如是觀。
K10vimkn_u:2919	 ya evaṃ paśyanti,  te samyak paśyanti /	T38n1781_006:0987c12_12	以斯觀者，名為正觀；
K10vimkn_u:2921	 ye tv anyathā paśyanti,  te mithyā paśyanti /	T38n1781_006:0987c13_2	若他觀者，名為邪觀」。
K10vimkn_u:2928	 kutas tvaṃ kulaputra cyutyehopapannaḥ /	T38n1781_006:0987c17_12	一者見其神德奇妙，來處必美，故問取從也； 二者上云如自觀身實相，實相無生，而今現有生，將成自觀之義，故以沒生問也。 三者上已顯法身，今次開迹用，是故問之。
K10vimkn_u:2929	 vimalakīrtir āha:	T38n1781_006:0987c20_14	「維摩詰言：
K10vimkn_u:2931	 kaccit tasya dharmasya cyutir upapattir vā /  āha: na tasya dharmasya kācic cyutir upapattir vā /	T38n1781_006:0987c21_1	汝所得法有沒生乎？
K10vimkn_u:2950	 vimalakīrtir āha:	T38n1781_006:0988a05_17	維摩詰言： 舍利弗！
K10vimkn_u:2951	 tat kiṃ manyase bhadantaśāriputra api nu sūryaraśmayo 'ndhakāreṇa sārdhaṃ ramante /	T38n1781_006:0988a06_4	於意云何？ 日光出時，與冥合乎？
K10vimkn_u:2952	 āha: no hīdaṃ kulaputra,  na tayor yogo 'sti /	T38n1781_006:0988a06_17	答曰： 不也。
K10vimkn_u:2954	 sahodgate hi sūryamaṇḍale sarvaṃ tamo 'payānti /	T38n1781_006:0988a07_7	日光出時，則無眾冥。
K10vimkn_u:2955	 āha: kiṃ kāraṇaṃ punaḥ sūryo jambūdvīpa udayate /	T38n1781_006:0988a07_12	維摩詰言： 夫日何故行閻浮提？ 答曰：
K10vimkn_u:2956	 āha: yāvad evāvabhāsakaraṇāya tamo'paghātaya ca /	T38n1781_006:0988a08_12	欲以明照，為之除冥。
K10vimkn_u:2957	 āha: evam eva śāriputra saṃcintya bodhisatvā apariśuddheṣu buddhakṣetreṣūpapadyante satvānāṃ pariśodhanāya /  na ca kleśaiḥ sārdhaṃ saṃvasanti,  kleśāndhakāraṃ ca vidhamanti sarvasatvānām /	T38n1781_006:0988a08_17	維摩詰曰： 菩薩如是，雖生不淨佛土，為化眾生，不與愚闇而共合也，但滅眾生煩惱闇耳」下，前辨無生，此出生處，應物而唱，來始非益。 無生即是法身，生謂應迹。
K10vimkn_u:2960	 Vkn 11.4 atha sā sarvā parṣat paritṛṣitābhut:  paśyema vayaṃ tam abhiratiṃ lokadhātuṃ taṃ cākṣobhyaṃ tathāgataṃ tāṃś ca bodhisatvāṃs tāṃś ca mahāśrāvakān /	T38n1781_006:0988a13_1	又諸佛說法，常依二諦，無生就真，生則約俗。 「是時大眾渴仰，欲見妙喜世界無動如來及其菩薩、聲聞之眾。 佛知一切眾會所念，告維摩詰言：
K10vimkn_u:2962	 atha bhagavāṃs tasyāḥ sarvasyāḥ parṣadaś cetasa cetaḥparivitarkam ājñāya vimalakīrtiṃ licchavim etad avocat:	T38n1781_006:0988a15_7	善男子！
K10vimkn_u:2963	 darśaya kulaputra asyāḥ parṣadas tām abhiratiṃ lokadhātuṃ taṃ cākṣobhyaṃ tathāgatam /	T38n1781_006:0988a17_12	為此眾會現妙喜國無動如來及諸菩薩、聲聞之，眾皆欲見」下，此文第二明現無動國所以現，有三因緣： 一者欲令此會修淨土行，故得往生； 二者欲顯淨名不思議德； 三者將還妙喜身本生處。 捨茲淨土，入斯穢國，明大士慈悲之緣也。
K10vimkn_u:2964	 draṣṭukameyam parsat /	T38n1781_006:0988a20_16	文有四句： 一大眾欲見、二淨名現土、三時眾得益、四還歸本處。 此初文也。
K10vimkn_u:2965	 atha vimalakīrter licchaver etad abhavat:	T38n1781_006:0988a22_13	「於是維摩詰心念：
K10vimkn_u:2966	 yan nv aham itaś cāsanān nottiṣṭheyam /  tāṃ cābhiratiṃ lokadhātum anekabodhisatvaśatasahasrāṃ devanāgayakṣagandharvāsurādhyuṣitāṃ  sacakravāḍaparikhāṃ sanadītaḍāgotsasaraḥsamudraparikhāṃ sasumerugirikūṭaparvatāṃ  sacandrasūryajyotiṣāṃ sadevanāgayakṣagandharvabhavanāṃ sabrahmabhavanapārisadyāṃ	T38n1781_006:0988a27_1	吾當不起于座，接妙喜國土鐵圍、山川、溪谷、江河、大海、泉源、須彌諸山，及日月、星宿、天、龍、鬼神、梵天等宮殿，并諸菩薩、聲聞之眾，城邑聚落，男女大小，乃至無動如來及菩提樹、諸妙蓮華，能於十方作佛事者。 三道寶階，從閻浮提至忉利天，以此寶階，諸天來下，悉為禮敬無動如來，聽受經法。
K10vimkn_u:2979	 bhārgavacakram iva paricchidya dakṣiṇena pāṇinā puṣpadāmam ivādāyemāṃ lokadhātuṃ praveśayeyam /  praveśya cāsyāḥ sarvasyāḥ parṣado darśayeyam /  Vkn 11.5 atha vimalakīrtir licchavis tasyāṃ velāyāṃ tathārūpaṃ samādhim samāpannaḥ,	T38n1781_006:0988b09_2	「作此念已，入於三昧，現神通力，以其右掌斷取妙喜世界」下，此第二正明現土，凡有四句： 一正現土、二釋迦勸觀、三大眾覩見、四勸修淨土因。 羅什曰「斷取，明不盡來也。 」「置於此土。
K10vimkn_u:2983	 Vkn 11.6 tatra ye divyacakṣuṣo 'bhijñāpratilabdhāḥ śrāvakā bodhisatvā devamanuṣyāś ca,  te mahāntam utkrośam utkrośanti sma:	T38n1781_006:0988b12_2	彼得神通菩薩及聲聞眾，并餘天人，俱發聲言：
K10vimkn_u:2985	 knyāmahe bhagavan kriyāmahe sugata /	T38n1781_006:0988b12_5	唯然！ 世尊！ 誰取我去？
K10vimkn_u:2986	 trāya ca tathāgata iti /	T38n1781_006:0988b12_18	願見救護。
K10vimkn_u:2987	 tān bhagavān vinayanārtham evam āha:	T38n1781_006:0988b12_23	無動佛言：
K10vimkn_u:2988	 na mamātra vṛṣabhitā vimalakīrtinā bodhisatvena kriyamāṇānām /	T38n1781_006:0988b13_13	非我所為，是維摩詰神力所作。
K10vimkn_u:2989	 tatra ye punar anye devamanuṣyāḥ,  te na jānanti na paśyanti ḥ kuto vayaṃ kriyāmaha iti /	T38n1781_006:0988b14_10	其餘未得神通者，不覺不知已之所往。
K10vimkn_u:2991	 na hy abhiratyā lokadhātor imaṃ sahaṃ lokadhātuṃ praveśitāyā ūnatvaṃ na pūrṇatvam abhūt /  na cāsya lokadhātor utpīḍo na saṃbādhaḥ /  nāpy abhiratyā lokadhātor ūnabhāvaḥ /	T38n1781_006:0988b15_17	妙喜世界雖入此土而不增減，於是世界亦不迫隘，如本無異。
