src_segmentnr	src_original	tgt_segmentnr	tgt_original
K12bsu035_u:429	 sarvā striyo nitya narā bhavantu śūrāśca vīrāśca vijñapaṇḍitāśca /	K12D0557_H0515:421a-10	བུད་མེད་ཐམས་ཅད་རྟག་ཏུ་ཕོར་གྱུར་ཏེ་༎
K12bsu035_u:430	 te sarvi bodhāya carantu nityaṃ carantu te pāramitāsu ṣaṭsu // Suv_4.91 //	K12D0557_H0515:421a-12	དེ་ཀུན་རྟག་ཏུ་བྱང་ཆུབ་ཕྱིར་སྤྱོད་གྱུར་༎ ཕ་རོལ་ཕྱིན་པ་དྲུག་ལ་སྤྱོད་པར་ཤོག་།
K12bsu035_u:431	 paśyantu buddhān daśasū diśāsu ratnottamavṛkṣasukhopaviṣṭān /  vaiḍūryasiṃhāsani saṃniṣaṇṇān śṛṇvantu dharmāṃśca prakāśyamānān // Suv_4.92 //	K12D0557_H0515:421a-14	ཕྱོགས་བཅུ་དག་ན་རིན་ཆེན་ཤིང་དབང་དྲུང་༎ སངས་རྒྱས་བདེ་བཞུགས་རིན་ཆེན་བེཨེ་དའུརྱའི་༎ ཁྲི་ལ་བཞུགས་པ་དག་ནི་མཐོང་གྱུར་ཅིག་། ཆོས་བསྟན་པ་ཡང་དེ་དག་ཐོས་འགྱུར་ཤོག་།
K12bsu035_u:434	 pāpāni karmāṇi mayā jitāni pūrvārjitā yadbhavasaṃkaṭeṣu /	K12D0557_H0515:421a-18	བདག་གིས་སྡིག་པའི་ལས་རྣམས་བསྒྲུབས་པ་ནི་༎ སྲིད་པ་ཉམ་ངར་སྔོན་ཆད་གང་བསྒྲུབས་པ་༎ སྡིག་ལས་གང་དག་མི་འདོད་འབྲས་ཐོབ་པ་༎
K12bsu035_u:435	 ye pāpakarmābhiratā vahante te sarvi kṣīyantu ca nirviśeṣāḥ // Suv_4.93 //	K12D0557_H0515:421a-21	དེ་དག་ཐམས་ཅད་མ་ལུས་ཟད་གྱུར་ཅིག་།
K12bsu035_u:436	 te sarvasattvā bhavabandhanasthāḥ saṃsārapāśairdṛḍhabandhabaddhāḥ /	K12D0557_H0515:421a-22	སེམས་ཅན་གང་དག་སྲིད་པར་བཅིངས་ནས་སུ་༎ འཁོར་བའི་ཞགས་པའི་ཐག་པས་དམ་བཅིངས་པ་༎
K12bsu035_u:439	 kurvantu gambhīravicitrapuṇyaṃ tatsarvapuṇyaṃ hyanumodayāmi // Suv_4.95 //	K12D0557_H0515:421b-2	སེམས་ཅན་གང་དག་འཛམ་བུའི་གླིང་འདི་དང་༎ གང་དག་འཇིག་རྟེན་ཁམས་ནི་གཞན་རྣམས་ནི་༎ བསོད་ནམས་སྣ་ཚོགས་ཟབ་མོ་རྣམས་བྱེད་པ་༎
K12bsu035_u:43	 teṣāṃ sarve tathā nityamupasargāḥ sudāruṇāḥ /  tejasā cāsya sūtrasya śāmyante sarvaprāṇinām // Suv_1.12 //	K12D0557_H0515:406a-16	མདོ་སྡེ་འདི་ཡི་གཟི་བརྗིད་ཀྱིས་༎ སྲོག་ཆགས་ཀུན་གྱི་གནད་པ་དང་༎ ཤིན་ཏུ་མི་བཟད་འདི་འདྲ་བ་༎ དེ་དག་རྟག་ཏུ་ཞི་བར་འགྱུར་༎
K12bsu035_u:440	 tenaiva puṇyābhyanumodanena kāyena vācā manasārjitena /	K12D0557_H0515:421b-5	ལུས་དང་ངག་དང་ཡིད་ཀྱིས་བསྒྲུབས་པ་ཡི་༎ བདག་གིས་རྗེས་སུ་ཡི་རང་བསོད་ནམས་དེ་༎
K12bsu035_u:441	 praṇidhānasiddhiḥ saphalā mayāstu spṛśeya bodhiṃ virajāmanuttarām // Suv_4.96 //	K12D0557_H0515:421b-7	བདག་ནི་སྨོན་གྲུབ་འབྲས་བུ་ཡོད་པར་ཤོག་། བྱང་ཆུབ་རྡུལ་བྲལ་བླ་མེད་ཐོབ་གྱུར་ཅིག་།
K12bsu035_u:442	 yo vandate toṣyati daśabalān sadā ca prasannaśuddhāmalamānasena /	K12D0557_H0515:421b-9	གང་དག་རྟག་དང་དྲི་མ་བྲལ་བ་དང་༎ དྲི་མེད་ཡིད་ཀྱིས་ཕྱག་འཚལ་བསྟོད་པ་དང་༎ ཡོངས་སུ་བསྔོ་བ་བརྗོད་པ་འདི་ཡིས་ནི་༎
K12bsu035_u:443	 imāya pariṇāmanadeśanāya ṣaṣṭiṃ ca kalpān jahate apāyān // Suv_4.97 //	K12D0557_H0515:421b-10	བསྐལ་པ་དྲུག་ཅུར་ངན་སོང་སྤོང་བར་གྱུར་༎
K12bsu035_u:444	 etebhi ślokebhi ca varṇitebhiḥ puruṣāḥ striyo brahmaṇakṣatriyā ca /	K12D0557_H0515:421b-11	ཚིགས་སུ་བཅད་པ་བརྗོད་པ་འདི་དག་གིས་༎ སྐྱེས་པ་བུད་མེད་བྲམ་ཟེ་རྒྱལ་རིགས་ལས་༎
K12bsu035_u:446	 yastoṣyate muniṃ sa kṛtāñjalibhiḥ sthihitva sarvatra jātismaru śatajātiṣu // Suv_4.98 //	K12D0557_H0515:421b-13	ཐལ་སྦྱར་འདུག་སྟེ་རྒྱལ་བ་གང་བསྟོད་པ་༎ ཚེ་རབས་ཀུན་ཏུ་སྐྱེ་བ་དྲན་པར་འགྱུར་༎
K12bsu035_u:447	 sarvāṅga sarvendriya śobhitāṅgo vicitrapūrṇebhirguṇairupetaḥ /	K12D0557_H0515:421b-15	ཡན་ལག་དབང་པོ་ཀུན་གྱིས་ཡན་ལག་བརྒྱན་༎ བསོད་ནམས་ཡོན་ཏན་སྣ་ཚོགས་རྣམས་དང་ལྡན་༎
K12bsu035_u:448	 narendrarājaiśca supūjitaḥ sadā etādṛśo bheṣyati tatra tatra // Suv_4.99 //	K12D0557_H0515:421b-17	མི་དབང་རྒྱལ་པོས་རྟག་ཏུ་དེ་མཆོད་དེ་༎ དེ་དང་དེ་དག་ཏུ་ནི་དེ་འདྲར་འགྱུར་༎ གང་དག་རྣ་བའི་བུ་གར་བཤགས་པ་འདི་ནི་གྲགས་འགྱུར་བ་༎
K12bsu035_u:449	 na tairekasya buddhasya cāntike kuśalaṃ kṛtam /	K12D0557_H0515:421b-20	དེ་དག་སངས་རྒྱས་གཅིག་གི་གན་ནས་དགེ་བ་བྱས་མ་ཡིན་༎
K12bsu035_u:450	 na dvayorapi trayeṣu na pañcasu na daśasu // Suv_4.100 //	K12D0557_H0515:421b-21	གཉིས་ལ་མ་ཡིན་བཞི་ལ་མ་ཡིན་ལྔ་མིན་བཅུ་ལ་མིན་༎
K12bsu035_u:451	 tathā buddhasahasrāṇāmāntike kuśalaṃ kṛtam /	K12D0557_H0515:421b-22	དེ་ལྟར་སངས་རྒྱས་སྟོང་གི་གན་ནས་དགེ་བ་བྱས་མ་ཡིན་༎
K12bsu035_u:452	 yeṣāmidaṃ karṇapuṭe deśanaṃ praviṣyatīti // Suv_4.101 //  iti śrīsuvarṇaprabhāsottamasūtrendrarāje deśanāparivarto nāma caturthaḥ //  (Bagchi 24)  // kamalākarasarvatathāgatastavaparivartaḥ //	K12D0557_H0515:422a-0	གསེར་འོད་དམ་པ་མདོ་སྡེའི་དབང་པོའི་རྒྱལ་པོ་༄༤༢༢ཨ་༌༎ ལས༏་བཤགས་པའི་ལེའུ་ཞེས་བྱ་བ་སྟེ་བཞི་པའོ་༎༎ འཕགས་པ་གསེར་འོད་དམ་པའི་མདོ་སྡེའི་དབང་པོའི་རྒྱལ་པོ་ཞེས་བྱ་བ་ཐེག་པ་ཆེན་པོའི་མདོ་། བམ་པོ་གཉིས་པ་།
K12bsu035_u:456	 atha khalu bhagavāṃstāṃ bodhisattvasamuccayāṃ kuladevatāmetadavocat /	K12D0557_H0515:422a-4	དེ་ནས་བཅོམ་ལྡན་འདས་ཀྱིས་རིགས་ཀྱི་ལྷ་མོ་བྱང་ཆུབ་ཡང་དག་པར་བསྡུས་པ་ལ་འདི་སྐད་ཅེས་བཀའ་སྩལ་ཏོ་༎
K12bsu035_u:457	 tena khalu punaḥ kuladevate kālena tena samayena rājā suvarṇabhujendro nāmāsīt /	K12D0557_H0515:422a-5	རིགས་ཀྱི་ལྷ་མོ་། དེའི་ཚེ་དེའི་དུས་ན་། རྒྱལ་པོ་གསེར་གྱི་ལག་པའི་དབང་པོ་ཞེས་བྱ་བ་དེས་།
K12bsu035_u:458	 etena kamalākareṇa sarvatathāgatastavenātītānāgatapratyutpannān buddhān bhagavato 'bhyastāvīt //	K12D0557_H0515:422a-8	དེ་བཞིན་གཤེགས་པ་ཐམས་ཅད་ལ་བསྟོད་པ་པདམའི་འབྱུང་གནས་འདིས་། འདས་པ་དང་། མ་འོངས་པ་དང༏་ད་ལྟར་བྱུང་བའི་སངས་རྒྱས་བཅོམ་ལྡན་འདས་རྣམས་ལ་མངོན་པར་བསྟོད་དོ་༎
K12bsu035_u:45	 svayaṃ te lokapālāśca sāmātyāḥ sagaṇeśvarāḥ /	K12D0557_H0515:406b-0	༄༤༠༦བ་འཇིག་རྟེན་སྐྱོང་བ་བདག་ཉིད་དང་༎ བློན་པོ་ཚོགས་ཀྱི་དབང་ཕྱུག་བཅས་༎
K12bsu035_u:459	 ye jina pūrvaka ye ca bhavanti ye ca dhriyanti daśodiśi loke /	K12D0557_H0515:422a-10	རྒྱལ་བ་གང་དག་སྔར་གྱུར་གང་བྱུང་དང་༎ ཕྱོགས་བཅུའི་འཇིག་རྟེན་དག་ན་གང་བཞུགས་པ་༎
K12bsu035_u:460	 teṣa jināna karomi praṇāmaṃ taṃ jinasaṃghamahaṃ praśayiṣye // Suv_5.1 //	K12D0557_H0515:422a-12	རྒྱལ་བ་དེ་དག་ཀུན་ལ་བདག་གིས་བསྟོད་༎
K12bsu035_u:461	 śāntapraśāntaviśuddhamunīndraṃ suvarṇavarṇaprabhāsitagātram /	K12D0557_H0515:422a-13	ཐུབ་དབང་ཞི་ཞིང་རབ་ཞི་རྣམ་པར་དག་། སྐུ་ནི་གསེར་གྱི་མདོག་ཏུ་རབ་ཏུ་གདའ༎
K12bsu035_u:462	 sarvasurāsurasusvarabuddhaṃ brahmarute svaragarjitaghoṣam // Suv_5.2 //	K12D0557_H0515:422a-15	དབྱངས་རྣམས་ཀུན་གྱིས་སངས་རྒྱས་གསུང་སྙན་ཏེ་༎ ཚངས་པའི་སྒྲ་དབྱངས་རབ་ཏུ་བསྒྲགས་པའི་གསུང་༎
K12bsu035_u:463	 ṣaṭpadamaulamahīruhakeśaṃ nīlasukuñcitakāśanikāśam /  śaṅkhatuṣārasupāṇḍaladantaṃ hemavirājitabhāsitanābham // Suv_5.3 //	K12D0557_H0515:422a-17	བུང་བ་རྨ་བྱ་ཨཽཏཔལ་སྔོན་པོའི་དབུ་༎ མཐོན་མཐིང་ལྕང་ལོ་བྱ་ནི་ཙ་ཤ་འདྲ་༎ ཁ་བ་དུང་ལྟར་རབ་ཏུ་དཀར་བའི་ཚེམས་༎ རྟག་ཏུ་གསེར་ལྟར་རྣམ་པར་མཛེས་པར་གདའ༎
K12bsu035_u:465	 nīlaviśālaviśuddhasunetraṃ nīlamivitpalapracyutibhāsam /  padmasuvarṇaviśālasujihvaṃ padmaprabhāsitapadmamukhābham // Suv_5.4 //	K12D0557_H0515:422a-21	སྤྱན་ནི་རིང་ཞིང་མཐོན་མཐིང་དྲི་མ་མེད་༎ ཨཽཏཔལ་སྔོན་པོ་རབ་ཏུ་རྒྱས་པ་འདྲ་༎ ལྗགས་ནི་ཆེ་ཞིང་༄༤༢༢བ་ལེགས་ལ་པདམའི་མདོག་།
K12bsu035_u:467	 śaṅkhamṛṇālanibhāmukhatorṇaṃ dakṣiṇavartitaverulivarṇam /  sūkṣmaniśākarakṣīṇaśaśīva gātra munermramarājvalanābham // Suv_5.5 //	K12D0557_H0515:422b-1	པདམ་འདྲར་སྣང་པདམའི་ཟེ་བ་འདྲ་༎ ཞལ་གྱི་མཛོད་སྤུ་པདམ་དུང་དང་འདྲ་༎ ཐུབ་པའི་ཟླ་བ་ཕྲ་ཞིང་ཟླ་བ་ཟད་པ་འདྲ་༎ སྐུ་ཡི་ལྟེ་བ་བུང་བ་གསལ་བ་བཞིན་༎
K12bsu035_u:46	 teṣāṃ rakṣāṃ kariṣyanti hyanekairyakṣakoṭibhiḥ // Suv_1.13 //	K12D0557_H0515:406b-1	གནོད་སྦྱིན་བྱེ་བ་དུ་མ་ཡིས་༎ དེ་དག་ལ་ནི་སྲུང་བར་བྱེད་༎
K12bsu035_u:469	 (Bagchi 25)  kāñcanakoṭi suvarṇamṛduraṃ nāsamukhonnata pīvaraghrāṇam /  agradharāgraviśiṣṭasunāsaṃ mṛduka sarvajināṃśa satatam // Suv_5.6 //	K12D0557_H0515:422b-7	འཇམ་ཞིང་ས་ལའི་གསེར་ལྟར་ཁ་དོག་བཟང་༎ རྟག་པར་རྒྱུན་དུ་རྒྱལ་བ་ཐམས་ཅད་ཀྱི་༎ རོ་མཆོག་འཇམ་ཞིང་དམ་པ་མཆོག་རབ་འཕགས་༎
K12bsu035_u:472	 ekasame cittaromamukhāgraṃ vālasuromapradakṣiṇavartam /	K12D0557_H0515:422b-10	སྤུ་ཡི་བུ་ག་ནས་ནི་རེ་རེ་སྐྱེས་༎ སྤུ་རྣམས་སྐྱེས་པ་ག-ཡས་སུ་འཁྱིལ་བ་སྟེ་༎
K12bsu035_u:473	 nīlanibhā jvalakuṇḍalajātaṃ nīlavirājitamaulisugrīvam // Suv_5.7 //	K12D0557_H0515:422b-12	མཐོན་མཐིང་འོད་འབར་འཚེར་ཞིང་ལྕང་ལོ་ཅན་༎ རྨ་བྱའི་མགྲིན་སྡུག་འདྲ་བར་སྔོ་ལ་མཛེས་༎ བལྟམས་མ་ཐག་ཏུ་སྐུ་ཡིས་སྣང་བར་བགྱིས་༎
K12bsu035_u:474	 jātasamānaprabhāsitagātraṃ pūjitasarvi deśodiśi loke /	K12D0557_H0515:422b-15	ཕྱོགས་བཅུའི་འཇིག་རྟེན་དག་ནི་ཐམས་ཅད་གང་༎
K12bsu035_u:475	 duḥkhamanantapraśāntatriloke sarvasukhena ca tarpitasattvam // Suv_5.8 //	K12D0557_H0515:422b-16	འཇིག་རྟེན་གསུམ་ན་སྡུག་བསྔལ་མཐའ་ཡས་ཞི་༎ བདེ་བ་ཀུན་གྱི་སེམས་ཅན་རྣམས་ཀྱང་ཚིམ་༎
K12bsu035_u:476	 narakagātiṣvatha tiryaggatīṣu pretasurāsuramanuṣyagatīṣu /	K12D0557_H0515:422b-18	སེམས་དམྱལ་འགྲོ་དང་དུད་འགྲོའི་འགྲོ་བ་དང་༎ ཡི་དབ༹གས་ལྷ་གནས་མི་ཡི་འགྲོ་རྣམས་སུ་༎ སེམས་ཅན་དེ་དག་ཐམས་ཅད་བདེ་བས་ཚིམ་༎
K12bsu035_u:477	 teṣu ca sarvasukhārpitasattvaṃ sarvapraśānta apāyagatīṣu // Suv_5.9 //	K12D0557_H0515:422b-20	ངན་སོང་འགྲོ་བ་རྣམས་ནི་ཐམས་ཅད་ཞི་༎
K12bsu035_u:47	 sarasvatī mahādevī tathā nairañjanavāsinī /  hārītī bhūtamātā ca dṛḍhā pṛthivīdevatā // Suv_1.14 //  brahmendraistridaśendraiśca maharddhikinnareśvaraiḥ /	K12D0557_H0515:406b-3	ལྷ་མོ་ཆེན་མོ་དབྱངས་ཅན་དང་། རཉཛ་ནར་གནས་པ་དང་༎ འབྱུང་པོའི་མ་མོ་འཕྲོག་མ་དང་༎ ས་ཡི་ལྷ་མོ་བརྟན་མ་དང་༎ ཚངས་པའི་དབང་དང་ལྷ་དབང་དང་༎ ཀླུ་དབང་མཐུ་ཆེན་རྣམས་དང་ནི་༎
K12bsu035_u:478	 varṇasuvarṇakanākanibhāsaṃ kāñcanataptaprabhāsitagātram /  saumyaśaśāṅkasuvimalavakraṃ vikāsitarājitasuvimalavadanam // Suv_5.10 //	K12D0557_H0515:422b-21	ཁ་དོག་མདོག་བཟང་གསེར་དང་འདྲ་བའི་འོད་༎ བཙོ་མའི་གསེར་ལྟར་རབ་ཏུ་སྣང་བའི་སྐུ་༎ བདེ་གཤེགས་ཟླ་བ་རབ་ཏུ་དྲི་མེད་ཞལ་༎ འཛུམ་ཞིང་རྣམ་མཛེས་ཤིན་ཏུ་དྲི་མེད་ཞལ་༎ གཞོན་ནུ་བཙས་འདྲར་སྐུ་ལུས་ཡན་ལག་འཇམ་༎
K12bsu035_u:480	 taruṇatanūruhakomalagātraṃ siṃhamivākramavikramanāgam /  lambitahasta pralambitabāhuṃ mārutapreritaśālalateva // Suv_5.11 //	K12D0557_H0515:422b-26	སེང་གེ་འདྲ་བར་རྩལ་གྱིས་གནོན་པའི་མཆོག་། ཕྱག་རིང་ཕྱག་ནི་རབ་ཏུ་རིང་བ་སྟེ་༎ རླུང་གིས་བསྐྱོད་པ་བཞིན་༎
K12bsu035_u:482	 (Bagchi 26)  vyomaprabhājvalamuñcitaraśmiṃ sūryasahasramiva pratapantam /	K12D0557_H0515:423a-3	ཉི་མ་སྟོང་ལྟར་རབ་ཏུ་ལྷག་གེའོ་༎
K12bsu035_u:484	 nirmalagātravarebhi munīndraṃ sarvaprabhāsita kṣetramanantam // Suv_5.12 //	K12D0557_H0515:423a-4	ཐུབ་པའི་དབང་པོའི་སྐུ་མཆོག་དྲི་མ་མེད་༎ ཞིང་རྣམས་མཐའ་ཡས་ཐམས་ཅད་རབ་ཏུ་སྣང་༎
K12bsu035_u:485	 candraniśākarabhāskarajālaṃ kṣetramanantasahasraśateṣu /  te 'pi ca niṣṭhita sarvamabhūṣi buddhaprabhāsavirocanatāyai // Suv_5.13 //	K12D0557_H0515:423a-6	སངས་རྒྱས་འོད་ནི་རྣམ་པར་ལྷང་ངེ་བས་༎ ཞིང་རྣམས་མཐའ་ཡས་བརྒྱ་སྟོང་རྣམས་སུ་ཡང་༎ མཚན་བྱད་ཟླ་བ་ཉི་མ་མང་པོ་དག་། དེ་དག་ཐམས་ཅད་འོད་ནི་མེད་པར་གྱུར་༎
K12bsu035_u:487	 buddhadivākaralokapradipaṃ buddhadivākaraśatasahasram /	K12D0557_H0515:423a-10	སངས་རྒྱས་ཉི་མ་འཇིག་རྟེན་སྒྲོན་མ་སྟེ་༎
K12bsu035_u:488	 kṣetramanantasahasraśateṣu paśyatu sattva tathāgatasūryam // Suv_5.14 //	K12D0557_H0515:423a-11	སངས་རྒྱས་ཉི་མ་བརྒྱ་ཕྲག་སྟོང་རྣམས་ནི་༎ ཞིང་རྣམས་མཐའ་ཡས་སྟོང་ཕྲག་བརྒྱ་དག་ན་༎ དེ་བཞིན་གཤེགས་པའི་ཉི་མ་སེམས་ཅན་མཐོང་༎
K12bsu035_u:489	 puṇyasahasraśatāccitakāyaṃ sarvaguṇebhiralaṅkṛtagātram /	K12D0557_H0515:423a-14	བསོད་ནམས་སྟོང་ཕྲག་བརྒྱ་དང་ལྡན་པའི་སྐུ་༎ ཡོན་ཏན་ཀུན་གྱིས་རབ་ཏུ་བརྒྱན་པའི་སྐུ་༎
K12bsu035_u:490	 śauṇḍagajendranibhaṃ jinabāhuṃ vimalasulakṣaṇamaṇḍitahastam // Suv_5.15 //	K12D0557_H0515:423a-16	གླང་ཆེན་དབང་པོའི་སྣ་འདྲ་རྒྱལ་བའི་ཕྱག་། ཕྱག་དང་ཞབས་འོད་རབ་མཛེས་དྲི་མ་མེད་༎
K12bsu035_u:491	 bhūmitalopamarajasamatulyaṃ sūkṣmarajopama ye gatabuddhāḥ //  sūkṣmarajopama ye ca bhavanti sūkṣmarajopama ye ca sthihanti // Suv_5.16 //	K12D0557_H0515:423a-18	ས་ཡི་སྟེང་གི་རྡུལ་དང་མཚུངས་འདྲ་སྙེད་༎ ཕྲ་བའི་རྡུལ་སྙེད་སངས་རྒྱས་གང་འདས་དང་༎ གང་དག་ཕྲ་བའི་རྡུལ་སྙེད་བྱུང་བ་དང་༎ གང་དག་ཕྲ་བའི་རྡུལ་སྙེད་བཞུགས་པ་ཡི་༎
K12bsu035_u:493	 teṣa jināna karomi praṇāmaṃ kāyatu vācamanena prasannaḥ /	K12D0557_H0515:423a-20	རྒྱལ་བ་དེ་དག་ལ་ནི་རབ་དང་པའི་༎
K12bsu035_u:494	 puṣpapradānasugandhapradānairvarṇaśatena sucetasi cāpi // Suv_5.17 //  jihvaśatairapi buddhaguṇāni kalpasahasraśate na hi vaktum /  (Bagchi 27)	K12D0557_H0515:423a-21	ངག་ཡིད་ལུས་ཀྱིས་མེ་ཏོག་དབུལ་བ་དང་༎ སྤོས་རྣམས་དབུལ་དང་བསྔགས་པ་བརྒྱ་དག་དང་༎ དགེ་བའི་སེམས་ཀྱིས་ཀྱང་ནི་ཕྱག་འཚལ་ལོ་༎
K12bsu035_u:497	 ye guṇasādhunivṛtti jinānāṃ sā ca varāgravicitra anekaiḥ // Suv_5.18 //	K12D0557_H0515:423a-22	རྒྱལ་བའི་ཡོན་ཏན་གང་དག་དགེར་གྱུར་བ་༎ སྙིང་པོ་མཆོག་རབ་སྣ་ཚོགས་དུ་མ་སྟེ་༎
K12bsu035_u:498	 ekajinasya guṇā na hi śakyā jihvaśatairapi bhāṣitu kaścit /  kāmamaśakti hi sarvajinānāṃ ekaguṇasya hi vistara vaktum // Suv_5.19 //	K12D0557_H0515:423a-24	བདག་གིས་བསྐལ་པ་སྟོང་དུ་ལྕེ་བརྒྱ་ཡིས་༎ སངས་༄༤༢༣བ་རྒྱས་ཡོན་ཏན་བརྗོད་པར་མི་ནུས་སོ་༎ རྒྱལ་བ་གཅིག་གི་ཡོན་ཏན་རྣམས་ཀྱང་ནི་༎ ལྕེ་སྟོང་གིས་ཀྱང་ཅུང་ཟད་བརྗོད་མི་ནུས་༎ བདག་གིས་རྒྱལ་བ་དག་ནི་ཐམས་ཅད་ཀྱི་༎ ཡོན་ཏན་ལྕེ་བརྒྱས་བརྗོད་པར་ག་ལ་ནུས་༎
K12bsu035_u:500	 sarvasadevakuloktasamūhaḥ sarvabhavāgrabhave jalapūrṇā /	K12D0557_H0515:423b-5	ལྷར་བཅས་འཇིག་རྟེན་ཐམས་ཅད་མཚོར་གྱུར་ཏེ་༎ སྲིད་པའི་རྩེ་མོ་མན་ཆད་ཆུས་གང་བ་༎
K12bsu035_u:501	 keśagrahaṇena tu śakya pramātuṃ naiva ca ekaguṇā sugatānām // Suv_5.20 //	K12D0557_H0515:423b-7	སྐྲ་ཡི་རྩེ་མོས་དཔག་པར་ནུས་སྲིད་ཀྱི་༎ བདེ་གཤེགས་རྣམས་ཀྱི་ཡོན་ཏན་གཅིག་ལ་མིན་༎
K12bsu035_u:502	 varṇita saṃstuta me jinasarvaṃ kāyatu vāca prasannamanena /	K12D0557_H0515:423b-9	ལུས་དང་ངག་ཡིད་རབ་ཏུ་དང་བ་ཡིས་༎ རྒྱལ་བ་ཀུན་ལ་བདག་གིས་བསྔགས་བསྟོད་པས་༎
K12bsu035_u:503	 yanmama sañcitapuṇyaphalāgraṃ tena ca sattva prabhotu jinatvam // Suv_5.21 //	K12D0557_H0515:423b-11	བདག་གིས་བསོད་ནམས་འབྲས་བུ་མཆོག་བསགས་གང་༎ དེས་ནི་སེམས་ཅན་རྒྱལ་བ་རེག་གྱུར་ཅིག་།
K12bsu035_u:504	 evaṃ stavitva narapati buddhaṃ evaṃ karoti nṛpaḥ praṇidhānam /	K12D0557_H0515:423b-13	དེ་ལྟར་རྒྱལ་པོས་སངས་རྒྱས་རྣམས་བསྟོད་ནས་༎ རྒྱལ་པོ་འདི་ལྟར་སྨོན་ལམ་འདེབས་པ་ནི་༎
K12bsu035_u:506	 īdṛśi bheri mi paśyami svapne īdṛśa deśana tatra śṛṇomi /	K12D0557_H0515:423b-15	མ་འོངས་བསྐལ་པ་མཐའ་ཡས་རྣམས་སུ་ཡང་༎ གང་དང་གང་དུ་བདག་ནི་སྐྱེ་བ་ན་༎ རྨི་ལམ་དུ་ནི་འདི་འདྲའི་རྔ་བལྟ་ཞིང་༎
K12bsu035_u:50	 garuḍendraistathā sārdhaṃ yakṣagandharvapannagaiḥ // Suv_1.15 //	K12D0557_H0515:406b-4	མི་འམ་ཅི་དབང་ལྷ་མིན་དབང་༎ དེ་བཞིན་ནམ་མཁའ་ལྡིང་དབང་རྣམས་༎
K12bsu035_u:507	 īdṛśa jīnastutikamalākara jātiṣu tatra labhe smaraṇatvam // Suv_5.23 //	K12D0557_H0515:423b-18	དེར་ནི་བཤགས་པ་འདི་འདྲ་མཉན་པར་བགྱི་༎ རྒྱལ་བསྟོད་པདམ་འབྱུང་རྒྱལ་འདི་འདྲ་བ་༎ སྐྱེ་བ་དེ་དང་དེར་ནི་རྙེད་པར་བགྱི་༎
K12bsu035_u:508	 buddhaguṇāni anantamatulyā ye 'pi ca durlabha kalpasahasraiḥ /  (Bagchi 28)	K12D0557_H0515:423b-21	སངས་རྒྱས་ཡོན་ཏན་མཐའ་ཡས་མཚུངས་མེད་དང་༎ གང་ཡང་བསྐལ་པ་སྟོང་དུ་རྙེད་དཀའ་བ་༎
K12bsu035_u:510	 amu śruṇeya ca svapnagato 'pi teṣu ca deśayi divasagato 'pi // Suv_5.24 //	K12D0557_H0515:423b-22	དེ་དག་རྨི་ལམ་དུ་ཡང་མཉན་པར་བགྱི་༎ ཉིན་གྱུར་ཚེ་ཡང་དེ་དག་བཤད་པར་བགྱི་༎
K12bsu035_u:511	 duḥkhasamudra vimocayi sattvā pūrayi ṣaḍabhi pi pāramitābhiḥ /	K12D0557_H0515:423b-24	སེམས་ཅན་སྡུག་བསྔལ་མཚོ་ལས་ཐར་བར་བགྱི་༎ ཕ་རོལ་ཕྱིན་པ་དྲུག་པོ་རྫོགས་པར་བགྱི་༎
