src_segmentnr	src_original	tgt_segmentnr	tgt_original
K12bsu035_u:1623	 saddharmavegāśrupramuktanetraḥ pratisphaṭastasya babhūva kāyaḥ // Suv_14.21 //	K12D0557_H0515:469b-16	ཆོས་ཀྱི་ཤུགས་ཀྱིས་མིག་ནས་མཆི་མ་ཕྱུང་༎ དེ་ཡི་ལུས་ནི་དགའ་བས་ཁྱབ་པར་གྱུར་༎
K12bsu035_u:1624	 imasya sūtrasya ca pūjanārthaṃ susaṃbhavo rāja tadantareṇa	K12D0557_H0515:469b-18	མདོ་སྡེ་འདི་ལ་མཆོད་པ་བྱ་བའི་ཕྱིར་༎ དེ་ཚེ་རྒྱལ་པོ་ལེགས་པར་བྱུང་བ་ཡིས་༎ ཡིད་བཞིན་ནོར་བུ་རིན་ཆེན་རྒྱལ་པོ་བླངས་༎
K12bsu035_u:1625	 gṛhṇitva cintāmaṇirājaratnaṃ sarvārthahetoḥ praṇidhiṃ cakāra // Suv_14.22 //	K12D0557_H0515:469b-21	སེམས་ཅན་རྣམས་ཕྱིར་སྨོན་ལམ་བཏབ་པ་ནི་༎
K12bsu035_u:1626	 varṣantu adyā iha jambudvipe sasaptaratnāṇi ca bhūṣaṇāni  ye ceha sattvāḥ khalu jambudvipe sukhitāśca bheṣyanti mahādhanāśca // Suv_14.23 //	K12D0557_H0515:469b-22	རིན་ཆེན་བདུན་དང་ལྡན་པའི་རྒྱན་རྣམས་དང་༎ གང་ཡང་འཛམ་བུའི་གླིང་འདིར་སེམས་ཅན་རྣམས་༎ བདེ་བར་འགྱུར་བའི་ནོར་ནི་ཆེན་པོ་ཡི་༎ ཆར་པ་དྲེ་རིང་འཛམ་བུའི་གླིང་དུ་ཕོབ་༎
K12bsu035_u:1628	 caturṣu dvīpeṣu pravarṣitāni saptāni ratnāni tadantareṇa /  keyūrahārā varakuṇḍalāni tathānnapāne vasanāni caiva // Suv_14.24 //	K12D0557_H0515:469b-25	དེ་ཡི་ཚེ་ན་རིན་ཆེན་སྣ་བདུན་དང་༎ དཔུང་རྒྱན་དང་ནི་དོ་ཤལ་རྣ་ཆ་མཆོག་། དེ་བཞིན་ཟས་༄༤༧༠ཨ་༌༎ དང་སྐོམ་དང་གོས་རྣམས་ཀྱང་༎ གླིང་བཞི་དག་ཏུ་རབ་ཏུ་འབབ་པར་གྱུར་༎
K12bsu035_u:163	 evaṃ mayā ca litsavikumāra iṣṭaṃ varam /	K12D0557_H0515:411a-4	ཀྱེ་ལིཙཚ་བི་གཞོན་ནུ་། ཁོ་བོས་ནི་དམ་པ་དེ་ལྟ་བུ་གསོལ་ཏོ་༎
K12bsu035_u:1630	 dṛṣṭvā ca taṃ rāja susaṃbhavaśca ratnapravarṣaṃ khalu jambudvīpe /	K12D0557_H0515:470a-3	རྒྱལ་པོ་ལེགས་པར་བྱུང་བས་འཛམ་གླིང་དུ་༎ རིན་ཆེན་ཆར་པ་འབབ་པ་དེ་མཐོང་ནས་༎
K12bsu035_u:1631	 catvāri dvīpāni saratnapūrṇā niryātayī ratnaśikhisya śāsane // Suv_14.25 //	K12D0557_H0515:470a-5	གླིང་བཞི་རིན་ཆེན་གང་བར་བཅས་པ་ནི་༎ རིན་ཆེན་གཙུག་ཏོར་ཅན་གྱི་བསྟན་ལ་ཕུལ་༎
K12bsu035_u:1632	 ahaṃ ca saḥ śākyamunistathāgataḥ susaṃbhavo nāma babhūva rājā /	K12D0557_H0515:470a-7	དེ་བཞིན་གཤེགས་པ་ཤའཀྱ་ཐུབ་པ་ང་༎ རྒྱལ་པོ་ལེགས་པར་བྱུང་ཞེས་བྱ་བར་གྱུར་༎
K12bsu035_u:1633	 (Bagchi 81)  yeneha me tyakta vasuṃdharā tadā catvāri dvīpāni saratnapūrṇā // Suv_14.26 //	K12D0557_H0515:470a-9	གླིང་བཞི་དག་ནི་རིན་ཆེན་གང་བཅས་ཀྱི་༎ ས་འདི་དེ་ཚེ་ང་ཡིས་ཡོངས་སུ་བཏང་༎
K12bsu035_u:1635	 akṣobhya āsīt sa tathāgataśca ratnoccayo bhikṣu sa dharmabhāṇakaḥ /  yenāsya rājasya susaṃbhavasya prakāśitaṃ sūtramidaṃ tadāntare // Suv_14.27 //	K12D0557_H0515:470a-11	གང་གིས་རྒྱལ་པོ་ལེགས་པར་བྱུང་ང་ལ་༎ དེ་ཚེ་མདོ་སྡེ་འདི་ནི་རབ་བསྟན་པ་༎ རིན་ཆེན་སོགས་པ་ཆོས་སྨྲའི་དགེ་སློང་དེ་༎ དེ་བཞིན་གཤེགས་པ་མི་འཁྲུགས་དེར་གྱུར་ཏོ་༎
K12bsu035_u:1637	 yanme śrutaṃ sūtramidaṃ tadantare ekāgravācāmanumoditaṃ ca /	K12D0557_H0515:470a-15	ངས་གང་དེ་ཚེ་མདོ་སྡེ་འདི་ཐོས་ཤིང་༎ ཚིག་གཅིག་གིས་ནི་རྗེས་སུ་ཡི་རང་སྟེ་༎
K12bsu035_u:1638	 tenaiva mahyaṃ kuśalena karmaṇā śrotānumodena śrutena tena // Suv_14.28 //	K12D0557_H0515:470a-17	ང་ནི་དགེ་བའི་ལས་ནི་དེ་ཉིད་དང་༎ ཆོས་ཉན་པ་དང་རྗེས་སུ་ཡི་རང་བས་༎
K12bsu035_u:1639	 suvarṇavarṇaṃ śatapuṇyalakṣaṇaṃ labheyi kāyaṃ priyadarśanaṃ sadā /	K12D0557_H0515:470a-18	གསེར་གྱི་མདོག་དང་བསོད་ནམས་བརྒྱ་ཡི་མཚན་༎
K12bsu035_u:164	 atha sarvasattvapriyadarśano nāma litsavikumāra ācāryavyākaraṇaprāptaṃ kauṇḍinyabrāhmaṇaṃ gāthābhirabhyabhāṣata /	K12D0557_H0515:411a-6	དེ་ནས་ལིཙཚ་བའི་གཞོན་ནུ་འཇིག་རྟེན་ཐམས་ཅད་ཀྱིས་མཐོང་ན་དགའ་བས་། སློབ་དཔོན་ལུང་སྟོན་པ་བྲམ་ཟེ་ཀོཨོནདི་ནྱ་ལ་ཚིགས་སུ་བཅད་པ་དག་གིས་སླར་སྨྲས་པ་།
K12bsu035_u:1640	 nayanābhirāmaṃ janakāntadarśanaṃ ratiṃkaraṃ devasahasrakoṭinām // Suv_14.29 //  navottaraṃ notisahasrakoṭyā kalpānabhūvaṃ nṛpacakravartī /	K12D0557_H0515:470a-19	བལྟ་ན་སྡུག་ཅིང་མིག་ཏུ་མངོན་མཛེས་ལ་༎ ལྷ་སྟོང་བྱེ་བ་རབ་ཏུ་དགའ་བྱེད་པ་༎ སྐྱེ་བོས་མཐོང་ན་དགའ་ལུས་རྟག་ཏུ་ཐོབ་༎ དགུ་བཅུ་རྩ་དགུར་འཁོར་ལོས་བསྒྱུར་རྒྱལ་གྱུར་༎
K12bsu035_u:1642	 aneka kalpāna sahasrakoṭyo trailokyarājatva mayānubhūtam // Suv_14.30 //	K12D0557_H0515:470a-24	བསྐལ་པ་བརྒྱ་སྟོང་དུ་མ་མང་པོར་ཡང་༎ ངས་ནི་ཁམས་ཀྱི་རྒྱལ་པོ་མྱོང་བར་གྱུར་༎
K12bsu035_u:1643	 acintiyā kalpa babhūva śakraḥ tathaiva brahmendra praśāntamānasaḥ /	K12D0557_H0515:470b-0	བསྐལ་པ་བསམ་གྱིས་མི་༄༤༧༠བ་ཁྱབ་བརྒྱ་བྱིན་གྱུར་༎ ཚངས་པའི་དབང་པོ་ཡིད་བཞིན་དེ་བཞིན་ནོ་༎
K12bsu035_u:1644	 ārāgitā me balāprameyā yeṣāṃ pramāṇaṃ na kadāci vidyate // Suv_14.31 //  (Bagchi 82)	K12D0557_H0515:470b-2	གང་དག་ཚད་ནི་ནམ་ཡང་ཡོད་མིན་པའི་༎ སྟོབས་བཅུ་དཔག་མེད་ངས་ནི་བརྙེས་པར་བྱས་༎
K12bsu035_u:1646	 tathā pramāṇaṃ bahu puṇyaskandhaṃ yanme śrutaṃ sūtranumoditaṃ ca /	K12D0557_H0515:470b-4	ངས་གང་མདོ་ཐོས་རྗེས་སུ་ཡི་རང་བ་༎ བསོད་ནམས་ཕུང་པོ་ད་ལྟར་ཚད་མེད་མང་༎
K12bsu035_u:1647	 yathābhiprāyeṇa mi bodhi prāptā saddharmakāyaśca mayā hi labdha // Suv_14.32 //	K12D0557_H0515:470b-6	བསམ་པ་ཇི་བཞིན་ངས་ནི་བྱང་ཆུབ་ཐོབ་༎ ཆོས་སྐུ་དམ་པ་ཡང་ནི་ངས་ཐོབ་བོ་༎
K12bsu035_u:1648	 iti śrīsuvarṇaprabhāsottamasūtrendrarāje susaṃbhavaparivarto nāma caturdaśamaḥ //	K12D0557_H0515:470b-8	གསེར་འོད་དམ་པ་མདོ་སྡེའི་དབང་པོའི་རྒྱལ་པོ་ལས་། ལེགས་པར་བྱུང་བའི་ལེའུ་ཞེས་བྱ་བ་སྟེ་བཅུ་གསུམ་པའོ་༎༎ དཔལ་ལྡན་ལྷ་མོ་།
K12bsu035_u:1649	 (Bagchi 83)  yaḥ kaścicchrīmahādevi śrāddhaḥ kulaputro vā kuladuhitā vātītānāgatapratyutpannānāṃ buddhānāṃ bhagavatāmacintyāṃ mahatīṃ vipulāṃ vistīrṇāṃ sarvopakaraṇaiḥ pūjāṃ karttukāmaḥ syāt /  atītānāgatapratyutpannānāṃ buddhānāṃ bhagavatāṃ gambhīraṃ buddhagocaraṃ parijñātukāmo bhavet /	K12D0557_H0515:470b-11	རིགས་ཀྱི་བུའམ་། རིགས་ཀྱི་བུ་མོ་དད་པ་ཅན་གང་ལ་ལ་ཞིག་། འདས་པ་དང་། མ་འོངས་པ་དང་། ད་ལྟར་བྱུང་བའི་སངས་རྒྱས་བཅོམ་ལྡན་འདས་རྣམས་ལ་ཡོ་བྱད་ཐམས་ཅད་ཀྱིས་མཆོད་པ་ཆེན་པོ་ཤིན་ཏུ་རྒྱས་ཤིང་རྒྱ་ཆེ་བ་བསམ་གྱིས་མི་ཁྱབ་པ་བྱེད་པར་འདོད་ཅིང་། འདས་པ་དང་། མ་འོངས་པ་དང་། ད་ལྟར་བྱུང་བའི་སངས་རྒྱས་བཅོམ་ལྡན་འདས་རྣམས་ཀྱི་སངས་རྒྱས་ཀྱི་སྤྱོད་ཡུལ་ཟབ་མོ་ཡོངས་སུ་ཤེས་པར་འདོད་པ་དེས་གཙུག་ལག་ཁང་ངམ་།
K12bsu035_u:165	 yadā strotaḥsu gaṅgāyā roheyuḥ kumudāni ca /	K12D0557_H0515:411a-8	ནམ་ཞིག་གང་གླའི་ཆུ་རྒྱུན་ལ་༎
K12bsu035_u:1653	 tenāvaśyaṃ tatra pradeśe vihāre vāraṇyapradeśe vā yatrāyaṃ suvarṇaprabhāsottamaḥ sūtrendrarājaḥ vistareṇa saṃprakāśyate /	K12D0557_H0515:470b-15	དགོན་པའི་ཕྱོགས་ཀྱང་རུང་སྟེ་། གང་ན་གསེར་འོད་དམ་པ་མདོ་སྡེའི་དབང་པོའི་རྒྱལ་པོ་འདི་རྒྱ་ཆེར་ཡང་དག་པར་རབ་ཏུ་སྟོན་པའི་ཕྱོགས་དེར་།
K12bsu035_u:1654	 tenāvikṣiptacittenāvirahitaśrotreṇāyaṃ suvarṇaprabhāsottamaḥ sūtrendrarājaḥ śrotavyaḥ //	K12D0557_H0515:471a-0	དེས་གདོན་མི་ཟ་བར་ག-ཡེང་བ་མེད་པའི་སེམས་ཀྱིས་རྣ་བ་བླགས་ཏེ་གསེར་འོད་དམ་པ་མདོ་སྡེའི་དབང་པོའི་རྒྱལ་པོ་འདི་མཉན་༄༤༧༡ཨ་༌༎
K12bsu035_u:1655	 atha khalu bhagavānimamevārthaṃ bhūyasyā mātrayā saṃparidīpayamānastasyāṃ velāyāmimā gāthā abhāṣata //	K12D0557_H0515:471a-1	པར་བྱའོ་༎ དེ་ནས་བཅོམ་ལྡན་འདས་ཀྱིས་དོན་འདི་ཉིད་འཁོར་ལ་རྒྱ་ཆེར་བརྗོད་པའི་ཕྱིར་། དེའི་ཚེ་ཚིགས་སུ་བཅད་པ་འདི་དག་གསུངས་སོ་༎
K12bsu035_u:1656	 ya icchetsarvabuddhānāṃ pūjāṃ kartumacintiyām /	K12D0557_H0515:471a-3	གང་ཞིག་སངས་རྒྱས་ཐམས་ཅད་ལ་༎ བསམ་ཡས་མཆོད་པ་བྱེད་འདོད་ཅིང་༎
K12bsu035_u:1657	 gambhīraṃ sarvabuddhānāṃ gocaraṃ ca prajanitum // Suv_15.1 //	K12D0557_H0515:471a-5	སངས་རྒྱས་ཀུན་གྱི་སྤྱོད་ཡུལ་བ་༎ ཟབ་མོ་རབ་ཏུ་ཤེས་འདོད་པས་༎
K12bsu035_u:1658	 sarvadeśopasaṃkramya vihāraṃ layanaṃ tathā /	K12D0557_H0515:471a-7	གཙུག་ལག་ཁང་ངམ་གནས་ཁང་ངམ་༎
K12bsu035_u:1659	 yāvaddeśīyate sūtraṃ svarṇabhāsottamaṃ tvidam // Suv_15.2 //	K12D0557_H0515:471a-8	གང་ན་གསེར་འོད་དམ་པ་ཡི་༎ མདོ་སྡེ་དམ་པ་འདི་སྟོན་པ་༎ ས་ཕྱོགས་དེར་ནི་འགྲོ་བར་བྱ་༎
K12bsu035_u:166	 raktāḥ kākā bhaviṣyanti śaṅkhavarṇāśca kokilāḥ // Suv_2.9 //  jambustālaphalaṃ dadyāt kharjūraścāmramañjarīm /	K12D0557_H0515:411a-9	མེ་ཏོག་རྣམས་ནི་སྐྱེ་བ་དང་༎ བྱ་རོག་དམར་པོ་འགྱུར་བ་དང་༎ ཁུ་བྱུག་དུང་མདོག་འདྲར་འགྱུར་དང་༎ འཛམ་བུར་ཏ་ལའི་འབྲུ་ཆགས་དང་༎ འབྲ་གོར་ཨཨ་མྲའི་དོགས་པ་ཆགས་༎
K12bsu035_u:1660	 acintiyamidaṃ sūtramanantaguṇasāgaram /	K12D0557_H0515:471a-11	མདོ་སྡེ་བསམ་གྱིས་མི་ཁྱབ་སྟེ་༎ ཡོན་ཏན་རྒྱ་མཚོ་མཐའ་ཡང་ཡས་༎ སྡུག་བསྔལ་རྒྱ་མཚོ་དུ་མ་ལས་༎
K12bsu035_u:1661	 mocakaṃ sarvasattvānāmanekaduḥkhasāgarāt // Suv_15.3 //	K12D0557_H0515:471a-14	སེམས་ཅན་ཐམས་ཅད་ཐར་བར་བྱེད་༎
K12bsu035_u:1662	 ādiṃ sūtrasya paśyāmi madhyamanidhanaṃ tathā /	K12D0557_H0515:471a-15	མདོ་སྡེ་ཡི་ནི་ཐོག་མ་དང་༎ དབུས་དང་དེ་བཞིན་ཐ་མ་མཐོང་༎
K12bsu035_u:1663	 atigambhīrasūtrendra upamānaṃ na vidyate // Suv_15.4 //	K12D0557_H0515:471a-16	མདོ་སྡེའི་དབང་པོ་རབ་ཟབ་སྟེ་༎ འདི་ལ་དཔེ་ནི་ཡོད་མ་ཡིན་༎
K12bsu035_u:1664	 na gaṅgārajasā caiva na dharaṇyāṃ na sāgare /  na cāmbaratalasthasya kiṃcicchakyopamā kṛtum // Suv_15.5 //	K12D0557_H0515:471a-18	གང་གའ་དང་ནི་ས་རྣམས་དང་༎ རྒྱ་མཚོ་དང་ནི་ནམ་མཁའ་ལ་༎ གནས་པའི་རྡུལ་ནི་གང་ཡང་རུང་༎ དཔེར་བྱ་བ་ནི་མི་ནུས་སོ༏་༏ཆོས་ཀྱི་དབྱིངས་ལ་འཇུག་པ་ཡི་༎
K12bsu035_u:1666	 dharmadhātupraveśena praveṣṭavyaṃ tadantaram /  yatra dharmātmakastūpaṃ gambhīraṃ supratiṣṭhitam // Suv_15.6 //  (Bagchi 84)	K12D0557_H0515:471a-21	དེ་ཡི་ཚེ་ན་འཇུག་པར་བྱ་༎ ཆོས་ཀྱི་བདག་ཉིད་མཆོད་རྟེན་ནི་༎
K12bsu035_u:1669	 tatra ca stūpamadhye 'sminpaśyecchākyamuniṃ jinam /	K12D0557_H0515:471a-24	མཆོད་རྟེན་དེ་ཡི་དབུས་ན་ནི༏་༏རྒྱལ་བ་ཤའཀྱ་ཐུབ་པ་མཐོང་༎
K12bsu035_u:1670	 idaṃ sūtraṃ prakāśantaṃ manojñena svareṇa ca // Suv_15.7 //	K12D0557_H0515:471a-25	ཡིད་དུ་འོང་བའི་དབྱངས་ཀྱིས་སུ་༎ མདོ་སྡེ་འདི་ནི་རབ་ཏུ་སྟོན་༎
K12bsu035_u:1671	 yāvanti kalpakoṭyo vai asaṃkhyeyā acintiyāḥ /	K12D0557_H0515:471a-27	གྲངས་མེད་བསམ་གྱིས་མི་ཁྱབ་པའི་༎
K12bsu035_u:168	 tadā sarṣapamātraṃ ca vyaktaṃ dhāturbhaviṣyati // Suv_2.10 //	K12D0557_H0515:411a-10	དེ་ཡི་ཚེ་ན་ཡུངས་འབྲུ་ཙམ་༎ རིང་བསྲེལ་དུ་ནི་གསལ་བར་འགྱུར་༎
K12bsu035_u:1685	 avatīryāsanādeva anyadeśe gato bhavet /  dṛśyante pratihāryāṇi tatrāsanagatāni ca // Suv_15.15 //  dharmabhāṇakarūpaṃ ca kadācittatra dṛśyate /	K12D0557_H0515:471b-28	ཆོས་སྨྲ་བ་ཡི་གཟུགས་སུ་ཡང་༎
K12bsu035_u:1688	 kadācidbuddha rūpaṃ ca bodhisattvaṃ kadācana // Suv_15.16 //	K12D0557_H0515:471b-30	རེས་འགའ་སངས་རྒྱས་གཟུགས་སུ་སྟེ་༎ རེས་འགའ་བྱང་ཆུབ་སེམས་དཔར་ཡང་༎
K12bsu035_u:1689	 samantabhadrarūpāṇi kvacinmañjuśriyastathā /	K12D0557_H0515:472a-0	རེས་འགའ་ཀུན་ཏུ་བཟང་པོ་དང་༎ དེ་བཞིན་འཇམ་༄༤༧༢ཨ་༌༎ དཔལ་གཟུགས་སུ་སྟེ་༎
K12bsu035_u:169	 yadā kacchapalomānāṃ prāvāraiḥ suvṛto bhavet /	K12D0557_H0515:411a-12	ནམ་ཞིག་རུས་སྦལ་སྤུ་རྣམས་ལས་༎ གོས་སུ་ལེགས་པར་བཏགས་གྱུར་ཏེ་༎
K12bsu035_u:1690	 kvacinmaitraiyarupāṇi dṛśyante tatra āsane // Suv_15.17 //	K12D0557_H0515:472a-2	རེས་འགའ་བྱམས་པའི་གཟུགས་སུ་ཡང་༎ ཁྲི་དེ་ལ་ནི་སྣང་བར་འགྱུར་༎
K12bsu035_u:1691	 kvacitkevalamābhāsaṃ kvaciddevopadarśanam /  muhūrtenābhidṛśyante punaścāntarahāyiṣu // Suv_15.18 //	K12D0557_H0515:472a-4	རེས་འགའ་འོད་ནི་འབའ་ཞིག་སྣང་༎ རེས་འགའ་ལྷ་རྣམས་སྣང་བར་འགྱུར་༎ ཡུད་ཙམ་ཞིག་ནི་དེར་སྣང་ནས་༎ དེ་ནས་མི་སྣང་བར་ཡང་འགྱུར་༎
K12bsu035_u:1695	 dhanyamaṅgalasampannaṃ saṃgrāme ca jayāvaham // Suv_15.19 //	K12D0557_H0515:472a-19	ག-ཡུལ་འགྱེད་པ་ན་རྒྱལ་བར་བྱེད་༎
K12bsu035_u:1696	 jambudvīpamidaṃ sarvaṃ yaśasā pūrayiṣyati /	K12D0557_H0515:472a-20	འཛམ་བུའི་གླིང་འདི་ཐམས་ཅད་དུ་༎ གྲགས་པས་རབ་ཏུ་གང་བར་འགྱུར་༎
K12bsu035_u:1697	 sarve ca ripavastasya nirjitā bhonti sarvathā // Suv_15.20 //  nihataśatruḥ sadā bhoti sarvapāpavivarjitaḥ /	K12D0557_H0515:472a-22	དེ་ཡི་དགྲ་རྣམས་ཐམས་ཅད་ནི་༎ རྟག་ཏུ་དགྲ་ནི་ཆོམས་པར་འགྱུར་༎ སྡིག་པ་ཐམས་ཅད་རྣམ་པར་སྤངས་༎
K12bsu035_u:170	 hemante śītaharaṇo tadā dhāturbhaviṣyati // Suv_2.11 //	K12D0557_H0515:411a-14	དགུན་གྱི་གྲང་བ་སེལ་བྱེད་པ་༎ དེ་ཚེ་རིང་བསྲེལ་ཡོད་པར་འགྱུར་༎
K12bsu035_u:1700	 brahmendrāstridaśendrāśca lokapālāstathaiva ca /	K12D0557_H0515:472a-28	ཚངས་དབང་སུམ་ཅུ་རྩ་གསུམ་དབང་༎
K12bsu035_u:1701	 vajrapāṇiśca yakṣendraḥ saṃjñeyaśca nararṣabhaḥ // Suv_15.22 //	K12D0557_H0515:472a-29	དེ་བཞིན་འཇིག་རྟེན་སྐྱོང་རྣམས་དང་༎ ལག་ན་རྡོ་རྗེ་གནོད་སྦྱིན་དབང་༎
K12bsu035_u:1702	 anavatapta nāgendraḥ sāgaraśca tathaiva ca /  kiṃnarendrāḥ surendrāśca garuḍendrāstathaiva ca /  etāṃśca pramukhān kṛtvā sarvāṇi devatāni ca // Suv_15.23 //	K12D0557_H0515:472b-0	རྒྱལ་པ་ཁྱུ་མཆོག་ཡང་དག་༄༤༧༢བ་ཤེས༏་༏ཀླུ་ཡི་དབང་པོ་མ་དྲོས་དང་༎ དེ་བཞིན་དུ་ནི་རྒྱ་མཚོ་དང་༎ མིའམ་ཅི་དབང་ལྷ་མིན་དབང་༎ དེ་བཞིན་ནམ་མཁའ་ལྡིང་དབང་པོ་༎ དེ་དག་ལ་ནི་རྟོགས་པ་དང་༎ ལྷ་རྣམས་དེ་དག་ཐམས་ཅད་ཀྱང་༎
K12bsu035_u:1705	 te ca tā nityaṃ pūjanti dharmastūpamacintiyam /	K12D0557_H0515:472b-3	ཆོས་ཀྱི་མཆོད་རྟེན་བསམ་ཡས་ལ་༎ རྟག་ཏུ་མཆོད་པ་བྱེད་པར་འགྱུར་༎
K12bsu035_u:1706	 praharṣitā bhaviṣyanti dṛṣṭvā sattvāḥ sa gauravāḥ // Suv_15.24 //	K12D0557_H0515:472b-5	ཞེ་སར་བཅས་པའི་སེམས་ཅན་རྣམས་༎ མཐོང་ནས་ཤིན་ཏུ་དགའ་བར་འགྱུར་༎
K12bsu035_u:1707	 te 'pyevaṃ cintayiṣyanti devendrāḥ sarva uttamāḥ /	K12D0557_H0515:472b-7	ལྷ་ཡི་དབང་པོ་མཆོག་དེ་དག་། ཐམས་ཅད་འདི་སྙམ་སེམས་པར་འགྱུར་༎ ལྷ་རྣམས་དེ་དག་ཐམས་ཅད་ཀྱང་༎
K12bsu035_u:1708	 devatāścaiva tāssarvā vakṣyanti ca parasparam // Suv_15.25 //	K12D0557_H0515:472b-10	ཕན་ཚུན་དུ་ནི་སྨྲ་བྱེད་པ་༎
K12bsu035_u:1709	 etā paśyatha sarvāṇi tejaḥ śrīpuṇyasaṃcitā /	K12D0557_H0515:472b-11	བསོད་ནམས་དཔལ་དང་གཟི་བརྗིད་དང་༎ བསགས་པ་དེ་དག་ཀུན་ལ་ལྟོས་༎
K12bsu035_u:171	 yadā maśakapādānāmaṭṭakālambanaṃ bhavet /	K12D0557_H0515:411a-16	ནམ་ཞིག་སྦྲང་བུའི་རྐང་ལག་ལས་༎ ཡང་ཐོག་ལེགས་པར་བྱས་གྱུར་ཏེ་༎
K12bsu035_u:1710	 uptakuśalamūlena āgtāste narā iha // Suv_15.26 //	K12D0557_H0515:472b-12	དགེ་བའི་རྩ་བ་སྦྱངས་པ་ཡི་༎ མི་རྣམས་དེ་དག་འདིར་ལྷགས་ཏེ་༎
K12bsu035_u:1711	 ya imaṃ sūtragambhīraṃ śravaṇārthamihāgatāḥ /	K12D0557_H0515:472b-14	གང་དག་མདོ་སྡེ་ཟབ་མོ་འདི་༎ ཉན་པའི་ཕྱིར་ནི་འདིར་ལྷགས་པ་༎
K12bsu035_u:1712	 acintiyaprasādena dharmastūpe sagauravāḥ // Suv_15.27 //	K12D0557_H0515:472b-16	དད་པ་བསམ་གྱིས་མི་ཁྱབ་པས་༎ ཆོས་ཀྱི་མཆོད་རྟེན་གུས་དང་བཅས་༎
K12bsu035_u:1713	 ete kāruṇikā loke ete sattvahitaṃkarāḥ /	K12D0557_H0515:472b-18	དེ་དག་འཇིག་རྟེན་སྙིང་རྗེ་ལྡན་༎ དེ་དག་སེམས་ཅན་ཕན་བྱེད་པ་༎
K12bsu035_u:1714	 ete gambhīradharmāṇāṃ saddharmarasabhojanam // Suv_15.28 //	K12D0557_H0515:472b-20	དེ་དག་ཟབ་མོའི་ཆོས་རྣམས་ཀྱིས་༎ དམ་པའི་ཆོས་ཀྱི་རོ་ཡི་སྣོད་༎
K12bsu035_u:1715	 dharmadhātupraveśena ya ete praviśanti ca /	K12D0557_H0515:472b-22	ཆོས་ཀྱི་དབྱིངས་ལ་འཇུག་པ་ཡིས་༎
K12bsu035_u:1716	 ye śṛṇvanti idaṃ sūtraṃ ye cānyāñśrāvayanti ca // Suv_15.29 //  (Bagchi 86)	K12D0557_H0515:472b-23	དེ་དག་རབ་ཏུ་འཇུག་པ་ཡིན་༎ གང་དག་གསེར་འོད་དམ་པའི་མདོ་༎ དགེ་བ་དམ་པ་འདི་ཉན་པ་༎
K12bsu035_u:1718	 buddhā śatasahasrāṇi tebhiste pūrvapūjitāḥ /	K12D0557_H0515:472b-26	དེ་དག་སྔོན་ཆད་སངས་རྒྱས་ནི་༎ བརྒྱ་སྟོང་རྣམས་ལ་མཆོད་པ་ཡིན་༎
K12bsu035_u:1719	 etena kuśalamūlena idaṃ sūtraṃ śṛṇvanti ca // Suv_15.30 //	K12D0557_H0515:472b-28	དགེ་བའི་རྩ་བ་དེ་ཡིས་ནི་༎ མདོ་སྡེ་ཉན་པ་དེ་དག་ལ་༎
K12bsu035_u:172	 dṛḍhaṃ cāpyaprakampi ca tadā dhāturbhaviṣyati // Suv_2.12 //	K12D0557_H0515:411a-18	བརྟན་ཞིང་རབ་ཏུ་མི་ག-ཡོ་བ་༎ དེ་ཚེ་རིང་བསྲེལ་ཡོད་པར་༄༤༡༡བ་འགྱུར་༎
K12bsu035_u:1720	 te sarve devarājendrāḥ sarasvatī tathaiva ca /	K12D0557_H0515:473a-0	ལྷ་དབང་རྒྱལ་པོ་དེ་ཀུན་༄༤༧༣ཨ་༌༎
K12bsu035_u:1721	 śrīśca vaiśravaṇaścaiva tathā caturmahādhipāḥ // Suv_15.31 //	K12D0557_H0515:473a-2	དཔལ་དང་རྣམ་ཐོས་བུ་དང་ནི་༎ དེ་བཞིན་རྒྱལ་པོ་བཞི་རྣམས་དང་༎ གནོད་སྦྱིན་བརྒྱ་ཕྲག་སྟེང་པོ་དག་།
