src_segmentnr	src_original	tgt_segmentnr	tgt_original
K12bsu035_u:1472	 anāttamānaso devā bhavanti bhavaneṣu ca // Suv_13.22 //  yadā hyupekṣate rājā duṣkṛtaṃ vicaretparam /  te sarve devarājāśca vakṣyanti ca parasparam // Suv_13.23 //  adhārmiko hyayaṃ rājā hyadharmapakṣamāśritaḥ /	T85n2767_001:0325b04_15	諸天即便捨離。
K12bsu035_u:1476	 na cireṇa hyayaṃ rājā devatāṃ kopayiṣyati // Suv_13.24 //  devatānāṃ parikopādviṣayo 'sya vinakṣyati /  śasrāṇi ca adharmaśca viṣaye 'tra bhaviṣyanti // Suv_13.25 //  śāṭhyānāṃ kalahānāṃ ca rogāṇāṃ ca samudbhavaḥ /  prakupyati ca devendra upekṣyanti ca devatāḥ // Suv_13.26 //  pralupyate ca yadrāṣṭraṃ sa nṛpaḥ śokamṛcchati /	T85n2767_001:0325b05_7	是王令其國敗生大愁惱。
K12bsu035_u:1482	 iṣṭaviyogaṃ prāpnoti bhrātrā vātha sutena vā // Suv_13.27 //  (Bagchi 73)  priyabhāryāviyogo vā prāpyate duhitātha vā /	T85n2767_001:0325b06_6	兄弟姊妹眷屬妻子孤迸流離身亦亡滅。
K12bsu035_u:1485	 ulkāpātā bhaviṣyanti pratisūryāstathaiva ca // Suv_13.28 //	T85n2767_001:0325b06_15	流星數墮二日並現。
K12bsu035_u:1486	 paracakrabhayaṃ vāpi durbhikṣaṃ vardhati bhṛśam /	T85n2767_001:0325b07_13	他方惡賊侵掠其土人民飢餓多諸疾疫。
K12bsu035_u:1487	 priyāmātyaśca mriyate 'priyastu garjate vacaḥ // Suv_13.29 //	T85n2767_001:0325b08_4	所重大臣捨離薨亡。
K12bsu035_u:1489	 parasparaṃ hariṣyanti kulabhogaṃ dhanāni ca // Suv_13.30 //  deśe deśe haniṣyanti śastreṇa ca parasparam /	T85n2767_001:0325b09_11	諸家財產國土所有互相劫奪刀兵而死。
K12bsu035_u:1491	 vivādāḥ kalahāḥ śāṭhyā bhavanti viṣayeṣu ca // Suv_13.31 //  grahaḥ praviśate rāṣṭre vyādhirbhavati dāruṇaḥ /	T85n2767_001:0325b10_5	五星諸宿違失常度諸惡疾。
