src_segmentnr	src_original	tgt_segmentnr	tgt_original
K12n283u_001:91	 te te durgatibhayabhītā na bhūyaḥ kāmaguṇebhirarthikā bhaviṣyanti,  dānābhiratāśca bhaviṣyanti dānasya ca varṇavādinaḥ |	T02D3132:265b-13	ངན་འགྲོའི་འཇིགས་པས་སྐྲག་ནས་འདོད་པའི་ཡོན་ཏན་དོན་དུ་མི་གཉེར་བ་དང་། སྦྱིན་པ་ལ་དགའ་བ་དང་། སྦྱིན་པའི་བསྔགས་པ་བརྗོད་པ་དང་། བདོག་པ་ཐམས་ཅད་ཡོངས་སུ་གཏོར་བར་འགྱུར་།
K12n283u_001:93	 sarvamapi parityāgenānupūrveṇa karacaraṇaśīrṣanayanaṃ ca māṃsaśoṇitaṃ (ca)	T02D3132:265b-14	རིམ་གྱིས་རང་གི་མགོ་དང་ཡན་ལག་དང་། ཤ་ཁྲག་ཀྱང་སློང་བ་རྣམས་ལ་རབ་ཏུ་སྦྱིན་པར་འགྱུར་ན་།
K12n283u_001:94	 yācakānāmanupradāsyanti,  prāgeva anyaṃ dhanaskandham ||	T02D3132:265b-15	ནོར་གྱི་ཕུང་པོ་གཞན་ལྟ་སྨོས་ཀྱང་ཅི་དགོས་།
K12n283u_001:96	 punaraparaṃ mañjuśrīḥ santi sattvāḥ ye tathāgatānuddiśya śikṣāpadāni dhārayanti,  te śīlavipattimāpadyante,	T02D3132:265b-16	འཇམ་དཔལ་གཞན་ཡང་སེམས་ཅན་གང་དག་དེ་བཞིན་གཤེགས་པ་རྣམས་ཀྱི་བསླབ་པའི་གནས་ལོག་པར་འཛིན་པ་དག་ཡོད་དེ་།
K12n283u_001:98	 dṛṣṭivipattimācāravipattiṃ vā kadācidāpadyante |  śīlavipannā ye punaḥ śīlavanto bhavanti,  śīlaṃ rakṣanti,  na punarbahuśrutaṃ paryeṣyanti,  na ca tathāgatabhāṣitānāṃ gambhīramarthamājānanti |	T02D3132:265b-17	གང་དག་ཚུལ་ཁྲིམས་དང་ལྡན་པ་དེ་དག་ནི་ཚུལ་ཁྲིམས་ཙམ་སྲུང་གི་མང་དུ་ཐོས་པ་ཡོངས་སུ་མི་ཚོལ་།
