src_segmentnr	src_original	tgt_segmentnr	tgt_original
K12n2967u_001:4481	 utsṛjya vajramārgeṇa siṣyavaktre nipātayet |	T17MW1PD95844_2485:8878	གིས། རྡོ་རྗེ་ནོར་བུ་བླངས་ནས་སློབ་མའི་ཁ་རུ་འདིས་སྦྱིན་པར་བྱའོ། །འདི
K12n2967u_001:4482	 idantatsarvavajrāṇāmabhiṣekapadaṁ param || 115 ||	T17MW1PD95844_2485:8879	དེ་རྡོ་རྗེ་ཐམས་ཅད་ཀྱི། །དབང་གི་གོ་འཕང་མཆོག་གྱུར་པ། །ལས་ཀྱི་མཆོག
K12n2967u_001:4484	 siddhyanti sarvamantrāṇi karmāgraprasarāṇi ca |	T17MW1PD95844_2485:8880	ནི་རབ་རྒྱས་པ། །སྔགས་རྣམས་ཐམས་ཅད་འགྲུབ་པར་འགྱུར་ཞེས་བྱ་བ་ནི
K12n2967u_001:4490	 adhyeṣya guruṇā tasya dātavyā sādhakasya tu |  mūḍhe mohātmakaṁ yogaṁ moharatyā samanvitam || 118 ||  niḥsekānmohadhārābhirmohavajraḥ svayaṁ bhavet |  dviṣṭe dveṣātmakaṁ yogaṁ dveṣaratyā samanvitam || 119 ||  prajñājñānātmakaṁ yogaṁ vajraratyā samanvitam || 121 ||	T17MW1PD95844_2485:8887	ནས་ཞུ་བར་གྱུར་པས་བཏོན་ནས་དེའི་ལུས་ཁྱབ་པ་རྣམས་ཀྱིས། ཉོན་མོངས་པའི་དྲི་མ་དཀྲུས་པ་རྣམས་ཀྱིས་དབང་བསྐུར་བར་བྱ་སྟེ། ཤེས་རབ་ཀྱི་དབང་ངོ་༎ དེ་ལ་སློབ་མ་ལའང་དགའ་བ་ལ་སོགས་པའི་དབྱེ་བས་ལྷན་ཅིག་སྐྱེས་པའི་རང་རིག་པ་དང་རང་གི་ཚཧིག་གིས་བསྟན་པར་བྱའོ་ཞེས་བྱ་བ་ནི་དབང་རིན་པོ་ཆེ་བཞི་པའོ༎ དེ་བཞིན་དུ་གནས་པ་ཉིད་ཀྱི་ལག་པ་བྱིན་ནས་དེ་བཞིན་གཤེགས་པ་དཔང་པོར
K12n2967u_001:4506	 hastaṁ dattvā śire śiṣyaṁ mucyate guruvajriṇā || 123 ||	T17MW1PD95844_2485:8896	སློབ་མའི་སྤྱི་བོར་ལག་བཞག་ནས། །བླ་མ་རྡོ་རྗེ་ཅན་གྱིས་དོར། །ཐབས
K12n2967u_001:4508	 nānyopāyena buddhatvaṁ tasmād vidyāmimāṁ varām |	T17MW1PD95844_2485:8897	གཞན་དག་གིས་འཚཧང་མི་རྒྱ། །དེ་ཕྱིར་འདི་ནི་རིག་མ་མཆོག །གཉིས་སུ་མེད
