src_segmentnr	src_original	tgt_segmentnr	tgt_original
K12sdurst_u:1885	 sahasrajvālya /  sahasrajvālākulakāyaṃ kuṇḍendudusannibhaṃ śāntam anantam agnim ākṛṣyārghaṃ parikalpayet /	K12D0483_H0457:366a-16	མེ་ལྕེ་སྟོང་གིས་འཁྲིགས་ཤིང་འབར་བའི་ལུས་༎ ཟླ་དཀར་ཀུནད་ཞི་ཞལ་ཞི་བའི་ལུས་༎ མཐའ་ཡས་པ་ཡི་གཟུགས་ཀྱི་མེ་བཀུག་ལ་༎ ཨཨརྒ་དབུལ་བར་བརྟགས་ནས་དེ་བཞིན་དུ་༎
K12sdurst_u:1887	 tathaiva ca buddhimān agrataḥ pratimādikaṃ sthāpayet /	K12D0483_H0457:366a-20	བློ་མཆོག་ལྡན་པའི་མདུན་དུ་གཟུགས་སོགས་གཞག་།
K12sdurst_u:1888	 tathāgatagaṇaṃ tathaivākṛṣyārghādikaṃ parikalpayet tathaiva yathoktapūjā kartavyā /	K12D0483_H0457:366a-21	ཇི་ལྟར་གསུངས་བཞིན་ཡོན་ཏན་འདོད་པ་ཡིས་༎ དེ་བཞིན་གཤེགས་ཚོགས་དེ་བཞིན་སྤྱན་དྲངས་ལ་༎ ཨཨརྒ་ལ་སོགས་བཏགས་ཏེ་དེ་བཞིན་དུ་༎ བདེར་གཤེགས་གསུངས་པའི་མཆོད་པ་ལ་སོགས་བྱ་༎
K12sdurst_u:1889	 tata āhutiṃ havyaṃ pūrayitvā jvalanāya parikalpayitvā jinādinīm aṣṭottaraśataṃ parikalpayet /  tataḥ śodhanamantrarājasyaikaviṃśatim āhutiṃ parikalpayet /	K12D0483_H0457:366a-25	དེ་ནས་བྱིན་ཟ་ལ་ནི་བརྟག་བྱ་བ་༎ བསྲེག་བྱས་བཀང་སྟེ་དེ་ཡང་སྦར་བའི་ཕྱིར་༎ དེ་ནས་བསྲེག་བྱས་བཀང་སྟེ་རིམ་གྱིས་ནི་༎ རྒྱལ་ལ་སོགས་ལ་བརྒྱ་རྩ་བརྒྱད་དུ་བརྟག་། བསྲེག་པར་བྱ་བ་ཉི་ཤུ་རྩ་གཅིག་བརྟག་།
K12sdurst_u:1891	 tataś cākṛṣya śvetamukham upakaraṇair vā vāratrayam arghādinā ca pūjayet /	K12D0483_H0457:366b-0	དེ་ནས་༄༣༦༦བ་སྤྱན་དྲངས་ཡོ་བྱད་ལན་གསུམ་དང་༎ ཨཨརྒ་ལ་སོགས་པདམའི་དཀར་ཞལ་མཆོད་༎
K12sdurst_u:1892	 vajrapāṇiṃ padmapāśadharaṃ trailokyarūpaṃ pādapadmākrāntapāpaṃ sarvālaṃkārālaṃkṛtaṃ saṃbuddhakirīṭinaṃ cintayed atha vā likhet /	K12D0483_H0457:366b-1	ཕྱག་ན་རྡོ་རྗེ་པདམ་ཞགས་བསྣམས་པའི་༎ འཇིག་རྟེན་གསུམ་ལས་རྣམ་པར་རྒྱལ་བའི་གཟུགས་༎ ཞབས་ཀྱི་པདམས་སྡིག་མནན་ཅིང་༎ རྒྱན་རྣམས་ཀུན་ནི་རབ་རྫོགས་ལ་༎ རྫོགས་སངས་རྒྱས་ཀྱི་དབུ་རྒྱན་མཐོ་༎
K12sdurst_u:1893	 tasya ḥrdayena śatasahasraṃ yāvat koṭiṃ vā juhuyāt /	K12D0483_H0457:366b-6	བསམས་སམ་ཡང་ན་བྲིས་ཀྱང་རུང་༎ དེ་ཡི་སྙིང་པོས་དེ་བཞིན་དུ་༎ བརྒྱ་ཕྲག་སྟོང་ངམ་ཡང་ན་ནི་༎ བྱེ་བའི་ཚད་དུ་སྦྱིན་སྲེག་བྱ་༎
K12sdurst_u:1895	 nimitte ca samutpanne pāpasaṃtatiprahāṇaṃ tathaiva jñātavyam /	K12D0483_H0457:366b-10	ཅི་སྟེ་མཚན་མ་ལ་སོགས་འབྱུང་༎ དེ་བཞིན་སྡིག་ཅན་རྒྱུད་ཅེས་བྱ་༎
K12sdurst_u:1555	 tasya madhye ratnapadmaṃ tu likhet pītaraśminam //  samantāl likhed ratnaṃ vedikāyāṃ tu aṃbujaṃ //	K12D0483_H0457:396b-3	འོད་ཟེར་སེར་པོ་ལྡན་པར་བྲི་༎ ཁོར་ཡུག་ཏུ་ནི་རིན་ཆེན་དང་༎ མུ་རན་རྣམས་ལ་ཆུ་སྐྱེས་བྲི་༎
K12sdurst_u:1564	 hastaṃ vā tasya madhye tu saṃlikhya raktam ambujam //	K12D0483_H0457:396b-18	ཁྲུ་བཞིར་བྱས་ལ་དེའི་དབུས་སུ་༎ པདམ་དམར་པོ་བྲིས་ནས་ཀྱང་༎
K12sdurst_u:1896	 tato bhasmībhūtaṃ vajrasaṃhāramantreṇa yathāvidhi saṃharet /	K12D0483_H0457:366b-12	དེ་ནས་ཐལ་བར་གྱུར་པ་དང་༎ རྡོ་རྗེ་བསྡུ་བའི་སྔགས་ཀྱིས་ནི་༎ ཆོ་ག་བཞིན་དུ་བསྡུ་བར་བྱ་༎ ཐལ་བ་དེ་དང་རུས་པའི་རྡུལ་༎
K12sdurst_u:1897	 bhasmāny asthirajāṃsi ca gandhodakapañcagavyasahitāni śodhanamantreṇa lakṣaṃ japtvā pindīkṛtya karpūragandhamṛdbhir miśrīkṛtya pratimāṃ caityadevatāṃ vā kuryāt /	K12D0483_H0457:366b-15	སྔགས་ཀྱིས་བཏབ་པའི་དྲི་ཆུ་དང་༎ བ་སྐྱེས་འོ་མ་ལ་སོགས་ལྔས་༎ སྦྱོང་བའི་སྔགས་ཀྱིས་བློ་ལྡན་གྱིས་༎ འབུམ་དུ་བཟླས་པས་བརྫིས་ནས་ནི་༎ ག་བུར་དྲི་དང་བསྒོས་པ་ཡིས་༎ འཇིམ་པ་དང་ནི་བསྲེས་ནས་ཀྱང་༎ གཟུགས་སུ་བྱ་བའམ་ཡང་ན་ནི་༎
K12sdurst_u:1898	 ekadvitricatuḥpañcavāraṃ vāṣṭottaraśatavāraṃ vā /	K12D0483_H0457:366b-22	གཅིག་གམ་གཉིས་སམ་གསུམ་མམ་ལྔ་༎ ཡང་ན་བརྒྱ་རྩ་བརྒྱད་བར་དུ་༎
K12sdurst_u:1899	 mantramudrābhir adhiṣṭhāya lakṣadvayaṃ japet //	K12D0483_H0457:366b-24	སྔགས་དང་ཕྱག་རྒྱས་བཏབ་ནས་སུ་༎ འབུམ་ཕྲག་གཉིས་ཀྱི་བར་དུ་བཟླས་༎
K12sdurst_u:1900	 tataś caityaṃ jvalati pratimā vā hasati //	K12D0483_H0457:366b-26	དེ་ནས་མཆོད་རྟེན་འབར་གྱུར་ཏམ་༎ ཡང་ན་གཟུགས་ཀྱི་ཞལ་འཛུམ་མམ་།
K12sdurst_u:1901	 gandhadhūpaprabhā jighrati paśyati devādīṃ nānāprakārām yasya ṛddhiprātihāryāṇi ca patanti puṣpādīni /  śaṃkhabherīvaṃśavīṇādīnāṃ ca śabdāḥ śrūyante /	K12D0483_H0457:366b-28	དྲི་དང་བདུག་པ་འོད་ཀྱང་རུང་༎ སྣང་ངམ་ཡང་ན་ངད་ལྡང་ངམ་༎ ལྷ་ལ་སོགས་པའི་རྣམ་པ་ནི་༎ རྫུ་འཕྲུལ་རྣམ་པར་འཕྲུལ་བ་དང་༎ མེ་ཏོག་༄༣༦༧ཨ་༌༎ ལ་སོགས་འདོར་བ་དང་༎ དུང་དང་རྔ་ལ་སོགས་པའི་སྒྲ་༎ གླིང་བུ་པི་ཝང་ལ་སོགས་རྣམས་༎
K12sdurst_u:1903	 kadācid devatāni nimittāni pāpabahalatayā yadi na paśyet tadāṣṭau lakṣasahasrāṇi japet /	K12D0483_H0457:367a-3	ཅི་སྟེ་མཚན་མ་འདི་དག་ནི་༎ སྡིག་ཅན་བློས་ནི་མ་མཐོང་ན་༎ འབུམ་གྱི་ཕྲག་ནི་བརྒྱད་སྟོང་ངམ་༎ ཇི་སྲིད་མཚན་མ་བྱུང་བར་དུ་༎
K12sdurst_u:1904	 yāvan nimittaṃ bhavati tathāgataṃ pūjayitvā //  susamāhito japet /	K12D0483_H0457:367a-7	དེ་བཞིན་གཤེགས་པ་མཆོད་ནས་ནི་༎ མཉམ་པར་གཞག་པས་བཟླས་པར་བྱ་༎
K12sdurst_u:1906	 tato 'nte rātrīm ekāṃ vidhijño japet /	K12D0483_H0457:367a-9	དེ་ཡི་མཐར་ནི་མཁས་པས་ཀྱང་༎ མཚན་གཅིག་ཐོག་ཐག་མི་ཉལ་བཟླས་༎
K12sdurst_u:1907	 tadāvaśyaṃ pāpaviśuddhātmā paśyati /	K12D0483_H0457:367a-11	དེ་ནས་དེ་ཡི་སྡིག་པ་ནི་༎ དག་པ་ཉིད་དུ་ངེས་པར་མཐོང་༎
K12sdurst_u:1565	 tasyopari ca saṃlikhet saśaraṃ dhanur eva ca //  samantāc ca likhec cāpaṃ saśaraṃ raktavarṇakam //	K12D0483_H0457:396b-20	དེ་ཡི་དབུས་སུ་མདའ་བཅས་པའི་༎ ཁོར་ཡུག་ཏུ་ཡང་མདའ་བཅས་པའི་༎ གཞུ་ནི་ཁ་དོག་དམར་པོར་བྲི་༎
K12sdurst_u:1908	 devatārūpakāyaṃ tatsantānaṃ parijānāti /	K12D0483_H0457:367a-13	ལྷ་ཡི་ལུས་ཀྱི་གཟུགས་གྱུར་ལ་༎ རང་གི་རྒྱུད་དུ་ངོ་ཤེས་འགྱུར་༎
K12sdurst_u:1909	 etāni nimittāni jñātvā avikalpacitto /	K12D0483_H0457:367a-15	མཚན་མ་འདི་དག་ཤེས་ནས་ནི་༎ རྣམ་པར་མི་རྟོག་སེམས་ཀྱིས་ཀྱང་༎
K12sdurst_u:1910	 maitrīkṛpāparītaḥ sarvakarmāṇi kuryāt /	K12D0483_H0457:367a-17	བྱམས་དང་སྙིང་རྗེར་ལྡན་པ་ཡིས་༎
K12sdurst_u:1911	 evam api yadi na saṃbhavati tadā tannāmamātraṃ likhitvā caityamālāṃ kuryāt pratimāṃ vā kṛtvā /	K12D0483_H0457:367a-19	ཡང་ན་མེད་པར་གྱུར་ན་ཡང་༎ བཟླས་ཤིང་སྒོམ་པའི་ཚུལ་གྱིས་ནི་༎ མིང་ཙམ་ལེགས་པར་བྲིས་ནས་ཀྱང་༎ མཆོད་རྟེན་ཕྲེང་བ་བྱ་བ་དང་༎ ཡང་ན་གཟུགས་སུ་བྲིས་ཀྱང་རུང་༎
K12sdurst_u:1912	 homābhiṣekakṛte sati /	K12D0483_H0457:367a-23	སྦྱིན་སྲེག་མངོན་པར་དབང་བསྐུར་ན་༎
K12sdurst_u:1913	 niyataṃ svargeṣūtpadyante /	K12D0483_H0457:367a-24	གདོན་མི་ཟ་བར་བདེ་འགྲོར་སྐྱེ་༎
K12sdurst_u:1914	 bhasmasarṣapavālukādīṃś ca nāma vidarbhyābhimantrya samudragāminyāṃ nadyāṃ kṣipet /	K12D0483_H0457:367a-25	ཐལ་བ་ཡུངས་ཀར་བྱེ་མ་སོགས་༎ རང་གི་མིང་སྨོས་སྔགས་བཏབ་ནས་༎ བཟླས་པ་བྱས་ཏེ་སོང་ནས་ཀྱང་༎ རྒྱ་མཚོར་འབབ་པའི་ཀླུང་དུ་དོར་༎
K12sdurst_u:1915	 tataḥ pāpīyaso 'pi durgati vimokṣati /	K12D0483_H0457:367a-29	དེ་ལྟར་ན་ནི་སྡིག་ཅན་ཡང་༎ ངན་སོང་ལས་ནི་ཐར་འགྱུར་ན་༎
K12sdurst_u:1916	 uttamakuśalabījam utpāditavato buddhatvaphalasamanvāgatasya dānaśīlakṣāntivīryadhyānaprajñāhetuprabhāvitasya puṇyavato lokasya durgati bhagneti	K12D0483_H0457:367a-31	དགེ་བའི་མཆོག་ནི་བསྐྱེད་པ་དང་༎ བྱང་ཆུབ་ས་བོན་བསྐྱེད་པའི་བདག་། སངས་རྒྱས་འབྲས་བུའི་རྒྱུ་༄༣༦༧བ་ལྡན་པ་༎ སྦྱིན་པའི་ཕ་རོལ་ཕྱིན་པར་ལྡན་༎ ཚུལ་ཁྲིམས་རྒྱུད་དང་རབ་ལྡན་པ་༎ བཟོད་པ་བརྩོན་འགྲུས་མཉམ་གཞག་དང་༎ ཤེས་རབ་རྣམས་ཀྱིས་རྒྱུ་བསྒོམ་པའི་༎
K12sdurst_u:1917	 kaḥ punaḥ vādo nātra saṃśayaḥ /	K12D0483_H0457:367b-4	འཇིག་རྟེན་བསོད་ནམས་ལྡན་ཅི་སྨོས་༎ མྱུར་དུ་དེ་ཡི་ངན་སོང་ནི་༎ བཅོམ་པར་གྱུར་ཏེ་ཐེ་ཚོམ་མེད་༎
K12sdurst_u:1918	 yaś cānutpāditakuśalamūlo yaś ca nāstikadṛṣṭir bodhimārgād nivṛttas tasya śāsanavidveṣiṇo	K12D0483_H0457:367b-7	དགེ་བའི་རྩ་བ་མ་བསྐྱེད་ལ་༎ མེད་པར་ལྟ་བ་གང་ཡིན་དང་༎ བྱང་ཆུབ་ལམ་ལས་རྣམ་ལོག་པས་༎ བསྟན་ལ་ཞེ་སྡང་གནོད་བྱེད་ཅིང་༎
K12sdurst_u:1919	 'pakāriṇaḥ pāpānabhijñasyamātṛ pitṛvipriyacittasya bodhicittanisṛtavītarāgaghātakasya	K12D0483_H0457:367b-10	སྡིག་པའི་རང་བཞིན་མ་མཐོང་ལ་༎ མ་དང་ཕ་ལ་སྙིང་རིང་ཞིང་༎ བྱང་ཆུབ་སེམས་ལ་བརྟེན་པ་དང་༎ འདོད་ཆགས་བྲལ་བ་བསད་པ་རྣམས་༎
K12sdurst_u:1920	 devatābuddhadharmasaṃghamantramudrāganādīnāṃ (Sdp 250)	K12D0483_H0457:367b-13	ཅི་སྟེ་ལྷ་རྣམས་མེད་གྱུར་ཏམ་༎ སངས་རྒྱས་དགེ་འདུན་ཆོས་དེ་བཞིན་༎ སྔགས་དང་ཕྱག་རྒྱའི་ཚོགས་ལ་སོགས་༎
K12sdurst_u:1567	 bāhyatas tadvad evāsya kuryād mantrabhūtaḥ sadā //	K12D0483_H0457:396b-24	སྔགས་རྫོགས་པས་ནི་རྟག་པར་ཡང་༎ ཕྱི་རོལ་དེ་དང་འདྲ་བར་བྱ་༎
K12sdurst_u:1568	 smṛtvā tasya sattvasya raktāmbarabhuṣitaḥ //	K12D0483_H0457:396b-26	སེམས་ཅན་དེ་ཡང་དྲན་བྱས་ཏེ་༎ དམར་པོར་གྱུར་པའི་གོས་གྱོན་ལ་༎
K12sdurst_u:1557	 kulapañcakabhedena likhed mudrāṃ tu bāhyataḥ //	K12D0483_H0457:396b-5	ཕྱི་རོལ་དུ་ནི་རིགས་ལྔ་ཡི་༎ སོ་སོའི་ཕྱག་རྒྱ་བྲི་པར་བྱ་༎
K12sdurst_u:1569	 raktapuṣpāmbujaṃ vāpi phalaṃ raktaṃ sadhātukam //	K12D0483_H0457:396b-28	མེ་ཏོག་དམར་རམ་པདམ་འམ་༎ འབྲས་བུ་དམར་རམ་ཚོན་བསྐུས་པའི་༎
K12sdurst_u:1570	 bhavet tasya devādayo ghṛtamiśritakuṃkumaiḥ //  raktacandanacūrṇaiś ca sarve tiṣṭhanti tadvaśāḥ //	K12D0483_H0457:396b-30	མར་དང་གུར་གུམ་བསྲེས་པ་དང་༎ ཙནདན་དམར་པོའི་ཕྱེ་མ་ཡིས་༎ སྦྱིན་སྲེག་བྱས་ན་ལྷ་ལ་སོགས་༎ ཐམས་ཅད་དེ་ཡི་དབང་དུ་འགྱུར་༎
K12sdurst_u:1572	 tasya duṣṭavināśāya abhicāraṃ samārabhet //	K12D0483_H0457:396b-33	དེ་ལ་གདོན་རྣམས་གཞོམ་པའི་ཕྱིར་༎ མངོན་སྤྱོད་ཀྱང་ནི་བརྩམ་བྱ་སྟེ་༎
K12sdurst_u:1573	 dvyardhahastaṃ trihastaṃ vā navahastaṃ tathottamam //	K12D0483_H0457:397a-0	ཕྱེད་དང་གསུམ་༄༣༩༧ཨ་༌༎ མམ་ཁྲུ་གསུམ་མམ་༎ དེ་ལྟར་དམ་པ་ཁྲུ་དགུར་བྱ་༎
K12sdurst_u:1574	 kṛtvā koṇatrayair yuktair madhye vajranavātmakam //	K12D0483_H0457:397a-3	གྲུ་གསུམ་པ་དང་ལྡན་པར་ནི་༎ དབུས་སུ་རྡོ་རྗེ་རྩེ་དགུ་པ་༎
K12sdurst_u:1575	 trisūcikair vṛtāṃ vedīṃ kṛtvā viśvaiś ca vajribhiḥ //  daṇḍamuṇḍatriśūlāṃkair vajraparaśusūcikaiḥ //	K12D0483_H0457:397a-6	རྡོ་རྗེ་རྣམས་དང་དབྱིག་པ་དང་༎ མགོ་ནི་རྡོ་རྗེ་རྩེ་གསུམ་དང་༎ དགྲ་སྟ་རྩེ་གཅིག་མུ་ཁྱུད་བསྐོར་༎
K12sdurst_u:1577	 kārayed bāhyato cāpi tripuṭaṃ pūrvavac citram //	K12D0483_H0457:397a-7	ཕྱི་རོལ་དུ་ཡང་རིམ་གསུམ་དུ་༎ སྔ་མ་བཞིན་དུ་བརྒྱན་པར་བྱ་༎
K12sdurst_u:1578	 kalaśān balikumbhāṃś ca naivedyān sthāpayed bahu //	K12D0483_H0457:397a-9	བྱ་དང་གཏོར་མ་བུམ་པ་དང་༎ བཤོས་ཆ་རྣམ་པ་མང་དུ་གཞག་།
K12sdurst_u:1579	 māṃsarudhirasaṃpūrṇāḥ kapālāś cāpi sarvataḥ //	K12D0483_H0457:397a-10	ཤ་དང་ཁྲག་གིས་བཀང་བ་ཡི་༎ མགོ་ཡི་ཐོད་པ་ཀུན་ཏུ་གཞག་།
K12sdurst_u:1580	 kṛṣṇāmbaradharaḥ kruddhas trailokyavijayī svayam //  sarvapāpādivighnānāṃ nāśayet tasya dehinaḥ //	K12D0483_H0457:397a-12	དེ་ཡི་ལུས་ཅན་སྡིག་སོགས་དང་༎ བགེགས་རྣམས་གཞོམ་པར་བྱ་བའི་ཕྱིར་༎ གོས་ནག་བགོས་ཤིང་ཁྲོས་ནས་ཀྱང་༎ འཇིག་རྟེན་གསུམ་རྒྱལ་བདག་ཉིད་བསམ་༎
K12sdurst_u:1582	 tataḥ sauhatapāpātmā nirvighnaś carate sukham //	K12D0483_H0457:397a-15	དེ་ནས་དེ་ཡི་སྡིག་བཅོམ་ལུས་༎ བགེགས་དང་ཕྲལ་ཏེ་ཅི་བདེ་བར་༎
K12sdurst_u:1583	 svargalokeṣu mānuṣye yāvat trailokyadhātuṣu //	K12D0483_H0457:397a-17	མཐོ་རིས་འཇིག་རྟེན་མི་ཡི་ནང་༎ ཁམས་གསུམ་པ་ན་ཅི་བདེར་སྤྱོད་༎
K12sdurst_u:1584	 anenaiva krameṇāśu kuryāj janmanīha sthitān //	K12D0483_H0457:397a-19	གོ་རིམས་འདི་དག་ཉིད་ཀྱིས་ནི་༎ ཚེ་འདིའི་གནས་ལའང་བྱ་བ་སྟེ་༎
K12sdurst_u:1585	 tatas tathaiva syāt teṣāṃ yeṣām uddiśya kāryate //	K12D0483_H0457:397a-21	དེ་ནས་གང་གི་ཕྱིར་བྱས་པ་༎ དེ་ཡི་ཕྱིར་ཡང་དེ་བཞིན་འགྱུར་༎
K12sdurst_u:1586	 anyāny api karmāṇi yathā pūrvaṃ tathā kuryāt //	K12D0483_H0457:397a-23	གཞན་དག་ཀྱང་ནི་ལས་རྣམས་ཀུན་༎
K12sdurst_u:1558	 tathaiva bāhyadevānāṃ likhed aṃkuśādikam //	K12D0483_H0457:396b-7	དེ་ལྟར་ཕྱི་ཡི་ལྷ་རྣམས་དང་༎ ལྕགས་ཀྱུ་ལ་སོགས་བྲི་བར་བྱ་༎
K12sdurst_u:1587	 tena saṃpadyate kṣipraṃ sattvānāṃ ca sukhāvaham //	K12D0483_H0457:397a-26	མྱུར་དུ་བདེ་སྐྱིད་མྱོང་བར་འགྱུར་༎
K12sdurst_u:1588	 (Sdp 226)  atha brahmādayo devāḥ saṃhṛṣṭamanaso bhagavantaṃ namasyaivam āhuḥ /	K12D0483_H0457:397a-27	དེ་ནས་ཚངས་པ་ལ་སོག་པ་ལྷ་རྣམས་ཡིད་མགུ་ནས་། བཅོམ་ལྡན་འདས་ལ་ཕྱག་འཚལ་ཏེ་འདི་སྐད་ཅེས་གསོལ་ཏོ་༎
K12sdurst_u:1590	 yo bhagavan apāyopapannānāṃ sattvānām arthāya hitāya sukhāya /  etaṃ kalparājaṃ likhiṣyati likhāpayiṣyati /  kiṃ punar yathānirdiṣṭam avikalpayataḥ kariṣyati /	K12D0483_H0457:397a-29	བཅོམ་ལྡན་འདས་། ངན་སོང་དུ་སྐྱེས་པའི་སེམས་ཅན་རྣམས་ཀྱི་དོན་༄༣༩༧བ་དང་༎ ཕན་པ་དང་། བདེ་བའི་སླད་དུ་བརྟག་པའི་རྒྱལ་པོ་འདི་འདྲི་བ་དང་། འདྲིར་འཇུག་པའི་རིགས་ཀྱི་བུའམ་།
K12sdurst_u:1593	 vayaṃ brahmāddayo devās tasya kulaputrasya kuladuhitur vā bhṛtyavat paripālayiṣyāmaḥ /	K12D0483_H0457:397b-1	རིགས་ཀྱི་བུ་མོ་རྣམས་བདག་ཅག་ཚངས་པ་ལ་སོགས་པ་ལྷ་རྣམས་ཀྱིས་བུ་བཞིན་དུ་ཡོངས་སུ་བསྐྱང་བར་བགྱི་།
K12sdurst_u:1594	 yaś ca rājaiva rājaputro vā rājāmātyo vā yathāpaṭhituṃ mantraṃ vartayiṣyati tasya rājavṛddhiṃ kariṣyāmaḥ /	K12D0483_H0457:397b-2	གང་རྒྱལ་པོ་དང་། རྒྱལ་པོའི་བུ་དང་། རྒྱལ་པོའི་བློན་པོ་རྣམས་ཇི་ལྟར་གསུངས་པའི་རྗེས་སུ་སློབ་ན་དེའི་རྒྱལ་སྲིད་འཕེལ་བར་བགྱི་།
K12sdurst_u:1595	 viṣayadeśāṃś ca janaparivārajanasasyādirakṣāṃ ca kariṣyāmaḥ /	K12D0483_H0457:397b-3	ཡུལ་དང་། ཕྱོགས་དང་། རང་གི་སྐྱེ་བོ་དང་། ཡོངས་ཀྱི་སྐྱེ་བོ་དང་། བྲན་ལ་སོགས་པ་བསྲུང་བར་བགྱི་།
K12sdurst_u:1596	 bahudhanadhānyasamṛddhiṃ kariṣyāmaḥ /	K12D0483_H0457:397b-4	ནོར་དང་འབྲུ་རྣམས་མང་དུ་འབྱོར་པར་བགྱི་།
K12sdurst_u:1597	 strīpuruṣadārakadārikāsaṃpadaṃ ca kariṣyāmaḥ /	K12D0483_H0457:397b-5	བུད་མེད་དང་། སྐྱེས་པ་དང་། ཁྱེའུ་དང་། བུ་མོ་རྣམས་དང་ལྡན་པར་བགྱི་།
K12sdurst_u:1598	 ṛddhiṃ ca sphītaṃ ca subhikṣaṃ ca kṣemaṃ ca kariṣyāmaḥ /	K12D0483_H0457:397b-6	འབྱོར་བ་དང་། རྒྱས་པ་དང་། ལོ་ལེགས་པ་དང་། ཞི་བ་རྣམས་སུ་བགྱི་ན་།
K12sdurst_u:1599	 yaś cedaṃ kalparājaṃ śrāddho dhvajāgrāvaropitaṃ kṛtvā nagaranigamādisu praveśayet svayaṃ vā pratyudgacched dhastiskandhāvaropitaṃ ca kṛtvā sarvagrāmanagarādikaṃ bhrāmayet /	K12D0483_H0457:397b-7	ཇི་ལྟར་བཤད་པ་ལ་མི་རྟོག་པར་བགྱི་བ་ལྟ་སྨོས་ཀྱང་ཅི་འཚལ་། གང་གི་བརྟག་པའི་རྒྱལ་པོ་འདི་དང་བས་རྒྱལ་མཚན་གྱི་རྩེ་མོ་ལ་བརྟགས་ཏེ་། གྲོང་དང་གྲོང་ཁྱེར་དུ་གཙུགས་ལ་། བདག་ཉིད་ཀྱིས་བསུ་བ་དང་། གླང་པོ་ཆེའི་སྟེང་དུ་བཞག་ལ་གྲོང་དང་གྲོང་ཁྱེར་ལ་སོགས་པ་ཐམས་ཅད་བསྐོར་ན་།
K12sdurst_u:1600	 sarvamṛtyūpadravaṃ ca naśyati /	K12D0483_H0457:397b-11	ནད་དང་གནོད་པ་ཐམས་ཅད་མ་མཆིས་པར་འགྱུར་ལ་།
K12sdurst_u:1601	 tasya mahāsattvasya padaṃ jñāsyāmo bhṛtyatvena putratvena vā /	K12D0483_H0457:397b-12	སེམས་ཅན་ཆེན་པོ་དེའི་དྲུང་ན་བདག་ཅག་བྲན་གྱི་ཚུལ་ལམ་། དེའི་ཚུལ་དུ་གནས་པར་བགྱིའོ་༎
K12sdurst_u:1602	 yatra pāpaṃ pracariṣyati tatra bhagavān vajrapāṇiḥ svayam eva saṃbhogikaiḥ kāyair vajrasattvarūpeṇa vyavasthita iti manyāmaḥ /	K12D0483_H0457:397b-14	གང་དུ་འདིར་རབ་ཏུ་སྤྱོད་པ་དེ་ན་། བཅོམ་ལྡན་འདས་། ཕྱག་ན་རྡོ་རྗེ་ཉིད་ལོངས་སྤྱོད་རྫོགས་པའི་སྐུས་རྡོ་རྗེ་སེམས་དཔའི་སྐུར་ཞུགས་པར་འཚལ་༄༣༩༨ཨ་༌༎
K12sdurst_u:1603	 sa eva bhagavān vajrasattvaḥ samantabhadraḥ sarvāśāparipūrakaḥ kalparājarūpeṇa viharatīti manyāmaḥ /	K12D0483_H0457:398a-2	བཅོམ་ལྡན་འདས་། རྡོ་རྗེ་སེམས་དཔའ་ཀུན་ཏུ་བཟང་པོ་རེ་བ་ཐམས་ཅད་ཡོངས་སུ་སྐོར་བ་དེ་ཉིད་བརྟག་པའི་རྒྱལ་པོའི་གཟུགས་སུ་བཞུགས་པར་འཚལ་བར་བགྱི་འོ་༎
K12sdurst_u:1604	 sarvatathāgatāś ca saparivārā viharanta iti manyāmaḥ /	K12D0483_H0457:398a-4	དེ་བཞིན་གཤེགས་པ་ཐམས་ཅད་འཁོར་དང་བཅས་ཏེ་བཞུགས་པར་འཚལ་བར་བགྱིའོ་༎
