src_segmentnr	src_original	tgt_segmentnr	tgt_original
K12sdurst_u:1728	 bhagavan amukanāma vidyārāja namo 'stu te //  svo 'haṃ likhitum icchāmi maṇḍalaṃ karūṇātmakam //	T02D2906:292b-2	རིག་སྔགས་རྒྱལ་ལ་ཕྱག་འཚལ་ལོ༎ བདག་ནི་བརྩེ་བར་གྱུར་ནས་སུ་༎
K12sdurst_u:1730	 śiṣyāṇām anukampāya yuṣmākaṃ pūjanāya ca //	T02D2906:292b-3	སློབ་མ་རྣམས་ལ་བརྩེ་བ་དང་༎ ཁྱེད་རྣམས་ལ་ཡང་མཆོད་པའི་ཕྱིར་༎
K12sdurst_u:1732	 samanvāharantu māṃ buddhā lokanāthāḥ kṛpālavaḥ //  arhanto bodhisattvāś ca yā cānyā mantradevatā //  devatālokapālāś ca ye ca bhutanmaharddhikāḥ //	T02D2906:292b-7	སངས་རྒྱས་མགོན་པོ་བརྩེར་ལྡན་དང་༎ བྱང་ཆུབ་སེམས་དཔའ་དགྲ་བཅོམ་དང་༎ གང་ཡང་གསང་སྔགས་ལྷ་རྣམས་དང་༎ འཇིག་རྟེན་སྐྱོང་བའི་ལྷ་རྣམས་དང་༎ གང་ཡང་འབྱུང་པོ་མཐུ་ཆེན་དང་༎ གང་ཡང་ལྷ་ཡི་སྤྱན་མངའ་བའི་༎
K12sdurst_u:1735	 śāsanābhiratāḥ sattvā ye kecid divyacakṣuṣaḥ //	T02D2906:292b-8	སངས་རྒྱས་བསྟན་ལ་དགའ་བ་རྣམས་༎ བདག་ལ་དགོངས་པར་མཛད་དུ་གསོལ་༎
K12sdurst_u:1736	 aham amukanāmnā tu amukaṃ maṇḍalaṃ śubham //  svabhūte tu kariṣyāmi yathāśaktyupacārataḥ //	T02D2906:292b-10	བདག་གི་མིང་ནི་འདི་ཞེས་བགྱི་༎ སང་ནི་གདུགས་ལ་དཀྱིལ་འཁོར་ནི་༎ བཟང་པོ་མིང་ནི་འདི་ཞེས་བགྱི་༎ ཡོ་བྱད་ཅི་འབྱོར་པས་འབྲི་ན་༎
K12sdurst_u:1738	 anukampām upādāya saśiṣyasya tu tan mama //	T02D2906:292b-14	བདག་དང་སློབ་མར་བཅས་པ་ལ་༎ ཐུགས་ནི་བརྩེ་བར་དགོངས་སུ་གསོལ་༎
