src_segmentnr	src_original	tgt_segmentnr	tgt_original
K14mavadsuu:945	 idaṃ ca vijñānam atho nirudhyate 16  vijñānam etac ca yadā nirudhyate  nāma ca rūpaṃ ca tato nirudhyate /  nāma ca rūpaṃ ca yadā aśeṣaṃ	K10D0113_H0116:106b-24	རྣམ་པར་ཤེས་པ་འགགས་པས་མིང་དང་གཟུགས་འགག་། མིང་དང་གཟུགས་འགགས་༄༡༠༧ཨ་༌༎
K14mavadsuu:949	 nirudhyate nāyatanāni santi 17  imāni ced āyatanāny aśeṣaṃ	K10D0113_H0116:107a-1	པས་སྐྱེ་མཆེད་དྲུག་འགག་།
K14mavadsuu:951	 yadā nirudhyaṃti na santi sparśā /	K10D0113_H0116:107a-2	སྐྱེ་མཆེད་དྲུག་འགགས་པས་རེག་པ་འགག་།
K14mavadsuu:952	 sparśeṣv asatsu na bhavaṃti vedanā  avedayānasya na saṃti tṛṣṇā 18	K10D0113_H0116:107a-3	རེག་པ་འགགས་པས་ཚོར་བ་འགག་། ཚོར་བ་འགགས་པས་སྲེད་པ་འགག་།
K14mavadsuu:954	 tṛṣṇānirodhān nopādadāti	K10D0113_H0116:107a-5	སྲེད་པ་འགགས་པས་ལེན་པ་འགག་།
K14mavadsuu:957	 jātiḥ kadācin na kathaṃcid asti 19	K10D0113_H0116:107a-7	སྲིད་པ་འགགས་པས་སྐྱེ་བ་འགག་།
