src_segmentnr	src_original	tgt_segmentnr	tgt_original
K14sf259_sc:376	Wal_12.1 tatra bhagavān paṁcakān bhikṣūn āmantrayate /	T02n0099_015:0103c14_15	爾時，世尊告五比丘： 「此苦聖諦，本所未曾聞法，當正思惟。 時，生眼、智、明、覺，此苦集、此苦滅、此苦滅道跡聖諦，本所未曾聞法，當正思惟。 時，生眼、智、明、覺。 「復次，苦聖諦智當復知，本所未聞法，當正思惟。 時，生眼、智、明、覺，苦集聖諦已知當斷，本所未曾聞法，當正思惟。 時，生眼、智、明、覺。 「復次，苦集滅，此苦滅聖諦已知當知作證，本所未聞法，當正思惟。
K14sf259_sc:377	Wal_12.2 idaṁ duḥkham āryasatyam iti me bhikṣavaḥ pūrvam ananuśruteṣu dharmeṣu yoniśo manasi kurvataś cakṣur udapādi jñānaṁ vidyā buddhir udapādi / Wal_12.3 ayaṁ duḥkhasamudaya ayaṁ duḥkhanirodha iyaṁ duḥkhanirodhagāminī pratipad āryasatyam iti me bhikṣavaḥ pūrvam ananuśruteṣu dharmeṣu yoniśo manasi kurvataś cakṣur udapādi	T02n0099_015:0103c24_1	時，生眼、智、明、覺，復以此苦滅道跡聖諦已知當修，本所未曾聞法，當正思惟。
K14sf259_sc:382	Wal_12.5 tat khalu duḥkhasamudayam āryasatyam abhijñāya prahātavyam iti me bhikṣavaḥ pūrvam ananuśruteṣu dharmeṣu yoniśo manasi kurvataś cakṣur udapādi jñānaṁ vidyā buddhir udapādi / Wal_12.6 tat khalu duḥkhanirodham āryasatyam abhijñayā sākṣātkartavyam iti me bhikṣavaḥ pūrvam ananuśruteṣu dharmeṣu yoniśo manasi kurvataś cakṣur udapādi jñānam vidyā buddhir udapādi /	T02n0099_015:0103c24_19	「復次，比丘！ 此苦聖諦已知，知已出，所未聞法，當正思惟。
K14sf259_sc:384	Wal_12.7 tat khalu duḥkhanirodhagāminī pratipad āryasatyam abhijñayā bhāvayitavyam iti me vidyā buddhir udapādi / Wal_12.8 tat khalu duḥkham āryasatyam abhijñayā parijñātam iti me bhikṣavaḥ pūrvam ananuśruteṣu dharmeṣu yoniśo manasi kurvataś cakṣur udapādi jñānaṁ vidyā buddhir udapādi /	T02n0099_015:0103c27_6	復次，此苦集聖諦已知，已斷出，所未聞法，當正思惟。
K14sf259_sc:388	Wal_12.9 tat khalu duḥkhasamudayam āryasatyam abhijñayā prahīṇam iti me bhikṣavaḥ pūrvam ananuśruteṣu dharmeṣu yoniśo manasi kurvataś cakṣur udapādi jñānmaṁ vidyā buddhir udapādi / Wal_12.10 tat khalu duḥkhanirodham āryasatyam abhijñayā sākṣātkṛtam iti me bhikṣavaḥ pūrvam ananuśruteṣu dharmeṣu yoniśo manasi kurvataś cakṣur udapādi jñānam vidyā buddhir udapādi / Wal_12.11 tat khalu duḥkhanirodhagāmimī pratipad āryasatyam abhijñayā bhāvitam iti me bhikṣavaḥ	T02n0099_015:0103c27_17	時，生眼、智、明、覺。 「復次，苦滅聖諦已知、已作證出，所未聞法，當正思惟。 時，生眼、智、明、覺； 復次，苦滅道跡聖諦已知、已修出，所未曾聞法，當正思惟。
K14sf259_sc:391	pūrvam ananuśruteṣu dharmeṣu yoniśo manasi kurvataś cakṣur udapādi jñānaṁ vidyā buddhir udapādi /	T02n0099_015:0104a02_1	時，生眼、智、明、覺。
K14sf259_sc:392	Wal_12.12 yāvac ca mama bhikṣava eṣu caturṣv āryasatyeṣv evaṁ triparivartaṁ dvādaśākāraṁ na cakṣur udapādi na jñānaṁ na vidyā na buddhir udapādi na tāvad aham asmād bhikṣavaḥ sadevakāl lokāt samārakāt sabrahmakāt saśramaṇabrāhmaṇikāyāḥ prajāyāḥ sadevamānuṣāyā mukto nisṛto visaṁyukto vipramukto viparyāsāpagatena cetasā bahulaṁ vyahāṛsaṁ na	T02n0099_015:0104a02_6	「諸比丘！ 我於此四聖諦三轉十二行不生眼、智、明、覺者，我終不得於諸天、魔、梵、沙門、婆羅門聞法眾中，為解脫、為出、為離，亦不自證得阿耨多羅三藐三菩提。
K14sf259_sc:396	tāvad ahaṁ bhiksavaḥ anuttarāṁ samyaksaṁbodhim abhisaṁbuddho ’smīty adhyajñāsiṣaṁ / Wal_12.13 yataś ca mama bhikṣava eṣu caturṣv āryasatyeṣv evaṁ triparivartaṁ dvādaśākāraṁ cakṣur udapādi jñānaṁ vidyā buddhir udapādi tato ’ham asmāt sadevakāl lokāt samārakāt sabrahmakāt saśramaṇabrāhmaṇikāyāḥ prajāyāḥ sadevamānuṣāyā mukto nissṛto visaṁyukto vipramukto viparyāsāpagatena cetasā bahulaṁ vyahārṣam tataś cāhaṁ bhikṣavaḥ anuttarāṁ samyaksaṁbodhim abhisaṁbuddho ’smīty adhyajñāsiṣam /	T02n0099_015:0104a08_11	我已於四聖諦三轉十二行生眼、智、明、覺，故於諸天、魔、梵、沙門、婆羅門聞法眾中，得出、得脫，自證得成阿耨多羅三藐三菩提。
K14sf259_sc:403	Wal_13.1 asmiṁ khalu dharmaparyāye bhāṣyamāṇe āyuṣmatah kauṇḍinyasya virajo vigatamalaṁ dharmeṣu dharmacakṣur utpannam aśītīnāñ ca devatāsahasrāṇām /	T02n0099_015:0104a10_4	」爾時，世尊說是法時，尊者憍陳如及八萬諸天遠塵離垢，得法眼淨。
K14sf259_sc:404	Wal_13.2 tatra bhagavān āyuṣmantaṁ kauṇḍinyam āmantrayati /	T02n0099_015:0104a10_16	爾時，世尊告尊者憍陳如：
K14sf259_sc:405	Wal_13.3 ājñātas te kauṇḍinya dharma	T02n0099_015:0104a11_1	「知法未？ 」憍陳如白佛：
K14sf259_sc:406	Wal_13.4 ājñāto bhagavann	T02n0099_015:0104a11_12	「已知。 世尊！
K14sf259_sc:407	Wal_13.5 ājñātas te kauṇḍinya dharma	T02n0099_015:0104a12_1	」復告尊者憍陳如： 「知法未？ 」拘隣白佛：
K14sf259_sc:408	Wal_13.6 ājñātaḥ sugata /	T02n0099_015:0104a12_16	「已知。 善逝！
K14sf259_sc:409	Wal_13.7 ājnāta āyuṣmatā kauṇḍinyena dharmas tasmād āyuṣmataḥ kauṇḍinyasyājñātakauṇḍinya ity adhivacanam /	T02n0099_015:0104a13_12	」尊者拘隣已知法故，是故名阿若拘隣。
K14sf259_sc:410	Wal_13.8 ājñāta āyuṣmatā kauṇḍinyena dharma iti bhaumā yakṣāḥ śabdam udīrayaṁti ghoṣam anuśrāvayaṁti	T02n0099_015:0104a14_11	尊者阿若拘隣知法已，地神舉聲唱言：
K14sf259_sc:411	Wal_13.9 etan māriṣā bhagavatā bārāṇasyām ṛṣivadane ṁrgadāpe triparivartaṁ dvādaśākāram dhārmyaṁ dharmacakraṁ pravartitam / aprativartyaṁ śramaṇena vā brāhmaṇena vā devena vā māreṇa vā brahmaṇā vā kenacid vā loke sahadharmataḥ bahujanahitāya bahujanasukhāya lokānukampāya arthāya hitāya sukhāya devamanuṣyāṇām iti divyāḥ kāyā abhivardhiṣyanty asurāḥ kāyāh parihāsyante iti /	T02n0099_015:0104a14_16	「諸仁者！ 世尊於波羅㮈國仙人住處鹿野苑中三轉十二行法輪，諸沙門、婆羅門、諸天、魔、梵所未曾轉，多所饒益，多所安樂，哀愍世間，以義饒益，利安天人，增益諸天眾，減損阿修羅眾。
K14sf259_sc:415	Wal_13.10 bhaumānāṁ yakṣāṇāṁ śabdaṁ srutvā antarīkṣacarā yakṣāś cāturmahārājakāyikā devās trayastriṁśā yāmās tuṣitā nirmāṇaratayaḥ paranirmitavaśavartino devās tena kṣaṇena tena lavena tena muhūrtena tena kṣaṇalavamuhūrtena yāvad brahmalokaṁ śabdo jagāma /	T02n0099_015:0104a21_15	」地神唱已，聞虛空神天、四天王天、三十三天、炎魔天、兜率陀天、化樂天、他化自在天展轉傳唱，須臾之間，聞于梵天身。
K14sf259_sc:418	Wal_13.11 brāhmakāyikā devāḥ śabdam udīrayaṁti ghoṣam anuśrāvayanti /	T02n0099_015:0104a22_3	梵天乘聲唱言：
K14sf259_sc:420	dharmacakraṁ pravartitam aprativartyaṁ śramaṇena vā brāhmaṇena vā devena vā māreṇa vā brahmaṇā va kenacid vā loke sahadharmataḥ bahujanahitāya bahujanasukhāya lokānukampāya arthāya hitāya sukhāya devamanuṣyāṇām iti divyāḥ kāyā abhivardhiṣyanti asurakāyā parihāsyante iti /	T02n0099_015:0104a26_9	「諸仁者，世尊於波羅㮈國仙人住處鹿野苑中三轉十二行法輪，諸沙門、婆羅門、諸天、魔、梵，及世間聞法未所曾轉，多所饒益，多所安樂，以義饒益諸天世人，增益諸天眾，減損阿修羅眾。
