src_segmentnr	src_original	tgt_segmentnr	tgt_original
T02D3305:182b-15	དད་པས་རིགས་ཀྱི་བུའམ་རིགས་ཀྱི་བུ་མོ་དགེ་བའི་ཚེས་དང་གཟའ་དང་དུས་སྦྱོར་ལ་སོགས་པ་ལ་། གཙང་ཞིང་གཙང་བའི་གོས་བགོས་ཏེ་།	T02n2910u_001:272	 śubhadivase  śrāddhena kulaputreṇa  kuladuhitrā vā śucinā śucivastraprāvṛtena
T02D3305:182b-17	ཡིད་དུ་འོང་བ་རབ་ཏུ་སྟོན་པ་དེ་བཞིན་གཤེགས་པའི་གཟུགས་ལ་མཆོད་པ་དེའི་མཆོག་ཇི་ལྟ་བར་རྣམ་པར་བསྒོམས་ལ་།	T02n2910u_001:278	 viviktapradeśe buddhapratimāṃ  pañcopahāraiḥ saṃpūjya |  tadagre triratnebhyo
T02D3305:182b-18	མེ་ཏོག་ལ་སོགས་པ་དབུལ་བ་སྔོན་དུ་འགྲོ་བས་དཀོན་མཆོག་གསུམ་ལ་ཕྱག་འཚལ་པ་སྔོན་དུ་འགྲོ་བར་བྱའོ་༎	T02n2910u_001:284	 guruve ca maṇḍalakāni  kṛtvā dakṣiṇāpūrvakaṃ tīvraprasādena  triratnebhyo gurucaraṇayoś ca
T02D3305:182b-21	བུས་མོའི་ལྷ་ངས་ལ་བཙུགས་པའམ་།	T02n2910u_001:294	 purato jānumaṇḍalena |  utkuṭukena vā
T02D3305:182b-22	ཙོག་ཙོག་པོར་འདུག་ལ་ཐལ་མོ་སྦྱར་ཏེ་གནས་པས་འདི་སྐད་ཅེས་གསོལ་བ་གདབ་པ་ལན་གསུམ་བྱའོ་༎	T02n2910u_001:296	 sthitvā trir evam  adhyeṣitavyam |
T02D3305:183a-0	དགེ་བའི་བཤེས་གཉེན་བདག་ལ་༄༡༨༣ཨ་༌་༎ སྡིག་པ་བཤགས་པ་དང་སྐྱབས་སུ་འགྲོ་བའི་བྱང་ཆུབ་ཏུ་སེམས་བསྐྱེད་པ་སྩལ་དུ་གསོལ་ཞེས་པས་སོ་༎	T02n2910u_001:301	 prayaccha me kalyāṇamitra trīṇi  śaraṇagamanāni | upāsā-  kaśikṣāsaṃvaraṃ ca ||
T02D3305:183a-2	དེ་ནས་བླ་མས་ལྷག་པའི་བསམ་པ་རབ་ཏུ་འཕེལ་བས་སློབ་མ་བལྟས་ཏེ་ཇི་ལྟར་ནུས་པ་སྦྱིན་པར་བྱའོ་ཞེས་ཁས་བླང་བ་སྔོན་དུ་འགྲོ་བས་འདི་ལྟར་སྦྱིན་པར་བྱའོ་༎	T02n2910u_001:307	 tataḥ samyagadhyāśayapravṛttaṃ  śiṣyam ava-
