src_segmentnr	src_original	tgt_segmentnr	tgt_original
T02D1364:183b-0	༄༡༨༣བ་༅་༎ རྒྱ་གར་སྐད་དུ་༎ ཤ་དམ་ག-ཡོ་ག་ནའ་མ་། བོད་སྐད་དུ་། སྦྱོར་བ་ཡན་ལག་དྲུག་པ་ཞེས་བྱ་བ་། གསང་བ་པའི་བདག་པོ་ཕྱག་ན་རྡོ་རྗེ་ལ་ཕྱག་འཚལ་ལོ་༎	T02n2998u_001:2116	 sidhyata ity āga- mapāṭhaḥ |
T02D1364:183b-10	བར་དུ་བཤད་པའི་ཡན་ལག་དང་པོར་བྱ་བ་ནི་འདིར་བླ་མའི་མན་ངག་སྟེ་།	T02n2998u_001:2123	 madhyoktāṅgaṁ pūrvaṁ kartavyam |  atra gurūpadeśata iti gurusaṁpradāyaḥ |
T02D1364:183b-11	གཞན་དུ་ན་གང་གི་ཚེ་རྒྱུད་ལས་གསུངས་པའི་རིམ་པས་གཟུང་ན་ནི་དེའི་ཚེ་བླ་མའི་མན་ངག་ཅི་ཞིག་དགོས་༎	T02n2998u_001:2125	 anyathā tantroktapāṭhakrameṇa yadi gṛhyate tadā gurusaṁpradāyaḥ ko 'sau nāma |
T02D1364:183b-12	དེའི་ཕྱིར་དགོངས་པས་བཤད་པ་ལ་སོགས་པ་ཐམས་ཅད་བླ་མའི་མན་ངག་ལས་རྟོགས་པར་བྱ་བ་འམ་།	T02n2998u_001:2126	 tasmād gurusaṁpradāyena saṁdhyābhāṣāntarādikaṁ veditavyam |  sar- vatra tena boddhavyam |
T02D1364:183b-13	ཡང་ན་བྱང་ཆུབ་སེམས་དཔའ་རྣམས་ཀྱིས་མཛད་པའི་འགྲེལ་པ་ལས་ཤེས་པར་བྱ་བ་ཡིན་གྱི་མཁས་པའི་ང་རྒྱལ་དང་ལྡན་པ་རྣམས་ཀྱིས་བྱས་པ་དེ་ལས་ནི་མ་ཡིན་ནོ་༏	T02n2998u_001:2128	 athavā bodhisattvakṛtaṭīkayā nānyayā pāṇḍi- tyābhimānabhūtaiḥ kṛtayeti |
T02D1364:183b-14	། དེས་ན་བསམ་གཏན་ཞེས་བྱ་བ་ལ་སོགས་པས་ཡན་ལག་གཞན་གསུམ་ཤེས་པར་བྱའོ་༎	T02n2998u_001:2129	 tenātrāparāṅgatrayaṁ dhyāne- netyādinā 'vagantavyam |
T02D1364:183b-15	རྒྱུད་གཞན་དུ་ཡན་ལག་དྲུག་གསུངས་པ་འདིར་མདོར་བྱས་པའི་དོན་གྱིས་ཡན་ལག་གསུམ་དུ་རྟོགས་པར་བྱ་བ་སྟེ་།	T02n2998u_001:2130	 aparatantrāntaroktaiḥ ṣaḍaṅgair asmin piṇḍīkṛto 'rtho 'ṅgatrayāṇām avagantavyaḥ |
T02D1364:183b-16	འདིར་གསང་བ་འདུས་པའི་རྒྱུད་ཕྱི་མ་ལས་། སོ་སོར་སྡུད་དང་བསམ་གཏན་དང་༎ ༄༡༨༤ཨ་༌་༎	T02n2998u_001:2131	 iha śrīsamājottare bha- gavān āha- pratyāhāras tathā dhyānaṁ prāṇāyāmaś ca dhāraṇā |
T02D1364:183b-5	དེ་ལ་འདིར་ཐབས་ནི་ཡན་ལག་དྲུག་གི་རྣལ་འབྱོར་ཏེ་།	T02n2998u_001:2117	 asāv upāyaḥ ṣaḍaṅgayogaḥ |
T02D1364:183b-6	འདིར་བར་མ་རིམ་པ་ལས་བཟློག་བས་བསྟན་ཅིང་ནང་གི་ཡན་ལག་རེ་རེ་དོར་བ་སྔ་མ་མ་བསྟན་པའི་ཡན་ལག་ཕྱི་མ་བསྟན་པའི་ཤུགས་ཉིད་ཀྱིས་རྟོགས་པར་བྱ་སྟེ་།	T02n2998u_001:2118	 atra madhyavilomenokta ekānta- riṭāṅgaṁ tyaktvā |  tad evānuktāṅgaṁ pūrvam aparoktāṅgasāmarthyād evāvagantavyam |
T02D1364:183b-7	དཔེར་ན་འདི་ནི་ཉིན་སྤྱོད་ཅེས་བརྗོད་པས་གཞན་མཚན་སྤྱོད་ཅེས་བྱ་བ་མ་བརྗོད་ཀྱང་ཤུགས་ཉིད་ཀྱིས་ཉེ་བར་དམིགས་པར་འགྱུར་རོ་༎	T02n2998u_001:2120	 yathāyaṁ divākara ity ukte 'paro niśākaro 'nukto 'pi sāmarthyād evopalabhyate |
T02D1364:183b-8	དེ་བཞིན་དུ་ཡང་གང་ཞིག་ཕན་ཚུན་ལྟོས་པའི་ཆོས་ནི་མ་བསྟན་པ་ཡང་བསྟན་པའི་ཆོས་ཀྱིས་ཉེ་བར་རྟོགས་སོ་༎	T02n2998u_001:2121	 tathā parasparāpekṣakadharmo 'nukto 'py uktadharmenopalabhyate |
T02D1364:183b-9	དེའི་ཕྱིར་རྒྱུད་འདིར་ཡན་ལག་རེ་རེའི་ཁོངས་སུ་གཏོགས་པའི་ཡན་ལག་གསུམ་བསྟན་ཏོ་༎	T02n2998u_001:2122	 ato 'smin tantre ekāntaritam aparāṅgatrayaṁ (83) nirdiṣṭaṁ |
T02D1364:184a-1	སྲོག་དང་རྩོལ་དང་འཛིན་པ་དང་། རྗེས་སུ་དྲན་དང་ཏིང་འཛིན་ཏེ་༎ རྣལ་འབྱོར་ཡན་ལག་དྲུག་ཏུ་འདོད་༎	T02n2998u_001:2132	 anusmṛtiḥ samādhiś ca ṣaḍaṅgo yoga iṣyate ||
T02D1364:184a-10	དེ་ལ་བདེ་བའི་སྒྲས་ཏིང་ངེ་འཛིན་བསྟན་ཏོ་༎	T02n2998u_001:2137	 atra su- khaśabdena samādhir ucyate |
T02D1364:184a-11	དེ་ལྟར་ན་ཡན་ལག་དྲུག་གི་རྣལ་འབྱོར་བ་ཉིད་ནི་སངས་རྒྱས་ཉིད་དུ་དྲུག་འགྲུབ་པར་འགྱུར་རོ་༎	T02n2998u_001:2138	 evam ebhiḥ ṣaḍaṅgaiḥ sidhyati yogitvaṁ buddhatvam iti |
T02D1364:184a-12	ཐ་མལ་པའི་ཕྱིའི་འཇིག་རྟེན་པའི་རྣལ་འབྱོར་གྲུབ་པ་ནི་ལས་དང་པོ་པའི་བྱིས་པའི་རྣལ་འབྱོར་པ་རྣམས་ཀྱིས་སྔགས་བཟླས་པ་དང་བསམ་གཏན་གྱིས་ཏེ་། དཀྱིལ་འཁོར་གྱི་འཁོར་ལོ་བརྟགས་པའི་བསྒོམ་པའི་སེམས་དང་བདེ་བ་ནི་ལས་ཀྱི་ཕྱག་རྒྱ་དང་ཡེ་ཤེས་ཀྱི་ཕྱག་རྒྱ་ལས་བྱུང་བའི་འཇིག་རྟེན་པའི་བདེ་བ་དང་། འབབ་པའི་རང་བཞིན་གྱི་བདེ་བ་འཇིག་རྟེན་པའི་བདེ་བས་ནི་འོག་མིན་གྱི་གནས་ཀྱི་བར་གྱི་འཇིག་རྟེན་པའི་འབྲས་བུའོ་༎	T02n2998u_001:2139	 sāmānyena bāhyayotitvaṁ laukikaṁ sidhyati |  ādi- karmikāṇāṁ bālayogināṁ laukikaṁ phalaṁ mantrajāpena pratyāhāra- saṁjñijnā |  dhyānena maṇḍalacakrādivikalpabhāvanācittena sukhena ca karmamudrājñānamudrākṣaraspandasukhena |  laukikasatyenākani- ṣṭhabhuvanaparyantam iti |
T02D1364:184a-14	དེ་ལྟར་རིམ་པ་གཉིས་ཀྱིས་འཇིག་རྟེན་པ་དང་འཇིག་རྟེན་ལས་འདས་པའི་རྣལ་འབྱོར་བ་ཉིད་འགྲུབ་པར་འགྱུར་རོ་༎	T02n2998u_001:2143	 evam ubhyakrameṇa laukikalokotta- raṁ yogitvaṁ sidhyati |
T02D1364:184a-15	འདིར་འཇིག་རྟེན་ལས་འདས་པའི་རྣལ་འབྱོར་བ་ཉིད་མཆོག་གི་ཡན་ལག་དྲུག་གི་སྦྱོར་བས་འགྲུབ་པ་ཇི་ལྟ་བ་དེ་བཞིན་དུ་བསྟན་པར་བྱ་སྟེ་༎	T02n2998u_001:2144	 atra lokottaraṁ yogitvaṁ ṣaḍaṅgayogena sidhyati |
T02D1364:184a-16	འདི་སོ་སོར་སྡུད་པ་ནི་ཕྱིའི་གཟུགས་ལ་སོགས་པའི་ཡུལ་རྣམས་ལ་མིག་ལ་སོགས་པའི་རྣམ་པར་ཤེས་པ་མི་འཇུག་ཅིང་། ནང་ཀི་ཡུལ་རྣམས་ལ་ལྷའི་མིག་ལ་སོགས་པའི་དབང་པོ་རྣམས་ཀྱི་རྣམ་པར་ཤེས་པ་འཇུག་པ་སྟེ་༎	T02n2998u_001:2145	 yathā tathocyate ||  (84) Chapter XVIII The Sixfold Yoga ( ṣaḍaṅgayoga )  iha pratyāhāro nāma bāhyarūpādiviṣayeṣv apravṛttiś kṣurādīndriyaiś cakṣurvijñānādīnām |
T02D1364:184a-18	ནང་གི་ནི་ཆོས་ཐམས་ཅད་སྟོང་པ་ཉིད་ཀྱི་དམིགས་པ་རྣམ་པར་མ་བརྟགས་པར་མཐོང་བ་ནི་དངོས་པོ་ཐམས་ཅད་མཐོང་བ་སྟོང་པ་ཉིད་ཀྱིས་ཏེ་། ཇི་ལྟར་བུ་མོས་གཟུགས་བརྙན་མཐོང་བ་ལྟར་ཁམས་གསུམ་པའི་སངས་རྒྱས་ཀྱི་གཟུགས་བརྙན་མཐོང་བ་ནི་སོ་སོར་སྡུད་པ་ཞེས་བྱ་བ་ཡན་ལག་དང་པོའོ་༎	T02n2998u_001:2148	 adhyātmani viṣayeṣu pravṛttir vyacakṣurādīndriyair divyacakṣurvijñānādīnām iti |  adhyātmani śūnyatā- mbhanenāakalpitaṁ sarvabhāvadarśanaṁ śūnye pratisenādarśe mārikāyā iveti pratyāhārāṅgam ucyate traidhātukabuddhabimba- rśanād iti |
T02D1364:184a-20	དེ་ནས་བསམ་གཏན་ནི་དངོས་པོ་ཡོད་པ་ཐམས་ཅད་ཀྱི་སྟོང་པ་ཤེས་རབ་ཏུ་འདུས་པ་ལ་སེམས་ཀྱི་འཇུག་པའོ་༎	T02n2998u_001:2150	 tato dhyānaṁ nāma śūnyeṣu sarvadharmeṣu dṛṣṭeṣu satsu |  ajñā nāma teṣu cittapravṛttiḥ |
T02D1364:184a-21	རྟོག་པ་ཞེས་བྱ་བ་ནི་སེམས་ཀྱི་དངོས་པོའི་དོན་འཛིན་པའོ་༎ དཔྱོད་པ་ཞེས་བྱ་བ་ནི་དངོས་པོའི་ཁྱད་པར་འཛིན་པའོ་༎	T02n2998u_001:2152	 vitarko nāma bhāvagrahaṇaṁ citta sya |  vicāro nāmo bhāvagrahaṇapratipattiḥ |
T02D1364:184a-23	དགའ་བ་ཞེས་བྱ་བ་ནི་དངོས་པོ་ཐམས་ཅད་ལ་སེམས་གནས་པའོ་༎ བདེ་བ་ནི་དངོས་པོ་ཐམས་ཅད་ཀྱི་མི་ག-ཡོ་བའི་ཕུང་༄༡༨༤བ་སུམ་ཚོགས་པའོ་༎	T02n2998u_001:2154	 ratir nāma sarvabhāveṣu tāropaṇam acalasukhaṁ nāma sarvabhāvebhyaḥ sukhasaṁpattiḥ |
T02D1364:184a-4	དེས་ན་བསམ་གཏན་གྱི་སྔོན་དུ་འགྲོ་བ་ནི་སོ་སོར་སྡུད་པའོ་༎	T02n2998u_001:2133	 ato dhyānapūrvaḥ pratyāhāro veditavyaḥ |
T02D1364:184a-5	སྔགས་བཟླས་པའི་སྔོན་དུ་འགྲོ་བ་ནི་སྲོག་དང་རྩོལ་བ་སྟེ་།	T02n2998u_001:2134	 mantrajāpapūrvaḥ prā- ṇāyāmo veditavyaḥ |
T02D1364:184a-6	འདིར་སྔགས་བཟླས་པའི་སྒྲས་ནི་མ་ནིང་གི་བཟླས་པའམ་། རྡོ་རྗེའི་བཟླས་པ་སྟེ་། སྲོག་གི་རླུང་འཛིན་པར་བརྗོད་དོ་༎	T02n2998u_001:2135	 atra mantrajāpaśabdena napuṁsakajāpo vajra- jāpo vā prāṇadhāraṇā ucyate |
T02D1364:184a-9	བདེ་བའི་སྔོན་དུ་འགྲོ་བ་ནི་རྗེས་སུ་དྲན་པ་སྟེ་།	T02n2998u_001:2136	 sukhapūrvānusmṛtir veditavyā |
T02D1364:184b-1	དེ་ལྟར་བསམ་གཏན་གྱི་ཡན་ལག་ལྔ་བསྟན་ཏོ་༎	T02n2998u_001:2155	 evaṁ ñcadhā dhyānāṅgam ucyate |
T02D1364:184b-10	དཔལ་མཆོག་དང་པོའམ་། བླ་མའི་མན་ངག་ལས་ཕྱག་རྒྱ་ཆེན་པོའི་དངོས་གྲུབ་འདོད་པའི་རྣལ་འབྱོར་པས་ཁོང་དུ་ཆུད་པར་བྱའོ་༎	T02n2998u_001:2171	 o lakṣābhidhāne paramādibuddhe vā sadgurūpadeśenāvagantavyo yoginā mahāmudrāsiddhaya iti |
T02D1364:184b-12	འདིར་ཡན་ལག་དྲུག་གི་རྣལ་འབྱོར་དང་པོའི་ལམ་དུ་བསྒོམ་པའི་མན་ངག་བསྟན་པ་རྒྱུད་གཞན་རྣམས་སུ་གསུངས་པ་ནི་གསང་བ་འདུས་པའི་རྒྱུད་ཕྱི་མ་ལས་བསྙེན་པ་དང་། ཉེ་བར་སྒྲུབ་པ་དང་། སྒྲུབ་པ་དང་། སྒྲུབ་པ་ཆེན་པོ་རྣམས་ཏེ་།	T02n2998u_001:2172	 iha ṣaḍaṅgasya punar ādimārgabhāvanopadeśas tantrān- tareṣūkhaḥ |  iha śrīsamājottare sevopasādhanaṁ sādhanaṁ mahāsā dhanaṁ ceti |
T02D1364:184b-14	བསྙེན་དུས་གཙུག་ཏོར་ཆེན་པོ་ཡི་༎ གཟུགས་སུ་འབད་པས་བསྒོམ་པར་བྱ་༎	T02n2998u_001:2174	 tad eva bhagavān āha- sevākāle mahoṣṇīṣaṁ bimbaṁ vibhāvya yatnataḥ |
T02D1364:184b-16	ཉེ་སྒྲུབ་དུས་སུ་དེ་བཞིན་དུ་༎ བདུད་རྩི་འཁྱིལ་པའི་གཟུགས་བསྒོམ་བྱ་༎	T02n2998u_001:2175	 upasādhanakāle tu bimbaṁ cāmṛtakuṇḍalīm ||
T02D1364:184b-18	སྒྲུབ་པ་ལ་ནི་ལྷ་ཡི་གཟུགས་༎ རྣལ་འབྱོར་བརྩོན་པས་བསྒོམ་པར་བྱ་༎	T02n2998u_001:2176	 sādhane devatābimbaṁ bhāvayed yogatatparaḥ |
T02D1364:184b-2	དེ་ནས་སྲོག་དང་རྩོལ་བ་ཞེས་བྱ་བ་ནི་ལ་ལ་ནའ་དང་། ར་ས་ནའ་སྟེ་ག-ཡས་པ་དང་ག-ཡོན་པ་འགགས་ཤིང་ཨཨ་བ་དྷའུ་ཏའི་ར་ཐིམ་སྟེ་དབུས་ཀྱི་ལམ་དུ་སྲོག་གི་རླུང་རྟག་ཏུ་འཇུག་པའོ་༎	T02n2998u_001:2156	 tataḥ prāṇāyāmo nāma lalanārasanā- madakṣiṇamārganirodhaḥ |  avadhūtīmadhyamārge prāṇavāyoḥ sadā avṛttir iti |
T02D1364:184b-20	སངས་རྒྱས་མངའ་བདག་གཟུགས་ཉིད་ནི་༎ སྒྲུབ་པ་ཆེ་ལ་རྣམ་པར་བརྟག་། ཅེས་གསུངས་ཏེ་།	T02n2998u_001:2177	 mahāsādhanakāle tu bimbaṁ buddhādhipaṁ vibhum ||
T02D1364:184b-3	རྔུབ་པ་དང་། གནས་པ་དང་། འབྱུང་བའི་སྦྱོར་བས་ཨཨ་བ་དྷའུ་ཏའིར་ཨཨོམ་གྱིས་འཇུག་པ་དང་། ཧའུམ་གིས་འགོག་པ་དང་། ཨཨ༔་ས་འབྱུང་བ་དང་། ཟླ་བ་དང་། སྒྲ་གཅན་དང་། ཉི་མའི་རང་བཞིན་གྱིས་གམས་པར་བྱེད་པ་ནི་སྲོག་དང་རྩོལ་བའི་རང་བཞིན་དུ་བསྟན་ཏོ་༎	T02n2998u_001:2158	 pūrakakumbhakare cakayogenāvadhūtyām _kāreṇa śvāsaṁ |  hūṁkāreṇa nirodham |  āḥkāreṇa niḥśvāsam |  (85) candrarāhusūryasvabhāvena kurute yogīti prāṇāyāmāṅgam ucyate |
T02D1364:184b-4	དེ་ནས་འཛིན་པ་ཞེས་བྱ་བ་ནི་སྲོག་གི་རླུང་ལྟེ་བ་དང་། སྙིང་ག་དང་། ཀློག་མ་དང་། དཔྲལ་བའི་དབང་ཆེན་དང་༏་ཆུ་དང་། མེ་དང་། རླུང་གི་དཀྱིལ་འཁོར་རྣམས་སུ་འཇུག་པས་ཐིག་ལེ་ལ་སྲོག་གནས་ཤིང་ཕྱིར་མི་འབྱུང་བ་ནི་འཛིན་པའི་ཡན་ལག་ཏུ་བསྟན་ཏོ་༎	T02n2998u_001:2162	 tato dhāraṇā nāma prāṇasya māhendravāruṇāgnivāyumaṇḍale nābhau hṛdi kaṇṭhe lalāṭe praveśo bāhye 'nirgamaḥ |  bindau prāṇaniveśanam iti dhāraṇāṅgam ucyate |
T02D1364:184b-5	དེ་ནས་རྗེས་སུ་དྲན་པ་ཞེས་བྱ་བ་ནི་རང་དད་པའི་ལྷའི་གཟུགས་བརྙན་མཐོང་བས་རྣམ་པར་རྟོག་པ་སྤང་བའོ་༎	T02n2998u_001:2164	 tato 'nusmṛtir nāma sveṣṭadevatādarśanaṁ pratibimbākāraṁ vikalparahitam |
T02D1364:184b-6	དེ་ལས་འོད་ཟེར་དུ་མ་འཕྲོ་བའི་གཟུགས་ཅན་རབ་ཏུ་སྣང་བའི་དཀྱིལ་འཁོར་སྣ་ཚོགས་ཀྱི་ཚུལ་ཅན་ཁམས་གསུམ་དུ་སྤྲོ་བ་དེ་རྗེས་སུ་དྲན་པའི་ཡན་ལག་གོ་༎	T02n2998u_001:2165	 tasmād anekaraśmisphuradrūpaṁ pra- bhāmaṇḍalam |  tato 'nekākāraṁ sphuradrūpaṁ traidhātukaspharaṇam ity anusmṛtyaṅgam ucyate |
T02D1364:184b-7	ཏིང་ངེ་འཛིན་ཞེས་བྱ་བ་ནི་རང་དད་པའི་ལྷ་ལ་རྗེས་སུ་ཆགས་ཤིང་མི་འཇིགས་པའི་བདེ་བ་། གཟུང་བ་དང་འཛིན་པ་མེད་པར་སེམས་རྩེ་གཅིག་པ་ཡིན་ནོ་ཞེས་ཏིང་ངེ་འཛིན་གྱི་ཡན་ལག་དེ་བཞིན་གཤེགས་པས་གསུངས་སོ་༎	T02n2998u_001:2167	 tataḥ samādhir nāmeṣṭadevatānu- rāgād yadakṣarasukhaprāptis tasyām ekīkaraṇaṁ cittasya |  grāhya- grāhakarahitaṁ cittaṁ samādhyaṅgam ucyate tathāgataiḥ |
T02D1364:184b-9	འདིར་ཡན་ལག་དྲུག་ནི་རྣལ་འབྱོར་མདོར་གསུངས་པ་སྟེ་རྒྱས་པར་ནི་འབུམ་སྡེའམ་།	T02n2998u_001:2169	 iha ṣaḍaṅ- gayogo 'tra saṁkṣepeṇokto |  vistar(at)
T02D1364:185a-0	འདིར་དགོངས་པའི་ཚིག་གཞན་གྱིས་གཙུག་ཏོར་ཆེན་པོའི་གཟུགས་ནི་ཁམས་གསུམ་༄༡༨༥ཨ་༌་༎ མ་ལུས་པའི་སངས་རྒྱས་ཀྱི་སྐུ་ནམ་མཁའ་ཆོས་འབྱུང་བར་ཐུགས་རྗེ་རབ་ཏུ་གཞག་ཅིང་བསྙེན་པའི་དུས་དང་པོར་སོ་སོར་སྡུད་པས་སྒོམ་ཞིང་བསམ་གཏན་གྱི་ཡན་ལག་གིས་ཀྱང་བརྟན་པར་བྱའོ་༎ དེ་ལ་བཅོམ་ལྡན་འདས་ཀྱིས་དམ་བཅའ་བ་ནི་།	T02n2998u_001:2179	 atra saṁdhyābhāṣāntareṇoṣṇīṣabimbaṁ buddhabimbaṁ tra- idhātukam aśeṣataḥ |  ākāśe dharmodaye cittavajraṁ pratiṣthāpya sevākāle prathamakāle pratyāhāreṇa bhāvayed dhyānāṅgena sthirīkuryād ity atra bhagavataḥ pratijñā-
T02D1364:185a-11	ས་གསུམ་པོ་ནི་བསྒྲུབ་པར་བྱ་༎ ཞེས་བྱ་བ་ལས་གསུམ་པའི་སངས་རྒྱས་ཀྱི་སྐུ་མིག་ལ་སོགས་པའི་བྱེད་པ་རྣམས་ཀྱིས་བསྒྲུབ་པར་བྱའོ་༎	T02n2998u_001:2187	 tathā- karaṇair bandhasaṁyogaiḥ sādhayed bhuvanatrayam |  iti |  buddhabimbaṁ bhuvanatrayaṁ sādhayet karaṇaiś cakṣurādibhiḥ |
T02D1364:185a-13	དེ་ཉིད་ཀྱི་མན་ངག་ནི་། ཞལ་ལས་ཁོང་དུ་ཆུད་པར་བྱའོ་༎	T02n2998u_001:2190	 sa evo- padeśo guruvaktreṇāvagantavyaḥ |
T02D1364:185a-15	དེ་ལ་བླ་མའི་མན་ངག་གིས་རྣལ་འབྱོར་བས་དང་པོར་ནམ་མཁའ་ལ་དུ་བ་ལྟ་བུ་མཐོང་སྟེ་སྨིག་རྒྱུ་ནི་མ་ཡིན་ཞེས་རང་གིས་ཉམས་སུ་མྱོང་བར་ཤེས་པར་བྱའོ་༎ དེ་ནས་སྨིག་རྒྱུ་ལྟ་བུ་སྟེ་༏་དུ་བ་ལ་སོགས་པ་དེ་ཉིད་རྟོག་པ་མེད་པར་གཟུགས་བརྙན་བཞིན་དུའོ་༎	T02n2998u_001:2191	 tatra gurūpadeśenākāśe prathamaṁ yogī dhūmaṁ paśyati na marīcikām iti svānubhavato jñeyam |  tato marīcikā paścāt tad eva dhūmādikaṁ kalpanārahitaṁ pratisenāvad iti |
T02D1364:185a-18	དང་པོ་དུ་བ་ལྟ་བུ་དང་། གཉིས་པ་སྨིག་རྒྱུ་ལྟ་བུ་དང་། གསུམ་པ་ནམ་མཁའ་ལྟ་བུ་དང་། བཞི་པ་མར་མེ་ལྟ་བུ་དང་། ལྔ་པ་སྤྲིན་མེད་པའི་ནམ་མཁའ་ལྟ་བུའི་རྟགས་གསང་བ་འདུས་པ་དང་། མཁའ་འགྲོ་མའི་དྲ་བ་ལས་གསུངས་སོ་༎	T02n2998u_001:2193	 evaṁ prathamaṁ dhūmanimittam |  dvitīyaṁ marīcikānimittam |  tṛtīyaṁ khadyotanimittam |  caturtham dīpanimittam |  pañcamaṁ nirabhragaganasaṁnibhaṁ nimittam iti samājottare |
T02D1364:185a-19	གཞན་ཡང་མཁའ་འགྲོ་མ་རྡོ་རྗེ་དྲ་བ་ལས་། བཅོམ་ལྡན་འདས་ཀྱིས་།	T02n2998u_001:2198	 ḍākinī- vajrapañjare 'pi bhagavatoktam |  tadupari bhagavān āha ḍākinīvajra- pañjare- sarvajñahetukaṁ tad dhi siddhinikaṭe nivartakam |
T02D1364:185a-21	སྒྱུ་མ་ལྟ་བུའི་རྣམ་པ་དང་༎ སྐད་ཅིག་རྨི་ལམ་ལྟ་བུའི་རྗེས་༎	T02n2998u_001:2200	 paścān māyopamākāraṁ svapnākāraṁ kṣaṇāt kṣaṇaṁ ||
T02D1364:185a-25	དེས་ན་བཅོམ་ལྡན་འདས་ཀྱི་བཀའ་ལས་དང་པོ་དུ་བ་ལྟ་བུ་ལ་སོགས་པའི་མཚན་མ་ནི་བསྒོམ་པའི་རྟགས་སུ་འགྱུར་རོ་༎	T02n2998u_001:2202	 ato bhagavato vacanād ādau dhūmādinimittabhāvanā- pratyayo bhavati |
T02D1364:185a-26	ཁ་ཅིག་ནི་གྲུབ་པའི་དུས་སུ་ཞེས་སྨྲ་སྟེ་། དེ་རྣམས་ནི་དེ་བཞིན་གཤེགས་པའི་དམ་བཅའ་མ་ཉམས་པར་བྱེད་པ་སྟེ་།	T02n2998u_001:2203	 kecit siddhikāle vadiṣyanti te sarve bhagavataḥ pratijñābhaṅgakāriṇaḥ |
T02D1364:185a-28	རྟོག་པ་ཐམས་ཅད་ཡོངས་སྤང་སྟེ་༎ ཉིན་ཞག་གཅིག་ལ་བརྟག་པར་བྱ་༎ ཞེས་བྱ་བའི་བཅོམ་ལྡན་༄༡༨༥བ་འདས་ཀྱི་བཀའ་སུན་འབྱིན་པར་འགྱུར་རོ་༎	T02n2998u_001:2204	 sarvacintāṁ parityajya dinam ekaṁ parīkṣayet pratyayam iti bhagavato vacanaviheṭhakāḥ |
T02D1364:185a-3	རྟོག་པ་ཐམས་ཅད་རྣམ་སྤངས་ཏེ་༎ ཉིན་ཞག་གཅིག་ལ་རྣམ་པར་བརྟག་། གལ་ཏེ་རྟགས་ནི་མ་བྱུང་ན་༎	T02n2998u_001:2181	 sarvacintāṁ parityajya dinam ekaṁ parīkṣayet |
T02D1364:185a-5	དེ་ཚེ་ང་ཡི་ཚིག་བརྫུན་ཡིན་༎	T02n2998u_001:2182	 yadi na syāt pratyayas tatra tadā me tanmṛṣā vacaḥ ||  iti |
T02D1364:185a-6	དེ་ལ་རྟགས་ནི་དུ་བ་ལ་སོགས་པའི་མཚན་མའོ་༎ གཞན་དུ་སྔགས་ལ་སོགས་པས་མ་ཡིན་ནོ་༎ ཞན་གཅིག་ལ་སྒྲུབ་པ་གང་གིས་སྔགས་པ་ལ་རྟགས་འབྱུང་སྟེ་།	T02n2998u_001:2184	 atra pratyayo dhūmādikaṁ nimittaṁ nānyan mantrādikaṁ dinenaikena sādhyate yena pratyayo bhaviṣyati mantriṇām |
