src_segmentnr	src_original	tgt_segmentnr	tgt_original
T02D1402:124a-10	རྒྱུ་མཐུན་ལ་སོགས་བདེ་བ་རྫོགས་༎ དྲི་མ་མེད་པའི་བར་དུ་བསྒོམ་༎	T02n798u_001:79	 niṣpandādi sukhāpūrṇa vaimalyaṃ yāvadeti tat ||
T02D1402:124a-12	ཞེས་པ་དང་། དེ་བཞིན་དུ་།	T02n798u_001:80	 tathā coktam
T02D1402:124a-13	བྷ་གར་ལིངག་རབ་བཞག་ནས་༎ བྱང་ཆུབ་སེམས་ནི་སྤྲོ་མི་བྱ་༎	T02n798u_001:81	 bhage liṅgaṃ pratiṣṭhāpya bodhicittaṃ na cotsṛjet |
T02D1402:124a-15	ཁམས་གསུམ་པ་ནི་མ་ལུས་པ་༎ སངས་རྒྱས་གཟུགས་སུ་བསྒོམ་པར་བྱ་༎	T02n798u_001:82	 bhāvayed buddhabimbaṃ tu traidhatukamaśeṣataḥ || iti ||
T02D1402:124a-17	ཞེས་པའོ་༎ འདིར་ཚིགས་སུ་བཅད་པ་གཉིས་པོ་འདིས་རྡོ་རྗེའི་ཚིག་འདིས་བསྡུས་པའི་དོན་རྟོགས་པར་བྱ་སྟེ་།	T02n798u_001:83	 ihānena gāthādvayenāsya vajrapadasya piṇḍārtho'vagantavya iti |
T02D1402:124a-19	འདིར་རྡོ་རྗེ་ནོར་བུའི་ནང་དུ་གནས་པའི་བྱང་ཆུབ་ཀྱི་སེམས་ལ་ཡིད་ནི་ནང་དུ་ཆུད་པ་ཞེས་བརྗོད་དོ་༎	T02n798u_001:86	 vajrasya maṇau madhye catubinddhātmakaṃ cittavajraṃ yadā bhavati ,  tadāvajraparyaṅkataścittaṃ maṇyantargata mityucyate |
T02D1402:124a-2	ཡིད་ནི་ནང་དུ་ཆུད་པ་ཡིས་༎ ཞེས་པ་ལ་སོགས་པས་སོ་༎	T02n798u_001:75	 antargatena manaseti |
T02D1402:124a-21	མེད་པའི་མཚན་ཉིད་བརྟན་པ་དང་ག-ཡོ་བ་དངོས་པོ་དང་དངོས་པོ་མེད་པའི་རང་བཞིན་རྣམ་པ་ཐམས་ཅད་ཀྱི་མཆོག་དང་ལྡན་པའི་བདག་ཉིད་མ་ལུས་པ་རྣལ་འབྱོར་པས་བསྒོམ་པར་བྱའོ་༎	T02n798u_001:100	 iha maṇyantantargataṃ tyajya bodhicittamantargataṃ mana ityucyate |  tenāntargatena manasā acyutabodhicittena karmamudrāprasaṅgena jñānamudrāprasaṅgena sthiracarasvabhāvātmakaṃ sarvākaravaropetaṃ bhāvayedaśeṣatai (to) yogī |
T02D1402:124a-22	དེ་ཉིད་ཤེས་རབ་ཀྱི་ཕ་རོལ་ཏུ་ཕྱིན་པ་རྣམ་པ་ཐམས་ཅད་ཀྱི་མཆོག་དང་ལྡན་པའོ་༎	T02n798u_001:102	 tadeva prajñāpāramitā sarvākāravaropetā śunyatā ca ,
T02D1402:124a-23	དེ་ཡང་རྒྱུད་འདིར་བཅོམ་ལྡན་འདས་ཀྱིས་འདོད་པའི་དངོས་གྲུབ་ཏུ་གསུངས་ཏེ་ཤེས་རབ་ཀྱི་རྒྱུད་འདི་ཉིད་ལས་སོ་༎	T02n798u_001:103	 sā śrīsaṃvarottare kāmasiddhirityuktā bhagavatā ,
T02D1402:124a-4	སྔགས་ཀྱི་ཚུལ་འདིར་ཤེས་རབ་དང་ཐབས་ཀྱི་རྒྱུད་རྣམས་སུ་རྡོ་རྗེའི་ཚིག་འདི་དགོངས་པའི་སྐད་གཞན་གྱིས་རྒྱུད་དང་རྒྱུད་གཞན་གྱིས་རྟོགས་པར་བྱའོ་༎ ཡིད་ནི་ནང་དུ་ཆུད་པ་ཡིས་༎ ཞེས་པ་རྐང་པ་འདིའི་ཚིག་སྔ་མ་ལ་སོགས་པ་འདི་ཡང་རྡོ་རྗེའི་ཚིག་སྟེ་།	T02n798u_001:76	 idaṃ vajrapade ca pañcavidhā (daṃ ca pañcavidhaṃ )
T02D1402:124a-7	དཔལ་འདུས་པ་སྟོང་ཕྲག་ཉི་ཤུ་ལྔ་པར་སངས་རྒྱས་བཅོམ་ལྡན་འདས་ཀྱིས་གསུངས་པ་།	T02n798u_001:77	 trisāhasrike śrīsamāje buddho bhagavānāha
T02D1402:124a-8	རྡོ་རྗེའི་སྐྱིལ་ཀྲུང་གིས་སེམས་ནི་༎ ནོར་བུའི་ནང་དུ་གནས་པར་བལྟ་༎	T02n798u_001:78	 vajraparyaṅkataścittaṃ maṇyantargatamīkṣe (kṣaye) t |
T02D1402:132a-18	གཟི་བརྗིད་ཆེན་པོ་འོད་གསལ་བ་༎ རིག་པའི་རྒྱལ་པོ་སྔགས་དབང་པོ་༎ གསང་སྔགས་རྒྱལ་པོ་དོན་ཆེན་བྱེད་༎ ཅེས་པ་ཚིགས་སུ་བཅད་པ་གཉིས་ཀྱིས་སྒྱུ་འཕྲུལ་དྲ་བར་མཚན་མ་གཞན་བཅོམ་ལྡན་འདས་ཀྱིས་དགོངས་པའི་སྐད་གཞན་གྱིས་གསུངས་ཏེ་། སྔར་བརྗོད་པའི་སྤྲིན་མེད་པའི་ནམ་མཁའ་ལས་བྱུང་བའི་སྣང་བ་གང་ཡིན་པ་དེ་ནི་རྣམ་པར་རྟོག་པ་ཐམས་ཅད་དང་བྲལ་བའི་སེམས་ལས་ནམ་མཁའ་ལས་བྱུང་རང་བྱུང་བའོ་༎	T02n798u_001:221	 svayambhūḥ sarvavikalparahitacittatvāditi |
T02D1402:132a-23	འདིར་༏་ཤེས་རབ་ཡེ་ཤེས་མེ་བོ་ཆེ་༎ ཞེས་པ་འབར་བ་ལྟར་སྣང་བའོ་༎	T02n798u_001:222	 atra prajñājñānānalo jñānapratibhāsaḥ |
T02D1402:132a-25	འོད་ཆེན་རྣམ་པར་སྣང་བར་བྱེད་༎ ཅེས་པ་བླ་བ་ལྟར་སྣང་པའོ་༎	T02n798u_001:223	 vairocano mahādīptiriti candrapratibhāsaḥ |  sa eva jñānajyotivirocanaśca |
T02D1402:132a-28	ཞེས་པའོ་༎ འགྲོ་བའི་མར་མེ་ཞེས་པ་ཉི་མ་ལྟར་སྣང་བའོ་༎	T02n798u_001:225	 jagatpradīpa iti suryapratibhāsaḥ |
T02D1402:132a-29	ཡེ་ཤེས་སྒྲོན་ཞེས་པ་སྒྲ་གཅན་ལྟར་སྣང་བའོ་༎	T02n798u_001:226	 jñānolkā iti rāhupratibhāsaḥ |  mahātejāḥ prabhāsvara iti sūryapratibhāsaḥ |  jñānolkā iti rāhupratibhāsaḥ |
T02D1402:132a-30	གཟི་བརྗིད་ཆེན་པོ་འོད་གསལ་བ་༎ ཞེས་པ་གློག་ལྟར་སྣང་བའོ་༎	T02n798u_001:229	 mahātejāḥ prabhāsvara iti vidyutpratibhāsaḥ |
T02D1402:132a-32	རིག་པའི་རྒྱལ་མཆོག་སྔགས་དབང་པོ་༎	T02n798u_001:230	 vidyārājo'gra mantreśa iti cittapratibhāso nīlavarṇacandramaṇḍalākāraḥ |
