src_segmentnr	src_original	tgt_segmentnr	tgt_original
T02mpvv_u:0	 Mahāpratisarāvidyāvidhi	T02D3118:217b-0	༄༢༡༧བ་`་༎ སོ་སོར་འབྲང་མའི་འཁོར་ལོ་བྲི་བའི་ཐབས་བཞུགས་།
T02mpvv_u:1	 namo bhagavatyai āryamahāpratisarāyai //	T02D3118:217b-1	༅་༎ འཕགས་པ་འཇམ་དཔལ་གཞོན་ནུར་གྱུར་པ་ལ་ཕྱག་འཚལ་ལོ་༏
T02mpvv_u:15	 oṃ amṛtavilokini garbhasaṃrakṣaṇi ākarṣaṇi dhārakasya rakṣāṃ śāntipuṣṭiṃ kuru hūṃ 2 phaṭ 2 svāhā /  [Mpvv, Page 477]  paścime //  oṃ bhara 2 saṃbhara 2 indriyabalaviśodhani dhārakasya rakṣāṃ kuru hūṃ 2 phaṭ 2 ruru cale svāhā //  uttare //	T02D3118:218a-0	དེའི་དབུས་སུ་ཟླ་བ་ཕྱེད་པས་བརྒྱན་པའི་ཧའུམ་བརྒྱད་ཀྱིས་བསྐོར་བའི་ཡི་གེ་པྲམ་དེའི་དབུས་སུ་སྔགས་ཨཨོམ་མ་ནི་དྷ་རི་བཛྲི་ནི་མ་ཧའ་པྲ་ཏི་སའ་རེ་ཆེ་གེ་མོ་རཀཤ་རཀཤ་པུཤཏིམ་ཤའིནཏམ་ཀུ་རུ་ཧའུམ་ཧའུམ་ཕཏ་༄༢༡༨ཨ་༌་༎
T02mpvv_u:2	 natvā pratisarāṃ bhaktyā sarvabuddhābhinanditām /	T02D3118:217b-2	། སངས་རྒྱས་ཀུན་གྱིས་མངོན་བསྟོད་པའི་༎
T02mpvv_u:20	 oṃ amṛtavare vara vara pravaraviśuddhe dhārakasya rakṣāṃ śāntipuṣṭiṃ kuru hūṃ 2 phaṭ 2 svāhā //	T02D3118:218a-1	ཕཏ་སབ༹འ་ཧའ་། དེའི་ཕྱི་རོལ་དུ་སོར་ཕྱེད་ཀྱི་ཚད་ཀྱི་རིམ་པ་གཉིས་བྱས་ལ་། དེའི་རིམ་པ་དང་པོ་ལ་ཨཨོམ་མ་ནི་དྷ་རི་བཛྲི་ན་མི་ཧའ་པྲ་ཏི་སའ་རེ་ཆེ་གེ་མོ་རཀཤ་རཀཤ་པུཤཏིམ་ཤའནཏིམ་ཀུ་རུ་ཧའུམ་ཧའུམ་ཕཏ་ཕཏ་། དེ་བཞིན་དུ་བྱས་ལ་ལན་གཉིས་ཡང་ངོ་༎ རིམ་པ་གཉིས་པ་ལ་ཡང་དེ་བཞིན་དུའོ་༏་། དེའི་ཕྱི་རོལ་དུ་སོར་གསུམ་གྱི་ཚད་ལ་ནི་རིམ་པ་གཅིག་བྱས་ལ་།
T02mpvv_u:21	 dalānāṃ madhye hūṃkārāṣṭakaveṣṭitapraiṃkāramadhye maṇidharītyādi mantraṃ likhet //	T02D3118:218a-7	དེའི་ཕྱོགས་བཞིར་རི་མོ་གཉིས་པའི་པདམ་འདབ་མ་བཞི་པ་། ཤར་ལ་སོགས་པའི་རིམ་གྱི་རི་མོ་གཉིས་ཀྱི་མཚམས་སུ་སྔགས་། ཨཨོམ་བི་མ་ལེ་བི་བུ་ལེ་ཛ་ཡ་ཝ་རེ་ཨཨ་མྲི་ཏ་ཆེ་གེ་མོ་ཤའནཏིམ་པུཤཏིམ་རཀཤ་རཀཤ་ཀུ་རུ་ཧའུམ་ཧའུམ་ཕཏ་ཕཏ་སབ༹འ་ཧའ་། གཉིས་པ་ལ་། ཨཨོམ་ཨཨ་མྲི་ཏེ་བི་ལོ་ཀི་ནི་གརབྷ་སམ་རཀཤ་ནི་ཆེ་གེ་མོ་ཤའནཏིམ་པུཤཏིམ་རཀཤ་རཀཤ་ཀུ་རུ་ཧའུམ་ཧའུམ་ཕཏ་ཕཏ་སབ༹འ་ཧའ་།
T02mpvv_u:22	 caturvidikṣu catustriśūkavajrārdhagarbhe āgneyādikoṇakrameṇa mantraṃ likhet //  oṃ visphoṭavajriṇi dhārakasya rakṣāṃ kuru hūṃ 2 phaṭ 2 svāhā //  nairṛtye //  oṃ amṛtavare dhārakasya rakṣāṃ kuru hūṃ 2 phaṭ 2 svāhā //  vāyavye /	T02D3118:218a-12	གསུམ་པ་ལ་། ཨཨོམ་བྷའ་ར་བྷའ་ར་སམ་བྷའ་ར་ཨཻནདྲ་ཡ་བ་ལ་བི་ཤོ་དྷ་ནེ་ཆེ་གེ་མོ་ཤའནཏིམ་པུཤཏིམ་རཀཤ་རཀཤ་ཧའུམ་ཧའུམ་ཕཏ་ཕཏ་སབ༹འ་ཧའ་། བཞི་པ་ལ་། ཨཨོམ་ཨཨ་མྲི་ཏེ་དྷ་ར་ཝ་ར་བི་ཤུདདྷ་ཆེ་གེ་མོ་ཤའནཏིམ་པུཤཏིམ་རཀཤ་རཀཤ་ཀུ་རུ་ཧའུམ་ཧའུམ་ཕཏ་ཕཏ་སབ༹འ་ཧའ་། མཚམས་རྣམས་སུ་རྡོ་རྗེ་རྩེ་གསུམ་པ་བཞི་ལ་།
T02mpvv_u:3	 vibhūtyai sarvasattvānāṃ taccakraṃ likhyate mayā //	T02D3118:217b-4	སེམས་ཅན་ཀུན་ལ་བསྲུང་བའི་ཕྱིར་༎ དེ་ཡི་འཁོར་ལོ་བདག་གིས་བྲི་༎
T02mpvv_u:4	 śuciḥ samāhitaḥ san balyādikaṃ dattvā nirmuṣṭihastapramāṇāṃ bhūrjatvacaṃ vastraṃ vā samādāya prathamaṃ tāvac caturaṅgulapramāṇaṃ puṭam ekaṃ likhet //  tanmadhye 'rdhendubindubhūṣitaṃ hūṃkārāṣṭakaveṣṭitaṃ praiṃkāram /  tanmadhye mantram /  oṃ maṇidhari vajriṇi mahāpratisare dhārakasya rakṣaṃ śāntipuṣṭiṃ kuru hūṃ 2 phaṭ 2 svāhā //  tato bāhye 'rdhāṅgulapuṭadvayam //	T02D3118:217b-6	གཙང་ཞིང་ཤིན་ཏུ་མཉམ་པར་བཞག་པར་གྱུར་པས་། གཏོར་མ་ལ་སོགས་པ་བྱིན་ལ་། ཁུ་ཚུར་བཅས་པའི་ཁྲུ་གང་གི་ཚད་ཀྱི་རས་ལ་སོགས་པ་ལ་བྲི་བར་བྱ་བ་ནི་། དང་པོར་རེ་ཞིག་སོར་བཞི་པའི་ཚད་ཀྱི་རིམ་པ་གཅིག་བྱས་ལ་།
