src_segmentnr	src_original	tgt_segmentnr	tgt_original
T02nitkarpu:29	 dānaṃ gomayambunā ca sahitaṃ śīlaṃ ca sammārjanaṃ	T02D1820:259a-22	ཆུ་བཅས་ལྕི་བ་སྦྱིན་པ་སྟེ་༎ སྐྱང་ནུལ་བྱས་པ་ཚུལ་ཁྲིམས་ཡིན་༎
T02nitkarpu:30	 kṣāntiṃ kṣudrapipīlikāpanayanaṃ vīryaṃ kriyāsthāpanam /	T02D1820:259a-24	གྲོག་མ་སོགས་བསལ་བཟོད་ཡིན་ཏེ་༎ བྱ་བ་སྤྲོ་བ་བརྩོན་འགྲུས་སོ་༎
T02nitkarpu:31	 dhyānaṃ tatkṣaṇamekacittakaraṇaṃ prajñāsurekhojvalā	T02D1820:259a-26	སྐད་ཅིག་དེ་སེམས་རྩེ་གཅིག་པ་༎ བསམ་གཏན་ཡིན་ཏེ་རི་མོ་དག་། སྙོམས་པ་ཤེས་རབ་ཡིན་པར་གསུངས་༎
T02nitkarpu:32	 etāḥ pāramitā ṣaḍeva labhate kṛtvā munermaṇḍalam //	T02D1820:259a-28	མནདལ་བྱས་པས་ཕ་རོལ་ཕྱིན་དྲུག་བརྙེས་པར་འགྱུར་༎
T02nitkarpu:33	 bhavati kanakavarṇaḥ sarvarogaurvimuktaḥ  suramanujaviśiṣṭaścandravaddīptakāntiḥ /	T02D1820:259a-29	ལྷ་མི་ཁྱད་པར་ཅན་སྐྱེ་ཟླ་ལྟར་གཟི་འཕགས་ཤིང་༎ ནད་ཀུན་ལས་གྲོལ་གསེར་གྱི་མདོག་དང་འདྲ་བར་འགྱུར་༎
T02nitkarpu:35	 dhanakanakasamṛddhirjāyate rājavaṃśe	T02D1820:259a-31	རྒྱལ་རིགས་འབྲུ་དང་གསེར་སོགས་འབྱོར་པས་གང་བར་སྐྱེ་༎
