src_segmentnr	src_original	tgt_segmentnr	tgt_original
T03bsa050_u:111	 abhyāgate yācanake ca tena saṃbodhisaṃbhāravivṛddhihetau /	T04D3936:336a-10	སློང་བ་སྔོན་དུ་འོངས་ན་རྒྱལ་སྲས་དེས་༎ རྫོགས་པའི་བྱང་ཆུབ་ཚོགས་ནི་སྤེལ་བའི་ཕྱིར་༎
T03bsa050_u:112	 tatpreṣyasaṃjñātmani saṃniveśyā kalyāṇamitrapriyatā ca tasmin // Ps_1.55 //	T04D3936:336a-12	ལྟོས་པ་མེད་པར་ཡོངས་སུ་གཏང་བར་བྱ་༎
T03bsa050_u:120	 vāsaḥ sucittasya hi nāsti doṣairambhonidhānasya śavairyathaiva // Ps_1.59 //	T04D3936:336a-16	སེམས་མཆོག་དེ་ནི་སྐྱོན་དང་མ་འགྲོགས་ཏེ་༎ རྒྱ་མཚོ་ཆེན་པོ་རོ་དང་མི་འགྲོགས་བཞིན་༎
T03bsa050_u:121	 tasmāt tyaktvā sarvataḥ sarvadoṣān bodhiprārthī sarvadā sarvadaḥ syāt /	T04D3936:336a-18	དེ་བས་རྟག་ཏུ་སྐྱོན་རྣམས་ཀུན་སྤངས་ཏེ་༎ བྱང་ཆུབ་འདོད་པས་རྟག་ཏུ་ཐམས་ཅད་སྦྱིན་༎
T03bsa050_u:123	 mūlaṃ dānasyāsya saṃbodhicittaṃ tanna tyājyaṃ ditsatā dānamīdṛk /	T04D3936:336a-24	ཆོག་ཤེས་མེད་པར་དབུལ་པོར་གསུངས་༎ སྦྱིན་པ་དེ་ནི་བྱང་ཆུབ་རྩ་བ་སྟེ་༎
