src_segmentnr	src_original	tgt_segmentnr	tgt_original
T03bsa050_u:556	 garuḍadhvajarājadṛk kva cit kuha ciccaiva halāyudhadyutiḥ // Ps_5.62 //  sitaśaktiracintyaśaktimān kuha ciccāruśikhaṇḍivāhanaḥ /  udayāstanagendrabhūṣaṇaḥ śaśisūryāmalarūpavān kva cit // Ps_5.63 //  kuha cid dhutabhuṅmarutvatāṃ vapuṣānyatra narāśrayāśinām /  vāruṇadyutim udvahan kva cit kuha cinmanmathacāruvigrahaḥ // Ps_5.64 //	T04D3944:231a-18	ལ་ལར་ཆུ་ཡི་ལྷ་གཟུགས་དང་༎ ལ་ལར་འདོད་པའི་ལྷ་ལྟར་སྟོན་༎
T03bsa050_u:561	 lalitāṃ pramadānarākṛtiṃ naranārīratisaṃgalālasaḥ /	T04D3944:231a-19	ལ་ལར་བུད་མེད་གཟུགས་མཛེས་དང་༎ ལ་ལར་ཕོ་སྨོས་དགའ་བ་སྟོན་༎
T03bsa050_u:562	 kva cid eva tapodhanaśriyaṃ vidadhat kāmaviraktamānasaḥ // Ps_5.65 //	T04D3944:231a-20	ལ་ལར་བརྟུལ་ཞུགས་ནོར་ལྡན་ཏེ་༎ འདོད་ལས་འདོད་ཆགས་བྲལ་བ་སྟོན་༎
T03bsa050_u:563	 hṛdayāni harannṛṇāṃ kva cid guruśiṣyakṣitipālavṛttibhiḥ /	T04D3944:231a-22	ལ་ལར་མི་རྣམས་ཡིད་འཕྲོག་ཅིང་༎ སློབ་དཔོན་སློབ་མ་རྒྱལ་པོ་བྱེད་༎
T03bsa050_u:564	 narakeṣvapi ca parabhāvato vidadhadduḥkhavimokṣaṇakṣaṇam // Ps_5.66 //	T04D3944:231a-24	ལ་ལར་མཐུ་ཆེན་བྱིན་རླབས་ཀྱིས་༎ ངན་སོང་སྡུག་བསྔལ་རྣམ་མང་སེལ་༎
T03bsa050_u:565	 jagatām adhimuktivistarairatha so 'nekavidhairviceṣṭitaiḥ /  karuṇāguṇasaṃtatastataḥ kurute lokahitaṃ tatastataḥ // Ps_5.67 //	T04D3944:231a-26	འགྲོ་བའི་དད་པ་ཚུལ་བཞིན་དུ་༎ སྙིང་རྗེའི་ཡོན་ཏན་རྒྱ་ཆེ་བས་༎ འཇིག་རྟེན་ཕན་པ་གྲངས་མེད་བྱེད་༎
T03bsa050_u:567	 samavāpya viśeṣasaṃpadaṃ vipulāṃ dhyānaguṇaśrayādimām /	T04D3944:231a-30	བསམ་གཏན་འདི་འདྲའི་གནས་ཐོབ་ཅིང་༎ ཁྱད་པར་ཕུན་སུམ་ཚོགས་ཐོབ་པས་༎
T03bsa050_u:568	 prayateta viśeṣavattaraṃ nidhicihneṣvavisaṃvadatsviva // Ps_5.68 //	T04D3944:231a-32	གཏེར་གྱི་མཚན་མ་སླུ་མེད་བཞིན་༎ ཁྱད་པར་གོང་ནས་གོང་བརྩོན་བྱ་༎
T03bsa050_u:570	 prayateta vivṛddhaye tataḥ parihāṇistu viparyayādataḥ // Ps_5.69 //	T04D3944:231a-36	དགེ་བ་སྤེལ་ཕྱིར་བརྩོན་པར་བྱ་༎ དེ་ལས་བཟློག་པ་དམན་པར་འགྲོ་༎
T03bsa050_u:571	 sulabhaśca samādhirudyamād anurakṣā punarasya duṣkarā /	T04D3944:231a-38	ཏིང་འཛིན་རྩོམ་པ་མེད་པ་སྟེ་༎ རྗེས་སུ་བསྒྲུབ་པ་དཀོན་པས་ན་༎
T03bsa050_u:572	 sahasā vijigīṣuṇā yathā vijitasya praśamapratikriyā // Ps_5.70 //	T04D3944:231a-40	རྣམ་པར་རྒྱལ་བ་འདོད་རྣམས་ཀྱིས་༎ ཞི་བའི་གཉེན་པོ་ཚུགས་མེད་བསྟེན་༎
T03bsa050_u:574	 anavāpya mahīmivācalām acalāṃ bhūmimabhīradurgamām // Ps_5.71 //	T04D3944:231a-43	ས་ལྟར་མི་ག-ཡོ་བརྟན་པ་ཡི་༎ ས་མཆོག་མི་ག-ཡོ་མ་ཐོབ་ཏུ་༎ དེ་ལ་ཡིད་བརྟན་ག-ཡོ་མི་བྱ་༎
T03bsa050_u:575	 abhisaṃskṛta[mārgacāriṇaḥ] patanāntā hi samādhivistarāḥ /	T04D3944:231a-46	མངོན་པར་འདུས་བྱས་ལམ་བྱས་པ་༎ ཏིང་འཛིན་བསྒྲུབ་པའང་འཇིག་པར་འགྱུར་༎
T03bsa050_u:576	 ata uttamamārgabhāvanām avalambeta vikalpavarjanāt // Ps_5.72 //	T04D3944:231a-48	དེ་བས་རྣམ་རྟོག་རྣམ་སྤངས་ཏེ་༎ ༄༢༣༡བ་ལམ་གྱི་དམ་པ་བསྒོམ་པར་བྱ་༎
T03bsa050_u:577	 sucinityasukhātmakalpanaṃ kapaṭam saṃskṛtadambhasaṃbhavām /	T04D3944:231b-1	བདེ་གཙང་རྟག་པའི་རྣམ་རྟོག་དག་།འདུས་བྱས་སླུ་བའི་ཆོས་ཅན་དུ་༎
T03bsa050_u:579	 viśade 'pyupalambhasaṃbhave vrajati kleśaśaravyatām ataḥ /  vyatiyāti tu māragocaraṃ tamanarthaṃ praśamayya sarvathā // Ps_5.74 //	T04D3944:231b-4	དམིགས་པ་ཆུང་ཡང་བྱུང་གྱུར་ན་༎ ཉོན་མོངས་མདས་གཙག་གཞིར་ཡང་འགྱུར་༎ དེ་འདྲའི་གནོད་པ་ཀུན་བཅིལ་ན་༎ བདུད་ཀྱི་སྤྱོད་ཡུལ་འདས་པར་འགྱུར་༎
T03bsa050_u:581	 na hi niśrayadośaduṣito bhavati dhyānavidhirviśuddhaye /	T04D3944:231b-8	གནས་པའི་སྐྱོན་དང་ལྡན་གྱུར་ན་༎ བསམ་གཏན་རྣམ་དག་ཚུལ་མི་འགྱུར་༎
T03bsa050_u:582	 calatānugato hi niśrayaḥ sakhaṭuṅkastata eva kathyate // Ps_5.75 //  vyavahāravidhiprasiddhaye pratipattadbhavatīti kathyate /	T04D3944:231b-10	གནས་པའི་རྗེས་འབྲངས་ཉམས་པ་སྟེ་༎ དོང་སྐམ་བཅས་ཞེས་དེ་ཕྱིར་བརྗོད་༎ ཐ་སྙད་ཚུལ་དག་འགྲུབ་དོན་དུ་༎ དེ་ནི་འཇིག་རྟེན་ལམ་ཞེས་བྱ་༎
T03bsa050_u:584	 na hi kiṃ cid udeti kutra cit sadasatsaṃbhavayuktyasaṃbhavāt // Ps_5.76 //	T04D3944:231b-14	ཡོད་དང་མེད་བྱུང་གཏང་མེད་པས་༎ གང་ནའང་ཅི་ཡང་སྐྱེ་བ་མེད་༎
T03bsa050_u:585	 gaganena samānamānasastribhavādapyu atha vītaniśrayaḥ /	T04D3944:231b-16	ནམ་མཁའི་དབྱིངས་འདྲ་ཡིད་ལྡན་ན་༎ སྲིད་པ་གསུམ་གྱི་གནས་དང་བྲལ་༎
T03bsa050_u:586	 avikalpitadhīraceṣṭito vacanenāpratiyatnaśobhinā // Ps_5.77 //	T04D3944:231b-18	ཚུལ་འཆོས་བྲལ་བའི་སྤྱོད་བརྟན་ལ་༎ ཁ་གསག་མེད་པའི་ཚུལ་ལྡན་ན་༎
T03bsa050_u:587	 kurute sa ca laukikīṃ kriyāṃ jagadekāntahitānuvartinīm /	T04D3944:231b-20	འཇིག་རྟེན་སྤྱོད་པ་དེ་བྱེད་ཀྱང་༎ འགྲོ་བ་གཅིག་ཏུ་ཕན་པ་སྤྱོད་༎
T03bsa050_u:588	 na samādhibalācca hīyate vaśavartitvamavāpya cetasaḥ // Ps_5.78 //	T04D3944:231b-22	སེམས་ལ་དབང་གྱུར་ཐོབ་པས་ན་༎ ཏིང་འཛིན་སྟོབས་ལས་ཉམས་པ་མེད་༎
T03bsa050_u:590	 vivardhate ghanasamaye yathodadhiḥ saridvadhūsamupahṛtairnavāmbubhiḥ // Ps_5.79 //	T04D3944:231b-26	དབྱར་དུས་རྒྱ་མཚོ་ཆུ་ཀླུང་དག་། ཆུ་གསར་བྱུང་བས་སྐྱེ་ཞིང་འཕེལ་༎
T03bsa050_u:591	 // dhyānapāramitāsamāsaḥ //  6. prajñāpāramitāsamāsaḥ	T04D3944:231b-27	བསམ་གཏན་གྱི་ཕ་རོལ་ཏུ་ཕྱིན་པའི་ལེའུའོ་།
T03bsa050_u:593	 puṇyāni dānaprabhṛtīnyamūni prajñāsanāthānyadhikaṃ vibhānti /	T04D3944:231b-28	༎ ། སྦྱིན་ལ་སོགས་པའི་བསོད་ནམས་འདི་དག་ནི་༎ ཤེས་རབ་མགོན་བཅས་ལྷག་པར་མཐུ་ལྡན་འགྱུར་༎
T03bsa050_u:594	 hiraṇmayānīva vibhūṣaṇāni pratyuptaratnadyutibhāsvarāṇi // Ps_6.1 //	T04D3944:231b-30	གསེར་གྱི་རྒྱན་བཟངས་རྣམ་པ་སྣ་ཚོགས་ལ་༎ རིན་ཆེན་ཕྲ་བཀོད་འོད་ཀྱིས་གསལ་བ་བཞིན་༎
T03bsa050_u:595	 kriyāsu sāmarthyaguṇaṃ hi teṣāṃ prajñaiva vistāriṇamādadhāti /	T04D3944:231b-32	སོ་སོའི་དོན་ལ་དེ་དག་ཡོན་ཏན་མཐུ་༎ ཤེས་རབ་འདི་ཉིད་རྒྱ་ཆེན་སྒྲུབ་པར་བྱེད་༎
T03bsa050_u:596	 svārthapravṛttau viśadakramāṇāṃ yathā manaḥsaṃtatirindriyāṇāṃ // Ps_6.2 //	T04D3944:231b-34	དབང་པོ་རང་རང་ཡུལ་གྱི་བྱེ་བྲག་ལ་༎ མཐུ་ཞེན་ཡིད་ཀྱིས་གསལ་བར་བསྟན་པ་བཞིན་༎
T03bsa050_u:597	 kriyāsvayogyāni śarīrayantrāṇyāyurviyuktāni yathā na bhānti /	T04D3944:231b-36	ལུས་འདི་སྲོག་དང་བྲལ་ན་མཐུ་མེད་ཅིང་༎ རང་གི་དགོས་པ་བསྒྲུབ་པ་མི་མཛེས་པ་༎
T03bsa050_u:598	 tathaiva kāryāṇi na bhānti loke prajñāviyogena jadīkṛtāni // Ps_6.3 //	T04D3944:231b-38	དེ་བཞིན་ཤེས་རབ་མེད་པས་བློ་གྱུར་ན་༎ དོན་སྒྲུབ་འཇིག་རྟེན་དག་ན་མཛེས་པ་མེད་༎
T03bsa050_u:599	 śraddhādikānāmapi cendriyāṇāṃ prajñāgraṇī buddhirivendriyāṇām /	T04D3944:231b-40	དད་ལ་སོགས་པའི་དབང་པོའི་རྣམ་པ་ཡང་༎ དབང་པོ་གཞན་ལ་བློ་འཛིན་ཤེས་རབ་གཙོ་༎
T03bsa050_u:600	 guṇāguṇān vetti hi tatsanāthaḥ kleśakṣaye naipuṇametyataśca // Ps_6.4 //	T04D3944:231b-42	དེ་ཡི་མགོན་ལྡན་ཡོན་ཏན་སྐྱོན་ཤེས་པས་༎ ཉོན་མོངས་ཟད་པའི་ཚུལ་ལ་མཁས་པར་འགྱུར་༎
T03bsa050_u:601	 prajñāviyogāt phalalālasānāṃ naiva svatodānaviśuddhirasti /	T04D3944:231b-44	ཤེས་རབ་མེད་ན་འབྲས་བུ་དོན་གཉེར་ལ་༎ སྦྱིན་པ་དག་ཉིད་༄༢༣༢ཨ་༌་༎ རྣམ་པར་དག་མི་འགྱུར་༎
T03bsa050_u:602	 tyāgaṃ parārthaṃ hi vadanti dānaṃ śeṣastu vṛddhyārthamiva prayogaḥ // Ps_6.5 //	T04D3944:232a-2	གཞན་དོན་བཏང་བ་སྦྱིན་པའི་མཆོག་ཅེས་གསུངས་༎ ལྷག་མ་ནོར་སྤེལ་དོན་གྱི་སྦྱོར་བ་ཡིན་༎
T03bsa050_u:603	 prajñāsamunmīlitacakṣuṣastu dattvā svamāṃsānyapi bodhisattvāḥ /	T04D3944:232a-4	ཤེས་རབ་མི་གསལ་རྣམ་པར་བྱིང་གྱུར་ན་༎ བྱང་ཆུབ་སེམས་དཔས་རང་གི་ཤ་བྱིན་ན་༎
T03bsa050_u:604	 naivonnatiṃ nāvanatiṃ prayānti bhaiṣajyavṛkṣā iva nirviklapāḥ // Ps_6.6 //	T04D3944:232a-6	སྨན་གྱི་ཤིང་ལྟར་རྣམ་པར་མི་རྟོག་པར་༎ མཐོའམ་དམའ་བར་འགྱུར་བ་དེ་ལ་མེད་༎
T03bsa050_u:605	 evaṃ sa bhūmiṃ prathamāmupaiti lokottarasyārthavidhipratiṣṭhām /	T04D3944:232a-8	དེ་བས་འཇིག་རྟེན་འདས་པ་དོན་གྱི་གཞི་༎
T03bsa050_u:606	 akrodhanaḥ prītisamṛddhacetā dānairmahadbhirjagadarthacetāḥ // Ps_6.7 //	T04D3944:232a-9	ཁྲོ་མེད་དགའ་བས་ཕུན་སུམ་ཚོགས་པའི་སེམས་༎ སྦྱིན་པ་ཆེན་པོས་འགྲོ་དོན་བསྒྲུབ་མོས་པ་༎
T03bsa050_u:607	 prāyeṇa yasyāṃ balacakravartī bhavatyasaṃhāryamatiśca bodheḥ /	T04D3944:232a-11	རྒྱལ་སྲས་ས་ཡི་དང་པོ་འཐོབ་པར་འགྱུར་༎ དེ་ལ་གནས་པ་ཕལ་ཆེར་བྱང་ཆུབ་ཏུ་༎ མི་འཕྲོགས་བློ་འཆང་འཁོར་ལོས་སྒྱུར་བར་འགྱུར་༎
T03bsa050_u:608	 prajñāguṇādeśitasatpatho 'tha karmeṇa bhūmiṃ vimalāmupaiti // Ps_6.8 //	T04D3944:232a-14	ཤེས་རབ་མཐུས་བསྟན་ལམ་མཆོག་བདེ་བ་དེས་༎ རིམ་གྱིས་དྲི་མེད་རྒྱལ་སྲས་ས་ཡང་ཐོབ་༎
T03bsa050_u:609	 yasyāṃ prakṛtyaiva viśuddhaśīlaścaturmahādvīpapatiḥ sa bhūtvā /	T04D3944:232a-16	དེ་ནས་རང་བཞིན་རྣམ་དག་ཚུལ་འཆང་ཞིང་༎ གླིང་བཞི་འཁོར་ལོས་སྒྱུར་བར་དེ་འགྱུར་ཏེ་༎
T03bsa050_u:61	 duḥkhāpagāyāmatiśīghragāyāṃ magnasya lokasya kathaṃ na dadyām /	T04D3944:220a-20	འཇིག་རྟེན་དོན་ཆེན་བསྒྲུབ་པར་བརྩོན་པ་དེ་༎ རྟོག་པ་མེད་པར་རྐང་པ་ཡོངས་སུ་གཏོང་༎ སྡུག་བསྔལ་རྒྱ་མཚོར་སྐྱེ་ཤིའི་ཆུས་ག-ཡེངས་པའི་༎
T03bsa050_u:610	 narendracūḍāmaṇisatkṛtājñaḥ sūryārhatāmeti yathā munīndraḥ // Ps_6.9 //	T04D3944:232a-18	རྒྱལ་པོ་ཀུན་གྱི་སྤྱི་བོས་བཀའ་བླང་ཞིང་༎ ཐུབ་དབང་རྒྱལ་བ་བཞིན་དུ་མཆོད་པར་འགྱུར་༎
T03bsa050_u:611	 tataḥ paraṃ kāmiṣu daivateṣu loke 'pi ca dvitrisahasrasaṃkhye /	T04D3944:232a-20	དེ་དག་ཡན་ཆད་འདོད་པའི་ལྷ་རིས་དང་༎ འཇིག་རྟེན་བྱུར་བུ་སྟོང་གཉིས་སྟོང་གསུམ་གྱི་༎
T03bsa050_u:612	 aiśvaryamāpnoti tataḥ paraṃ ca bhūmiṃ viśodhya prabhavāṃ prabhāyāḥ // Ps_6.10 //	T04D3944:232a-21	དབང་ཕྱུག་ཐོབ་འགྱུར་དེ་དག་ཡན་ཆད་དུ་༎ ཤེས་རབ་འོད་ཀྱིས་རྒྱུ་རྣམས་སྦྱངས་པས་འཐོབ་༎
T03bsa050_u:613	 śīlasya śuddhiḥ kuta eva tasya yaḥ prajñayā nāpahṛtāndhakāraḥ /	T04D3944:232a-23	ཤེས་རབ་སྣང་བས་མུན་པ་མ་བསལ་ན་༎ ཚུལ་ཁྲིམས་དག་དང་ལྡན་པར་དེ་མི་འགྱུར་༎
T03bsa050_u:614	 prāyeṇa śīlāni hi tadviyogād āmarṣadoṣaiḥ kaluṣīkriyante // Ps_6.11 //	T04D3944:232a-25	ཕལ་ཆེར་ཤེས་རབ་མེད་པས་ཚུལ་ཁྲིམས་དག་། ཤེས་པའི་སྐྱོན་གྱིས་ཉོན་མོངས་རྙོག་བཅས་འགྱུར་༎
T03bsa050_u:615	 nātmārthamapyasti tu yasya śīlaṃ prājñasya tasyāsti kathaṃ parārtham /  yo dṛṣṭadoṣo bhavabandhanānāṃ lokān samastāṃstata ujjihīrṣuḥ // Ps_6.12 //	T04D3944:232a-26	རང་གི་དོན་དུ་ཚུལ་ཁྲིམས་མི་བསྒྲུབ་ན་༎ བློ་ལྡན་སྲིད་པའི་བཙོན་རའི་སྐྱོན་མཐོང་ཞིང་༎ དེ་ནས་འཇིག་རྟེན་མ་ལུས་གདོན་མོས་པ་༎ སྲིད་པའི་དོན་དུ་མི་སྒྲུབ་སྨོས་ཅི་དགོས་༎
T03bsa050_u:617	 prajñāvipakṣairhṛdi soparāge kṣamāguṇaḥ kena dhṛtiṃ labheta /	T04D3944:232a-30	ཤེས་རབ་ལོག་པའི་སྐྱོན་གྱིས་སེམས་རྙོག་ན་༎ བཟོད་པའི་ཡོན་ཏན་དེ་ལ་གནས་ཅི་སྨོས་༎
T03bsa050_u:619	 prajñānvitānāṃ tu parāpakārāḥ kṣamāguṇāḥ sthairyakarā bhavanti /	T04D3944:232a-34	ཤེས་རབ་ལྡན་པ་རྣམས་ལ་གནོད་པ་དག་། བཟོད་པའི་ཡོན་ཏན་ཡོད་པས་གནོད་མི་འགྱུར་༎
T03bsa050_u:62	 saddharmahastāniti saṃpradatte hastānvikoṣāmburuhaprakāśān // Ps_1.30 //	T04D3944:220a-23	འཇིག་རྟེན་ཆོས་ཀྱི་ལག་པས་བསྐྱབ་པོ་ཞེས་༎ ལག་པ་པདམ་རྒྱས་འདྲ་གཏོང་བར་བྱེད་༎
T03bsa050_u:620	 bhadrātmakānāmiva vāraṇānāṃ karamāśrayā naikavidhā viṣeṣāḥ // Ps_6.14 //	T04D3944:232a-35	ཤིན་ཏུ་དུལ་བའི་གླང་པོ་མཆོག་རྣམས་ལ་༎ ལས་ཀྱི་ཁྱད་པར་རྣམ་མང་བཟོད་པ་བཞིན་༎
T03bsa050_u:621	 niṣkevalaṃ vīryamapi śramāya prajñāsanāthasya tu tasya kārye /  anuttaraḥ siddhiguṇo 'bhyudeti hartā tadutthasya pariśramasya // Ps_6.15 //	T04D3944:232a-37	བརྩོན་འགྲུས་གཅིག་པུ་བྱས་པ་ངལ་བའི་མཐའ་༎ ཤེས་རབ་གྲོགས་ཀྱིས་བསྟངས་ན་དོན་ཆེན་འགྲུབ་༎ བསྒྲུབས་བྱས་རྗེས་ལ་དེ་ཡི་ཡོན་ཏན་འཐོབ་༎ དེ་ལས་བྱུང་༄༢༣༢བ་བའི་དུབ་པ་ཡོངས་སུ་སེལ་༎
T03bsa050_u:623	 yasmāt paraṃ sūkṣamataraṃ na kiṃ cid yannaipuṇānāṃ paramaḥ prakarṣaḥ /	T04D3944:232b-1	མཁས་པ་རྣམས་ལ་ཕུལ་དུ་བསྔགས་འགྱུར་ཞིང་༎ དེ་ལས་ཕྲ་ཞིང་ཟབ་པ་གཞན་མེད་པས་༎
T03bsa050_u:624	 yatkāmadoṣādibhirāvṛtānāṃ manaḥpathaṃ naiva kadā cideti // Ps_6.16 //	T04D3944:232b-3	འདོད་པའི་སྐྱོན་གྱིས་ཡོངས་སུ་མ་བསྒྲིབས་པའི་༎ ཡིད་ལམ་དྲང་པོར་ཤེས་རབ་མེད་མི་འགྱུར་༎
T03bsa050_u:625	 tad dhyānamekāntasukhābhirāmaṃ kathaṃ pravekṣyantyastāṃ manāṃsi /	T04D3944:232b-5	དེ་འདྲའི་བསམ་གཏན་བདེ་དགའ་མཆོག་ལྡན་པ་༎
T03bsa050_u:626	 sthūlāni doṣopacayairmahadbhiḥ prajñotpathaṃ nyāyamivāśritānī // Ps_6.17 //	T04D3944:232b-6	སྐྱོན་བསགས་ཉེས་པ་ཆེན་པོ་གྲགས་གྱུར་པའི་༎ ལམ་གོལ་རིགས་པའི་ཚུལ་ལས་བརྟེན་པ་ནི་༎
T03bsa050_u:627	 prajñānirudyogamaterhi dṛṣṭirnāyāti śuddhiṃ tadṛte na śīlam /	T04D3944:232b-9	ཤེས་རབ་ཚུལ་ལ་བརྩོན་མེད་བློ་འཆང་ན་༎ དེ་ཡི་ལྟ་བ་ཡོངས་སུ་དག་མི་འགྱུར་༎ དེ་མེད་ཚུལ་ཁྲིམས་མི་འདག་དེ་མེད་པས་༎
T03bsa050_u:628	 samyakasmādhis tadṛte na labhyo duḥkhakṣayastadvirahāttathaiva // Ps_6.18 //	T04D3944:232b-12	ཏིང་འཛིན་མི་འཐོབ་སྡུག་བསྔལ་ཟད་མི་འགྱུར་༎
T03bsa050_u:629	 prājñastu doṣādbhayamīkṣamāṇaḥ sukhānubaddhaṃ ca sukhaṃ guṇebhyaḥ /	T04D3944:232b-13	ཤེས་རབ་ལྡན་པས་སྐྱོན་ལས་བག་བྱེད་ཅིང་༎ ཡོན་ཏན་ཚོགས་ལས་རྒྱུན་དུ་བདེ་ཐོབ་པས་༎
T03bsa050_u:63	 śraddhendriyādipratipūraṇārthaṃ sa karṇanāsādi dadātyakhinnaḥ /	T04D3944:220a-25	དབང་པོ་ལྔ་དག་རྫོགས་པར་བྱ་བའི་ཕྱིར་༎ སྣ་དང་རྣ་བ་སྐྱོན་མེད་ཡོངས་སུ་གཏོང་༎
T03bsa050_u:631	 samudyatastena samādhimetya prāpnoti vākkāyamanoviśuddhīḥ /	T04D3944:232b-16	ཡོན་ཏན་ཚོགས་ཀྱི་བདེ་བའི་ལམ་དུ་འཇུག་། ཡང་དག་རྟོགས་པས་ཏིང་འཛིན་འཐོབ་པར་འགྱུར་༎ ངག་ཡིད་ལུས་རྣམས་རྣམ་པར་དག་པ་འགྲུབ་༎
T03bsa050_u:632	 ato 'navadyena balena yuktaḥ pravartate lokahitodayeṣu // Ps_6.20 //	T04D3944:232b-18	དེ་ཕྱིར་སྐྱོན་མེད་མཐུ་དང་ལྡན་གྱུར་པ་༎ འཇིག་རྟེན་ཕན་པ་ཕུན་སུམ་ཚོགས་ལ་འཇུག་། སྦྱིན་པས་ཅི་འདོད་ཡིད་བཞིན་སྒྲུབ་པ་བྱེད་༎
T03bsa050_u:633	 dānena cābhīpsitabhūyasaiva priyairadīnairvacanāmṛtaiśca /	T04D3944:232b-20	ཚིག་སྙན་བདུད་རྩི་ཤིན་ཏུ་གསལ་བ་དང་༎ རྒྱུ་མེད་མཐུ་དང་ལྡན་པའི་སྡོམ་པ་ཡིས་༎
T03bsa050_u:634	 naiṣkāraṇorjasvalayā ca vṛttyā parārthacaryāsu samaṃ samantāt // Ps_6.21 //	T04D3944:232b-21	གཞན་གྱི་དོན་ལ་མཉམ་པར་ཀུན་དུ་སྤྱོད་༎
T03bsa050_u:635	 sāmānyamartheṣu ca darśayitvā premṇā vaśīkṛtya manāṃsi teṣām /	T04D3944:232b-22	དོན་ལ་ཐུན་མོང་ཡང་དག་བསྟན་བྱས་ཤིང་༎ བྱམས་པས་དེ་དག་ཡིད་ནི་དབང་བསྐུར་ཏེ་༎
T03bsa050_u:636	 karoti nirvāṇasukhe pratiṣṭhāṃ prajñāguṇāvyāhatadharmacakraḥ // Ps_6.22 //	T04D3944:232b-24	ཤེས་རབ་སྟོབས་ཀྱིས་འཁོར་ལོ་ཐོགས་མེད་དེ་༎ མྱ་ངན་འདས་བའི་བདེ་ལ་འགོད་པར་བྱེད་༎
T03bsa050_u:638	 ajīvikādurgatimṛtyunindāśāradyadoṣāśrayaṇī bhayārtiḥ // Ps_6.23 //	T04D3944:232b-27	བྱིན་གྱིས་བརླབས་ཤིང་ཡོངས་སུ་བསྲུངས་པས་ན་༎ མཚོ་མེད་ངན་འགྲོ་འཆི་དང་སྨད་པ་དང་༎ དོགས་པའི་སྟོབས་ཀྱིས་འཇིགས་པ་ཉེར་མི་འོང་༎
T03bsa050_u:639	 bhayāni sarvāṇi hi doṣajāni prajñā na doṣaiḥ sahavāsameti /	T04D3944:232b-29	འཇིགས་པ་ཐམས་ཅད་སྐྱོན་ལས་བྱུང་བ་སྟེ་༎ ཤེས་རབ་སྐྱོན་དང་ལྷན་ཅིག་མི་འགྲོགས་པས་༎
T03bsa050_u:64	 cakṣuśca cakṣurvimalīkariṣyaṃllokasya sarvāvaraṇaprahāṇāt // Ps_1.31 //	T04D3944:220a-27	འཇིག་རྟེན་ཐམས་ཅད་སྒྲིབ་པ་ཀུན་སྤངས་ཏེ་༎ རྣམ་དག་མིག་ལྡན་བསྒྲུབ་ཕྱིར་མིག་ཀྱང་གཏོང་༎
T03bsa050_u:640	 śaradvyapoḍhābhragavākṣapakṣā bhā bhāskarasyeva tamaḥpratānaiḥ // Ps_6.24 //  sahasraraśmerudaye 'pi yāni tamāṃsi rundhanti jagadgatāni /	T04D3944:232b-31	སྟོན་གྱི་ནམ་མཁའི་སྤྲིན་ཚོགས་མེད་པ་ལ་༎ ཉི་འོད་གསལ་བ་མུན་དང་མི་འགྲོགས་བཞིན་༎ ཉི་མ་འོད་ཆེན་ཤར་བར་གྱུར་བཞིན་དུ་༎ འགྲོ་བའི་རྒྱུད་རྣམས་མུན་ནག་གང་འགེབས་པ་༎
T03bsa050_u:642	 nāmaikaśeṣāṇi karoti tāni prajñāprabhāyāḥ prasaraprabhāvaḥ // Ps_6.25 //	T04D3944:232b-35	ཤེས་རབ་འོད་ཀྱི་མཐུ་ཆེན་འབྱུང་བས་ན་༎ ཐམས་ཅད་གསལ་༄༢༣༣ཨ་༌་༎ འགྱུར་མིང་ཙམ་འབའ་ཞིག་ལུས་༎
T03bsa050_u:643	 na tatra bhūyaḥ karaṇīyam asti yatra prabhā sā balatāmupaiti /	T04D3944:233a-2	གང་ལ་ཤེས་རབ་འོད་ཆེན་ཤར་གྱུར་པ་༎ དེ་ལ་བྱ་བའི་ལྷག་མ་ལས་པ་མེད་༎
