src_segmentnr	src_original	tgt_segmentnr	tgt_original
T03D3799:251b-15	། རྣམ་པར་ཐར་པ་དང་ཞེས་པ་ནི་ནང་གཟུགས་སུ་འདུས་ཤེས་པས་ཕྱི་རོལ་གྱི་གཟུགས་སུ་ལྟ་བ་ནི་གཅིག་གོ་༎	T07n772_012:99	 ālaṃbanaṃpaśyan parivartayati cittaṃ prāpnoti vimuktimiti vimokṣaḥ |  paśyatyadhyātmarūpamaśuci,  paśyati ca bahirdhārūpaṃ (na tathā)
T03D3799:251b-16	ནང་གཟུགས་ཀྱི་མཚན་མ་མེད་པ་ལ་ཕྱིའི་གཟུགས་སུ་ལྟ་བ་ནི་གཉིས་པའོ་༎	T07n772_012:103	 na paśyatyadhyātmarūpaṃ,  paśyati bahirdhārūpamaśuci - iti dvitīyo vimokṣaḥ |
T03D3799:252a-0	༄༢༥༢ཨ་༌་༎ གཟུགས་མེད་པ་བཞི་རྣམས་དང་། འདུ་ཤེས་དང་ཚོར་བ་འགོག་པ་སྟེ་རྣམ་པར་ཐར་པ་བརྒྱད་དོ་༎	T07n772_012:106	 catvāryarūpadhyānāni catvāro vimokṣāḥ |  nirodhaḥ (aṣṭamo)vimokṣaḥ ||
T03D3799:252a-11	ནང་གི་གཟུགས་ལ་གཟུགས་མེད་པར་འདུ་ཤེས་ཤིང་ཕྱིའི་གཟུགས་ཅན་ལ་རྒྱས་པར་ལྟ་བ་སྟེ་ཟིལ་གྱིས་གནོན་པར་ཤེས་པ་ནི་བཞི་པའོ་༎	T07n772_012:114	 adhyātmamarūpasaṃjñī bahirdhāpaśyati rūpāṇi apramāṇāni suvarṇāni durvarṇāni |  ityālaṃbanamabhibhūya jānāti paśyatīti caturthamamabhibhvāyatanaṃ |
T03D3799:252a-12	ནང་གི་གཟུགས་ལ་མཚན་མར་འདུ་ཤེས་ཤིང་ཕྱིའི་གཟུགས་ལ་སྔོན་པོར་ལྟ་བ་ནི་ལྔ་པའོ་༏	T07n772_012:116	 adhyātmamarūpasaṃjñī bahirdhā paśyati rūpāṇi nīlāni |
T03D3799:252a-6	ནང་གི་གཟུགས་ལ་མཚན་མར་འདུ་ཤེས་ཤིང་ཕྱིའི་གཟུགས་ལ་ནི་བསྡུས་པའི་ང་རྒྱལ་ཅན་དུ་ལྟ་བ་སྟེ་།	T07n772_012:110	 adhyātmaṃ rūpasaṃjñī bahirdhā paśyati rūpāṇi apramāṇāni suvarṇāni durvarṇāni |
T03D3799:252a-7	དེ་ཟིལ་གྱིས་གནོན་པར་ཤེས་པ་ནི་ཕྱི་སྟེ་གཅིག་གོ་༎	T07n772_012:111	 ityālaṃbanamabhibhūmaya jānāti paśyatīti dvitīyamabhibhvāyatanaṃ |
T03D3799:252a-8	ནང་གི་གཟུགས་ལ་མཚན་མར་འདུ་ཤེས་ཤིང་ཕྱིའི་གཟུགས་ཅན་ལ་རྒྱས་པར་ལྟ་བ་སྟེ་། དེ་ཟིལ་གྱིས་གནོན་པར་ཤེས་པ་ནི་གཉིས་པའོ་༎ ནང་གི་གཟུགས་ནི་གཟུགས་མེད་པར་འདུ་ཤེས་ལ་ཕྱིའི་གཟུགས་ལ་བསྡུས་ནས་ལྟ་བ་དེ་ཟིལ་གྱིས་གནོན་པར་ཤེས་པ་ནི་གསུམ་པའོ་༎	T07n772_012:112	 adhyātmamarūpasaṃjñī bahirdhā paśyati rūpāṇi parittāni suvarṇāni durvarṇāni |  ityālaṃbanamabhibhūmaya jānāti paśyatīti tṛtīyamabhibhvāyatanaṃ |
