src_segmentnr	src_original	tgt_segmentnr	tgt_original
T04bsa047_u:529	 paramāṇūṃśca bhāgaśaḥ pratyavekṣa- māṇo yogī tān arthānna samanupaśyati /	T04D3915:33a-29	རྡུལ་ཕྲ་རབ་རྣམས་ཀྱང་ཆ་ཤས་ཀྱིས་སོ་སོར་བརྟགས་ན་རྣལ་འབྱོར་པས་དོན་དེ་དག་མི་མཐོང་ངོ་༎
T04bsa047_u:53	 atra ye caurādayo 'ṅgacchedaśūlārpaṇodbandhanādibhiḥ kāryanta eva teṣāṃ nārakameva duḥkham /  ye ca dāridrayadyupahatāsteṣāṃ pretānāmiva tatkṣuttarṣāḍibhirduḥkham /	T04D3915:23a-9	འདི་ན་རྐུན་པོ་ལ་སོགས་པ་གང་དག་ཡན་ལག་གཏུབ་པ་དང་། གསལ་ཤིང་ལ་སྐྱོན་པ་དང་། དབྱངས་ཏེ་བཏགས་པ་ལ་སོགས་པས་ཉོན་མོངས་པ་དེ་དག་ནི་སེམས་ཅན་དམྱལ་བའི་སྡུག་བསྔལ་ཁོ་ན་ཡིན་ནོ་༎ གང་དག་དབུ་ལ་ཞིང་ཕོངས་པ་དེ་དག་ནི་ཡི་དགས་དང་འདྲ་བར་བཀྲེས་ཤིང་སྐོམ་པ་ལ་སོགས་པས་སྡུག་བསྔལ་ལོ་༎
T04bsa047_u:530	 tasyāsamanupaśyata evaṃ bhavati cittamātramevaitat sarvaṃ na punarbāhyo 'rthā vipadyate / tadevam-	T04D3915:33a-30	དེས་དེ་དག་མ་མཐོང་བས་འདི་སྙམ་དུ་འདི་དག་ཐམས་ཅད་ནི་སེམས་ཙམ་སྟེ་ཕྱི་རོལ་གྱི་དོན་མེད་དོ་སྙམ་དུ་སེམས་སོ་༎
T04bsa047_u:531	 (Bhk 186)  “cittamātraṃ samāruhya bāhyamarthaṃ na kalpayet / “	T04D3915:33a-31	འདི་ལྟར་། སེམས་ཙམ་ལ་ནི་རབ་བརྟེན་ནས་༎ ཕྱི་རོལ་དོན་ལ་མི་བརྟག་གོ་༎
T04bsa047_u:533	 rūpidharmavikalpāṃstyajed ityarthaḥ /	T04D3915:33a-33	ཞེས་དེ་སྐད་འབྱུང་བ་ནི་ཆོས་གཟུགས་ཅན་ལ་རྣམ་པར་རྟོག་པ་སྤོང་བའོ་ཞེས་བྱ་བའི་ཐ་ཚིག་གོ་༎
T04bsa047_u:534	 teṣām upalabdhilakṣaṇaprāptānāṃ vicārayed anupalabdheḥ /	T04D3915:33a-34	དམིགས་སུ་རུང་བའི་མཚན་ཉིད་དུ་གྱུར་པ་དེ་དག་རྣམ་པར་དཔྱད་ན་མི་དམིགས་པའི་ཕྱིར་རོ་༎
T04bsa047_u:535	 evaṃ rūpiṇo dharmān vibhāvyārupiṇo vibhāvayet /	T04D3915:33b-0	༄༣༣བ་དེ་ལྟར་ཆོས་གཟུགས་ཅན་རྣམས་རྣམ་པར་བཤིག་ནས་གཟུགས་ཅན་མ་ཡིན་པ་རྣམ་པར་བཤིག་པར་བྱ་སྟེ་།
T04bsa047_u:536	 tatra yaccittamātraṃ tadapyasati grāhye grāhako na yukto grāhakasya grāhyapekṣatvad tataścittaṃ grāhyagrāhakaviviktam advayameva cittamiti vicārayed	T04D3915:33b-1	དེ་ལ་སེམས་ཙམ་གང་ཡིན་པ་དེ་ཡང་གཟུང་བ་མེད་ན་འཛིན་པར་མི་རུང་སྟེ་། འཛིན་པ་ནི་གཟུང་བ་ལ་ལྟོས་པའི་ཕྱིར་རོ་༎ དེ་ལྟ་བས་ན་སེམས་ན་གཟུང་བ་དང་འཛིན་པ་ལས་དབེན་ཞིང་གཉིས་སུ་མེད་པ་ཁོ་ན་ཡིན་པར་རྣམ་པར་དཔྱད་ནས་གཉིས་སུ་མེད་པའི་མཚན་ཉིད་།
T04bsa047_u:537	 “tathatālambane sthitvā tadapi cittamātram atikramet / “	T04D3915:33b-4	དེ་བཞིན་ཉིད་ཀྱི་དམིགས་གནས་ནས་༎ སེམས་ཙམ་ལས་ཀྱང་བཟླ་བར་བྱ་༎
T04bsa047_u:538	 grahakamākāramatikrameta /	T04D3915:33b-6	འཛིན་པའི་རྣམ་པ་ལས་ཤིན་ཏུ་བཟླ་བར་བྱ་སྟེ་།
T04bsa047_u:539	 dvayanirābhāsa eva advayajñāne tiṣṭhedityarthaḥ /	T04D3915:33b-7	གཉིས་སུ་སྣང་བ་མེད་པ་གཉིས་མེད་པའི་ཤེས་པ་ལ་གནས་པར་བྱ་ཞེས་བྱ་བའི་ཐ་ཚིག་གོ་༎
T04bsa047_u:540	 evaṃ cittamātramatikramya tadapi dvayanirābhasaṃ yajjñānaṃ tadatikrameta /	T04D3915:33b-8	དེ་ལྟར་སེམས་ཙམ་ལ་བཟླས་ནས་གཉིས་སྣང་བ་མེད་པའི་ཤེས་པ་ལས་ཀྱང་བཟླ་བར་བྱ་སྟེ་།
T04bsa047_u:541	 svataḥ parato bhāvānāṃ janmānupapatteḥ grāhyagrāhakayoścālīkatve tadavyatirekāt tasyāpi satyatvamayuktamiti vicārayet /  tatrāpyadvayajñāne vastutvābhiniveśaṃ tyajet,	T04D3915:33b-9	བདག་དང་གཞན་ལས་དངོས་པོ་རྣམས་སྐྱེ་བ་མི་འཐད་པའི་ཕྱིར་གཟུང་བ་དང་འཛིན་པ་བརྫུན་པ་ཁོ་ན་ཡིན་ལ་། དེ་དག་ལས་དེ་ཡང་གུད་ན་མེད་པའི་ཕྱིར་དེ་ཡང་བདེན་པ་ཉིད་མ་ཡིན་པར་བརྟགས་ལ་གཉིས་མེད་པའི་ཤེས་པ་དེ་ལ་ཡང་དངོས་པོར་མངོན་པར་ཞེན་པ་དོར་བར་བྱ་སྟེ་།
T04bsa047_u:543	 advayajñānanirābhāsa eva jñāne tiṣṭhedityarthaḥ /	T04D3915:33b-11	གཉིས་མེད་པའི་ཤེས་པ་སྣང་བ་མེད་པའི་ཤེས་པ་ཁོ་ན་ལ་གནས་པར་བྱ་ཞེས་བྱ་བའི་ཐ་ཚིག་གོ་༎
T04bsa047_u:544	 evaṃ sati sarvadharmaniḥsvabhāvatāpratipattau sthito bhavati /	T04D3915:33b-12	དེ་ལྟར་ན་ཆོས་ཐམས་ཅད་ལ་ངོ་བོ་ཉིད་མེད་པར་རྟོགས་པ་ལ་གནས་པ་ཡིན་ནོ་༎
T04bsa047_u:545	 tatra sthitasya paramatattvapraveśāt nirvikalpasamādhipraveśaḥ /	T04D3915:33b-13	དེ་ལ་གནས་པས་ཡང་དག་པ་ཉིད་ཀྱི་མཆོག་ལ་ཞུགས་པས་རྣམ་པར་མི་རྟོག་པའི་ཏིང་ངེ་འཛིན་ལ་ཞུགས་པ་ཡིན་ནོ་༎
T04bsa047_u:546	 tathā cādvayajñānanirābhāse jñāne yadā sthito yogī tadā paramatattve sthitatvāt,	T04D3915:33b-14	དེ་ལྟར་རྣལ་འབྱོར་པ་གང་གི་ཚེ་གཉིས་མེད་པའི་ཤེས་པ་སྣང་བ་མེད་པའི་ཤེས་པ་ལ་གནས་པར་གྱུར་པ་དེའི་ཚེ་།
T04bsa047_u:547	 mahāyānaṃ sa paśyati /	T04D3915:33b-15	མཐོང་བའི་ལམ་ལ་གནས་པས་ཐེག་པ་ཆེན་པོ་མཐོང་ངོ་༎
T04bsa047_u:548	 etadeva tat mahāyānam ucyate yat paramatattvadarśanam /	T04D3915:33b-16	དེ་ཁོ་ན་དམ་པ་མཐོང་བ་གང་ཡིན་པ་དེ་ཉིད་ཐེག་པ་ཆེན་པོ་ཞེས་བྱའོ་༎
T04bsa047_u:549	 etadeva tat paramatattvadarśanaṃ yat sarvadharmān prajñācakṣuṣā nirūpayataḥ samyagjñānāvaloke satyadarśanam /	T04D3915:33b-17	དེ་ཁོ་ན་དམ་པ་མཐོང་བ་དེ་ནི་ཆོས་ཐམས་ཅད་ཤེས་རབ་ཀྱི་མིག་གིས་བརྟགས་ཏེ་ཡང་དག་པའི་ཡེ་ཤེས་ཀྱི་སྣང་བ་ཤར་ན་ཅི་ཡང་མཐོང་བ་མེད་པ་གང་ཡིན་པའོ་༎
T04bsa047_u:55	 ye ca bhṛtyādayaḥ parāyattīkṛtātmabhāvāḥ,  ye ca balibhirākramya pīḍayante teṣāṃ tiraścāmiva tāḍanāvarodhanādi duḥkham /	T04D3915:23a-11	བྲན་ལ་སོགས་པ་གང་དག་གཞན་གྱིས་ལུས་ལ་དབང་བྱས་པ་དང་། གང་དག་མཐུས་མནན་ཏེ་གནོད་པར་བྱེད་པ་དེ་དག་ནི་དུད་འགྲོ་དང་འདྲ་བར་བརྡེག་པ་དང་༏་གདགས་པ་ལ་སོགས་པས་སྡུག་བསྔལ་ལོ་༎
T04bsa047_u:550	 tathā coktaṃ sutre- “katamaṃ paramārthadarśanam?	T04D3915:33b-18	དེ་སྐད་མདོ་ལས་ཀྱང་གསུངས་ཏེ་། དོན་དམ་པ་མཐོང་བ་གང་ཞེ་ན་།
T04bsa047_u:551	 sarvadharmāṇām adarśanam /” iti /	T04D3915:33b-20	ཆོས་ཐམས་ཅད་མཐོང་བ་མེད་པ་གང་ཡིན་པའོ་ཞེས་འབྱུང་ངོ་༎
T04bsa047_u:552	 atredṛśamevādarśanamabhipretaṃ na tu nimīlitākṣajātyandhānāmiva pratyayavaikalyād amanasikārato vā yadadarśanam /	T04D3915:33b-21	འདིར་དེ་ལྟ་བུའི་མཐོང་བ་མེད་པ་ལ་དགོངས་ཏེ་། མི་མཐོང་བ་ཞེས་བཀའ་སྩལ་གྱི་མིག་བཙུམས་པ་དང་། དམུས་ལོང་ལ་སོགས་པ་ལྟ་བུ་རྐྱེན་མ་ཚང་བ་དང་། ཡིད་ལ་མི་བྱེད་པས་མི་མཐོང་བ་ནི་མ་ཡིན་ནོ་༎
T04bsa047_u:554	 tato bhāvābhiniveśadiviparyāsavāsanāyā aprahīṇatvād asaṃjñisamāpattyādivyutthitasyeva punarapi bhāvābhiniveśamūlasya rāgādikleśagaṇasyotpatteramukta eva yogī bhavet /	T04D3915:34a-0	དེ་བས་ན་དངོས་པོར་མངོན་པར་༄༣༤ཨ་༌་༎ ཞེན་པ་ལ་སོགས་པ་ཕྱིན་ཅི་ལོག་གི་བག་ཆགས་མ་སྤངས་པས་འདུ་ཤེས་མེད་པའི་སྙོམས་པར་འཇུག་པ་ལ་སོགས་པ་ལས་ལངས་པ་བཞིན་དུ་དངོས་པོ་ལ་སོགས་པ་མངོན་པར་ཞེན་པའི་རྩ་བ་ཅན་འདོད་ཆགས་ལ་སོགས་པ་ཉོན་མོངས་པའི་ཚོགས་ཡང་འབྱུང་བའི་ཕྱིར་རྣལ་འབྱོར་པ་མ་གྲོལ་བ་ཉིད་དུ་འགྱུར་རོ་༎
T04bsa047_u:555	 bhāvābhiniveśamūlo rāgādiḥ āryasatyadvayanirdeśādau varṇitaḥ /	T04D3915:34a-3	འདོད་ཆགས་ལ་སོགས་པའི་རྩ་བ་ནི་དངོས་པོ་ལ་མངོན་པར་ཞེན་པ་ཡིན་ནོ་ཞེས་འཕགས་པ་བདེན་པ་གཉིས་བསྟན་པ་ལས་ཀྱང་བཀའ་སྩལ་ཏོ་༎
T04bsa047_u:556	 yatpunaruktam avikalpapraveśadhāraṇyām- “amanasikārato rūpādinimittaṃ varjayati” iti /	T04D3915:34a-4	རྣམ་པར་མི་རྟོག་པ་ལ་འཇུག་པའི་གཟུངས་ལས་ཡིད་ལ་མི་བྱེད་པས་གཟུགས་ལ་སོགས་པའི་མཚན་མ་སྤོང་ངོ་ཞེས་གསུངས་པ་གང་ཡིན་པ་དེ་ཡང་ཤེས་རབ་ཀྱིས་བརྟགས་ན་མི་དམིགས་པ་གང་ཡིན་པ་དེ་། དེར་ཡིད་ལ་མི་བྱེད་པར་དགོངས་ཀྱིས་།
T04bsa047_u:558	 na hyasaṃjñisamāpattyādiriva anādikāliko rūpādyabhiniveśo manasikāraparivarjanamātrāt prahīyate /  saṃśayā prahāṇe tu na pūrvopalabdheṣu ca rūpādiṣvabhiniveśamanasikāraparivarjanaṃ śakyaṃ kartum agnyaparivarjane dāhāparivarjanavat /	T04D3915:34a-7	འདུ་ཤེས་མེད་པའི་སྙོམས་པར་འཇུག་པ་ལ་སོགས་པ་ལྟར་ཐོག་མ་མེད་པའི་དུས་ནས་གཟུགས་ལ་སོགས་པ་ལ་མངོན་པར་ཞེན་པའི་ཡིད་ལ་བྱེད་པ་སྤངས་པ་ཙམ་གྱིས་སྤོང་བ་ནི་མ་ཡིན་ནོ་༎ ཐེ་ཚོམ་མ་སྤངས་པར་ནི་སྔོན་དམིགས་པའི་གཟུགས་ལ་སོགས་པ་ལ་མངོན་པར་ཞེན་པའི་ཡིད་ལ་བྱེད་པ་ཡོངས་སུ་སྤང་བར་མི་ནུས་ཏེ་། མེ་མ་སྤངས་པར་ཚ་བ་སྤང་དུ་མི་རུང་བ་བཞིན་ནོ་༎
T04bsa047_u:560	 tathāmī rūpādimithyāvikalpāḥ kaṇṭakādivadutkīlya na hastena cetaso 'panetavyāḥ /	T04D3915:34a-10	འདི་ལྟར་གཟུགས་ལ་སོགས་པ་རྣམ་པར་རྟོག་པ་འདི་དག་ཚེར་མ་ལ་སོགས་པ་བཞིན་དུ་སེམས་ལས་ལག་པས་དབྱུང་ཞིང་བསལ་དུ་མི་རུང་སྟེ་།
T04bsa047_u:561	 kiṃ tarhi saṃśayabījāpagamāt /	T04D3915:34a-11	ཐེ་ཚོམ་གྱི་ས་བོན་སྤང་དགོས་པའི་ཕྱིར་རོ་༎
T04bsa047_u:562	 tacca saṃśayabījaṃ yoginaḥ samādhyāloke sati prajñācakṣuṣā nirūpayatastesāṃ rūpādīnāṃ pūrvopalabdhānām upalabdhilakṣaṇaprāptānām anupalambhād,  rajjoḥ sarpajñānavad,	T04D3915:34a-12	ཐེ་ཚོམ་གྱི་ས་བོན་དེ་ཡང་རྣལ་འབྱོར་པའི་ཏིང་ངེ་འཛིན་གྱི་སྣང་བ་བྱུང་སྟེ་། ཤེས་རབ་ཀྱི་མིག་གིས་བརྟགས་ན་གཟུགས་ལ་སོགས་པ་སྔར་དམིགས་པ་དམིགས་སུ་རུང་བའི་མཚན་ཉིད་དུ་གྱུར་པ་དེ་དག་མི་དམིགས་པའི་ཕྱིར་ཐག་པ་ལ་སྦྲུལ་དུ་ཤེས་པ་བཞིན་དུ་སྤང་གི་། གཞན་དུ་མ་ཡིན་ནོ་༎
T04bsa047_u:564	 apagacchati nānyathā /  tathā saṃśayabījāpagamād rūpādinimittamanasikāraḥ śakyate varjayituṃ nānyathā /	T04D3915:34a-14	དེའི་ཚེ་ཐེ་ཚོམ་གྱི་ས་བོན་དང་བྲལ་བས་གཟུགས་ལ་སོགས་པའི་མཚན་མ་ཡིད་ལ་བྱེད་པ་སྤོང་ནུས་པར་འགྱུར་ཏེ་། གཞན་དུ་མ་ཡིན་ནོ་༎ དེ་ལྟ་མ་ཡིན་ཏེ་།
T04bsa047_u:566	 anyathā hyasati samādhyāloke prajñācakṣuṣāpyanavaloke yathā andhakūpāvasthitapuruṣasyāvacarakagataghāṭādiṣviva yogino rūpādiṣvastitvasaṃśayo naiva nivarteta /	T04D3915:34a-17	ཏིང་ངེ་འཛིན་གྱི་སྣང་བ་མ་བྱུང་། ཤེས་རབ་ཀྱི་མིག་གིས་མ་བལྟས་ན་མུན་ཁུང་ན་འདུག་པའི་མི་ལྟར་ཁྱིམ་གྱི་ནང་ན་ཡོད་པའི་བུམ་པ་ལ་སོགས་པ་སོམ་ཉི་ཟ་བར་གྱུར་པ་བཞིན་དུ་རྣལ་འབྱོར་པ་ཡང་གཟུགས་ལ་སོགས་པ་ཡོད་པར་སོམ་ཉི་ཟ་བ་ལྡོག་པར་མི
T04bsa047_u:567	 tadanivṛttyā cā prahīṇatimiradoṣasyeva yo 'yukto 'līkarūpādyabhiniveśaḥ pravarteta na kenāpi nivartyeta /	T04D3915:34b-1	། དེ་མ་ལོག་ན་མིག་རབ་རིབ་ཀྱི་སྐྱོན་མ་བསལ་བ་བཞིན་དུ་གཟུགས་ལ་སོགས་པ་མི་བདེན་ལ་། མངོན་པར་ཞེན་པ་འབྱུང་སྟེ་ཅིས་ཀྱང་མི་ཟློགས་སོ་༎
T04bsa047_u:568	 tasmāt samādhihastena manaḥ sandhāya sūkṣmataraprajñāśastreṇa tatra cetasi rūpādimithyāvikalpabījam uddharet /	T04D3915:34b-3	དེ་ལྟ་བས་ན་ཏིང་ངེ་འཛིན་གྱི་ལག་གིས་སེམས་གཟུང་སྟེ་ཤིན་ཏུ་ཆ་ཕྲ་བའི་ཤེས་རབ་ཀྱི་མཚོན་གྱིས་གཟུགས་ལ་སོགས་པ་ལོག་པར་རྣམ་པར་རྟོག་པའི་ས་བོན་གྱི་ཟུག་རྔུ་སེམས་དེ་ལ་ཡོད་པ་བསལ་བར་བྱའོ་༎
T04bsa047_u:569	 evam satyutkhātamūlā iva (Bhk 188)  taravo bhūmernirmūlatayā mithyāvikalpāḥ punaścetasi na virohanti /	T04D3915:34b-4	དེ་ལྟར་བྱས་ན་རྩ་བ་ནས་བྱུང་བའི་ཤིང་དག་ས་ལས་མི་སྐྱེ་བ་བཞིན་དུ་རྩ་བ་མེད་པས་ན་ལོག་པར་རྣམ་པར་རྟོག་པའི་སེམས་ཀྱང་སྐྱེ་བར་མི་འགྱུར་རོ་༎
T04bsa047_u:57	 tathā paryeṣṭikṛtam anyo 'nyadrohopaghātādi kṛtaṃ priyaviprayogāpriyasaṃyogakṛtaṃ cāprameyameṣāṃ duḥkham /	T04D3915:23a-12	དེ་བཞིན་དུ་བཙལ་བར་བྱ་བ་དང་། གཅིག་ལ་གཅིག་གནོད་པ་བྱེད་པ་ལ་སོགས་པ་དང་། སྡུག་པ་དང་བྲལ་བ་དང་། མི་སྡུག་པ་དང་ཕྲད་པ་ལ་སོགས་པ་དེ་དག་ལ་སྡུག་བསྔལ་དཔག་ཏུ་མེད་དོ་༎
T04bsa047_u:571	 ata evāvaraṇaprahāṇāya śamathavipaśyanāyuganaddhavāhī mārgo bhagavatā nirdiṣṭaḥ,	T04D3915:34b-5	དེ་བས་ན་སྒྲིབ་པ་སྤོང་བའི་ཕྱིར་ཞི་གནས་དང་ལྷག་མཐོང་ཟུང་དུ་འབྲེལ་བར་འཇུག་པའི་ལམ་བཅོམ་ལྡན་འདས་ཀྱིས་བཀའ་སྩལ་ཏེ་།
T04bsa047_u:572	 tayoḥ avikalpasamyagjñāne hetutvāt /	T04D3915:34b-6	དེ་གཉིས་ནི་ཡང་དག་པའི་ཡེ་ཤེས་རྣམ་པར་མི་རྟོག་པའི་རྒྱུ་ཡིན་པའི་ཕྱིར་རོ་༎
T04bsa047_u:573	 tathā coktam-	T04D3915:34b-7	དེ་སྐད་དུ་།
T04bsa047_u:574	 śīlaṃ pratiṣṭhāya samādhilābhāḥ samādhilābhācca hi prajñābhāvanā /	T04D3915:34b-8	ཚུལ་ཁྲིམས་ལ་ནི་གནས་ནས་ཏིང་ངེ་འཛིན་འཐོབ་སྟེ་༎ ཏིང་ངེ་འཛིན་ཐོབ་ནས་ཀྱང་ཤེས་རབ་སྒོམ་པར་བྱེད་༎
T04bsa047_u:575	 prajñayā jñānaṃ bhavati viśuddhaṃ viśuddhajñānasya hi śīlasampat // iti /	T04D3915:34b-10	ཤེས་རབ་ཀྱིས་ནི་ཡེ་ཤེས་རྣམ་པར་དག་པ་འཐོབ་༎ ཡེ་ཤེས་རྣམ་པར་དག་པས་ཚུལ་ཁྲིམས་ཕུན་སུམ་ཚོགས་༎ ཞེས་བཀའ་སྩལ་ཏོ་༎
T04bsa047_u:576	 tathā hi yadā śamathenālambane cittaṃ sthirīkṛtaṃ bhavati tadā prajñayā vicārayataḥ samyagjñānāloka utpadyate,	T04D3915:34b-13	འདི་ལྟར་གང་གི་ཚེ་ཞི་གནས་ཀྱིས་དམིགས་པ་ལ་སེམས་བརྟན་པར་བྱས་པ་དེའི་ཚེ་ཤེས་རབ་ཀྱིས་རབ་ཏུ་བརྟགས་ན་ཡང་དག་པའི་ཡེ་ཤེས་ཀྱི་སྣང་བ་འབྱུང་སྟེ་།
T04bsa047_u:577	 tadāndhakāramivāloke prakāśayati āvaraṇam apahīyate /	T04D3915:34b-14	དེའི་ཚེ་སྣང་བ་བྱུང་བས་མུན་པ་བསལ་བ་བཞིན་དུ་སྒྲིབ་པ་འབྱུང་ངོ་༎
T04bsa047_u:578	 ata evānayoścakṣurālokayoriva samyagjñānotpādaṃ pratyanyo 'nyānuguṇyenāvasthitatvānnālokāndhakāravat parasparavirodhaḥ /	T04D3915:34b-15	དེ་གཉིས་ཀ་ཡང་མིག་དང་སྣང་བ་བཞིན་དུ་ཡང་དག་པའི་ཡེ་ཤེས་འབྱུང་བ་ལ་ཕན་ཚུན་མཐུན་པར་གནས་པ་ཡིན་གྱི་། སྣང་བ་དང་མུན་པ་བཞིན་དུ་མི་མཐུན་པ་མ་ཡིན་ནོ་༎
T04bsa047_u:579	 na hi samādhirandhakārasvabhāvaḥ /	T04D3915:34b-17	ཏིང་ངེ་འཛིན་ནི་མུན་པའི་ངོ་བོ་ཉིད་ཡིན་ཏེ་། ཅི་ཞེ་ན་།
T04bsa047_u:58	 ye kvacid īśvarāḥ sukhitā iva lapyante te 'pi viparyavasānasampado vividhakudṛṣṭigahananimagnā  nārakādiduḥkhānubhavahetuvividha kleśakarmāṇyupacinvantaḥ prapātasthāstarava iva	T04D3915:23a-13	གང་དག་ཁ་ཅིག་ཕྱུག་ཅིང་སྐྱིད་པ་དང་འདྲ་བར་སྣང་བ་དེ་དག་ཀྱང་འབྱོར་བའི་མཐའ་ནི་རྒྱུད་པ་སྟེ་། ལྟ་བ་ངན་པ་སྣ་ཚོགས་གཟིང་གཟིང་བར་ནུབ་ཅིང་སེམས་ཅན་དམྱལ་བ་ལ་སོགས་པའི་སྡུག་བསྔལ་མྱོང་བར་འགྱུར་བའི་རྒྱུ་ལས་དང་ཉོན་མོངས་པ་བསགས་པས་གད་ཀ་ན་འདུག་པ་དང་འདྲ་བར་སྡུག་བསྔལ་གྱི་རྒྱུར་གྱུར་པ་ཡང་ཡང་དག་པར་༄༢༣བ
T04bsa047_u:580	 kiṃ tarhi cittaikāgratālakṣaṇaḥ /	T04D3915:34b-19	སེམས་རྩེ་གཅིག་པའི་མཚན་ཉིད་དོ་༎
T04bsa047_u:581	 sa ca samāhito yathābhūtaṃ prajānātīti vacanādekāntena prajñānukūla eva bhavati,  na tu viruddhastasmāt syāt samāhitasya prajñayā nirūpayataḥ sarvadharmāṇāmanupalambhaḥ /  sa eva paramo 'nupalambhaḥ /	T04D3915:34b-20	དེ་ནི་མཉམ་པར་བཞག་ན་ཡང་དག་པ་ཇི་ལྟ་བ་བཞིན་དུ་རབ་ཏུ་ཤེས་སོ་ཞེས་བཀའ་སྩལ་པའི་ཕྱིར་དེ་ཤེས་རབ་དང་ཤིན་ཏུ་མཐུན་པ་ཡིན་གྱི་། མི་མཐུན་པ་མ་ཡིན་ནོ་༎ དེ་ལྟ་བས་ན་མཉམ་པར་གཞག་པའི་ཤེས་རབ་ཀྱིས་བརྟགས་ན་ཆོས་ཐམས་ཅད་མི་དམིགས་པ་གང་ཡིན་པ་དེ་ཉིད་མི་དམིགས་པའི་དམ་པའོ་༎
T04bsa047_u:584	 sā ca tādṛśī yogināmavasthānalakṣaṇā gatiranābhogā,	T04D3915:34b-23	རྣལ་འབྱོར་པ་རྣམས་ཀྱི་ཞི་གནས་སྐབས་ཀྱི་མཚན་ཉིད་དེ་འདྲ་བ་དེ་ནི་ལྷུན་གྱིས་གྲུབ་པ་ཡིན་ཏེ་།
T04bsa047_u:585	 tataḥ paraṃ dṛṣṭavyasyābhāvāt /	T04D3915:34b-24	དེའི་ཕ་རོལ་ཏུ་བལྟ་བར་བྱ་བ་གཞན་མེད་པའི་ཕྱིར་རོ་༎
T04bsa047_u:586	 śānteti bhāvābhāvādivikalpalakṣaṇasya prapañcasyopaśamāt /	T04D3915:35a-0	ཞི་བ་ནི་ཡོད་པ་དང་མེད་པ་ལ་སོགས་པ་རྣམ་པར་རྟོག་པའི་མཚན་ཉིད་ཀྱི་སྤྲོས་པ་ཐམས་ཅད་ཉེ་བར་༄༣༥ཨ་༌་༎ ཞི་བའི་ཕྱིར་རོ་༎
T04bsa047_u:587	 tathā hi yadā prajñayā nirūpayan na kiñcid bhāvasvabhāvam upalabhate yogī,  tadāsya naiva bhāvavikalpo bhavat /	T04D3915:35a-2	འདི་ལྟར་གང་གི་ཚེ་རྣལ་འབྱོར་པས་ཤེས་རབ་ཀྱིས་བརྟགས་ན་དངོས་པོའི་ངོ་བོ་ཉིད་གང་ཡང་མི་དམིགས་པ་དེའི་ཚེ་དེ་ལ་དངོས་པོར་རྣམ་པར་རྟོག་པ་མི་འབྱུང་བ་ཉིད་དོ་༎
