src_segmentnr	src_original	tgt_segmentnr	tgt_original
T04bsa054_u:8924	 tat kiṃ manyase subhūte api tu strotaāpannasyaivaṃ bhavati- mayā strotaāpattiphalaṃ prāptamiti?	T25n1511_001:0785b02_8	「『須菩提！ 於意云何？ 須陀洹能作是念： 「我得須陀洹果不？
T04bsa054_u:8925	 subhūtirāha- no hīdaṃ bhagavan /	T25n1511_001:0785b03_13	」』須菩提言： 『不也。 世尊！
T04bsa054_u:8926	 tatkasya hetoḥ?	T25n1511_001:0785b03_24	何以故？
T04bsa054_u:8927	 na hi bhagavan kiṃcidāpannaḥ,  tenocyate strotaāpanna iti /	T25n1511_001:0785b04_8	實無有法名須陀洹。
T04bsa054_u:8929	 na rūpamāpanno na śabdān na gandhān na rasān na spraṣṭavyāni na dharmānāpannaḥ,  tenocyate strotaāpanna iti /	T25n1511_001:0785b05_4	不入色聲香味觸法，是名須陀洹。
