src_segmentnr	src_original	tgt_segmentnr	tgt_original
T04bsa047_u:204	 dharmālokāstathāgatānāmaparyantagatā aparyantakṛtā aparyantabaddhāḥ,  yeṣāṃ saṃkhyā nāsti,	T26n1522_010:0181a03_13	如來法明無量入、無量作、無量轉。
T04bsa047_u:208	 tesāmadhigamāya abhinirhāramutpādaya /	T26n1522_010:0181a06_18	汝今適得此一法明乃至應起此法」故。 無量入者，法門差別故。 無量作者，作事差別故。 無量轉者，依上上不斷差別故。 經曰：
T04bsa047_u:209	 api tu khalu punaḥ kulaputra,	T26n1522_010:0181a09_8	復次善男子！
T04bsa047_u:210	 prekṣasva tāvad daśasu dikṣu apramāṇakṣetratāṃ ca apramāṇasattvatāṃ ca apramāṇadharmavibhaktitāṃ ca /  tatsarvamanugaṇaya /  yathāvattayā abhinirhāramutpādaya /	T26n1522_010:0181a10_18	汝觀十方無量國土、無量眾生、無量法差別，汝應如實盡通達彼事。
T04bsa047_u:213	 “iti hi bho jinaputra,	T26n1522_010:0181a11_4	如是佛子！
