src_segmentnr	src_original	tgt_segmentnr	tgt_original
T04bsa054_u:12548	 bodhicaryāvatāraṃ me yadvicintayataḥ śubham /  tena sarve janāḥ santu bodhicaryāvibhūṣaṇāḥ // Bca_10.1 //	T16D4383:312b-17	བདག་ནི་ཉེར་འཚོའི་གཞིར་ཡང་ཤོག་། བདག་གིས་བྱང་ཆུབ་སྤྱོད་པ་ལ་༎ དགེ་བ་གང་དེས་འགྲོ་བ་ཀུན་༎ བྱང་ཆུབ་སྤྱོད་ལ་འཇུག་པར་ཤོག་། ཕྱོགས་རྣམས་ཀུན་ན་ལུས་དང་སེམས་༎
T04bsa054_u:12550	 sarvāsu dikśu yāvantaḥ kāyacittavyathāturāḥ /	T16D4383:312b-21	སྡུག་བསྔལ་ནད་པ་ཇི་སྙེད་པ་༎
T04bsa054_u:12551	 te prāpnuvantu matpuṇyaiḥ sukhapramodyasāgarān // Bca_10.2 //  āsaṃsāraṃ sukhajyānirmā bhūtteṣāṃ kadācana /	T16D4383:312b-22	དེ་དག་བདག་གི་བསོད་ནམས་ཀྱིས་༏་། བདེ་དགའ་རྒྱ་མཚོ་ཐོབ་པར་ཤོག་། དེ་དག་སངས་རྒྱས་བདེ་ཐོབ་ཀྱི་༎ བར་དུ་བདེ་ལས་ཉམས་མ་གྱུར་༎
T04bsa054_u:12553	 bodhisattvasukhaṃ prāptaṃ bhavatvavirataṃ jagat // Bca_10.3 //	T16D4383:312b-25	འགྲོ་བས་བླ་ན་མེད་པ་ཡི་༎ བདེ་བ་རྒྱུན་མི་འཆད་ཐོབ་ཤོག་།འཇིག་རྟེན་ཁམས་ན་དམྱལ་བ་དག་། གང་དག་ཇི་སྙེད་ཡོད་པ་རྣམས་༎
T04bsa054_u:12554	 yāvanto narakāḥ kecidvidyante lokadhātuṣu /	T16D4383:312b-27	དེ་དག་ཏུ་ནི་ལུས་ཅན་རྣམས་༎
T04bsa054_u:12555	 sukhāvatīsukhāmodyairmodantāṃ teṣu dehinaḥ // Bca_10.4 //  śītārtāḥ prāpnuvantūṣṇamuṣṇārtāḥ santu śītalāḥ /  bodhisattvamahāmeghasaṃbhavairjalasāgaraiḥ // Bca_10.5 //  asipatravanaṃ teṣāṃ syānnandanavanadyuti /	T16D4383:312b-28	བདེ་ཆེན་བདེ་བས་དགའ་བར་ཤོག་། གྲང་བས་ཉམ་ཐག་དྲོ་ཐོབ་ཤོག་། བྱང་ཆུབ་སེམས་དཔའ་སྤྲིན་ཆེན་ལས་༎
T04bsa054_u:12564	 aṅgārataptopalaśastravṛṣṭiradyaprabhṛtyastu ca puṣpavṛṣṭiḥ /  patitasakalamāṃsāḥ kundavarṇāsthidehā  dahanasamajalāyāṃ vaitaraṇyāṃ nimagnāḥ /  mama kuśalabalena prāptadivyātmabhāvāḥ	T16D4383:313a-8	དེང་ནས་རྩེ་ཕྱིར་མེ་ཏོག་འཕེལ་བར་ཤོག་། ཆུ་བོ་རབ་མེད་མེ་དོང་འདྲ་ནང་བྱིང་བ་དག་། ཤ་ཀུན་ཞིག་གྱུར་རུས་གོང་མེ་ཏོག་ཀུན་དའི་མདོག་། བདག་གི་དགེ་བའི་སྟོབས་ཀྱིས་ལྷ་ཡི་ལུས་ཐོབ་ནས་༎
T04bsa054_u:12569	 saha suravanitābhiḥ santu mandākinīsthāḥ // Bca_10.10 //  trastāḥ paśyantvakasmādiha yamapuruṣāḥ kākagṛdhrāśca ghorā	T16D4383:313a-9	ལྷ་མོ་རྣམས་དང་ལྷན་ཅིག་དལ་གྱིས་འབབ་གནས་ཤོག་། ཅི་ཕྱིར་འདི་ནི་གཤིན་རྗེའི་མི་དང་ཁྲ་དང་བྱ་རྒོད་མི་བཟད་རྣམས་སྐྲག་བྱེད་༎
T04bsa054_u:12571	 dhvāntaṃ dhvastaṃ samantātsukharatijananī kasya saumyā prabheyam /  (Bcp 284)	T16D4383:313a-10	ཀུན་ནས་མུན་བསལ་བདེ་དགའ་བསྐྱེད་པའི་མཐུ་བཟང་འདི་ཀོ་སུ་ཡི་ཡིན་སྙམ་སྟེ་༎
T04bsa054_u:12573	 ityūrdhva prekṣamāṇā gaganatalagataṃ vajrapāṇiṃ jvalantaṃ	T16D4383:313a-11	གྱེན་དུ་བལྟས་ན་ནམ་མཁའི་དཀྱིལ་ན་ཕྱག་ན་རྡོ་རྗེ་འབར་བ་བཞུགས་མཐོང་ནས་༎
T04bsa054_u:12574	 dṛṣṭvā prāmodyavegādvayapagataduritā yāntu tenaiva sārdham // Bca_10.11 //  patati kamalavṛṣṭirgandhapānīyamiśrā-	T16D4383:313a-12	རབ་ཏུ་དགའ་བའི་ཤུགས་ཀྱིས་སྡིག་དང་བྲལ་ནས་དེ་དང་ལྷན་ཅིག་འགྲོ་བར་ཤོག་། མེ་ཏོག་ཆར་པ་སྤོས་ཆུ་དང་འདྲེས་བབ་པ་ཡིས་༎
T04bsa054_u:12576	 cchamiti (?)narakavahniṃ dṛśyate nāśayantī /	T16D4383:313a-13	དམྱལ་བའི་མེ་མདག་ཆིལ་ཆིལ་གསོད་པར་མཐོང་གྱུར་ནས་༏
T04bsa054_u:12577	 kimidamiti sukhenāhvāditānāmakasmād  bhavatu kamalapāṇerdarśanaṃ nārakāṇām // Bca_10.12 //  āyātāyāta śīghraṃ bhayamapanayata bhrātaro jīvitāḥ smaḥ	T16D4383:313a-14	། གློ་བུར་བདེ་བས་ཚིམ་པ་འདི་ཅི་བསམ་པ་དང་༎ སེམས་དམྱལ་རྣམས་ཀྱིས་ཕྱག་ན་པདམ་མཐོང་བར་ཤོག་། གྲོགས་དག་འཇིགས་པ་བོར་ལ་རིངས་པར་ཚུར་ཤོག་འུ་བུའི་ཐད་དུ་ནི་༎
T04bsa054_u:12581	 sarva yasyānubhāvādvayasanamapagataṃ prītivegāḥ pravṛttāḥ	T16D4383:313a-15	གང་གི་མཐུ་ཡིས་སྡུག་བསྔལ་ཐམས་ཅད་བྲལ་ཞིང་དགའ་བའི་ཤུགས་ཕྱིན་ལ་༏
T04bsa054_u:12582	 jātaṃ saṃbodhicittaṃ sakalajanaparitrāṇamātā dayā ca // Bca_10.13 //	T16D4383:313a-16	།འགྲོ་བ་ཀུན་ནས་ཡོངས་སྐྱོབ་བྱང་ཆུབ་སེམས་དང་བརྩེ་བ་སྐྱེས་གྱུར་པ་༎ གཞོན་ནུ་ཟུར་ཕུད་ཅན་འབར་འཇིགས་པ་མེད་པར་བྱེད་པ་ཅི་ཞིག་ཕྱིན་༎
T04bsa054_u:12583	 paśyantvenaṃ bhavantaḥ suraśatamukuṭairarcyamānāṅghripadmaṃ  kāruṇyādārdradṛṣṭiṃ śirasi nipatitānekapuṣpaughavṛṣṭim /	T16D4383:313a-18	ཁྱོད་ཀྱིས་ལྷ་བརྒྱའི་ཅོད་པན་དག་གི་ཞབས་ཀྱི་པདམ་ལ་མཆོད་ཅིང་༎ ཐུགས་རྗེས་རླན་སྤྱན་དབུ་ལ་མེ་ཏོག་དུ་༄༣༡༣བ་མའི་ཚོགས་ཀྱིས་ཆར་འབབ་པ་༎
T04bsa054_u:12585	 kūṭāgārairmanojñaiḥ stutimukharasurastrīsahastropagītair	T16D4383:313b-1	ཁང་བརྩེགས་ཡིད་འོང་ལྷ་མོ་སྟོང་ཕྲག་བསྟོད་དབྱངས་སྒྲོགས་ལྡན་འདི་ལྟོས་ཞེས་༎
T04bsa054_u:12586	 dṛṣṭvāgre mañjughoṣaṃ bhavatu kalakalaḥ sāṃprataṃ nārakāṇām // Bca_10.14 //  iti matkuśalaiḥ samantabhadrapramukhānāvṛtabodhisattvameghān /	T16D4383:313b-2	འཇམ་དབྱངས་དེ་འདྲ་མཐོང་ནས་ད་ནི་སེམས་དམྱལ་ཅ་ཅོ་འདོན་པར་ཤོག་། དེ་ལྟར་བདག་གི་དགེ་རྩས་ཀུན་ཏུ་བཟང་ལ་སོགས་༎
T04bsa054_u:12588	 sukhaśītasugandhavātavṛṣṭīnabhinandantu vilokya nārakāste // Bca_10.15 //  śāmyantu vedanāstīvrā nārakāṇāṃ bhayāni ca /  durgatibhyo vimucyantāṃ sarvadurgativāsinaḥ // Bca_10.16 //	T16D4383:313b-3	བྱང་ཆུབ་སེམས་དཔའ་སྒྲིབ་པ་མེད་སྤྲིན་བདེ་བ་དང་༎ བསིལ་ཞིང་དྲི་ཞིམ་ངད་ལྡང་ཆར་པ་འབེབས་མཐོང་ནས་༎
T04bsa054_u:12591	 anyonyabhakṣaṇabhayaṃ tiraścāmapagacchatu /  bhavantu sukhinaḥ pretā yathottarakurau narāḥ // Bca_10.17 //  saṃtarpyantāṃ pretāḥ strāpyantāṃ śītalā bhavantu sadā /	T16D4383:313b-4	སེམས་ཅན་དམྱལ་བ་དེ་དག་མངོན་པར་དགའ་གྱུར་ཅིག་། དུད་འགྲོ་རྣམས་ནི་གཅིག་ལ་གཅིག་། ཟ་བའི་འཇིགས་དང་བྲལ་བར་ཤོག་། སྒྲ་མི་སྙན་པའི་མི་བཞིན་དུ་༎ ཡི་དགས་རྣམས་ནི་བདེ་བར་གྱུར་༎
T04bsa054_u:12594	 āryāvalokiteśvarakaragalitakṣīradhārābhiḥ // Bca_10.18 //	T16D4383:313b-6	འཕགས་པ་སྤྱན་རས་གཟིགས་དབང་གི་། ཕྱག་ནས་འབབ་པའི་འོ་རྒྱུན་གྱིས་༎
T04bsa054_u:12595	 andhāḥ paśyantu rūpāṇi śṛṇvantu badhirāḥ sadā /	T16D4383:313b-7	ཡི་དགས་རྣམས་ནི་ཚིམ་བྱས་ཤིང་༎ ཁྲུས་བྱས་རྟག་ཏུ་བསིལ་བར་ཤོག་། ལོང་བ་རྣམས་ཀྱིས་གཟུགས་མཐོང་ཤོག་།འོན་པས་རྟག་ཏུ་སྒྲ་ཐོས་ཤོག་། ལྷ་མོ་སྒྱུ་འཕྲུལ་བཞིན་དུ་ནི་༎
T04bsa054_u:12596	 garbhiṇyaśca prasūyantāṃ māyādevīva nirvyathāḥ // Bca_10.19 //	T16D4383:313b-9	སྦྲུམ་མ་གནོད་མེད་བཙའ་བར་ཤོག་། གཅེར་བུ་རྣམས་ཀྱིས་གོས་དག་དང་༎ བཀྲེས་པ་རྣམས་ཀྱིས་ཟས་དང་ནི་༎
T04bsa054_u:12597	 vastrabhojanapānīyaṃ strakcandanavibhūṣaṇam /  manobhilaṣitaṃ sarvaṃ labhantāṃ hitasaṃhitam // Bca_10.20 //  mītāśca nirbhayāḥ santu śokārtāḥ prītilābhinaḥ /  udvigrāśca nirudvegā dhṛtimanto bhavantu ca // Bca_10.21 //	T16D4383:313b-10	སྐོམ་པ་རྣམས་ཀྱིས་ཆུ་དག་དང་༎ བཏུང་བ་ཞིམ་པོ་ཐོབ་པར་ཤོག་། བཀྲེན་པ་རྣམས་ཀྱིས་ནོར་ཐོབ་ཤོག་། མྱ་ངན་ཉམ་ཐག་དགའ་ཐོབ་ཤོག་། ཡི་ཆད་རྣམས་ཀྱང་ཡིད་སོས་ཤིང་༎ མྱུར་དུ་ནད་ལས་ཐར་བར་ཤོག་།འགྲོ་བའི་ནད་ནི་མ་ལུས་པ་༎ སྐྲག་པ་རྣམས་ནི་འཇིགས་མེད་ཤོག་། བཅིངས་པ་རྣམས་ནི་གྲོལ་བར་གྱུར་༎ ཕྱོགས་རྣམས་ཐམས་ཅད་བདེ་བར་ཤོག་། གང་གི་དོན་དུ་འགྲོ་བྱེད་པ་༎
T04bsa054_u:12601	 ārogyaṃ rogiṇāmastu mucyantāṃ sarvabandhanāt /  durbalā balinaḥ santu strigdhacittāḥ parasparam // Bca_10.22 //	T16D4383:313b-18	དེ་འབད་མི་དགོས་གྲུབ་གྱུར་ཅིག་། གྲུ་དང་གྲུ་ཆེན་ཞུགས་པ་རྣམས་༎ ཆུ་ཡི་ངོགས་སུ་བདེ་ཕྱིན་ནས་༎
T04bsa054_u:12610	 suptamattapramattānāṃ vyādhyāraṇyādisaṃkaṭe /  anāthabālavṛddhānāṃ rakṣāṃ kurvantu devatāḥ // Bca_10.26 //	T16D4383:314a-3	བྱིས་པ་རྒན་པོ་མགོན་མེད་པ་༎ གཉིད་ལོག་མྱོས་ཤིང་རབ་མྱོས་རྣམས་༎
T04bsa054_u:12612	 sarvākṣaṇavinirmuktāḥ śraddhāprajñākṛpānvitāḥ /	T16D4383:314a-5	ལྷ་དག་སྲུང་བར་བྱེད་པར་ཤོག་། མི་ངལ་ཀུན་ལས་ཐར་པ་དང་༎ དད་དང་ཤེས་རབ་བརྩེར་ལྡན་ཞིང་༎
T04bsa054_u:12613	 ākārācārasaṃpannāḥ santu jātismarāḥ sadā // Bca_10.27 //  bhavantvakṣayakośāśca yāvadgaganagañjavat /	T16D4383:314a-6	ཟས་དང་སྤྱོད་པ་ཕུན་ཚོགས་ནས་༎ རྟག་ཏུ་ཚེ་རབས་དྲན་གྱུར་ཅིག་། ཐམས་ཅད་ནམ་མཁའི་མཛོད་བཞིན་དུ་༎
T04bsa054_u:12615	 nirdvandvā nirupāyāsāḥ santu svādhīnavṛttayaḥ // Bca_10.28 //	T16D4383:314a-8	ལོངས་སྤྱོད་ཟད་པར་མེད་པར་ཤོག་། རྩོད་པ་མེད་ཅིང་འཚེ་མེད་པར་༎
T04bsa054_u:12616	 alpaujasaśca ye sattvāste bhavantu mahaujasaḥ /	T16D4383:314a-10	དེ་དག་གཟི་བརྗིད་ཆེན་པོར་ཤོག་། དཀའ་ཐུབ་ཅན་གང་གཟུགས་ངན་པ་༎
T04bsa054_u:12617	 bhavantu rūpasaṃpannā ye virūpāstapasvinaḥ // Bca_10.29 //  yāḥ kāścana striyo loke puruṣatvaṃ vrajantu tāḥ /	T16D4383:314a-11	གཟུགས་བཟང་ཕུན་སུམ་ཚོགས་གྱུར་ཅིག་།འཇིག་རྟེན་བུད་མེད་ཇི་སྙེད་པ་༎
T04bsa054_u:12619	 prāpnuvantūccatāṃ nīcā hatamānā bhavantu ca // Bca_10.30 //	T16D4383:314a-12	དེ་དག་སྐྱེས་པ་ཉིད་གྱུར་ཅིག་། མ་རབས་རྣམས་ནི་མཐོ་ཐོབ་ཅིང་༎
T04bsa054_u:12620	 anena mama puṇyena sarvasattvā aśeṣataḥ /	T16D4383:314a-13	ང་རྒྱལ་དག་ཀྱང་བཅོམ་པར་ཤོག་། བདག་གི་བསོད་ནམས་འདི་ཡིས་ནི་༎ སེམས་ཅན་ཐམས་ཅད་མ་ལུས་པ་༎
T04bsa054_u:12621	 viramya sarvapāpebhyaḥ kurvantu kuśalaṃ sadā // Bca_10.31 //	T16D4383:314a-15	སྡིག་པ་ཐམས་ཅད་སྤངས་ནས་ནི་༎
T04bsa054_u:12622	 bodhicittāvirahitā bodhicaryāparāyaṇāḥ /	T16D4383:314a-16	རྟག་ཏུ་དགེ་བ་བྱེད་པར་ཤོག་། བྱང་ཆུབ་སེམས་དང་མི་འབྲལ་ཞིང་༎ བྱང་ཆུབ་སྤྱོད་ལ་གཞོལ་བ་དང་༎ སངས་རྒྱས་རྣམས་ཀྱི་ས་ཡོངས་བཟུང་ཞིང་༎
T04bsa054_u:12623	 buddhaiḥ parigṛhītāśca mārakarmavivarjitāḥ // Bca_10.32 //	T16D4383:314a-18	བདུད་ཀྱི་ལས་ཀྱང་སྤོང་བར་ཤོག་། སེམས་ཅན་དེ་དག་ཐམས་ཅད་ནི་༎
T04bsa054_u:12624	 aprameyāyuṣaścaiva sarvasattvā bhavantu te /  nityaṃ jīvantu sukhitā mṛtyuśabdo 'pi naśyatu // Bca_10.33 //	T16D4383:314a-19	ཚེ་ཡང་དཔག་མེད་རིང་བར་ཤོག་། རྟག་ཏུ་བདེ་བར་འཚོ་འགྱུར་ཞིང་༎ འཆི་བའི་སྒྲ་ཡང་གྲག་མ་གྱུར་༎
T04bsa054_u:12626	 ramyāḥ kalpadrumodyānairdiśaḥ sarvā bhavantu ca /	T16D4383:314a-21	དཔག་བསམ་ཤིང་གི་སྐྱེད་མོས་ཚལ་༎
T04bsa054_u:12627	 buddhabuddhātmajākīrṇā dharmadhvanimanoharaiḥ // Bca_10.34 //	T16D4383:314a-22	སངས་རྒྱས་དང་ནི་སངས་རྒྱས་སྲས་༎
T04bsa054_u:12628	 śarkarādivyapetā ca samā pāṇitalopamā /  mṛdvī ca vaiḍūryamayī bhūmiḥ sarvatra tiṣṭhatu // Bca_10.35 //  bodhisattvamahāparṣanmaṇḍalāni samantataḥ /  niṣīdantu svaśobhābhirmaṇḍayantu mahītalam // Bca_10.36 //  pakṣibhyaḥ sarvavṛkṣebhyo raśmibhyo gaganādapi /  dharmadhvaniraviśrāmaṃ śrūyatāṃ sarvadehibhiḥ // Bca_10.37 //	T16D4383:314b-0	ཤིང་དང་འོད་སེར་ཐམས་ཅད་དང་༎ ནམ་མཁའ་ལས་ཀྱང་ཆོས་༄༣༡༤བ་ཀྱི་སྒྲ་༏
T04bsa054_u:12638	 sphīto bhavatu lokaśca rājā bhavatu dhārmikaḥ // Bca_10.39 //  śaktā bhavantu cauṣadhyo mantrāḥ sidhyantu jāpinām /  bhavantu karuṇāviṣṭā ḍākinīrākṣasādayaḥ // Bca_10.40 //	T16D4383:314b-4	རྒྱལ་པོ་ཆོས་བཞིན་བྱེད་གྱུར་ཅིག་།འཇིག་རྟེན་དག་ཀྱང་དར་བར་ཤོག་། སྨན་རྣམས་མཐུ་དང་ལྡན་པ་དང་༎ གསང་སྔགས་བཟླས་བརྗོད་གྲུབ་པར་ཤོག་། མཁའ་འགྲོ་སྲིན་པོ་ལ་སོགས་པ་༎
T04bsa054_u:12641	 mā kaścidduḥkhitaḥ sattvo mā pāpī mā ca rogitaḥ /	T16D4383:314b-5	སྙིང་རྗེའི་སེམས་དང་ལྡན་གྱུར་ཅིག་། སེམས་ཅན་འགའ་ཡང་སྡུག་མ་གྱུར་༏
T04bsa054_u:12642	 mā hīnaḥ paribhūto vā mā bhūtkaścicca durmanāḥ // Bca_10.41 //	T16D4383:314b-6	།འཇིགས་དང་བརྙས་པ་མི་འབྱུང་ཞིང་༎ འགའ་ཡང་ཡིད་མི་བདེ་མ་གྱུར་༎
T04bsa054_u:12643	 pāṭhasvādhyāyakalilā vihārāḥ santu susthitāḥ /  nityaṃ syātsaṃghasāmagrī saṃghakāryaṃ ca sidhyatu // Bca_10.42 //  vivekalābhinaḥ santu śikṣākāmāśca bhikṣavaḥ /	T16D4383:314b-8	གཙུག་ལག་ཁང་རྣམས་ཀློག་པ་དང་༎ ཁ་ཏོན་གྱིས་བརྒྱན་ལེགས་གནས་ཤོག་། རྟག་ཏུ་དགེ་འདུན་མཐུན་པ་དང་༎ དགེ་འདུན་དོན་ཡང་འགྲུབ་པར་ཤོག་། བསླབ་པ་འདོད་པའི་དགེ་སློང་དག་། དབེན་པ་དག་ཀྱང་ཐོབ་པར་ཤོག་། ག-ཡེང་བ་ཐམས་ཅད་སྤངས་ནས་ནི་༎
T04bsa054_u:12646	 karmaṇyacittā dhyāyantu sarvavikṣepavarjitāḥ // Bca_10.43 //	T16D4383:314b-9	སེམས་ནི་ལས་རུང་བསྒོམ་གྱུར་ཅིག་། དགེ་སློང་མ་རྣམས་རྙེད་ལྡན་ཞིང་༎
T04bsa054_u:12647	 lābhinyaḥ santu bhikṣuṇyaḥ kalahāyāsavarjitāḥ /  bhavantyakhaṇḍaśīlāśca sarve pravrajitāstathā // Bca_10.44 //	T16D4383:314b-10	འཐབ་དང་རྩོད་པ་སྤོང་བར་ཤོག་། དེ་བཞིན་རབ་ཏུ་བྱུང་བ་ཀུན་༎ ཚུལ་ཁྲིམས་ཉམས་པ་མེད་གྱུར་ཅིང་༎
T04bsa054_u:12649	 duḥśīlāḥ santu saṃvignāḥ pāpakṣayaratāḥ sadā /  sugaterlābhinaḥ santu tatra cākhaṇḍitavratāḥ // Bca_10.45 //	T16D4383:314b-12	ཚུལ་ཁྲིམས་འཆལ་བས་ཡིད་བྱུང་ནས་༎ རྟག་ཏུ་སྡིག་པ་ཟད་བྱེད་ཤོག་། བདེ་འགྲོ་དག་ཀྱང་ཐོབ་གྱུར་ནས་༎
T04bsa054_u:12651	 paṇḍitāḥ saṃskṛtāḥ santu lābhinaḥ paiṇḍapātikāḥ /  bhavantu śuddhasaṃtānāḥ sarvadikkhyātakīrtayaḥ // Bca_10.46 //	T16D4383:314b-14	དེར་ཡང་བརྟུལ་ཞུགས་མི་ཉམས་ཤོག་། མཁས་པ་རྣམས་ནི་བཀུར་བ་དང་༎ བསོད་ནམས་དག་ཀྱང་རྙེད་པར་ཤོག་། རྒྱུད་ནི་ཡོངས་སུ་དག་པ་དང་༎ ཕྱོགས་རྣམས་ཀུན་དུ་གྲགས་པར་ཤོག་། ངན་སོང་སྡུག་བསྔལ་མི་མྱོང་ཞིང་༎
T04bsa054_u:12653	 abhuktvāpāyikaṃ duḥkhaṃ vinā duṣkaracaryayā /  divyenaikena kāyena jagaddhuddhatvamāpnuyāt // Bca_10.47 //	T16D4383:314b-15	དཀའ་བས་སྤྱད་པ་མེད་པར་ཡང་༎ ལྷ་བས་ལྷག་པའི་ལུས་ཀྱིས་ནི་༎ དེ་དག་སངས་རྒྱས་མྱུར་འགྲུབ་ཤོག་། སེམས་ཅན་ཀུན་གྱིས་ལན་མང་དུ་༎
T04bsa054_u:12655	 pūjyantāṃ sarvasaṃbuddhāḥ sarvasattvairanekadhā /	T16D4383:314b-18	སངས་རྒྱས་ཐམས་ཅད་མཆོད་བྱེད་ཅིང་༎
T04bsa054_u:12656	 acintyabauddhasaukhyena sukhinaḥ santu bhūyasā // Bca_10.48 //	T16D4383:314b-19	སངས་རྒྱས་བདེ་བ་བསམ་ཡས་ཀྱིས་༎ རྟག་ཏུ་བདེ་དང་ལྡན་གྱུར་ཅིག་། བྱང་ཆུབ་སེམས་དཔའ་རྣམས་ཀྱིས་ནི་༎
T04bsa054_u:12657	 sidhyantu bodhisattvānāṃ jagadarthaṃ manorathāḥ /  yaccintayanti te nāthāstatsattvānāṃ samṛdhyatu // Bca_10.49 //	T16D4383:314b-21	འགྲོ་དོན་ཐུགས་ལ་དགོངས་འགྲུབ་ཤོག་། མགོན་པོ་ཡིས་ནི་གང་དགོངས་པ་༎
T04bsa054_u:12659	 pratyekabuddhāḥ sukhino bhavantu śrāvakāstathā /  devāsuranarairnityaṃ pūjyamānāḥ sagauravaiḥ // Bca_10.50 //	T16D4383:315a-1	ཀྱང་བདེ་གྱུར་ཅིག་། བདག་ཀྱང་འཇམ་དབྱངས་བཀའ་དྲིན་གྱིས་༎
T04bsa054_u:12661	 jātismaratvaṃ pravrajyāmahaṃ ca prāpnuyāṃ sadā /  yāvatpramuditābhūmiṃ mañjughoṣaparigrahāt // Bca_10.51 //  yena tenāsanenāhaṃ yāpayeyaṃ balānvitaḥ /  vivekavāsasāmagrīṃ prāpnuyāṃ sarvajātiṣu // Bca_10.52 //	T16D4383:315a-2	ས་རབ་དགའ་བ་ཐོབ་པར་དུ་༎ རྟག་ཏུ་ཚེ་རབས་དྲན་པ་དང་༎ རབ་ཏུ་བྱུང་བ་ཐོབ་པར་ཤོག་། བདག་ནི་ཁ་ཟས་གྱི་ནས་ཀྱང་༎ ཉམས་དང་ལྡན་ཞིང་འཚོ་བར་ཤོག་། ཚེ་རབས་ཀུན་དུ་དབེན་གནས་པར་༎
T04bsa054_u:12665	 yadā ca draṣṭukāmaḥ syāṃ praṣṭukāmaśca kiṃcana /	T16D4383:315a-5	ཕུན་སུམ་ལྡན་པ་ཐོབ་པར་ཤོག་། གང་ཚེ་བལྟ་བར་འདོད་པ་དང་༎ ཅུང་ཟད་འདྲི་བར་འདོད་ན་ཡང་༎
T04bsa054_u:12666	 tameva nāthaṃ paśyeyaṃ mañjunāthamavighnataḥ // Bca_10.53 //	T16D4383:315a-6	མགོན་པོ་འཇམ་དབྱངས་དེ་ཉིད་ནི་༎ གེགས་མེད་པར་ཡང་མཐོང་བར་ཤོག་། ཕྱོགས་བཅུ་ནམ་མཁའི་མཐས་གཏུགས་པའི་༎
T04bsa054_u:12667	 daśadigvyomaparyantasarvasattvārthasādhane /	T16D4383:315a-8	སེམས་ཅན་ཀུན་དོན་བསྒྲུབ་པའི་ཕྱིར་༎
T04bsa054_u:12668	 yathā carati mañjuśrīḥ saiva caryā bhavenmama // Bca_10.54 //  (Bcp 287)  ākāśasya sthitiryāvadyāvacca jagataḥ sthitiḥ /  tāvanmama sthitirbhūyājjagadduḥkhāni nighnataḥ // Bca_10.55 //	T16D4383:315a-9	ཇི་ལྟར་འཇམ་དབྱངས་སྤྱོད་མཛད་པ་༎ བདག་གི་སྤྱོད་པའང་དེ་འདྲར་ཤོག་། ཇི་སྲིད་ནམ་མཁའ་གནས་པ་དང་༎ འགྲོ་བ་ཇི་སྲིད་གནས་གྱུར་པ་༎ དེ་སྲིད་བདག་ནི་གནས་གྱུར་ནས་༎
T04bsa054_u:12672	 yatkiṃcijjagato duḥkhaṃ tatsarvaṃ mayi pacyatām /  bodhisattvaśubhaiḥ sarvairjagatsukhitamastu ca // Bca_10.56 //	T16D4383:315a-12	འགྲོ་བའི་སྡུག་བསྔལ་སེལ་བར་ཤོག་།འགྲོ་བའི་སྡུག་བསྔལ་གང་ཅི་འང་རུང་༎ དེ་ཀུན་བདག་ལ་སྨིན་གྱུར་ཅིག་། བྱང་ཆུབ་སེམས་དཔའི་དགེ་འདུན་གྱིས་༎
T04bsa054_u:12674	 jagadduḥkhaikabhaiṣajyaṃ sarvasaṃpatsukhākaram /	T16D4383:315a-14	འགྲོ་བ་བདེ་ལ་སྤྱོད་པར་ཤོག་།འགྲོ་བའི་སྡུག་བསྔལ་སྨན་གཅིག་པུ་༎
T04bsa054_u:1574	 evaṃ sarvamidaṃ kṛtvā yanmayāsāditaṃ śubham /	T16D4383:312a-2	དེ་ལྟར་འདི་དག་ཀུན་བྱས་ཏེ་༎
