src_segmentnr	src_original	tgt_segmentnr	tgt_original
T04ksmadhlu:1276	 “na hi suvikrāntavikrāmin rūpaṃ rāgadharmi vā virāgadharmi vā,  evaṃ vedanā saṃjñā saṃskārāḥ /  na vijñānaṃ rāgadharmi vā virāgadharmi vā /	T04D3853:100a-8	ཚོར་བ་དང་། འདུ་ཤེས་དང་། འདུ་བྱེད་རྣམས་དང་། རྣམ་པར་ཤེས་པ་ཡང་འདོད་ཆགས་ཀྱི་ཆོས་ཅན་ནམ་། འདོད་ཆགས་དང་བྲལ་བའི་ཆོས་ཅན་མ་ཡིན་ནོ་༎ གཟུགས་འདོད་ཆགས་ཀྱི་ཆོས་ཉིད་མ་ཡིན་པ་དང་། འདོད་ཆགས་དང་བྲལ་བའི་ཆོས་ཉིད་མ་ཡིན་པ་།
T04ksmadhlu:1279	 yā ca rūpavedanāsaṃjñāsaṃkāravijñānānāṃ na rāgadharmatā nāpi virāgadharmatā iyaṃ prajñāpāramitā /	T04D3853:100a-11	གང་ཡིན་པ་དེ་ནི་ཤེས་རབ་ཀྱི་ཕ་རོལ་ཏུ་ཕྱིན་པའོ་༎ ཚོར་བ་དང་། འདུ་ཤེས་དང་། འདུ་བྱེད་རྣམས་དང་། རྣམ་པར་ཤེས་པ་འདོད་ཆགས་ཀྱི་ཆོས་ཉིད་མ་ཡིན་པ་དང་། འདོད་ཆགས་དང་བྲལ་བའི་ཆོས་ཉིད་མ་ཡིན་པ་གང་ཡིན་པ་དེ་ནི་ཤེས་རབ་ཀྱི་ཕ་རོལ་ཏུ་ཕྱིན་པའོ་༎ གཟུགས་ནི་ཞེ་སྡང་གི་ཆོས་ཅན་ནམ་།
T04ksmadhlu:1281	 evaṃ vedanā saṃjñā saṃskārāḥ /  na vijñānaṃ dveṣadharmi vā adveṣadharmi vā /	T04D3853:100a-14	ཞེ་སྡང་དང་བྲལ་བའི་ཆོས་ཅན་མ་ཡིན་ནོ་༎ ཚོར་བ་དང་། འདུ་ཤེས་དང་། འདུ་བྱེད་རྣམས་དང་། རྣམ་པར་ཤེས་པ་ཡང་ཞེ་སྡང་གི་ཆོས་ཅན་ནམ་། ཞེ་སྡང་དང་བྲལ་བའི་ཆོས་ཅན་མ་ཡིན་ནོ་༎
T04ksmadhlu:1283	 yā ca rūpavedanāsaṃjñāsaṃskāravijñānānāṃ na dveṣadharmatā nāpi vigatadveṣadharmatā iyaṃ prajñāpāramitā /	T04D3853:100a-17	གཟུགས་ཞེ་སྡང་གི་ཆོས་ཉིད་མ་ཡིན་པ་དང་། ཞེ་སྡང་དང་བྲལ་བའི་ཆོས་ཉིད་མ་ཡིན་པ་གང་ཡིན་པ་དེ་ནི་ཤེས་རབ་ཀྱི་ཕ་རོལ་ཏུ་ཕྱིན་པའོ་༎ ཚོར་བ་དང་། འདུ་ཤེས་དང་། འདུ་བྱེད་རྣམས་དང་། རྣམ་པར་ཤེས་པ་ཡང་ཞེ་སྡང་གི་ཆོས་ཉིད་མ་ཡིན་པ་དང་། ཞེ་སྡང་དང་བྲལ་བའི་ཆོས་ཉིད་མ་ཡིན་པ་གང་ཡིན་པ་དེ་ནི་ཤེས་རབ་ཀྱི་ཕ་རོལ་ཏུ་ཕྱིན་པའོ་༎
T04ksmadhlu:1284	 na hi suvikrāntavikrāmin rūpaṃ mohadharmi vā vigatamohadharmi vā,	T04D3853:100a-19	གཟུགས་ནི་གཏི་མུག་གི་ཆོས་ཅན་ནམ་། གཏི་མུག་དང་བྲལ་བའི་ཆོས་ཅན་མ་ཡིན་ནོ་༎
T04ksmadhlu:1285	 evaṃ vedanā saṃjñā saṃskārāḥ /  na vijñānaṃ mohadharmi vā vigatamohadharmi vā /	T04D3853:100a-21	ཚོར་བ་དང་། འདུ་ཤེས་དང་། འདུ་བྱེད་རྣམས་དང་། རྣམ་པར་ཤེས་པ་ཡང་གཏི་མུག་གི་ཆོས་ཅན་ནམ་། གཏི་མུག་དང་བྲལ་བའི་ཆོས་ཅན་མ་ཡིན་ནོ་༎
T04ksmadhlu:1287	 yā ca rūpavedanāsaṃjñāsaṃskāravijñānānāṃ na mohadharmatā nāpi vigatamohadharmatā iyaṃ prajñāpāramitā /	T04D3853:100a-23	གཟུགས་ནི་གཏི་མུག་གི་ཆོས་ཉིད་མ་ཡིན་པ་དང་། གཏི་མུག་དང་བྲལ་བའི་ཆོས་ཉིད་མ་ཡིན་པ་གང་ཡིན་པ་དེ་ནི་ཤེས་རབ་ཀྱི་ཕ་རོལ་ཏུ་ཕྱིན་པའོ་༎ ཚོར་བ་དང་། འདུ་ཤེས་དང་། འདུ་བྱེད་རྣམས་དང་། རྣམ་པར་ཤེས་པ་གཏི་མུག་གི་ཆོས་ཉིད་མ་ཡིན་པ་དང་། གཏི་མུག་དང་བྲལ་བའི་ཆོས་ཉིད་མ་༄༡༠༠བ་ཡིན་པ་གང་ཡིན་པ་དེ་ནི་ཤེས་རབ་ཀྱི་ཕ་རོལ་ཏུ་ཕྱིན་པའོ་༎
T04ksmadhlu:1288	 na hi suvikrāntavikrāmin rūpaṃ saṃkliśyate vā vyavadāyate vā,	T04D3853:100b-1	རབ་ཀྱི་རྩལ་གྱིས་རྣམ་པར་གནོན་པ་། གཟུགས་ནི་ཀུན་ནས་ཉོན་མོངས་པར་འགྱུར་བའམ་།
T04ksmadhlu:1289	 evaṃ vedanā saṃjñā saṃskārāḥ /  na vijñānaṃ saṃkliśyate vā vyavadāyate vā /	T04D3853:100b-4	ཚོར་བ་དང་། འདུ་ཤེས་དང་། འདུ་བྱེད་རྣམས་དང་། རྣམ་པར་ཤེས་པ་ཡང་ཀུན་ནས་ཉོན་མོངས་པར་འགྱུར་པའམ་།
