src_segmentnr	src_original	tgt_segmentnr	tgt_original
T04ksmadhlu:1276	 “na hi suvikrāntavikrāmin rūpaṃ rāgadharmi vā virāgadharmi vā,	K06D0014_H0014:31a-12	རབ་ཀྱི་རྩལ་གྱིས་རྣམ་པར་གནོན་པ་། གཟུགས་ནི་། བདག་གམ་། བདག་མེད་པ་མ་ཡིན་ནོ་༎
T04ksmadhlu:1277	 evaṃ vedanā saṃjñā saṃskārāḥ /  na vijñānaṃ rāgadharmi vā virāgadharmi vā /	K06D0014_H0014:31a-15	དེ་བཞིན་དུ་ཚོར་བ་དང་། འདུ་ཤེས་དང་། འདུ་བྱེད་རྣམས་དང་། རྣམ་པར་ཤེས་པ་ཡང་བདག་གམ་།
T04ksmadhlu:1279	 yā ca rūpavedanāsaṃjñāsaṃkāravijñānānāṃ na rāgadharmatā nāpi virāgadharmatā iyaṃ prajñāpāramitā /	K06D0014_H0014:31a-17	གཟུགས་དང་། ཚོར་བ་དང་། འདུ་ཤེས་དང་། འདུ་བྱེད་རྣམས་དང་། རྣམ་པར་ཤེས་པ་བདག་ཀྱང་མ་ཡིན་། བདག་མེད་པ་ཡང་མ་ཡིན་པ་གང་ཡིན་པ་དེ་། ཤེས་རབ་ཀྱི་ཕ་རོལ་ཏུ་ཕྱིན་པའོ་༎
T04ksmadhlu:1281	 evaṃ vedanā saṃjñā saṃskārāḥ /	K06D0014_H0014:31a-20	རབ་ཀྱི་རྩལ་གྱིས་རྣམ་པར་གནོན་པ་། གཟུགས་ནི་། འདོད་ཆགས་ཀྱི་ཆོས་ཅན་ནམ་། འདོད་ཆགས་དང་བྲལ་བའི་ཆོས་ཅན་མ་ཡིན་ནོ་༎ དེ་བཞིན་དུ་ཚོར་བ་དང་། འདུ་ཤེས་དང་། འདུ་བྱེད་རྣམས་དང་། རྣམ་པར་ཤེས་པ་ཡང་འདོད་ཆགས་ཀྱི་ཆོས་ཅན་ནམ་། འདོད་ཆགས་དང་བྲལ་བའི་ཆོས་ཅན་མ་ཡིན་༄༣༡བ་ཏེ༏་གཟུགས་དང་། ཚོར་བ་དང་། འདུ་ཤེས་དང་། འདུ་བྱེད་རྣམས་དང་། རྣམ་པར་ཤེས་པ་འདོད་ཆགས་ཀྱི་ཆོས་ཉིད་ཀྱང་མ་ཡིན་། འདོད་ཆགས་དང་བྲལ་བའི་ཆོས་ཉིད་ཀྱང་མ་ཡིན་པ་གང་ཡིན་པ་དེ༏་ཤེས་རབ་ཀྱི་ཕ་རོལ་ཏུ་ཕྱིན་པའོ་༎ རབ་ཀྱི་རྩལ་གྱིས་རྣམ་པར་གནོན་པ་།
T04ksmadhlu:1282	 na vijñānaṃ dveṣadharmi vā adveṣadharmi vā /  yā ca rūpavedanāsaṃjñāsaṃskāravijñānānāṃ na dveṣadharmatā nāpi vigatadveṣadharmatā iyaṃ prajñāpāramitā /	K06D0014_H0014:31b-3	གཟུགས་ནི་། ཞེ་སྡང་གི་ཆོས་ཅན་ནམ་། ཞེ་སྡང་མེད་པའི་ཆོས་ཅན་མ་ཡིན་ནོ་༎ དེ་བཞིན་དུ་ཚོར་བ་དང་། འདུ་ཤེས་དང་། འདུ་བྱེད་རྣམས་དང་། རྣམ་པར་ཤེས་པ་ཡང་ཞེ་སྡང་གི་ཆོས་ཅན་ནམ་། ཞེ་སྡང་མེད་པའི་ཆོས་ཅན་ཡིན་ཏེ་། གཟུགས་དང་། ཚོར་བ་དང་། འདུ་ཤེས་དང་། འདུ་བྱེད་རྣམས་དང་། རྣམ་པར་ཤེས་པ་ཞེ་སྡང་གི་ཆོས་ཉིད་ཀྱང་མ་ཡིན་།
