src_segmentnr	src_original	tgt_segmentnr	tgt_original
T04ksmadhlu:1490	 yadi sāmānyena paramārthato dvayaviviktastvaṃ sādhayitumiṣyate tadā siddhasādhanameva,	T04D3888:257a-21	ཁྱེད་ཅག་གཉིས་པོ་དབེན་པ་ཙམ་༎ ཇི་སྟེ་སྒྲུབ་པར་འདོད་ན་ནི་༎ དེ་ནི་གྲུབ་པ་སྒྲུབ་ཡིན་ཏེ་༎
T04ksmadhlu:1491	 yato hi vayamapi paramārthato dvayasya mithyātvād viviktatvamevābhyupagacchāmaḥ /  yadi hyabhāvasvabhāvaḥ khalu paramārthata ākāravirahitavijñānatvena sādhayitumiṣyate,	T04D3888:257a-24	གང་ཕྱིར་བདེན་པ་ཉིད་མི་འདོད་༎ ཡིན་པས་སྒོ་ནས་ཤེས་པ་ལ་༎ གཉིས་ཀྱི་རྣམ་པ་དབེན་པ་ཉིད་༎
T04ksmadhlu:1493	 tadāpi siddhasādhanameva,	T04D3888:257a-27	སྒྲུབ་ན་འདིར་ཡང་འདོད་པ་དང་༎ མི་འགལ་ཕྱིར་ན་གྲུབ་པ་སྒྲུབ་༎
T04ksmadhlu:1494	 yato hi vayamapi paramārthataḥ sarvadharmāṇāmanutpannatvāt sarvavijñānāni tāvat paramārthato 'siddhāni dvayākārasuviyuktānītyabhyupagacchāmaḥ	T04D3888:257a-28	དོན་དམ་ཉིད་དུ་མ་སྐྱེས་པའི་༎ རྣམ་ཤེས་བདག་ཉིད་ཆོས་ཅན་ལ་༎ གཉིས་ཀྱི་རྣམ་པ་དབེན་པ་ཉིད་༎
T04ksmadhlu:1495	 yadi vijñānākhyaṃ dharmiṇaṃ dvayaviyuktatvena vastusattvena ca sādhayitumiṣyate tadā dṛṣṭāntavayāsiddhatvādanaikāntikattvaṃ hetoḥ,	T04D3888:257a-31	འདོད་ན་ཡང་དག་གང་ཞིག་ཡིན་༎ ཇི་སྟེ་གཉིས་མེད་ངོ་བོ་དང་༎ དངོས་པོ་ཉིད་དུའང་རྟོགས་བྱེད་ཅིང་༎ ཤེས་པ་གཉི་ག་སྒྲུབ་འདོད་ན་༎ དེ་ལྟར་རྗེས་འགྲོ་འདིར་མི་འགྲུབ་༎ དཔེ་ནི་བསྒྲུབ་བྱས་སྟོང་པ་སྟེ་༎ ཀུན་ཏུ་བརྟགས་པ་བརྗོད་པའི་ཕྱིར་།
T04ksmadhlu:1496	 bāhyārthasvabhāvānāṃ śītoṣṇīdīnāṃ samyagasiddhatvāt /	T04D3888:257a-37	ཡང་དག་པ་ཡི་དངོས་པོ་ཉིད་༎ དྲོ་བའི་རེག་པ་གྲུབ་པ་མེད་༎ ཕྱི་རོལ་དོན་གྱི་ངོ་བོ་རུ་༎ དྲོ་བའི་རེག་པ་འདོད་ན་ཡང་༎
