src_segmentnr	src_original	tgt_segmentnr	tgt_original
T04nagvigvu:465	 naitad iṣṭaṃ /  tatra yad uktaṃ svaparātmānau prakāśayaty agnir iti tan na //	T04D3832:130a-17	དེ་ནི་དེ་ལྟར་ཡང་མ་ཡིན་པས་དེ་ལ་མེ་ནི་རང་དང་གཞན་གྱིས་བདག་ཉིད་གཉིས་གསལ་བར་བྱེད་པ་ཡིན་ནོ་ཞེས་སྨྲས་པ་གང་ཡིན་པ་དེ་རུང་བ་མ་ཡིན་ནོ་༎
T04nagvigvu:467	 (Vv 282)  kiñcānyat /	T04D3832:130a-18	འདི་ལྟར་གཞན་ཡང་།
T04nagvigvu:469	 nāsti tamaś ca jvalane yatra ca tiṣṭhate parātmani jvalanaḥ /	T04D3832:130a-19	གསལ་བྱེད་དེ་ནི་མུན་སེལ་ཏེ་༎ མེ་དང་གང་ན་མི་གནས་པ་༎ གཞན་ནའང་མུན་པ་ཡོད་མིན་ན་༎
T04nagvigvu:47	 sarvatra cet punaḥ gṛhītaṃ tvadvacanaṃ sarvabhāvāś ca śūnyāḥ /	T04D3832:122a-10	གལ་ཏེ་ཐམས་ཅད་ཀྱི་ནང་དུ་ཁྱོད་ཀྱི་ཚིག་བསྡུས་སོ་ཞེ་ན་། དངོས་པོ་ཐམས་ཅད་སྟོང་པ་ཡིན་པས་དེས་ན་དེ་ཡང་སྟོང་པ་ཡིན་ནོ་༎
T04nagvigvu:470	 kurute kathaṃ prakāśaṃ sa hi prakāśo andhakāravadhaḥ // NagVv_37 //	T04D3832:130a-22	ཇི་ལྟར་གསལ་བར་བྱེད་པ་ཡིན་༎
T04nagvigvu:471	 iha cāgnau nāsti tamaḥ /  nāpi ca yatrāgnis tatrāsti tamaḥ /	T04D3832:130a-23	འདིར་མེ་ལ་ཡང་མུན་པ་མེད་ལ་༎ གང་ན་མེ་ཡོད་པ་དེ་ན་ཡང་མུན་པ་མེད་དོ་༎
T04nagvigvu:473	 prakāśaś ca nāma tamasaḥ pratighātas tatra katham asya tamasaḥ /  pratighātam agniḥ karoti /  yasya pratighātat svaparātmānau prakāśayatīti //	T04D3832:130a-25	གསལ་བར་བྱེད་པ་ཞེས་བྱ་བ་ནི་མུན་པ་སེལ་བ་ཡིན་པས་དེའི་ཕྱིར་མེ་ལ་ཡང་མུན་པ་མེད་ལ་། གང་ན་མེ་ཡོད་པ་དེ་ན་ཡང་མུན་པ་མེད་ན་མེད་གང་ཞིག་སེལ་བར་རང་དང་གཞན་གྱི་བདག་ཉིད་གཉིས་གསལ་བར་བྱེད་པའི་མེས་མུན་པ་གང་ཞིག་སེལ་བར་བྱེད་།
T04nagvigvu:48	 tena tad api śūnyaṃ śūnyatvād anena nāsti pratiṣedhaḥ / 4 /	T04D3832:122a-12	དེའི་ཕྱིར་འདིས་འགོག་པ་མེད་དོ་༎
T04nagvigvu:481	 yasmād utpadyamāna evobhayaṃ prakāśayaty agniḥ svātmānaṃ parātmānañ ceti /	T04D3832:130b-0	༄༡༣༠བ་མེ་གང་ན་ཡོད་པ་དེ་ན་ཡང་མུན་པ་མེད་དེ་དེའི་ཕྱིར་མེ་འབྱུང་བ་ཁོ་ན་རང་གི་བདག་ཉིད་དང་། གཞན་གྱི་བདག་ཉིད་གཉི་ག་གསལ་བར་བྱེད་པ་ཡིན་ནོ་ཞེ་ན་།
T04nagvigvu:482	 (Vv 284)  atrocyate	T04D3832:130b-1	འདིར་སྨྲས་པ་།
T04nagvigvu:484	 utpadyamāna eva prakāśayaty agnir ity asadvādaḥ /	T04D3832:130b-2	མེ་འབྱུང་བ་ན་གསལ་བྱེད་པ་༎ ཡང་དག་མིན་པར་སྨྲ་བ་སྟེ་༎
T04nagvigvu:485	 utpadyamāna eva prāpnoti tamo na hi hutāśaḥ // NagVv_38 //	T04D3832:130b-4	མེ་འབྱུང་བ་ན་མུན་པ་དང༎ ཕྲད་པ་མེད་པ་ཁོ་ན་ཡིན་༎
T04nagvigvu:486	 ayam agnir utpadyamāna eva prakāśayati svātmānaṃ parātmānañ ceti /  nāyam upapadyate vādaḥ /	T04D3832:130b-5	མེ་དེ་ནི་འབྱུང་བ་ཁོན་ན་རང་གི་བདག་ཉིད་དང་གཞན་གྱི་བདག་ཉིད་གསལ་བར་བྱེད་དོ་ཞེས་སྨྲ་བ་དེ་ནི་འཐད་པ་མ་ཡིན་ནོ་༎
T04nagvigvu:488	 kasmān na hy utpadyamāna evāgniḥ tamaḥ prāpnoti /	T04D3832:130b-6	ཅིའི་ཕྱིར་ཞེ་ན་། མེ་འབྱུང་བ་ཉིད་ན་མུན་པ་དང་ཕྲད་པ་མེད་པ་ཁོ་ན་ཡིན་།
T04nagvigvu:49	 atha śūnyam asti vānena pratiṣedhaḥ śūnyaḥ sarvabhāvā iti tena śūnyāpi sarvabhāvāḥ kāryakriyāsamarthā samarthabhaveyuḥ /  na caitad iṣṭaṃ / 5 /	T04D3832:122a-13	གལ་ཏེ་སྟོང་པ་ཡིན་ཡང་དངོས་པོ་ཐམས་ཅད་ནི་སྟོང་པའོ་ཞེས་འདིས་འགོག་པ་ཡོད་དོ་ཞེ་ན་། དེས་ན་དངོས་པོ་ཐམས་ཅད་སྟོང་པ་ཡིན་ཡང་བྱ་བ་བྱེད་ནུས་པར་འགྱུར་ཏེ་དེ་ནི་འདོད་པ་མ་ཡིན་ནོ་༎
T04nagvigvu:490	 tamasaś cānupaghātān nāsti prakāśaḥ /	T04D3832:130b-12	མུན་པ་མ་བསལ་བའི་ཕྱིར་གསལ་བར་ཡང་མི་བྱེད་དོ་༎
T04nagvigvu:491	 aprāpto 'pi jvalano yadi vā punar andhakāram upahanyāt /	T04D3832:130b-13	འདི་ལྟར་གཞན་ཡང་། ཡང་ན་མེ་དང་མ་ཕྲད་ཀྱང་༎ མུན་པ་སེལ་བར་བྱེད་ན་ནི་༎
T04nagvigvu:492	 sarveṣu lokadhātuṣu tamo 'yam iha saṃsthita upahanyāt // NagVv_39 //	T04D3832:130b-16	འདི་ན་ཡོད་པ་གང་ཡིན་པས་༎ ཇི་རྟེན་ཁམས་ཀུན་མུན་སེལ་འགྱུར་༎
T04nagvigvu:493	 athāpi manyase aprāpto 'py agnir andhakāram upahantīti /	T04D3832:130b-18	འོན་ཏེ་མེ་ནི་མུན་པ་དང་ཕྲད་པར་ཡང་སེལ་བར་བྱེད་དོ་སྙམ་དུ་སེམས་ན་།
T04nagvigvu:494	 nanv idānīm iha saṃsthito agniḥ sarvalokadhātustham upahaniṣyati tamaḥ tulyāyām aprāpto na caitad evaṃ dṛṣṭaṃ /	T04D3832:130b-19	འོན་ནི་དེ་མ་ཕྲད་པར་འདྲ་བས་འདི་ན་གནས་པའི་མེས་འཇིག་རྟེན་གྱི་ཁམས་ཐམས་ཅད་ན་གནས་པའི་མུན་པ་སེལ་བར་འགྱུར་བ་ཞིག་ན་།
T04nagvigvu:495	 tasmād aprāpyaivāgnir andhakāram upahantīti yad iṣṭaṃ / tan na /	T04D3832:130b-20	དེ་ནི་དེ་ལྟར་ཡང་མ་ཡིན་པས་དེའི་ཕྱིར་མེ་ནི་མུན་པ་དང་མ་ཕྲད་པར་སེལ་བར་བྱེད་པར་འདོད་པ་གང་ཡིན་པ་དེ་མི་རུང་ངོ་༎ འདི་ལྟར་གཞན་ཡང་།
T04nagvigvu:496	 (Vv 286)  yadi ca svataḥ pramāṇasiddhir anapekṣya te prameyāṇi /	T04D3832:130b-22	གལ་ཏེ་རང་ལས་ཚད་མ་གྲུབ་༎ གཞལ་བྱ་རྣམས་ལ་མ་ལྟོས་པར་༎ ཁྱོད་ཀྱི་ཚད་མ་འགྲུབ་འགྱུར་འདིར་༎ གལ་ཏེ་མེ་བཞིན་དུ་རང་ལས་ཚད་མ་གྲུབ་པོ་སྙམ་དུ་སེམས་ན་། གཞལ་བར་བྱ་བའི་དོན་རྣམས་ལ་མ་ལྟོས་པར་ཡང་ཚད་མ་རྣམས་རབ་ཏུ་འགྲུབ་པར་འགྱུར་རོ་༎ ཅིའི་ཕྱིར་ཞེ་ན་༏
T04nagvigvu:5	 na hi bije hetubhūte 'ṅkuro sti /	T04D3832:121a-10	མྱུ་གུ་ནི་རྒྱུ་ས་བོན་དུ་གྱུར་པ་ལ་ཡང་མེད་།
T04nagvigvu:502	 athāpekṣyate na svataḥ prasiddhiḥ /	T04D3832:130b-29	རང་ལས་གྲུབ་པ་ནི་གཞན་ལ་ལྟོས་པ་མ་ཡིན་ནོ་༎ འོན་ཏེ་ལྟོས་ན་ནི་རང་ལས་གྲུབ་པ་མ་ཡིན་ནོ་༎
T04nagvigvu:503	 atrāha / yadi nāpekṣyante prameyān arthān apramāṇāni ko doṣo bhaviṣyatīti / atrocyate /  anāpeksā hi prameyān arthān yadi te pramāṇasaṃsiddhiḥ /	T04D3832:130b-31	འདིར་སྨྲས་པ་། གལ་ཏེ་ཚད་མ་རྣམས་གཞལ་བར་བྱ་པའི་དོན་རྣམས་ལ་ནི་། མི་ལྟོས་ན་སྐྱོན་ཅིར་འགྱུར་ཞེ་ན་། འདིར་བཤད་པ་། གལ་ཏེ་གཞལ་བྱའི་དོན་རྣམས་ལ་། ༄༡༣༡ཨ་༌་༎ མ་ལྟོས་ཁྱོད་ཀྱི་ཚད་མ་འགྲུབ་༎
T04nagvigvu:505	 bhavati na bhavanti kasyacid evam imāni pramāṇāni // NagVv_41 //	T04D3832:131a-1	ཚད་མ་འདི་རྣམས་ཁོ་ན་ནི་༎ གང་གིའང་ཡིན་པར་མི་འགྱུར་རོ་༎
T04nagvigvu:506	 yadi prameyān arthān anapekṣya siddhir bhavati pramāṇānām iti /	T04D3832:131a-3	གལ་ཏེ་ཚད་མ་རྣམས་གཞལ་བར་བྱ་བ་དོན་རྣམས་ལ་མི་ལྟོས་པར་རབ་ཏུ་འགྲུབ་པ་ཡིན་ནོ་ཞེ་ན་།
T04nagvigvu:507	 tānīmāni pramāṇāni na kasyacit pramāṇāni bhavanti /  evaṃ doṣaḥ //	T04D3832:131a-4	དེ་ལྟ་ན་ནི་ཁྱོད་ཀྱིས་ཚད་མ་འདི་རྣམས་གང་གི་ཕྱིར་ཚད་མ་ཡང་མ་ཡིན་པའི་སྐྱོན་དེ་ལྟ་བུར་འགྱུར་རོ་༎
T04nagvigvu:51	 atha śūnyāḥ sarvabhāvāḥ na ca kāryaṃ kriyāsamarthaṃ bhavaṃti mā bhūt dṛṣṭāntavirodha iti kṛtvā śūnyena tvadvacanena sarvabhāvāsvabhāvo pratiṣedho nopapanna iti / 6 /  kiñcānyat / evaṃ tadastitvāt vaiṣamikatvaprasaṅgaḥ /	T04D3832:122a-15	གལ་ཏེ་འགལ་བའི་དཔེར་གྱུར་ནས་མི་རུང་ངོ་སྙམ་ནས་དངོས་པོ་ཐམས་ཅད་སྟོང་པ་ཡིན་ཏེ་བྱ་བ་བྱེད་མི་ནུས་སོ་ཞེ་ན་། ཁྱོད་ཀྱི་ཚིག་སྟོང་བས་ཀྱང་དངོས་པོ་ཐམས་ཅད་ཀྱི་རང་བཞིན་འགོག་པར་མི་འཐད་དོ་༎
T04nagvigvu:510	 naivedānīm anapekṣya prameyān arthān pramāṇāni bhavanti //  (Vv 288)	T04D3832:131a-6	དེ་གཞལ་བར་བྱ་བའི་དོན་རྣམས་ལ་མི་ལྟོས་པར་ཚད་མ་རྣམས་སུ་འགྱུར་བ་མ་ཡིན་ནོ་༎
T04nagvigvu:512	 atha matam apekṣa siddhis teṣām iti atra bhavati ko doṣaḥ /	T04D3832:131a-7	འོན་ཏེ་ལྟོས་ནས་དེ་རྣམས་འགྲུབ་༎
T04nagvigvu:530	 kin te pramāṇasiddhyā tāni yad arthaṃ prasiddhaṃ tata // NagVv_44 //	T04D3832:131a-29	གང་ཕྱིར་ཁྱོད་ཀྱི་དེ་གྲགས་པ་༎ ཚད་མ་གྲུབ་པས་ཅི་ཞིག་བྱ་༎
T04nagvigvu:531	 yadi ca manyase 'napekṣyaiva pramāṇāni prameyānāṃ prasiddhir bhavati /	T04D3832:131a-31	གལ་ཏེ་ཚད་མ་རྣམས་ལ་མ་ལྟོས་པར་གཞལ་བར་བྱ་བ་རྣམས་འགྲུབ་པོ་སྙམ་དུ་སེམས་ན་།
T04nagvigvu:532	 kim idānīṃ te pramāṇasiddhyā paryanviṣṭayā kiṃ kāraṇaṃ /	T04D3832:131a-32	ཅི་དེ་ཁྱོད་ཀྱི་ཚད་མ་གྲུབ་པར་ཡོངས་སུ་བརྟག་པས་ཅི་ཞིག་བྱ་༎
T04nagvigvu:534	 te prameyārthā vinā pramāṇaiḥ siddhāḥ tatra kiṃ pramāṇaiḥ kṛtyaṃ /  atha tu pramāṇasiddhir bhavaty apekṣyaiva te prameyāṇi /	T04D3832:131a-33	ཅིའི་ཕྱིར་ཞེ་ན་། གང་གི་དོན་དུ་ཁྱོད་ཀྱི་ཚད་མ་དེ་རྣམས་ཡོངས་སུ་བརྟག་པའི་གཞལ་བར་བྱ་བའི་༄༡༣༡བ་དོན་དེ་རྣམས་ནི་ཚད་མ་རྣམས་མེད་པར་ཡང་གྲུབ་པ་ཡིན་པས་དེ་ལ་ཁྱོད་ཀྱི་ཚད་མ་རྣམས་ཀྱིས་ཅི་ཞིག་བྱ་།
T04nagvigvu:541	 prameyaiḥ sādhitatvat /  pramāṇāni ca prameyāṇi bhavanti /  pramāṇānāṃ sādhakatvāt /	T04D3832:131b-1	ཅི་སྟེ་ཁྱོད་ཀྱི་ཚད་མ་རྣམས་༎ གཞལ་བྱ་རྣམས་ལ་ལྟོས་ནས་འགྲུབ་༎
T04nagvigvu:545	 atha te pramāṇasiddhyā prameyasiddhiḥ prameyasiddhyā ca /	T04D3832:131b-3	དེ་ལྟར་ཁྱོད་ཀྱི་ཚད་མ་རྣམས་༎ གཞལ་བྱ་ངེས་པར་བཟློག་པར་འགྱུར་༎ ཅི་སྟེ་སྔར་སྨྲས་པའི་སྐྱོན་དུ་འགྱུར་བ་ན་མི་རུང་ངོ་སྙམ་ནས་ཚད་མ་རྣམས་ནི་གཞལ་བར་བྱ་བའི་དོན་རྣམས་ལ་ལྟོས་པ་ཡིན་ནོ་སྙམ་དུ་སེམས་ན་དེ་ལྟ་ན་ནི་ཁྱོད་ཀྱི་ཚད་མ་དང་གཞལ་བར་བྱ་བ་རྣམས་བཟློག་པར་འགྱུར་གཞལ་བར་བྱ་བ་རྣམས་ཀྱིས་རབ་ཏུ་བསྒྲུབ་པའི་ཕྱིར་རོ་༎ གཞལ་བར་བྱ་བ་ཡང་ཚད་མ་རྣམས་སུ་འགྱུར་ཏེ་།
T04nagvigvu:546	 bhavati pramāṇasiddhiḥ nāsty ubhayasyāpi te siddhiḥ // NagVv_46 //	T04D3832:131b-9	ཚད་མ་རྣམས་སྒྲུབ་པར་བྱེད་པ་ཡིན་པའི་ཕྱིར་རོ་༎ འོན་ཏེ་ཁྱོད་ཀྱིས་ཚད་གྲུབ་པས་༎ གཞལ་བར་བྱ་བ་འགྲུབ་འགྱུར་ལ་༎ གཞལ་བྱ་གྲུབ་པས་ཚད་གྲུབ་ན་༎ ཁྱོད་ཀྱིས་གཉི་གའང་འགྲུབ་མི་འགྱུར་༎ འོན་ཏེ་ཚད་མ་གྲུབ་པས་གཞལ་བར་བྱ་བ་འགྲུབ་པར་འགྱུར་ཏེ་།
T04nagvigvu:547	 atha manyase pramāṇasiddhyā prameyasiddhir bhavati pramāṇāpekṣatvāt /  prameyasiddhyā ca pramāṇasiddhir bhavati prameyāpekṣatvād iti //	T04D3832:131b-15	ཚད་མ་ལ་ལྟོས་པའི་ཕྱིར་རོ་༎ གཞལ་བར་བྱ་བ་འགྲུབ་པས་ཀྱང་ཚད་མ་འགྲུབ་པར་འགྱུར་ཏེ་། གཞལ་བར་བྱ་བ་ལ་ལྟོས་པའི་ཕྱིར་རོ་སྙམ་དུ་སེམས་ན་།
T04nagvigvu:549	 evaṃ saty ubhayasyāpi siddhir na .y. + + + + ṇaṃ	T04D3832:131b-18	དེ་ལྟ་ན་ནི་ཁྱོད་ཀྱིས་གཉི་ག-ཡང་འགྲུབ་པར་མི་འགྱུར་རོ་༎
T04nagvigvu:55	 yena hi viśeṣahetunā kiñcit śūnyaṃ kiñcid aśūnyaṃ syāt /  sa ca nopadiṣṭo hetuḥ /	T04D3832:122a-17	ཇི་ལྟར་གཞན་ཡང་དེ་སྐད་ཟེར་ན་ནི་ཁ་ཅིག་ནི་སྟོང་། ཁ་ཅིག་ནི་མི་སྟོང་ངོ་ཞེས་མི་འདྲ་བ་ཉིད་དུ་ཐལ་བར་འགྱུར་རོ་༎ མི་འདྲ་བ་ཉིད་ཡིན་ན་ནི་གང་གིས་ན་ཁ་ཅིག་ནི་སྟོང་ཁ་ཅིག་ནི་མི་སྟོང་པར་གྱུར་པའི་གཏན་ཚིགས་ཀྱི་ཁྱད་པར་ཡང་སྨྲོས་ཤིག་།
T04nagvigvu:550	 sidhyanti hi pramāṇair yadi prameyāṇi tāni tair evā /  sādhyāni ca prameyais tāni kathaṃ sādhayiṣyanti // NagVv_47 //  yadi hi pramāṇaiḥ pramayāṇi sidhyanti tāni pramāṇāni tair eva prameyaiḥ sādhayitavyāni /  nanv asiddheṣu prameyeṣu kāraṇasyāsiddhatvād asiddhāni kathaṃ sādhayisyanti prameyāṇīti /	T04D3832:131b-19	ཅིའི་ཕྱིར་ཞེ་ན་། གལ་ཏེ་ཚད་མས་གཞལ་བྱ་འགྲུབ་༎ གཞལ་བྱ་དེ་དག་རྣམས་ཀྱིས་ཀྱང་༎ དེ་དག་བསྒྲུབ་པར་བྱ་ཡིན་ན་༎ དེ་དག་ཇི་ལྟར་བསྒྲུབ་པར་འགྱུར་༎ གལ་ཏེ་ཚད་མ་རྣམས་ཀྱིས་ནི་གཞལ་བར་བྱ་བ་རྣམས་འགྲུབ་པར་བྱེད་ལ་།
T04nagvigvu:557	 yadi prameyaiḥ pramāṇāni sidhyanti tāni ca prameyāṇi tair eva pramāṇaiḥ sādhayitavyānīti /	T04D3832:131b-31	གལ་ཏེ་ཡང་གཞལ་བར་བྱ་བ་རྣམས་འགྲུབ་པར་འགྱུར་ལ་། ཚད་མ་དེ་རྣམས་ཀྱིས་ཀྱང་གཞལ་བར་བྱ་བ་དེ་དག་བསྒྲུབ་པར་བྱ་བ་ཡིན་ནོ་ཞེ་ན་།
T04nagvigvu:558	 nanv asiddheṣu pramāṇeṣu kāraṇasyāsiddhatvād asiddhāni kathaṃ sādhayiṣyanti pramāṇāni /	T04D3832:132a-0	འོན་ཚད་མ་མ་གྲུབ་པ་༄༡༣༢ཨ་༌་༎ རྣམས་ཀྱི་རྒྱུ་ཡིན་ན་རྒྱུ་རབ་ཏུ་མ་གྲུབ་པའི་ཕྱིར་ཚད་མ་མ་གྲུབ་པ་དག་ཇི་ལྟར་བསྒྲུབ་པར་འགྱུར་།
T04nagvigvu:559	 pitra yady utpādyaḥ putro yadi tena caiva putreṇa /	T04D3832:132a-2	གལ་ཏེ་ཕ་ཡིས་བུ་བསྐྱེད་བྱ་༎
T04nagvigvu:563	 tatredānīṃ brūhi kena ka utpādayitavyaḥ /	T04D3832:132a-3	གལ་ཏེ་བུ་དེ་ཉིད་ཀྱིས་ཀྱང་༎ ཅི་སྟེ་ཕ་དེ་བསྐྱེད་བྱ་ན་༎ དེ་ནི་གང་གིས་གང་བསྐྱེད་སྨྲོས་༎
T04nagvigvu:565	 pramāṇaiḥ prameyāni sādhayitavyāni tāny eva ca punaḥ pramāṇāni taiḥ prameyaiḥ tatredānīṃ tu katamaiḥ katamāni sādhayitavyāni /  (Vv 296)	T04D3832:132a-8	ད་དེ་ན་གང་གིས་གང་བསྐྱེད་པར་སྨྲོས་ཤིག་ཅེས་བྱ་བ་དེ་བཞིན་དུ་ཁྱོད་ན་རེ་ཚད་མ་རྣམས་ཀྱིས་གཞལ་བར་བྱ་བ་དག་བསྒྲུབ་པར་བྱ་བ་ཡིན་ལ་། ཚད་མ་དེ་དག་ཉིད་ཀྱང་གཞལ་བར་བྱ་བ་དེ་དག་ཉིད་ཀྱིས་བསྒྲུབ་པར་བྱ་བ་ཡིན་ནོ་ཞེས་ཟེར་བ་།
T04nagvigvu:567	 kaś ca pitā kaḥ putraḥ tatra tvaṃ brūhi kathaṃ tāv ubhāv api ca /	T04D3832:132a-10	ད་དེ་ན་ཁྱོད་ཀྱིས་གང་དག་གིས་གང་དག་རབ་ཏུ་བསྒྲུབ་པར་བྱ་བ་ཡིན་ནོ་༎
T04nagvigvu:568	 pitreputralakṣaṇadharau yato nas tatra saṃdehaḥ // NagVv_50 //	T04D3832:132a-11	དེ་དག་གཉི་གའང་ཕ་དང་བུའི་༎ མཚན་ཉིད་འཛིན་པས་དེ་ཡི་ཕྱིར་༎ དེ་ལ་ཁོ་བོ་ཐེ་ཚོམ་གྱུར་༎
T04nagvigvu:569	 tayoś ca pūrvopadiṣṭayoḥ pitāputrayoḥ vada kataraḥ putraḥ kataraḥ pitā ubhāv api tāv utpādakatvāt pitṛlakṣaṇadharau /	T04D3832:132a-14	དེ་ན་ཕ་གང་བུ་གང་སྨྲོས་༎ གང་གི་ཕྱིར་ཕ་དང་བུ་སྔར་བསྟན་པ་དེ་གཉིས་ལས་། བུ་ནི་གང་ཕ་ནི་གང་དེ་གཉི་ག་ཡང་སྐྱེད་པར་བྱེད་པ་ཡིན་པའི་ཕྱིར་ཕའི་མཚན་ཉིད་འཛིན་པར་བྱེད་པ་ཡིན་ལ་།
T04nagvigvu:57	 tatra yad uktaṃ śūnyāḥ sarvabhāvā iti tan na //  (Vv 224)	T04D3832:122a-20	གཏན་ཚིགས་དེ་ཡང་མ་བརྟན་པས་དེ་ལ་དངོས་པོ་ཐམས་ཅད་ནི་སྟོང་པའོ་ཞེས་སྨྲས་པ་གང་ཡིན་པ་དེ་མི་རུང་ངོ་༎
T04nagvigvu:570	 utpādyatvāc ca putralakṣaṇadharāv atra naḥ sandeho bhavati /  kataras tatra pitā kataras tatra putra iti /  evam eva yāny etāni bhavati /	T04D3832:132a-17	བསྐྱེད་པར་བྱ་བ་ཡིན་པའི་ཕྱིར་བུའི་མཚན་ཉིད་འཛིན་པ་ཡིན་པས་འདི་ལ་ཁོ་བོ་ཐེ་ཚོམ་དུ་གྱུར་ན་དེ་ལ་ཕ་ནི་གང་བུ་ནི་གང་ཞེས་བྱ་བ་དེ་བཞིན་དུ་ཁྱོད་ཀྱིས་ཚད་མ་དང་གཞལ་བར་བྱ་བ་གང་དག་ཡིན་པ་དེ
T04nagvigvu:573	 pramāṇaprameyaṇi /  tatra katarāṇi pramāṇāni katarāṇi prameyāṇi /	T04D3832:132a-18	དག་ཀྱང་དེ་ནི་ཚད་མ་དག་ནི་གང་ཡིན་། གཞལ་བར་བྱ་བ་དག་ནི་གང་ཡིན་།
T04nagvigvu:575	 ubhayāny api hy etāni pramāṇāni tāni prameyāṇi sādhyatvāt prameyāṇīti /	T04D3832:132a-20	འདི་དག་གཉི་ག་ཡང་རབ་ཏུ་སྒྲུབ་པར་བྱེད་པ་ཡིན་པའི་ཕྱིར་ཚད་མ་དག་ཡིན་ལ་།
T04nagvigvu:584	 nāpi parasyāt pratyakṣasyānumānopamānāgamair anumānasya pratyakṣopamānāgamair upamānasya pratyakṣānumānāgamaiḥ /	T04D3832:132b-0	མངོན་སུམ་ནི་རྗེས་སུ་དཔག་པ་དང་། དཔེས་འཇལ་བ་༄༡༣༢བ་དང་༏་ལུང་རྣམས་ཀྱིས་དང་། རྗེས་སུ་དཔག་པ་ནི་མངོན་སུམ་དང་། དཔེ་འཇལ་བ་དང་། ལུང་རྣམས་ཀྱིས་དང་། དཔེས་འཇལ་བ་ནི་མངོན་སུམ་དང་རྗེ་སུ་དཔག་པ་དང་། ལུང་རྣམས་ཀྱིས་དང་། ལུང་ནི་མངོན་སུམ་དང་། རྗེས་སུ་དཔག་པ་དང་། དཔེས་འཇལ་བས་ཀྱང་མ་ཡིན་ལ་། རང་གི་ཇི་ལྟ་བ་བཞིན་དུ་།
T04nagvigvu:585	 āgamasya pratyakṣānumānopamānaiḥ /	T04D3832:132b-3	མངོན་སུམ་དང་རྗེས་སུ་དཔག་པ་དང་། དཔེས་འཇལ་བ་དང་། ལུང་རྣམས་ཀྱིས་ནི་མངོན་སུམ་དང་། རྗེས་སུ་དཔག་པ་དང་། དཔེས་འཇལ་བ་དང་། ལུང་གཞན་རྣམས་ཀྱིས་ཀྱང་མ་ཡིན་ལ་།
T04nagvigvu:586	 nāpi pratyakṣānumānopamānāgamād anyaiḥ pratyakṣānumānopamānāgamair yathāsvaṃ nāpi prameyaiḥ samastavyastaiḥ svaviṣayaparaviṣatāgṛhītaiḥ nāpy akasmān nāsti samuccayena /	T04D3832:132b-4	གཞལ་བར་བྱ་བ་རང་དང་གཞན་གྱིས་བསྡུས་པ་མཐའ་དག་དང་། རེ་རེས་ཀྱང་མ་ཡིན་ལ་། རྒྱུ་མེད་པས་ཀྱང་མ་ཡིན་ལ་། ཀུན་བསྡུས་པས་ཀྱང་མ་ཡིན་ནོ་༎
T04nagvigvu:587	 eteṣāṃ kāraṇānāṃ pūrvoddiṣṭānāṃ viṃśas triṃśac catvāriśat ṣaṭviṃśatir vā tatra yad uktaṃ /	T04D3832:132b-7	གཏན་ཚིགས་སྔར་བསྟན་པ་དེ་དག་ནི་། ཉི་ཤུའམ་། སུམ་ཅུའམ་། བཞི་བཅུའམ་། སུམ་ཅུ་རྩ་དྲུག་གིས་ཀྱང་མི་བསྒྲུབ་ན་།
T04nagvigvu:59	 kiñcānyat	T04D3832:122a-21	འདི་ལྟར་གཞན་ཡང་།
