src_segmentnr	src_original	tgt_segmentnr	tgt_original
T04nagvigvu:591	 kuśalānāṃ dharmāṇāṃ dharmāvasthāvidaś ca manyante /  kuśalaṃ janasvabhāvaṃ manyante śeṣeṣv apy eṣa viniyogaḥ / [7]	T04D3832:132b-13	སྐྱེ་བོ་ཆོས་ཀྱི་གནས་སྐབས་མཁས་༎ དགེ་བ་དག་གི་ཆོས་རྣམས་ལ་༎ དགེ་བའི་རང་བཞིན་ཡིན་པར་ནི་༎ སེམས་ཤིང་ལྷག་མ་རྣམས་དང་ཡང་༎
T04nagvigvu:593	 atra brūmaḥ /	T04D3832:132b-17	ཞེས་སྨྲས་པ་གང་ཡིན་པ་དེ་ལ་བཤད་པར་བྱ་སྟེ་།
T04nagvigvu:594	 kuśalānāṃ dharmāṇāṃ dharmāvasthavido brūvate yat /	T04D3832:132b-18	ཆོས་ཀྱི་གནས་སྐབས་རབ་མཁས་པ་༎
T04nagvigvu:599	 idaṃ tatkuśalavijñānam ayaṃ kuśalavijñānasvabhāva evaṃ sarveṣāṃ na caitad evaṃ dṛṣṭaṃ /	T04D3832:132b-19	དགེ་བ་ཡིན་ནི་ཆོས་རྣམས་ཀྱི་༎ དགེ་བའི་རང་བཞིན་སྨྲ་བ་གང་༎ དེ་ལྟར་རབ་ཕྱེ་བརྗོད་བྱ་ཡིན་༎ ཆོས་ཀྱི་གནས་སྐབས་ལ་མཁས་པ་དགེ་བའི་ཆོས་ཀྱི་དགེ་བའི་རང་གི་ངོ་བོ་སེམས་པ་དེ་ཡང་ཁྱོད་ཀྱིས་རབ་ཏུ་ཕྱེ་སྟེ་། འདི་ནི་དགེ་པའི་རང་གི་ངོ་བོ་ཡིན་།
T04nagvigvu:6	 na pṛthivyaptejovāyvādinām ekekasmin pratyayasaṃjñite /	T04D3832:121a-11	རྐྱེན་ཞེས་བྱ་བས་དང་ཆུ་དང་མེ་དང་རླུང་ལ་སོགས་པ་རེ་རེ་ལ་ཡང་མེད་།
T04nagvigvu:60	 mā śabdavad ity etat syāt te buddhir na caitad upapannam /	T04D3832:122a-22	དེ་སྒྲ་མ་འབྱིན་ལྟ་བུའོ་ཞེས་། ཁྱོད་བློ་སེམས་ན་དེ་མི་འཐད་༎
T04nagvigvu:600	 tasmād yad uktam upadiṣṭaḥ svabhāvo dharmāṇām iti tan na //  (Vv 302)	T04D3832:132b-24	འདི་དག་ནི་དགོ་བའི་ཆོས་དེ་དག་ཡིན་ཏེ་། འདི་ནི་དགེ་བ་དེ་རྣམ་པར་ཤེས་པ་ཡིན་། འདི་ནི་དགེ་བ་དེ་རྣམ་པར་ཤེས་པའི་རང་གི་ངོ་བོ་ཡིན་། དེ་བཞིན་དུ་ཐམས་ཅད་ལ་བསྟན་པར་བྱ་བ་ཡིན་ནོ་། དེ་ཡང་དེ་ལྟར་མ་བསྟན་པས་དེའི་ཕྱིར་རང་༄༡༣༣ཨ་༌་༎ གི་ངོ་བོ་ཇི་ལྟ་བ་བཞིན་དུ་ཆོས་རྣམས་ཀྱི་རང་གི་ངོ་བོ་བསྟན་ཏོ་ཞེས་སྨྲས་པ་གང་ཡིན་པ་དེ་མི་རུང་ངོ་༎
T04nagvigvu:602	 kiñcānyat /	T04D3832:133a-2	འདི་ལྟར་གཞན་ཡང་།
T04nagvigvu:603	 yadi ca pratītya kuśalaḥ svabhāva utpadyate sa kuśalānām /	T04D3832:133a-3	གལ་ཏེ་དགེ་བའི་ཆོས་རྣམས་ཀྱི་༎ དགེ་བའི་རང་གི་ངོ་བོ་དེ་༎ བརྟེན་ནས་སྐྱེ་ན་དེ་ལྟ་ན་༎
T04nagvigvu:604	 dharmāṇāṃ parabhāvaḥ svabhāva eva kathaṃ bhavati // NagVv_53 //	T04D3832:133a-6	གཞན་དངོས་རང་ངོར་ཇི་ལྟར་འགྱུར༎
T04nagvigvu:605	 yadi ca kuśalānāṃ dharmāṇāṃ svabhāvo hetupratyayasāmagrīṃ pratītyotpadyate /	T04D3832:133a-7	གལ་ཏེ་དགེ་བའི་ཆོས་རྣམས་ཀྱི་རང་གི་ངོ་བོ་ནི་རྒྱུ་དང་རྐྱེན་ཚོགས་པ་ལ་བརྟེན་ནས་སྐྱེའོ་ཞེ་ན་།
T04nagvigvu:606	 parabhāvād utpannaḥ kuśalānāṃ dharmāṇāṃ kathaṃ svabhāvo bhavati /	T04D3832:133a-8	དེ་གཞན་གྱི་དངོས་པོ་ལ་བརྟེན་ནས་སྐྱེས་པ་ཡིན་ན་། དགེ་བའི་ཆོས་རྣམས་ཀྱི་རང་གི་ངོ་བོར་ཇི་ལྟར་འགྱུར་།
T04nagvigvu:607	 evam evākuśalaprabhṛtīnāṃ /	T04D3832:133a-10	མི་དགེ་བ་ལ་སོགས་པ་དག་ལ་ཡང་དེ་བཞིན་དུ་སྦྱར་རོ་༎
T04nagvigvu:609	 kuśalāvyākṛtānāṃ nā .y. + + + dharmāṇāṃ kuśalaḥ svabhāvopadiṣṭaḥ /  evam akuśalānām akuśalādir iti / tan na //	T04D3832:133a-12	དེ་བཞིན་དུ་མི་དགེ་བ་ལ་སོགས་པའི་ཆོས་རྣམས་ཀྱི་མི་དགེ་བ་ལ་སོགས་པའི་རང་གི་ངོ་བོ་ཡང་བསྟན་པ་ཡིན་ནོ་ཞེས་སྨྲས་པ་གང་ཡིན་པ་དེ་མི་རུང་ངོ་༎
T04nagvigvu:61	 śabdenātra satā bhaviṣyato vāraṇaṃ tasya // NagVv_3 //  syāt te buddhiḥ yathā nāma kaścit brūyāt mā śabdaṃ kārṣīr mā śabdaṃ kārṣīr iti /  tena ca śabdena vyāvartanaṃ kriyate /	T04D3832:122a-26	དཔེར་ན་ཁ་ཅིག་ན་རེ་སྒྲ་མ་འབྱིན་ཅིག་ཅེས་བདག་ཉིད་སྒྲ་འབྱིན་ཏེ་། སྒྲ་དེས་སྒྲ་ཟློག་པར་བྱེད་དོ་༎
T04nagvigvu:611	 kiñcānyat /	T04D3832:133a-13	འདི་ལྟར་གཞན་ཡང་།
T04nagvigvu:612	 atha na pratītya kiñcit svabhāva utpadyate sa kuśalānām /	T04D3832:133a-14	འོན་ཏེ་དགེ་བའི་ཆོས་རྣམས་ཀྱི་༎ རང་གི་ངོ་བོ་དེ་འགའ་ལ་འང་༎ མ་བརྟེན་སྐྱེ་ན་དེ་ལྟ་ནའང་༎
T04nagvigvu:613	 dharmāṇām evaṃ syād vāso na brahmacaryasya // NagVv_54 //	T04D3832:133a-17	ཚངས་པར་སྤྱོད་ལ་གནས་མི་འགྱུར་༎
T04nagvigvu:614	 atha manyase /  na kiñcit pratītya kuśalānāṃ dharmāṇāṃ kuśalasvabhāva utpadyate /  evam akuśalānāṃ dharmāṇām akuśalaḥ avyākṛtānām avyākṛta iti /	T04D3832:133a-18	འོན་ཏེ་དགེ་བའི་ཆོས་རྣམས་ཀྱི་དགེ་བའི་རང་གི་ངོ་བོ་ནི་འགའ་ལའང་མ་བརྟེན་པར་སྐྱེ་ལ་། མི་དགེ་བ་ལ་སོགས་པ་དག་གི་ཡང་དེ་ལྟ་བུ་ཡིན་ནོ་སྙམ་དུ་སེམས་ན་།
T04nagvigvu:617	 evaṃ saty abrahmacaryavāso bhavati kiṃ kāraṇaṃ /	T04D3832:133a-20	དེ་ལྟ་ན་ནི་ཚངས་པར་སྤྱོད་པ་ལ་གནས་པར་མི་འགྱུར་རོ་༎ ཅིའི་ཕྱིར་ཞེ་ན་།
T04nagvigvu:618	 pratītyasamutpādasya hi evaṃ sati pratyākhyānaṃ bhavati /  pratītyasamutpādasya pratyākhyānāt pratītyasamutpādadarśaṇaṃ pratyākhyānaṃ bhavati /	T04D3832:133a-22	དེ་ལྟ་ཡིན་ན་ནི་རྟེན་ཅིང་འབྲེལ་པར་འབྱུང་བ་བཏང་བ་ཡིན་ནོ་༎ རྟེན་ཅིང་འབྲེལ་བར་འབྱུང་བ་གཏང་བའི་ཕྱིར་། རྟེན་ཅིང་འབྲེལ་པར་འབྱུང་བ་མཐོང་བ་བཏང་བ་ཡིན་ཏེ་། རྟེན་ཅིང་འབྲེལ་པར་འབྱུང་བ་ཡོད་པ་མ་ཡིན་པ་ནི་མཐོང་བ་སྟེ་།
T04nagvigvu:620	 na hy avidyamānasya pratītyasamutpādasya darśanam utpadyamānaṃ bhavati /  asati pratītyasamutpādadarśane dharmadarśanaṃ na bhavati /	T04D3832:133a-26	དམིགས་པར་འཐད་པ་མ་ཡིན་ནོ་༎ རྟེན་ཅིང་འབྲེལ་པར་འབྱུང་བ་མཐོང་བ་མེད་ན་། ཆོས་མཐོང་བ་མེད་པ་ཡིན་ནོ་༎
T04nagvigvu:622	 uktaṃ hi /  bhagavatā yo hi bhikṣavaḥ pratītyasamutpādaṃ paśyati sa dharmaṃ paśyati /	T04D3832:133a-29	བཅོམ་ལྡན་འདས་ཀྱིས་ནི་དགེ་སློང་སུས་རྟེན་ཅིང་འབྲེལ་བར་འབྱུང་བ་མཐོང་བ་དེས་ཆོས་མཐོང་ངོ་ཞེས་གསུངས་སོ༎
T04nagvigvu:624	 dharmadarśanābhāvād brahmacaryavāsābhāvaḥ //  (Vv 304)	T04D3832:133a-30	ཆོས་མཐོང་བ་མེད་པའི་ཕྱིར་ཚངས་པར་སྤྱོད་པ་ལ་གནས་པ་མེད་པ་ཡིན་ནོ་༎
T04nagvigvu:626	 athavā pratītyasamutpādapratyākhyānāt /  duḥkhasamudāyapratyākhyānaṃ bhavati /	T04D3832:133a-31	ཡང་ན་རྟེན་ཅིང་འབྲེལ་པར་འབྱུང་བ་བཏང་བས་སྡུག་བསྔལ་ཀུན་འབྱུང་བ་བཏང་བ་ཡིན་ཏེ་།
T04nagvigvu:628	 pratītyasamutpādo hi duḥkhasya samudayaḥ /	T04D3832:133a-32	སྡུག་བསྔལ་ཀུན་འབྱུང་བ་ནི་རྟེན་ཅིང་འབྲེལ་པར་འབྱུང་བ་ཡིན་པས་སོ་༎
T04nagvigvu:629	 duḥkhasamudayasya pratyākhyānād duḥkhapratyākhyānaṃ bhavati /	T04D3832:133b-0	སྡུག་བསྔལ་ཀུན་འབྱུང་བ་༄༡༣༣བ་བཏང་བས་སྡུག་བསྔལ་བཏང་བ་ཡིན་ཏེ་།
T04nagvigvu:630	 asati hi samudaye tat kuto duḥkhaṃ samudeṣyati /	T04D3832:133b-1	ཀུན་འབྱུང་བ་མེད་ན་གང་ལས་སྡུག་བསྔལ་ཀུན་འབྱུང་བར་འགྱུར་།
T04nagvigvu:631	 duḥkhasamudayapratyākhyānāc ca duḥkhanirodhasya pratyākhyānaṃ /	T04D3832:133b-2	སྡུག་བསྔལ་གཏང་བའི་ཕྱིར་དང་། ཀུན་འབྱུང་བ་གཏང་བའི་ཕྱིར་དང་། སྡུག་བསྔལ་འགོག་པ་བཏང་བ་ཡིན་ཏེ་།
T04nagvigvu:632	 asati hi duḥkhasamudaye kasya prahāṇān nirodho bhaviṣyati /	T04D3832:133b-3	སྡུག་བསྔལ་དང་ཀུན་འབྱུང་བ་གཉིས་མེད་ན་གང་ཞིག་སྤངས་པས་འགོག་པར་འགྱུར་བས་སོ་༎
T04nagvigvu:633	 asati hi duḥkhanirodhe kasya prāptaye mārgo bhaviṣyati /  duḥkhanirodhagāmī /	T04D3832:133b-4	སྡུག་བསྔལ་འགོག་པ་མེད་ན་གང་ཞིག་ཐོབ་པར་བྱ་བའི་ཕྱིར་སྡུག་བསྔལ་འགོག་པར་འགྱུར་བའི་ལམ་དུ་འགྱུར་།
T04nagvigvu:635	 evaṃ caturṇām āryasatyānām abhāvāc chrāmaṇyaphalābhāvaḥ /	T04D3832:133b-5	དེས་ན་འཕགས་པའི་བདེན་པ་བཞི་དག་མེད་པར་འགྱུར་ཏེ་། དེ་མེད་པའི་ཕྱིར་དགེ་སྦྱོང་གི་ཚུལ་གྱི་འབྲས་བུ་མེད་པར་འགྱུར་ཏེ་།
T04nagvigvu:636	 satyadarśanādiśramaṇyaphalāni samādhigamyante /	T04D3832:133b-7	བདེན་པ་མཐོང་བ་ལས་དགེ་སྦྱོང་གི་ཚུལ་གྱི་འབྲས་བུ་རྣམས་ཡང་དག་པར་འཐོབ་པས་སོ་༎
T04nagvigvu:637	 śrāmaṇyaphalānām abhāvād abrahmacaryavāsa iti //	T04D3832:133b-8	དགེ་སྦྱོང་གི་ཚུལ་གྱི་འབྲས་བུ་རྣམས་མེད་པས་ཚངས་པར་སྤྱོད་པ་ལ་གནས་པར་མི་འགྱུར་རོ་༎
T04nagvigvu:64	 evam eva śūnyāḥ sarvabhāvā iti /  śūnyena vacanena sarvatā sarvabhāvasvabhāvavyāvartanaṃ kriyata iti /	T04D3832:122a-28	དེ་བཞིན་དུ་དངོས་པོ་ཐམས་ཅད་ནི་སྟོང་པ་ཞེས་སྟོང་པའི་རང་བཞིན་གྱི་ཚིག་གིས་དངོས་པོ་ཐམས་ཅད་ཀྱི་རང་བཞིན་ཟློག་པར་བྱེད་དོ་སྙམ་ན་།
T04nagvigvu:640	 nityāś ca sarvabhāvāḥ syuḥ nityatvād ahetumataḥ // NagVv_55 //	T04D3832:133b-10	རྒྱུ་མི་ལྡན་པ་རྟག་པའི་ཕྱིར་༎ ཆོས་རྣམས་ཐམས་ཅད་རྟག་པར་འགྱུར་༎
T04nagvigvu:642	 evaṃ sati pratītyasamutpādaṃ pratyācakṣaṇasya bhavataḥ ko doṣa prasajyate /	T04D3832:133b-14	དེ་ལྟ་ཡིན་ན་རྟེན་ཅིང་འབྲེལ་པར་འབྱུང་བ་གཏོང་བ་དེ་ལ་སྐྱོན་ཅིར་འགྱུར་ཞེ་ན་།
T04nagvigvu:643	 dharmo na bhavati adharmo na bhavati /  saṃvyavahārāś ca laukikā na sambhavanti /	T04D3832:133b-15	ཆོས་མེད་པ་དང་། ཆོས་མ་ཡིན་པ་མེད་པ་དང་། འཇིག་རྟེན་པའི་ཐ་སྙད་རྣམས་མེད་པར་འགྱུར་རོ་༎
T04nagvigvu:645	 kiṃ kāraṇaṃ pratītyasamutpannaṃ hy etat sarvam asati pratītyasamutpāde kuto bhaviṣyati /	T04D3832:133b-16	ཅིའི་ཕྱིར་ཞེ་ན་། འདི་ཐམས་ཅད་ནི་རྟེན་ཅིང་འབྲེལ་པར་འབྱུང་བ་ཡིན་ན་རྟེན་ཅིང་འབྲེལ་པར་འབྱུང་བ་དེ་མེད་ན་གང་ལས་འབྱུང་བར་འགྱུར་།
T04nagvigvu:646	 api ca sasvabhāvo 'pratītyasamutpanno nirhetuko nityaḥ syāt /	T04D3832:133b-18	གཞན་ཡང་རང་གི་ངོ་བོ་དང་བཅས་པ་དང་། རྟེན་ཅིང་འབྲེལ་པར་འབྱུང་བ་མ་ཡིན་པ་དང་། རྒྱུ་མེད་པ་ལས་བྱུང་བ་དང་རྟག་པར་འགྱུར་ཏེ་།
T04nagvigvu:647	 kiṃ kāraṇaṃ nirhetukā hi bhāvā nityās tatra sa eva cābrahmacaryavāsaḥ prasajyet svasiddhāntavirodhaś ca /	T04D3832:133b-19	རྒྱུ་མེད་པ་རྣམས་ནི་རྟག་པ་ཉིད་ཡིན་པའི་ཕྱིར་དང་། དེ་ལ་ཚངས་པར་སྤྱོད་པ་ལ་གནས་པ་མ་ཡིན་པ་དེ་ཉིད་དུ་ཡང་འགྱུར་རོ་༎ གྲུབ་པའི་མཐའ་དང་ཡང་འགལ་ཏེ་།
T04nagvigvu:648	 kiṃ kāraṇam anityā hi bhagavatā sarve saṃskārā nirdeṣṭās te svabhāvanityatvān nityā hi bhavanti /	T04D3832:133b-21	ཅིའི་ཕྱིར་ཞེ་ན་། བཅོམ་ལྡན་འདས་ཀྱིས་འདུ་བྱེད་ཐམས་ཅད་ནི་མི་རྟག་པའོ་ཞེས་བཤད་པ་ཡིན་ནོ་༎ དེ་དག་ནི་རང་གི་ངོ་བོ་ཉིད་དང་བཅས་པའི་རྟག་པ་ཉིད་ཀྱིས་རྟག་པ་ཡིན་ནོ་༎
T04nagvigvu:649	 eṣa cākuśaleṣv avyākṛteṣu nairyāṇādiṣu ca doṣas /	T04D3832:133b-24	མི་དགེ་བ་དང་ལུང་མ་བསྟན་༎ ངེས་འབྱིན་སྩོགས་ལའང་སྐྱོན་དེ་བཞིན་༎ དེ་བས་ཁྱོད་ཀྱི་འདུས་བྱས་ཀུན་༎ འདུས་མ་བྱས་པ་ཉིད་དུ་འགྱུར་༎ དགེ་བའི་༄༡༣༤ཨ་༌་༎ ཆོས་རྣམས་ལ་རྟག་པ་དེ་བསྟན་པ་གང་ཡིན་པ་དེ་ཉིད་མི་དགེ་བ་རྣམས་དང་། ལུང་དུ་མ་བསྟན་པ་རྣམས་ལ་ཡང་ཡོད་། དེ་ཉིད་ངེས་པར་འབྱིན་པ་ལ་སོགས་པ་ལ་ཡང་ཡོད་དོ་༎
T04nagvigvu:650	 tasmāt sarvaṃ saṃskṛtam asaṃskṛtaṃ te bhavaty evaṃ // NagVv_56 //	T04D3832:134a-3	དེ་བས་ན་ཁྱོད་ཀྱི་འདུས་བྱས་འདི་ཐམས་ཅད་འདུས་མ་བྱས་སུ་འགྱུར་རོ་༏
T04nagvigvu:652	 kiṃkāraṇaṃ heto hy asaty utpādasthitibhaṅgā na bhavanti /	T04D3832:134a-4	། ཅིའི་ཕྱིར་ཞེ་ན་། རྒྱུ་མེད་ན་སྐྱེ་བ་དང་གནས་པ་དང་འཇིག་པ་དག་མེད་པའི་ཕྱིར་རོ་༎
T04nagvigvu:653	 utpādasthitibhaṅgeṣv asatsu saṃskṛtalakṣaṇābhāvāt /  sarvaṃ saṃskṛtam asaṃskṛtaṃ saṃpadyate /	T04D3832:134a-6	དེ་མེད་ན་འདུས་བྱས་ཀྱི་མཚན་ཉིད་མེད་པའི་ཕྱིར་ཐམས་ཅད་འདུས་མ་བྱས་སུ་འགྱུར་རོ་༎
T04nagvigvu:655	 tatra yad uktaṃ kuśalādīnāṃ bhāvānāṃ svabhāvasadbhāvād aśūnyāḥ sarvabhāvā iti tan na //	T04D3832:134a-7	དེ་ལ་དགེ་བ་ལ་སོགས་པ་དག་གི་དངོས་པོ་དག་གི་རང་གི་ངོ་བོ་ཡོད་པའི་ཕྱིར་དངོས་པོ་ཐམས་ཅད་སྟོང་པ་མ་ཡིན་ནོ་ཞེས་སྨྲས་པ་གང་ཡིན་པ་དེ་མི་རུང་ངོ་༎
T04nagvigvu:656	 (Vv 308)  yat punar bhavatoktaṃ /	T04D3832:134a-8	གཞན་ཡང་ཁྱོད་ཀྱིས་།
T04nagvigvu:658	 yadi ca na bhavet svabhāvo bhāvānāṃ na svabhāva ity evaṃ	T04D3832:134a-9	གལ་ཏེ་ཆོས་ཀྱི་རང་བཞིན་མེད་༎
T04nagvigvu:659	 nāmāpi bhaved evaṃ nāma hi nirvastukaṃ nāsti / [9]	T04D3832:134a-10	རང་བཞིན་མེད་ཅེས་བྱ་བའི་མིང་༎ དེ་ཡང་དེ་བཞིན་མེད་འགྱུར་ཏེ་༎
T04nagvigvu:66	 atra vayaṃ brūmaḥ /	T04D3832:122a-29	འདིར་སྨྲས་པ་།
T04nagvigvu:661	 bhavatā prativaktavyo nāma brūmaś ca na vayaṃ sata // NagVv_57 //	T04D3832:134a-13	ཞེས་སྨྲས་པ་གང་ཡིན་པ་འདི་ལ་བཤད་པར་བྱ་སྟེ་། གང་ཞིག་རང་བཞིན་བཅས་པ་ཞེས་༎ མིང་ནི་ཡོད་པར་སྨྲ་བ་ལ་༎ ང་ནི་མིང་ཡོད་མི་སྨྲའོ་༎
T04nagvigvu:662	 yo nāma sadbhūtaṃ brūyāt sasvabhāva iti sa bhavatā prativaktavyaḥ syāt /	T04D3832:134a-18	གང་ཞིག་མིང་འདི་རང་བཞིན་དང་བཅས་པ་ཡིན་ནོ་ཞེས་མིང་ཡོད་པར་སྨྲ་བ་དེ་ལ་ཁྱོད་ཀྱིས་ལན་གདབ་པར་བྱ་བ་ཡིན་གྱི་།
T04nagvigvu:663	 yasya sadbhūtaṃ nāma svabhāvasya /	T04D3832:134a-19	གལ་ཏེ་མིང་ཅན་གྱི་རང་བཞིན་དེ་མེད་ན་།
T04nagvigvu:664	 tasmāt tenāpi svabhāvena sadbhūtena bhavitavyaṃ /	T04D3832:134a-20	དེའི་ཕྱིར་མིང་དེ་ཡང་རང་བཞིན་ཡོད་པ་མ་ཡིན་པར་བྱ་དགོས་ཏེ་།
T04nagvigvu:665	 na hy asadbhūtasya svabhāvasya sadbhūtaṃ nāma bhavatīti /	T04D3832:134a-21	ཡོད་པ་མ་ཡིན་པ་ལ་ནི་མིང་གི་རང་བཞིན་ཡོད་པར་མི་འགྱུར་བས་ངེད་ཅག་ཀྱང་མིང་གི་རང་བཞིན་ཡོད་པར་མི་སྨྲའོ་༎ དེ་བས་ན་དངོས་པོ་རྣམས་ཀྱི་རང་བཞིན་ཡང་མེད་པའི་ཕྱིར་མིང་གི་རང་བཞིན་ཡང་མེད་པ་ཡིན་ནོ་༎
T04nagvigvu:666	 na punar vayaṃ nāma sadbhūtaṃ brūmas tad api hi svabhāvasyābhāvān nāma niḥsvabhāvatvāt śūnyaṃ śūnyatvād asadbhūtam /  tatra yad bhavatoktaṃ nāmasadbhāvāt sadbhūtaḥ svahhāvā iti / tan na //	T04D3832:134a-23	དེའི་ཕྱིར་སྟོང་པ་ཡིན་ནོ་༎ སྟོང་པ་ཉིད་ཡིན་པའི་ཕྱིར་ཡོད་པ་མ་ཡིན་པས་དེ་ལ་ཁྱོད་ཀྱིས་མིང་ཡོད་པའི་ཕྱིར་རང་གི་ངོ་བོ་ཡོད་དོ་ཞེས་སྨྲས་པ་གང་ཡིན་པ་དེ་མི་རུང་ངོ་༎
T04nagvigvu:668	 kiñcānyat /	T04D3832:134a-25	འདི་ལྟར་གཞན་ཡང་།
T04nagvigvu:669	 (Vv 310)  nāmāsad iti ca yad idaṃ tat kiṃ nu sato bhavaty utāsataḥ /	T04D3832:134a-26	མེད་ལ་མིང་མེད་ཅེས་གང་འདི་༎ ཅི་དེ་ཡོད་པའམ་མེད་པ་ཡིན་༎
T04nagvigvu:67	 etad apy anupapannaṃ kiṃ kāraṇaṃ /	T04D3832:122b-0	དེར་ཡང་འཐད་པ་མ་༄༡༢༢བ་ཡིན་ཏེ་།
T04nagvigvu:671	 yadi hi sato yady asato dvidhāpi te hīyate vādaḥ // NagVv_58 //	T04D3832:134a-28	གལ་ཏེ་ཡོད་པའམ་མེད་པ་ཡིན་༎ ཁྱོད་ཀྱིས་སྨྲས་པ་གཉི་གའང་ཉམས་༎
T04nagvigvu:672	 yac caitan nāmāsad iti tat kiṃ sataḥ asataḥ /  yadi hi satas tan nāma yady asata ubhayathāpi pratijñā hīyate /	T04D3832:134a-30	མེད་པ་ལ་མིང་མེད་དོ་ཞེས་བྱ་བ་གང་ཡིན་པ་འདི་ཅི་མིང་མེད་པ་དེ་ཡོད་པ་ཡིན་ནམ་འོན་ཏེ་མེད་པ་ཡིན་། གལ་ཏེ་མིང་དེ་ཡོད་པ་ཞིག་གི་ཡིན་ནམ་།
T04nagvigvu:674	 tatra yadi tāvat sata /	T04D3832:134b-1	དེ་ལ་གལ་ཏེ་རེ་ཞིག་མིང་མེད་པ་ཞེས་བྱ་བའི་མིང་ཡོད་པ་ཡིན་ནོ་ཞེ་ན་། མིང་མེད་དོ་ཞེས་བྱ་བའི་དམ་བཅས་པ་ཉམས་པར་འགྱུར་ཏེ་། ད་ནི་དེ་མེད་པ་མ་ཡིན་ཏེ་།
T04nagvigvu:675	 asad iti pratijñā hīyate /  asad iti nāma yā pratijñā asadbhūtasya nāma na bhavati astitvasvabhāva iti nāma tasmāt sadbhūtaḥ svabhāva iti / sā hīnā //	T04D3832:134b-4	ད་ནི་དེ་ཡོད་པས་སོ་ཅི་སྟེ་མིང་མེད་པ་ཞེས་བྱ་བ་མེད་པ་ཡིན་ནོ་ཞེ་ན་། མེད་པ་ལ་ནི་མིང་མེད་དོ་༎ དེ་བས་ན་མིང་གི་རང་བཞིན་ཡོད་དོ་ཞེས་ཁྱོད་ཀྱིས་དམ་བཅས་པ་གང་ཡིན་པ་དེ་ཉམས་པ་ཡིན་ནོ་༎
T04nagvigvu:678	 kiñcānyat /	T04D3832:134b-7	འདི་ལྟར་གཞན་ཡང་།
T04nagvigvu:679	 sarveṣāṃ bhāvānāṃ śūnyatvañ copapāditaṃ pūrvam /	T04D3832:134b-8	དངོས་པོ་དག་ནི་ཐམས་ཅད་ཀྱི་༎ སྟོང་པ་ཉིད་ནི་སྔར་བསྟན་པས་༎
T04nagvigvu:68	 satā hy atra śabdena hy atra bhaviṣyataḥ śabdasya pratiṣedhaḥ kriyate /	T04D3832:122b-1	འདི་ལ་སྒྲ་ཡོད་པས་སྒྲ་འབྱུང་བར་འགྱུར་བ་འགོག་པར་བྱེད་པ་ཡིན་གྱི་།
T04nagvigvu:680	 sa upālambhaḥ tasmād bhavaty ayañ cāpratijñāyāḥ // NagVv_59 //	T04D3832:134b-10	དེ་ཕྱིར་དམ་བཅས་མེད་པར་ཡང་༎ ཀླན་ཀ་གང་ཡིན་དེ་ཚོལ་བྱེད་༎
