src_segmentnr	src_original	tgt_segmentnr	tgt_original
T04sanss03u:368	 bhavati tad uccāraṃ bhavati pūyaśoṇitaṃ vêti //  saṃgharakṣitâvadāne 'py anarthôktaḥ /  yāṃs tvaṃ saṃgharakṣita satvān adrākṣīḥ kuḍyâkārāṃs te  bhikṣavâsan /	K01D0001_H0001:161a-2	དགེ་འདུན་འཚོ་ཁྱོད་ཀྱིས་སེམས་ཅན་རྩིག་པ་འདྲ་བ་གང་དག་མཐོང་བ་དེ་དག་ནི་དགེ་སློང་དག་ཏུ་གྱུར་པ་ན་།
T04sanss03u:372	 taiḥ sāṃghikaṃ kuḍyaṃ śleṣmaṇā nāśitaṃ /	K01D0001_H0001:161a-3	དེ་དག་གིས་དགེ་འདུན་གྱི་རྩིག་པ་མཆིལ་མས་མ་རུང་བར་བྱས་པས་།
T04sanss03u:373	 tasya karmaṇo vipākena kuḍyâkārāḥ saṃvṛttāḥ /	K01D0001_H0001:161a-4	ལས་དེའི་རྣམ་པར་སྨིན་པས་རྩིག་པ་འདྲ་བ་དག་ཏུ་གྱུར་ཏོ་༎
T04sanss03u:374	 yāṃs tvaṃ saṃgharakṣita satvān adrākṣīḥ stambhâkārāṃs te  bhikṣavâsan /  taiḥ sāṃghikastaṃbhaḥ siṃhāṇakena nāśitaḥ /	K01D0001_H0001:161a-5	ཁྱོད་ཀྱིས་སེམས་ཅན་ཀ་བ་འདྲ་བ་གང་དག་མཐོང་བ་དེས་ཀྱང་། དགེ་སློང་དག་ཏུ་གྱུར་པ་ན་། དེ་དག་གིས་དགེ་འདུན་གྱི་ཀ་བ་སྣབས་ཀྱིས་མ་རུང་བར་བྱས་པས་།
T04sanss03u:377	 tena stambhâkārāḥ saṃvṛttāḥ /	K01D0001_H0001:161a-8	ལས་དེའི་རྣམ་པར་སྨིན་པས་ཀ་བ་འདྲ་བ་དག་ཏུ་གྱུར་ཏོ་༎
T04sanss03u:378	 yāṃs tvaṃ satvān adrākṣīr vṛkṣâkārān patrâkārān  phalâkārān te 'pi bhikṣavâsan /	K01D0001_H0001:161a-9	ཁྱོད་ཀྱིས་སེམས་ཅན་ཤིང་ལྗོན་པ་འདྲ་བ་དག་དང་། ལོ་མ་འདྲ་བ་དག་དང་། མེ་ཏོག་འདྲ་བ་དག་དང་། འབྲས་བུ་འདྲ་བ་གང་དག་མཐོང་བ་དེ་དག་ཀྱང་དགེ་སློང་དག་ཏུ་གྱུར་པ་ན་།
T04sanss03u:381	 paribhuktāni tena te vṛkṣapatrapuṣpaphalâkārāḥ saṃvṛttāḥ /	K01D0001_H0001:161a-10	དེ་དག་གིས་དགེ་འདུན་གྱི་ཤིང་ལྗོན་པ་དང་། ལོ་མ་དང་། མེ་ཏོག་དང་། འབྲས་བུ་དག་གང་ཟག་གི་ལོངས་སྤྱོད་དུ་སྤྱད་པས་། ལས་དེའི་རྣམ་པར་སྨིན་པས་ཤིང་ལྗོན་པ་འདྲ་བ་དག་དང་། ལོ་མ་འདྲ་བ་དག་དང་། མེ་ཏོག་འདྲ་བ་དག་དང་། འབྲས་བུ་འདྲ་བ་དག་ཏུ་གྱུར་ཏོ་༎
T04sanss03u:382	 yāṃs tvaṃ satvān adrākṣī rajjvākārān  saṃmārjany-ākārāṃs te bhikṣavâsan /	K01D0001_H0001:161a-12	ཁྱོད་ཀྱིས་སེམས་ཅན་ཐག་པ་འདྲ་བ་དག་དང་། ཕྱགས་མ་འདྲ་བ་དག་མཐོང་བ་དེ་དག་ཀྱང་དགེ་སློང་དག་ཏུ་གྱུར་པ་ན་།
T04sanss03u:384	 taiḥ sāṃghikā rajjusammārjanyaḥ paudgalikaparibhogena paribhuktās tena rajjvākārāḥ sammārjany-ākā-  [ Bendall ed p58 ---> ]	K01D0001_H0001:161a-13	དེ་དག་གིས་དགེ་འདུན་གྱི་ཐག་པ་དང་ཕྱགས་མ་གང་ཟག་གི་ལོངས་སྤྱོད་དུ་སྤྱད་པས་། ལས་དེའི་རྣམ་པར་སྨིན་པས་ཐག་པ་འདྲ་བ་དག་དང་། ཕྱགས་མ་འདྲ་བ་དག་ཏུ་གྱུར་ཏོ་༎
T04sanss03u:387	 yaṃ tvaṃ satvam adrākṣīs taṭṭâkāraṃ sa śrāmaṇerakâsīt /	K01D0001_H0001:161a-15	ཁྱོད་ཀྱིས་སེམས་ཅན་ཕོར་པ་འདྲ་བ་གང་དག་མཐོང་བ་དེ་དག་ནི་།
T04sanss03u:388	 sa taṭṭukaṃ nirmādayati /	K01D0001_H0001:161a-17	དེ་དག་ཕོར་པ་འཁྲུད་པར་བྱེད་པའི་ཚེ་།
T04sanss03u:389	 āgantukāś ca bhikṣavo 'bhyāgatāḥ /	K01D0001_H0001:161b-0	དགེ་སློང་གློ་བུར་༄༡༦༡བ་དུ་འོངས་པ་དག་ལྷགས་ནས་། དེ་དག་གིས་དགེ་ཚུལ་དེ་དག་ལ་དྲིས་པ་།
T04sanss03u:390	 tair asau dṛṣṭaś ca pṛṣṭaś ca śrāmaṇeraka kim ayaṃ saṃghasya  pānakaṃ bhaviṣyati /	K01D0001_H0001:161b-2	དགེ་ཚུལ་དག་། ཅི་དགེ་འདུན་ལ་སྐོམ་འབྱུང་བར་འགྱུར་རམ་།
T04sanss03u:392	 sa mātsaryôpahatacittaḥ kathayati /	K01D0001_H0001:161b-4	དགེ་ཚུལ་དེ་དག་སེར་སྣས་དཀྲིས་ཏེ་སྨྲས་པ་།
T04sanss03u:393	 kiṃ na paśyatha taṭṭukaṃ nirmāditaṃ pītaṃ pānakam iti /	K01D0001_H0001:161b-5	ཁོ་བོ་ཅག་གི་ཕོར་པ་བཀྲུས་པ་མཐོང་ངམ་། སྐོམ་འཐུངས་ཟིན་ཏོ་༎
T04sanss03u:394	 te vṛttā velêti nairāśyam āpannā hīnadīnavadanāḥ  prakrāntāḥ /	K01D0001_H0001:161b-7	དེ་དག་གིས་བསམས་པ་། དུས་ཡོལ་བ་བལྟ་སྙམ་ནས་རེ་བ་མེད་པར་གྱུར་ཏེ་། བཞིན་གྱུར་ཅིང་ཉམས་ཏེ་དོང་བས་།
T04sanss03u:396	 sa tasya karmaṇo vipākena taṭṭukâkāraḥ saṃvṛttāḥ //  yaṃ tvam satvam adrākṣīr udūkhalâkāraṃ so 'pi  bhikṣur āsīt /	K01D0001_H0001:161b-10	ལས་དེའི་རྣམ་པར་སྨིན་པས་ཕོར་པ་འདྲ་བ་དག་ཏུ་གྱུར་ཏོ༏་༏ཁྱོད་ཀྱིས་སེམས་ཅན་གཏུན་འདྲ་བ་གང་དག་མཐོང་བ་དེ་དག་ཀྱང་དགེ་སློང་དག་ཏུ་གྱུར་པ་ན་།
T04sanss03u:399	 tasya pātrakarma pratyupasthitaṃ /	K01D0001_H0001:161b-11	དེ་དག་ལ་ལྷུང་བཟེད་ཀྱི་ལས་དག་བྱུང་ནས་།
T04sanss03u:400	 tatra câikaḥ śrāmaṇerako 'rhan mudrāvāre niyuktaḥ /  sa tenôktaḥ śrāmaṇeraka dadasva me khalistākaṃ kuṭṭayitvêti /	K01D0001_H0001:161b-12	དེ་ན་དགེ་ཚུལ་དགྲ་བཅོམ་པ་གཅིག་དམ་བཞག་པར་བསྐོས་པ་དེ་ལ་དེ་དག་གིས་སྨྲས་པ་། དགེ་ཚུལ་ཁོ་བོ་ཅག་ལ་གཏུན་དུ་འབྲུ་མར་གྱི་ཚིག་མ་ཉུང་ཞིག་བརྡུངས་ཏེ་བྱིན་ཅིག་། དེས་སྨྲས་པ་།
T04sanss03u:402	 sa kathayati /  sthavira tiṣṭha tāvan muhūrtaṃ vyagro 'smi paścāt kuṭṭayitvā  dāsyāmîti /  sa saṃjātâmarṣaḥ kathayati /  śrāmaṇeraka yadi mama kalpate udūkhalaṃ spraṣṭuṃ tvām evâham  udūkhale prakṣipya kuṭṭayeyaṃ /	K01D0001_H0001:161b-15	གནས་བརྟན་དག་བདག་བྲེལ་གྱིས་རེ་ཞིག་ཡུད་ཙམ་ཞིག་བཞེས་ཤིག་དང་། སླད་ཀྱིས་གསོལ་ལོ༏་༏དེ་དག་མི་བཟོད་པ་སྐྱེས་ནས་ཀུན་ནས་དཀྲིས་པ་དྲག་པོས་སྨྲས་པ་། དགེ་ཚུལ་གལ་ཏེ་ཁོ་བོ་ཅག་གཏུན་ལ་རེག་ཏུ་རུང་ན་ཁོ་བོ་ཅག་གིས་ཁྱོད་ཉིད་གཏུན་དུ་བཅུག་སྟེ་བརྡུང་བར་ཡང་བྱ་ན་།
T04sanss03u:409	 prāg eva khalistokam iti /	K01D0001_H0001:161b-17	འབྲུ་མར་ཚིགས་མ་ཉུང་ཞིག་ལྟ་ཅི་སྨོས་།
T04sanss03u:410	 sa śrāmaṇeraḥ saṃlakṣayati /	K01D0001_H0001:161b-18	དགེ་ཚུལ་དེས་བསམས་པ་།
T04sanss03u:411	 tīvraparyavasthānaparyavasthito 'yaṃ /	K01D0001_H0001:161b-19	འདི་དག་ཀུན་ནས་དཀྲིས་པ་དྲག་པོས་དཀྲིས་པས་།
T04sanss03u:412	 yady aham asmai prativacanaṃ dāsyāmi bhūyasyā mātrayā prakopam	K01D0001_H0001:161b-20	གལ་ཏེ་བདག་གིས་འདི་དག་ལ་ལན་བཏབ་ན་། ལྷག་པར་ཡང་རབ་ཏུ་འཁྲུག་པར་འགྱུར་རོ་སྙམ་ནས་།
T04sanss03u:413	 āpatsyatîti tūṣṇīm avasthitaḥ /	K01D0001_H0001:161b-22	དེས་ཅང་མི་སྨྲ་བར་བསྡད་ནས་།
T04sanss03u:414	 yadâsya paryavasthānaṃ vigataṃ tadôpasaṃkramya kathayati /	K01D0001_H0001:161b-23	གང་གི་ཚེ་དེ་དག་ཀུན་ནས་དཀྲིས་པ་དང་བྲལ་བ་དེའི་ཚེ་ན་། གང་དུ་སོང་སྟེ་སྨྲས་པ་།
T04sanss03u:415	 sthavira jānīṣe tvaṃ ko 'ham iti /	K01D0001_H0001:161b-25	གནས་བརྟན་དག་ཁྱེད་ཀྱིས་བདག་སུ་ལགས་མཁྱེན་ཏམ་།
T04sanss03u:416	 sa kathayati /	K01D0001_H0001:161b-26	དེ་དག་གིས་སྨྲས་པ་།
T04sanss03u:417	 jāne tvāṃ kāśyapasya samyaksaṃbuddhasya pravrajitaṃ śrāmaṇerakaṃ /	K01D0001_H0001:162a-0	ཤེས་ཏེ་༄༡༦༢ཨ་༌༎ ཁྱོད་ནི་ཡང་དག་པར་རྫོགས་པའི་སངས་རྒྱས་འོད་སྲུང་གི་བསྟན་པ་ལ་རབ་ཏུ་བྱུང་བའི་དགེ་ཚུལ་ཡིན་ནོ་༎
T04sanss03u:418	 aham api bhikṣuḥ sthaviraḥ /	K01D0001_H0001:162a-2	ཁོ་བོ་ཅག་ཀྱང་དགེ་སློང་ཡིན་ནོ་༎
T04sanss03u:419	 śrāmaṇerakaḥ kathayati /  yady apy evaṃ tathâpi tu yan mayā pravrajitena karaṇīyaṃ tat  kṛtaṃ /	K01D0001_H0001:162a-3	གནས་བརྟན་དག་གལ་ཏེ་དེ་ལྟར་ལགས་ཀྱིས་ཀྱང་འདི་ལྟར་བདག་གིས་ནི་རབ་ཏུ་བྱུང་བས་བགྱི་བ་གང་ལགས་པ་དེ་བགྱིས་སོ་༎ ཅི་ཞིག་བྱས་ཉོན་མོངས་པ་ཐམས་ཅད་སྤངས་པས་དགྲ་བཅོམ་པ་ཉིད་མངོན་དུ་བགྱིས་སོ་༎
T04sanss03u:422	 kiṃ kṛtaṃ kleśaprahāṇaṃ chinnasakalabandhano 'haṃ sarvabandhanavinirmuktaḥ /	K01D0001_H0001:162a-5	ཁྱེད་ནི་འཆིང་བ་མཐའ་དག་གིས་བཅིངས་བ་ལགས་ལ་། བདག་ནི་འཆིང་བ་ཐམས་ཅད་ལས་ངེས་པར་གྲོལ་བ་ལགས་ན་།
