src_segmentnr	src_original	tgt_segmentnr	tgt_original
T04sanss16u:100	 yat sarvâryāḥ sarvanavayānasaṃprasthitā bodhisatvā na pariprāpayiṣyanti tad ahaṃ pariprāpayiṣyāmi /	T11n0310_053:0313a19_2	一切賢聖諸新發意未住正位諸菩薩等所未曾擐，我今獨擐。
T04sanss16u:101	 na mama dānaṃ sahāyakaṃ /	T11n0310_053:0313a19_12	』爾時菩薩又作是念： 『我於今者嚴備如是，豈令布施自在度我？
T04sanss16u:102	 ahaṃ punar dānasya sahāyaḥ /	T11n0310_053:0313a20_19	我當自在度彼布施。
T04sanss16u:103	 na mama śīlakṣāntivīryadhyānaprajñāḥ sahāyikāḥ /  ahaṃ punaḥ śīlakṣāntivīryadhyānaprajñānāṃ sahāyo /	T11n0310_053:0313a22_5	如是持戒忍辱精進靜慮及般若等，豈令自在而度於我？
T04sanss16u:93	 eko bodhisatvo 'dvitīyo 'sahāyo 'nuttarāyāṃ samyaksaṃbodhau  [ Cambridge MS f121a ---> ]  saṃnāhaṃ saṃnahyati /  sa vīryabalaparigṛhītenâdhyāśayenâparâvakāśâsvayaṃkārī /	T11n0310_053:0313a14_1	所謂菩薩獨一眾表無有與等不假伴助，為證阿耨多羅三藐三菩提故，由自攝受精進勢力、清淨欲解、被堅固鎧。
T04sanss16u:98	 sâivaṃ dṛḍhasaṃnāhaḥ saṃnaddho /  yat kiñcit sarvasatvānāṃ pariprāpayitavyaṃ bhaviṣyati tad ahaṃ pariprāpayiṣyāmi /	T11n0310_053:0313a17_13	『如是甲鎧一切眾生所不能擐，我今獨擐如是甲鎧。
