src_segmentnr	src_original	tgt_segmentnr	tgt_original
T04sanss11u:70	 uktaṃ hy āryaratnakūṭe /	T04D3940:109b-26	འཕགས་པ་དཀོན་མཆོག་བརྩེགས་པ་ལས་ཀྱང་༎
T04sanss11u:71	 tad yathā kāśyapa kaścid eva puruṣo mahatôdakârṇavenôhyamānôdakatṛṣṇayā kālaṃ kuryād /  evam eva kāśyapêhâike śramaṇabrāhmaṇā bahūn dharmān udgṛhya paryavāpya na rāgatṛṣṇāṃ vinodayanti /	T04D3940:109b-27	འོད་སྲུངས་འདི་ལྟ་སྟེ་དཔེར་ན་མི་ལ་ལ་ཞིག་རྒྱ་མཚོའི་ཆུ་ཆེན་པོས་ཁྱེར་ལ་ཆུས་སྐོམ་བཞིན་དུ་འཆི་བའི་དུས་བྱེད་པ་དེ་བཞིན་དུ་འོད་སྲུངས་འདི་ནི་དགེ་སྦྱོང་དང་བྲམ་ཟེ་ཁ་ཅིག་ཆོས་མང་པོ་བླངས་ཏེ་ཀུན་ཆུབ་པར་བྱས་ཀྱང
T04sanss11u:73	 na dveṣatṛṣṇāṃ /  na mohatṛṣṇāṃ vinodayanti /  te mahatā dharmârṇavenôhyamānāḥ kleśatṛṣṇayā kālagatā /	T04D3940:109b-28	། འདོད་ཆགས་ལ་སྲེད་པ་མི་སེལ་ཞེ་སྡང་ལ་སྲིད་པ་མི་སེལ་གཏི་མུག་ལ་སྲིད་པ་མི་སེལ་བ་དེ་དག་ནི་ཆོས་ཀྱི་རྒྱ་མཚོ་ཆེན་པོས་ཁྱེར་ལ་།
T04sanss11u:76	 durgativinipātagāmino bhavantîti //	T04D3940:109b-29	ཉོན་མོངས་པའི་སྐོམ་པས་འཆི་བའི་དུས་བྱེད་པར་འགྱུར་ཏེ་། ངན་འགྲོར་འགྲོ་བར་༄༡༡༠ཨ་༌་༎ འགྱུར་རོ་ཞེས་གསུངས་སོ་༎
T04sanss11u:77	 tasmād avaśyam araṇyam āśrayet //	T04D3940:110a-2	དེ་ལྟ་བས་ན་གདོན་མི་ཟ་བར་དགོན་པ་ལ་གནས་པར་བྱའོ་༎
T04sanss11u:79	 yeṣu ca sthāneṣu nâtidūre piṇḍapātagocaro bhavati na  atisaṃnikṛṣṭe /  yeṣu pānīyāni bhavanty acchāni śucīni nirmalāny alpâyāsāni mukhaparibhogāni yā-  ni ca sthānāni vṛkṣasaṃpannāni bhavanti puṣpasaṃpannāni phalasaṃpannāni pattrasaṃpannāny  apagataduṣṭaśvāpadāni guhāsaṃpannāni prāgbhārasaṃpannāni sukhaparisarpyakāṇi śāntāny	T04D3940:110a-4	གནས་གང་དག་ན་བསོད་སྙོམས་བླང་བའི་སྤྱོད་ཡུལ་དང་ཧ་ཅང་ཡང་མི་རིང་ཧ་ཅང་ཡང་མི་ཉེ་བ་དང་། གནས་གང་དག་ན་ཆུ་དང་ཞིང་རྙོག་པ་མེད་པ་གཙང་ཞིང་དྲི་མ་མེད་པ་ཚོགས་ཆུང་བ་ཡོད་པ་དང་། གནས་གང་ན་ཤིང་ཕུན་སུམ་ཚོགས་པ་མེ་ཏོག་ཕུན་སུམ་ཚོགས་པ་འབྲས་བུ་ཕུན་སུམ་ཚོགས་པ་ལོ་མ་ཕུན་སུམ་ཚོགས་པ་།
T04sanss11u:8	 yehi sthitair evâgāramadhye prāptêyaṃ uttamâgrabodhiḥ //  jyaṃ yatha kheṭapiṇḍaṃ vased araṇyeṣu vivekakāmaḥ /	T04D3940:108b-20	རྒྱལ་སྲིད་མཆིལ་མའི་ཐལ་བ་བཞིན་སྤངས་ནས་༎ དབེན་པ་འདོད་དེས་དགོན་པར་གནས་བྱེད་པ་༎
T04sanss11u:86	 advitīyāni tādṛśāni sthānāny āśrayet /	T04D3940:110a-6	དེ་གནས་དེ་དག་ན་གནས་ཤིང་།
T04sanss11u:87	 sa teṣu sthāneṣv āśrito yad anena pūrvapaṭhitaṃ bhavati tat tribhī rātrais trirdivasasya  svâdhyāyati nâtyuccena svareṇa nâtinīcena nôddhatair indriyair na bahirgatena cittena  prasādam upajīvan grantham upadhārayan nimittāny udgṛhṇan middham apakrāman /	T04D3940:110a-7	གང་དེས་སྔོན་བླངས་པ་དང་སྔོན་ཐོས་པ་དེ་ཉིན་ལན་གསུམ་མཚན་ལན་གསུམ་དུ་ཧ་ཅང་ཡང་མི་ཆེ་ཧ་ཅང་ཡང་མི་ཆུང་བ་དང་། དབང་པོ་མི་རྒོད་ཅིང་ཕྱི་རོལ་དུ་མ་སོང་བའི་སེམས་དང་དད་པས་ཉེ་བར་འཚོ་ཞིང་ཚིག་ཉེ་བར་བཟུང་སྟེ་། མཚན་མར་འཛིན་ཅིང་གཉིད་ཀྱིས་མ་ལོག་པར་ཁ་ཏོན་བྱེད་དོ་༎
T04sanss11u:90	 saced āraṇyakasya bhikṣo rājā vôpasaṃkrāmati rājamātro vânye vā brāhmaṇakṣatriyanaigamajānapadāḥ /	T04D3940:110a-9	གལ་ཏེ་དགེ་སློང་དགོན་པའི་དྲུང་དུ་རྒྱལ་པོའམ་བློན་པོའམ་དེ་མ་ཡིན་པ་གཞན་བྲམ་ཟེའམ་རྒྱལ་རིགས་སམ་གྲོང་པའམ་ཡུལ་གྱི་མི་དག་འོངས་ན་།
T04sanss11u:91	 tena teṣām ādareṇa svāgatakriyā kartavyā /	T04D3940:110a-10	དེས་དེ་དག་ལ་གུས་པར་ལེགས་པར་འོངས་སོ་ཞེས་བརྗོད་པར་བྱ་སྟེ་།
T04sanss11u:92	 evaṃ cânena vaktavyaṃ /  niṣīda mahārāja yathā prajñaptae āsane /	T04D3940:110a-11	དེས་རྒྱལ་པོ་ཆེན་པོ་ཇི་ལྟར་སྟན་བཏིང་བ་ལ་བཞུགས་ཤིག་ཅེས་དེ་སྐད་བྱས་ནས་གལ་ཏེ་འདུག་ན་གཉི་ག་ཡང་འདུག་པར་བྱའོ་༎
T04sanss11u:94	 saced upaviśati dvābhyām apy upaveṣṭavyaṃ /  sacen nôpaviśati ubhābhyām api nôpaveṣṭavyaṃ /	T04D3940:110a-12	དེ་སྟེ་མི་འདུག་ན་ཡང་གཉི་ག་མི་འདུག་པར་བྱའོ་༎
T04sanss11u:96	 sacec cañcalêndriyo bhavati utkarṣayitavyaṃ /  tasya te mahārāja lābhāḥ sulabdhā yasya te bhūpradeśe śīlavanto guṇavanto bahuśrutāḥ śramaṇabrāhmaṇāḥ prativasanti /  anupadrutāś caurabhaṭâdibhiḥ //	T04D3940:110a-13	གལ་ཏེ་དབང་པོ་རྒོད་པར་གྱུར་ན་རྒྱལ་པོ་ཆེན་པོ་གང་ཁྱོད་ཀྱིས་ས་ཕྱོགས་ན་དགེ་སློང་དང་བྲམ་ཟེ་རྣམས་ཚུལ་ཁྲིམས་དང་ལྡན་པ་ཡོན་ཏན་དང་ལྡན་པ་མང་དུ་ཐོས་པ་དག་མི་རྒོད་དང་སྤྲེའུ་རྣམས་ཀྱིས་མ་གཙེས་པར་གནས་པ་དེ་ནི་རྙེད་པ་ལེགས་པར་རྙེད་དོ་ཞེས་བསྟན་པར་བྱའོ་༎
T04sanss11u:99	 sacet sthiro bhavati vinītaḥ praśāntêndriyaḥ bhavyaś ca bhavati dharmadeśanāyāḥ tato 'sya vicitrā dharmadeśanôpasaṃhartavyā /	T04D3940:110a-15	དེ་སྟེ་བརྟན་ཞིང་དུལ་བ་དབང་པོ་རབ་ཏུ་ཞི་བ་ཞིག་ཡིན་ཏེ་ཆོས་བསྟན་པར་རུང་ན་དེ་ལ་ཆོས་སྣ་ཚོགས་བསྟན་པར་བྱའོ་༎
