src_segmentnr	src_original	tgt_segmentnr	tgt_original
T04sanss18u:260	 kāmabhogāṃś ca darśenti dhyānaṃ ca dhyāyināṃ tathā /  vidhvasta māraṃ kurvanti avatāraṃ na denti te //	T38n1775_007:0396a17_2	示受於五欲，亦復現行禪，令魔心憒亂，不能得其便。
T04sanss18u:262	 agnimadhye yathā padmam abhūtaṃ taṃ vinirdiśet /	T38n1775_007:0396a17_5	肇曰： 火中生蓮華，是可謂希有；
T04sanss18u:265	 saṃcintya gaṇikāṃ bhonti puṃsām ākarṣaṇāya te /  rāgâṅku saṃlobhya buddhajñāne sthāpayanti te //	T38n1775_007:0396a23_2	或現作婬女，引諸好色者，先以欲鉤牽，後令入佛智。 肇曰： 反欲以順。
T04sanss18u:267	 grāmikāś ca sadā bhonti sârthavāhāḥ purohitāḥ /  agrâmātyâtha câmātyaḥ [[DOUBT]] satvānāṃ hitakāraṇāt //	T38n1775_007:0396a25_2	或為邑中主，或作商人導，國師及大臣，以祐利眾生。
T04sanss18u:269	 daridrāṇāṃ ca satvānāṃ nidhānā bhonti akṣayāḥ /	T38n1775_007:0396a26_4	諸有貧窮者，現作無盡藏，因以勸導之，令發菩提心。
