src_segmentnr	src_original	tgt_segmentnr	tgt_original
T06abhsubhu:3560	 tāni khalu rūpāṇyabhibhūya jānātyābhibhūya paśyati tathāsaṃjñī ca bhavati /  idaṃ pañcamamabhibhvāyatanam /	T26n1536_019:0445c04_17	內無色想觀外諸色，若青青顯青現青光亦復如是，於彼諸色勝知勝見有如是想，是第五勝處。
T06abhsubhu:3562	 adhyātmamarūpasaṃjñī bahirdhā rūpāṇi paśyati pītāni yāvatpītanirbhāsāni /  tadyathā karṇikārapuṣpaṃ saṃpannaṃ vā vārāṇasīyakaṃ vastraṃ pītaṃ pītavarṇamiti vistaraḥ /	T26n1536_019:0445c07_5	內無色想觀外諸色，若黃黃顯黃現黃光，猶如羯尼迦花，或如婆羅痆斯深染黃衣，若黃黃顯黃現黃光。
T06abhsubhu:3565	 adhyātmamarūpasaṃjñī bahirdhā rūpāṇi paśyati lohitāni yāvallohitanirbhāsāni /  tadyathā bandhujīvakapuṣpaṃ saṃpannaṃ vā vārāṇasīyaṃ vastraṃ lohitaṃ lohita[varṇa]miti vistaraḥ /	T26n1536_019:0445c11_17	內無色想觀外諸色，若赤赤顯赤現赤光，猶如槃豆時縛迦花，或如婆羅痆斯深染赤衣，若赤赤顯赤現赤光。
T06abhsubhu:3567	 idaṃ saptamamabhibhvāyatanam /	T26n1536_019:0445c14_2	內無色想觀外諸色，若赤赤顯赤現赤光亦復如是，於彼諸色勝知勝見有如是想，是第七勝處。
T06abhsubhu:3568	 adhyātmamarūpasaṃjñī bahirdhā rūpāṇi paśyatyavadātānyavadātavarṇānyavadātanidarśanānyavadātanirbhāsāni /	T26n1536_019:0445c16_10	內無色想觀外諸色，若白白顯白現白光，猶如烏沙斯星色，或如婆羅痆斯極鮮白衣，若白白顯白現白光。 內無色想觀外諸色，若白白顯白現白光亦復如是，於彼諸色勝知勝見有如是想，是第八勝處。
