src_segmentnr	src_original	tgt_segmentnr	tgt_original
T07vakobhku:403	 dviguṇottaravṛddhayā tu purvagodottarāvhayāḥ // VAkK_3.75 //	T29n1558_011:0061a21_11	東勝身人身長八肘，西牛貨人長十六肘，北俱盧人三十二肘。
T07vakobhku:405	 kāmināṃ rūpiṇāṃ tvādau yojanārdhaṃ tataḥ param // VAkK_3.76 //	T29n1558_011:0061a23_10	欲界六天最下身量一俱盧舍四分之一，如是後後一一分增，至第六天身一俱盧舍半。 色天身量初梵眾天半踰繕那，梵輔全一，大梵一半，少光二全，此上餘天皆增倍倍，唯無雲減三踰繕那，謂無量光天倍增二至四，乃至色究竟增滿萬六千。 身量既殊，壽量別不？ 亦別。
T07vakobhku:406	 ardhārdhavṛddhi ūrdhva tu parīttābhebhya āśrayaḥ /  dviguṇadviguṇā hitvānabhrakebhya striyojanam // VAkK_3.77 //  sahasrāmāyuḥ kuruṣu dvayorardhārdhavarjitam /	T29n1558_011:0061a27_18	云何？ 頌曰： 北洲定千年，　　西東半半減，
T07vakobhku:409	 ihāniyatam ante tu daśābdāḥ ādito 'mitam // VAkK_3.78 //	T29n1558_011:0061a29_13	此洲壽不定，　　後十初叵量。
T07vakobhku:410	 nṛṇāṃ varṣāṇi pañcāśadahorātro divaukasām /  kāme 'dharāṇāṃ tenāyuḥ pañcavarṣaśatāni tu // VAkK_3.79 //  dviguṇottaramurdhvānāmubhayaṃ rūpiṇāṃ punaḥ /	T29n1558_011:0061b01_0	人間五十年，　　下天一晝夜， 乘斯壽五百，　　上五倍倍增。
T07vakobhku:413	 nāstyahorātramāyustu kalpaiḥ svāśrayasaṃmitaiḥ // VAkK_3.80 //	T29n1558_011:0061b03_0	色無晝夜殊，　　劫數等身量，
