src_segmentnr	src_original	tgt_segmentnr	tgt_original
T07yabhkvyu:7737	 kāmarūpārūpyāvacarāṇāṃ kāmarūpārūpyāvacarī yathākramam iti.  kāmadhātūpapannasya kāmāvacarāṇāṃ dharmāṇāṃ kāmāvacarī prāptiḥ.	T07D4098:317a-30	འདོད་པ་དང་གཟུགས་དང་གཟུགས་མེད་པར་གཏོགས་པ་རྣམས་ཀྱི་ནི་།
T07yabhkvyu:7746	 anāptānāṃ caturvidheti.  adhātvāptānāṃ saṃskṛtāsaṃskṛtānām anāsravāṇāṃ caturvidhā prāptiḥ.  kāmarūpārūpyāvacarī cānāsravā ca.  samāsena sarvān anāptān abhisamasyety arthaḥ.  pratyekaṃ tu na caturvidhā.  tata āha.	T07D4098:317b-1	དྲི་མ་མེད་པ་ནི་ཁམས་གསུམ་པ་དང་། ཟག་པ་མེད་པ་སྟེ་ལམ་གྱི་བདེན་པ་དང་། འདུས་མ་བྱས་ནི་དྲི་མ་མེད་པའི་རྣམས་སོ་༎
T07yabhkvyu:7764	 anāsraveṇa mārgeṇānāsravā.  āryasya tu rūpāvacareṇa mārgeṇa prāptasya rūpāvacarī cānāsravā cārūpyāvacareṇārūpyāvacarī cānāsravā ca.  laukikenāryavairāgye visaṃyogāptayo dvidheti  mārgasatyasyānāsravaiveti.  laukikīm asya prāptiṃ pratiṣedhayati.	T07D4098:317b-4	ཟག་པ་མེད་པའི་ལམ་གྱིས་ཐོབ་པ་དང་། ལམ་གྱི་བདེན་པ་ནི་ཟག་པ་མེད་པའོ་༎
T07yabhkvyu:7770	 seyaṃ samasya caturvidheti.	T07D4098:317b-5	དེ་ཡང་བསྡུ་ན་རྣམ་པ་བཞིར་འགྱུར་ཏེ་།
T07yabhkvyu:7771	 samāsena traidhātukī cānāsravā ceti uktam arthaṃ nigamayati.	T07D4098:317b-6	ཁམས་གསུམ་དང་ཟག་པ་མེད་པའོ་༎
T07yabhkvyu:7772	 śaikṣāṇām iti.  śaikṣā dharmāḥ śaikṣasyānāsravā dharmā.  aśaikṣā aśaikṣasyānāsravā.  [Tib.139a] mārgasatyabhāvā evaite draṣṭavyāḥ.	T07D4098:317b-7	སློབ་པ་དང་མི་སློབ་པ་རྣམས་ཀྱི་ནི་སློབ་པ་དང་མི་སློབ་པའོ་༎
T07yabhkvyu:7776	 śaikṣāśaikṣebhyas tv anye naiva śaikṣā nāśaikṣāḥ.  asaṃskṛtā api yāvan naiva śaikṣā nāśaikṣā iṣyante.  teṣāṃ  tridhā	T07D4098:317b-8	སློབ་པ་ཡང་མ་ཡིན་མི་སློབ་པ་ཡང་མ་ཡིན་པ་རྣམས་ཀྱི་ནི་རྣམ་པ་གསུམ་མོ་༎
