src_segmentnr	src_original	tgt_segmentnr	tgt_original
T08suvrnavu:1393	 satyādhiṣṭhānasamanantaram eva pracaṇḍasyāmātyasya śarīrād duḥkhavedanā pravigatā  svasthībhūtaśarīraś ca samutthāya bhagavacchāsane samupajātabahumānaḥ sthavirānandasamīpam  upagamya pādayor nipatyovāca /	T14n0550_008:0882b25_13	」作是言時，彼勇戾大臣諸苦銷散輕安如故，即能昇舉，乃於如來清淨教中深生信樂，前詣尊者阿難所，頂禮雙足作是白言：
T08suvrnavu:1396	 labheyāhaṃ sthavirānanda svākhyāte dharmavinaye pravrajyām upasampadaṃ bhikṣubhāvañ careyam ahaṃ sthavirānandasyāntike brahmacaryam iti /	T14n0550_008:0882b27_7	「我今願於尊者法中清淨出家，受具足戒成苾芻相，於尊者所，誓修梵行。
T08suvrnavu:1397	 sa sthavirānandena pravrājitas tathā ca svam anuśiṣṭo yathā tena tasminn eva muhūrte sarvakleśaprahāṇād arhatvaṃ prāptaṃ /	T14n0550_008:0882b29_3	」是時，尊者阿難即為教授出家之法，乃至成苾芻已。 於須臾間斷諸煩惱，證阿羅漢果。
T08suvrnavu:1398	 so 'rhatvaprāpto gaganatalam abhyudgamya vicitraiḥ prātihāryam mahājanamanānsi prahlādayan	T14n0550_008:0882c02_15	證是果已，即時踊身處虛空中，出現種種神變事等，普使一切在會大眾身意泰然。
T08suvrnavu:2162	 upasaṃkrāmya kathayati /	T14n0550_012:0892b25_1	到已，謂言：
T08suvrnavu:1399	 gaganatalād avatīrya sthavirānandapramukhaṃ bhikṣusaṃghaṃ anuparipāṭikayā vanditvaikānte niṣaṇṇaḥ /	T14n0550_008:0882c04_9	是時，勇戾苾芻從空而下，詣尊者阿難等苾芻眾前，次第禮足，退坐一面。
T08suvrnavu:1401	 [75] tatas tad atyadbhutaṃ sthavirānandasya mahātmyaṃ dṛṣṭvā sā parat sthavirānande 'tyartham abhiprasannā /  tatas tāṃ parṣadaṃ tathābhiprasannmanaskām ālokya sthavirānandena tathā vidhā dharmadeśanā kṛtā yāṃ śrutvānekaiḥ prāṇiśatasahasrais mahān viśeṣo 'dhigataḥ /	T14n0550_008:0882c07_14	爾時，一切大眾見尊者阿難廣作如是大威神力希有事已，是諸大眾於尊者所極生最上清淨信重，咸皆歡喜，諦誠瞻仰。 尊者阿難，普為大眾隨其種類如應說法。
T08suvrnavu:1403	 kaiścit srotaāpattiphalaṃ prāptaṃ /  kaiścic chrāvakabodhau cittāny utpāditāni /  kaiścid yāvadbuddhanimnā dharmapravaṇā saṃghaprāgbharā vyavasthitā divākareṇa ca sārthavāhena sapatnīkena satyāni dṛṣṭāni /	T14n0550_008:0882c14_6	是時會中無數百千人眾，聞所說已，其獲果利成證有差，會中或有證須陀洹果者，乃至或有證阿羅漢果者，有發聲聞菩提心者，乃至或有歸向佛者，信樂法者，尊重僧者，各各蒙益如應而住，彼日照商主并其妻室於此會中見諦開悟。
T08suvrnavu:1407	 anekaiś ca devatāśatasahastrais tatas tābhir devatābhiḥ prasannamanasmabhiḥ divyaṃ vastravaryaṃ pātitaṃ /	T14n0550_008:0882c18_14	復有無數百千天人，發生清淨信重之心，雨天寶衣奏天妙樂，又復雨諸天中妙花，謂優鉢羅花、鉢訥摩花、俱母陀花、奔拏利迦花、曼陀羅花等，數量廣大積至于膝。
T08suvrnavu:2163	 bhadanta kim mayā tavāparādhaṃ kṛtaṃ yad evam avarṇaniścāraṇaṃ me kṛtavān asīti /	T14n0550_012:0892b25_20	『我於尊者無所觸嬈，何出惡言固相譏毀？
T08suvrnavu:1549	 paribhuktavatī hṛṣṭā yā mahāsampadaṃ purā /  imām adya daśāṃ prāpya saiva śocati duḥkhinī /5/  aho saṃsāradaurātmyam aho sampadanityatā /  yad evaṃ sukhitā bhūtvā duḥkhabhājanatāṅ gateti /6/  Sva Roy 228,1 - 231,5  [88] tataḥ sārthavāhapatnī tayā preṣyadārikāyā saha anayānupūrvyā paragṛheṣu bhṛtikayā karma kartum ārabdhā /	T14n0550_010:0885a09_8	沙門臣法護等奉　詔譯「爾時，妙耳商主之妻同其女使，日詣他舍傭力取直，以彼醜相童子福力衰竭業增上故，所得工直日漸微少。
T08suvrnavu:1555	 virūpasya ca kumārasyāpuṇyādhipatyena prātidivasam apacīyāmānaṃ mūlyaṃ labhate /  yāvad apareṇa samayenā sūryāstaṃ divasaṃ karma kārayitvā na kiñcil labhyate /	T14n0550_010:0885a10_12	乃至其後，自日初出逮于晚際，倍力營工價無所得。
T08suvrnavu:1557	 yāvat karma 'pi na kaścit kārayati /	T14n0550_010:0885a11_9	又復最後處處營作皆罷，無復傭雇。
T08suvrnavu:1558	 yāvat sārthavāhapatnī tatyā preṣyadārikayā saha sañjalpaṃ kartum ārabdhā /	T14n0550_010:0885a12_3	「時商主妻即與女使互相議言：
T08suvrnavu:2164	 tena tasyāntike cittaṃ pradūṣya kharaṃ vākkarma niścāritaṃ tādṛśaṃ tvayā pāpakarma kṛtaṃ yena tvaṃ śulam arhasīti /	T14n0550_012:0892b27_2	』時說法苾芻轉起恚心，復出惡言增加呵毀，謂言： 『汝有此罪，後當應受鐵叉之苦。
T08suvrnavu:1559	 apīdānīṃ karmāpi na kaścit kārayati /  sarvathā bhikṣām aṭāma iti /	T14n0550_010:0885a12_20	『我等今時無傭力處，宜當周行乞丐。
T08suvrnavu:1561	 te mallakam ādāya bhikṣām aṭitum ārabdhā /	T14n0550_010:0885a13_16	』言已，即時持一瓦器，自行乞食所有。
T08suvrnavu:1562	 yadā ca virūpaḥ kumāraḥ paryaṭituṃ samartho jātaḥ tadā tasya mātrābhihitaṃ putra tvam idānīṃ svayam eva bhikṣām aṭitvā bhuṅkṣveti /	T14n0550_010:0885a14_14	醜相童子俟後成長能履步時，母即告言： 『汝於今時，宜自乞食而用存養。
T08suvrnavu:1565	 tañ cātikṛṣṇaṃ virasacchavim atyantavirūpam aṣṭādaśabhir avalakṣaṇair vidūṣitagātram avalokya loko 'tyantavimukho jāto 'dhomukhaḥ prakrāmati	T14n0550_010:0885a15_18	』言已亦復授一瓦器。 「其子即時持器周行街衢巷陌乞食自資，以彼童子膚體麁黑容貌醜惡，具十八種可厭惡相，人所觀者掩面而去。
T08suvrnavu:1566	 sa yeṣāṃ gṛhadvāraṃ gacchati te tasya tad ativirasaṃ kāyād gandham āghrāya sahasaiva	T14n0550_010:0885a19_17	凡所往詣他舍門首，以其枯瘦穢氣充盈，隨風聞者掩鼻而行。
T08suvrnavu:1567	 nāśāpuṭadvayaṃ pidhāya kāṣṭhapāṣāṇaśarkarādibhis tāḍayitvā niṣkāśayanti śīghram asmād gaccheti /	T14n0550_010:0885a20_12	或以杖木、瓦石打擊驅逐而言： 『速離我舍。
T08suvrnavu:1568	 sa jaṅgama iva nagaravistārajambāle yatra yatra gacchati tatra tatra kāṣṭhapāṣāṇaśarkarādibhis tāḍayitvā niṣkāśyate /  saikabhiṣām apy alabdhvā kāṣṭhapāṣāṇaśarkarādibhis tāḍitas tena mallakena bhagnena krandamāno mātur antikam āgatya bhṛśataramanyumān bhūtvā vikroṣṭum ārabdhaḥ /	T14n0550_010:0885a23_15	』其猶蠕蟲，周行城邑砂礫雜穢處處充塞，隨所往處皆為杖木、瓦石打擲驅逐，奔馳求丐一食竟不能得，所持瓦器亦為打擊所碎。 「童子爾時為人惡賤，啼泣忙然奔詣母所。
T08suvrnavu:1570	 tataḥ sā taṃ dṛṣṭvodvignā urasi prahāraṃ dattvā kathayati /	T14n0550_010:0885a25_9	時母見已，拊膝哀傷，即作是言：
T08suvrnavu:1571	 hā kaṣṭaṃ kasya te putra aparāddhan tu kim bhavet /	T14n0550_010:0885a25_13	『苦哉！ 我子艱危斯甚，彼何等人，無悲愍心不懼其罪？
T08suvrnavu:1572	 kṛpām apāsya yenaivaṃ prahṛtaṃ tvayi duḥkhite /1/	T14n0550_010:0885a27_2	故打擊汝令受斯苦。
T08suvrnavu:1573	 tato virūpaḥ kumāraḥ sasvaraḥ prarudann uvāca /	T14n0550_010:0885a27_18	』「是時，童子哽咽啼泣說伽陀曰：
T08suvrnavu:1574	 yeṣāṃ yeṣāṃ gṛhadvāram ahaṃ gacchāmi yācituṃ /	T14n0550_010:0885a28_0	「『處處往詣於他舍，　　我本乞食而存養，
T08suvrnavu:1575	 te te kaṭhallapāṣāṇaiḥ kāṣṭhādyais tāḍayanti mām iti /2/	T14n0550_010:0885a29_17	翻為杖木及瓦石，　　見者皆來打擊我。
T08suvrnavu:1578	 nūnaṃ kṛtaṃ tvayā ghoraṃ pāpaṃ putrānyajanmaṣu /  bhṛśan nirādho 'pi yenaivaṃ tāḍyase paraiḥ /1/	T14n0550_010:0885b03_19	「『豈非汝於往生中，　　昔曾造作不善業？ 今被他人打擊汝，　　非汝現生之愆尤？
T08suvrnavu:1580	 dhik kaṣṭaṃ bhoḥ /  imam atyantavirasaṃ saukhyavivarjitaṃ /  dīnaṃ yācantam ālokya kṛpotpannā na cetasi /2/	T14n0550_010:0885b05_0	汝身醜惡復枯瘦，　　一切樂事悉離散， 貧窮困苦極艱危，　　無人為興悲恤意。 苦哉！
T08suvrnavu:924	 adrākṣīd rājā 'jātaśatrur uparidhavalagṛhasyāvasthitaḥ /  sthavirānandaṃ mahatābhikṣusaṃghena sārddham arddhacandrākāropagūḍham upari vihāyasā  ṛddhyā sandhyābhrapaṭalair iva gaganatalam alaṅkṛtya mahāśmaśāṇābhimukham āgacchantaṃ	T14n0550_006:0876b11_1	爾時，國主阿闍世王處于嚴潔高廣樓閣之上，瞻見尊者阿難與苾芻眾，如半月相，尊者處中加趺而坐，高涌虛空如雲如蓋，種種莊嚴殊妙可愛，漸來向於棄屍林所。
T08suvrnavu:2165	 tac chrutvā ajitasya bhikṣor etad abhavat /	T14n0550_012:0892b28_6	』「時無勝苾芻聞已自念：
T08suvrnavu:1583	 hā hatāsmi vinaṣṭāhaṃ kena te putra mallakaḥ /  bhagno bhagnaśarīreṇa bhikṣāmātropajīvinaḥ /3/	T14n0550_010:0885b08_17	今時家散壞，　　子身傷損器用破，乞食之具既無成，　　何能乞丐而活命？
T08suvrnavu:1585	 pitrā mātrā vimuktasya muktasya ca gṛhāśramāt /	T14n0550_010:0885b09_7	父母離散子何託？
T08suvrnavu:1586	 kena putra dayāṃ hitvā tava bhagno 'dya mallakaḥ /4/	T14n0550_010:0885b10_17	　　家宅破壞善相衰，乞食之器一無存，　　今時何人復與汝？
T08suvrnavu:1587	 utsannasarvatantrasya varjitasya suhṛjjanaiḥ /	T14n0550_010:0885b11_0	眷屬親愛及朋友，　　主宰尊長悉分離，
T08suvrnavu:2166	 duḥkhito 'yaṃ tapasvy upahataś ceti viditvā pātracīvaram ādāya yathāparibhuktaṃ śayanāsanaṃ pratiśamāyya tasmād vihārān niṣkramya saṃprasthitaḥ	T14n0550_012:0892b28_16	『如斯行業壞修行法。 』知是事已，即自收舉衣鉢受用出離其寺，詣一樹下隨意棲止。
T08suvrnavu:1588	 mitran nātho guruś caiva bhagnas te kena mallakaḥ /5/	T14n0550_010:0885b12_17	乞食之器既無存，　　今時何人復與汝？
T08suvrnavu:1589	 hā putra kena vā vīryaṃ tvayi darśitam āture /	T14n0550_010:0885b13_7	何人見汝嬰貧病？ 　　於中能發勇猛心，苦哉！
T08suvrnavu:1590	 dīne ca hā hato 'si putraka hataḥ pūrvakarmaṇā svena /6/	T14n0550_010:0885b14_18	破壞至如斯，　　由汝先世中罪業？ 苦哉！
T08suvrnavu:2167	 tañ ca saṃprasthitam avalokya bhikṣavo bhikṣuṇyaḥ sa ca karvaṭakanīvāsījanakāyas taṃ nivarttayitukāmāḥ pṛṣṭhato 'nubaddhā //	T14n0550_012:0892c02_8	是時，四眾見已，即同奔逐勸誘欲令迴復，竟不從命。
T08suvrnavu:1591	 hā putra mṛdu śūraḥ kaḥ kasya kṛpā nāvagāhatehṛdayaṃ /	T14n0550_010:0885b15_18	汝是柔善人，　　何故無人為悲愍？
T08suvrnavu:2168	 Sva Roy 326,4 - 329,330  [119] tasya dhārmakathikasya bhikṣoḥ kaukṛtyam utpannaṃ na śobhanaṃ mayā kṛtaṃ yal  lābhasatkārakāraṇād īdṛśam apāyagatisamvartanīyaṃ karma kṛtam ity utpannavaimanasyo	T14n0550_012:0892c02_18	時說法苾芻後自惟忖： 『我今所作誠為不善，以利養因起惡趣業，如是審思心極追悔，我應詣彼求其懺罪。
T08suvrnavu:2172	 aśrudhārāvasicyamānadīnavadano bāladāraka ivoccaiḥ prarudaran paśyatā teṣām anekeṣāṃ  brāhmaṇagṛhapatiśatasahasrāṇām ajitasya bhikṣoḥ pādayor nipatyātyayam atyayato deśayitum ārabdhaḥ /	T14n0550_012:0892c08_16	「是時，無數百千諸婆羅門、長者等眾咸覩是事，到已即時前詣無勝苾芻，頂禮雙足，作是白言：
T08suvrnavu:1592	 pāṣāṇopalakṭhinaṃ hṛdayaṃ kasya kathaya me 'dya /7/	T14n0550_010:0885b16_0	人心堅硬鐵石同，　　損害猶如利刀斧，
T08suvrnavu:1593	 hā kathaṃ tvāṃ parāhantuṃ dīnaṃ mukhaśatair hataṃ /  bhikṣām aṭantaṃ duḥkhārtaṃ lokasyotsahate manaḥ /8/	T14n0550_010:0885b17_17	多種破壞復貧苦，　　於中寧忍起害心。
T08suvrnavu:1599	 tāḍito 'si kathaṃ putra jātigarvamadākulaiḥ /  rujābhibhūte kenādya kṛpā tyaktātiduḥkhite /11/  hā tvayā yat kṣudhārtena bhikṣayā samupārjitaṃ /	T14n0550_010:0885b23_17	於中寧容打擊汝，　　由汝曩生憍倨心。 今時疾病眾苦縈，　　極苦無人垂愍念， 貧窮飢渴苦逼迫，　　乞丐周行何所成？
T08suvrnavu:1602	 stokam annaṃ tad apy adya śvabhiḥ kākaiś ca bhakṣitaṃ /12/	T14n0550_010:0885b26_0	或時極少見於前，　　鵶犬殘餘之棄食，
T08suvrnavu:1603	 hā putra mandabhāgyāham adhunā kiṃ karomi te /	T14n0550_010:0885b27_2	苦哉！ 我身極無福，　　而無方計何所作？
T08suvrnavu:1604	 kṛtapūrveṇa pāpena vidhātrāniṣṭakarmaṇeti /13/  Sva Roy 235,1 - 244,2	T14n0550_010:0885b28_17	宿業斯為破壞因，　　業主所持今如是。
T08suvrnavu:1606	 [90] evaṃ sā 'nekaprakāram ātmananam anuśocantī tasyaiva khaṇḍāvavarakasyāgratas  bhūmau niṣādya śanaiḥ śanaiḥ pāṇinā madayitum ārabdhāḥ /  yāvat sā vīthīmadhyena gacchataḥ paśyaty anekān śreṣṭhiputrān sārthavāhaputrāṃś cānyāṃś	T14n0550_010:0885c01_15	』「爾時商主之妻說是伽陀已，多種逼惱相續憂苦，於其所住殘破舍前暫時存息。 以其醜相童子先被打擊流血污身，抱持居懷，瓦礫雜穢不淨盈滿，以手拂摩童子之身，徐徐而起詣衢巷中。
T08suvrnavu:1610	 cotsadān brāhmaṇagṛhapatīn kāśikadukūlakoṭambakakauśeyasūkṣmātimahārhavicitravastraharṣakaṭakakeyūrāṅgadakuṇḍalahārārddhahāravicitrālaṅkārasamalaṅkṛtaśarīrān  vividhavikacasurabhikusumakalāpavibhūṣitavigrahāṃs tāṃś cātmīyam anatikaṣṭām avasthām	T14n0550_010:0885c07_14	見諸豪貴上族之子，或商主之子，及餘富盛長者婆羅門等，身著殊妙迦尸迦衣絜白清淨，大價翫好真珠瓔珞耳璫環釧種種莊嚴，光絜殊妙花鬘眾飾。
T08suvrnavu:1614	 sampannaikasatākīrṇe ratnaiḥ sāgarasannibhaiḥ /	T14n0550_010:0885c11_0	「『往昔富饒皆滿足，　　眾寶莊嚴如寶山，
T08suvrnavu:1615	 kule suviprule bhūtvāpy anubhūya sukhaṃ paraṃ /1/  vipattibhāginau jātau saṅkārodaravāsinau /	T14n0550_010:0885c12_17	家族廣大悉圓成，　　受用最上諸妙樂。
T08suvrnavu:1617	 sukṛcchreṇāpi yāv āvāṃ nāpnuvo 'nnaṃ bubhukṣitau /2/	T14n0550_010:0885c13_0	今時子母具破壞，　　穢污之處為所歸， 巧出多種乞丐言，　　竟無有人與食者。
T08suvrnavu:1618	 śokārṇavaṃ duḥkhajālormibhīmaṃ santāpanakrograśatābhikīrṇaṃ /	T14n0550_010:0885c15_0	憂苦大海波浪深，　　逼惱怖畏無義利，
T08suvrnavu:1620	 vipattanānakrasahastrasaṃkulaṃ vipattibhīmormitaraṅgacañcalāṃ /	T14n0550_010:0885c16_0	大聲高振危苦增，　　貧窮深流今墜溺， 險惡流中水族滿，　　破散波浪速復危，
T08suvrnavu:1621	 mahārujāviddhabhayapracaṇḍāṃ nadīṃ hi dāridramayīṃ prapannau /4/	T14n0550_010:0885c18_17	極惡大病違害深，　　貧窮濬流俱陷沒；
T08suvrnavu:1622	 duḥkhopalavyādhikharāvakīrṇaṃ santāpasiṃhadhvanipūrṇakuñjaṃ /  śokāṇḍajāvāsaśatābhikīrṇaṃ dāridraduḥkhālayam abhyupetau /5/	T14n0550_010:0885c19_0	病苦憂愁如箭射，　　師子吼聲振野中， 眾鳥聚居憂卵中，　　貧窮憂苦亦如是。
T08suvrnavu:1624	 nūnaṃ purā sādhujane na dattaṃ dānaṃ pramādaskhalitāśayābhyāṃ /	T14n0550_010:0885c21_0	昔於善人不行施，　　不起清淨信施心，
T08suvrnavu:1625	 dīnāv idānīm iha mandabhāgyau paśyāva yad dṛptamukhāni nityaṃ /6/	T14n0550_010:0885c22_17	今時無福子母同，　　見諸樂事如怨隙。
T08suvrnavu:1626	 prāyeṇa yācanakāyācanakaṃ na dattaṃ klībesu bhāgyarahiteṣu vimohitābhyāṃ /	T14n0550_010:0885c23_0	往昔不曾施乞人，　　厭棄尠福下劣者，
T08suvrnavu:1627	 āvāsamātravikalāv api yena jātau klībau yato vyasanam ugrataraṃ prapannau /7/	T14n0550_010:0885c24_17	今生子母破壞時，　　艱難危逼苦同受。
T08suvrnavu:1631	 yenāvān tāḍayaty eṣa janaḥ pāṣāṇaloṣṭakaiḥ /9/	T14n0550_010:0885c28_17	今生被他打擊時，　　杖木瓦石苦當受。
T08suvrnavu:2174	 kṣamasva bhadanta yathā bālena yathā mūḍhena yathāvyaktenākuśalena lābhasatkārābhibhūtena mayā tavābhūtenāvarṇo niścāritas tad atyayam atyato deśayata kṣamasvānukampām upādayeti /	T14n0550_012:0892c08_20	『尊者！ 我今懺罪願尊忍可，我如稚童，我如愚夫，我不明了，貪利養故造不善業，以虛妄緣出不善語，謗訕尊者深為罪咎！ 深為罪咎！ 尊者悲心願垂忍可。
T08suvrnavu:1632	 paribhāṣāpathaṃ nīto nūnaṃ gurujanaḥ purā /	T14n0550_010:0885c29_0	昔不尊重於他人，　　或復出語而呵毀， 今生子母破壞時，　　所向被他還毀責。 先世不曾尊重人，　　或復於他起輕慢，
T08suvrnavu:1633	 yadevaṃ paribhavaḥ kaṣṭamanujāto sudārupaḥ /11/	T14n0550_010:0886a03_17	今生極惡苦難多，　　為他輕慢還隨逐。
T08suvrnavu:1634	 atithibhyo na dattāni āvābhyāṃ pūrvajanmani /  vastrāṇi yena vāsāṃsi na bhavanty adhunāvayoḥ /12/  rodanānādabahulā bahavaḥ kāritā janāḥ /	T14n0550_010:0886a04_0	子母先世俱悋惜，　　見乞丐者不捨與， 我今貧困衣亦無，　　他人還復不霑施。 往昔或於他人事，　　多興違礙及障難，
T08suvrnavu:1637	 yena bandhuvihīnau hi ciraṃ rodiva duḥkhitau /13/	T14n0550_010:0886a07_17	今生眷屬悉分離，　　徒增苦惱長悲泣。
T08suvrnavu:1638	 citrasaṃvyānasaṃvītaṃ na dattaṃ śayanaṃ purā /	T14n0550_010:0886a08_0	往昔遲留及失時，　　不施他人床臥等，
T08suvrnavu:1639	 śarkaropalasaṃkīrṇe svapivo yena bhūtale /14/	T14n0550_010:0886a09_17	今生荊棘地中眠，　　報應昭明自當受。
T08suvrnavu:1640	 āsanāni vicitrāṇi na ca dattāni sādhuṣu /	T14n0550_010:0886a10_0	眾妙莊嚴諸床座，　　往昔不曾施善人，
T08suvrnavu:1641	 āsanaṃ pṛthivī yena bahukaṇṭasaṅkaṭā /15/	T14n0550_010:0886a11_17	今生坐起地為床，　　廣多荊棘而叢聚。
T08suvrnavu:1642	 pūrvaṃ nopānahau dattau na ca yānaṃ sukhāvahaṃ /	T14n0550_010:0886a12_0	往昔不曾施鞋履，　　及彼乘輿諸樂具，
T08suvrnavu:1643	 yena vā kaṇṭakākīrṇe vicarāvo mahītale /16/	T14n0550_010:0886a13_17	今生踐履於地中，　　觸處廣多荊棘等。
T08suvrnavu:1644	 āvāsamatsratayā khalu naiva dattaṃ prāyeṇa cārthini jane gṛhavāsamātraṃ /	T14n0550_010:0886a14_0	舍宅宵宿及器具，　　往昔慳心不曾施，
T08suvrnavu:1645	 ugrāṃśupaṅktiparirājitamadhyabhāgaṃ saṃkārakūṭam iha yena vayaṃ prapannāḥ /17/	T14n0550_010:0886a15_17	恃其豪貴自尊高，　　雜穢聚中今墮入。
T08suvrnavu:2175	 ajito bhikṣuḥ kathayati /	T14n0550_012:0892c12_14	』「無勝苾芻答言：
T08suvrnavu:1646	 saṃśuṣkakaṇṭhapariśuṣkakapolavaktrān pānābhilāṣamanasaḥ samupadīkṣya pūrvaṃ /	T14n0550_010:0886a16_0	往昔曾見枯悴人，　　炎渴之時須水飲， 雖見不肯施清泉，　　今生面目極乾悴。 往昔貧人及親友，　　以飢苦故來求食，
T08suvrnavu:1649	 satkṛtya vānnavidhinā paribhojitāś ca teneha bhakṣyarahitau viparibhrāmavaḥ /19/	T14n0550_010:0886a19_17	不起尊重淨施心，　　今生無食自荒亂。
T08suvrnavu:1650	 āroṣitāḥ parahitapratipattidakṣā nūnaṃ bhavāntaragataiḥ subahuprakāraṃ /	T14n0550_010:0886a20_0	昔見他人利樂事，　　彊生多種嫉恚心，
T08suvrnavu:1651	 yeneha sāmpratam api tu itare 'pi loke ākrośabhājanaparatvam upāgatāḥ smaḥ /20/	T14n0550_010:0886a21_17	于今還感卑下人，　　他來於己生瞋恚。
T08suvrnavu:2176	 āyuṣmān kṣāntam ity uktvātīvasaṃvignacitto 'nyatamaṃ vṛkṣamūlaṃ niśritya niṣaṇṇaḥ  paryaṅkam ābhujya ṛjuṃ kāyaṃ praṇidhāya pratimukhaṃ smṛtim upasthāpya tena tasminn	T14n0550_012:0892c12_18	『大德！ 我已忍可，我今但為心厭憒閙，棲止樹下跏趺宴坐，端身正念修寂靜行。
T08suvrnavu:1652	 āvābhyāṃ bahavo nūnaṃ jātigarvamadāśrayāt /  tāḍitā guṇavanto 'pi jātā yenādhunā kharāḥ /21/	T14n0550_010:0886a22_0	子母往生恃豪族，　　於他常起憍倨心， 或復觸嬈有德人，　　今招極惡苦甘受。
T08suvrnavu:1654	 saṃsārasāgare cetaḥ sarvavyādhibhayāpahaṃ /	T14n0550_010:0886a24_0	無始輪迴生死海，　　一切病苦大怖畏，
T08suvrnavu:1655	 bhaiṣajyaṃ na purā dattaṃ yena rogābhi pīḍitau /22/	T14n0550_010:0886a25_17	不曾施藥為蠲除，　　今招大病常縈逼。
T08suvrnavu:1656	 na snāpitā pitṛvayasyajanā na mātā āpyapitā na guravo na ca dīnalokaḥ /  āsnānapānarahitau vidhinā prajātau yeneha duḥkhaśatabhāgyahatāv anāthau /23/	T14n0550_010:0886a26_0	父母尊長修行者，　　乃至最下貧窮人， 飲食沐浴不施霑，　　今生無福招貧苦。
T08suvrnavu:2178	 eva paramasamvegadravīkṛtacetasā udyacchatā ghaṭamānena vyāyacchamānena idam eva  pañcagaṇḍakaṃ saṃsāracakraṃ calācalaṃ viditvā yāvat sendropendrāṇāṃ devānāṃ pūjyo  mānyo 'bhivādyaś ca samvṛttaḥ /	T14n0550_012:0892c17_12	』說是語已，時無勝苾芻發生最上厭離之心，靜念世間誠堪驚懼，遷流謝滅諸行不停，五眾循環生死流轉，乃至帝釋諸天供養稱讚皆非究竟。
T08suvrnavu:1658	 kṣutapipāsapariklāntau bhaktācchādanavarjitau/	T14n0550_010:0886a28_0	我今飢渴極疲悴，　　飲食衣服悉皆無，
T08suvrnavu:1659	 rogaduḥkhābhisantaptau ko nv āvāṃ pālayiṣyati /24/	T14n0550_010:0886a29_17	諸病諸苦逼迫心，　　今時何人為救護？
T08suvrnavu:1660	 kasya dāsau bhavāvo 'dya kasya vā paricārakau /	T14n0550_010:0886b01_0	子母今欲作奴婢，　　何人容許願承事，
T08suvrnavu:1661	 yo no 'dya jīvitaṃ dadyād asmin loke sudurlabhaṃ /25/	T14n0550_010:0886b02_17	今時二命若獲存，　　此亦世間極難得。
T08suvrnavu:1662	 aho duḥkhaṃ hi dāridrayam aho 'py akṛtapuṇyatā /	T14n0550_010:0886b03_2	苦哉！ 先世不作福，　　苦哉！
T08suvrnavu:1663	 evaṃ sphīte 'pi nagare nātho nāsti yathāvayor iti /26/	T14n0550_010:0886b04_17	貧困今如是，而此國城大豐饒，　　無人為我作依怙。 』「時妙耳商主之妻說是伽陀已，忍受飢渴，身心憂惱，子母同處隨業而住。
T08suvrnavu:1666	 [91] karṇaś ca sārthavāho mahāsamudrād bhagnayānapātraḥ kathañcit phalakam āsādya dārakasahāyo jalāt sthalam uttīryāyātaḥ /	T14n0550_010:0886b08_16	「彼妙耳商主昔涉大海營貿資財，船舫破散沈溺所獲，浮一板木，仗一家童，涉歷艱危扶持得渡。
T08suvrnavu:1667	 mahatā kṛcchreṇa bhikṣām aṭan bandhumatīṃ rājadhānīm āgataḥ /  sa tatra bahiḥ kṣetrake rātrim vāsam upagataḥ /	T14n0550_010:0886b09_13	路中求乞歸滿度摩城，近屆一村宿止。
T08suvrnavu:1669	 tatra cānyatamo bhṛtakapuruṣaḥ kṣetrapālakas tenāsau pratyabhijñātaḥ /	T14n0550_010:0886b11_2	「于彼有一耕人守護彼村，其人見此商主素曾識面，乃自思忖：
T08suvrnavu:1670	 tasyaitad abhavad eṣa sārthavāho 'tikṣāmaśarīro vipannasarvasvan draviṇasañcayo dārakasahāyo 'bhyāgataḥ /	T14n0550_010:0886b11_14	『今此商主何故瘦悴容狀？ 若斯諒其所獲金寶財貨一切破散，唯仗家童扶持來此。
T08suvrnavu:1671	 tat katham asya gṛhapravṛttim ārocayiṣyāmy api tu svayam eva jñāsyatīti viditvā tena tasya hastaprakṣālanodakaṃ datvā māṣapūpavadvayam anupradattaṃ	T14n0550_010:0886b13_16	我今或以商主之家焚蕩事緣而告語邪？ 或復商主後當自知？ 』念已，即時持水授與令其灌手，復以二菉豆餅奉之令食。
T08suvrnavu:1672	 tataḥ karṇena sārthavāhena ekaṃ māṣapūpakaṃ sthāpitaṃ /	T14n0550_010:0886b16_9	「時，妙耳商主自念：
T08suvrnavu:1673	 mā riktahastako gṛhaṃ pravekṣyāmīti viditvā dārakasya haste sthāpitaṃ /	T14n0550_010:0886b16_21	『我今不應空手而歸舍中。
T08suvrnavu:1674	 evaṃ tv arddhārddhikaṃ kṛtvānāhāraśarīreṇa tena dārakena sārddhaṃ bhakṣitam /	T14n0550_010:0886b17_17	』乃取一餅留之懷中，次破一餅與童分食。
T08suvrnavu:1675	 athāparasmin divase karṇaḥ sārthavāhas taṃ māṣapūpakam ādāyātiparamarukṣakṣāmaśarīro 'timalinaikaśāṭakamātrasāro bandhumatīṃ rājadhānīṃ praviśya gṛhaṃ saṃprasthitaḥ //	T14n0550_010:0886b18_8	食已，明旦漸次前進。 而彼商主容貌枯悴，身力困疲，著弊垢衣漸至城邑。
T08suvrnavu:1677	 [92] virūpo 'pi prabhātakāla eva kṣuttṛṣṇāparikṣāmavadanaḥ kim mayā mandabhāgyenātra tiṣṭhatā jīvatā vā prayojanaṃ /	T14n0550_010:0886b20_14	時醜相童子先在殘破舍中，至明旦時，忽自思念： 『我今飢渴消瘦若此，餘命雖存其將何用？
