src_segmentnr	src_original	tgt_segmentnr	tgt_original
T08suvrnavu:465	 Sva Roy 69,1 - 70,3  [31] tac chrutvā suvarṇavarṇasya kumārasya mātā tīvraduḥkhābhyāhatā mūrcchitā bhūmau nipatitā /  tato jalābhiṣekapratyāgataprāṇā utthāya hā putra hā putreti vikrośantī keśā luñcamānā uras tāḍayantī kampamānā muhur muhur moham upagacchantī gṛhān nirgatya vīthīm avatīrṇā /  sā putraviyogaśokābhyāhatā viklavahṛdayā tattad vilapantī ekaikaṃ pṛcchati /  katareṇa pathā suvarṇavarṇaḥ kumāro nīto bhaviṣyatīti /	T14n0550_004:0871b19_20	」是時，日照商主聞是語已，以子別離苦惱逼故，即時悶絕而躃于地，以水灑面，良久乃蘇。
T08suvrnavu:462	 ārye suvarṇavarṇaḥ kumāraḥ paścād bāhugāḍhabandhanabaddho vadhyaghātakair adhiṣṭhito  'nena kilodyāne kāśisundarī dārikā praghātitety avicāryaiva vadhāya parityakto rathyāvīthīcatvaraśṛṅgāṭakeṣv anuśrāvyate /  na cirād eva mahāśmaśānaṃ nītvā praghātyata iti /	T14n0550_004:0871b17_3	「日照商主有子其名金色童子，色相端嚴眾德圓具，而彼童子於自園中殺害迦尸孫那利女，王官不能審察是事，付執法人，將欲棄置四衢巷陌，眾所共聞，童子非久往棄屍林命垂殞謝。
T08suvrnavu:470	 hā putrakaṃ na paśyāmi paritrāyadhvaṃ paritrāyadhvaṃ putrakam me darśayateti /  viruvantī vīthīmadhyena saṃsthitā /	T14n0550_004:0871b21_3	扶持漸起，極大號哭，流淚如雨，四顧觀察，作如是言：
T08suvrnavu:476	 anena pathā putrako me suvarṇavarṇaḥ kumāro nīyate yathā ca taṃ paśyāmi tathā me prasādaṃ kartum arhatheti /	T14n0550_004:0871b21_18	我子金色童子今在何處？
T08suvrnavu:530	 Sva Roy 76,1 - 77,5  [34] divākaraś ca sārthavāhaḥ samudrāt saṃsiddhayānpātro rājagṛham anuprāptaḥ /  sa rājagṛhan nagaraṃ praviśan nimittāny apraśastāni paśyati /  tasya hṛdayaṃ kampitum ārabdhaṃ aṅgāni sīditum ārabdhāni /  netraṃ sphuritum ārabdhaṃ śakunayaś cāsya purataḥ kharam vāśitum ārabdhāḥ /  sa nimittakuśalaḥ śakunirute ca kṛtavī cintayituṃ pravṛttaḥ /	T14n0550_004:0871a28_4	商主素解其占，即作是念：
T08suvrnavu:521	 evam eva kathan nāma nīyate bhoḥ suto mama /7/  śūnyā me 'dya diśaḥ sarvā vepate me kaḍevaraṃ /  dahyate hṛdayañ cāpi moham eti ca mānasaṃ /8/  tvaritatvaritaṃ nīto nṛśaṃsair vadhyaghātakaiḥ /  hā hā na bhūyo drakṣyāmi sutaṃ hṛdayavallabhaṃ /9/	T14n0550_004:0871a26_18	當入城時，商主忽見不吉祥相，即時商主心生驚怖，身極顫掉，兩目眴動；
T08suvrnavu:536	 yathaitāni nimittāny apraśastāni samanupaśyāmi dhruvam adya suvarṇavarṇasya kumārasya mahān upadravaḥ samupasthito bhaviṣyati /  tathā hy etāni nimittāni tadviyogaṃ sūcayantīty āha ca /	T14n0550_004:0871b01_6	「如我今者所見之相，極不祥善，決定我子金色童子有嬈亂事，今應在近，如相法說必有別離。 」于是商主說伽陀曰：
T08suvrnavu:538	 yathā sphurati netram me yathā rauti vihaṅgamaḥ /	T14n0550_004:0871b02_0	「如我兩目俱眴動，　　群飛厲聲而鳴噪，
T08suvrnavu:539	 dhruvam me putrakenādya viyogaḥ samupasthitaḥ /1/	T14n0550_004:0871b03_17	決定我子於今時，　　別離之苦應在近。
T08suvrnavu:540	 yathā cāṅgāni sīdanti vepate hṛdayañ ca me /	T14n0550_004:0871b04_0	又若身支發顫掉，　　其心熱惱驚怖生，
T08suvrnavu:541	 dhruvaṃ putraviyogo 'dya dāruṇaḥ samupasthita iti /2/	T14n0550_004:0871b05_17	決定親子今別離，　　惡相同前應在近。
T08suvrnavu:542	 Sva Roy 77,5 - 80,81  [35] sa evam anarthaśatasahasrāṇi cintayan sīdamānāṅgapratyaṅgaḥ /	T14n0550_004:0871b07_15	」商主說是伽陀已，當其身心顫怖之際，思百千種無義利事，遲疑盤旋不知所止。 又復惟忖：
T08suvrnavu:544	 vepathur apragalbhapadasañcāraḥ kathañcid rājagṛham anupraviṣṭo yāvac chṛṇoti mahājanakāyasya krandanaśabdaṃ /	T14n0550_004:0871b08_11	「我今何故來復此城？ 」乃至後時，聞多人眾舉聲㘁叫，商主聞是㘁叫聲時，又復思念。
T08suvrnavu:960	 rāgatoyamadāvarttaṃ mānormbhibhavasāgaraṃ /	T14n0550_006:0876c17_0	「貪瞋憍慢常相續，　　流注三有海無窮，
T08suvrnavu:961	 vīrya plavaṃ samāruhya tvam adya pratariṣyasi /3/	T14n0550_006:0876c18_17	乘彼精進智慧舟，　　我今為汝令枯涸。
T08suvrnavu:962	 janmabhogaṃ jarāliṅgaṃ mṛtyukandarasaṃkulaṃ /	T14n0550_006:0876c19_0	生為大苦老為根，　　死即是極巇險處，
T08suvrnavu:963	 prajñāvajreṇa mahatā bhetsyase duḥkhaparvataṃ /4/	T14n0550_006:0876c20_17	勝慧金剛大利堅，　　破諸苦山悉摧碎。
T08suvrnavu:545	 sa tam ākrandanaśabdam anusaran vīthīm avatīrṇo yāvat paśyati mahājanakāyaṃ rākṣasopadrutam  iva nagaraṃ viyogaduḥkhābhyāhataṃ krandamānaṃ tena sammukhāgato 'nyatamaḥ puruṣaḥ pṛṣṭaḥ /	T14n0550_004:0871b11_6	乃適四衢，復見多人如被羅剎怖畏侵惱，各各皆有別離苦逼。 居商主前，乃見一人，即發問言：
T08suvrnavu:547	 bhoḥ puruṣa kim idam iti /	T14n0550_004:0871b12_5	「仁者！ 今此何故事相如是？ 」彼人答言：
T08suvrnavu:548	 sa ca tan na jānāti yathāyam evāsau divākaraḥ sārthavāha iti /  tenākhyātaṃ divākarasya sārthavāhasya putraḥ suvarṇavarṇo nāma kumāro 'tyantaṃ rūpādiguṇasampadā  yuktas tena kilodyāne kāśisundarī dārikā praghātitety avicāryaiva vadhāya parityakto  na cirād eva mahāśmaśānaṃ nītvā praghātyata iti /	T14n0550_004:0871b17_3	「日照商主有子其名金色童子，色相端嚴眾德圓具，而彼童子於自園中殺害迦尸孫那利女，王官不能審察是事，付執法人，將欲棄置四衢巷陌，眾所共聞，童子非久往棄屍林命垂殞謝。
T08suvrnavu:553	 tac chrutvā divākaraḥ sārthavāhaḥ putraviyogaduḥkhābhyāhataḥ sahasaiva mūrcchito bhūmau nipatitaḥ /	T14n0550_004:0871b19_20	」是時，日照商主聞是語已，以子別離苦惱逼故，即時悶絕而躃于地，以水灑面，良久乃蘇。
T08suvrnavu:554	 tato jalābhiṣekapratyāgataprāṇa utthāya bāṣpormitaraṅgāpūryamāṇavadanakamalaḥ sambhrāntaḥ sa nirīkṣamāṇa hā katareṇa pathā suvarṇavarṇaḥ kumāro nīto bhaviṣyatīti /	T14n0550_004:0871b21_3	扶持漸起，極大號哭，流淚如雨，四顧觀察，作如是言： 「苦哉！ 我子金色童子今在何處？
T08suvrnavu:964	 kalpakoṭisahasreṣu yan na labdhaṃ tvayā padaṃ /	T14n0550_006:0876c21_0	經千俱胝劫數中，　　勤苦積集所未得，
T08suvrnavu:555	 vīthīmadhyena tvaritatvaritaṃ saṃprasthitaḥ /  yāvat paśyati tāvat paśyati bhāryāṃ muktakeśīm ubhābhyāṃ pāṇibhyām uras tāḍayantīṃ  ārtasvaraṃ tat tadvilapantīṃ sutaviyogajāṃ duḥkhāṃ tīvrāṃ kharāṃ kaṭukām amanaāpāṃ  vedanāṃ vedayamānāṃ dṛṣṭvā ca punas tīvramanyūparuddhagadgadāyamānakaṇṭho bāṣpāmbupariplutekṣaṇas	T14n0550_004:0871b24_4	」于是商主速疾周行巷陌尋求，乃見己妻荒迷散髮，拊膝悲號，逼迫哀聲，周行馳走，以子別離極大苦故。
T08suvrnavu:559	 tasyāḥ sakāśam upasaṃkrāntaḥ /	T14n0550_004:0871b25_3	商主見已，極生悲惱，哽咽流淚漸近其前。
T08suvrnavu:561	 [36] sā taṃ dṛṣṭvā dviguṇataraśokaśalyābhyāhata bāṣpormmitaraṅgāpūryamāṇavadanakamalā sasambhramā tvaritaṃ tvaritam utthāya tasya purata ātmānaṃ kṣiptavatī /	T14n0550_004:0871b26_11	妻見夫已，倍復悲號，憂箭射心流淚如雨，速詣夫前舉體投地。
T08suvrnavu:562	 sā tato divākareṇa sārthavāhenārtasvaraṃ krandamānā pariṣvajyotthāpitā /  sā tasya pādayor nipatyovāca /	T14n0550_004:0871b28_3	于是，日照商主前執其手高聲號哭，妻乃趨前虔伸拜奉，即作是言：
T08suvrnavu:564	 sārthavāhaṃ paritrāyasva paritrāyasva putrabhikṣām me 'nuprayacchety āha ca /	T14n0550_004:0871b28_9	「仁者夫主！ 救我！ 救我！ 我今從夫乞彼愛子，願夫哀察。 」說伽陀曰：
T08suvrnavu:565	 mandabhāgyāṃ nirānandā mām āśvāsaya sāṃprataṃ /	T14n0550_004:0871c01_0	「願今夫主安慰我，　　我無福分無歡喜，
T08suvrnavu:566	 viyujyamānāṃ putreṇa virudantīṃ suduḥkhitāṃ /1/	T14n0550_004:0871c02_17	我今與子別離時，　　極大苦惱徒悲泣。
T08suvrnavu:567	 yasya janmani te svāmin ānandaaḥ paramo 'bhavat /	T14n0550_004:0871c03_0	夫主共知子生時，　　若獲最上大喜者，
T08suvrnavu:568	 sa eva māraṇāyādya nīyate vallabhaḥ sutaḥ /2/	T14n0550_004:0871c04_17	何故愛子復于今，　　執持受死而非久？
T08suvrnavu:569	 vinītaḥ peśalo dakṣo naikaśāstraviśāradaḥ /	T14n0550_004:0871c05_0	我子調善復少勇，　　多種教典悉明解，
T08suvrnavu:570	 rūpeṇānupameyaś ca nīyate paṇḍitaḥ sutaḥ /3/	T14n0550_004:0871c06_0	色相端嚴無比倫，　　大智之子將命殞，
T08suvrnavu:571	 chidyate kulavaṃśas te bhidyate kulamethikā /	T14n0550_004:0871c07_0	斷我大族中種姓，　　破我大族中根源，
T08suvrnavu:572	 kulodyotakaraḥ śrīmān dīpo nirvāpyate tava /4/	T14n0550_004:0871c08_17	族中明炬大吉祥，　　息滅如是諸光照。
T08suvrnavu:573	 etad dhṛdaya sarvasvam etat prītinibandhanaṃ /	T14n0550_004:0871c09_0	我子是為心中寶，　　是為相續中深愛，
T08suvrnavu:574	 etan netrāmṛtaṃ nṝṇāṃ nīyate vadhyaghātakaiḥ /5/	T14n0550_004:0871c10_17	我子眾中甘露眼，　　為執法者將刑戮。
T08suvrnavu:575	 sarvam etad dhi kriyate etac cakṣur nirudhyate /	T14n0550_004:0871c11_0	一切皆為子所作，　　失子猶如眼喪滅，
T08suvrnavu:576	 putrābhidhānaṃ hṛdayaṃ etad utpāṭya nīyate /6/	T14n0550_004:0871c12_17	集聚心寶子亦然，　　何故今時將破壞？
T08suvrnavu:577	 tac chīghraṃ kriyatāṃ yatna[ḥ] sutasya parimuktaye /	T14n0550_004:0871c13_0	夫當速疾發勤勇，　　為子廣施善方便，
T08suvrnavu:578	 sarvasvam api dattvādya putraṃ māñ ca vimocaya /7/	T14n0550_004:0871c14_17	若人能救我子時，　　一切珍寶我今與。
T08suvrnavu:579	 ṛdhyantu tava saṅkalpā ṛdhyatv āśāsitum manaḥ /  apy eva tañ ca jīvantaṃ drakṣyāmi tava putrakam iti /8/	T14n0550_004:0871c15_0	我見汝子於今時，　　未臨刑戮餘命在， 隨汝意樂及思惟，　　宜今速作救護事。
T08suvrnavu:581	 Sva Roy 83,5 - 86,87  [37] atha divākaraḥ sārthavāhaḥ putraviyogaśokaduḥkhābhyāhato 'pi dhairyam avalaṃbya cittena kṛtakarapuṭaḥ paurān uvāca //	T14n0550_004:0871c19_2	」爾時，日照商主雖復以子離別憂苦逼迫哀切，然且奮警身心扶持，前詣諸人眾所，合掌告言：
T08suvrnavu:583	 bhoḥ bhoḥ paurāḥ śrūyatāṃ kathan nāma yuktaṃ bhavatāmamedaṃ vyasanam upasthitam upekṣituṃ /	T14n0550_004:0871c19_8	「汝諸仁者！ 咸聽我語，我於今時險惡艱難斯現所發，汝等何不少施方便放捨救護？
T08suvrnavu:584	 katham aṭavyām ivāvicārya nagaramadhyena yuṣmākaṃ paśyatām eva prakāśaguṇo 'pi me kumāro vadhāya nīyate /	T14n0550_004:0871c21_17	若曠野中事難明察，今在王城汝豈不見？ 況復我子有德顯明，何故付執法人持將刑戮？
T08suvrnavu:585	 katham alpotsukās tiṣṭhatha /  kathaṃ pratīkāravirdhir na cintyate /	T14n0550_004:0871c23_12	汝等何不少發悲心勤力救護？ 云何王者多種法律不審思惟？
T08suvrnavu:587	 kathaṃ kumārasya muktaye na prayatnadhvam iti /	T14n0550_004:0871c24_18	何不勇銳其心放捨我子？
T08suvrnavu:588	 te kathayanti sārthavāha īdṛśo 'yaṃ kumāro guṇavāṃs tavaivaiaksyedaṃ vyasanam api tu sarveṣām evāsmākaṃ kin tūpāyan na paśyāmaḥ kumārasya pratimuktaye  yenaiva viṣaṇṇāmanasas tiṣṭhāma iti /	T14n0550_004:0871c25_8	」時諸人眾中一答言： 「商主！ 汝此童子圓具眾德我等悉知，且於今時非汝一人獨受艱苦，我等內外一切人眾悲苦亦同，然亦我等未見方便，能令童子而獲放捨，是故我等心各愁憂，咸生熱惱。
T08suvrnavu:590	 divākaraḥ sārthavāhaḥ kathayati /	T14n0550_004:0871c29_13	」商主復言：
T08suvrnavu:591	 bhavantaḥ parijñāta eva yuṣmābhir ayaṃ kumāro yathātyantaṃ kāruṇiko mahātmā dharmakāmaḥ sattvavatsalaḥ /	T14n0550_004:0871c29_19	「汝諸仁者！ 又復應知，今此童子畢竟純善，悲心增劇有大威德，法欲具足愛念眾生，豈於如是無義利事而能發心？
T08suvrnavu:592	 cittam apy ayam īdṛśe 'kārye na samartha utpādayituṃ prāg evācarituṃ /	T14n0550_004:0872a03_9	況復行邪？
T08suvrnavu:593	 tataḥ kumārasya pravicāraṇārthaṃ yatna ārabhyatāṃ /  yadi kumāraḥ pravicāryate niyatam asmād vyasanāt parimucyate /  yūyañ ca sādhavaḥ sarvajanasādhāraṇās tad yuṣmākaṃ vijñāpayatāṃ na kaścid doṣo dṛśyate /  nānyatra mayy anukampā darśitā bhavati /	T14n0550_004:0872a04_8	願諸仁者速於今時特為審察，如是事相。 若或詳審，而此童子事有實者，此之危難願令放捨，汝等人眾若於是事詳證可成，一切人眾同汝教令，是故無少過失可得。
T08suvrnavu:597	 sādhutvāt guṇānurāgitvañ ca prakāśitaṃ bhavati /  yat kāruṇyacittaṃ paryupasthāpya gatvā rājā vijñapyatāṃ /  tanmantriṇo vā kadācic ca te 'rtharucitvāt suyuktam api yuṣmadvacanam anyathā na manayanti /	T14n0550_004:0872a10_19	此外別無悲愍之心而為發現，若其然者，汝等能善愛敬有德悲心顯明，汝等若發悲愍心已，應詣王所，求王教令勅前臣輔，如汝所言宣示其事，無復別異而可信聽。
T08suvrnavu:600	 ahañ ca putraviyogenātyantaṃ vyathitaḥ /  tataḥ sarvasvam api madīyaṃ dattvā tathā prasādaḥ karaṇīyo yathā kumāraḥ pravicāryata iti /  Sva Roy 87,1 - 89,3	T14n0550_004:0872a13_11	仁者當知，我今為子將其別離畢竟艱苦，能救護者我今悉與一切珍寶，惟願汝等廣施恩惠，為此童子如理詳察。
T08suvrnavu:603	 [38] prajñāto 'sau sārthavāhaḥ kṛtamitraś ca /  teṣu vacanāt kumāraguṇānurāgāc cābhyupagataṃ tataḥ taiḥ pravīṇā vyavahāriṇaḥ paurikā rājakulaṃ preṣitā uktāś ca /	T14n0550_004:0872a14_18	」時諸人眾聞商主言，具明其意，互相謂曰： 「今此童子，眾德咸具，深可愛敬。 」即時眾中召其二三有智之人、明正理者，遣詣王所具奏於王：
T08suvrnavu:605	 sa ced adya kumāraḥ punar nipuṇataraṃ pravicāryate vayam api rājñaḥ suvarṇalakṣam anuprayacchāma iti /	T14n0550_004:0872a19_4	「若王今時為金色童子勅彼臣輔，令其審細重復詳察事之虛實，我等民眾以十萬金奉上於王。 」王從所奏。 時有智人詣掌法司，先勅詳辯勇戾大臣之所。
T08suvrnavu:606	 tatas te paurikā vyavahāriṇaḥ karaṇamaṇḍapaṅgatāḥ pracaṇḍena cāmātyena dūrata eva dṛṣṭā uktāś ca bhavantaḥ kim āgamanaprayojanam iti /	T14n0550_004:0872a21_18	爾時，勇戾大臣遠見二三人來，即發問言： 「汝等無其事緣，何故來此？
T08suvrnavu:607	 tair ākhyātaṃ rājagṛhanivāsinaś ca paurā evaṃ vijñapayanty ayaṃ suvarṇavarṇaḥ kumāro  'tyarthaṃ rūpaudāryasampadā yuktatvān mahājanavallabhaś ced asya viyogād rājagṛhanivāsino	T14n0550_004:0872a22_16	」諸人答言： 「我等王舍大城所居，人眾哀告：
T08suvrnavu:611	 tad vayaṃ suvarṇalakṣam anuprayacchāmaḥ /  divākaraś ca sārthavāhaḥ sarvasvam asmadvijñaptyā suvarṇavarṇaḥ kumāraḥ pratinivartya punar nipuṇataraṃ pravicāryatām evaṃ kṛte cāsmākaṃ vijñāptisākalyaṃ kṛtaṃ bhavati /  rājñaś ca koṣaḥ samvarddhito bhavati /  Sva Roy 89,3 - 91,5	T14n0550_004:0872b01_7	』王勅仁者，今為金色童子重復審細詳辯前事，我等以十萬金奉上於王，日照商主亦自排備眾多珍寶而以奉之，令王廣藏有所增益。
T08suvrnavu:615	 [39] pracaṇḍo 'mātyaḥ śrutvā ruṣitaḥ kathayati /	T14n0550_004:0872b02_14	」時勇戾大臣聞是語已，忿恚答言：
T08suvrnavu:616	 bhavantaḥ kim atra na vicāritaṃ yad bhūyo vicāryate yac ca kathayata rājakośa eṣa saṃvarddhito bhavatīti /  tata kiṃ vayam anyāyopāttair dravyai rājakośaṃ samvarddhayiṣyāmaḥ /	T14n0550_004:0872b03_8	「事定已久，汝等何故復令詳辯？ 又復何言與十萬金令增王藏，豈我今時非理取財增王府庫？
T08suvrnavu:618	 na ca yuṣmābhī rājño 'bhiprāyo 'vabuddhaḥ /  sarvathā yūyam avaśyaṃ vaiśālakānāṃ prayogeṇāsya rājño 'narthaṅ karttukāmā yenaivam upāyenāsya rājño 'varṇaṃ niścārayitum icchatha /  anyāyakāry eva rājā yad evam avicāryaṃ janapadaṃ vināśayatīti /  tena te nirbhartsitāḥ /	T14n0550_004:0872b08_12	汝等誠謂不知王意，汝諸人眾於一切處巧設計智，欲令王者作無義利，此非方便，乃是汝等出譏謗言謗於王者，若或餘事欲令王者同斯詳辯，即見多人悉皆破壞。
T08suvrnavu:622	 sa tān nirbhartsayitvā catvāro 'sya kṛtāntapuruṣasadṛśāḥ santi manuṣyā atiraudrakarmāṇaḥ satatābhyāsavaśān nirghṛṇīkṛtasantānā niṣkaruṇās tān āhūya kathayati /	T14n0550_004:0872b10_4	」時勇戾大臣呵責彼等二三人已，即時呼召四類惡人： 所謂造作極惡業者、不忍辱者、無慈愍者、無悲心者。
T08suvrnavu:623	 gacchata śīghraṃ vadhyaghātakān adhitiṣṭhata /  asmādvacanācca vaktavyā śīghram enaṃ nagarān niṣkāsya yathā sandiṣṭena vidhinā praghātayata /	T14n0550_004:0872b11_14	召已，謂言： 「汝等今速監逐彼諸膾宰之人出於城外，依我所言，如王法令殺彼童子。
T08suvrnavu:625	 na ca yuṣmābhir māṃ muktvā rājānam vānayasya kasyacid vacanenāyaṃ moktavyaḥ /	T14n0550_004:0872b14_8	汝等勿得輒令放捨，自餘臣佐或有所言亦不可放。
T08suvrnavu:626	 evaṃ hi kurvatāṃ śreyo 'nyathāhaṃ bhavatām mahāmarāryādābandaṅ karomīti /	T14n0550_004:0872b15_3	汝等若或依我教令斯即甚善； 若不從命起異見者，我與汝等大生怨縛。
T08suvrnavu:627	 evaṃ svāminn iti te rājapuruṣās tasya pratiśrutya khaḍgapāṇayaḥ saṃprasthitās /	T14n0550_004:0872b16_8	」彼等答言： 「我今從命。 」是時，四監逐官受旨命已，各執利劍監逐前行。
T08suvrnavu:965	 tad vatsa durlabhataraṃ prāpsyasy adya nirāsravam iti /5/	T14n0550_006:0876c22_17	極難得者於今時，　　謂令汝得無漏法。
T08suvrnavu:629	 [40] te vadhyaghātakā vyākṣepaśatāni kurvāṇāḥ śainaḥ śainaḥ suvarṇavarṇaṃ kumāraṃ  rathyāvīthīcatvaraśṛṅgāṭakeṣv anuśrāvayantaḥ paribhrāmayanto 'ho vata kumārasya kecit	T14n0550_004:0872b20_8	時諸膾宰審慮百端運謀方計，徐緩進步執持童子，迂轉四衢周行巷陌，欲令一切普使聞知，乃作是言： 「苦哉！
T08suvrnavu:631	 mocayitāro bhaviṣyanty apy evaṃ vayam īdṛśam akāryaṃ na kurma iti /	T14n0550_004:0872b21_7	我今作何方計，今此童子脫免斯難？ 我等今時，豈能作此無義利事？
T08suvrnavu:632	 te rājapuruṣā nikṛṣṭakhaḍgapāṇayas samprāptā tais teṣām vadhyaghātakānāṃ yathā sandiṣṭam ākhyātaṃ /	T14n0550_004:0872b24_3	」是時，四監逐官各執利劍，詣諸膾宰之前，告語彼言：
T08suvrnavu:633	 uktāś ca yady enaṃ śīghraṃ nagarān niṣkrāmya yathā sandiṣṭena vidhinā na praghātayata /  vayaṃ yuṣmān sāmpratam eva praghātayāma iti /	T14n0550_004:0872b26_10	「汝等宜應如，彼大臣所授旨命速營其事，汝等若不速出城外，如彼法令殺其童子，我即今時斷汝等命。
T08suvrnavu:635	 te tān atisekanikṛṣṭān khaḍgavyagraṣṭān yamapuruṣān ivālokya saṃtrastās tato maraṇabhayabhītāś cintayituṃ pravṛttāḥ hā kaṣṭaṃ na kenacit kumārasya paritrāṇaṃ kṛtaṃ /	T14n0550_004:0872b28_1	」而彼四類極惡監逐之官，各執利劍其狀可畏，怒目觀視彼諸膾宰。 是時，彼等慮其斷命，咸生驚怖，皆言： 「苦哉！
T08suvrnavu:636	 sāṃpratam asmābhir eva praghātayitavyo bhaviṣyatīti /	T14n0550_004:0872c01_4	我等今時無復方計救此童子，須宜從命而將致殺。
T08suvrnavu:637	 bāṣpāmbupariplutekṣaṇais tai rājapuruṣair adhiṣṭhitāḥ suvarṇavarṇaṃ nagarān niṣkrāmayitum ārabdhāḥ /	T14n0550_004:0872c01_15	」言已，悲傷滿目垂淚。 是時，四監逐官疾速催驅金色童子出於城外。
T08suvrnavu:639	 [41] tañ ca nagarān niṣkāsyamānam ālokyānekāni prāṇiśatasahasrāṇi ekaraveṇoccair vikroṣṭum ārabdhāni hā kaṣṭam eṣa /	T14n0550_004:0872c04_12	當其童子出城之時，有無數百千人眾奔馳瞻覩，傷痛流淚，異口同音，咸作是言： 「苦哉！
T08suvrnavu:640	 divākaraḥ sārthavāhaḥ sarvasvena viyujyate /  eṣa divākarasya sārthavāhasya mātṛkāvaṅśaś chidyate /  eṣa divākarasya sārthavāhasya kulapradīpo antardhāpyate /  eṣa divākarasya sārthavāhasya kulanandano 'ntadrghāpyate /  eṣa divākarasya sārthavāhasya kulacūḍāmaṇirapahriyate /  eṣa divākarasya sārthavāhasya cakṣur nirudhyate /  etad divākarasya sārthavāhasya kulavibhūṣaṇam apahriyate /  etad divākarasya sārthavāhasya hṛdayam utapāṭyate /	T14n0550_004:0872c09_16	日照商主大寶散失，又此日照商主根源上族而悉斷壞，日照商主族中明炬而將息滅，日照商主族中最上髻珠墜落，日照商主清淨眼滅，日照商主妙好莊嚴今悉離散，日照商主心極痛傷其猶開剖，日照商主體中命殞。
T08suvrnavu:648	 amī divākarasya sārthavāhasya mūrtimantaḥ prāṇā apahriyante /  hā kaṣṭaṃ kathaṃ nāma kumāro 'ṭavyām evaṃ paribhrāmya niṣkāsito na kenacid asya paritrāṇaṃ kṛtaṃ /	T14n0550_004:0872c10_2	苦哉！ 何故令此童子出於城外曠野孤逈寂寥之所？ 盤旋宛轉無救無依？
T08suvrnavu:966	 Sva Roy 141,3 - 144,145  [56] athaitat sthavirānandād upaśruta suvarṇavarṇaḥ kumāro gatapratyāgataprāṇa ivāśvasitaḥ saṃhṛṣitatanuruho gaganatalāsaktadṛṣṭiḥ sthavirānandāvarjitaikamanaso 'bhavat /	T14n0550_006:0876c25_11	」爾時，金色童子得聞尊者阿難如是語已，如還命人，身心安隱生大歡喜，仰觀虛空專注一心，向彼尊者瞪目觀視。
T08suvrnavu:650	 eṣa sāmprataṃ rājagṛhān nagarāc candramā mṛtyurāhuṇā grasyate /  eṣa rājagṛhanagaranabhastaladivākaro 'staṅgacchati /  etad rājagṛhanagaranivāsināṃ paurāṇāṃ netrāmṛtam adarśanapathe vyavasthāpyate /	T14n0550_004:0872c13_16	今此童子於其最勝王舍城中，如清淨月為彼羅睺之所吞食，又此王舍大城如空中日白晝銷殞； 王舍大城所居人眾，喪甘露眼迷失方處； 王舍大城所居人眾，相續深愛而悉離散；
T08suvrnavu:653	 etad rājagṛhanagaranivāsināṃ paurāṇāṃ prītinibandhanaṃ vilupyate /  etad rājanagṛhanagaranivāsināṃ paurāṇāṃ vibhūṣaṇam apahriyate /  eṣa rājagṛhanagaranivāsināṃ paurāṇāṃ cūḍāmaṇir apahriyate /  eṣa rājagṛhanagaranivāsināṃ paurāṇāṃ hṛdayavallabho vināśāya nīyate /	T14n0550_004:0872c16_12	王舍大城所居人眾妙好莊嚴今已廢棄； 王舍大城所居人眾髻珠墜落； 王舍大城所居人眾心所愛寶今悉破壞；
T08suvrnavu:657	 kam idānīṃ rājagṛhanivāsinaḥ paurā animiṣam avalokayiṣyanti /	T14n0550_004:0872c19_5	王舍大城所居人眾目既喪，明將何瞻覩？
T08suvrnavu:658	 kam idānīṃ dṛṣṭvā prītimanaso bhaviṣyantīti nirāśībhūtāḥ //	T14n0550_004:0872c20_2	我等今時見是事已，云何能生悅樂？ 心意誠謂我等無所依止。
T08suvrnavu:659	 Sva Roy 96,5 - 99,2  [42] pracaṇḍasyāmātyasyānyatayamena puruṣeṇāgatya niveditaṃ /	T14n0550_004:0872c22_3	」爾時，童子既出城已，彼監逐官遣人來白勇戾大臣：
T08suvrnavu:661	 niḥkāsitaḥ suvarṇavarṇaḥ kumāro rājagṛhān nagarād iti /	T14n0550_004:0872c22_15	「金色童子已出王舍大城。
T08suvrnavu:662	 sa śrutvā prītimanāḥ samvṛttaḥ /	T14n0550_004:0872c23_5	」時勇戾大臣聞已歡喜。
T08suvrnavu:676	 uccair vikroṣṭum ārabdhaḥ /  locanānanda hā putra hā me kulavibhūṣaṇa /	T14n0550_005:0873a20_3	「苦哉！ 我子󰭅怡眼，　　苦哉！ 族中大莊嚴，我為汝父福尠微，　　為害汝故大號哭。
T08suvrnavu:679	 vimuhyate me hṛdayaṃ bhramanti ca diśo 'dhunā /	T14n0550_005:0873a22_0	我為汝故心離散，　　于今迷轉於諸方，
T08suvrnavu:968	 tatas tai rājapuruṣais te vadhyaghātakā uktāḥ /	T14n0550_006:0876c26_4	是時，四監逐官謂諸膾宰言：
T08suvrnavu:680	 tvadviyogāgnisaṃtaptaṃ dahyate vata me manaḥ /2/	T14n0550_005:0873a23_12	與汝別離火熾然，　　苦哉！ 焚燒我心意。
T08suvrnavu:681	 paṇḍitasya vinītasya kāruṇyaniratasya ca /	T14n0550_005:0873a24_0	汝是調善有智人，　　增上愛樂悲愍者，
