src_segmentnr	src_original	tgt_segmentnr	tgt_original
T10nrat_4_u:112	 alātacakraṃ gṛhṇāti yathā cakṣur viparyayāt /	T04D3862:227a-14	མགལ་མེའི་འཁོར་ལོ་འཛིན་བྱེད་པ་༎
T10nrat_4_u:113	 tathendriyāṇi [ 17b ] gṛhṇanti viṣayān sāmpratān iva // RATNA_04.57	T04D3862:227a-15	དེ་བཞིན་དབང་པོ་རྣམས་ཀྱིས་ནི་༎ དེ་ལྟའི་ཡུལ་དག་འཛིན་པར་བྱེད་༎
T10nrat_4_u:114	 indriyāṇīndriyārthāś ca pañcabhūtamayā matāḥ /	T04D3862:227a-17	དབང་པོ་དང་ནི་དབང་དོན་རྣམས་༎ འབྱུང་བ་ལྔ་ཡི་རང་བཞིན་འདོད་༎
T10nrat_4_u:115	 pratisvaṃ bhūtavaiyarthyād eṣāṃ vyarthatvam arthataḥ // RATNA_04.58	T04D3862:227a-19	འབྱུང་བ་སོ་སོར་དོན་མེད་པས་༎ འདི་དག་དོན་དུ་དོན་མེད་དོ་༎
T10nrat_4_u:116	 nirindhano 'gnir bhūtānāṃ vinirbhāge prasajyate /	T04D3862:227a-21	འབྱུང་རྣམས་སོ་སོར་ཐ་དད་ན་༎ བུད་ཤིང་མེད་པའི་མེར་ཐལ་འགྱུར་༎
T10nrat_4_u:117	 saṃparke lakṣaṇābhāvaḥ śeṣeṣv apy eṣa nirṇayaḥ // RATNA_04.59	T04D3862:227a-23	འདུས་ན་མཚན་ཉིད་མེད་འགྱུར་ཏེ་༎ ལྷག་མ་ལ་ཡང་དེ་ལྟར་ངེས་༎
T10nrat_4_u:118	 evaṃ dvidhāpi bhūtānāṃ vyarthatvāt saṅgatir vṛthā /	T04D3862:227a-25	དེ་ལྟར་འབྱུང་རྣམས་རྣམ་གཉིས་སུའང་༎
T10nrat_4_u:119	 vyarthatvāt saṅgateś caivaṃ rūpaṃ vyartham ato 'rthataḥ // RATNA_04.60	T04D3862:227a-27	འདུས་པ་དོན་མེད་ཉིད་ཀྱི་ཕྱིར་། གཟུགས་ཀྱང་དོན་དུ་དོན་མེད་དོ་༎
T10nrat_4_u:120	 vijñānavedanāsaṃjñāsaṃskārāṇām ca sarvaśaḥ /	T04D3862:227a-29	རྣམ་ཤེས་ཚོར་དང་འདུ་ཤེས་དང་༎ འདུ་བྱེད་རྣམས་ཀྱང་ཐམས་ཅད་དུ་༎
