src_segmentnr	src_original	tgt_segmentnr	tgt_original
T11bsa069_u:0	 Tarkaśāstram /  atha prathamaṃ prakaraṇam /	T32n1633_001:0028c24_0	1 無道理難品反質難品中無道理難品第一
T11bsa069_u:10	 yadi svato 'nyāyyaṃ tadetadanyāyyamasaccaiva,  tasmādahamanyāyya[vādī] iti cedbhavatocyate tadayuktam /	T32n1633_001:0029a01_16	若自體中無道理者，無道理亦應無，是故汝說我無道理，是義不然。
T11bsa069_u:1002	 śabda ākāśasādharmyannitya iti cettato yadi vaidharmyaṃ syāt,  tadānityaḥ /  vaidharmyañca śabdasya sahetukatvamākāśasya tvahetukatvamiti /  śabda aindriyaka ākāśastvanaindriyakaḥ /  tasmācchabdo 'nitya iti pratyavasthita idamāha /	T32n1633_001:0034c08_7	若聲與空同相故是常者，若不同相則應無常。 不同相者，聲有因、空無因，聲根所執、空非根所執，是故聲無常。 外曰：
T11bsa069_u:1007	 sādharmyaṃ vaidharmyaṃ vā na mayā samālocyate /	T32n1633_001:0034c10_12	若同相、若不同相，我悉不撿。
T11bsa069_u:1008	 nityasādharmyaṃ tu mayoktam /  yadi nityasadharmā tadā nitya iti /	T32n1633_001:0034c11_6	我說常同相，若有常同相則是常。
T11bsa069_u:1010	 (Tś 34)	T32n1633_001:0034c11_9	論曰：
T11bsa069_u:1011	 atrāparaḥ / nityasādharmyamanaikāntikam /  amūrtānyanityānyapi bastūni vidyante /  yathā sukhaduḥkhādīni /  tasmādasiddho hetuḥ /	T32n1633_001:0034c12_19	常同相者不定，無身物亦有無常，如苦樂心等，是故汝因不成就。
T11bsa069_u:1015	 vaidharmyaṃ tu sarvamanityaṃ nityavyatiriktamiti niścitaṃ vyanakti /  tasmādanityatāsādhane samarthamityukte brūyāt /	T32n1633_001:0034c14_3	不同相者，定顯一切無常與常相離，是故能立無常。 外曰：
T11bsa069_u:1017	 anityaṃ sahetukam /  nityaṃ tvahetukamiti mayāpi pratipāditam /	T32n1633_001:0034c14_18	我亦信無常有因、常無因。
T11bsa069_u:1019	 iti pratijñāhāninigrahasthānāpattiḥ /	T32n1633_001:0034c15_7	是名壞自立義墮負處。
T11bsa069_u:1020	 2. pratijñāntaram /  pratijñātārthapratiṣedhe pareṇa kṛte dharmāntaravikalpādarthanirdeśaḥ pratijñāntaramucyate /	T32n1633_001:0034c17_2	二、取異自立義者，自義已為他所破，更思惟立異法為義，是名取異自立義。 外曰：
T11bsa069_u:1022	 nityaḥ śabdaḥ /	T32n1633_001:0034c17_8	聲常。
T11bsa069_u:1023	 kasmāt /	T32n1633_001:0034c17_12	何以故？
T11bsa069_u:1024	 asparśatvāt /	T32n1633_001:0034c18_4	無觸故，譬如虛空，是義已立。
T11bsa069_u:1026	 asparśatvahetunā nityaḥ śabda iti bhavatā sthāpitam /	T32n1633_001:0034c18_18	若汝立聲常，依無觸因。
T11bsa069_u:1027	 asparśatvahetuścānaikāntikaḥ /  cittecchakrodhādyasparśamapyanityam /  śabdo 'pyasparśastasmādanaikāntikatā /  ākāśādivannityaścittādivadanityo vetyasparśatvamanaikāntikameva /  tasmādbhavaddheturasiddhaḥ /	T32n1633_001:0034c21_14	無觸因者不定，心欲瞋等並無觸而是無常，聲亦無觸，是故不可定，如虛空等常、不如心等無常，無觸既不定，汝因則不成就。
T11bsa069_u:103	 yadi bhavadartho 'smaduktādanyastadānyatvadoṣo bhavata eva na tu mama /	T32n1633_001:0029b17_16	若汝義異我自說，則異過失在汝，不關於我。
T11bsa069_u:1032	 yadi heturasiddhastadā pratijñāpyasiddheti prasiddhamiti pratyavasthita idamāha /	T32n1633_001:0034c22_11	因若不成就，立義亦不成就，是義已破。
T11bsa069_u:1037	 yā ca mayā nirdiṣṭā nityatā,  sā nityatāniṣedhārthā /  nityatā śabdānna vyatiricyate rūpādibhyastu vyatiricyate /  śabdo nityatāyā na vyatiricyate śrotragrāhyādikāttu vyatiricyate /  yadyasmānna vyatiricyate,  tattena sambaddham,	T32n1633_001:0034c26_4	聲及常並非我義，我所立義常與聲相攝、聲與常相攝，我所說聲為除色等，我所說常為除無常等，常不離聲離色等、聲不離常離耳所執等，不相離名相攝。
T11bsa069_u:104	 yadi nānyat,  tarhi matpakṣatulyameva,  tena nāstyanyatvam /  athocyate mamānyaditi tanmithyā /	T32n1633_001:0029b18_19	若不異，汝則同我，則無有異，汝說我異，此是邪語。
T11bsa069_u:1043	 eṣāsmatpratijñā /  mayā na śabdo na ca nityatā sthāpyate /  bhavān punaḥ śabdañca nityatāñca khaṇḍayati (Tś 35)  na tu mama pratijñāṃ khaṇḍayati /	T32n1633_001:0034c27_9	是我立義不立聲亦不立常，汝難聲難常並不難我義。
T11bsa069_u:1047	 iyamucyate pratijñāntarānagrahasthānāpattiḥ /  3. pratijñāvirodhaḥ /	T32n1633_001:0034c28_2	是名取異自立義墮負處。
T11bsa069_u:1049	 hetupratijñayorvirodhaḥ pratijñāvirodha ityucyate /	T32n1633_001:0034c29_10	三、因與立義相違者，因與立義不得同，是名因與立義相違。
T11bsa069_u:1050	 prativādī prāha /	T32n1633_001:0034c29_13	外曰：
T11bsa069_u:1051	 nityaḥ śabdaḥ /	T32n1633_001:0034c29_17	聲常住。
T11bsa069_u:1052	 kasmāt /	T32n1633_001:0035a01_1	何以故？
T11bsa069_u:1053	 sarvasyānityatvāt /  ākāśavat /	T32n1633_001:0035a01_17	一切無常故，譬如虛空，是義已立。
T11bsa069_u:1055	 iti sthāpite 'paraḥ prāha bhavatoktaṃ sarvamanityaṃ tasmānnityaḥ śabda iti /  atha śabdaḥ sarvasminnantarbhavati na vā /	T32n1633_001:0035a01_20	論曰： 汝說一切無常是故聲常者，聲為是一切所攝、為非一切所攝？
T11bsa069_u:1057	 sarvasminnantarbhavati cet /  sarvasyānityatvācchabdo 'pyanityaḥ /  sarvasminnāntarbhavati cettadā sarvamityasiddham /	T32n1633_001:0035a04_6	若是一切所攝，一切無常，聲應無常。 若非一切所攝，一切則不成就。
T11bsa069_u:1060	 kuta iti cet /	T32n1633_001:0035a05_3	何以故？
T11bsa069_u:1061	 śabdasyāsaṅgrahāt /	T32n1633_001:0035a05_8	不攝聲故。
T11bsa069_u:1062	 hetuvacane pratijñāhāniḥ /  pratijñāvacane ca hetuhāniḥ /  tasmādbhavato 'rtho 'siddhaḥ /	T32n1633_001:0035a05_18	若汝說因，立義則壞； 若說立義，因則壞，是故汝義不成就。
T11bsa069_u:1065	 iyaṃ pratijñāvirodhanigrahasthānāpattirucyate /	T32n1633_001:0035a07_7	是名因與立義相違墮負處。
T11bsa069_u:1066	 4. pratijñāsaṃnyāsaḥ /  pareṇa svapratijñāpratiṣedhe kṛte saṃnyāso 'samarthaneti pratijñāsaṃnyāsaḥ /	T32n1633_001:0035a08_15	四、捨自立義者，他已破自所立義，捨而不救，是名捨自立義。 外曰：
T11bsa069_u:1068	 nityaḥ śabdaḥ /	T32n1633_001:0035a09_2	聲常住。
T11bsa069_u:1069	 kutaḥ /	T32n1633_001:0035a09_6	何以故？
T11bsa069_u:1070	 aindriyakatvāt /  yathā sāmānyamaindriyakaṃ nityañca /  śabdo 'pyaindriyakatvānnityaḥ /  iti sthāpite 'paraḥ prāha nityaḥ śabda aindriyakatvāditi bhavatoktam /	T32n1633_001:0035a11_1	根所執故，譬如同異性者根所執故常，聲亦根所執是故常住，是義已立。 論曰：
T11bsa069_u:1074	 atha yadaindriyakaṃ tadanityalakṣaṇākrāntaṃ ghaṭādivat /  ghaṭo hyaindriyakatvādanityaḥ /  tasmācchabdopyanitya iti /	T32n1633_001:0035a12_10	汝說聲根所執故常住，根所執者與無常相攝，譬如瓦器等。 瓦器等根所執故無常，聲應無常。
T11bsa069_u:1077	 yadbhavatoktaṃ sāmānyavannityamiti tadayuktam /	T32n1633_001:0035a13_19	汝說如同異性常，是義不然。
T11bsa069_u:1078	 tathā hi gavādisāmānyaṃ gavāderabhinnaṃ bhinnaṃ vā /	T32n1633_001:0035a14_3	何以故？ 牛等同異性，為與牛一、為與牛異？
T11bsa069_u:1079	 abhinnañced,  gaureva san sāmānyaṃ tvasat /	T32n1633_001:0035a15_10	若一牛是實，同異性不實。
T11bsa069_u:108	 anyaccānyasmānnānyadityananyatvam /  (Tś 6) yadyanyadanyasmādanyat,  tato 'nyanna bhavet /	T32n1633_001:0029b19_11	復次異與異無異，是故無異。 若異與異異，則不是異。
T11bsa069_u:1081	 bhinnañced,	T32n1633_001:0035a16_4	若異離牛，同異性自體應可顯。
T11bsa069_u:1082	 gorvyatiriktaṃ sāmānyaṃ prakāśeta na tu gorvyatiriktaṃ sāmānyaṃ prakāśate tasmāddṛṣṭānto na nityatāsādhakaḥ /  pratijñā cāsiddhā /	T32n1633_001:0035a17_12	離牛既不見同異性，不成常住譬，汝立義不得成就，是義已破。
T11bsa069_u:1084	 (Tś 36) iti dūṣaṇe kṛte prativādī prāha kenaitatsthāpitam /	T32n1633_001:0035a17_15	外曰： 誰立此義？
T11bsa069_u:1085	 iyaṃ pratijñāsannyāsanigrahasthānāpattirityucyate /  5. hetvantaram /  aviśeṣahetau sthāpite paścāddhetvantaroktiriti hetvantaram /	T32n1633_001:0035a18_9	是名捨自立義墮負處。 五、立異因義者，已立同相因義，後時說異因，是名立異因義。 外曰：
T11bsa069_u:1088	 nityaḥ śabdaḥ /  kasmāt /	T32n1633_001:0035a20_3	聲常住。
T11bsa069_u:1090	 dviranabhivyaktatvāt /  yannityaṃ tatsarvaṃ sakṛdabhivyaktamākāśavat /  śabdasyāpi tathātvam /	T32n1633_001:0035a21_18	不兩時顯故，一切常住皆一時顯，譬如虛空等，聲亦如是，是義已立。
T11bsa069_u:1094	 nityaḥ śabdo dviranabhivyaktatvāt /	T32n1633_001:0035a22_18	汝說聲常住，不兩時顯，譬如虛空等。
T11bsa069_u:1095	 ākāśavaditi na tveṣa heturyuktaḥ /	T32n1633_001:0035a23_2	是因不然。
T11bsa069_u:1096	 kuta iti ceddviranabhivyaktasya nityatānaikāntikatvāt /  yathā vāyoḥ sparśasya ca sakṛdevābhivaktavāpi vāyuranityaḥ /	T32n1633_001:0035a23_6	何以故？ 不兩時顯者不定常住，譬如風與觸一時顯而風無常，聲亦如是。
T11bsa069_u:1098	 śabdo 'pi tatheti pratyavasthita idamāha /	T32n1633_001:0035a24_17	外曰：
T11bsa069_u:1099	 śabdo vāyuvilakṣaṇaḥ /  vāyurhi tvagindriyagrāhyaḥ /  śabdastu śravaṇagrāhyaḥ /  tasmācchabdo vāyuvilakṣaṇa iti /	T32n1633_001:0035a26_5	聲與風不同相，風身根所執、聲耳根所執，是故聲與風不同相。
T11bsa069_u:1104	 pūrvamuktaṃ bhavatā śabdo nityo dviranabhivyaktatvādityadhunā tūcyate śabdo vāyuvilakṣaṇaḥ pṛthagindriyagrāhyatvāditi prathamahetutyāgena bhavata hetvantaraṃ pratiṣṭhāpitam /	T32n1633_001:0035a27_17	汝前說不兩時顯故聲常住，汝今說聲與風不同相，別根所執故。
T11bsa069_u:1105	 tasmādbhavato heturasiddhaḥ /	T32n1633_001:0035a28_14	汝捨前因立異因，是故汝因不得成就。
T11bsa069_u:1106	 iyaṃ hetvantaranigrahasthānāpattirucyate /  6. arthāntaram /	T32n1633_001:0035a29_5	是名立異因義墮負處。
T11bsa069_u:111	 yathā manuṣyo goranyo na gaurbhavati,	T32n1633_001:0029b20_14	譬如人與牛異，人不是牛。
T11bsa069_u:112	 yadyanyadanyasmādanyat,  tadā tadekaṃ bhavet /  yadyekaṃ tato nānyat,  tatkimucyate mamānyaditi /	T32n1633_001:0029b21_19	若異與異無異則是一，若一則無有異，汝何故說我為異？
T11bsa069_u:1120	 aṇuramūrtaḥ sukhotpādakaḥ duḥkhotpādako 'prāpto sāpakarṣotkarṣaḥ samito 'sannyāso na vināśaḥ /	T32n1633_001:0035b07_7	譬如有人說塵無身，生歡喜、生憂惱，不至而有損益，捨彌多、不捨則滅。
T11bsa069_u:1121	 śabdo nityaḥ kasmāt /	T32n1633_001:0035b07_11	聲常住。 何以故？
T11bsa069_u:1122	 anityasya nityatvāt /	T32n1633_001:0035b07_20	無常常故。
T11bsa069_u:1123	 iyamavijñātārthanigrahasthānāpattirucyate /  9. apārthakam /	T32n1633_001:0035b08_10	是名有義不可解墮負處。
T11bsa069_u:1125	 paurvāparyyāsambandho 'pārthakam /	T32n1633_001:0035b09_12	九、無道理義者，有義前後不攝，是名無道理義。
T11bsa069_u:1126	 yathā kaścidvadet /  daśavidhaṃ phalaṃ trividhaḥ kaṃbala ekavidhaṃ pānabhojanametadapārthakamucyate /	T32n1633_001:0035b10_19	譬如有人說言食十種果、三種氈、一種飲食，是名無道理。
T11bsa069_u:1128	 10. aprāptakālam /  pratijñāyāṃ duṣṭāyāṃ paścāddhetusthāpanamaprāptakālam /	T32n1633_001:0035b12_1	十、不至時者，立義已被破，後時立因，是名不至時。 外曰：
T11bsa069_u:1130	 nityaḥ śabdaḥ /	T32n1633_001:0035b12_8	聲常住。
T11bsa069_u:1131	 yathā pārimāṇḍalyāśrayasya paramāṇornityatvātpārimāṇḍalyaṃ nityaṃ śabdasyāpi tathātvasambhava iti kṛte 'paraḥ prāha /	T32n1633_001:0035b12_12	何以故？ 譬如隣虛圓依常住故，圓常住，聲亦如是。 論曰：
T11bsa069_u:1132	 bhavatā nityatāsthāpane heturnoktaḥ,  pañcāvayavanyūnavacanasthāpanādbhavadartho 'siddha iti dūṣita idaṃ prāha /	T32n1633_001:0035b14_19	汝立常義不說因，立五分言不具足，汝義則不成就，此義已破。 外曰：
T11bsa069_u:1134	 asti me heturnāmnā tu noktaḥ /	T32n1633_001:0035b15_11	我有因，但不說名。
T11bsa069_u:1135	 ko 'yaṃ heturiti cet /	T32n1633_001:0035b15_16	何者為因？
T11bsa069_u:1136	 nityākāśāśrayatvamiti /	T32n1633_001:0035b16_1	依常住空故。
T11bsa069_u:1137	 atrāparaḥ / yathā gṛhe dagdhe tatparitrāṇāyodakānveṣaṇaṃ tathānavasare 'rtharakṣaṇāya hetusthāpanam /	T32n1633_001:0035b16_4	論曰： 譬如屋被燒竟，更求水救之，非時立因救義亦如是。
T11bsa069_u:1138	 etadaprāptakālamucyate /	T32n1633_001:0035b17_12	是名不至時。
T11bsa069_u:1139	 11. nyūnam / pañcāvayavā anyatamena hīnā iti nyūnam /	T32n1633_001:0035b18_17	十一、不具足分者，五分義中一分不具，是名不具足分。
T11bsa069_u:1140	 pratijñā heturudāharaṇamupanayanaṃ nigamanamiti pañcāvayavāḥ /	T32n1633_001:0035b20_4	五分者，一立義言、二因言、三譬如言、四合譬言、五決定言。
T11bsa069_u:1142	 yathā (kaścidvadatya)  nityaḥ śabda ityayaṃ prathamo 'vayavaḥ /	T32n1633_001:0035b20_13	譬如有人言聲無常。 是第一分。
T11bsa069_u:1144	 kṛtakatvāditi dvitīyo 'vayavaḥ /	T32n1633_001:0035b21_2	何以故？ 依因生故。 是第二分。
T11bsa069_u:1145	 yadvastu kṛtakaṃ tadanityaṃ yathā ghaṭaḥ kṛtako 'nityaśceti tṛtīyo 'vayavaḥ /	T32n1633_001:0035b22_15	若有物依因生，是物無常，譬如瓦器，依因生故無常。 是第三分。
T11bsa069_u:1146	 śabdo 'pi tatheti caturtho 'vayavaḥ /	T32n1633_001:0035b23_9	聲亦如是，是第四分。
T11bsa069_u:1147	 tasmācchabdo 'nitya iti pañcamo 'vayavaḥ /  pañcāvayavānāmanyatamena nyūnatā nyūnanigrahasthānāpattirityucyate /	T32n1633_001:0035b23_20	是故聲無常，是第五分。 是五分若不具一分，是名不具足墮負處。
T11bsa069_u:1149	 12. adhikam / bahuhetūdāharaṇoktiradhikam /	T32n1633_001:0035b25_18	十二、長分者，說因多、說譬多，是名長分。
T11bsa069_u:1150	 yathā (kaścidvade)  cchabdo 'nityaḥ /	T32n1633_001:0035b26_5	譬如有人說聲無常。
T11bsa069_u:1152	 kasmāt? /	T32n1633_001:0035b26_9	何以故？
T11bsa069_u:1153	 prayatnānantarīyakatvādamūrtatvādaindriyakatvādutpādavināśābhyāṃ vācyatvāccaitaddhetubāhulyamityucyate /	T32n1633_001:0035b27_13	依功力生，無中間生故、根所執故、生滅故、作言語故。 是名長因。
T11bsa069_u:1154	 api ca śabdo 'nityaḥ kṛtakatvād ghaṭavatpaṭavatgṛhavatkarmmavat /	T32n1633_001:0035b29_6	復次聲無常，依因生故，譬如瓦器、譬如衣服、譬如屋舍、譬如業。
T11bsa069_u:1155	 etaddṛṣṭāntabāhulyamityucyate /	T32n1633_001:0035b29_11	是名長譬。
T11bsa069_u:1156	 vādī prāha / bhavatā hetūdāharaṇabahulyamuktam /  yadyeko hetuḥ sādhanāsamarthastadā kathamekahetuprayogaḥ /  atha sādhanasamarthastadā kiṃ hetubāhulyena udāharaṇabahulye 'pi tathātvasambhavaḥ /	T32n1633_001:0035b29_14	論曰： 汝說多因多譬，若一因不能證義，何用說？ 一因若能證義，何用說多因？ 多譬亦如是，多說則無用。
T11bsa069_u:1159	 tadbāhulyokteraprayojanatvāt /  13. punaruktam /  punaruktaṃ trividhaṃ,	T32n1633_001:0035c03_2	是名長分。 十三、重說者，有三種重說：
T11bsa069_u:116	 ataścaitanyāyyamiti /  ahaṃ nyāyamavalambya bhavatā vivade /  tasmādanyathāhaṃ vadāmi /	T32n1633_001:0029b23_2	復次是道理者，我於汝道理中共諍故，我說有異。
T11bsa069_u:1162	 śabdapunaruktaṃ,  artha punaruktaṃ,  arthāpattipunaruktañca /	T32n1633_001:0035c04_6	一重聲、二重義、三重義至。
T11bsa069_u:1165	 śabdapunaruktaṃ yathā (kaścidvade)  cchakraḥ śakraḥ /	T32n1633_001:0035c04_18	重聲者，如說帝釋，帝釋。
T11bsa069_u:1167	 arthapunaruktaṃ yathā (kaścidvadet)  cakṣurakṣi /	T32n1633_001:0035c05_7	重義者，如說眼、目。
T11bsa069_u:1169	 arthāpattipunaruktaṃ yathā (kaścidvadet)  satyaṃ saṃsāro duḥkhaṃ satyaṃ nirvāṇaṃ sukham /	T32n1633_001:0035c06_2	重義至者，如說生死實苦、涅槃實樂。
T11bsa069_u:1171	 prathamameva vacanaṃ vaktavyaṃ dvitīyaṃ tvaprayojanam /	T32n1633_001:0035c06_14	初語應說，第二語不須說。
T11bsa069_u:1172	 kasmāt /	T32n1633_001:0035c06_18	何以故？
T11bsa069_u:1173	 pūrvavacanasya spaṣṭārthatvāt /	T32n1633_001:0035c07_4	前語已顯義故。
T11bsa069_u:1174	 pūrvavacanasyārtha spaṣṭaśced,  dvitīyavacanena kiṃ spaṣṭaṃ bhavet /	T32n1633_001:0035c07_17	若前語已顯義，後語何所顯？
T11bsa069_u:1176	 yadi na kiñcit prakaṭayitavyaṃ tadā tadaprayojanam /	T32n1633_001:0035c08_8	若無所顯，後語則無用。
T11bsa069_u:1177	 etatpunaruktamityucyate /	T32n1633_001:0035c08_13	是名重說。
T11bsa069_u:1178	 14. ananubhāṣaṇam /  pariṣadā vijñātāyāḥ pratijñāyāstrirabhihitāyā (Tś 39)  api yadi kaścitpratyuccāraṇāsamarthastadānanubhāṣaṇam /  15. ajñānam / pariṣadā vijñātāyā api pratijñāyāḥ kenacidavijñānamajñānamucyate /	T32n1633_001:0035c10_5	十四、不能誦者，若說立義，大眾已領解，三說有人不能誦持，是名不能誦。 十五、不解義者，若說立義，大眾已領解，三說有人不解義，是名不解義。
T11bsa069_u:1182	 16. apratibhā / yadi parasya pratijñāṃ nyāyavadīkṣate dūṣaṇe cāsamarthastadāpratibhā /	T32n1633_001:0035c13_1	十六、不能難者，見他如理立義不能破，是名不能難。
T11bsa069_u:1184	 ajñāne 'pratibhāyāñcobhayatrānigrahasthānāpattiḥ /	T32n1633_001:0035c13_20	不解義、不能難，是二種非墮負處。
T11bsa069_u:1185	 kasmāt? /	T32n1633_001:0035c14_3	何以故？
T11bsa069_u:1186	 yadi kaścidarthaṃ na vijānāti dūṣaṇe cāsamarthastena saha vādo na kartavya iti /	T32n1633_001:0035c14_20	若人不解義、不能難，不應與其論義。 論曰：
T11bsa069_u:1187	 ete tvatimande nigrahasthāne /	T32n1633_001:0035c15_11	是二種極惡墮負處。
T11bsa069_u:1188	 anyeṣu nigrahasthāneṣu,  sadoṣasya vacanasya vividhenopāyenoddharaṇaṃ śakyam /	T32n1633_001:0035c16_17	於餘墮負處，若言說有過失，可以別方便救之。
T11bsa069_u:119	 yadyāvayorbheda eva na syānna tadā bhavatā vivādo 'haṃ tu bhavadarthameva vadāmi /	T32n1633_001:0029b24_4	若汝與我不異者，則不與汝共諍，我說汝義故。
T11bsa069_u:1190	 atra tūbhayatra na kaścidupāya uddharaṇasamarthaḥ /  eṣa manuṣyaḥ pūrvaṃ pāṇḍityagauravaṃ sthāpayati,  paścāttu pāṇḍityaṃ prakaṭayitumaśaktaḥ /	T32n1633_001:0035c18_11	此二種非方便能救，是人前時起聰明慢，後時不能顯聰明相，是愚夫可恥。 是名不能難。
T11bsa069_u:1193	 17. vikṣepaḥ / svapratijñāyā doṣaṃ jñātvā vyājaiḥ parihāraḥ kāryāntarakathanam /  yathāhaṃ svayaṃ rogī,  ahaṃ paraṃ roginaṃ draṣṭumicchāmi /  tadā tu yadi nāpakrāmati paradūṣaṇanirākaraṇaṃ na kalpayati /	T32n1633_001:0035c21_13	十七、立方便避難者，知自立義有過失，方便隱避說餘事相，或言我自有疾、或言欲看他疾、此時不去事則不辦，遮他立難。
T11bsa069_u:1197	 kasmāt /	T32n1633_001:0035c21_17	何以故？
T11bsa069_u:1198	 bandhusnehāpagamabhayāt /	T32n1633_001:0035c22_5	畏失親善愛念故。
T11bsa069_u:1199	 iti vikṣepanigrahasthānāpattirucyate /	T32n1633_001:0035c22_16	是名立方便避難墮負處。
T11bsa069_u:12	 anyacca / mama vacanamanyāyyamiti cedbhavatocyate,  tato bhavānajña iti spaṣṭam /	T32n1633_001:0029a02_13	又若汝稱我言說無道理，自顯汝無智。
T11bsa069_u:120	 sarvamuktamanyaditi ced,  bhavatāpi kiñciduktamiti bhavānapyanyadvadatīti doṣo bhavata eva /	T32n1633_001:0029b25_9	若一切所說異者，汝亦有所說，是故汝說異，過失在汝。
T11bsa069_u:1200	 18. matānujñā / paradūṣaṇe svapakṣadoṣābhyupagama iti matānujñā /	T32n1633_001:0035c24_5	十八信許他難者，於他立難中信許自義過失，是名信許他難。
T11bsa069_u:1201	 yadi kaścit pareṇa dūṣaṇe kṛte,  svapakṣadoṣamanujānāti,  yathā mama doṣa evaṃ bhavato 'pītyabhyupagacchan /	T32n1633_001:0035c25_14	若有人已信許自義過失，信許他難，如我過失，汝過失亦如是。
T11bsa069_u:1204	 iyaṃ matānujñocyate /	T32n1633_001:0035c26_1	是名信許他難。
T11bsa069_u:1205	 19. paryanuyojyopekṣaṇam /  yadi kaścinnigrahasthānaṃ prāpnuyāt,  tasya nigrahāpattyanudbhāvanaṃ taddūṣaṇecchayā tu (Tś 40)	T32n1633_001:0035c27_16	十九、於墮負處不顯墮負者，若有人已墮負處，而不顯其墮負，更立難欲難之。
T11bsa069_u:1208	 dūṣaṇasthāpanam /  tadarthe ca hīne kiṃ prayojanaṃ dūṣaṇena /	T32n1633_001:0035c28_6	彼義已壞，何用難為？
T11bsa069_u:1210	 asiddhametaddūṣaṇam /	T32n1633_001:0035c28_12	此難不成就。
T11bsa069_u:1211	 etaducyate paryanuyojyopekṣaṇam /	T32n1633_001:0035c29_3	是名於墮負處不顯墮負。
T11bsa069_u:1212	 20. niranuyojyānuyogaḥ /  kasyacidanigrāhyatve 'pi nigrahasthānābhiyogo niranuyojyānuyogaḥ /	T32n1633_001:0036a01_11	二十、非處說墮負者，他不墮負處說言墮負，是名非處說墮負。
T11bsa069_u:1214	 anyacca /  prativādini svapratijñāhānyāpanne svapakṣabhinnārthopādānenāsthāne paranigrahasthānadyotanam /  ayamapi niranuyojyānuyogaḥ /	T32n1633_001:0036a03_7	復次他墮壞自立義處，若取自立異義顯他墮負而非其處，是名非處說墮負處。
T11bsa069_u:1217	 21. apasiddhāntaḥ /  pūrvaṃ caturvidhe siddhānte svayamaṅgīkṛte 'pi paścāccedyathāsiddhāntaṃ na brūyādayamapasiddhāntaḥ /	T32n1633_001:0036a05_11	二十一、為悉檀多所違者，先已共攝持四種悉檀多，後不如悉檀多理而說，是名為悉檀多所違。
T11bsa069_u:122	 yadi bhavato vākyaṃ nānyat,  tarhi mamāpi vacanaṃ nānyaditi yad bhavatoktamahamanyadvadāmīti tadayuktam /  atha bhavadvacanaṃ mithyaiva /	T32n1633_001:0029b26_4	若汝說不說異者，我亦說不說異。 汝言我說異，是義不然，汝是邪語。
T11bsa069_u:1220	 yathā pūrvamuktāstrividhāḥ /	T32n1633_001:0036a08_3	二十二、似因者，如前說有三種：
T11bsa069_u:1221	 asiddho 'neikāntiko viruddhaśceti hetvābhāsāḥ /	T32n1633_001:0036a09_1	一不成就、二不定、三相違，是名似因。
T11bsa069_u:1222	 asiddhaḥ / yathā kaścit sthāpayedaśva āgacchati /	T32n1633_001:0036a09_16	一、不成就者，譬如有人立馬來。
T11bsa069_u:1223	 kasmāt /	T32n1633_001:0036a09_20	何以故？
T11bsa069_u:1224	 śṛṅgadarśanāt /	T32n1633_001:0036a10_3	見有角故。
T11bsa069_u:1225	 aśvo 'śṛṅga iti śṛṅgaheturasiddho 'śvāgamanasthāpanāsamarthaḥ /	T32n1633_001:0036a10_20	馬無角，角為因不成就，不能立馬來。
T11bsa069_u:1226	 anaikāntikaḥ /  yathā kaścit sthāpayetgaurāgacchati /	T32n1633_001:0036a11_14	二、不定者，譬如有人立秦牛來。
T11bsa069_u:1228	 kasmāt /	T32n1633_001:0036a11_18	何以故？
T11bsa069_u:1229	 śṛṅgadarśanāt /	T32n1633_001:0036a12_3	見有角故。
T11bsa069_u:1230	 yaḥ saśṛṅga sa gaurityanaikāntikaḥ chāgarurvādīnāṃ saśṛṅgatvāt /  śṛṅgaheturanaikāntikaḥ /  tasmādgavāgamanasthāpanāsamarthaḥ /	T32n1633_001:0036a13_9	有角不定牛，羊鹿等亦有角，角為因不定，不能立秦牛來。
T11bsa069_u:1233	 viruddhaḥ / yathā kaścit sthāpayetprabhāte rātriḥ /	T32n1633_001:0036a14_5	三、相違者，譬如有人立晝時是夜。
T11bsa069_u:1234	 kasmāt /	T32n1633_001:0036a14_9	何以故？
T11bsa069_u:1235	 aruṇodayāt /  aruṇodayo rātryā viruddhaḥ /  aruṇodayahetū rātristhāpanāsamarthaḥ /	T32n1633_001:0036a14_14	日新出故。 日新出與夜相違，日出為因不能立夜。
T11bsa069_u:1238	 yadi kenacideṣa hetuḥ prayujyate tadā hetvābhāsanigrahasthānāpattiḥ /	T32n1633_001:0036a16_9	若人立此三種為因，是名似因墮負處。
T11bsa069_u:125	 śeṣaṃ pūrvavat /	T32n1633_001:0029b27_5	餘義如前說。
T11bsa069_u:126	 yad (bhavato)  vicārya nirdhāryate /  yadi vacanamasiddhaṃ,	T32n1633_001:0029b28_4	汝稱我說義不成就，我今共汝辯決是處。
T11bsa069_u:130	 tadā tadeva vacanamasiddham /  yadi vacanasyāsiddhatvaṃ,  tadā vacanameva na prāptam /	T32n1633_001:0029b28_18	若說不成就者，是說不成就說。 若所說不成就，則不得說。
T11bsa069_u:133	 atha vacanaṃ na prāptaṃ,  kathaṃ bhavatocyate mayā yaduktaṃ tadasiddhamiti /	T32n1633_001:0029c01_8	若不得說者，汝云何說我所說不成就。
T11bsa069_u:135	 atha vacanaṃ prāptaṃ tatsidvameva syāt /	T32n1633_001:0029c02_1	若得說，所說則應成就。
T11bsa069_u:136	 yadi maduktamasiddhamiti bhavatocyate tadayuktam /	T32n1633_001:0029c02_12	汝說不成就，是義不然。
