src_segmentnr	src_original	tgt_segmentnr	tgt_original
T15bsa060_u:84	 sa śobhate puṣpitapuṣpavacca sumaṇḍitaṃ yasya mukhaṃ suvarṇaiḥ /	T15D4332:123b-27	དེ་ནི་ཡིད་འོང་པདམ་རབ་གསར་རྒྱས་པ་ལྟ་བུར་མཛེས་༎
T15bsa060_u:85	 anakṣaraṃ yasya mukhaṃ bhavecvet tannetravaktre bhubi chidravacca // 42 //	T15D4332:123b-28	ཡི་གེ་མེད་པར་གྱུར་བའི་ཁ་ནི་གང་ཡིན་པ་༎ དེ་ནི་ཁ་མིན་ས་ཡི་བུ་ག་དག་དང་མཚུངས་༎
T15bsa060_u:86	 muktāmaṇibhyāṃ ca hi gardabhasya kiṃ śūkarasya priyabhojanena /	T15D4332:123b-30	བོང་དུ་ཕྱུགས་ལ་ནོར་བུ་མུ་ཏིག་ཅི་༎ དུད་འགྲོ་ཕག་ལ་ཁ་ཟས་ཞིམ་པོ་ཅི་༎
T15bsa060_u:87	 andhasyadīptyā badhirasya gītaimūrkhasya dharmeṇa kimasti kṛtyam // 43 //	T15D4332:123b-32	ལོང་ལ་སྣང་དང་འོན་པ་དག་ལ་གླུ་༎ གླེན་པ་དག་ལ་ཆོས་ཀྱིས་ཅི་ཞིག་བྱ་༎
T15bsa060_u:88	 kātantraśābdavettā hi vaidyaśca siddhasāravit /  kāṣṭhakhaṅgadharaścopahāsaṃ yānti trayo 'pi te // 44 //	T15D4332:123b-34	ཀ་ཏན་ཏྲ་ཞེས་སྒྲ་མཁན་དང་༎ གཅེས་སྒྲུབ་ཤེས་པའི་སྨན་པ་དང་༎ དབྱིག་པ་ཐོག་པའི་རལ་ཀ་བས་༎ དེ་གསུམ་འཇིག་རྟེན་བཞད་གད་སའོ་༎
T15bsa060_u:9	 guṇiṣu durlabhā āḍhayā āḍhayeṣu guṇinastathā // 5 //	T15D4332:122a-20	སྦལ་བ་ལྷན་ཅིག་གནས་ཀྱང་དེ་ལྟ་མིན་༎ ཡོན་ཏན་ལྡན་ལ་ཕྱུག་པོ་དཀོན་༎ ཕྱུག་པོ་ལ་ཡང་ཡོན་ཏན་དཀོན་༎
T15bsa060_u:90	 dehīdaṃ vacanaṃ nimnaṃ na dāsyāmyatinimnakam /	T15D4332:123b-36	བདག་ལ་བྱིན་ཟེར་དམན་པའི་ཚིག་། མི་སྦྱིན་ཟེར་བ་དམན་པས་དམན་༎ འདི་ཁྱེར་ཟེར་བ་མཆོག་གི་ཚིག་། མི་ཁྱེར་ཟེར་བ་དེ་བས་མཆོག་། གནོད་སྤངས་ཕན་པ་བསྟེན་པ་ཡི་༎
T15bsa060_u:92	 kṣatiṃ bihāya yenāpi prayogeṇa hitasya kim /  svakāyarakṣaṇenāpi kiñcaiva dhanatṛṣṇayā // 46 //	T15D4332:123b-38	སྦྱོར་བ་གང་ཡང་རུང་བ་ཡིས་༎ ལུས་ནི་ཤིན་ཏུ་བསྲུང་བྱ་ཡི་༎ ནོར་ལ་སྲེད་པས་ཅི་༄༡༢༤ཨ་༌་༎
T15bsa060_u:94	 kiṃśukasya phalaprāptiryathā vyartha bubhukṣave /  dhaninaśca tathādāturjīvanaṃ niṣprayojanam // 47 //	T15D4332:124a-2	ཉེ་བར་འཚོ་བས་ཅི་ཞིག་བྱ་༎ ཀིམ་ཤུ་ཀ་ཡི་འབྲས་བུ་ནི་༎ ཆགས་ཀྱང་ཁ་བས་ཅི་བྱར་ཡོད་༎
T15bsa060_u:96	 kāmāturāṇāṃ na bhayaṃ na lajjā kṣudhāturāṇāṃ na balaṃ na tejaḥ /	T15D4332:124a-5	འདོད་པས་གདུངས་ལ་ཁྲེལ་མེད་ངོ་ཚ་མེད་༎ བཀྲེས་པས་གདུངས་ན་སྟོབས་མེད་མདངས་ཀྱང་མེད་༎
T15bsa060_u:97	 rogāturāṇāṃ na sukhaṃ na nidrā mārgāturāṇāṃ na bhayaṃ na vīryam // 48 //	T15D4332:124a-7	ནད་ཀྱིས་གདུངས་ན་གཉིད་མེད་བདེ་བ་མེད་༎ ལམ་གྱིས་དུབ་ན་འཇིགས་དང་བརྩོན་པ་མེད་༎
T15bsa060_u:98	 dhanalipsuḥ suhrit tyājyā bhāryā ca vyabhicāriṇī /  adharmī ca nṛpaḥ krūro mantrī piśuna eva ca // 49 //  kupradeśo hi durvyavasāyo duṣṭo 'tha vai suhṛt /	T15D4332:124a-9	གྲོགས་པོ་ནོར་ལ་བརྐམ་པ་སྤང་༎ ཆུང་མ་ལོག་ག-ཡེམ་ཆེ་བ་སྤང་༎ རྒྱལ་པོ་ཆོས་མིན་སྤྱོད་པ་སྤང་༎ བློན་པོ་རབ་གཏུམ་དབྱེན་སྨྲ་སྤང་༎
