src_segmentnr	src_original	tgt_segmentnr	tgt_original
T17O2MS163914CZ189477:575	rigs kyi bu phyir na/_sa dang po rab tu dga' ba zhes bya zhe na/_de ni thog mar 'jig rten las 'das pa'i sems sngon ma mthong ba de mngon du gyur te/ don chen po'i bsams pa phun sum tshhogs pa thob pa'i phyir/_sa dang po rab tu dga' ba zhes bya'o/_/	T16D4347:139a-11	ས་དང་པོ་པྲ་མུ་དི་ཏ་ཅེས་བྱ་བ་ནི་དོན་ཆེན་པོ་སྔོན་འདྲིས་པ་མ་ཡིན་པའི་འཇིག་རྟེན་ལས་འདས་པའི་སེམས་ཐོབ་པ་དང་། བྱང་ཆུབ་དང་ཉེ་ཞིང་སེམས་ཅན་མང་པོའི་དོན་སྒྲུབ་བ་གཟིགས་ནས་དགའ་བ་རླབས་པོ་ཆེ་སྐྱེ་བས་རབ་ཏུ་དགའ་བ་ཞེས་བྱ་།
T17O2MS163914CZ189477:579	ltung ba phra mo'i dri ma dang /_tshhul khrims kyi nyes skyon thams cad dag pa'i phyir/_sa gnyis pa dri ma med pa zhes bya'o/_/	T16D4347:139a-12	ས་གཉིས་པ་ནི་བི་མ་ལ་ཞེས་བྱ་བ་ནི་། ཚུལ་ཁྲིམས་འཆལ་པའི་ལྟུང་བ་ཕྲ་མོ་ཡན་ཆད་ཀྱང་བྱང་བས་ན་དྲི་མ་མེད་པ་ཞེས་བྱ་།
T17O2MS163914CZ189477:581	mtshhan ma med pa yid la byed pa med pa'i tshhad med pa'i ye shes dang / ting nge 'dzin gyi ye shes kyi 'od snang ba de bskyod par mi nus shing gang gis kyang zil gyis mi non pa dang /_thos pa 'dzin pa'i gzungs la gnas pa'i phyir sa gsum pa 'od byed pa zhes bya'o/_/	T16D4347:139a-14	ས་གསུམ་པ་པྲ་བཏའ་ཀ་རི་ཞེས་བྱ་བ་ནི་ཉན་ཐོས་དང་རང་སངས་རྒྱས་ཀྱིས་ལས་འདས་པའི་ཏིང་ངེ་འཛིན་གྱི་ཕུང་པོ་ཡོངས་སུ་དག་པ་ཡེ་ཤེས་ཀྱི་སྣང་བ་ཆེན་པོའི་གནས་སུ་གྱུར་པ་ཐོབ་བས་ན་འོད་བྱེད་པ་ཞེས་བྱ་།
T17O2MS163914CZ189477:584	ye shes kyi me des nyon mongs pa thams cad bsreg cing /_byang chub kyi 'phro ba zhes bya'o/_/	T16D4347:139a-15	ས་བཞི་པ་ཨཨརྩི་ཤམ་ཏི་ཞེས་བྱ་བ་ནི་། ཉོན་མོངས་པ་སྲེག་པ་བྱང་ཆུབ་ཀྱི་ཕྱོགས་ཀྱི་མེའི་འོད་འཕྲོ་བ་ཅན་ཞེས་བྱ་།
T17O2MS163914CZ189477:587	de bsgoms pa'i thabs dang /_mchog gi ye shes la dbang bsgyur dka' ba dang /_mthong spang dang /_bsgom spang gi nyon mongs pa thul bar dka' ba thul ba'i phyir sa lnga pa sbyangs dka' ba zhes bya'o/_/ ma med pa yid la byed pa thams cad mngon du byed pas/_sa drug pa mngon du	T16D4347:139a-17	ས་ལྔ་པ་སུ་དུ་རྫ་ཡ་ཞེས་བྱ་བ་ནི་ཉན་ཐོས་དང་རང་སངས་རྒྱས་ལས་འདས་པའི་འཕགས་པའི་བདེན་པ་བཞི་ལ་སྒོམ་ཞིང་འཁོར་བ་དང་མྱ་ངན་ལས་འདས་པ་གཉིས་ཀ་ལ་མི་གནས་པའི་ཤེས་རབ་ཡོངས་སུ་དག་པར་སྦྱང་ཞིང་སྒོམ་པ་ཤིན་ཏུ་དཀའ་བས་ན་ས་དེ་ནོན་པར་དཀའ་བ་འམ་བསྒྲུབ་པར་དཀའ་བ་ལ་བྱ་སྟེ་། ཤིན་ཏུ་སྦྱང་དཀའ་བ་ཞེས་བྱ་།
T17O2MS163914CZ189477:592	gyur pa zhes bya'o/_/ zag pa med pa'i chos la bar chad med cing mtshhan ma med pa yid la byed	T16D4347:139a-20	ས་དྲུག་པ་ཨཨ་བྷི་མུ་ཁི་ཞེས་བྱ་བ་ནི་ཤེས་རབ་ཀྱི་ཕ་རོལ་ཏུ་ཕྱིན་པ་ལ་བརྟེན་ནས་འཁོར་བ་དང་མྱ་ངན་ལས་འདས་པ་གཉིས་ཀ་ལ་མི་གནས་ཤིང་མཚན་མ་མེད་པ་ལ་གནས་ཤིང་མཚན་མ་མེད་པ་ལ་རང་གི་ངང
T17O2MS163914CZ189477:594	pas rnam par grol ba'i ting nge 'dzin yun ring du bsgoms pa de rnams dag cing thogs pa med pa dang /_nyan thos dang rang rgyal las ring du song ba'i	T16D4347:139b-0	གིས་༄༡༣༩བ་འཇུག་པའི་ཡེ་ཤེས་ལ་མང་དུ་གནས་ཤིང་མངོན་དུ་གཟིགས་པས་ན་མངོན་དུ་གྱུར་པ་ཞེས་བྱ་། ས་བདུན་པ་དའུ་རམ་ག་མ་ཞེས་བྱ་བ་མཚན་མ་མེད་པ་ལ་བགྲོད་པ་གཅིག་ཏུ་གྱུར་པའི་ལམ་དང་ཉེ་ཞིང་རིང་དུ་ཕྱིན་པས་ན་རིང་དུ་སོང་བ་ཞེས་བྱ་།
T17O2MS163914CZ189477:596	phyir/_sa bdun pa ring du song ba zhes bya'o/_/ mtshhan ma med pa yid la byed pa bsgom pa la dbang thob ste/_nyon mongs pa rnams kyis g.yo bar mi nus pas na sa brgyad pa mi g.yo ba zhes bya'o/_/	T16D4347:139b-2	ས་བརྒྱད་པ་ཨཨ་ཙལ་ཞེས་བྱ་བ་ནི་མཆན་མའི་འདུ་ཤེས་དང་མཚན་མ་མེད་པར་རྩོལ་བའི་འདུ་ཤེས་གཉི་གས་བསྐྱོད་པར་མི་ནུས་པས་མི་ག-ཡོ་བ་ཞེས་བྱ་།
