src_segmentnr	src_original	tgt_segmentnr	tgt_original
T17O2MS163914CZ189842:26	'tshhams med 'gyur ba med/_/nad kyis nyen pa'i dgra bcom pa/_/mthong nas rang gi 'grin pa la/_/nad g.yog pa'i dge slong gis/_/btshir bas shi	T04D3903:103a-29	དེ་ནི་ཤི་ན་ག-ཡོག་བྱེད་པའི་༎ དགེ་སློང་དེ་ནི་སྐྱོན་བརྟེན་མིན་༎
T17O2MS163914CZ189842:28	der nyes pa med/_/gzhan du 'du shes pas gzhan du/_/shi bar gyur kyang	T04D3903:103a-31	གཞན་ལ་གཞན་གྱི་འདུ་ཤེས་ཀྱིས་༎ བསད་པར་གྱུར་ཀྱང་སྐྱོན་ཡོད་མིན་༎
T17O2MS163914CZ189842:29	nyes pa med/_/ngan sems med na skyon med de/_/'dul ba las ni gsal	T04D3903:103a-33	ཞེས་པ་འདུལ་བར་གསལ་བར་གསུངས་སོ་༎ གདུག་སེམས་མེད་ལ་སྐྱོན་མ་ཡིན་༎
T17O2MS163914CZ189842:30	bar gsungs/_/gang phyir bcos pa'i bsam pa yis/_/mchod rten bshig	T04D3903:103a-35	གང་ཕྱིར་གསོ་བའི་བློ་ཡིས་ནི་༎ མཚམས་མེད་པ་ལ་ཉེ་བྱེད་པ་༎
T17O2MS163914CZ189842:31	de'i nyes pa med/_/mtshhams med pa dang nyes byas pa/_/bsod nams phung po	T04D3903:103a-37	མཆོད་རྟེན་རྐོ་བ་སྐྱོན་མ་ཡིན་༎ ༄༡༠༣བ་བསོད་ནམས་ཕུང་པོ་འབའ་ཞིག་འགྱུར་༎
T17O2MS163914CZ189842:32	'ba' zhig yin/_/bsam pa bzang pos thub pa'i dbur/_/gang gis lham gnyis bzhag pa dang /_/gzhan gyis de bzhin bsal ba la/_/gnyi gas rgyal	T04D3903:103b-1	དགེ་བའི་བསམ་པས་ཐུབ་དབུ་ལ་༎
